{
  "caseNumber": 8,
  "timestamp": "2025-08-17T13:28:28.109Z",
  "detailedResult": {
    "caseNumber": 8,
    "hasReportFile": true,
    "processingTime": 59,
    "success": true,
    "validation": {
      "hasPatientInfo": true,
      "hasValidName": true,
      "hasMedicalRecords": true,
      "hasInsuranceInfo": true,
      "noNaNValues": false,
      "processingSuccess": true,
      "overallScore": 0.8333333333333334
    },
    "patientInfo": {
      "patientName": "실명번호",
      "birthDate": "yyyy-mm-dd",
      "registrationNumber": "550112-1"
    },
    "medicalRecordsCount": 262,
    "insuranceInfoCount": 34,
    "hospitalizationCount": 25,
    "testResultsCount": 0,
    "nanIssues": {
      "hasNaN": true,
      "locations": [
        ".progressReport"
      ]
    },
    "memoryUsage": {
      "rss": 56225792,
      "heapTotal": 18821120,
      "heapUsed": 10677792,
      "external": 1815551,
      "arrayBuffers": 10515
    }
  },
  "fullResult": {
    "success": true,
    "normalizedReport": {
      "header": {
        "patientName": "실명번호",
        "birthDate": "yyyy-mm-dd",
        "registrationNumber": "550112-1"
      },
      "insuranceConditions": [
        {
          "conditionNumber": 1,
          "productName": "(무) 간편"
        },
        {
          "conditionNumber": 2,
          "coverage": "]"
        },
        {
          "conditionNumber": 3,
          "coverage": "명 납입유형 피"
        },
        {
          "conditionNumber": 4,
          "coverage": "상태 (기본계약)갱신형 실손상해입원의료비(간편"
        },
        {
          "conditionNumber": 5,
          "coverage": "보장기간 추가납입형 1년"
        },
        {
          "conditionNumber": 6,
          "coverage": "이광욱 (기본계약)갱신형 실손질병입원의료비(간편"
        },
        {
          "conditionNumber": 7,
          "coverage": "추가납입형 1년 추가납입형 1년 2024-10-08 200,000원 450원 2025-10-08 2024-10-08 50,000,000원 39,368 (기본계약)갱신형 실손질병통원의료비(간편"
        },
        {
          "conditionNumber": 8,
          "coverage": "추가납입형 1년 2025-10-08 2024-10-08 200,000원 11,568원 2025-10-08 [기타특약 담보]"
        },
        {
          "conditionNumber": 9,
          "coverage": "명 구분 1 구분 담보상태"
        },
        {
          "conditionNumber": 10,
          "coverage": "100세 2054-10-08 제도성 자동갱신적용대상 선택담보 해당없음 2024-10-08 0원 0원 100세 2054-10-08 002 / 002 (무) 간편"
        },
        {
          "conditionNumber": 11,
          "coverage": "및 기타사항】"
        },
        {
          "conditionNumber": 12,
          "coverage": "및 기타사항 증권번호 319-1472-7663-13"
        },
        {
          "conditionNumber": 13,
          "coverage": "별 상세내용은"
        },
        {
          "conditionNumber": 14,
          "coverage": "별 만기가 기본계약의 만기 이전에 종료될 수 있으므로 반드시 특약별 만기를 확인하시기 바랍니다. ※ 담보종목별 자세한 보상내용은 약관을 참조하시기 바랍니다. ※ 청약서 주요내용 작성시 사실 그대로를 알리지 않았거나, 자필서명을 본인이 직접서명(날인)하지 않은경우는 보상되지 않을 수 있습니다. ※ 상해담보"
        },
        {
          "conditionNumber": 15,
          "coverage": "갱신에 관한 사항] ※ 갱신시점의"
        },
        {
          "conditionNumber": 16,
          "coverage": "은 기본계약의 납입기간과 관계없이"
        },
        {
          "conditionNumber": 17,
          "coverage": "의"
        },
        {
          "conditionNumber": 18,
          "coverage": "은 해지된 것으로 봅니다. ※ [갱신형 담보 자동갱신에 관한 사항] ※자동갱신 적용대상 계약이"
        },
        {
          "conditionNumber": 19,
          "coverage": "의"
        },
        {
          "conditionNumber": 20,
          "coverage": "보장기간으로 합니다. 다만, 갱신시점의 피"
        },
        {
          "conditionNumber": 21,
          "coverage": "보장기간 미만일 경우에는 그 잔여기간을"
        },
        {
          "conditionNumber": 22,
          "coverage": ""
        },
        {
          "conditionNumber": 23,
          "coverage": "| 소재지계약목록 No 1 기사고(피"
        },
        {
          "conditionNumber": 24,
          "productName": "계약자명 319-1472-7663-13 0 (무) 간편"
        },
        {
          "conditionNumber": 25,
          "coverage": "목록 □ 계약담보조회 No 증권번호 소재지 손해목적 서열 통화 피해서열 계약목적물명"
        },
        {
          "conditionNumber": 26,
          "coverage": "담보명 제외 보상담보명 계약목적물일련번호 이표번호 특약담보코드 위험코드 1 319-1472-7663-13 0 인 1 KRW 1 이광욱 200,000(기본계약) 2 ? 319-1472-7663-13 0 인 1 KRW 1 이광욱 간편"
        },
        {
          "conditionNumber": 27,
          "coverage": "계약변경 부활유무 휴면미지급 유의계약자→녹취→ 건별 SMS발송 타사간사 분리사고접수 4세대실손할증비급여 삭제 저장 NH농협손해"
        },
        {
          "conditionNumber": 28,
          "company": "기(고의사고 허위사고, 허위입원. 진단. 장해, 사고 후"
        },
        {
          "conditionNumber": 29,
          "coverage": "및 기타사항"
        },
        {
          "conditionNumber": 30,
          "coverage": "및 기타사항 ⓒ 상기 보장사항의 세부적인 내용은 약관 및 관계 법령을 따릅니다. 불완전판매율 구분 김선형 모집자 업권 평균 손보 생보 0.00 % - % 0.02 % 0.06 % 모집점 모집자 금촌농협 김선형 연락처 (201203841 C:04) 031-941-366: 설계번호 24-0081-063096 설계일자 2024-10-08 발행일시 2024-10-08 16:20:03 5/7 NH농협손해"
        },
        {
          "conditionNumber": 31,
          "coverage": "은 계약 체결시에"
        },
        {
          "conditionNumber": 32,
          "coverage": "하는 다수의"
        },
        {
          "conditionNumber": 33,
          "productName": ""
        },
        {
          "conditionNumber": 34,
          "company": "제출 123 매 의무기록 사본 증명서 이 사본은 의무기록 원본과 틀림이 없음을 증명합니다. 이 사본은 위의 용도 외에는 사용할 수 없습니다. 의무기록 사본 증명서 2025년 04월 11일 담당자: 김경미 (인) 담당자의 날인이 없는 것은 무효임 여래대학교 연세대학교 의과대학 학과대학 세브란스병원 병원 세브란스병원 SEVERANCE HOSPITAL 등록번호: 8633158 주민등록번호: 550112-125**** 남/63세 환자명: 이광욱 외래재진기록 2019-01-02 진료과 심장내과 주치의 안철민 BP(S) 181 mmHg BP(D) 95 mmHg HR 90/min Subjective Objective CT angio Assessment Good/No interval change Multifocal stenosis with calcifications in both SFA and both ATA. Diffuse atherosclerosis with calcification, infrarenal aorta. Varicose vein, left calf. No evidence of DVT. Otherwise unremarkable. CAD(2vd+ LM) s/pCAG(2018.04, 일산백) s/p 2018-04-09 4OPCAB(LIMA to dLAD, to OM(seq) to DG with RIMA composite Y, Aorta to rPL with RA) DM s/p carotid stenting Plan PTA 고려 SFA os, Rt contralateral approach 2월 10일입원, 11일 시술 기록자명 안철민 전자서명자: 안철민 세브란스병원 SEVERANCE HOSPITAL 1/1 출력일: 2025-04-11 출력자: 김경미 원본대조필 등록번호: 8633158 주민등록번호: 550112-125**** 남/64세 환자명: 이광욱 입원정보 입원일자 2019-01-27 입원과 심장내과 입원주치의 안철민 퇴원정보 퇴원일자 2019-01-29 퇴원과 심장내과 퇴원주치의 안철민 최종진단명(*) 순서 한국질병 구분 확진 진단명 분류번호 1 주진단 확진 Peripheral arterial occlusive disease (lower extremities) 170.29 2 기타진단 확진 Unstable angina 120.0 3 기타진단 확진 Coronary artery disease (left main) 125.1 4 기타진단 확진 Coronary artery disease (2 vessel disease) 125.1 5 기타진단 확진 S/P Coronary artery bypass graft Z95.1 과거진단명 과거진단코드 주호소 (*) Diabetes mellitus other, without complication; Diabetes mellitus type 2, without complication; Diabetic polyneuropathy; Internal carotid artery stenosis;Internal carotid artery stenosis, right;Type 2 diabetes mellitus, coronary artery disease; E11.58;E11.9;E13.9;E14.41;165.2; For PTA 과거력 및 현재병력 상기 64세 남환 DM, CAOD (2vd, s/p CAG), PAOD 진단 받은 분으로 PTA 시행 위해 금일 입원함. V/S 120/70 78 20 Current Sx: none 이상 진찰 소견 (★) n-s 재원중 투약내역 (*) n-s 투여된 약물 중 잔류효과로 퇴원 후 주의가 필요한 약물 (*) 없음 있음 Aspirin protect->출혈의 위험성이 증가되므로 상처나 멍이 생기지 않도록 주의하십시오.; Platless-> 출혈의 위험성이 증가되므로 상처나 멍이 생기지 않도록 주의하십시오.; 전자서명자: 안철민 세브란스병원 SEVERANCE HOSPITAL 퇴원요약 2019-01-29 1/3 출력일: 2025-04-11 출력자: 김경미 원본대조필 등록번호: 8633158 주민등록번호: 550112-125****남/64세 환자명: 이광욱 검사소견 (*) 치료 및 효과 (*) @PTA(19.1.28) Access site Lt CFA Approach method contralateral antegrade Peripheral angiography with JR 5F catheter revealed total occlusion of Rt. SFA OS (TIMI 1) with diffuse irregular up to 70% LN of p-mSFA total occlusion of Rt. ATA (TIMI O) Taget lesion: Rt. SFA 7F Balkin sheath c 018 command wire The guiding wire was passed through the lesion. Balloon angioplasty was done with 6x60 mm Mustang PTA balloon at Rt. SFA OS~MSFA F/U angio revealed 60% residual stenosis without dissection Two DCB with 6x150 mm Inpact Admiral were inflated at Rt. SFA OS~MSFA F/U angio revealed 10 % residual stenosis without dissection or flow limitation conclusion>> Successful PTA C DCB at Rt. SFA @Successful PTA c DCB at Rt. SFA(19.1.28) 시행 후 acute complication 없이 퇴원함. @PTA(19.1.28) 주시술명 주시술코드 3950 기타시술명 기타시술코드 Implantable Medical Device 사용 여부 No Yes 치료결과 (*) 완쾌 경쾌 호전안됨 진단뿐 가망없는 퇴원 48시간이내 사망 선행사인 48시간이후 사망 선행사인 선행사인 분류코드 활력증상 혈압 120/75 mmHg 맥박수 70 퇴원형태 (★) 퇴원지시후 타병원전원 회/분 체온 36.8 자의퇴원 ㅇ 탈원 호흡수 20 회/분 향후 치료계획 외래 추후관리 재입원 없음 기타 퇴원요약 2019-01-29 전자서명자: 안철민 2/3 출력일: 2025-04-11 세브란스병원 SEVERANCE HOSPITAL 출력자: 김경미 원본대조필 등록번호: 8633158 주민등록번호: 550112-125**** 남/64세 환자명: 이광욱 퇴원약 약품명 (Name) 용량(Dose) 일수(Days) 용법(Direction) 처방 분류 (Type) 효능 아스피린프로텍트 1 14 정100mg 아침 식후 30분 복용하십시오 퇴원약 헤르벤정 30mg 1 14 아침,저녁 식후 30 퇴원약 분 복용하십시오 리피토정 80mg 1 14 아침 식후 30분 퇴원약 복용하십시오 플래리스정 1 14 아침 식후 30분 복용하십시오 퇴원약 라비에트정10mg 1 14 아침 식전 30분 복 퇴원약 용하십시오 중외시그마트정 1 5mg 14 아침, 저녁 식후 30 퇴원약 분 복용하십시오 코자정100mg 1 14 아침 식후 30분 복용하십시오 퇴원약 아스피린프로텍트 1 19 정100mg 아침 식후 30분 복용하십시오 퇴원약 헤르벤정 30mg 1 19 아침,저녁 식후 30 퇴원약 분 복용하십시오 리피토정 80mg 1 19 아침 식후 30분 퇴원약 복용하십시오 플래리스정 1 19 아침 식후 30분 퇴원약 복용하십시오 라비에트정10mg 1 19 아침 식전 30분 복 퇴원약 용하십시오 중외시그마트정 1 5mg 19 아침,저녁 식후 30 퇴원약 분 복용하십시오 코자정100mg 1 19 아침 식후 30분 복용하십시오 퇴원약 담당 전공의사명 권혜란 기록자명 권혜란 주치의사명 안철민 <약어 설명> CAOD coronary artery obstructive disease RFCA radio-frequency catheter ablation NSTEMI non-ST elevation myocardial infarction C-angio : coronary angiogram A.fib: atrial fibrillation EPS electrophysiologic studies DCMP: dilated cardiomyopathy HCMP hypertrophic cardiomyopathy PAF paroxysmal atrial fibrillation RHD rheumatic heart disease NSVT non-sustained ventricular tachycardia A-flutter : atrial flutter 퇴원요약 2019-01-29 전자서명자: 안철민 3/3 출력일: 2025-04-11 출력자: 김경미 세브란스병원 SEVERANCE HOSPITAL 원본대조필 등록번호: 8633158 주민등록번호: 550112-125****남/64세 환자명: 이광욱 입원일자 2019-01-27 입원과 심장내과 입원주치의 안철민 입원결정의사 안철민 주호소 또는 입원사유 For PTA 현재질병상태 상기 64세 남환 DM, CAOD (2vd, s/p CAG), PAOD 진단 받은 분으로 PTA 시행 위해 금일 입원함. V/S 120/70 78 20 Current Sx none 과거력 Hypertension No Yes Pul. Tbc No Yes DM No Yes Hepatitis No Yes Smoking No Yes 금연교육 여부 시행 미시행 |해당없음 Alcohol No Yes Drug Allergy No Yes Penicillin Sulfonamide ? Cephalosporin Other 알레르기 No Yes Hypercholesterolemia No Yes Cardiac disease No Yes Old CVA No Yes 말초동맥 및 경동맥 질환 No Yes Coronary artery bypass graft No Yes Others 가족력 계통문진 Generalized Weakness No Easy Fatigue No Fever No Chill No Headache No 00000 Yes Yes Yes Yes Yes Dizziness No Yes Insomnia No Yes 전자서명자: 안철민 세브란스병원 SEVERANCE HOSPITAL 입원기록 2019-01-27 1/5 출력일: 2025-04-11 출력자: 김경미 원본대조필 등록번호: 8633158 주민등록번호: 550112-125**** 남/64세 환자명: 이광욱 입원기록 2019-01-27 Cough Sputum Dyspnea DOE z z zz z z z z z z z No No Yes Yes Yes No Yes No No No Yes Yes Yes No Yes No Yes No Yes 0000000000 Chest pain Palpitation Hemoptysis Hematemesis Anorexia Nausea No Vomiting No Yes Constipation No Yes Diarrhea No Yes Abdominal pain No Yes Abdominal discomfort No Hematochezia No Melena No 000 Yes Yes Yes Dysuria No Yes Oliguria No Yes Hematuria No Yes Poor oral intake No Yes Weight Loss No Yes Weight Gain No Yes Others 신체조사 General Appearance Appearance Not so ill-looking appearance Mental Status Alert Drowsy Stupor Semicoma Coma Nutritional and Developement status Good Moderate Poor Skin 피부 Abnormal skin rash Warm ? Cold Wet Dry No Yes Skin tugor Good HEENT Normocephaly without deformity Yes No Sclera not icteric not injected Throat 전자서명자: 안철민 세브란스병원 SEVERANCE HOSPITAL Conjunctiva not pale Lips & tongues not dried 2/5 출력일: 2025-04-11 출력자: 김경미 원본대조필 등록번호: 8633158 주민등록번호: 550112-125**** 남/64세 환자명: 이광욱 Neck Stiffness supple Cervical LNs not palpable Neck veins not engorged Chest/lung Symmetric expansion Yes No Retraction No Yes ( Both Rt Lt) Breath sounds clear increased decreased character High-pitched sound Continuous sound Wheezing Discontinuous sound Fine crackle Low-pitched sound Location Stridor ? Velcro rale Right upper lung field Rhonchi ? Coarse crackle Right middle lung field Left upper lung field ? Left middle lung field Right lower lung field ? Left lower lung field Heart PMI (5th ICS LMCL) 이상 RHB without murmur with murmur Thrill No Yes Heaving No Yes Abdomen Palpation ? soft ? rigid flat distended Bowel sound normoative Tenderness No Yes Palpation of organ No liver kidney spleen Shifting dullness No Yes Fluid wave No Yes Back and Extremity LOM No Yes CVA tenderness No Rt. Lt. Both Pitting edema No Yes Paresthesia No Yes 전자서명자: 안철민 세브란스병원 SEVERANCE HOSPITAL 입원기록 2019-01-27 3/5 출력일: 2025-04-11 출력자: 김경미 원본대조필 등록번호: 8633158 주민등록번호: 550112-125**** 남/64세 환자명: 이광욱 입원기록 2019-01-27 others (Physical Exam) 감염성질환 초기평가 1. 증상 및 기간 발열 기간 일전 호흡기증상 기간 일전 소화기증상 기간 일전 해당없음 (미상환자 포함) 2. 최근 1달 이내 방문한나라 해당없음 없음 있음 3. 최근 1달 이내 입원했던 병원 (감염주의 병원) 없음 있음 4. 밀접 접촉자 해당없음 아니오 예 5. 신종 감염병 의심환자 아니오 예 통증평가 통증여부 No Yes 추정진단 PAOD 계획 PTA 고려 퇴원계획 퇴원 후 치료식이 여부 ? N ? Y 추후 관리 계획 |가정간호사업소 호스피스 타 병원 전원 외래 사회 복지서비스 연계 필요성 ? N ? Y 기타 퇴원시 요구사항 치료계획 + Problem Goal 목표일 수정목표일 계획일 부 PAOD PTA 2019-01-28 2019-01-27 기록자명 하장우 <약어 설명> BMI : body mass index BP(D): Blood Pressure(Diastolic) BP(S) : Blood Pressure(Systolic) BT body temperature 전자서명자: 안철민 세브란스병원 SEVERANCE HOSPITAL ICS: impulse conducting system(of the heart) LMCL left midclavicular line LNs lymph nodes LOM limitation of motion 4/5 출력일: 2025-04-11 출력자: 김경미 원본대조필 등록번호: 8633158 주민등록번호: 550112-125****남/68세 환자명: 이광욱 검사결과 1. ABI (Ankle / Brachial Index) - Rt: 0.90 /Lt: 0.84 1-1. TBI (Toe / Brachial Index)- Rt: 0.39/Lt: 0.36 Impression Name Image 1 전자서명자: 모혜인 세브란스병원 SEVERANCE HOSPITAL 기능검사결과(I/F형) 2023-03-22 1/2 출력일: 2025-04-11 출력자: 김경미 원본대조필 등록번호: 8633158 주민등록번호: 550112-125**** 남/68세 환자명: 이광욱 Name: LEE K.W. ID #: 8633158 Exam Date: 03/22/2023 11:08 AM Operator: M 기능검사결과(I/F형) SEVERANCE HOSPITAL Sex: M MultiLab Series !! SEGMENTAL PRESSURE AND PVR STUDY Brachial RIGHT LEFT 108 109 RIGHT LEFT 0.85 93 PT 92 0.84 0.90 98 DP 91 0.83 ми PVR 64mmHg 187cc LEFT Ankle ABI: 0.84 Gain: 2 Spd:25 Amp:16 TBI: 0.36 0.39 43 39 0.36 PVR 65mmHg 175cc RIGHT Ankle Gain: 2 Spd:25 Amp:19 ABI: 0.90 TBI: 0.39 PPG RIGHT Great Toe Gain:.50 Speed: 25 Amp:01 판독의(1차) 박한진 판독의(2차) 안철민 ABI INDEX 0.97- 1.25 NORMAL 0.75 0.96 MILD 0.50 0.74 MODERATE <0.50 SEVEREE TBI(FBI) INDEX >0.80 NORMAL 0.20 0.54 CLAUDICATION <0.20 REST PAIN PPG LEFT Great Toe Gain:.50 Speed: 25 Amp:01 2023-03-22 전자서명자: 모혜인 2/2 출력일: 2025-04-11 출력자: 김경미 세브란스병원 SEVERANCE HOSPITAL 원본대조필 등록번호: 8633158 주민등록번호: 550112-125**** 남/67세 환자명 : 이광욱 진료과 내분비내과 주치의 강은석 BP(S) 150mmHg BP(D) 58 mmHg HR 89/min 경과 및 Plan 진단명 구분 확진 CAD(2vd+ LM) s/p CAG (2018.04, 일산백) s/p 4OPCAB(LIMA to dLAD, to OM(seq) to DG with RIMA composite Y, Aorta to rPL with RA) (2018-04-09) Rt. ICA stenosis s/p stent insertion (2018.10.02) PAD s/p PTA c DCB at Rt. SFA (2019.01.28) DM(11yrs) Ex-smoker (30yr, 2년전 중단) Aorta to rPL with RA) Glucose 140 Glycoalbumin 20.6 Glucose (연속) - 식후 2시간 195 HbA1c 7.3 Cholesterol 121 Triglyceride 77 HDL-Cholesterol 56 LDL-Cholesterol (Friedewald) 49.6 BUN 24.4 Creatinine 1.22 Urine Albumin-to-Creatinine Ratio 78.07 >> 생활습관 개선 필요함 repeat med 6mo f/u 주진단 확진 Diabetes mellitus type 2 with dyslipidemia 기타진단 확진 Thyroid nodule 기타진단 확진 Internal carotid artery stenosis 기록자명 강은석 진단명 외래재진기록 2022-07-19 전자서명자: 강은석 1/1 출력일: 2025-04-11 출력자: 김경미 세브란스병원 SEVERANCE HOSPITAL 원본대조필 등록번호: 8633158 주민등록번호: 550112-125****남/67세 환자명: 이광욱 외래재진기록 2022-09-21 진료과 심장내과 주치의 일반 BP(S) mmHg HR /min Subjective Objective Assessment Plan 진단명 구분 확진 주진단 기타진단 기타진단 확진 확진 확진 BP(D) mmHg chest pain / discomfort (-/-) dyspnea / DOE (-/-) palpitation (-) functional capacity >4METS 잘지냈다. 증상없음 PAD, S/P PTA 2019.1.28 - IVUS-DCB - s/p PTA DCB at Rt. SFA[2019-01-28] ABI 1.04/1.09 <== 0.69/0.99 CAD(2vd+ LM) s/pCAG(2018.04, 일산백) s/p 2018-04-09 4OPCAB(LIMA to dLAD, to OM(seq) to DG with RIMA composite Y, Aorta to rPL with RA) DM herben 일년 정도 사용 - 유경종 교수님 - radial graft HTN_Q Repeat med Unstable angina Coronary artery disease (left main) Coronary artery disease (2 vessel disease) 기록자명 최기정 <약어 설명> BP(D) : Blood Pressure(Diastolic) 진단명 HR : Heart Rate BP(S) : Blood Pressure (Systolic) med Medication 전자서명자: 최기정 세브란스병원 1/1 출력일: 2025-04-11 출력자: 김경미 원본대조필 SEVERANCE HOSPITAL 등록번호: 8633158 주민등록번호: 550112-125****남/67세 환자명: 이광욱 진료과 신경과 주치의 홍순호 SBP 129 mmHg DBP 60mmHg 맥박 81회/분 경과 Rt. pICA severe stenosis s/p stent insertion (2018) --4 vessel 2019.09.05 Occlusion of Lt VA. No residual stenosis or in-stent thrombosis in Rt pICA. --brain MRIA 2022.09.14 Small old infarction in left side medulla. Microbleed in right parietal lobe. Stenosis in right carotid bulb and right distal VA. Steno-occlusion in left VA. Stenosis in left proximal ICA, left cavernous ICA. -->interval change 없어보임. 별일 없으셨다 2024 brain MRIA 외래재진기록 2022-09-21 전자서명자: 홍순호 1/2 출력일: 2025-04-11 출력자: 김경미 세브란스병원 SEVERANCE HOSPITAL 원본대조필 등록번호: 8633158 주민등록번호: 550112-125**** 남/67세 환자명: 이광욱 진단명 구분 확진 주진단 확진 |기타진단 확진 |기타진단 확진 Internal carotid artery stenosis Unstable angina Coronary artery disease (2 vessel disease) 진단명 기록자명 홍순호 외래재진기록 2022-09-21 전자서명자: 홍순호 2/2 출력일: 2025-04-11 출력자: 김경미 세브란스병원 SEVERANCE HOSPITAL 원본대조필 등록번호: 8633158 주민등록번호: 550112-125**** 남/69세 환자명: 이광욱 영상검사 CT& MR 영상검사 CT& MR 검사명 MRI Brain & Angio 3D(Neck포함) (contrast) 검사방법 검사일자 판독일자 2024.09.12 10:33 2024.10.22 15:34 촬영실 MRI 74호(본관 4층) Description 판독의/전문의 Clinical information: Internal carotid artery stenosis Imaging technique: sagittal T1Wl, axial T1WI, T2WI, T2 FLAIR. T2*WI, contrast enhanced 3D T1Wl with axial/coronal/sagittal reconstruction, intracranial TOF MRA, contrast enhanced intracranial and neck MRA. Contrast media: Used Small old infarction in left side medulla. Microbleed in right parietal lobe. Stenosis in right carotid bulb and right distal VA. Steno-occlusion in left VA. Stenosis in left proximal ICA, left cavernous ICA. IMP: No interval change ④조영제 Dotarem inj[20ml/Syringe] [Meglumine gadoterate 376.9mg/ml] [20ml/Syringe]:1 안성수/안성수/안성수 전자서명자: 안성수 1/1 출력일: 2025-04-11 출력자: 김경미 세브란스병원 SEVERANCE HOSPITAL 원본대조필 등록번호: 8633158 주민등록번호: 550112-125**** 남/68세 환자명: 이광욱 진료과 내분비내과 주치의 강은석 BP(S) 163mmHg BP(D) 70mmHg HR 91/min 경과 및 Plan CAD(2vd+ LM) s/p CAG (2018.04, 일산백) s/p 4OPCAB(LIMA to dLAD, to OM(seq) to DG with RIMA composite Y, Aorta to rPL with RA) (2018-04-09) Rt. ICA stenosis s/p stent insertion (2018.10.02) PAD s/p PTA c DCB at Rt. SFA (2019.01.28) DM(11yrs) Ex-smoker (30yr, 2년전 중단) Aorta to rPL with RA) Glucose 124 Glycoalbumin 20.9 Glucose (연속) - 식후 2시간 226 HbA1c 7.2 Cholesterol 116 Triglyceride 76 HDL-Cholesterol 50 LDL-Cholesterol (Friedewald) 50.8 Urine Albumin-to-Creatinine Ratio 69.81 >> 운동 및 생활습관 개선 필요함 repeat med 6mof/u 진단명 구분 확진 주진단 확진 기타진단 확진 기타진단 확진 Diabetes mellitus type 2 with dyslipidemia Thyroid nodule Internal carotid artery stenosis 기록자명 강은석 진단명 외래재진기록 2023-01-17 전자서명자: 강은석 1/1 출력일: 2025-04-11 출력자: 김경미 세브란스병원 SEVERANCE HOSPITAL 원본대조필 등록번호: 8633158 주민등록번호: 550112-125**** 남/68세 환자명: 이광욱 외래재진기록 2023-03-22 진료과 심장내과 주치의 안철민 BP(S) 122 mmHg BP(D) 52mmHg HR 88/min Subjective Objective Assessment Plan Good/No interval change Non-HDL Cholesterol 53 LDL-Cholesterol (Friedewald) 39.4 Glucose 134 BUN 19.8 Creatinine 1.06 TMT 10.1 METs, equivocal ABI (Ankle / Brachial Index) 0.84/Lt: 0.82 PAD, s/p PTA 2019.1.28 - IVUS-DCB - - Rt: 0.90 /Lt: 0.84 <==Rt: 0.96/Lt: 0.88 <== Rt: s/p PTA DCB at Rt. SFA[2019-01-28] ABI 1.04/1.09 <== 0.69/0.99 CAD(2vd+ LM) s/p CAG(2018.04, 일산백) s/p 2018-04-09 4OPCAB(LIMA to dLAD, to OM(seq) to DG with RIMA composite Y, Aorta to rPL with RA) DM herben 일년 정도 사용 - 유경종 교수님 - radial graft HTN Repeat med 3개월 후 local refer 2yr EKG/CXR/LAB/full(비급여 설명드림) 진단명 구분 확진 주진단 확진 Unstable angina |기타진단 확진 Coronary artery disease (left main) |기타진단 확진 Coronary artery disease (2 vessel disease) 기록자명 안철민 전자서명자: 안철민 세브란스병원 SEVERANCE HOSPITAL 진단명 1/1 출력일: 2025-04-11 출력자: 김경미 원본대조필 등록번호: 8633158 주민등록번호: 550112-125****남/70세 환자명: 이광욱 검사결과 1. ABI (Ankle/ Brachial Index) - Rt: 0.80 /Lt: 0.72 1-1. TBI (Toe Brachial Index) - Rt: 0.51/Lt: 0.33 Impression Name Image 1 0.5- 0- Patient name: 012 Patient ID: 8633158 Gender: R Thigh PVR E 0.5- 0- 0.98 124] 127 1.00 -0.5- 기능검사결과(I/F형) 2025-03-19 Exam Date/Time: 19-03-2025 10:27 Examiner: Ref Physician: L Thigh -3.5- 45 P=59 HR-73 Amp-1.060 RT-232 Sc=x4 G=6 R BI Knee PVR 0.99 126 131 1.03 0.5- 0.5- 0.90 114 113 89 0- 0- -05- 4s R P=56 HR=72 Amp=1.248 RT=264 Sc=x4 G=6 R Ankle 0.80 10192 0.72 0.75 95 OP 90 0.71 0.79 100 103 0.81 0.51 65 42 0.33 -0.5- PVR 0.5- L Ankle 0.5- 0- -0.5- 0.5 0- -0.5- 0- -0.5- 4s P=57 HR=75 Amp=0.678 RT=236 Sc=x4 G=6 R Metatarsal PVR 0.5 0- -0.5- 4s P=62 HR 75 Amp=0.270 RT-244 Sc=x4 G=6 R Toe 1 A ниш 0- -10- 45 HR 73 Amp=17.4 RT=282 Sc=x4 G=4 판독의(1차) 이찬주 판독의(2차) 안철민 전자서명자: 이재인 세브란스병원 SEVERANCE HOSPITAL VIASONIX 0- -10- PVR 4s P=59 HR=73 Amp=0.938 RT=264 Sc=x4 G=6 L BI Knee PVR ни 45 P=57 HR=72 Amp=1.185 RT=238 Sc=x4 G=6 PVR ми P=55 HR=N/A Amp=N/A RT=N/A Sc=x4 G=6 L Metatarsal PVR 45 P=58 HR=N/A Amp=N/A RT=N/A Sc=x4 G=6 L Toe 1 ми 4s HR 73 Amp=20.4 RT=282 Sc=x4 G=4 Page 1 of 1 1/1 출력일: 2025-04-11 출력자: 김경미 원본대조필 등록번호: 8633158 주민등록번호: 550112-125**** 남/64세 환자명: 이광욱 C-sec: cesarean section CVA cerebrovascular accident CVA tenderness costovertebral angle DM diabetes mellitus DOE dyspnea on exertion ECOG eastern cooperative oncology group HEENT: head, ear, eye, nose and throat NSVD normal spontaneous vaginal delivery PAOD peripheral arterial occlusive disease : PMI point of maximum impulse PR: pulse rate Pul. Tbc pulmonary tuberculosis RHB regular heart beat 전자서명자: 안철민 세브란스병원 SEVERANCE HOSPITAL 입원기록 2019-01-27 5/5 출력일: 2025-04-11 출력자: 김경미 원본대조필 등록번호: 8633158 주민등록번호: 550112-125****남/64세 환자명: 이광욱 진료과 심장내과 주치의 안철민 경과 계획 >>PTA CAD(2vd+ LM) s/pCAG(2018.04, 일산백) s/p_20182-04-09 4OPCAB(LIMA to dLAD, to OM(seq) to DG with RIMA composite Y, Aorta to rPL with RA) DM s/p carotid stenting @ CT angio Multifocal stenosis with calcifications in both SFA and both ATA. Diffuse atherosclerosis with calcification, infrarenal aorta. Varicose vein, left calf. No evidence of DVT. Otherwise unremarkable. PTA 치료계획: 주치의가 환자의 치료계획을 확인함. 주치의 Comment 주치의가 회진을 돌아 환자의 상태를 확인하였고 처방상태를 확인 후 환자에게 현재 상태를 설명함. 치료계획 + Problem 부 E Acute myocardial infarction, ST elevation E PAOD 기록자명 권혜란 Goal PTA PTA 목표일 수정목표일 계획일 2019-01-28 2019-01-27 2019-01-28 전자서명자: 안철민 1/1 세브란스병원 SEVERANCE HOSPITAL 2019-01-27 출력일: 2025-04-11 경과기록 2019-01-27 출력자: 김경미 원본대조필 등록번호: 8633158 주민등록번호: 550112-125****남/64세 환자명: 이광욱 진료과 심장내과 주치의 안철민 경과 계획 >>PTA CAD(2vd+ LM) s/p CAG(2018.04, 일산백) s/p_20182-04-09 40PCAB(LIMA to dLAD, to OM(seq) to DG with RIMA composite Y, Aorta to rPL with RA) DM s/p carotid stenting @ CT angio Multifocal stenosis with calcifications in both SFA and both ATA. Diffuse atherosclerosis with calcification, infrarenal aorta. Varicose vein, left calf. No evidence of DVT. Otherwise unremarkable. @PTA(19.1.28) PTA 치료계획: 주치의가 환자의 치료계획을 확인함. 주치의 Comment 치료계획 + Problem 부 E Acute myocardial 주치의가 회진을 돌아 환자의 상태를 확인하였고 처방상태를 확인 후 환자에게 현재 상태를 설명함. Goal PTA 목표일 수정목표일 계획일 2019-01-28 2019-01-27 infarction, ST elevation E PAOD 기록자명 권혜란 전자서명자: 안철민 세브란스병원 SEVERANCE HOSPITAL PTA 2019-01-28 1/1 2019-01-27 출력일: 2025-04-11 경과기록 2019-01-28 출력자: 김경미 원본대조필 등록번호: 8633158 주민등록번호: 550112-125**** 남/64세 환자명: 이광욱 경과 계획 [Puncture site assessment]: POD #0 1. Lt.CFA (Proglide) 1) Bleeding/Oozing (-) 2) Hematoma/Color change (-/-) 3) Distal assessment: Color/Pulse/Temperature change (-/-/-) * Lt.DPA (2+) 4) Infection sign (-) 5) Puncture site pulse check (2+) +) Pulse examination * 0-absent/1+ diminished/2+ normal/3+ bounding 천자부위가 점점 부어오르는 느낌이나 거즈 위로 피가 배어나오거나 흐르는 경우, 갑자기 어지럽거나 통증 및 불편감 심해지는 경우 즉시 의료진에게 알리도록 환자와 보호자 교육함. Puncture site close monitoring 4hrs ABR 기록자명 김지영 전담간호사 경과기록 2019-01-28 전자서명자: 김지영 1/1 출력일: 2025-04-11 출력자: 김경미 세브란스병원 SEVERANCE HOSPITAL 원본대조필 등록번호: 8633158 주민등록번호: 550112-125**** 남/64세 환자명: 이광욱 경과 [Puncture site assessment]: POD #1 1. Lt.CFA (Proglide) 1) Bleeding/Oozing (-) 2) Hematoma/Color change (-/-) 3) Distal assessment: Color/Pulse/Temperature change (-/-/-) Lt.DPA (2+) 4) Infection sign (-) 5) Puncture site pulse check (2+) 6) Bruit(+)/ Thrill (-) 7) 기존 compressive Dx 제거 후 betadine ball로 소독함. Medress #1로 새로 DX 시행함. +) Pulse examination * 0-absent/1+ diminished/2+ normal/3+ bounding 퇴원 후 천자부위 통증 증가, 부종, 감염의 징후, 말초부위 피부색 변 화, 상처 악화 등이 있을 경우 병원 내원하거나 연락하시도록 환자와 보호자 교육함. 계획 f/u 기록자명 김지영 전담간호사 경과기록 2019-01-29 전자서명자: 김지영 1/1 출력일: 2025-04-11 출력자: 김경미 세브란스병원 SEVERANCE HOSPITAL 원본대조필 등록번호: 8633158 주민등록번호: 550112-125**** 남/64세 환자명: 이광욱 연령 구분 분류 영유아기 학령전기 학령기 일반 산모 ㅇ정신 청소년기 성인 현병력 주 증상 및 내원 과정 Hx. DM, HTN, dyslipidemia, Unstable angina, CAOD, (2018.04), s/p CABG(2018.04), Rt. ICA stent insertion(2018.09) PTA 위해 입원함. 복용중인 약 투약 상태 개수 약명 횟수 용법 약품 코드 개수 단위 Aspirin protect [100 mg/1 T 1 PO 아침 식후 D2ASPI01 Glupa (48hr 전후 조영제 1 T 1 PO 아침 식후 D2GLUP02 병용금기) [500 mg/T] Herben [30 mg/T) 1 T 2 PO D2HERBO1 Lipitor [80 mg/T] 1 T 1 PO 아침 식후 D2LIPI12 Lozasartan(원외) [100 1 T 1 PO 아침 식후 DZLOZA02 mg/T] Platless [75 mg/T] 1 T 1 PO 아침 식후 D2PLAT01 Rabiet [10mg/T] 1 T 1 Sigmart [5 mg/T] 1 T 2 22 PO 아침 식전 D2RABI01 PO D2SIGM01 Xigduo XR 10/1000 (원 1 T 1 PO 아침 식후 D2XIGD02 외,48hr 전후 조영제 병용 금기) [1/1] 간호정보조사 2019-01-27 통증 통증 없음 있음 입원 전에 있었음 과거력 과거력 무 유 입원 및 수술 이력 없음 과거병력 고혈압 당뇨 □ 결핵 □암 □ 간염 있음 잘모름 경련 | 기타 CAOD 2vd s/pCABG 과거력(입원 및 수술) 입원시 진단명 및 수술명 입원 및 수술 시기 CAOD 2vd s/pCABG 2018.4월 Rt. ICA stent insertion 2018.09 s/p CAG 전자서명자: 김은경 세브란스병원 SEVERANCE HOSPITAL (2018.04, 일산백) 1/5 출력일: 2025-04-11 출력자: 김경미 원본대조필 등록번호: 8633158 주민등록번호: 550112-125****남/64세 환자명 : 이광욱 간호정보조사 2019-01-27 Allergy Allergy 없음 □ 약 □ 음식 기능 평가 일상생활(ADL) 수행 능력 독립적 수행 부분 보조 필요 완전 보조 보조기(이동) 사용 없음 ㅇ 목발 ㅇ 지팡이 Owalker 휠체어 ㅇ기타 *이동시 주로 사용하는 보조기를 선택해 주세요. 식사하기 독립적 수행가능 목욕하기 독립적 수행가능 개인 위생 독립적 수행가능 옷입기 독립적 수행가능 화장실 사용 독립적 수행가능 계단 오르기 독립적 수행가능 이동하기 독립적 수행가능(휠체어를 제외한 walking aid 사용 할 수 있음) 이동 하기(의자와 침대간) 독립적 수행가능 이동 하기 (휠체어) 운동 규칙적으로 하는 운동 있음 운동의 종류 걷기 □ 달리기 □ 수영 1등산 골프 기타 운동 횟수 (매일 )회/주 1회 운동 시간 1시간~1시간30 음주력 Onondrinker ex-drinker current drinker 음주력(종류, 양, 횟수/wk) 소주 1병 주 3~4회 음주 시작 시기 20살 끊은 시기 2018.4 흡연력 흡연력 Ononsmoker ex-smoker current smoker 하루의 흡연량 (1)갑/일 흡연 시작시기 20살 끊은 시기 2016년 * 끊은 시기가 1년 이하인 경우 꼭 금연교육을 시행해 주세요. (퇴원전까지) 예방 접종 B형 간염 잘모름 Rubella 잘모름 폐구균 잘모름 영양 상태 1개월간 체중변화 없음 ㅇ 증가함 ㅇ 감소함 체중변화 kg 최근 1주일간 식사량 변화 없음 ㅇ 증가 감소 식이 주의 사항 ) 없음 ㅇ 열량 조절 ㅇ 체중 조절 ㅇ 염분 제한 ○ 수분 제한 ○ 단백질 제한 ㅇ 지방 제한 기타 식습관 식사횟수 3회/일 편식 습관 무 선호 음식 기피 음식 수면 상태 전자서명자: 김은경 세브란스병원 SEVERANCE HOSPITAL 2/5 출력일: 2025-04-11 출력자: 김경미 원본대조필 등록번호: 8633158 주민등록번호: 550112-125**** 남/64세 환자명: 이광욱 수면시간 5시간 수면을 돕는법 무 수면장애 없음 신경계 시간에 대한 지남력 있음 장소에 대한 지남력 있음 사람에 대한 지남력 있음 의사 소통 □ 원만함 어려움 □ 불가능함 □ 기타 정서 상태 지난 2주동안 기분이 가라앉거나, 우울하거나, 희망이 없다고 느낀 기간 ) 없음 2~3일 이상 ○7일 이상 ○ 거의 매일 ○ 확인 불가능 지난 2주동안 평소 하던 일에 대한 흥미가 없어지거나 즐거움을 느끼지 못한 기간 없음 ○ 2~3일 이상 ○7일 이상 ○ 거의 매일 확인불가능 정서 평가 0 *The Patient Health Questionnaire -2(PHQ-2) (2003). 마비 무 유확인 불가능 Weakness 무 확인 불가능 시각 시력 장애 유 시력 장애 시력장애 부위 양안 시력저하 □ 시력상실 □ 복시 □ 반점 □ 통증 안경 |기타 보조기 사용 청각 청력 장애 무 ot 소화기계 소화기 관련 증상 배변 양상 배변 횟수 1회/일 유 대변 색깔 □ 누런색 갈색 □ 녹색 □ 검은색 간호정보조사 2019-01-27 배변 장애 무유 선홍색 |흰색 |기타 배변 조절 조절에 문제 없음 배뇨 양상 배뇨 방법 ? spont voiding Foley catheter ? CIC Kissmo □ 기타 catheter 교환 예정일 배뇨 장애 무 ○ 유 배뇨 조절 조절에 문제 없음 기능평가 100 순환기계 맥박 규칙적임 Pacemaker 없음 부종 없음 있음 순환기 관련증상 없음 있음 호흡기계 호흡양상 Regular ? Irregular Suppressed Labored 기타 호흡기 관련증상 없음 있음 전자서명자 : 김은경 세브란스병원 SEVERANCE HOSPITAL 3/5 출력일: 2025-04-11 출력자: 김경미 원본대조필 등록번호: 8633158 주민등록번호: 550112-125**** 남/64세 환자명 : 이광욱 피부 피부 온도 따뜻함 피부 습도 적당함 피부색 이상없음 피부 변화 무 유 ото ото [Comment] 사망 사망 사망 사망 형: CAOD 사망 사망 PT 간호정보조사 퇴원 퇴원 후 보호자 (Main care giver) 없음 배우자 부 모 □ 자녀 조부 ? 조모 형제자매 간병인 기타 퇴원 예정지 ?자택 친척집 타병원 요양시설 기타 퇴원 예정 교통 수단(Discharge transportation) 자가 대중 교통 항공 □ 구급차 |기타 일반 정보(6세 이상) 교육 정도 고등졸 결혼 상태 결혼 직업 사무직 원목 연락 전화번호 01037588088 원함 원하지 않음 종교 없음 기독교 천주교 불교 기타 보호자 (Main care giver) □ 없음 V배우자 부 자녀 조부 조모 형제 자매 간병인 □ 기타 교육 요구도 환자 보호자 기타 교육 요구 주 사용 언어 한국어 □ 영어 일본어 □ 중국어 □ 러시아어 □ 기타 교육 방법(환자 선호) 구두□ 유인물 □ 시범 보이기 |시청각 매체(가능하다면) 읽고 쓰는데 어려움 없음 □ 있음 □ 기타 원하는 교육 내용 □ 질병 □ 약물 □ 검사 □ 수술 □자가 간호 □ 기타 영양 교육과 진료에 영향을 주는 가치와 신념(Value & belief) 없음 있음 경제적 상태 전자서명자: 김은경 세브란스병원 SEVERANCE HOSPITAL 2019-01-27 4/5 출력일: 2025-04-11 출력자: 김경미 원본대조필 |등록번호: 8633158 주민등록번호: 550112-125****남/64세 환자명: 이광욱 입원비 지불의 어려움 있음 없음 기타 입원비 지불과 관련한 사회 사업팀 상담 필요 있음 없음 기타 간호정보조사 2019-01-27 전자서명자: 김은경 5/5 출력일: 2025-04-11 출력자: 김경미 세브란스병원 SEVERANCE HOSPITAL 원본대조필 등록번호: 8633158 주민등록번호: 550112-125****남/70세 환자명 : 이광욱 검사결과 Impression Image Name 전자서명자: 서동우 세브란스병원 SEVERANCE HOSPITAL 기능검사결과(I/F형) *CAD-2VD, S/POPCAB(2018), DM, HTN *Compare with previous echo (2018.04.16) 1. No RWMA 2. Still enlarged LA(LAVI : 39ml/m2) with normal global LV systolic function (EF: 77%) 3. Relaxation abnormality of LV filling pattern with elevated LV filling pressure (E/e': 10->15) 4. Mild pulmonary hypertension (RVSP: 41mmHg) 5. Slightly dilated sinus of Valsalva (38mm) and ascending aorta (39mm) 1/2 출력일: 2025-04-11 출력자: 김경미 원본대조필 등록번호: 8633158 주민등록번호: 550112-125****남/70세 환자명: 이광욱 기능검사결과(I/F형) ECHOCARDIOGRAPHY LABORATORY, SEVERANCE CARDIOVASCULAR HOSPITAL YONSEI UNIVERSITY COLLEGE OF MEDICINE, SEOUL KOREA Exam Date: 2025-03-19 Patient ID: 8633158 Echo No.: 25 Name: 이광욱 Referring Dr.: 안철민 Sex/Age: M 1 70Y Location: OPD Study Remark: Height 170.0cm Weight 78kg BSA 1.89m2 BP 149/62mmHg 1. Comments 전문심초음파 *CAD-2VD, S/P OPCAB(2018), DM, HTN \"Compare with previous echo (2018.04.16) 1. No RWMA 2. Still enlarged LA(LAVI 39ml/m2) with normal global LV systolic function (EF: 77%) 3. Relaxation abnormality of LV filling pattern with elevated LV filling pressure (E/e: 10->15) 4. Mild pulmonary hypertension (RVSP: 41mmHg) 5. Slightly dilated sinus of Valsalva (38mm) and ascending aorta (39mm) 2. Regional Wall Motion Abnormality: No 3. [LV GLS]: 15-20% 4. Valves: MV Native Slightly thickened AV Native Senile sclerocalcified TV Native Slightly thickened 5. Regurgitation: MR Trivial AR No TR. GI PR No 6. Stenosis: MS No AS No 7. Pericardial Effusion: No TS: Intracardiac Thrombi: No No PS No Mass: No 8. Diastolic function: Relaxation abnormality of LV filling pattern M-mode/2D Measurement RVD (9-26) mm LVEDD (42-54): 51 mm IVSD (8-11): IVSS: 11 mm Ao root (22-33) mm 13 mm LA (AP/ML/SI): 40// mm LVESD (24-36): 29 mm PWD (8-11): 9 mm LA Vol LVEF (55-76): PWS: 13 mm by M-mode: 77 % LVOT (18-22): mm by Biplane. % LV Mass: 188.0 g by prolate ellipse by mod simpson LA Vol index (18-28) ml 76.0 ml TV Annulus: mm LV Mass index: 97.9 g/m2 IVC: mm RWT: 0.35 Echo Score: Doppler Measurement Total M T S C by prolate ellipse: by mod simpson MV Annulus (4C/2C): 39.6 ml/m2 ml/m2 mm Aortic Mitral Tricuspid LVOT (TVI): AV (TVI): cm cm TVI of MR jet: cm TR jet. 2.98 m/sec E (0.6-1): 0.77 m/sec RVSP: 41 mmHg LVOT peak V m/sec A (0.3-0.8): 1.10 m/sec RAP 5 mmHg PSPG/MSPG: 1 mmHg DT (170-210) 224 msec MPAP mmHg AV Peak V: m/sec PHT: msec PVR PSPG/MSPG: 9/5 mmHg MDPG: mmHg MDPG mmHg AVA by 2D HR: /min RVOT VTI cm by continuity: cm2 MVA by 2D: cm2 Pulmonic PHT of AR jet: msec by PHT: cm2 PSPG/MSPG: mmHg by continuity: cm2 TDI S 11.0 cm/sec E': 5.0 cm/sec A 11.0 RVOT AT: cm/sec m/sec E/E 15.40 Reported by: 서동우 판독의(1차) 서동우 판독의(2차) 심지영 전자서명자: 서동우 세브란스병원 SEVERANCE HOSPITAL Responsible Dr. : 심지영 2/2 출력일: 2025-04-11 출력자: 김경미 원본대조필 등록번호: 8633158 주민등록번호: 550112-125****남/68세 환자명: 이광욱 진료과 내분비내과 주치의 강은석 BP(S) 132 mmHg BP(D) 62 mmHg HR 82/min 경과 및 Plan CAD(2vd+ LM) s/p CAG (2018.04, 일산백) s/p 40PCAB(LIMA to dLAD, to OM(seq) to DG with RIMA composite Y, Aorta to rPL with RA) (2018-04-09) Rt. ICA stenosis s/p stent insertion (2018.10.02) PAD s/p PTA c DCB at Rt. SFA (2019.01.28) DM(11yrs) Ex-smoker (30yr, 2년전 중단) Aorta to rPL with RA) Glucose 114 Glycoalbumin 20.5 Glucose (연속) - 식후 2시간 181 HbA1c 7.2 Cholesterol 112 Triglyceride 57 HDL-Cholesterol 48 LDL-Cholesterol (Friedewald) 52.6 Urine Albumin-to-Creatinine Ratio 42.04 >> repeat med 6mo f/u 진단명 구분 확진 주진단 기타진단 기타진단 Thyroid nodule 확진 Diabetes mellitus type 2 with dyslipidemia 확진 확진 Internal carotid artery stenosis 기록자명 강은석 전자서명자: 강은석 세브란스병원 SEVERANCE HOSPITAL 진단명 외래재진기록 2023-07-18 1/1 출력일: 2025-04-11 출력자: 김경미 원본대조필 등록번호: 8633158 주민등록번호: 550112-125**** 남/69세 환자명: 이광욱 진료과 내분비내과 주치의 김다함 Progress U/S 경부(neck)(Doppler) 2024.01.16 Clinical information: Diabetes mellitus type 2 with dyslipidemia US examination was done with linear transducer> =10 MHz (central frequency). 이전 US와 비교함 Both thyroid gland 에 multiple probably benign nodules 들이 관찰되며 가장 큰 것은 Rt thyroid lower pole의 21mm 크기의 nodule 임. Background echotexture subtle heterogeneous mild diffuse enlarge 001 음.. Both neck에 pathologically enlarged LNs 없음. Doppler ultrasound images 상 특이소견 없음. Imp: Multiple probably benign nodules in both thyroids (K-TIRADS: 3) R/O Diffuse thyroid disease recommend follow up. T3 0.47 Free T4 1.08 TSH 2.12 추가사항 Thyroid nodule Plan 2y f/u 진단명 구분 확진 주진단 확진 Diabetes mellitus type 2 with dyslipidemia |기타진단 확진 Diabetic polyneuropathy |기타진단 확진 Internal carotid artery stenosis 진단명 기록자명 김다함 외래재진기록 2024-01-16 전자서명자: 김다함 1/1 출력일: 2025-04-11 출력자: 김경미 세브란스병원 SEVERANCE HOSPITAL 원본대조필 등록번호: 8633158 주민등록번호: 550112-125**** 남/69세 환자명: 이광욱 진료과 내분비내과 주치의 강은석 BP(S) 142 mmHg BP(D) 62 mmHg HR 77/min 경과 및 Plan CAD(2vd+ LM) s/p CAG (2018.04, 일산백) s/p 40PCAB(LIMA to dLAD, to OM(seq) to DG with RIMA composite Y, Aorta to rPL with RA) (2018-04-09) Rt. ICA stenosis s/p stent insertion (2018.10.02) PAD s/p PTA DCB at Rt. SFA (2019.01.28) DM(11yrs) Ex-smoker (30yr, 2년전 중단) Aorta to rPL with RA) Glucose 106 Glycoalbumin20.0 Glucose (연속) - 식후 2시간 177 HbA1c 7.0 Cholesterol 104 Triglyceride 77 HDL-Cholesterol 42 LDL-Cholesterol (Friedewald) 46.6 Urine Albumin-to-Creatinine Ratio 69.15 가끔씩 졸린 증상? >> 식습관 꾸준히 관리해보시고, 식후 1시간 자가혈당 측정해보세요. repeat med 6mo f/u 진단명 구분 확진 주진단 확진 Diabetes mellitus type 2 with dyslipidemia |기타진단 확진 Diabetic polyneuropathy |기타진단 확진 Internal carotid artery stenosis 기록자명 강은석 전자서명자: 강은석 세브란스병원 SEVERANCE HOSPITAL 진단명 외래재진기록 2024-01-16 1/1 출력일: 2025-04-11 출력자: 김경미 원본대조필 | 등록번호: 8633158 주민등록번호: 550112-125****남/69세 환자명: 이광욱 진료과 내분비내과 주치의 강은석 BP(S) mmHg BP(D) mmHg HR /min 경과 및 Plan 진단명 구분 확진 CAD(2vd+ LM) s/p CAG (2018.04, 일산백) s/p 40PCAB(LIMA to dLAD, to OM(seq) to DG with RIMA composite Y, Aorta to rPL with RA) (2018-04-09) Rt. ICA stenosis s/p stent insertion (2018.10.02) PAD s/p PTA c DCB at Rt. SFA (2019.01.28) DM(11yrs) Ex-smoker (30yr, 2년전 중단) Aorta to rPL with RA) Glucose 121 Glycoalbumin23.6 Glucose (연속) - 식후 2시간 116 HbA1c 6.9 Cholesterol 115 Triglyceride 57 HDL-Cholesterol 51 LDL-Cholesterol (Friedewald) 52.6 Urine Albumin-to-Creatinine Ratio 36.11 >> repeat med 6mo f/u 주진단 확진 Diabetes mellitus type 2 with dyslipidemia 확진 Thyroid nodule 기타진단 기타진단 확진 Internal carotid artery stenosis 기록자명 강은석(의사) 전자서명자: 강은석 세브란스병원 SEVERANCE HOSPITAL 진단명 외래재진기록 2024-07-16 1/1 출력일: 2025-04-11 출력자: 김경미 원본대조필 등록번호: 8633158 주민등록번호: 550112-125**** 남/69세 환자명: 이광욱 외래재진기록 2024-10-01 진료과 신경과 주치의 남효석 Subjective Brain MRI and MRA 2024-09-12 Small old infarction in left side medulla. Stenosis in right carotid bulb and right distal VA. Steno-occlusion in left VA. Stenosis in left proximal ICA, left cavernous ICA. --> 비슷하십니다. 평소에 괜찮음. 운전하고 내릴 때 어찔함. <5초 - 2022-09-14 에 비해서 Rt distal VA stenosis 가 심해짐. one-way 라서 우려됨. LDL-Cholesterol (Friedewald) 52.6 Objective Assessment Plan plavix, 아모잘탄 Q (로수바 20 복합제) ▶아스피린 추가 Stroke 발생 Cerebral infarction Hemorrhage stroke Unknown stroke TIA Stroke 발생 날짜 Stroke Comment CAOD 발생 ? Acute MI ? Unstable angina PTCA/stent CABG Others CAOD 발생 날짜 CAOD 발생 Comment 전자서명자: 남효석 세브란스병원 SEVERANCE HOSPITAL 1/3 출력일: 2025-04-11 출력자: 김경미 원본대조필 등록번호: 8633158 주민등록번호: 550112-125****남/69세 환자명: 이광욱 외래재진기록 2024-10-01 121067Y|M 8633158 Study Date 2022-09-14 A1069Y|M 8633158 Study Date 2024-09-12 AR 전자서명자: 남효석 세브란스병원 SEVERANCE HOSPITAL B1050mm RF 2/3 출력일: 2025-04-11 출력자: 김경미 원본대조필 등록번호: 8633158 주민등록번호: 550112-125**** 남/69세 환자명: 이광욱 진단명 구분 확진 HP Bricktha Study Date 202409 12 LH 11069YM 8633158 Study Dale 2024-09-12 503 18m RA 주진단 확진 Internal carotid artery stenosis HP 기타진단 확진 기타진단 확진 Coronary artery disease (2 vessel disease) Unstable angina 기록자명 남효석(의사) 전자서명자: 남효석 세브란스병원 SEVERANCE HOSPITAL 진단명 외래재진기록 2024-10-01 3/3 출력일: 2025-04-11 출력자: 김경미 원본대조필 등록번호: 8633158 주민등록번호: 550112-125****남/70세 환자명: 이광욱 진료과 내분비내과 주치의 강은석 BP(S) 170mmHg BP(D) 50mmHg HR 103/min 경과 및 Plan CAD(2vd+ LM) s/p CAG (2018.04, 일산백) s/p 40PCAB(LIMA to dLAD, to OM(seq) to DG with RIMA composite Y, Aorta to rPL with RA) (2018-04-09) Rt. ICA stenosis s/p stent insertion (2018.10.02) PAD s/p PTA c DCB at Rt. SFA (2019.01.28) DM(11yrs) Ex-smoker (30yr, 2년전 중단) Aorta to rPL with RA) Glucose 132 20.1 Glycoalbumin Glucose (연속) - 식후 2시간 235 HbA1c 6.8 Total cholesterol 112 Triglyceride 70 HDL-Cholesterol 56 LDL-Cholesterol (Friedewald) 42 Urine Albumin-to-Creatinine Ratio 63.99 체중 이전과 비슷함 >> repeat med 6mo f/u 진단명 구분 확진 주진단 확진 기타진단 확진 기타진단 확진 Diabetes mellitus type 2 with dyslipidemia Diabetic polyneuropathy 진단명 Internal carotid artery stenosis 기록자명 강은석(의사) 전자서명자: 강은석 세브란스병원 SEVERANCE HOSPITAL 외래재진기록 2025-01-14 1/1 출력일: 2025-04-11 출력자: 김경미 원본대조필 등록번호: 8633158 주민등록번호: 550112-125****남/70세 환자명: 이광욱 진료과 심장내과 주치의 안철민 BP(S) 131 mmHg BP(D) 56mmHg HR 86/min Subjective Good/No interval change Objective Non-HDL Cholesterol 50 Assessment LDL-Cholesterol (Friedewald) 34.8 외래재진기록 일산21세기병원 약) Platless 75mg qd, Amosartan Q5/100/20mg qd, Sigmart 5mg bid, Herben 30mg bid ABI (Ankle / Brachial Index) - Rt: 0.80 /Lt: 0.72 <=-Rt: 0.90 /Lt: 0.84 <== Rt: 0.96 /Lt: 0.88 <==Rt: 0.84/Lt: 0.82 echo *CAD-2VD, S/P OPCAB(2018), DM, HTN *Compare with previous echo (2018.04.16) 1. No RWMA 2. Still enlarged LA(LAVI: 39ml/m2) with normal global LV systolic function (EF: 77%) 3. Relaxation abnormality of LV filling pattern with elevated LV filling pressure (E/e': 10->15) 4. Mild pulmonary hypertension (RVSP: 41mmHg) 5. Slightly dilated sinus of Valsalva (38mm) and ascending aorta (39mm) TMT 10.1 METS equivocal PAD, s/p PTA 2019.1.28 - IVUS-DCB - s/p PTA CDCB at Rt. SFA[2019-01-28] ABI 1.04/1.09 <== 0.69/0.99 CAD(2vd+ LM) s/pCAG(2018.04, 일산백) s/p 2018-04-09 4OPCAB(LIMA to dLAD, to OM(seq) to DG with RIMA composite Y, Aorta to rPL with RA) DM herben 일년 정도 사용 - 유경종 교수님 - radial graft HTN Plan 2yr EKG/CXR/LAB/full(비급여 설명드림) 진단명 구분 확진 진단명 주진단 확진 Unstable angina |기타진단 확진 Peripheral arterial occlusive disease (lower extremities) |기타진단 확진 Coronary artery disease (2 vessel disease) 전자서명자: 안철민 세브란스병원 SEVERANCE HOSPITAL 2025-03-26 1/2 출력일: 2025-04-11 출력자: 김경미 원본대조필 등록번호: 8633158 주민등록번호: 550112-125****남/70세 환자명 : 이광욱 외래재진기록 2025-03-26 기록자명 안철민(의사) 전자서명자: 안철민 세브란스병원 SEVERANCE HOSPITAL 2/2 출력일: 2025-04-11 출력자: 김경미 원본대조필 등록번호: 8633158 주민등록번호: 550112-125**** 남/70세 환자명: 이광욱 진료과 신경과 주치의 남효석 Subjective Objective Assessment Plan Rt distal VA stenosis 가 진행한 것 같습니다. 위험석이 커서 증상이 있으면 스텐트 고려하겠습니다. Stroke 발생 Cerebral infarction Hemorrhage stroke Unknown stroke TIA Stroke 발생 날짜 Stroke Comment CAOD 발생 Acute MI ? Unstable angina PTCA/stent CABG Others CAOD 발생 날짜 CAOD 발생 Comment 전자서명자: 남효석 세브란스병원 SEVERANCE HOSPITAL 8633158M070YCT Brain + Angio (Brain+Neck) (contrast 2025-03-19 13 08:17 AL 외래재진기록 2025-03-26 1/3 출력일: 2025-04-11 출력자: 김경미 원본대조필 | 등록번호: 8633158 주민등록번호: 550112-125****남/70세 환자명 : 이광욱 전자서명자: 남효석 세브란스병원 SEVERANCE HOSPITAL JOYCT Brain + Angio (Brain+Neck) (contrast)2025-03-19 13:08:17 HR M070YCT Brain + Angio (Brain+Neck) (contrast)2025-03-19 13:08 17 A 외래재진기록 2025-03-26 2/3 출력일: 2025-04-11 출력자: 김경미 원본대조필 등록번호: 8633158 주민등록번호: 550112-125****남/70세 환자명 : 이광욱 BOYCT Brain + Angio (Brain+Neck) (contrast)2025-03-19 13:08:17 A 진단명 구분 확진 진단명 주진단 확진 기타진단 확진 Unstable angina Internal carotid artery stenosis 기타진단 확진 Coronary artery disease (2 vessel disease) 기록자명 남효석(의사) 전자서명자: 남효석 세브란스병원 SEVERANCE HOSPITAL 외래재진기록 2025-03-26 3/3 출력일: 2025-04-11 출력자: 김경미 원본대조필 진료비 세부산정내역(외래) 환자등록번호 8633158 환자성명 이광욱 환자구분 건강"
        }
      ],
      "insuranceHistory": [
        {
          "period": "[보험 가입 3개월 이내]"
        },
        {
          "period": "[보험 가입 3개월 이내]"
        },
        {
          "period": "[보험 가입 3개월 이내]"
        },
        {
          "period": "[보험 가입 3개월 이내]"
        },
        {
          "period": "[보험 가입 3개월 이내]"
        },
        {
          "period": "[보험 가입 3개월 이내]"
        },
        {
          "period": "[보험 가입 3개월 이내]"
        },
        {
          "period": "[보험 가입 3개월 이내]"
        },
        {
          "period": "[보험 가입 3개월 이내]"
        },
        {
          "period": "[보험 가입 3개월 이내]"
        },
        {
          "period": "[보험 가입 3개월 이내]"
        },
        {
          "period": "[보험 가입 3개월 이내]"
        },
        {
          "period": "[보험 가입 3개월 이내]"
        },
        {
          "period": "[보험 가입 3개월 이내]"
        },
        {
          "period": "[보험 가입 3개월 이내]"
        },
        {
          "period": "[보험 가입 3개월 이내]"
        },
        {
          "period": "[보험 가입 3개월 이내]"
        },
        {
          "period": "[보험 가입 3개월 이내]"
        },
        {
          "period": "[보험 가입 3개월 이내]"
        },
        {
          "period": "[보험 가입 3개월 이내]"
        },
        {
          "period": "[보험 가입 3개월 이내]"
        },
        {
          "period": "[보험 가입 3개월 이내]"
        },
        {
          "period": "[보험 가입 3개월 이내]"
        },
        {
          "period": "[보험 가입 3개월 이내]"
        },
        {
          "period": "[보험 가입 3개월 이내]"
        },
        {
          "period": "[보험 가입 3개월 이내]"
        },
        {
          "period": "[보험 가입 3개월 이내]"
        },
        {
          "period": "[보험 가입 3개월 이내]",
          "company": "기(고의사고 허위사고, 허위입원. 진단. 장해, 사고 후"
        },
        {
          "period": "[보험 가입 3개월 이내]"
        },
        {
          "period": "[보험 가입 3개월 이내]"
        },
        {
          "period": "[보험 가입 3개월 이내]"
        },
        {
          "period": "[보험 가입 3개월 이내]"
        },
        {
          "period": "[보험 가입 3개월 이내]"
        },
        {
          "period": "[보험 가입 3개월 이내]",
          "company": "제출 123 매 의무기록 사본 증명서 이 사본은 의무기록 원본과 틀림이 없음을 증명합니다. 이 사본은 위의 용도 외에는 사용할 수 없습니다. 의무기록 사본 증명서 2025년 04월 11일 담당자: 김경미 (인) 담당자의 날인이 없는 것은 무효임 여래대학교 연세대학교 의과대학 학과대학 세브란스병원 병원 세브란스병원 SEVERANCE HOSPITAL 등록번호: 8633158 주민등록번호: 550112-125**** 남/63세 환자명: 이광욱 외래재진기록 2019-01-02 진료과 심장내과 주치의 안철민 BP(S) 181 mmHg BP(D) 95 mmHg HR 90/min Subjective Objective CT angio Assessment Good/No interval change Multifocal stenosis with calcifications in both SFA and both ATA. Diffuse atherosclerosis with calcification, infrarenal aorta. Varicose vein, left calf. No evidence of DVT. Otherwise unremarkable. CAD(2vd+ LM) s/pCAG(2018.04, 일산백) s/p 2018-04-09 4OPCAB(LIMA to dLAD, to OM(seq) to DG with RIMA composite Y, Aorta to rPL with RA) DM s/p carotid stenting Plan PTA 고려 SFA os, Rt contralateral approach 2월 10일입원, 11일 시술 기록자명 안철민 전자서명자: 안철민 세브란스병원 SEVERANCE HOSPITAL 1/1 출력일: 2025-04-11 출력자: 김경미 원본대조필 등록번호: 8633158 주민등록번호: 550112-125**** 남/64세 환자명: 이광욱 입원정보 입원일자 2019-01-27 입원과 심장내과 입원주치의 안철민 퇴원정보 퇴원일자 2019-01-29 퇴원과 심장내과 퇴원주치의 안철민 최종진단명(*) 순서 한국질병 구분 확진 진단명 분류번호 1 주진단 확진 Peripheral arterial occlusive disease (lower extremities) 170.29 2 기타진단 확진 Unstable angina 120.0 3 기타진단 확진 Coronary artery disease (left main) 125.1 4 기타진단 확진 Coronary artery disease (2 vessel disease) 125.1 5 기타진단 확진 S/P Coronary artery bypass graft Z95.1 과거진단명 과거진단코드 주호소 (*) Diabetes mellitus other, without complication; Diabetes mellitus type 2, without complication; Diabetic polyneuropathy; Internal carotid artery stenosis;Internal carotid artery stenosis, right;Type 2 diabetes mellitus, coronary artery disease; E11.58;E11.9;E13.9;E14.41;165.2; For PTA 과거력 및 현재병력 상기 64세 남환 DM, CAOD (2vd, s/p CAG), PAOD 진단 받은 분으로 PTA 시행 위해 금일 입원함. V/S 120/70 78 20 Current Sx: none 이상 진찰 소견 (★) n-s 재원중 투약내역 (*) n-s 투여된 약물 중 잔류효과로 퇴원 후 주의가 필요한 약물 (*) 없음 있음 Aspirin protect->출혈의 위험성이 증가되므로 상처나 멍이 생기지 않도록 주의하십시오.; Platless-> 출혈의 위험성이 증가되므로 상처나 멍이 생기지 않도록 주의하십시오.; 전자서명자: 안철민 세브란스병원 SEVERANCE HOSPITAL 퇴원요약 2019-01-29 1/3 출력일: 2025-04-11 출력자: 김경미 원본대조필 등록번호: 8633158 주민등록번호: 550112-125****남/64세 환자명: 이광욱 검사소견 (*) 치료 및 효과 (*) @PTA(19.1.28) Access site Lt CFA Approach method contralateral antegrade Peripheral angiography with JR 5F catheter revealed total occlusion of Rt. SFA OS (TIMI 1) with diffuse irregular up to 70% LN of p-mSFA total occlusion of Rt. ATA (TIMI O) Taget lesion: Rt. SFA 7F Balkin sheath c 018 command wire The guiding wire was passed through the lesion. Balloon angioplasty was done with 6x60 mm Mustang PTA balloon at Rt. SFA OS~MSFA F/U angio revealed 60% residual stenosis without dissection Two DCB with 6x150 mm Inpact Admiral were inflated at Rt. SFA OS~MSFA F/U angio revealed 10 % residual stenosis without dissection or flow limitation conclusion>> Successful PTA C DCB at Rt. SFA @Successful PTA c DCB at Rt. SFA(19.1.28) 시행 후 acute complication 없이 퇴원함. @PTA(19.1.28) 주시술명 주시술코드 3950 기타시술명 기타시술코드 Implantable Medical Device 사용 여부 No Yes 치료결과 (*) 완쾌 경쾌 호전안됨 진단뿐 가망없는 퇴원 48시간이내 사망 선행사인 48시간이후 사망 선행사인 선행사인 분류코드 활력증상 혈압 120/75 mmHg 맥박수 70 퇴원형태 (★) 퇴원지시후 타병원전원 회/분 체온 36.8 자의퇴원 ㅇ 탈원 호흡수 20 회/분 향후 치료계획 외래 추후관리 재입원 없음 기타 퇴원요약 2019-01-29 전자서명자: 안철민 2/3 출력일: 2025-04-11 세브란스병원 SEVERANCE HOSPITAL 출력자: 김경미 원본대조필 등록번호: 8633158 주민등록번호: 550112-125**** 남/64세 환자명: 이광욱 퇴원약 약품명 (Name) 용량(Dose) 일수(Days) 용법(Direction) 처방 분류 (Type) 효능 아스피린프로텍트 1 14 정100mg 아침 식후 30분 복용하십시오 퇴원약 헤르벤정 30mg 1 14 아침,저녁 식후 30 퇴원약 분 복용하십시오 리피토정 80mg 1 14 아침 식후 30분 퇴원약 복용하십시오 플래리스정 1 14 아침 식후 30분 복용하십시오 퇴원약 라비에트정10mg 1 14 아침 식전 30분 복 퇴원약 용하십시오 중외시그마트정 1 5mg 14 아침, 저녁 식후 30 퇴원약 분 복용하십시오 코자정100mg 1 14 아침 식후 30분 복용하십시오 퇴원약 아스피린프로텍트 1 19 정100mg 아침 식후 30분 복용하십시오 퇴원약 헤르벤정 30mg 1 19 아침,저녁 식후 30 퇴원약 분 복용하십시오 리피토정 80mg 1 19 아침 식후 30분 퇴원약 복용하십시오 플래리스정 1 19 아침 식후 30분 퇴원약 복용하십시오 라비에트정10mg 1 19 아침 식전 30분 복 퇴원약 용하십시오 중외시그마트정 1 5mg 19 아침,저녁 식후 30 퇴원약 분 복용하십시오 코자정100mg 1 19 아침 식후 30분 복용하십시오 퇴원약 담당 전공의사명 권혜란 기록자명 권혜란 주치의사명 안철민 <약어 설명> CAOD coronary artery obstructive disease RFCA radio-frequency catheter ablation NSTEMI non-ST elevation myocardial infarction C-angio : coronary angiogram A.fib: atrial fibrillation EPS electrophysiologic studies DCMP: dilated cardiomyopathy HCMP hypertrophic cardiomyopathy PAF paroxysmal atrial fibrillation RHD rheumatic heart disease NSVT non-sustained ventricular tachycardia A-flutter : atrial flutter 퇴원요약 2019-01-29 전자서명자: 안철민 3/3 출력일: 2025-04-11 출력자: 김경미 세브란스병원 SEVERANCE HOSPITAL 원본대조필 등록번호: 8633158 주민등록번호: 550112-125****남/64세 환자명: 이광욱 입원일자 2019-01-27 입원과 심장내과 입원주치의 안철민 입원결정의사 안철민 주호소 또는 입원사유 For PTA 현재질병상태 상기 64세 남환 DM, CAOD (2vd, s/p CAG), PAOD 진단 받은 분으로 PTA 시행 위해 금일 입원함. V/S 120/70 78 20 Current Sx none 과거력 Hypertension No Yes Pul. Tbc No Yes DM No Yes Hepatitis No Yes Smoking No Yes 금연교육 여부 시행 미시행 |해당없음 Alcohol No Yes Drug Allergy No Yes Penicillin Sulfonamide ? Cephalosporin Other 알레르기 No Yes Hypercholesterolemia No Yes Cardiac disease No Yes Old CVA No Yes 말초동맥 및 경동맥 질환 No Yes Coronary artery bypass graft No Yes Others 가족력 계통문진 Generalized Weakness No Easy Fatigue No Fever No Chill No Headache No 00000 Yes Yes Yes Yes Yes Dizziness No Yes Insomnia No Yes 전자서명자: 안철민 세브란스병원 SEVERANCE HOSPITAL 입원기록 2019-01-27 1/5 출력일: 2025-04-11 출력자: 김경미 원본대조필 등록번호: 8633158 주민등록번호: 550112-125**** 남/64세 환자명: 이광욱 입원기록 2019-01-27 Cough Sputum Dyspnea DOE z z zz z z z z z z z No No Yes Yes Yes No Yes No No No Yes Yes Yes No Yes No Yes No Yes 0000000000 Chest pain Palpitation Hemoptysis Hematemesis Anorexia Nausea No Vomiting No Yes Constipation No Yes Diarrhea No Yes Abdominal pain No Yes Abdominal discomfort No Hematochezia No Melena No 000 Yes Yes Yes Dysuria No Yes Oliguria No Yes Hematuria No Yes Poor oral intake No Yes Weight Loss No Yes Weight Gain No Yes Others 신체조사 General Appearance Appearance Not so ill-looking appearance Mental Status Alert Drowsy Stupor Semicoma Coma Nutritional and Developement status Good Moderate Poor Skin 피부 Abnormal skin rash Warm ? Cold Wet Dry No Yes Skin tugor Good HEENT Normocephaly without deformity Yes No Sclera not icteric not injected Throat 전자서명자: 안철민 세브란스병원 SEVERANCE HOSPITAL Conjunctiva not pale Lips & tongues not dried 2/5 출력일: 2025-04-11 출력자: 김경미 원본대조필 등록번호: 8633158 주민등록번호: 550112-125**** 남/64세 환자명: 이광욱 Neck Stiffness supple Cervical LNs not palpable Neck veins not engorged Chest/lung Symmetric expansion Yes No Retraction No Yes ( Both Rt Lt) Breath sounds clear increased decreased character High-pitched sound Continuous sound Wheezing Discontinuous sound Fine crackle Low-pitched sound Location Stridor ? Velcro rale Right upper lung field Rhonchi ? Coarse crackle Right middle lung field Left upper lung field ? Left middle lung field Right lower lung field ? Left lower lung field Heart PMI (5th ICS LMCL) 이상 RHB without murmur with murmur Thrill No Yes Heaving No Yes Abdomen Palpation ? soft ? rigid flat distended Bowel sound normoative Tenderness No Yes Palpation of organ No liver kidney spleen Shifting dullness No Yes Fluid wave No Yes Back and Extremity LOM No Yes CVA tenderness No Rt. Lt. Both Pitting edema No Yes Paresthesia No Yes 전자서명자: 안철민 세브란스병원 SEVERANCE HOSPITAL 입원기록 2019-01-27 3/5 출력일: 2025-04-11 출력자: 김경미 원본대조필 등록번호: 8633158 주민등록번호: 550112-125**** 남/64세 환자명: 이광욱 입원기록 2019-01-27 others (Physical Exam) 감염성질환 초기평가 1. 증상 및 기간 발열 기간 일전 호흡기증상 기간 일전 소화기증상 기간 일전 해당없음 (미상환자 포함) 2. 최근 1달 이내 방문한나라 해당없음 없음 있음 3. 최근 1달 이내 입원했던 병원 (감염주의 병원) 없음 있음 4. 밀접 접촉자 해당없음 아니오 예 5. 신종 감염병 의심환자 아니오 예 통증평가 통증여부 No Yes 추정진단 PAOD 계획 PTA 고려 퇴원계획 퇴원 후 치료식이 여부 ? N ? Y 추후 관리 계획 |가정간호사업소 호스피스 타 병원 전원 외래 사회 복지서비스 연계 필요성 ? N ? Y 기타 퇴원시 요구사항 치료계획 + Problem Goal 목표일 수정목표일 계획일 부 PAOD PTA 2019-01-28 2019-01-27 기록자명 하장우 <약어 설명> BMI : body mass index BP(D): Blood Pressure(Diastolic) BP(S) : Blood Pressure(Systolic) BT body temperature 전자서명자: 안철민 세브란스병원 SEVERANCE HOSPITAL ICS: impulse conducting system(of the heart) LMCL left midclavicular line LNs lymph nodes LOM limitation of motion 4/5 출력일: 2025-04-11 출력자: 김경미 원본대조필 등록번호: 8633158 주민등록번호: 550112-125****남/68세 환자명: 이광욱 검사결과 1. ABI (Ankle / Brachial Index) - Rt: 0.90 /Lt: 0.84 1-1. TBI (Toe / Brachial Index)- Rt: 0.39/Lt: 0.36 Impression Name Image 1 전자서명자: 모혜인 세브란스병원 SEVERANCE HOSPITAL 기능검사결과(I/F형) 2023-03-22 1/2 출력일: 2025-04-11 출력자: 김경미 원본대조필 등록번호: 8633158 주민등록번호: 550112-125**** 남/68세 환자명: 이광욱 Name: LEE K.W. ID #: 8633158 Exam Date: 03/22/2023 11:08 AM Operator: M 기능검사결과(I/F형) SEVERANCE HOSPITAL Sex: M MultiLab Series !! SEGMENTAL PRESSURE AND PVR STUDY Brachial RIGHT LEFT 108 109 RIGHT LEFT 0.85 93 PT 92 0.84 0.90 98 DP 91 0.83 ми PVR 64mmHg 187cc LEFT Ankle ABI: 0.84 Gain: 2 Spd:25 Amp:16 TBI: 0.36 0.39 43 39 0.36 PVR 65mmHg 175cc RIGHT Ankle Gain: 2 Spd:25 Amp:19 ABI: 0.90 TBI: 0.39 PPG RIGHT Great Toe Gain:.50 Speed: 25 Amp:01 판독의(1차) 박한진 판독의(2차) 안철민 ABI INDEX 0.97- 1.25 NORMAL 0.75 0.96 MILD 0.50 0.74 MODERATE <0.50 SEVEREE TBI(FBI) INDEX >0.80 NORMAL 0.20 0.54 CLAUDICATION <0.20 REST PAIN PPG LEFT Great Toe Gain:.50 Speed: 25 Amp:01 2023-03-22 전자서명자: 모혜인 2/2 출력일: 2025-04-11 출력자: 김경미 세브란스병원 SEVERANCE HOSPITAL 원본대조필 등록번호: 8633158 주민등록번호: 550112-125**** 남/67세 환자명 : 이광욱 진료과 내분비내과 주치의 강은석 BP(S) 150mmHg BP(D) 58 mmHg HR 89/min 경과 및 Plan 진단명 구분 확진 CAD(2vd+ LM) s/p CAG (2018.04, 일산백) s/p 4OPCAB(LIMA to dLAD, to OM(seq) to DG with RIMA composite Y, Aorta to rPL with RA) (2018-04-09) Rt. ICA stenosis s/p stent insertion (2018.10.02) PAD s/p PTA c DCB at Rt. SFA (2019.01.28) DM(11yrs) Ex-smoker (30yr, 2년전 중단) Aorta to rPL with RA) Glucose 140 Glycoalbumin 20.6 Glucose (연속) - 식후 2시간 195 HbA1c 7.3 Cholesterol 121 Triglyceride 77 HDL-Cholesterol 56 LDL-Cholesterol (Friedewald) 49.6 BUN 24.4 Creatinine 1.22 Urine Albumin-to-Creatinine Ratio 78.07 >> 생활습관 개선 필요함 repeat med 6mo f/u 주진단 확진 Diabetes mellitus type 2 with dyslipidemia 기타진단 확진 Thyroid nodule 기타진단 확진 Internal carotid artery stenosis 기록자명 강은석 진단명 외래재진기록 2022-07-19 전자서명자: 강은석 1/1 출력일: 2025-04-11 출력자: 김경미 세브란스병원 SEVERANCE HOSPITAL 원본대조필 등록번호: 8633158 주민등록번호: 550112-125****남/67세 환자명: 이광욱 외래재진기록 2022-09-21 진료과 심장내과 주치의 일반 BP(S) mmHg HR /min Subjective Objective Assessment Plan 진단명 구분 확진 주진단 기타진단 기타진단 확진 확진 확진 BP(D) mmHg chest pain / discomfort (-/-) dyspnea / DOE (-/-) palpitation (-) functional capacity >4METS 잘지냈다. 증상없음 PAD, S/P PTA 2019.1.28 - IVUS-DCB - s/p PTA DCB at Rt. SFA[2019-01-28] ABI 1.04/1.09 <== 0.69/0.99 CAD(2vd+ LM) s/pCAG(2018.04, 일산백) s/p 2018-04-09 4OPCAB(LIMA to dLAD, to OM(seq) to DG with RIMA composite Y, Aorta to rPL with RA) DM herben 일년 정도 사용 - 유경종 교수님 - radial graft HTN_Q Repeat med Unstable angina Coronary artery disease (left main) Coronary artery disease (2 vessel disease) 기록자명 최기정 <약어 설명> BP(D) : Blood Pressure(Diastolic) 진단명 HR : Heart Rate BP(S) : Blood Pressure (Systolic) med Medication 전자서명자: 최기정 세브란스병원 1/1 출력일: 2025-04-11 출력자: 김경미 원본대조필 SEVERANCE HOSPITAL 등록번호: 8633158 주민등록번호: 550112-125****남/67세 환자명: 이광욱 진료과 신경과 주치의 홍순호 SBP 129 mmHg DBP 60mmHg 맥박 81회/분 경과 Rt. pICA severe stenosis s/p stent insertion (2018) --4 vessel 2019.09.05 Occlusion of Lt VA. No residual stenosis or in-stent thrombosis in Rt pICA. --brain MRIA 2022.09.14 Small old infarction in left side medulla. Microbleed in right parietal lobe. Stenosis in right carotid bulb and right distal VA. Steno-occlusion in left VA. Stenosis in left proximal ICA, left cavernous ICA. -->interval change 없어보임. 별일 없으셨다 2024 brain MRIA 외래재진기록 2022-09-21 전자서명자: 홍순호 1/2 출력일: 2025-04-11 출력자: 김경미 세브란스병원 SEVERANCE HOSPITAL 원본대조필 등록번호: 8633158 주민등록번호: 550112-125**** 남/67세 환자명: 이광욱 진단명 구분 확진 주진단 확진 |기타진단 확진 |기타진단 확진 Internal carotid artery stenosis Unstable angina Coronary artery disease (2 vessel disease) 진단명 기록자명 홍순호 외래재진기록 2022-09-21 전자서명자: 홍순호 2/2 출력일: 2025-04-11 출력자: 김경미 세브란스병원 SEVERANCE HOSPITAL 원본대조필 등록번호: 8633158 주민등록번호: 550112-125**** 남/69세 환자명: 이광욱 영상검사 CT& MR 영상검사 CT& MR 검사명 MRI Brain & Angio 3D(Neck포함) (contrast) 검사방법 검사일자 판독일자 2024.09.12 10:33 2024.10.22 15:34 촬영실 MRI 74호(본관 4층) Description 판독의/전문의 Clinical information: Internal carotid artery stenosis Imaging technique: sagittal T1Wl, axial T1WI, T2WI, T2 FLAIR. T2*WI, contrast enhanced 3D T1Wl with axial/coronal/sagittal reconstruction, intracranial TOF MRA, contrast enhanced intracranial and neck MRA. Contrast media: Used Small old infarction in left side medulla. Microbleed in right parietal lobe. Stenosis in right carotid bulb and right distal VA. Steno-occlusion in left VA. Stenosis in left proximal ICA, left cavernous ICA. IMP: No interval change ④조영제 Dotarem inj[20ml/Syringe] [Meglumine gadoterate 376.9mg/ml] [20ml/Syringe]:1 안성수/안성수/안성수 전자서명자: 안성수 1/1 출력일: 2025-04-11 출력자: 김경미 세브란스병원 SEVERANCE HOSPITAL 원본대조필 등록번호: 8633158 주민등록번호: 550112-125**** 남/68세 환자명: 이광욱 진료과 내분비내과 주치의 강은석 BP(S) 163mmHg BP(D) 70mmHg HR 91/min 경과 및 Plan CAD(2vd+ LM) s/p CAG (2018.04, 일산백) s/p 4OPCAB(LIMA to dLAD, to OM(seq) to DG with RIMA composite Y, Aorta to rPL with RA) (2018-04-09) Rt. ICA stenosis s/p stent insertion (2018.10.02) PAD s/p PTA c DCB at Rt. SFA (2019.01.28) DM(11yrs) Ex-smoker (30yr, 2년전 중단) Aorta to rPL with RA) Glucose 124 Glycoalbumin 20.9 Glucose (연속) - 식후 2시간 226 HbA1c 7.2 Cholesterol 116 Triglyceride 76 HDL-Cholesterol 50 LDL-Cholesterol (Friedewald) 50.8 Urine Albumin-to-Creatinine Ratio 69.81 >> 운동 및 생활습관 개선 필요함 repeat med 6mof/u 진단명 구분 확진 주진단 확진 기타진단 확진 기타진단 확진 Diabetes mellitus type 2 with dyslipidemia Thyroid nodule Internal carotid artery stenosis 기록자명 강은석 진단명 외래재진기록 2023-01-17 전자서명자: 강은석 1/1 출력일: 2025-04-11 출력자: 김경미 세브란스병원 SEVERANCE HOSPITAL 원본대조필 등록번호: 8633158 주민등록번호: 550112-125**** 남/68세 환자명: 이광욱 외래재진기록 2023-03-22 진료과 심장내과 주치의 안철민 BP(S) 122 mmHg BP(D) 52mmHg HR 88/min Subjective Objective Assessment Plan Good/No interval change Non-HDL Cholesterol 53 LDL-Cholesterol (Friedewald) 39.4 Glucose 134 BUN 19.8 Creatinine 1.06 TMT 10.1 METs, equivocal ABI (Ankle / Brachial Index) 0.84/Lt: 0.82 PAD, s/p PTA 2019.1.28 - IVUS-DCB - - Rt: 0.90 /Lt: 0.84 <==Rt: 0.96/Lt: 0.88 <== Rt: s/p PTA DCB at Rt. SFA[2019-01-28] ABI 1.04/1.09 <== 0.69/0.99 CAD(2vd+ LM) s/p CAG(2018.04, 일산백) s/p 2018-04-09 4OPCAB(LIMA to dLAD, to OM(seq) to DG with RIMA composite Y, Aorta to rPL with RA) DM herben 일년 정도 사용 - 유경종 교수님 - radial graft HTN Repeat med 3개월 후 local refer 2yr EKG/CXR/LAB/full(비급여 설명드림) 진단명 구분 확진 주진단 확진 Unstable angina |기타진단 확진 Coronary artery disease (left main) |기타진단 확진 Coronary artery disease (2 vessel disease) 기록자명 안철민 전자서명자: 안철민 세브란스병원 SEVERANCE HOSPITAL 진단명 1/1 출력일: 2025-04-11 출력자: 김경미 원본대조필 등록번호: 8633158 주민등록번호: 550112-125****남/70세 환자명: 이광욱 검사결과 1. ABI (Ankle/ Brachial Index) - Rt: 0.80 /Lt: 0.72 1-1. TBI (Toe Brachial Index) - Rt: 0.51/Lt: 0.33 Impression Name Image 1 0.5- 0- Patient name: 012 Patient ID: 8633158 Gender: R Thigh PVR E 0.5- 0- 0.98 124] 127 1.00 -0.5- 기능검사결과(I/F형) 2025-03-19 Exam Date/Time: 19-03-2025 10:27 Examiner: Ref Physician: L Thigh -3.5- 45 P=59 HR-73 Amp-1.060 RT-232 Sc=x4 G=6 R BI Knee PVR 0.99 126 131 1.03 0.5- 0.5- 0.90 114 113 89 0- 0- -05- 4s R P=56 HR=72 Amp=1.248 RT=264 Sc=x4 G=6 R Ankle 0.80 10192 0.72 0.75 95 OP 90 0.71 0.79 100 103 0.81 0.51 65 42 0.33 -0.5- PVR 0.5- L Ankle 0.5- 0- -0.5- 0.5 0- -0.5- 0- -0.5- 4s P=57 HR=75 Amp=0.678 RT=236 Sc=x4 G=6 R Metatarsal PVR 0.5 0- -0.5- 4s P=62 HR 75 Amp=0.270 RT-244 Sc=x4 G=6 R Toe 1 A ниш 0- -10- 45 HR 73 Amp=17.4 RT=282 Sc=x4 G=4 판독의(1차) 이찬주 판독의(2차) 안철민 전자서명자: 이재인 세브란스병원 SEVERANCE HOSPITAL VIASONIX 0- -10- PVR 4s P=59 HR=73 Amp=0.938 RT=264 Sc=x4 G=6 L BI Knee PVR ни 45 P=57 HR=72 Amp=1.185 RT=238 Sc=x4 G=6 PVR ми P=55 HR=N/A Amp=N/A RT=N/A Sc=x4 G=6 L Metatarsal PVR 45 P=58 HR=N/A Amp=N/A RT=N/A Sc=x4 G=6 L Toe 1 ми 4s HR 73 Amp=20.4 RT=282 Sc=x4 G=4 Page 1 of 1 1/1 출력일: 2025-04-11 출력자: 김경미 원본대조필 등록번호: 8633158 주민등록번호: 550112-125**** 남/64세 환자명: 이광욱 C-sec: cesarean section CVA cerebrovascular accident CVA tenderness costovertebral angle DM diabetes mellitus DOE dyspnea on exertion ECOG eastern cooperative oncology group HEENT: head, ear, eye, nose and throat NSVD normal spontaneous vaginal delivery PAOD peripheral arterial occlusive disease : PMI point of maximum impulse PR: pulse rate Pul. Tbc pulmonary tuberculosis RHB regular heart beat 전자서명자: 안철민 세브란스병원 SEVERANCE HOSPITAL 입원기록 2019-01-27 5/5 출력일: 2025-04-11 출력자: 김경미 원본대조필 등록번호: 8633158 주민등록번호: 550112-125****남/64세 환자명: 이광욱 진료과 심장내과 주치의 안철민 경과 계획 >>PTA CAD(2vd+ LM) s/pCAG(2018.04, 일산백) s/p_20182-04-09 4OPCAB(LIMA to dLAD, to OM(seq) to DG with RIMA composite Y, Aorta to rPL with RA) DM s/p carotid stenting @ CT angio Multifocal stenosis with calcifications in both SFA and both ATA. Diffuse atherosclerosis with calcification, infrarenal aorta. Varicose vein, left calf. No evidence of DVT. Otherwise unremarkable. PTA 치료계획: 주치의가 환자의 치료계획을 확인함. 주치의 Comment 주치의가 회진을 돌아 환자의 상태를 확인하였고 처방상태를 확인 후 환자에게 현재 상태를 설명함. 치료계획 + Problem 부 E Acute myocardial infarction, ST elevation E PAOD 기록자명 권혜란 Goal PTA PTA 목표일 수정목표일 계획일 2019-01-28 2019-01-27 2019-01-28 전자서명자: 안철민 1/1 세브란스병원 SEVERANCE HOSPITAL 2019-01-27 출력일: 2025-04-11 경과기록 2019-01-27 출력자: 김경미 원본대조필 등록번호: 8633158 주민등록번호: 550112-125****남/64세 환자명: 이광욱 진료과 심장내과 주치의 안철민 경과 계획 >>PTA CAD(2vd+ LM) s/p CAG(2018.04, 일산백) s/p_20182-04-09 40PCAB(LIMA to dLAD, to OM(seq) to DG with RIMA composite Y, Aorta to rPL with RA) DM s/p carotid stenting @ CT angio Multifocal stenosis with calcifications in both SFA and both ATA. Diffuse atherosclerosis with calcification, infrarenal aorta. Varicose vein, left calf. No evidence of DVT. Otherwise unremarkable. @PTA(19.1.28) PTA 치료계획: 주치의가 환자의 치료계획을 확인함. 주치의 Comment 치료계획 + Problem 부 E Acute myocardial 주치의가 회진을 돌아 환자의 상태를 확인하였고 처방상태를 확인 후 환자에게 현재 상태를 설명함. Goal PTA 목표일 수정목표일 계획일 2019-01-28 2019-01-27 infarction, ST elevation E PAOD 기록자명 권혜란 전자서명자: 안철민 세브란스병원 SEVERANCE HOSPITAL PTA 2019-01-28 1/1 2019-01-27 출력일: 2025-04-11 경과기록 2019-01-28 출력자: 김경미 원본대조필 등록번호: 8633158 주민등록번호: 550112-125**** 남/64세 환자명: 이광욱 경과 계획 [Puncture site assessment]: POD #0 1. Lt.CFA (Proglide) 1) Bleeding/Oozing (-) 2) Hematoma/Color change (-/-) 3) Distal assessment: Color/Pulse/Temperature change (-/-/-) * Lt.DPA (2+) 4) Infection sign (-) 5) Puncture site pulse check (2+) +) Pulse examination * 0-absent/1+ diminished/2+ normal/3+ bounding 천자부위가 점점 부어오르는 느낌이나 거즈 위로 피가 배어나오거나 흐르는 경우, 갑자기 어지럽거나 통증 및 불편감 심해지는 경우 즉시 의료진에게 알리도록 환자와 보호자 교육함. Puncture site close monitoring 4hrs ABR 기록자명 김지영 전담간호사 경과기록 2019-01-28 전자서명자: 김지영 1/1 출력일: 2025-04-11 출력자: 김경미 세브란스병원 SEVERANCE HOSPITAL 원본대조필 등록번호: 8633158 주민등록번호: 550112-125**** 남/64세 환자명: 이광욱 경과 [Puncture site assessment]: POD #1 1. Lt.CFA (Proglide) 1) Bleeding/Oozing (-) 2) Hematoma/Color change (-/-) 3) Distal assessment: Color/Pulse/Temperature change (-/-/-) Lt.DPA (2+) 4) Infection sign (-) 5) Puncture site pulse check (2+) 6) Bruit(+)/ Thrill (-) 7) 기존 compressive Dx 제거 후 betadine ball로 소독함. Medress #1로 새로 DX 시행함. +) Pulse examination * 0-absent/1+ diminished/2+ normal/3+ bounding 퇴원 후 천자부위 통증 증가, 부종, 감염의 징후, 말초부위 피부색 변 화, 상처 악화 등이 있을 경우 병원 내원하거나 연락하시도록 환자와 보호자 교육함. 계획 f/u 기록자명 김지영 전담간호사 경과기록 2019-01-29 전자서명자: 김지영 1/1 출력일: 2025-04-11 출력자: 김경미 세브란스병원 SEVERANCE HOSPITAL 원본대조필 등록번호: 8633158 주민등록번호: 550112-125**** 남/64세 환자명: 이광욱 연령 구분 분류 영유아기 학령전기 학령기 일반 산모 ㅇ정신 청소년기 성인 현병력 주 증상 및 내원 과정 Hx. DM, HTN, dyslipidemia, Unstable angina, CAOD, (2018.04), s/p CABG(2018.04), Rt. ICA stent insertion(2018.09) PTA 위해 입원함. 복용중인 약 투약 상태 개수 약명 횟수 용법 약품 코드 개수 단위 Aspirin protect [100 mg/1 T 1 PO 아침 식후 D2ASPI01 Glupa (48hr 전후 조영제 1 T 1 PO 아침 식후 D2GLUP02 병용금기) [500 mg/T] Herben [30 mg/T) 1 T 2 PO D2HERBO1 Lipitor [80 mg/T] 1 T 1 PO 아침 식후 D2LIPI12 Lozasartan(원외) [100 1 T 1 PO 아침 식후 DZLOZA02 mg/T] Platless [75 mg/T] 1 T 1 PO 아침 식후 D2PLAT01 Rabiet [10mg/T] 1 T 1 Sigmart [5 mg/T] 1 T 2 22 PO 아침 식전 D2RABI01 PO D2SIGM01 Xigduo XR 10/1000 (원 1 T 1 PO 아침 식후 D2XIGD02 외,48hr 전후 조영제 병용 금기) [1/1] 간호정보조사 2019-01-27 통증 통증 없음 있음 입원 전에 있었음 과거력 과거력 무 유 입원 및 수술 이력 없음 과거병력 고혈압 당뇨 □ 결핵 □암 □ 간염 있음 잘모름 경련 | 기타 CAOD 2vd s/pCABG 과거력(입원 및 수술) 입원시 진단명 및 수술명 입원 및 수술 시기 CAOD 2vd s/pCABG 2018.4월 Rt. ICA stent insertion 2018.09 s/p CAG 전자서명자: 김은경 세브란스병원 SEVERANCE HOSPITAL (2018.04, 일산백) 1/5 출력일: 2025-04-11 출력자: 김경미 원본대조필 등록번호: 8633158 주민등록번호: 550112-125****남/64세 환자명 : 이광욱 간호정보조사 2019-01-27 Allergy Allergy 없음 □ 약 □ 음식 기능 평가 일상생활(ADL) 수행 능력 독립적 수행 부분 보조 필요 완전 보조 보조기(이동) 사용 없음 ㅇ 목발 ㅇ 지팡이 Owalker 휠체어 ㅇ기타 *이동시 주로 사용하는 보조기를 선택해 주세요. 식사하기 독립적 수행가능 목욕하기 독립적 수행가능 개인 위생 독립적 수행가능 옷입기 독립적 수행가능 화장실 사용 독립적 수행가능 계단 오르기 독립적 수행가능 이동하기 독립적 수행가능(휠체어를 제외한 walking aid 사용 할 수 있음) 이동 하기(의자와 침대간) 독립적 수행가능 이동 하기 (휠체어) 운동 규칙적으로 하는 운동 있음 운동의 종류 걷기 □ 달리기 □ 수영 1등산 골프 기타 운동 횟수 (매일 )회/주 1회 운동 시간 1시간~1시간30 음주력 Onondrinker ex-drinker current drinker 음주력(종류, 양, 횟수/wk) 소주 1병 주 3~4회 음주 시작 시기 20살 끊은 시기 2018.4 흡연력 흡연력 Ononsmoker ex-smoker current smoker 하루의 흡연량 (1)갑/일 흡연 시작시기 20살 끊은 시기 2016년 * 끊은 시기가 1년 이하인 경우 꼭 금연교육을 시행해 주세요. (퇴원전까지) 예방 접종 B형 간염 잘모름 Rubella 잘모름 폐구균 잘모름 영양 상태 1개월간 체중변화 없음 ㅇ 증가함 ㅇ 감소함 체중변화 kg 최근 1주일간 식사량 변화 없음 ㅇ 증가 감소 식이 주의 사항 ) 없음 ㅇ 열량 조절 ㅇ 체중 조절 ㅇ 염분 제한 ○ 수분 제한 ○ 단백질 제한 ㅇ 지방 제한 기타 식습관 식사횟수 3회/일 편식 습관 무 선호 음식 기피 음식 수면 상태 전자서명자: 김은경 세브란스병원 SEVERANCE HOSPITAL 2/5 출력일: 2025-04-11 출력자: 김경미 원본대조필 등록번호: 8633158 주민등록번호: 550112-125**** 남/64세 환자명: 이광욱 수면시간 5시간 수면을 돕는법 무 수면장애 없음 신경계 시간에 대한 지남력 있음 장소에 대한 지남력 있음 사람에 대한 지남력 있음 의사 소통 □ 원만함 어려움 □ 불가능함 □ 기타 정서 상태 지난 2주동안 기분이 가라앉거나, 우울하거나, 희망이 없다고 느낀 기간 ) 없음 2~3일 이상 ○7일 이상 ○ 거의 매일 ○ 확인 불가능 지난 2주동안 평소 하던 일에 대한 흥미가 없어지거나 즐거움을 느끼지 못한 기간 없음 ○ 2~3일 이상 ○7일 이상 ○ 거의 매일 확인불가능 정서 평가 0 *The Patient Health Questionnaire -2(PHQ-2) (2003). 마비 무 유확인 불가능 Weakness 무 확인 불가능 시각 시력 장애 유 시력 장애 시력장애 부위 양안 시력저하 □ 시력상실 □ 복시 □ 반점 □ 통증 안경 |기타 보조기 사용 청각 청력 장애 무 ot 소화기계 소화기 관련 증상 배변 양상 배변 횟수 1회/일 유 대변 색깔 □ 누런색 갈색 □ 녹색 □ 검은색 간호정보조사 2019-01-27 배변 장애 무유 선홍색 |흰색 |기타 배변 조절 조절에 문제 없음 배뇨 양상 배뇨 방법 ? spont voiding Foley catheter ? CIC Kissmo □ 기타 catheter 교환 예정일 배뇨 장애 무 ○ 유 배뇨 조절 조절에 문제 없음 기능평가 100 순환기계 맥박 규칙적임 Pacemaker 없음 부종 없음 있음 순환기 관련증상 없음 있음 호흡기계 호흡양상 Regular ? Irregular Suppressed Labored 기타 호흡기 관련증상 없음 있음 전자서명자 : 김은경 세브란스병원 SEVERANCE HOSPITAL 3/5 출력일: 2025-04-11 출력자: 김경미 원본대조필 등록번호: 8633158 주민등록번호: 550112-125**** 남/64세 환자명 : 이광욱 피부 피부 온도 따뜻함 피부 습도 적당함 피부색 이상없음 피부 변화 무 유 ото ото [Comment] 사망 사망 사망 사망 형: CAOD 사망 사망 PT 간호정보조사 퇴원 퇴원 후 보호자 (Main care giver) 없음 배우자 부 모 □ 자녀 조부 ? 조모 형제자매 간병인 기타 퇴원 예정지 ?자택 친척집 타병원 요양시설 기타 퇴원 예정 교통 수단(Discharge transportation) 자가 대중 교통 항공 □ 구급차 |기타 일반 정보(6세 이상) 교육 정도 고등졸 결혼 상태 결혼 직업 사무직 원목 연락 전화번호 01037588088 원함 원하지 않음 종교 없음 기독교 천주교 불교 기타 보호자 (Main care giver) □ 없음 V배우자 부 자녀 조부 조모 형제 자매 간병인 □ 기타 교육 요구도 환자 보호자 기타 교육 요구 주 사용 언어 한국어 □ 영어 일본어 □ 중국어 □ 러시아어 □ 기타 교육 방법(환자 선호) 구두□ 유인물 □ 시범 보이기 |시청각 매체(가능하다면) 읽고 쓰는데 어려움 없음 □ 있음 □ 기타 원하는 교육 내용 □ 질병 □ 약물 □ 검사 □ 수술 □자가 간호 □ 기타 영양 교육과 진료에 영향을 주는 가치와 신념(Value & belief) 없음 있음 경제적 상태 전자서명자: 김은경 세브란스병원 SEVERANCE HOSPITAL 2019-01-27 4/5 출력일: 2025-04-11 출력자: 김경미 원본대조필 |등록번호: 8633158 주민등록번호: 550112-125****남/64세 환자명: 이광욱 입원비 지불의 어려움 있음 없음 기타 입원비 지불과 관련한 사회 사업팀 상담 필요 있음 없음 기타 간호정보조사 2019-01-27 전자서명자: 김은경 5/5 출력일: 2025-04-11 출력자: 김경미 세브란스병원 SEVERANCE HOSPITAL 원본대조필 등록번호: 8633158 주민등록번호: 550112-125****남/70세 환자명 : 이광욱 검사결과 Impression Image Name 전자서명자: 서동우 세브란스병원 SEVERANCE HOSPITAL 기능검사결과(I/F형) *CAD-2VD, S/POPCAB(2018), DM, HTN *Compare with previous echo (2018.04.16) 1. No RWMA 2. Still enlarged LA(LAVI : 39ml/m2) with normal global LV systolic function (EF: 77%) 3. Relaxation abnormality of LV filling pattern with elevated LV filling pressure (E/e': 10->15) 4. Mild pulmonary hypertension (RVSP: 41mmHg) 5. Slightly dilated sinus of Valsalva (38mm) and ascending aorta (39mm) 1/2 출력일: 2025-04-11 출력자: 김경미 원본대조필 등록번호: 8633158 주민등록번호: 550112-125****남/70세 환자명: 이광욱 기능검사결과(I/F형) ECHOCARDIOGRAPHY LABORATORY, SEVERANCE CARDIOVASCULAR HOSPITAL YONSEI UNIVERSITY COLLEGE OF MEDICINE, SEOUL KOREA Exam Date: 2025-03-19 Patient ID: 8633158 Echo No.: 25 Name: 이광욱 Referring Dr.: 안철민 Sex/Age: M 1 70Y Location: OPD Study Remark: Height 170.0cm Weight 78kg BSA 1.89m2 BP 149/62mmHg 1. Comments 전문심초음파 *CAD-2VD, S/P OPCAB(2018), DM, HTN \"Compare with previous echo (2018.04.16) 1. No RWMA 2. Still enlarged LA(LAVI 39ml/m2) with normal global LV systolic function (EF: 77%) 3. Relaxation abnormality of LV filling pattern with elevated LV filling pressure (E/e: 10->15) 4. Mild pulmonary hypertension (RVSP: 41mmHg) 5. Slightly dilated sinus of Valsalva (38mm) and ascending aorta (39mm) 2. Regional Wall Motion Abnormality: No 3. [LV GLS]: 15-20% 4. Valves: MV Native Slightly thickened AV Native Senile sclerocalcified TV Native Slightly thickened 5. Regurgitation: MR Trivial AR No TR. GI PR No 6. Stenosis: MS No AS No 7. Pericardial Effusion: No TS: Intracardiac Thrombi: No No PS No Mass: No 8. Diastolic function: Relaxation abnormality of LV filling pattern M-mode/2D Measurement RVD (9-26) mm LVEDD (42-54): 51 mm IVSD (8-11): IVSS: 11 mm Ao root (22-33) mm 13 mm LA (AP/ML/SI): 40// mm LVESD (24-36): 29 mm PWD (8-11): 9 mm LA Vol LVEF (55-76): PWS: 13 mm by M-mode: 77 % LVOT (18-22): mm by Biplane. % LV Mass: 188.0 g by prolate ellipse by mod simpson LA Vol index (18-28) ml 76.0 ml TV Annulus: mm LV Mass index: 97.9 g/m2 IVC: mm RWT: 0.35 Echo Score: Doppler Measurement Total M T S C by prolate ellipse: by mod simpson MV Annulus (4C/2C): 39.6 ml/m2 ml/m2 mm Aortic Mitral Tricuspid LVOT (TVI): AV (TVI): cm cm TVI of MR jet: cm TR jet. 2.98 m/sec E (0.6-1): 0.77 m/sec RVSP: 41 mmHg LVOT peak V m/sec A (0.3-0.8): 1.10 m/sec RAP 5 mmHg PSPG/MSPG: 1 mmHg DT (170-210) 224 msec MPAP mmHg AV Peak V: m/sec PHT: msec PVR PSPG/MSPG: 9/5 mmHg MDPG: mmHg MDPG mmHg AVA by 2D HR: /min RVOT VTI cm by continuity: cm2 MVA by 2D: cm2 Pulmonic PHT of AR jet: msec by PHT: cm2 PSPG/MSPG: mmHg by continuity: cm2 TDI S 11.0 cm/sec E': 5.0 cm/sec A 11.0 RVOT AT: cm/sec m/sec E/E 15.40 Reported by: 서동우 판독의(1차) 서동우 판독의(2차) 심지영 전자서명자: 서동우 세브란스병원 SEVERANCE HOSPITAL Responsible Dr. : 심지영 2/2 출력일: 2025-04-11 출력자: 김경미 원본대조필 등록번호: 8633158 주민등록번호: 550112-125****남/68세 환자명: 이광욱 진료과 내분비내과 주치의 강은석 BP(S) 132 mmHg BP(D) 62 mmHg HR 82/min 경과 및 Plan CAD(2vd+ LM) s/p CAG (2018.04, 일산백) s/p 40PCAB(LIMA to dLAD, to OM(seq) to DG with RIMA composite Y, Aorta to rPL with RA) (2018-04-09) Rt. ICA stenosis s/p stent insertion (2018.10.02) PAD s/p PTA c DCB at Rt. SFA (2019.01.28) DM(11yrs) Ex-smoker (30yr, 2년전 중단) Aorta to rPL with RA) Glucose 114 Glycoalbumin 20.5 Glucose (연속) - 식후 2시간 181 HbA1c 7.2 Cholesterol 112 Triglyceride 57 HDL-Cholesterol 48 LDL-Cholesterol (Friedewald) 52.6 Urine Albumin-to-Creatinine Ratio 42.04 >> repeat med 6mo f/u 진단명 구분 확진 주진단 기타진단 기타진단 Thyroid nodule 확진 Diabetes mellitus type 2 with dyslipidemia 확진 확진 Internal carotid artery stenosis 기록자명 강은석 전자서명자: 강은석 세브란스병원 SEVERANCE HOSPITAL 진단명 외래재진기록 2023-07-18 1/1 출력일: 2025-04-11 출력자: 김경미 원본대조필 등록번호: 8633158 주민등록번호: 550112-125**** 남/69세 환자명: 이광욱 진료과 내분비내과 주치의 김다함 Progress U/S 경부(neck)(Doppler) 2024.01.16 Clinical information: Diabetes mellitus type 2 with dyslipidemia US examination was done with linear transducer> =10 MHz (central frequency). 이전 US와 비교함 Both thyroid gland 에 multiple probably benign nodules 들이 관찰되며 가장 큰 것은 Rt thyroid lower pole의 21mm 크기의 nodule 임. Background echotexture subtle heterogeneous mild diffuse enlarge 001 음.. Both neck에 pathologically enlarged LNs 없음. Doppler ultrasound images 상 특이소견 없음. Imp: Multiple probably benign nodules in both thyroids (K-TIRADS: 3) R/O Diffuse thyroid disease recommend follow up. T3 0.47 Free T4 1.08 TSH 2.12 추가사항 Thyroid nodule Plan 2y f/u 진단명 구분 확진 주진단 확진 Diabetes mellitus type 2 with dyslipidemia |기타진단 확진 Diabetic polyneuropathy |기타진단 확진 Internal carotid artery stenosis 진단명 기록자명 김다함 외래재진기록 2024-01-16 전자서명자: 김다함 1/1 출력일: 2025-04-11 출력자: 김경미 세브란스병원 SEVERANCE HOSPITAL 원본대조필 등록번호: 8633158 주민등록번호: 550112-125**** 남/69세 환자명: 이광욱 진료과 내분비내과 주치의 강은석 BP(S) 142 mmHg BP(D) 62 mmHg HR 77/min 경과 및 Plan CAD(2vd+ LM) s/p CAG (2018.04, 일산백) s/p 40PCAB(LIMA to dLAD, to OM(seq) to DG with RIMA composite Y, Aorta to rPL with RA) (2018-04-09) Rt. ICA stenosis s/p stent insertion (2018.10.02) PAD s/p PTA DCB at Rt. SFA (2019.01.28) DM(11yrs) Ex-smoker (30yr, 2년전 중단) Aorta to rPL with RA) Glucose 106 Glycoalbumin20.0 Glucose (연속) - 식후 2시간 177 HbA1c 7.0 Cholesterol 104 Triglyceride 77 HDL-Cholesterol 42 LDL-Cholesterol (Friedewald) 46.6 Urine Albumin-to-Creatinine Ratio 69.15 가끔씩 졸린 증상? >> 식습관 꾸준히 관리해보시고, 식후 1시간 자가혈당 측정해보세요. repeat med 6mo f/u 진단명 구분 확진 주진단 확진 Diabetes mellitus type 2 with dyslipidemia |기타진단 확진 Diabetic polyneuropathy |기타진단 확진 Internal carotid artery stenosis 기록자명 강은석 전자서명자: 강은석 세브란스병원 SEVERANCE HOSPITAL 진단명 외래재진기록 2024-01-16 1/1 출력일: 2025-04-11 출력자: 김경미 원본대조필 | 등록번호: 8633158 주민등록번호: 550112-125****남/69세 환자명: 이광욱 진료과 내분비내과 주치의 강은석 BP(S) mmHg BP(D) mmHg HR /min 경과 및 Plan 진단명 구분 확진 CAD(2vd+ LM) s/p CAG (2018.04, 일산백) s/p 40PCAB(LIMA to dLAD, to OM(seq) to DG with RIMA composite Y, Aorta to rPL with RA) (2018-04-09) Rt. ICA stenosis s/p stent insertion (2018.10.02) PAD s/p PTA c DCB at Rt. SFA (2019.01.28) DM(11yrs) Ex-smoker (30yr, 2년전 중단) Aorta to rPL with RA) Glucose 121 Glycoalbumin23.6 Glucose (연속) - 식후 2시간 116 HbA1c 6.9 Cholesterol 115 Triglyceride 57 HDL-Cholesterol 51 LDL-Cholesterol (Friedewald) 52.6 Urine Albumin-to-Creatinine Ratio 36.11 >> repeat med 6mo f/u 주진단 확진 Diabetes mellitus type 2 with dyslipidemia 확진 Thyroid nodule 기타진단 기타진단 확진 Internal carotid artery stenosis 기록자명 강은석(의사) 전자서명자: 강은석 세브란스병원 SEVERANCE HOSPITAL 진단명 외래재진기록 2024-07-16 1/1 출력일: 2025-04-11 출력자: 김경미 원본대조필 등록번호: 8633158 주민등록번호: 550112-125**** 남/69세 환자명: 이광욱 외래재진기록 2024-10-01 진료과 신경과 주치의 남효석 Subjective Brain MRI and MRA 2024-09-12 Small old infarction in left side medulla. Stenosis in right carotid bulb and right distal VA. Steno-occlusion in left VA. Stenosis in left proximal ICA, left cavernous ICA. --> 비슷하십니다. 평소에 괜찮음. 운전하고 내릴 때 어찔함. <5초 - 2022-09-14 에 비해서 Rt distal VA stenosis 가 심해짐. one-way 라서 우려됨. LDL-Cholesterol (Friedewald) 52.6 Objective Assessment Plan plavix, 아모잘탄 Q (로수바 20 복합제) ▶아스피린 추가 Stroke 발생 Cerebral infarction Hemorrhage stroke Unknown stroke TIA Stroke 발생 날짜 Stroke Comment CAOD 발생 ? Acute MI ? Unstable angina PTCA/stent CABG Others CAOD 발생 날짜 CAOD 발생 Comment 전자서명자: 남효석 세브란스병원 SEVERANCE HOSPITAL 1/3 출력일: 2025-04-11 출력자: 김경미 원본대조필 등록번호: 8633158 주민등록번호: 550112-125****남/69세 환자명: 이광욱 외래재진기록 2024-10-01 121067Y|M 8633158 Study Date 2022-09-14 A1069Y|M 8633158 Study Date 2024-09-12 AR 전자서명자: 남효석 세브란스병원 SEVERANCE HOSPITAL B1050mm RF 2/3 출력일: 2025-04-11 출력자: 김경미 원본대조필 등록번호: 8633158 주민등록번호: 550112-125**** 남/69세 환자명: 이광욱 진단명 구분 확진 HP Bricktha Study Date 202409 12 LH 11069YM 8633158 Study Dale 2024-09-12 503 18m RA 주진단 확진 Internal carotid artery stenosis HP 기타진단 확진 기타진단 확진 Coronary artery disease (2 vessel disease) Unstable angina 기록자명 남효석(의사) 전자서명자: 남효석 세브란스병원 SEVERANCE HOSPITAL 진단명 외래재진기록 2024-10-01 3/3 출력일: 2025-04-11 출력자: 김경미 원본대조필 등록번호: 8633158 주민등록번호: 550112-125****남/70세 환자명: 이광욱 진료과 내분비내과 주치의 강은석 BP(S) 170mmHg BP(D) 50mmHg HR 103/min 경과 및 Plan CAD(2vd+ LM) s/p CAG (2018.04, 일산백) s/p 40PCAB(LIMA to dLAD, to OM(seq) to DG with RIMA composite Y, Aorta to rPL with RA) (2018-04-09) Rt. ICA stenosis s/p stent insertion (2018.10.02) PAD s/p PTA c DCB at Rt. SFA (2019.01.28) DM(11yrs) Ex-smoker (30yr, 2년전 중단) Aorta to rPL with RA) Glucose 132 20.1 Glycoalbumin Glucose (연속) - 식후 2시간 235 HbA1c 6.8 Total cholesterol 112 Triglyceride 70 HDL-Cholesterol 56 LDL-Cholesterol (Friedewald) 42 Urine Albumin-to-Creatinine Ratio 63.99 체중 이전과 비슷함 >> repeat med 6mo f/u 진단명 구분 확진 주진단 확진 기타진단 확진 기타진단 확진 Diabetes mellitus type 2 with dyslipidemia Diabetic polyneuropathy 진단명 Internal carotid artery stenosis 기록자명 강은석(의사) 전자서명자: 강은석 세브란스병원 SEVERANCE HOSPITAL 외래재진기록 2025-01-14 1/1 출력일: 2025-04-11 출력자: 김경미 원본대조필 등록번호: 8633158 주민등록번호: 550112-125****남/70세 환자명: 이광욱 진료과 심장내과 주치의 안철민 BP(S) 131 mmHg BP(D) 56mmHg HR 86/min Subjective Good/No interval change Objective Non-HDL Cholesterol 50 Assessment LDL-Cholesterol (Friedewald) 34.8 외래재진기록 일산21세기병원 약) Platless 75mg qd, Amosartan Q5/100/20mg qd, Sigmart 5mg bid, Herben 30mg bid ABI (Ankle / Brachial Index) - Rt: 0.80 /Lt: 0.72 <=-Rt: 0.90 /Lt: 0.84 <== Rt: 0.96 /Lt: 0.88 <==Rt: 0.84/Lt: 0.82 echo *CAD-2VD, S/P OPCAB(2018), DM, HTN *Compare with previous echo (2018.04.16) 1. No RWMA 2. Still enlarged LA(LAVI: 39ml/m2) with normal global LV systolic function (EF: 77%) 3. Relaxation abnormality of LV filling pattern with elevated LV filling pressure (E/e': 10->15) 4. Mild pulmonary hypertension (RVSP: 41mmHg) 5. Slightly dilated sinus of Valsalva (38mm) and ascending aorta (39mm) TMT 10.1 METS equivocal PAD, s/p PTA 2019.1.28 - IVUS-DCB - s/p PTA CDCB at Rt. SFA[2019-01-28] ABI 1.04/1.09 <== 0.69/0.99 CAD(2vd+ LM) s/pCAG(2018.04, 일산백) s/p 2018-04-09 4OPCAB(LIMA to dLAD, to OM(seq) to DG with RIMA composite Y, Aorta to rPL with RA) DM herben 일년 정도 사용 - 유경종 교수님 - radial graft HTN Plan 2yr EKG/CXR/LAB/full(비급여 설명드림) 진단명 구분 확진 진단명 주진단 확진 Unstable angina |기타진단 확진 Peripheral arterial occlusive disease (lower extremities) |기타진단 확진 Coronary artery disease (2 vessel disease) 전자서명자: 안철민 세브란스병원 SEVERANCE HOSPITAL 2025-03-26 1/2 출력일: 2025-04-11 출력자: 김경미 원본대조필 등록번호: 8633158 주민등록번호: 550112-125****남/70세 환자명 : 이광욱 외래재진기록 2025-03-26 기록자명 안철민(의사) 전자서명자: 안철민 세브란스병원 SEVERANCE HOSPITAL 2/2 출력일: 2025-04-11 출력자: 김경미 원본대조필 등록번호: 8633158 주민등록번호: 550112-125**** 남/70세 환자명: 이광욱 진료과 신경과 주치의 남효석 Subjective Objective Assessment Plan Rt distal VA stenosis 가 진행한 것 같습니다. 위험석이 커서 증상이 있으면 스텐트 고려하겠습니다. Stroke 발생 Cerebral infarction Hemorrhage stroke Unknown stroke TIA Stroke 발생 날짜 Stroke Comment CAOD 발생 Acute MI ? Unstable angina PTCA/stent CABG Others CAOD 발생 날짜 CAOD 발생 Comment 전자서명자: 남효석 세브란스병원 SEVERANCE HOSPITAL 8633158M070YCT Brain + Angio (Brain+Neck) (contrast 2025-03-19 13 08:17 AL 외래재진기록 2025-03-26 1/3 출력일: 2025-04-11 출력자: 김경미 원본대조필 | 등록번호: 8633158 주민등록번호: 550112-125****남/70세 환자명 : 이광욱 전자서명자: 남효석 세브란스병원 SEVERANCE HOSPITAL JOYCT Brain + Angio (Brain+Neck) (contrast)2025-03-19 13:08:17 HR M070YCT Brain + Angio (Brain+Neck) (contrast)2025-03-19 13:08 17 A 외래재진기록 2025-03-26 2/3 출력일: 2025-04-11 출력자: 김경미 원본대조필 등록번호: 8633158 주민등록번호: 550112-125****남/70세 환자명 : 이광욱 BOYCT Brain + Angio (Brain+Neck) (contrast)2025-03-19 13:08:17 A 진단명 구분 확진 진단명 주진단 확진 기타진단 확진 Unstable angina Internal carotid artery stenosis 기타진단 확진 Coronary artery disease (2 vessel disease) 기록자명 남효석(의사) 전자서명자: 남효석 세브란스병원 SEVERANCE HOSPITAL 외래재진기록 2025-03-26 3/3 출력일: 2025-04-11 출력자: 김경미 원본대조필 진료비 세부산정내역(외래) 환자등록번호 8633158 환자성명 이광욱 환자구분 건강"
        }
      ],
      "medicalRecords": [
        {
          "date": "2025-03-24",
          "hospital": "미확인 의료기관",
          "visitDate": "2025-03-24",
          "reason": "정기 진료",
          "diagnosis": "미확인",
          "notes": ""
        },
        {
          "date": "2003-12-08",
          "hospital": "미확인 의료기관",
          "visitDate": "2003-12-08",
          "reason": "정보 국적 직업/업종 주민번호 고객과의 관계 신분증사본 징구여부 연락처 [ 여/ 부 실명확인 (택일) 월 주민등록증(www.minwon.go.kr) ㄷ 외국인등록증(www.hikorea.go.kr) 발급기관/면허번호/ 발행국가 년 운전면허증(www.safedriving.or.kr) 「여권 [ 기타[ ] 발급일 일 모집인(면담자): 김선형 출금금융기관명 국민카드 출금계좌(카드)번호",
          "diagnosis": "미확인",
          "notes": "[ ] 발급일 일 모집인(면담자): 김선형 출금금융기관명 국민카드 출금계좌(카드)번호"
        },
        {
          "date": "2009-10-01",
          "hospital": "유선신청, 우편신청 또는 인터넷 신청 등에 의하여도 가능합니다. 모집점 모집자 금촌농협 김선형 (",
          "visitDate": "2009-10-01",
          "reason": "입금계좌 은행 예금주(계약자) : 계좌번호 1. 계약자는 보험증권을 받은 날 부터 15일이내에 청약을 철회할 수 있습니다. 다만, 전문금융소비자가 체결한 보험계약, 청약일부터 30일 초과, 회사가 건강상태 진단을 지원하는 계약, 보험기간(보장기 간)이 90일 이내인 계약, 법률에 따라 가입의무 부과 및 해제·해지가 가능한 보험(다만, 계약자가 동종의 다른 보험에 가입한 경우는 제외) 은 청약을 철회할 수 없습니다. 2. 저희 회사는 청약철회 청구서를 접수한 경우 지체없이 이미 납입한 보험료를 돌려드립니다. 3. 청약철회 청구서를 발송한 날 이후(발송일 포함)에 발생한 보험금 지급사유에 대해서는 회사가 책임을 지지 아니하며, 입금처의 거래은행 예금주는 계약자와 동일해야 합니다. ※콜센터 유선신청, 우편신청 또는 인터넷 신청 등에 의하여도 가능합니다. 모집점 모집자 금촌농협 김선형 (",
          "diagnosis": "을 지원하는 계약, 보험기간(보장기 간)이 90일 이내인 계약, 법률에 따라 가입의무 부과 및 해제·해지가 가능한 보험(다만, 계약자가 동종의 다른 보험에 가입한 경우는 제외) 은 청약을 철회할 수 없습니다. 2. 저희 회사는 청약철회 청구서를 접수한 경우 지체없이 이미 납입한 보험료를 돌려드립니다. 3. 청약철회 청구서를 발송한 날 이후(발송일 포함)에 발생한 보험금 지급사유에 대해서는 회사가 책임을 지지 아니하며, 입금처의 거래은행 예금주는 계약자와 동일해야 합니다. ※콜센터 유선신청, 우편신청 또는 인터넷 신청 등에 의하여도 가능합니다. 모집점 모집자 금촌농협 김선형 (",
          "notes": ""
        },
        {
          "date": "",
          "hospital": "미확인 의료기관",
          "reason": "정기 진료",
          "diagnosis": "또는 치료 사실 등 중요한 내용을 (알릴의무) 구두 로만 알릴 경우 계약전 알릴 의무를 이행한 것으로 인정되지 않아 향후 계약이 해지 되거나 보험금을 (구두) (해지) 지급받지 못할 수 있습니다. ?보험계약자 이조훈 (은)는 보험모집자 김선형 (으)로부터 계약전 알릴의무 위반시의 효과(계약해지, 보장제한, 보험금 미지급 등)에 대해 설명을 들었으며, 계약전 알릴의무 사항에 대해 청약서에 사실대로 기재하였음을 확인합니다. 위의 각 계약 전 알릴 의무 사항에 대한 하며, 보험계약자 및 피보험자(보험대상자) 본인이 직접 답변 내용은 사실과 일치 (답변내용은 사실과 일치) 작성하였음을 확인합니다. 또한 회사가 위 사항과 관련하여 필요시에는 별도의 확인을 할 수 있으며 의사에게 본인의 질병 등의 건강 상태를 조회하거나 열람토록 하는것에 동의합니다. 자필서명 구분 보험계약자 피보험자 성명 이조훈 이광욱 서명 이조훈 법정대리인 1 (친권자) 관계 법정대리인 2(친권자) 관계 법정대리인(친권자) 1인이 서명한 경우 본인은 다른 법정대리인(친권자) 1인과 합의하에 공동으로 친권을 행사합니다. 이관욱 피보험자(보험대상자) 본인이 자필서명을 하지 않으신 경우에는 보험계약이 무효가 되어 보장을 받지 못할 수도 있습니다. 보험계약자 또는 피보험자(보험대상자)가 미성년자인 경우 법정대리인이 서명하여 주시기 바랍니다. LW",
          "notes": ""
        },
        {
          "date": "2024-12-11",
          "hospital": "미확인 의료기관",
          "visitDate": "2024-12-11",
          "reason": "정기 진료",
          "diagnosis": "미확인",
          "notes": ""
        },
        {
          "date": "2025-03-19",
          "hospital": "미확인 의료기관",
          "visitDate": "2025-03-19",
          "reason": "정기 진료",
          "diagnosis": "미확인",
          "notes": ""
        },
        {
          "date": "",
          "hospital": "1644- 9000 ※추가서류제출: 스캔 또는 심사자 개인 팩스로 전송하시길 바랍니다. 0301 0001 0101 CL",
          "reason": "정기 진료",
          "diagnosis": "미확인",
          "notes": ""
        },
        {
          "date": "",
          "hospital": "의무기록사본 총 1부 (표지제외) 빈경환 UNIVER 세브란스병원 SEVERANCE HOSPITAL 발행번호: 등록번호: 2025-41122 8633158 환자성명: 용도: 발급매수: 이광욱 보험회사제출 123 매 의무기록 사본 증명서 이 사본은 의무기록 원본과 틀림이 없음을 증명합니다. 이 사본은 위의 용도 외에는 사용할 수 없습니다. 의무기록 사본 증명서",
          "reason": "정기 진료",
          "diagnosis": "미확인",
          "notes": ""
        },
        {
          "date": "2025-04-11",
          "hospital": "병원 세브란스병원 SEVERANCE HOSPITAL 등록번호: 8633158 주민등록번호: 550112-125**** 남/63세 환자명: 이광욱 외래재진기록",
          "visitDate": "2025-04-11",
          "reason": "정기 진료",
          "diagnosis": "미확인",
          "notes": ""
        },
        {
          "date": "",
          "hospital": "SEVERANCE HOSPITAL Conjunctiva not pale Lips & tongues not dried 2/5 출력일:",
          "reason": "정기 진료",
          "diagnosis": "미확인",
          "notes": ""
        },
        {
          "date": "",
          "hospital": "SEVERANCE HOSPITAL ICS: impulse conducting system(of the heart) LMCL left midclavicular line LNs lymph nodes LOM limitation of motion 4/5 출력일:",
          "reason": "정기 진료",
          "diagnosis": "미확인",
          "notes": ""
        },
        {
          "date": "",
          "hospital": "SEVERANCE HOSPITAL 기능검사결과(I/F형)",
          "reason": "정기 진료",
          "diagnosis": "미확인",
          "notes": "1. ABI (Ankle / Brachial Index) - Rt: 0.90 /Lt: 0.84 1-1. TBI (Toe / Brachial Index)- Rt: 0.39/Lt: 0.36 Impression Name Image 1 전자서명자: 모혜인 세브란스병원 SEVERANCE HOSPITAL 기능검사결과(I/F형)"
        },
        {
          "date": "",
          "hospital": "SEVERANCE HOSPITAL 원본대조필 등록번호: 8633158 주민등록번호: 550112-125**** 남/67세 환자명 : 이광욱 진료과 내분비내과 주치의 강은석 BP(S) 150mmHg BP(D) 58 mmHg HR 89/min 경과 및 Plan 진단명 구분 확진 CAD(2vd+ LM) s/p CAG (2018.04, 일산백) s/p 4OPCAB(LIMA to dLAD, to OM(seq) to DG with RIMA composite Y, Aorta to rPL with RA) (",
          "reason": "정기 진료",
          "diagnosis": "구분 확진 CAD(2vd+ LM) s/p CAG (2018.04, 일산백) s/p 4OPCAB(LIMA to dLAD, to OM(seq) to DG with RIMA composite Y, Aorta to rPL with RA) (",
          "notes": ""
        },
        {
          "date": "",
          "hospital": "미확인 의료기관",
          "reason": "정기 진료",
          "diagnosis": "확진 Diabetes mellitus type 2 with dyslipidemia 기타진단 확진 Thyroid nodule 기타진단 확진 Internal carotid artery stenosis 기록자명 강은석 진단명 외래재진기록",
          "notes": "진단 확진 Thyroid nodule 기타진단 확진 Internal carotid artery stenosis 기록자명 강은석 진단명 외래재진기록"
        },
        {
          "date": "",
          "hospital": "SEVERANCE HOSPITAL 원본대조필 등록번호: 8633158 주민등록번호: 550112-125****남/67세 환자명: 이광욱 외래재진기록",
          "reason": "정기 진료",
          "diagnosis": "미확인",
          "notes": ""
        },
        {
          "date": "",
          "hospital": "미확인 의료기관",
          "reason": "없음 PAD, S/P PTA",
          "diagnosis": "구분 확진 주진단 기타진단 기타진단 확진 확진 확진 BP(D) mmHg chest pain / discomfort (-/-) dyspnea / DOE (-/-) palpitation (-) functional capacity >4METS 잘지냈다. 증상없음 PAD, S/P PTA",
          "notes": "진단 기타진단 확진 확진 확진 BP(D) mmHg chest pain / discomfort (-/-) dyspnea / DOE (-/-) palpitation (-) functional capacity >4METS 잘지냈다. 증상없음 PAD, S/P PTA"
        },
        {
          "date": "",
          "hospital": "1/1 출력일:",
          "reason": "정기 진료",
          "diagnosis": "HR : Heart Rate BP(S) : Blood Pressure (Systolic) med Medication 전자서명자: 최기정 세브란스병원 1/1 출력일:",
          "notes": ""
        },
        {
          "date": "",
          "hospital": "SEVERANCE HOSPITAL 원본대조필 등록번호: 8633158 주민등록번호: 550112-125**** 남/67세 환자명: 이광욱 진단명 구분 확진 주진단 확진 |기타진단 확진 |기타진단 확진 Internal carotid artery stenosis Unstable angina Coronary artery disease (2 vessel disease) 진단명 기록자명 홍순호 외래재진기록",
          "reason": "정기 진료",
          "diagnosis": "구분 확진 주진단 확진 |기타진단 확진 |기타진단 확진 Internal carotid artery stenosis Unstable angina Coronary artery disease (2 vessel disease) 진단명 기록자명 홍순호 외래재진기록",
          "notes": "진단 확진 |기타진단 확진 Internal carotid artery stenosis Unstable angina Coronary artery disease (2 vessel disease) 진단명 기록자명 홍순호 외래재진기록"
        },
        {
          "date": "",
          "hospital": "SEVERANCE HOSPITAL 원본대조필 등록번호: 8633158 주민등록번호: 550112-125**** 남/69세 환자명: 이광욱 영상검사 CT& MR 영상검사 CT& MR 검사명 MRI Brain & Angio 3D(Neck포함) (contrast) 검사방법 검사일자 판독일자",
          "reason": "정기 진료",
          "diagnosis": "미확인",
          "notes": ""
        },
        {
          "date": "",
          "hospital": "SEVERANCE HOSPITAL 원본대조필 등록번호: 8633158 주민등록번호: 550112-125**** 남/68세 환자명: 이광욱 진료과 내분비내과 주치의 강은석 BP(S) 163mmHg BP(D) 70mmHg HR 91/min 경과 및 Plan CAD(2vd+ LM) s/p CAG (2018.04, 일산백) s/p 4OPCAB(LIMA to dLAD, to OM(seq) to DG with RIMA composite Y, Aorta to rPL with RA) (",
          "reason": "정기 진료",
          "diagnosis": "미확인",
          "notes": ""
        },
        {
          "date": "",
          "hospital": "미확인 의료기관",
          "reason": "정기 진료",
          "diagnosis": "구분 확진 주진단 확진 기타진단 확진 기타진단 확진 Diabetes mellitus type 2 with dyslipidemia Thyroid nodule Internal carotid artery stenosis 기록자명 강은석 진단명 외래재진기록",
          "notes": "진단 확진 기타진단 확진 Diabetes mellitus type 2 with dyslipidemia Thyroid nodule Internal carotid artery stenosis 기록자명 강은석 진단명 외래재진기록"
        },
        {
          "date": "",
          "hospital": "SEVERANCE HOSPITAL 원본대조필 등록번호: 8633158 주민등록번호: 550112-125**** 남/68세 환자명: 이광욱 외래재진기록",
          "reason": "정기 진료",
          "diagnosis": "미확인",
          "notes": ""
        },
        {
          "date": "",
          "hospital": "SEVERANCE HOSPITAL 진단명 1/1 출력일:",
          "reason": "정기 진료",
          "diagnosis": "구분 확진 주진단 확진 Unstable angina |기타진단 확진 Coronary artery disease (left main) |기타진단 확진 Coronary artery disease (2 vessel disease) 기록자명 안철민 전자서명자: 안철민 세브란스병원 SEVERANCE HOSPITAL 진단명 1/1 출력일:",
          "notes": "진단 확진 Coronary artery disease (left main) |기타진단 확진 Coronary artery disease (2 vessel disease) 기록자명 안철민 전자서명자: 안철민 세브란스병원 SEVERANCE HOSPITAL 진단명 1/1 출력일:"
        },
        {
          "date": "",
          "hospital": "SEVERANCE HOSPITAL VIASONIX 0- -10- PVR 4s P=59 HR=73 Amp=0.938 RT=264 Sc=x4 G=6 L BI Knee PVR ни 45 P=57 HR=72 Amp=1.185 RT=238 Sc=x4 G=6 PVR ми P=55 HR=N/A Amp=N/A RT=N/A Sc=x4 G=6 L Metatarsal PVR 45 P=58 HR=N/A Amp=N/A RT=N/A Sc=x4 G=6 L Toe 1 ми 4s HR 73 Amp=20.4 RT=282 Sc=x4 G=4 Page 1 of 1 1/1 출력일:",
          "reason": "정기 진료",
          "diagnosis": "미확인",
          "notes": ""
        },
        {
          "date": "",
          "hospital": "미확인 의료기관",
          "reason": "정기 진료",
          "diagnosis": "미확인",
          "prescription": "상태를 확인 후 환자에게 현재 상태를 설명함. 치료계획 + Problem 부 E Acute myocardial infarction, ST elevation E PAOD 기록자명 권혜란 Goal PTA PTA 목표일 수정목표일 계획일",
          "notes": ""
        },
        {
          "date": "",
          "hospital": "SEVERANCE HOSPITAL",
          "reason": "정기 진료",
          "diagnosis": "미확인",
          "notes": ""
        },
        {
          "date": "",
          "hospital": "미확인 의료기관",
          "reason": "정기 진료",
          "diagnosis": "미확인",
          "prescription": "상태를 확인 후 환자에게 현재 상태를 설명함. Goal PTA 목표일 수정목표일 계획일",
          "notes": ""
        },
        {
          "date": "",
          "hospital": "SEVERANCE HOSPITAL PTA",
          "reason": "정기 진료",
          "diagnosis": "미확인",
          "notes": ""
        },
        {
          "date": "",
          "hospital": "SEVERANCE HOSPITAL 3/5 출력일:",
          "reason": "없음 있음 호흡기계 호흡양상 Regular ? Irregular Suppressed Labored 기타 호흡기 관련증상 없음 있음 전자서명자 : 김은경 세브란스병원 SEVERANCE HOSPITAL 3/5 출력일:",
          "diagnosis": "미확인",
          "notes": "배변 조절 조절에 문제 없음 배뇨 양상 배뇨 방법 ? spont voiding Foley catheter ? CIC Kissmo □ 기타 catheter 교환 예정일 배뇨 장애 무 ○ 유 배뇨 조절 조절에 문제 없음 기능평가 100 순환기계 맥박 규칙적임 Pacemaker 없음 부종 없음 있음 순환기 관련증상 없음 있음 호흡기계 호흡양상 Regular ? Irregular Suppressed Labored 기타 호흡기 관련증상 없음 있음 전자서명자 : 김은경 세브란스병원 SEVERANCE HOSPITAL 3/5 출력일:"
        },
        {
          "date": "",
          "hospital": "SEVERANCE HOSPITAL 원본대조필 등록번호: 8633158 주민등록번호: 550112-125****남/70세 환자명 : 이광욱 검사결과 Impression Image Name 전자서명자: 서동우 세브란스병원 SEVERANCE HOSPITAL 기능검사결과(I/F형) *CAD-2VD, S/POPCAB(2018), DM, HTN *Compare with previous echo (",
          "reason": "정기 진료",
          "diagnosis": "미확인",
          "notes": "Impression Image Name 전자서명자: 서동우 세브란스병원 SEVERANCE HOSPITAL 기능검사결과(I/F형) *CAD-2VD, S/POPCAB(2018), DM, HTN *Compare with previous echo ("
        },
        {
          "date": "",
          "hospital": "SEVERANCE HOSPITAL Responsible Dr. : 심지영 2/2 출력일:",
          "reason": "정기 진료",
          "diagnosis": "미확인",
          "notes": ""
        },
        {
          "date": "",
          "hospital": "SEVERANCE HOSPITAL 진단명 외래재진기록",
          "reason": "정기 진료",
          "diagnosis": "구분 확진 주진단 기타진단 기타진단 Thyroid nodule 확진 Diabetes mellitus type 2 with dyslipidemia 확진 확진 Internal carotid artery stenosis 기록자명 강은석 전자서명자: 강은석 세브란스병원 SEVERANCE HOSPITAL 진단명 외래재진기록",
          "notes": "진단 기타진단 Thyroid nodule 확진 Diabetes mellitus type 2 with dyslipidemia 확진 확진 Internal carotid artery stenosis 기록자명 강은석 전자서명자: 강은석 세브란스병원 SEVERANCE HOSPITAL 진단명 외래재진기록"
        },
        {
          "date": "",
          "hospital": "미확인 의료기관",
          "reason": "정기 진료",
          "diagnosis": "구분 확진 주진단 확진 Diabetes mellitus type 2 with dyslipidemia |기타진단 확진 Diabetic polyneuropathy |기타진단 확진 Internal carotid artery stenosis 진단명 기록자명 김다함 외래재진기록",
          "notes": "진단 확진 Diabetic polyneuropathy |기타진단 확진 Internal carotid artery stenosis 진단명 기록자명 김다함 외래재진기록; 없음. Imp: Multiple probably benign nodules in both thyroids (K-TIRADS: 3) R/O Diffuse thyroid disease recommend follow up. T3 0.47 Free T4 1.08 TSH 2.12 추가사항 Thyroid nodule Plan 2y f/u 진단명 구분 확진 주진단 확진 Diabetes mellitus type 2 with dyslipidemia |기타진단 확진 Diabetic polyneuropathy |기타진단 확진 Internal carotid artery stenosis 진단명 기록자명 김다함 외래재진기록"
        },
        {
          "date": "",
          "hospital": "SEVERANCE HOSPITAL 원본대조필 등록번호: 8633158 주민등록번호: 550112-125**** 남/69세 환자명: 이광욱 진료과 내분비내과 주치의 강은석 BP(S) 142 mmHg BP(D) 62 mmHg HR 77/min 경과 및 Plan CAD(2vd+ LM) s/p CAG (2018.04, 일산백) s/p 40PCAB(LIMA to dLAD, to OM(seq) to DG with RIMA composite Y, Aorta to rPL with RA) (",
          "reason": "정기 진료",
          "diagnosis": "미확인",
          "notes": ""
        },
        {
          "date": "",
          "hospital": "SEVERANCE HOSPITAL 진단명 외래재진기록",
          "reason": "? >> 식습관 꾸준히 관리해보시고, 식후 1시간 자가혈당 측정해보세요. repeat med 6mo f/u 진단명 구분 확진 주진단 확진 Diabetes mellitus type 2 with dyslipidemia |기타진단 확진 Diabetic polyneuropathy |기타진단 확진 Internal carotid artery stenosis 기록자명 강은석 전자서명자: 강은석 세브란스병원 SEVERANCE HOSPITAL 진단명 외래재진기록",
          "diagnosis": "구분 확진 주진단 확진 Diabetes mellitus type 2 with dyslipidemia |기타진단 확진 Diabetic polyneuropathy |기타진단 확진 Internal carotid artery stenosis 기록자명 강은석 전자서명자: 강은석 세브란스병원 SEVERANCE HOSPITAL 진단명 외래재진기록",
          "notes": "진단 확진 Diabetic polyneuropathy |기타진단 확진 Internal carotid artery stenosis 기록자명 강은석 전자서명자: 강은석 세브란스병원 SEVERANCE HOSPITAL 진단명 외래재진기록"
        },
        {
          "date": "",
          "hospital": "미확인 의료기관",
          "reason": "정기 진료",
          "diagnosis": "구분 확진 CAD(2vd+ LM) s/p CAG (2018.04, 일산백) s/p 40PCAB(LIMA to dLAD, to OM(seq) to DG with RIMA composite Y, Aorta to rPL with RA) (",
          "notes": ""
        },
        {
          "date": "",
          "hospital": "SEVERANCE HOSPITAL 진단명 외래재진기록",
          "reason": "정기 진료",
          "diagnosis": "확진 Diabetes mellitus type 2 with dyslipidemia 확진 Thyroid nodule 기타진단 기타진단 확진 Internal carotid artery stenosis 기록자명 강은석(의사) 전자서명자: 강은석 세브란스병원 SEVERANCE HOSPITAL 진단명 외래재진기록",
          "notes": "진단 기타진단 확진 Internal carotid artery stenosis 기록자명 강은석(의사) 전자서명자: 강은석 세브란스병원 SEVERANCE HOSPITAL 진단명 외래재진기록"
        },
        {
          "date": "",
          "hospital": "SEVERANCE HOSPITAL 1/3 출력일:",
          "reason": "정기 진료",
          "diagnosis": "미확인",
          "notes": ""
        },
        {
          "date": "",
          "hospital": "SEVERANCE HOSPITAL B1050mm RF 2/3 출력일:",
          "reason": "정기 진료",
          "diagnosis": "미확인",
          "notes": ""
        },
        {
          "date": "",
          "hospital": "미확인 의료기관",
          "reason": "정기 진료",
          "diagnosis": "구분 확진 HP Bricktha Study Date 202409 12 LH 11069YM 8633158 Study Dale",
          "notes": ""
        },
        {
          "date": "",
          "hospital": "SEVERANCE HOSPITAL 진단명 외래재진기록",
          "reason": "정기 진료",
          "diagnosis": "확진 Internal carotid artery stenosis HP 기타진단 확진 기타진단 확진 Coronary artery disease (2 vessel disease) Unstable angina 기록자명 남효석(의사) 전자서명자: 남효석 세브란스병원 SEVERANCE HOSPITAL 진단명 외래재진기록",
          "notes": "진단 확진 기타진단 확진 Coronary artery disease (2 vessel disease) Unstable angina 기록자명 남효석(의사) 전자서명자: 남효석 세브란스병원 SEVERANCE HOSPITAL 진단명 외래재진기록"
        },
        {
          "date": "",
          "hospital": "SEVERANCE HOSPITAL 외래재진기록",
          "reason": "정기 진료",
          "diagnosis": "구분 확진 주진단 확진 기타진단 확진 기타진단 확진 Diabetes mellitus type 2 with dyslipidemia Diabetic polyneuropathy 진단명 Internal carotid artery stenosis 기록자명 강은석(의사) 전자서명자: 강은석 세브란스병원 SEVERANCE HOSPITAL 외래재진기록",
          "notes": "진단 확진 기타진단 확진 Diabetes mellitus type 2 with dyslipidemia Diabetic polyneuropathy 진단명 Internal carotid artery stenosis 기록자명 강은석(의사) 전자서명자: 강은석 세브란스병원 SEVERANCE HOSPITAL 외래재진기록"
        },
        {
          "date": "",
          "hospital": "약) Platless 75mg qd, Amosartan Q5/100/20mg qd, Sigmart 5mg bid, Herben 30mg bid ABI (Ankle / Brachial Index) - Rt: 0.80 /Lt: 0.72 <=-Rt: 0.90 /Lt: 0.84 <== Rt: 0.96 /Lt: 0.88 <==Rt: 0.84/Lt: 0.82 echo *CAD-2VD, S/P OPCAB(2018), DM, HTN *Compare with previous echo (",
          "reason": "정기 진료",
          "diagnosis": "미확인",
          "notes": ""
        },
        {
          "date": "",
          "hospital": "SEVERANCE HOSPITAL",
          "reason": "정기 진료",
          "diagnosis": "구분 확진 진단명 주진단 확진 Unstable angina |기타진단 확진 Peripheral arterial occlusive disease (lower extremities) |기타진단 확진 Coronary artery disease (2 vessel disease) 전자서명자: 안철민 세브란스병원 SEVERANCE HOSPITAL",
          "notes": "진단 확진 Peripheral arterial occlusive disease (lower extremities) |기타진단 확진 Coronary artery disease (2 vessel disease) 전자서명자: 안철민 세브란스병원 SEVERANCE HOSPITAL"
        },
        {
          "date": "",
          "hospital": "SEVERANCE HOSPITAL 2/2 출력일:",
          "reason": "정기 진료",
          "diagnosis": "미확인",
          "notes": ""
        },
        {
          "date": "",
          "hospital": "SEVERANCE HOSPITAL 8633158M070YCT Brain + Angio (Brain+Neck) (contrast",
          "reason": "이 있으면 스텐트 고려하겠습니다. Stroke 발생 Cerebral infarction Hemorrhage stroke Unknown stroke TIA Stroke 발생 날짜 Stroke Comment CAOD 발생 Acute MI ? Unstable angina PTCA/stent CABG Others CAOD 발생 날짜 CAOD 발생 Comment 전자서명자: 남효석 세브란스병원 SEVERANCE HOSPITAL 8633158M070YCT Brain + Angio (Brain+Neck) (contrast",
          "diagnosis": "미확인",
          "notes": ""
        },
        {
          "date": "",
          "hospital": "SEVERANCE HOSPITAL JOYCT Brain + Angio (Brain+Neck) (contrast)",
          "reason": "정기 진료",
          "diagnosis": "미확인",
          "notes": ""
        },
        {
          "date": "",
          "hospital": "SEVERANCE HOSPITAL 외래재진기록",
          "reason": "정기 진료",
          "diagnosis": "구분 확진 진단명 주진단 확진 기타진단 확진 Unstable angina Internal carotid artery stenosis 기타진단 확진 Coronary artery disease (2 vessel disease) 기록자명 남효석(의사) 전자서명자: 남효석 세브란스병원 SEVERANCE HOSPITAL 외래재진기록",
          "notes": "진단 확진 Unstable angina Internal carotid artery stenosis 기타진단 확진 Coronary artery disease (2 vessel disease) 기록자명 남효석(의사) 전자서명자: 남효석 세브란스병원 SEVERANCE HOSPITAL 외래재진기록"
        },
        {
          "date": "2025-01-08",
          "hospital": "미확인 의료기관",
          "visitDate": "2025-01-08",
          "reason": "정기 진료",
          "diagnosis": "미확인",
          "notes": ""
        },
        {
          "date": "2025-01-08",
          "hospital": "미확인 의료기관",
          "visitDate": "2025-01-08",
          "reason": "정기 진료",
          "diagnosis": "미확인",
          "notes": ""
        },
        {
          "date": "2025-01-08",
          "hospital": "미확인 의료기관",
          "visitDate": "2025-01-08",
          "reason": "정기 진료",
          "diagnosis": "미확인",
          "notes": ""
        },
        {
          "date": "2025-01-08",
          "hospital": "미확인 의료기관",
          "visitDate": "2025-01-08",
          "reason": "정기 진료",
          "diagnosis": "미확인",
          "notes": ""
        },
        {
          "date": "2025-01-08",
          "hospital": "미확인 의료기관",
          "visitDate": "2025-01-08",
          "reason": "정기 진료",
          "diagnosis": "미확인",
          "notes": ""
        },
        {
          "date": "2025-01-08",
          "hospital": "미확인 의료기관",
          "visitDate": "2025-01-08",
          "reason": "정기 진료",
          "diagnosis": "미확인",
          "notes": ""
        },
        {
          "date": "2025-01-08",
          "hospital": "미확인 의료기관",
          "visitDate": "2025-01-08",
          "reason": "정기 진료",
          "diagnosis": "미확인",
          "notes": ""
        },
        {
          "date": "2025-01-08",
          "hospital": "미확인 의료기관",
          "visitDate": "2025-01-08",
          "reason": "정기 진료",
          "diagnosis": "미확인",
          "notes": ""
        },
        {
          "date": "2025-01-08",
          "hospital": "미확인 의료기관",
          "visitDate": "2025-01-08",
          "reason": "정기 진료",
          "diagnosis": "미확인",
          "notes": ""
        },
        {
          "date": "2025-01-08",
          "hospital": "미확인 의료기관",
          "visitDate": "2025-01-08",
          "reason": "정기 진료",
          "diagnosis": "미확인",
          "notes": ""
        },
        {
          "date": "2025-01-08",
          "hospital": "미확인 의료기관",
          "visitDate": "2025-01-08",
          "reason": "정기 진료",
          "diagnosis": "미확인",
          "notes": ""
        },
        {
          "date": "2025-01-08",
          "hospital": "미확인 의료기관",
          "visitDate": "2025-01-08",
          "reason": "정기 진료",
          "diagnosis": "미확인",
          "notes": ""
        },
        {
          "date": "2025-01-08",
          "hospital": "미확인 의료기관",
          "visitDate": "2025-01-08",
          "reason": "정기 진료",
          "diagnosis": "미확인",
          "notes": ""
        },
        {
          "date": "2025-01-08",
          "hospital": "미확인 의료기관",
          "visitDate": "2025-01-08",
          "reason": "정기 진료",
          "diagnosis": "미확인",
          "notes": ""
        },
        {
          "date": "2025-01-08",
          "hospital": "미확인 의료기관",
          "visitDate": "2025-01-08",
          "reason": "정기 진료",
          "diagnosis": "미확인",
          "notes": ""
        },
        {
          "date": "2025-01-08",
          "hospital": "미확인 의료기관",
          "visitDate": "2025-01-08",
          "reason": "정기 진료",
          "diagnosis": "미확인",
          "notes": ""
        },
        {
          "date": "2025-01-08",
          "hospital": "미확인 의료기관",
          "visitDate": "2025-01-08",
          "reason": "정기 진료",
          "diagnosis": "미확인",
          "notes": ""
        },
        {
          "date": "2025-01-08",
          "hospital": "미확인 의료기관",
          "visitDate": "2025-01-08",
          "reason": "정기 진료",
          "diagnosis": "미확인",
          "notes": ""
        },
        {
          "date": "2025-01-08",
          "hospital": "미확인 의료기관",
          "visitDate": "2025-01-08",
          "reason": "정기 진료",
          "diagnosis": "미확인",
          "notes": ""
        },
        {
          "date": "2025-01-08",
          "hospital": "미확인 의료기관",
          "visitDate": "2025-01-08",
          "reason": "정기 진료",
          "diagnosis": "미확인",
          "notes": ""
        },
        {
          "date": "2025-01-08",
          "hospital": "미확인 의료기관",
          "visitDate": "2025-01-08",
          "reason": "정기 진료",
          "diagnosis": "미확인",
          "notes": ""
        },
        {
          "date": "2025-01-08",
          "hospital": "미확인 의료기관",
          "visitDate": "2025-01-08",
          "reason": "정기 진료",
          "diagnosis": "미확인",
          "notes": ""
        },
        {
          "date": "2025-01-08",
          "hospital": "미확인 의료기관",
          "visitDate": "2025-01-08",
          "reason": "정기 진료",
          "diagnosis": "미확인",
          "notes": ""
        },
        {
          "date": "2025-01-08",
          "hospital": "미확인 의료기관",
          "visitDate": "2025-01-08",
          "reason": "정기 진료",
          "diagnosis": "미확인",
          "notes": ""
        },
        {
          "date": "2025-01-08",
          "hospital": "미확인 의료기관",
          "visitDate": "2025-01-08",
          "reason": "정기 진료",
          "diagnosis": "미확인",
          "notes": ""
        },
        {
          "date": "2025-01-08",
          "hospital": "미확인 의료기관",
          "visitDate": "2025-01-08",
          "reason": "정기 진료",
          "diagnosis": "미확인",
          "notes": ""
        },
        {
          "date": "2025-01-08",
          "hospital": "미확인 의료기관",
          "visitDate": "2025-01-08",
          "reason": "정기 진료",
          "diagnosis": "미확인",
          "notes": ""
        },
        {
          "date": "2025-01-08",
          "hospital": "미확인 의료기관",
          "visitDate": "2025-01-08",
          "reason": "정기 진료",
          "diagnosis": "미확인",
          "notes": ""
        },
        {
          "date": "2025-01-08",
          "hospital": "미확인 의료기관",
          "visitDate": "2025-01-08",
          "reason": "정기 진료",
          "diagnosis": "미확인",
          "notes": ""
        },
        {
          "date": "2025-01-08",
          "hospital": "미확인 의료기관",
          "visitDate": "2025-01-08",
          "reason": "정기 진료",
          "diagnosis": "미확인",
          "notes": ""
        },
        {
          "date": "2025-01-08",
          "hospital": "미확인 의료기관",
          "visitDate": "2025-01-08",
          "reason": "정기 진료",
          "diagnosis": "미확인",
          "notes": ""
        },
        {
          "date": "2025-01-08",
          "hospital": "미확인 의료기관",
          "visitDate": "2025-01-08",
          "reason": "정기 진료",
          "diagnosis": "미확인",
          "notes": ""
        },
        {
          "date": "2025-01-08",
          "hospital": "미확인 의료기관",
          "visitDate": "2025-01-08",
          "reason": "정기 진료",
          "diagnosis": "미확인",
          "notes": ""
        },
        {
          "date": "2025-01-08",
          "hospital": "미확인 의료기관",
          "visitDate": "2025-01-08",
          "reason": "정기 진료",
          "diagnosis": "미확인",
          "notes": ""
        },
        {
          "date": "2025-01-08",
          "hospital": "미확인 의료기관",
          "visitDate": "2025-01-08",
          "reason": "정기 진료",
          "diagnosis": "미확인",
          "notes": ")의 요청에 따라 진료비 계산서·영수증 세부산정내역을 발급합니다."
        },
        {
          "date": "2025-04-11",
          "hospital": "미확인 의료기관",
          "visitDate": "2025-04-11",
          "reason": "정기 진료",
          "diagnosis": "미확인",
          "notes": ""
        },
        {
          "date": "",
          "hospital": "미확인 의료기관",
          "reason": "정기 진료",
          "diagnosis": "미확인",
          "prescription": "·조제 행위료",
          "notes": ""
        },
        {
          "date": "2025-01-14",
          "hospital": "미확인 의료기관",
          "visitDate": "2025-01-14",
          "reason": "정기 진료",
          "diagnosis": "미확인",
          "notes": ""
        },
        {
          "date": "2025-01-14",
          "hospital": "미확인 의료기관",
          "visitDate": "2025-01-14",
          "reason": "정기 진료",
          "diagnosis": "미확인",
          "notes": ""
        },
        {
          "date": "2025-01-14",
          "hospital": "미확인 의료기관",
          "visitDate": "2025-01-14",
          "reason": "정기 진료",
          "diagnosis": "미확인",
          "notes": ""
        },
        {
          "date": "2025-01-14",
          "hospital": "미확인 의료기관",
          "visitDate": "2025-01-14",
          "reason": "정기 진료",
          "diagnosis": "미확인",
          "notes": ")의 요청에 따라 진료비 계산서·영수증 세부산정내역을 발급합니다."
        },
        {
          "date": "2025-03-19",
          "hospital": "미확인 의료기관",
          "visitDate": "2025-03-19",
          "reason": "정기 진료",
          "diagnosis": "미확인",
          "notes": ""
        },
        {
          "date": "2025-03-19",
          "hospital": "미확인 의료기관",
          "visitDate": "2025-03-19",
          "reason": "정기 진료",
          "diagnosis": "미확인",
          "notes": ""
        },
        {
          "date": "2025-03-19",
          "hospital": "미확인 의료기관",
          "visitDate": "2025-03-19",
          "reason": "정기 진료",
          "diagnosis": "미확인",
          "notes": ""
        },
        {
          "date": "2025-03-19",
          "hospital": "미확인 의료기관",
          "visitDate": "2025-03-19",
          "reason": "정기 진료",
          "diagnosis": "미확인",
          "notes": ""
        },
        {
          "date": "2025-03-19",
          "hospital": "미확인 의료기관",
          "visitDate": "2025-03-19",
          "reason": "정기 진료",
          "diagnosis": "미확인",
          "notes": ""
        },
        {
          "date": "2025-03-19",
          "hospital": "미확인 의료기관",
          "visitDate": "2025-03-19",
          "reason": "정기 진료",
          "diagnosis": "미확인",
          "notes": ""
        },
        {
          "date": "2025-03-19",
          "hospital": "미확인 의료기관",
          "visitDate": "2025-03-19",
          "reason": "정기 진료",
          "diagnosis": "미확인",
          "notes": ""
        },
        {
          "date": "2025-03-19",
          "hospital": "미확인 의료기관",
          "visitDate": "2025-03-19",
          "reason": "정기 진료",
          "diagnosis": "미확인",
          "notes": ""
        },
        {
          "date": "2025-03-19",
          "hospital": "미확인 의료기관",
          "visitDate": "2025-03-19",
          "reason": "정기 진료",
          "diagnosis": "미확인",
          "notes": ""
        },
        {
          "date": "2025-03-19",
          "hospital": "미확인 의료기관",
          "visitDate": "2025-03-19",
          "reason": "정기 진료",
          "diagnosis": "미확인",
          "notes": ""
        },
        {
          "date": "2025-03-19",
          "hospital": "미확인 의료기관",
          "visitDate": "2025-03-19",
          "reason": "정기 진료",
          "diagnosis": "미확인",
          "notes": ""
        },
        {
          "date": "2025-03-19",
          "hospital": "미확인 의료기관",
          "visitDate": "2025-03-19",
          "reason": "정기 진료",
          "diagnosis": "미확인",
          "notes": ""
        },
        {
          "date": "2025-03-19",
          "hospital": "미확인 의료기관",
          "visitDate": "2025-03-19",
          "reason": "정기 진료",
          "diagnosis": "미확인",
          "notes": ""
        },
        {
          "date": "2025-03-19",
          "hospital": "미확인 의료기관",
          "visitDate": "2025-03-19",
          "reason": "정기 진료",
          "diagnosis": "미확인",
          "notes": ""
        },
        {
          "date": "2025-03-19",
          "hospital": "미확인 의료기관",
          "visitDate": "2025-03-19",
          "reason": "정기 진료",
          "diagnosis": "미확인",
          "notes": ""
        },
        {
          "date": "2025-03-19",
          "hospital": "미확인 의료기관",
          "visitDate": "2025-03-19",
          "reason": "정기 진료",
          "diagnosis": "미확인",
          "notes": ""
        },
        {
          "date": "2025-03-19",
          "hospital": "미확인 의료기관",
          "visitDate": "2025-03-19",
          "reason": "정기 진료",
          "diagnosis": "미확인",
          "notes": ""
        },
        {
          "date": "2025-03-19",
          "hospital": "미확인 의료기관",
          "visitDate": "2025-03-19",
          "reason": "정기 진료",
          "diagnosis": "미확인",
          "notes": ""
        },
        {
          "date": "2025-03-19",
          "hospital": "미확인 의료기관",
          "visitDate": "2025-03-19",
          "reason": "정기 진료",
          "diagnosis": "미확인",
          "notes": ""
        },
        {
          "date": "2025-03-19",
          "hospital": "미확인 의료기관",
          "visitDate": "2025-03-19",
          "reason": "정기 진료",
          "diagnosis": "미확인",
          "notes": ""
        },
        {
          "date": "2025-03-19",
          "hospital": "미확인 의료기관",
          "visitDate": "2025-03-19",
          "reason": "정기 진료",
          "diagnosis": "미확인",
          "notes": ""
        },
        {
          "date": "2025-03-19",
          "hospital": "미확인 의료기관",
          "visitDate": "2025-03-19",
          "reason": "정기 진료",
          "diagnosis": "미확인",
          "notes": ""
        },
        {
          "date": "2025-03-19",
          "hospital": "미확인 의료기관",
          "visitDate": "2025-03-19",
          "reason": "정기 진료",
          "diagnosis": "미확인",
          "notes": ""
        },
        {
          "date": "2025-03-19",
          "hospital": "미확인 의료기관",
          "visitDate": "2025-03-19",
          "reason": "정기 진료",
          "diagnosis": "미확인",
          "notes": ""
        },
        {
          "date": "2025-03-19",
          "hospital": "미확인 의료기관",
          "visitDate": "2025-03-19",
          "reason": "정기 진료",
          "diagnosis": "미확인",
          "notes": ""
        },
        {
          "date": "2025-03-19",
          "hospital": "미확인 의료기관",
          "visitDate": "2025-03-19",
          "reason": "정기 진료",
          "diagnosis": "미확인",
          "notes": ""
        },
        {
          "date": "2025-03-19",
          "hospital": "미확인 의료기관",
          "visitDate": "2025-03-19",
          "reason": "정기 진료",
          "diagnosis": "미확인",
          "notes": ""
        },
        {
          "date": "2025-03-19",
          "hospital": "미확인 의료기관",
          "visitDate": "2025-03-19",
          "reason": "정기 진료",
          "diagnosis": "미확인",
          "notes": ""
        },
        {
          "date": "2025-03-19",
          "hospital": "미확인 의료기관",
          "visitDate": "2025-03-19",
          "reason": "정기 진료",
          "diagnosis": "료",
          "notes": ""
        },
        {
          "date": "2025-03-19",
          "hospital": "미확인 의료기관",
          "visitDate": "2025-03-19",
          "reason": "정기 진료",
          "diagnosis": "료",
          "notes": ""
        },
        {
          "date": "2025-03-19",
          "hospital": "미확인 의료기관",
          "visitDate": "2025-03-19",
          "reason": "정기 진료",
          "diagnosis": "료",
          "notes": ""
        },
        {
          "date": "2025-03-19",
          "hospital": "미확인 의료기관",
          "visitDate": "2025-03-19",
          "reason": "정기 진료",
          "diagnosis": "료",
          "notes": ""
        },
        {
          "date": "2025-03-19",
          "hospital": "미확인 의료기관",
          "visitDate": "2025-03-19",
          "reason": "정기 진료",
          "diagnosis": "미확인",
          "notes": ")의 요청에 따라 진료비 계산서·영수증 세부산정내역을 발급합니다."
        },
        {
          "date": "2025-03-19",
          "hospital": "미확인 의료기관",
          "visitDate": "2025-03-19",
          "reason": "정기 진료",
          "diagnosis": "료 CT진단료",
          "notes": ""
        },
        {
          "date": "2025-03-19",
          "hospital": "미확인 의료기관",
          "visitDate": "2025-03-19",
          "reason": "정기 진료",
          "diagnosis": "료",
          "notes": ""
        },
        {
          "date": "2025-03-19",
          "hospital": "미확인 의료기관",
          "visitDate": "2025-03-19",
          "reason": "정기 진료",
          "diagnosis": "미확인",
          "notes": ""
        },
        {
          "date": "2025-03-19",
          "hospital": "미확인 의료기관",
          "visitDate": "2025-03-19",
          "reason": "정기 진료",
          "diagnosis": "미확인",
          "notes": ")의 요청에 따라 진료비 계산서·영수증 세부산정내역을 발급합니다."
        },
        {
          "date": "2025-03-26",
          "hospital": "미확인 의료기관",
          "visitDate": "2025-03-26",
          "reason": "정기 진료",
          "diagnosis": "미확인",
          "notes": ""
        },
        {
          "date": "2025-03-26",
          "hospital": "미확인 의료기관",
          "visitDate": "2025-03-26",
          "reason": "정기 진료",
          "diagnosis": "미확인",
          "notes": ""
        },
        {
          "date": "2025-03-26",
          "hospital": "미확인 의료기관",
          "visitDate": "2025-03-26",
          "reason": "정기 진료",
          "diagnosis": "미확인",
          "notes": ""
        },
        {
          "date": "2025-03-26",
          "hospital": "미확인 의료기관",
          "visitDate": "2025-03-26",
          "reason": "정기 진료",
          "diagnosis": "미확인",
          "notes": ")의 요청에 따라 진료비 계산서·영수증 세부산정내역을 발급합니다."
        },
        {
          "date": "2025-03-26",
          "hospital": "미확인 의료기관",
          "visitDate": "2025-03-26",
          "reason": "정기 진료",
          "diagnosis": "미확인",
          "notes": ""
        },
        {
          "date": "2025-03-26",
          "hospital": "미확인 의료기관",
          "visitDate": "2025-03-26",
          "reason": "정기 진료",
          "diagnosis": "미확인",
          "notes": ""
        },
        {
          "date": "2025-03-26",
          "hospital": "미확인 의료기관",
          "visitDate": "2025-03-26",
          "reason": "정기 진료",
          "diagnosis": "미확인",
          "notes": ""
        },
        {
          "date": "2025-03-26",
          "hospital": "미확인 의료기관",
          "visitDate": "2025-03-26",
          "reason": "정기 진료",
          "diagnosis": "미확인",
          "notes": ""
        },
        {
          "date": "2025-03-26",
          "hospital": "미확인 의료기관",
          "visitDate": "2025-03-26",
          "reason": "정기 진료",
          "diagnosis": "미확인",
          "notes": ")의 요청에 따라 진료비 계산서·영수증 세부산정내역을 발급합니다."
        },
        {
          "date": "2025-04-11",
          "hospital": "미확인 의료기관",
          "visitDate": "2025-04-11",
          "reason": "정기 진료",
          "diagnosis": "미확인",
          "notes": ""
        },
        {
          "date": "2025-04-11",
          "hospital": "미확인 의료기관",
          "visitDate": "2025-04-11",
          "reason": "정기 진료",
          "diagnosis": "미확인",
          "notes": "내분비내과 진료기간"
        },
        {
          "date": "2025-04-11",
          "hospital": "미확인 의료기관",
          "visitDate": "2025-04-11",
          "reason": "정기 진료",
          "diagnosis": "미확인",
          "notes": "진료과 신경과 진료기간"
        },
        {
          "date": "2025-04-11",
          "hospital": "미확인 의료기관",
          "visitDate": "2025-04-11",
          "reason": "정기 진료",
          "diagnosis": "미확인",
          "notes": "진료과 심장내과 진료기간"
        },
        {
          "date": "2025-04-11",
          "hospital": "진료기간",
          "visitDate": "2025-04-11",
          "reason": "정기 진료",
          "diagnosis": "미확인",
          "notes": "세브)서류영상발급센터 진료기간"
        },
        {
          "date": "2025-04-11",
          "hospital": "미확인 의료기관",
          "visitDate": "2025-04-11",
          "reason": "정기 진료",
          "diagnosis": "미확인",
          "notes": ""
        },
        {
          "date": "2025-04-11",
          "hospital": "미확인 의료기관",
          "visitDate": "2025-04-11",
          "reason": "정기 진료",
          "diagnosis": "미확인",
          "notes": ")의 요청에 따라 진료비 계산서·영수증 세부산정내역을 발급합니다."
        },
        {
          "date": "2025-04-11",
          "hospital": "SEVERANCE HOSPITAL Hybrid peripheral angiography (Lower extremity)",
          "visitDate": "2025-04-11",
          "reason": "정기 진료",
          "diagnosis": "미확인",
          "notes": ""
        },
        {
          "date": "",
          "hospital": "SEVERANCE HOSPITAL 원본대조필 등록번호: 8633158 주민등록번호: 550112-125**** 남/64세 환자명: 이광욱 판독의(1차) 최정호 판독의(2차) 안철민 전자서명자: 한혜수 세브란스병원 SEVERANCE HOSPITAL 기능검사결과(I/F형) 2/2 출력일:",
          "reason": "정기 진료",
          "diagnosis": "미확인",
          "notes": "(I/F형) 2/2 출력일:"
        },
        {
          "date": "",
          "hospital": "SEVERANCE HOSPITAL 기능검사결과(I/F형)",
          "reason": "정기 진료",
          "diagnosis": "미확인",
          "notes": "Impression Skin Perfusion Pressure Test 1. Rt: 65mmHg/ Lt: 76mmHg <발등> 2. Rt: 77mmHg/Lt: 77mmHg <발바닥> (Normal value: 50 이상) n Name 107161 Image1 전자서명자: 한혜수 세브란스병원 SEVERANCE HOSPITAL 기능검사결과(I/F형)"
        },
        {
          "date": "",
          "hospital": "SEVERANCE HOSPITAL 원본대조필 등록번호: 8633158 주민등록번호: 550112-125****남/64세 환자명 : 이광욱 Cath No. Date",
          "reason": "정기 진료",
          "diagnosis": "미확인",
          "notes": ""
        },
        {
          "date": "",
          "hospital": "SEVERANCE HOSPITAL 원본대조필 등록번호: 8633158 주민등록번호: 550112-125**** 남/64세 환자명 : 이광욱 외래재진기록",
          "reason": "정기 진료",
          "diagnosis": "미확인",
          "notes": ""
        },
        {
          "date": "",
          "hospital": "SEVERANCE HOSPITAL 1/1 출력일:",
          "reason": "정기 진료",
          "diagnosis": "미확인",
          "notes": ""
        },
        {
          "date": "",
          "hospital": "SEVERANCE HOSPITAL 133572P1104102 AATI 966-691-MCU308 1/2 출력일:",
          "reason": "정기 진료",
          "diagnosis": "미확인",
          "notes": ""
        },
        {
          "date": "",
          "hospital": "SEVERANCE HOSPITAL Comments/Revising point for measurement 2/2 출력일:",
          "reason": "정기 진료",
          "diagnosis": "미확인",
          "notes": ""
        },
        {
          "date": "",
          "hospital": "SEVERANCE HOSPITAL 외래재진기록",
          "reason": "정기 진료",
          "diagnosis": "미확인",
          "notes": ""
        },
        {
          "date": "",
          "hospital": "SEVERANCE HOSPITAL 원본대조필 등록번호: 8633158 주민등록번호: 550112-125**** 남/64세 환자명: 이광욱 외래재진기록",
          "reason": "정기 진료",
          "diagnosis": "미확인",
          "notes": ""
        },
        {
          "date": "",
          "hospital": "SEVERANCE HOSPITAL 1/1 출력일:",
          "reason": "정기 진료",
          "diagnosis": "미확인",
          "notes": ""
        },
        {
          "date": "",
          "hospital": "SEVERANCE HOSPITAL 원본대조필 등록번호: 8633158 주민등록번호: 550112-125**** 남/64세 환자명: 이광욱 판독의(1차) 이용준 판독의(2차) 안철민 전자서명자: 한혜수 세브란스병원 SEVERANCE HOSPITAL 기능검사결과(I/F형) 2/2 출력일:",
          "reason": "정기 진료",
          "diagnosis": "미확인",
          "notes": "(I/F형) 2/2 출력일:"
        },
        {
          "date": "",
          "hospital": "SEVERANCE HOSPITAL 1/1 출력일:",
          "reason": "정기 진료",
          "diagnosis": "미확인",
          "notes": ""
        },
        {
          "date": "",
          "hospital": "1/6 출력일:",
          "reason": "정기 진료",
          "diagnosis": "미확인",
          "notes": ""
        },
        {
          "date": "",
          "hospital": "SEVERANCE HOSPITAL 2/6 출력일:",
          "reason": "정기 진료",
          "diagnosis": "미확인",
          "notes": ""
        },
        {
          "date": "",
          "hospital": "SEVERANCE HOSPITAL 3/6 출력일:",
          "reason": "정기 진료",
          "diagnosis": "미확인",
          "notes": ""
        },
        {
          "date": "",
          "hospital": "SEVERANCE HOSPITAL ICS: impulse conducting system(of the heart) LMCL left midclavicular line LNs lymph nodes LOM limitation of motion NSVD normal spontaneous vaginal delivery PAOD peripheral arterial occlusive disease PMI point of maximum impulse 5/6 출력일:",
          "reason": "정기 진료",
          "diagnosis": "미확인",
          "notes": ""
        },
        {
          "date": "",
          "hospital": "SEVERANCE HOSPITAL 1/2 출력일:",
          "reason": "정기 진료",
          "diagnosis": "미확인",
          "notes": ""
        },
        {
          "date": "",
          "hospital": "2/2 출력일:",
          "reason": "정기 진료",
          "diagnosis": "미확인",
          "notes": ""
        },
        {
          "date": "",
          "hospital": "SEVERANCE HOSPITAL 2/4 출력일:",
          "reason": "정기 진료",
          "diagnosis": "미확인",
          "notes": "체중변화 kg ㆍ염분 제한 수분 제한 단백질 제한 ○ 지방 제한 식습관 식사횟수 3회/일 편식 습관 무 선호 음식 기피 음식 수면 상태 수면시간 6 수면을 돕는법 수면장애 없음 전자서명자 : 함경희 세브란스병원 SEVERANCE HOSPITAL 2/4 출력일:"
        },
        {
          "date": "",
          "hospital": "SEVERANCE HOSPITAL 원본대조필 등록번호: 8633158 주민등록번호: 550112-125****남/64세 환자명 : 이광욱 간호정보조사",
          "reason": "정기 진료",
          "diagnosis": "미확인",
          "notes": ""
        },
        {
          "date": "",
          "hospital": "SEVERANCE HOSPITAL 1/1 출력일:",
          "reason": "정기 진료",
          "diagnosis": "미확인",
          "notes": ""
        },
        {
          "date": "",
          "hospital": "28 /30 점 1/2 출력일:",
          "reason": "정기 진료",
          "diagnosis": "미확인",
          "notes": ""
        },
        {
          "date": "",
          "hospital": "SEVERANCE HOSPITAL 출력자: 김경미 원본대조필 등록번호: 8633158 주민등록번호: 550112-125**** 남/64세 환자명: 이광욱 / 오른손잡이 2. 대졸 3. 돈 계산. 4.읽기? 쓰기 ㅇ 5. 공무원 간이 정신상태 검사 (Korean version of Mini-Mental State Exam, K-MMSE) 등록번호: 8633158 환자성명: 이광욱 성별/나이: M,64세 항 목 점수 항 목 점수 2019 0 0 비행기 주전자 기억회상 0 연필 0 3점 일 4 0 8.9] 수 0 ① 소나무 이름대기 X 0 1 시게 0 지남력 가운 04 볼펜 0 ст 대한민국 0 ① 언어 명령시행 종이를 뒤집고 0 ① 도 서울 0 및 반으로 접은 다음 0 무엇 하는 곳 병원 0 시공간 저에게 주세요. I 현재장소명 세브란스 0 구성 따라 말하기 “백문이 불여일견\" 0 몇중 14층 0 4 9점 오각형 0 비행기 주전자 0 읽 기억 양말 0 기 Mi 기 \"눈을 감으세요\" 0 L 0 소나무 명시 0 100 -7 93 0 총점: 28 130 주의집중 -7 86 0 0 및 계산 -7 79 0 5점 -7 72 0 -7 65 0 8 학력: 무학/초졸/중졸/고졸/맨솔 5 오각형 그리기 ▷ 읽기 D 눈을 감으세요 ▶ 쓰기 (오늘 기분이나 날씨에 대해 한 문장으로 써보세요) 세브란스병원 비온후검 Scan 작성자 : 박우현 1/1 출력일:",
          "reason": "정기 진료",
          "diagnosis": "미확인",
          "notes": ""
        },
        {
          "date": "",
          "hospital": "원본대조필 SEVERANCE HOSPITAL 등록번호: 8633158 주민등록번호: 550112-125**** 남/64세 환자명 : 이광욱 외래재진기록",
          "reason": "정기 진료",
          "diagnosis": "미확인",
          "notes": ""
        },
        {
          "date": "",
          "hospital": "SEVERANCE HOSPITAL 1/1 출력일:",
          "reason": "정기 진료",
          "diagnosis": "미확인",
          "notes": ""
        },
        {
          "date": "",
          "hospital": "SEVERANCE HOSPITAL 원본대조필 등록번호: 8633158 주민등록번호: 550112-125****남/65세 환자명: 이광욱 시행일자",
          "reason": "정기 진료",
          "diagnosis": "미확인",
          "notes": ""
        },
        {
          "date": "",
          "hospital": "SEVERANCE HOSPITAL 백민렬 1/2 출력일:",
          "reason": "정기 진료",
          "diagnosis": "미확인",
          "notes": ""
        },
        {
          "date": "",
          "hospital": "SEVERANCE HOSPITAL 2/2 출력일:",
          "reason": "정기 진료",
          "diagnosis": "미확인",
          "notes": ""
        },
        {
          "date": "",
          "hospital": "SEVERANCE HOSPITAL TCD report 1/2 출력일:",
          "reason": "정기 진료",
          "diagnosis": "미확인",
          "notes": "Normal Abnormal Undetermined TCD study The temporal window temporal window was good poor site bilateral side right side The Ophthalmic flow ophthalmic flow was The ACA flow normal direction reversed direction site left side bilateral side left side Oright side ACA flow was normal direction site bilateral side I reversed direction left side right side Findings Increased MV on Lt Siph (84cm/s) and BA (77cm/s). Conclusion)) 1. The previous DSA study showed occlusion of Lt VA. 2. This hemodynamic study showed increased MV on Lt Siph and BA, which may suggest stenosis or increased blood flow. 3. We recommend the follow up TCD study to check up the interval change of vessel status. Findings Right Findings Left MV Pl MV PI Rt. MCA pro 61 1.21 Lt MCA pro 71 1.17 Rt. MCA dis 60 1.13 Lt. MCA dis 70 1.15 -52 1.19 Rt. ACA Lt. ACA -44 1.41 Rt. PCA -21 1.17 Lt. PCA -27 1.15 Rt. Opth 20 1.06 Lt. Opth 25 1.48 Rt. Siph1 48 1.26 Lt. Siph1 -84 1.06 Rt.VA -33 1.31 Lt VA BA pro ?? -67 1.12 BA dis -77 1.17 전자서명자: 백민렬 세브란스병원 SEVERANCE HOSPITAL TCD report 1/2 출력일:"
        },
        {
          "date": "",
          "hospital": "SEVERANCE HOSPITAL 출력자: 김경미 원본대조필 등록번호: 8633158 주민등록번호: 550112-125****남/65세 환자명 : 이광욱 Hame LEE KWANG OOK TCD ID 8633158 ①LACA ⓡ LMCA LPCA BA LPCoA ⓡ LICA LOA Depth 50 Proce 1.6 ROA 50 Maan → RACA ①RMCA RPCA ⓡ ACOA RPCoA RICA Depth Prope 50 1.6 25 Pl 1.48 Pask 34 Mean r 20 FI 1.06 LSIPHON T Depth 74 Proce 1.6 RSIPHON Depth 78 Prope 1.6 Pask 135 Mean 76 PI 1.18 Peak 89 Mean 48 Pl 1.26 LSIPHON 130 on Depth 74 Proce 1.6 Posk -143 Meani -84 FI LMCA Depth 48 1.06 Probe 1.6 RSIPHON 130 0 RMCA 170 Paak 83 Mean 45 Fl 1.28 Peak 전자서명자: 백민렬 세브란스병원 SEVERANCE HOSPITAL Depth 78 Prope 1.6 -80 Mean -35 FI 1.96 Depth 44 Probe 1.6 70 70 Mea 38 1.31 TCD report 2/6 1/6 출력일:",
          "reason": "정기 진료",
          "diagnosis": "미확인",
          "notes": ""
        },
        {
          "date": "",
          "hospital": "SEVERANCE HOSPITAL TCD report 3/6 2/6 출력일:",
          "reason": "정기 진료",
          "diagnosis": "미확인",
          "notes": ""
        },
        {
          "date": "",
          "hospital": "SEVERANCE HOSPITAL Depth 54 Prope 1.6 RPCA Depre 60 Prode 1.6 Depth 64 F1 Probe 1.6 Peak RVA Pask RVA Depth 66 Proce 1.6 -38 Mean -21 PI 1.17 Depth 54 Prote 1.6 -60 Mean -32 Pl 1.33 Depth 60 Proce 1.6 Peak -62 Mean -33 1.31 TCD report 4/6 3/6 출력일:",
          "reason": "정기 진료",
          "diagnosis": "미확인",
          "notes": ""
        },
        {
          "date": "",
          "hospital": "SEVERANCE HOSPITAL Depth Proce RVA 64 1.6 Depth BA prox. 120 78 -60 Mean -32 F1 1.27 Probe 1.6 Peak -120 Mean -69 P 1.11 BA prox. Depth 84 Proce 1.6 Peak -117 Mean -67 BA dis. 136 -129 BA dis. 1.12 Depth Probe 88 1.6 Mean -73 F 1.16 Depth 90 Proce 1.6 Pazk -123 Mean -70 Pl 1.14 TCD report 5/6 4/6 출력일:",
          "reason": "정기 진료",
          "diagnosis": "미확인",
          "notes": ""
        },
        {
          "date": "",
          "hospital": "SEVERANCE HOSPITAL 원본대조필 등록번호: 8633158 주민등록번호: 550112-125****남/65세 환자명: 이광욱 SEVERANCE HOSPITAL Name Gender LEE KWANG OOK^^^^ Male TCD ID 8633158 Exam Date Age D.O.B Exam Type",
          "reason": "정기 진료",
          "diagnosis": "미확인",
          "notes": ""
        },
        {
          "date": "",
          "hospital": "원본대조필 SEVERANCE HOSPITAL 등록번호: 8633158 주민등록번호: 550112-125**** 남/64세 환자명: 이광욱 외래재진기록",
          "reason": "정기 진료",
          "diagnosis": "미확인",
          "notes": ""
        },
        {
          "date": "",
          "hospital": "SEVERANCE HOSPITAL 1/1 출력일:",
          "reason": "정기 진료",
          "diagnosis": "미확인",
          "notes": ""
        },
        {
          "date": "",
          "hospital": "SEVERANCE HOSPITAL 출력자: 김경미 원본대조필 등록번호: 8633158 주민등록번호: 550112-125****남/65세 환자명: 이광욱 검사결과 ABI (Ankle/Brachial Index) - Rt: 0.77 /Lt: 0.90 Impression Image Name pvr Image1 Name: LEE GWANG WOOK 8633158 Exam Date:",
          "reason": "정기 진료",
          "diagnosis": "미확인",
          "notes": "ABI (Ankle/Brachial Index) - Rt: 0.77 /Lt: 0.90 Impression Image Name pvr Image1 Name: LEE GWANG WOOK 8633158 Exam Date:"
        },
        {
          "date": "",
          "hospital": "SEVERANCE HOSPITAL 원본대조필 등록번호: 8633158 주민등록번호: 550112-125**** 남/65세 환자명 : 이광욱 판독의(1차) 이선화 판독의(2차) 안철민 전자서명자: 박규리 세브란스병원 SEVERANCE HOSPITAL 기능검사결과(I/F형) 2/2 출력일:",
          "reason": "정기 진료",
          "diagnosis": "미확인",
          "notes": "(I/F형) 2/2 출력일:"
        },
        {
          "date": "",
          "hospital": "SEVERANCE HOSPITAL 외래재진기록",
          "reason": "정기 진료",
          "diagnosis": "미확인",
          "notes": ""
        },
        {
          "date": "",
          "hospital": "SEVERANCE HOSPITAL 외래재진기록",
          "reason": "정기 진료",
          "diagnosis": "미확인",
          "notes": ""
        },
        {
          "date": "",
          "hospital": "SEVERANCE HOSPITAL 1/1 출력일:",
          "reason": "정기 진료",
          "diagnosis": "미확인",
          "notes": ""
        },
        {
          "date": "",
          "hospital": "SEVERANCE HOSPITAL 원본대조필 등록번호: 8633158 주민등록번호: 550112-125**** 남/65세 환자명: 이광욱 판독의(1차) 이찬주 판독의(2차) 안철민 전자서명자: 박규리 세브란스병원 SEVERANCE HOSPITAL 기능검사결과(I/F형) 2/2 출력일:",
          "reason": "정기 진료",
          "diagnosis": "미확인",
          "notes": "(I/F형) 2/2 출력일:"
        },
        {
          "date": "",
          "hospital": "SEVERANCE HOSPITAL 외래재진기록",
          "reason": "정기 진료",
          "diagnosis": "미확인",
          "notes": ""
        },
        {
          "date": "",
          "hospital": "SEVERANCE HOSPITAL 159 / 77 CD, TCD",
          "reason": "정기 진료",
          "diagnosis": "미확인",
          "notes": ""
        },
        {
          "date": "",
          "hospital": "SEVERANCE HOSPITAL 원본대조필 등록번호: 8633158 주민등록번호: 550112-125****남/65세 환자명: 이광욱 외래재진기록",
          "reason": "정기 진료",
          "diagnosis": "미확인",
          "notes": ""
        },
        {
          "date": "",
          "hospital": "SEVERANCE HOSPITAL 원본대조필 등록번호: 8633158 주민등록번호: 550112-125**** 남/67세 환자명: 이광욱 영상검사 CT& MR 영상검사 CT& MR 검사명 MRI Brain & Angio 3D(Neck포함) (contrast) 검사방법 검사일자 판독일자",
          "reason": "정기 진료",
          "diagnosis": "미확인",
          "notes": ""
        },
        {
          "date": "",
          "hospital": "SEVERANCE HOSPITAL 원본대조필 등록번호: 8633158 주민등록번호: 550112-125****남/65세 환자명 : 이광욱 외래재진기록",
          "reason": "정기 진료",
          "diagnosis": "미확인",
          "notes": ""
        },
        {
          "date": "",
          "hospital": "SEVERANCE HOSPITAL 1/1 출력일:",
          "reason": "정기 진료",
          "diagnosis": "미확인",
          "notes": ""
        },
        {
          "date": "",
          "hospital": "SEVERANCE HOSPITAL 원본대조필 등록번호: 8633158 기능검사결과(I/F형) 주민등록번호: 550112-125**** 남/66세 환자명: 이광욱",
          "reason": "정기 진료",
          "diagnosis": "미확인",
          "notes": "(I/F형) 주민등록번호: 550112-125**** 남/66세 환자명: 이광욱"
        },
        {
          "date": "",
          "hospital": "SEVERANCE HOSPITAL 2/2 출력일:",
          "reason": "정기 진료",
          "diagnosis": "미확인",
          "notes": ""
        },
        {
          "date": "",
          "hospital": "SEVERANCE HOSPITAL 원본대조필 등록번호: 8633158 주민등록번호: 550112-125**** 남/65세 환자명: 이광욱 영상검사 특수촬영-초음파 영상검사 특수촬영-초음파 검사명 U/S 경부(neck)(Doppler) 검사방법 검사일자 판독일자",
          "reason": "정기 진료",
          "diagnosis": "미확인",
          "notes": ""
        },
        {
          "date": "",
          "hospital": "SEVERANCE HOSPITAL Both thyroid gland 에 multiple probably benign nodules 들이 관찰되며, 가장 큰 것은 Rt thyroid lower pole의 15mm 크기의 nodule 임. Both neck에 pathologically enlarged LNs 없음. Doppler ultrasound images 상 특이소견 없음. IMP: Multiple probably benign nodules in both thyroids, recommend follow up. 손진우/손진우/윤정현 1/1 출력일:",
          "reason": "정기 진료",
          "diagnosis": "미확인",
          "notes": "없음. IMP: Multiple probably benign nodules in both thyroids, recommend follow up. 손진우/손진우/윤정현 1/1 출력일:"
        },
        {
          "date": "",
          "hospital": "SEVERANCE HOSPITAL 원본대조필 등록번호: 8633158 주민등록번호: 550112-125**** 남/67세 환자명: 이광욱 검사명 검사방법 검사일자 판독일자 Description 판독의/전문의 영상검사 특수촬영-초음파 영상검사 특수촬영-초음파 U/S 경부(neck)(Doppler)",
          "reason": "정기 진료",
          "diagnosis": "미확인",
          "notes": ""
        },
        {
          "date": "",
          "hospital": "SEVERANCE HOSPITAL 원본대조필 등록번호: 8633158 주민등록번호: 550112-125**** 남/65세 환자명: 이광욱 진료과 내분비내과 주치의 강은석 BP(S) 146 mmHg BP(D) 경과 및 Plan 기록자명 강은석 75mmHg HR 85/min CAD(2vd+ LM) s/p CAG (2018.04, 일산백) s/p 4OPCAB(LIMA to dLAD, to OM(seq) to DG with RIMA composite Y, Aorta to rPL with RA) (",
          "reason": "정기 진료",
          "diagnosis": "미확인",
          "notes": ""
        },
        {
          "date": "",
          "hospital": "SEVERANCE HOSPITAL 원본대조필 등록번호: 8633158 주민등록번호: 550112-125**** 남/66세 환자명: 이광욱 외래재진기록",
          "reason": "정기 진료",
          "diagnosis": "미확인",
          "notes": ""
        },
        {
          "date": "",
          "hospital": "SEVERANCE HOSPITAL 원본대조필 등록번호: 8633158 기능검사결과(I/F형) 주민등록번호: 550112-125**** 남/66세 환자명: 이광욱",
          "reason": "정기 진료",
          "diagnosis": "미확인",
          "notes": "(I/F형) 주민등록번호: 550112-125**** 남/66세 환자명: 이광욱"
        },
        {
          "date": "",
          "hospital": "SEVERANCE HOSPITAL 2/2 출력일:",
          "reason": "정기 진료",
          "diagnosis": "미확인",
          "notes": ""
        },
        {
          "date": "",
          "hospital": "SEVERANCE HOSPITAL 70mmHg HR 86/min CAD(2vd+ LM) s/p CAG (2018.04, 일산백) s/p 4OPCAB(LIMA to dLAD, to OM(seq) to DG with RIMA composite Y, Aorta to rPL with RA) (",
          "reason": "정기 진료",
          "diagnosis": "미확인",
          "notes": ""
        },
        {
          "date": "",
          "hospital": "미확인 의료기관",
          "reason": "정기 진료",
          "diagnosis": "구분 확진 주진단 확진 기타진단 확진 |기타진단 확진 - s/p PTA c DCB at Rt. SFA",
          "notes": "진단 확진 |기타진단 확진 - s/p PTA c DCB at Rt. SFA"
        },
        {
          "date": "",
          "hospital": "미확인 의료기관",
          "reason": "정기 진료",
          "diagnosis": "전자서명자: 안철민 1/1 출력일:",
          "notes": ""
        },
        {
          "date": "",
          "hospital": "SEVERANCE HOSPITAL 원본대조필 등록번호: 8633158 주민등록번호: 550112-125**** 남/67세 환자명 : 이광욱 검사결과 1. ABI (Ankle/ Brachial Index) Rt: 0.96 /Lt: 0.88 - Impression Name Image 1 Name: ID #: Exam Date: LEE K.W 8633158",
          "reason": "정기 진료",
          "diagnosis": "미확인",
          "notes": "1. ABI (Ankle/ Brachial Index) Rt: 0.96 /Lt: 0.88 - Impression Name Image 1 Name: ID #: Exam Date: LEE K.W 8633158"
        },
        {
          "date": "",
          "hospital": "SEVERANCE HOSPITAL 원본대조필 등록번호: 8633158 기능검사결과(I/F형) 주민등록번호: 550112-125****남/67세 환자명: 이광욱",
          "reason": "정기 진료",
          "diagnosis": "미확인",
          "notes": "(I/F형) 주민등록번호: 550112-125****남/67세 환자명: 이광욱"
        },
        {
          "date": "",
          "hospital": "SEVERANCE HOSPITAL 2/2 출력일:",
          "reason": "정기 진료",
          "diagnosis": "미확인",
          "notes": ""
        },
        {
          "date": "",
          "hospital": "미확인 의료기관",
          "reason": "정기 진료",
          "diagnosis": "구분 확진 CAD(2vd+LM) s/p CAG (2018.04, 일산백) s/p_4OPCAB(LIMA to dLAD, to OM(seq) to DG with RIMA composite Y, Aorta to rPL with RA) (",
          "notes": ""
        },
        {
          "date": "",
          "hospital": "SEVERANCE HOSPITAL 진단명 외래재진기록",
          "reason": "정기 진료",
          "diagnosis": "확진 Diabetes mellitus type 2 with dyslipidemia |기타진단 확진 Thyroid nodule |기타진단 확진 Internal carotid artery stenosis 기록자명 강은석 전자서명자: 강은석 세브란스병원 SEVERANCE HOSPITAL 진단명 외래재진기록",
          "notes": "진단 확진 Thyroid nodule |기타진단 확진 Internal carotid artery stenosis 기록자명 강은석 전자서명자: 강은석 세브란스병원 SEVERANCE HOSPITAL 진단명 외래재진기록"
        },
        {
          "date": "",
          "hospital": "미확인 의료기관",
          "reason": "정기 진료",
          "diagnosis": "구분 확진 주진단 확진 |기타진단 확진 Diabetes mellitus type 2 with dyslipidemia Thyroid nodule |기타진단 확진 Internal carotid artery stenosis 진단명 기록자명 김다함 외래재진기록",
          "notes": "진단 확진 Diabetes mellitus type 2 with dyslipidemia Thyroid nodule |기타진단 확진 Internal carotid artery stenosis 진단명 기록자명 김다함 외래재진기록; 없음. Imp: Multiple probably benign nodules in both thyroids(K-TIRADS: 3) recommend follow up. T3 0.89 Free T4 1.04 TSH2.58 추가사항 Thyroid nodule Plan 2yf/u 진단명 구분 확진 주진단 확진 |기타진단 확진 Diabetes mellitus type 2 with dyslipidemia Thyroid nodule |기타진단 확진 Internal carotid artery stenosis 진단명 기록자명 김다함 외래재진기록"
        },
        {
          "date": "",
          "hospital": "SEVERANCE HOSPITAL 원본대조필 등록번호: 8633158 주민등록번호: 550112-125**** 남/69세 환자명: 이광욱 영상검사 특수촬영 - 초음파 영상검사 특수촬영-초음파 검사명 U/S 경부(neck)(Doppler) 검사방법 검사일자 판독일자",
          "reason": "정기 진료",
          "diagnosis": "미확인",
          "notes": ""
        },
        {
          "date": "",
          "hospital": "SEVERANCE HOSPITAL 촬영실 암)갑상선초음파 1검사실 Clinical information: Diabetes mellitus type 2 with dyslipidemia US examination was done with linear transducer> =10 MHz (central frequency). 이전 US와 비교함 Both thyroid gland 에 multiple probably benign nodules 들이 관찰되며 가장 큰 것은 Rt thyroid lower pole의 21mm 크기의 nodule 임. Background echotexture는 subtle heterogeneous 하며 mild diffuse enlarge 되어 있음. Both neck에 pathologically enlarged LNs 없음. Doppler ultrasound images 상 특이소견 없음. Imp: Multiple probably benign nodules in both thyroids (K-TIRADS: 3) R/O Diffuse thyroid disease recommend follow up. 함주현/함주현/함주현 1/1 출력일:",
          "reason": "정기 진료",
          "diagnosis": "미확인",
          "notes": "없음. Imp: Multiple probably benign nodules in both thyroids (K-TIRADS: 3) R/O Diffuse thyroid disease recommend follow up. 함주현/함주현/함주현 1/1 출력일:"
        },
        {
          "date": "",
          "hospital": "미확인 의료기관",
          "reason": "정기 진료",
          "diagnosis": "구분 확진 CAD(2vd+ LM) s/p CAG (2018.04, 일산백) s/p4OPCAB(LIMA to dLAD, to OM(seq) to DG with RIMA composite Y, Aorta to rPL with RA) (",
          "notes": ""
        },
        {
          "date": "",
          "hospital": "미확인 의료기관",
          "reason": "정기 진료",
          "diagnosis": "확진 Diabetes mellitus type 2 with dyslipidemia |기타진단 확진 Thyroid nodule |기타진단 확진 Internal carotid artery stenosis 기록자명 강은석 진단명 외래재진기록",
          "notes": "진단 확진 Thyroid nodule |기타진단 확진 Internal carotid artery stenosis 기록자명 강은석 진단명 외래재진기록"
        },
        {
          "date": "",
          "hospital": "1/1 출력일:",
          "reason": "정기 진료",
          "diagnosis": "미확인",
          "notes": ""
        },
        {
          "date": "",
          "hospital": "미확인 의료기관",
          "reason": "정기 진료",
          "diagnosis": "구분 확진 주진단 확진 Unstable angina 기타진단 확진 Coronary artery disease (left main) 기타진단 확진 Coronary artery disease (2 vessel disease) 기록자명 안철민 진단명 전자서명자: 안철민 1/1 출력일:",
          "notes": "진단 확진 Coronary artery disease (left main) 기타진단 확진 Coronary artery disease (2 vessel disease) 기록자명 안철민 진단명 전자서명자: 안철민 1/1 출력일:"
        },
        {
          "date": "",
          "hospital": "SEVERANCE HOSPITAL 원본대조필 ========== 파일: i?￢i??i?? i§?e￡?e?´i?­.pdf ==========",
          "reason": "정기 진료",
          "diagnosis": "미확인",
          "notes": ""
        },
        {
          "date": "",
          "hospital": "&약국별 개인진료정보요약 정보주체 : 이광욱 열람대상기간 :",
          "reason": "정기 진료",
          "diagnosis": "미확인",
          "prescription": "조제정보 병·의원&약국별 개인진료정보요약 정보주체 : 이광욱 열람대상기간 :",
          "notes": ""
        },
        {
          "date": "",
          "hospital": "(양방)경 28,030 3,830 24,200 쇄 및 협착 (양방)경 2",
          "reason": "정기 진료",
          "diagnosis": "미확인",
          "notes": ""
        },
        {
          "date": "",
          "hospital": "1 778,260 311,360 466,900 쇄 및 협착 의료법인 세경 4",
          "reason": "정기 진료",
          "diagnosis": "미확인",
          "notes": ""
        },
        {
          "date": "",
          "hospital": "(양방)녹 145,440 내장 의심 87,340 58,100 5",
          "reason": "정기 진료",
          "diagnosis": "미확인",
          "notes": ""
        },
        {
          "date": "",
          "hospital": "25,640 3,840 21,800 타 명시된 합병증을 7",
          "reason": "정기 진료",
          "diagnosis": "미확인",
          "notes": ""
        },
        {
          "date": "",
          "hospital": "80,810 32,410 48,400 타 명시된 합병증을 9",
          "reason": "정기 진료",
          "diagnosis": "미확인",
          "notes": ""
        },
        {
          "date": "",
          "hospital": "학과 (양방)기 타 및 상세 외래 Al109 불명의 원 발성 고혈 압 1 21,170 12,770 8,400 (양방)지 10",
          "reason": "정기 진료",
          "diagnosis": "미확인",
          "notes": ""
        },
        {
          "date": "",
          "hospital": "목의 상세 외래 AS6359 불명 부분 의 염좌 긴장 1 39,420 23,720 15,700 . 본 자료는 병·의원&약국에서 청구한 요양급여비용 명세서를 기준으로 작성된 자료입니다. 진료비에는 국민건강보험법 제41조의4에 따른 선별급여 관련 금액이 포함되어 있지 않습니다. 이에 본 자료를 단순 참고가 아닌 증빙자료로 사용할 수 없으며, 이용에 관한 책임은 이용자에게 있습니다. 1/10 빈경환",
          "reason": "정기 진료",
          "diagnosis": "미확인",
          "notes": "가 아닌 증빙자료로 사용할 수 없으며, 이용에 관한 책임은 이용자에게 있습니다. 1/10 빈경환"
        },
        {
          "date": "",
          "hospital": "세불명의 1 급성 상기 도감염 24,130 19,330 4,800 (양방)달 리 분류되 15",
          "reason": "정기 진료",
          "diagnosis": "미확인",
          "notes": ""
        },
        {
          "date": "",
          "hospital": "타 명시된 합병증을 1 145,330 51,730 93,600 16",
          "reason": "정기 진료",
          "diagnosis": "미확인",
          "notes": ""
        },
        {
          "date": "",
          "hospital": "가정의 학과 (양방)죽 외래 A1251 상경화성 심장병 1 12,290 7,390 4,900 (양방)상 19",
          "reason": "정기 진료",
          "diagnosis": "미확인",
          "notes": ""
        },
        {
          "date": "",
          "hospital": "내과 외래 AJ209 세불명의 급성 기관 지염 16,960 11,060 5,900 (양방)급 20",
          "reason": "정기 진료",
          "diagnosis": "미확인",
          "notes": ""
        },
        {
          "date": "",
          "hospital": "1 113,930 39,330 74,600 타 명시된 합병증을 (양방)상 22",
          "reason": "정기 진료",
          "diagnosis": "미확인",
          "notes": ""
        },
        {
          "date": "",
          "hospital": "세불명 부 외래 학과 AI213 위의 급성 경색증 1 16,650 10,050 6,600 전층심근 본 자료는 병·의원&약국에서 청구한 요양급여비용 명세서를 기준으로 작성된 자료입니다. 진료비에는 국민건강보험법 제41조의4에 따른 선별급여 관련 금액이 포함되어 있지 않습니다. . . 이에 본 자료를 단순 참고가 아닌 증빙자료로 사용할 수 없으며, 이용에 관한 책임은 이용자에게 있습니다. 빈경환 2/10",
          "reason": "정기 진료",
          "diagnosis": "미확인",
          "notes": "가 아닌 증빙자료로 사용할 수 없으며, 이용에 관한 책임은 이용자에게 있습니다. 빈경환 2/10"
        },
        {
          "date": "",
          "hospital": "(양방)녹 1 196,190 117,790 78,400 내장 의심 26",
          "reason": "정기 진료",
          "diagnosis": "미확인",
          "notes": ""
        },
        {
          "date": "",
          "hospital": "(양방)불 195,570 104,370 91,200 증 28",
          "reason": "정기 진료",
          "diagnosis": "미확인",
          "notes": ""
        },
        {
          "date": "",
          "hospital": "(양방)녹 23,890 내장 의심 14,390 9,500 30",
          "reason": "정기 진료",
          "diagnosis": "미확인",
          "notes": ""
        },
        {
          "date": "",
          "hospital": "31",
          "reason": "정기 진료",
          "diagnosis": "미확인",
          "notes": ""
        },
        {
          "date": "",
          "hospital": "타 명시된 1 88,760 35,560 53,200 합병증을 ?본 자료는 병·의원&약국에서 청구한 요양급여비용 명세서를 기준으로 작성된 자료입니다. 진료비에는 국민건강보험법 제41조의4에 따른 선별급여 관련 금액이 포함되어 있지 않습니다. 이에 본 자료를 단순 참고가 아닌 증빙자료로 사용할 수 없으며, 이용에 관한 책임은 이용자에게 있습니다. 3/10 빈경환",
          "reason": "정기 진료",
          "diagnosis": "미확인",
          "notes": "가 아닌 증빙자료로 사용할 수 없으며, 이용에 관한 책임은 이용자에게 있습니다. 3/10 빈경환"
        },
        {
          "date": "",
          "hospital": "(양방)녹 내장 의심 23,050 13,850 9,200 35",
          "reason": "정기 진료",
          "diagnosis": "미확인",
          "notes": ""
        },
        {
          "date": "",
          "hospital": "(양방)녹 1 내장 의심 131,150 78,750 52,400 37",
          "reason": "정기 진료",
          "diagnosis": "미확인",
          "notes": ""
        },
        {
          "date": "",
          "hospital": "24,760 3,760 21,000 연세대학교의 (양방)경 39",
          "reason": "정기 진료",
          "diagnosis": "미확인",
          "notes": ""
        },
        {
          "date": "",
          "hospital": "24,760 3,760 21,000 쇄 및 협착 <",
          "reason": "정기 진료",
          "diagnosis": "미확인",
          "notes": ""
        },
        {
          "date": "",
          "hospital": "845,790 338,390 507,400 쇄 및 협착 (양방)달 연세대학교의 리 분류되 42",
          "reason": "정기 진료",
          "diagnosis": "미확인",
          "notes": ""
        },
        {
          "date": "",
          "hospital": "타 명시된 합병증을 43",
          "reason": "정기 진료",
          "diagnosis": "미확인",
          "notes": ""
        },
        {
          "date": "",
          "hospital": "타 및 상세 \"불명의 난 26,020 15,620 10,400 \"시\" 의료법인 세경 진료과 (양방)기 49",
          "reason": "정기 진료",
          "diagnosis": "미확인",
          "notes": ""
        },
        {
          "date": "",
          "hospital": "<",
          "reason": "정기 진료",
          "diagnosis": "미확인",
          "notes": ""
        },
        {
          "date": "",
          "hospital": "99,460 59,760 39,700 내장, 양쪽 의료법인 세경 (양방)기 55",
          "reason": "정기 진료",
          "diagnosis": "미확인",
          "notes": ""
        },
        {
          "date": "",
          "hospital": "타 및 상세 1 126,890 76,190 50,700 시 본 자료는 병·의원&약국에서 청구한 요양급여비용 명세서를 기준으로 작성된 자료입니다. . 진료비에는 국민건강보험법 제41조의4에 따른 선별급여 관련 금액이 포함되어 있지 않습니다. . 빈경환 이에 본 자료를 단순 참고가 아닌 증빙자료로 사용할 수 없으며, 이용에 관한 책임은 이용자에게 있습니다. 5/10",
          "reason": "정기 진료",
          "diagnosis": "미확인",
          "notes": "가 아닌 증빙자료로 사용할 수 없으며, 이용에 관한 책임은 이용자에게 있습니다. 5/10"
        },
        {
          "date": "",
          "hospital": "&약국에서 청구한 요양급여비용 명세서를 기준으로 작성된 자료입니다. . 진료비에는 국민건강보험법 제41조의4에 따른 선별급여 관련 금액이 포함되어 있지 않습니다. ?이에 본 자료를 단순 참고가 아닌 증빙자료로 사용할 수 없으며, 이용에 관한 책임은 이용자에게 있습니다. 빈경환 6/10",
          "reason": "정기 진료",
          "diagnosis": "미확인",
          "notes": "가 아닌 증빙자료로 사용할 수 없으며, 이용에 관한 책임은 이용자에게 있습니다. 빈경환 6/10"
        },
        {
          "date": "",
          "hospital": "(양방)만 치주과 외래 AK0530 성 단순치 1 주영 53,340 37,340 16,000 68",
          "reason": "정기 진료",
          "diagnosis": "미확인",
          "notes": ""
        },
        {
          "date": "",
          "hospital": "이비인 후과 외래 AH612 (양방)귀 지떡 1 52,650 36,950 15,700 69",
          "reason": "정기 진료",
          "diagnosis": "미확인",
          "notes": ""
        },
        {
          "date": "",
          "hospital": "치과보 철과 외래 AK081 또는 국한 성치주병 에의한 치 1 564,010 394,810 169,200 74",
          "reason": "정기 진료",
          "diagnosis": "미확인",
          "notes": ""
        },
        {
          "date": "",
          "hospital": "철과 외래 AK081 또는 국한 성치주병 에 의한 0 558,750 391,150 167,600 77",
          "reason": "정기 진료",
          "diagnosis": "미확인",
          "notes": ""
        },
        {
          "date": "",
          "hospital": "(양방)만 치주과 외래 AK0530 성 단순치 1 주염 37,990 26,690 11,300 본 자료는 병·의원&약국에서 청구한 요양급여비용 명세서를 기준으로 작성된 자료입니다. 진료비에는 국민건강보험법 제41조의4에 따른 선별급여 관련 금액이 포함되어 있지 않습니다. ?이에 본 자료를 단순 참고가 아닌 증빙자료로 사용할 수 없으며, 이용에 관한 책임은 이용자에게 있습니다. 7/10 빈경환",
          "reason": "정기 진료",
          "diagnosis": "미확인",
          "notes": "가 아닌 증빙자료로 사용할 수 없으며, 이용에 관한 책임은 이용자에게 있습니다. 7/10 빈경환"
        },
        {
          "date": "",
          "hospital": "치과보 존과 외래 AK081 또는 국한 성치주병 에 의한 치 1 545,790 382,090 163,700 (양방)사 79",
          "reason": "정기 진료",
          "diagnosis": "미확인",
          "notes": ""
        },
        {
          "date": "",
          "hospital": "치과보 철과 외래 AK081 또는 국한 성치주병 에 의한 116,800 81,800 35,000 82",
          "reason": "정기 진료",
          "diagnosis": "미확인",
          "notes": ""
        },
        {
          "date": "",
          "hospital": "구강악 (양방)만 안면외 외래 AK0531 성 복합치 1 과 주영 25,480 17,880 7,600 (양방)만 88",
          "reason": "정기 진료",
          "diagnosis": "미확인",
          "notes": ""
        },
        {
          "date": "",
          "hospital": "&약국에서 청구한 요양급여비용 명세서를 기준으로 작성된 자료입니다. ?진료비에는 국민건강보험법 제41조의4에 따른 선별급여 관련 금액이 포함되어 있지 않습니다. ?이에 본 자료를 단순 참고가 아닌 증빙자료로 사용할 수 없으며, 이용에 관한 책임은 이용자에게 있습니다. 8/10 빈경환",
          "reason": "정기 진료",
          "diagnosis": "미확인",
          "notes": "가 아닌 증빙자료로 사용할 수 없으며, 이용에 관한 책임은 이용자에게 있습니다. 8/10 빈경환"
        },
        {
          "date": "",
          "hospital": "구강악 (양방)만 안면외 외래 AK0531 성 복합치 1 과 주염 13,720 12,220 1,500 (양방)만 90",
          "reason": "정기 진료",
          "diagnosis": "미확인",
          "notes": ""
        },
        {
          "date": "",
          "hospital": "(양방)만 치주과 외래 AK0530 성 단순치 주염 1 32,540 22,840 9,700 92",
          "reason": "정기 진료",
          "diagnosis": "미확인",
          "notes": ""
        },
        {
          "date": "",
          "hospital": "치과보 존과 (양방)상 외래 AK074 세불명의 부정교합 1 17,880 16,180 1,700 (양방)만 93",
          "reason": "정기 진료",
          "diagnosis": "미확인",
          "notes": ""
        },
        {
          "date": "",
          "hospital": "철과 외래 AK081 또는 국한 116,800 81,800 35,000 성 치주병 에 의한 치 (양방)사 고, 추출 <",
          "reason": "정기 진료",
          "diagnosis": "미확인",
          "notes": ""
        },
        {
          "date": "",
          "hospital": "철과 외래 AK081 또는 국한 성치주병 에 의한 치 1 546,230 382,430 163,800 (양방)사 고, 추출 99",
          "reason": "정기 진료",
          "diagnosis": "미확인",
          "notes": ""
        },
        {
          "date": "",
          "hospital": "치과보 철과 외래 AK081 또는 국한 1 116,800 81,800 35,000 성 치주병 에 의한 치 본 자료는 병·의원&약국에서 청구한 요양급여비용 명세서를 기준으로 작성된 자료입니다. . 진료비에는 국민건강보험법 제41조의4에 따른 선별급여 관련 금액이 포함되어 있지 않습니다. . 이에 본 자료를 단순 참고가 아닌 증빙자료로 사용할 수 없으며, 이용에 관한 책임은 이용자에게 있습니다. 빈경환 9/10 외래 코드 일수(건강보험 적용분) 혜택받은 금액| (진료비) 100",
          "reason": "정기 진료",
          "diagnosis": "미확인",
          "notes": "가 아닌 증빙자료로 사용할 수 없으며, 이용에 관한 책임은 이용자에게 있습니다. 빈경환 9/10 외래 코드 일수(건강보험 적용분) 혜택받은 금액| (진료비) 100"
        },
        {
          "date": "",
          "hospital": "&약국에서 청구한 요양급여비용 명세서를 기준으로 작성된 자료입니다. 진료비에는 국민건강보험법 제41조의4에 따른 선별급여 관련 금액이 포함되어 있지 않습니다. 이에 본 자료를 단순 참고가 아닌 증빙자료로 사용할 수 없으며, 이용에 관한 책임은 이용자에게 있습니다.",
          "reason": "정기 진료",
          "diagnosis": "미확인",
          "notes": "가 아닌 증빙자료로 사용할 수 없으며, 이용에 관한 책임은 이용자에게 있습니다."
        }
      ],
      "hospitalizationRecords": [
        {
          "date": "",
          "hospital": "미확인 의료기관",
          "reason": "※약관을 모바일(문자)를 통해 수련하는 것에 대한 동의여부{V 동의 [동의안함) ※본인수의자 지정 변경 관련 추가약정( 5 약정함 이조훈 (서명) 약정하지 아니함 (약정함을 선택한 경우) 본인(보험계약자)이 사망한 경우에는 상속인 등 승계인이 보험수익자 지정·변경권을 행사합니다 부) ※(대상: 피보험자) 의료급여 수급권자 보험료 할인 신청 ( = 여 -자격취득일로부터 실손의료비 보장 보험계약의 매회 납입할 보장종목별 보장보험료의 5%를 할인하여 드립니다. ※청약유효일자: 2024 10-31 까지 LW",
          "diagnosis": ". 장해, 사고 후 보험가입 등)는 형법상 금지된 범죄입니다. 구분! 계약자 자 i 필서명 필: 성명 이조훈 주피보험자 종피보험자 1 종피보험자2 종피보험자3 종피보험자4 종피보험자5 이광욱 법정대리인(친권자) 관 서명 이조훈 이광욱 * 가입자보관용 청약서상에 자필서명하셨습니까? 예 = 아니오 * 보험계약자 또는 피보험자가 미성년자인 경우 법정대리인이 서명하여 주시기 바랍니다. *피보험자(보험대상자 본인이 자필서명을 하지 않으신 경우에는 보험계약이 무효가 되어 보장을 받지 못할 수도 있습니다 *계약의 보장개시 효력은 1회 보험료를 납입하신 때부터입니다. 뒷면의 꼭 아셔야 할 사항을 반드시 확인하시기 바랍니다. ※안내장 발송(7 동의 동의안함 * 안내장 발송형태(ㄷ 모바일 안내장 E-Mail/E-Ma주소 ※약관을 모바일(문자)를 통해 수련하는 것에 대한 동의여부{V 동의 [동의안함) ※본인수의자 지정 변경 관련 추가약정( 5 약정함 이조훈 (서명) 약정하지 아니함 (약정함을 선택한 경우) 본인(보험계약자)이 사망한 경우에는 상속인 등 승계인이 보험수익자 지정·변경권을 행사합니다 부) ※(대상: 피보험자) 의료급여 수급권자 보험료 할인 신청 ( = 여 -자격취득일로부터 실손의료비 보장 보험계약의 매회 납입할 보장종목별 보장보험료의 5%를 할인하여 드립니다. ※청약유효일자: 2024 10-31 까지 LW",
          "admissionPeriod": "undefined ~ undefined",
          "surgeryInfo": null,
          "notes": ""
        },
        {
          "date": "",
          "hospital": "(1644-9000)] ☞ 보험에 가입하신 후 d. 보험증권을 받으시면 청약서 내용과 다름이 없는 지 또는 누락이 없는 지 확인하시기 바랍니다. 1 청약서 기재사항에 변동사항(피보험자의 직업 및 직무의 변경, 보험목적의 양도, 건물 구조 또는 용도의 변경, 보험목적을 다른 장소로 옮기는 경우, 수리하는 경우 등)이 있거나 다른 보험에 가입하실 경우 회사에 즉시 연락하시기 바랍니다. 3 보험계약의 내용을 변경하고자 할 경우에는 회사의 승낙을 얻어야 합니다. 4 손해가 생긴 경우에는 지체없이 이를 회사에 알려서 필요한 절차를 안내 받으시기 바랍니다. 5 보험금 지급사유의 조사 및 확인을 위하여 보험금 지급기일 초과가 명백히 예상되는 경우에는 피보험자 또는 수익자의 청구에 따라 회사가 추정 하는 보험금의 50% 상당액을 가지급보험금으로 지급하여 드립니다. [ 실손의료비를 가입하신 경우 이 보험계약에서 보장하는 실손의료비는 동 비용을 담보하는 다수의 보험계약에 체결되어 있는 경우, 약관에 따라 비례하여 보상합니다. 다만, 이미 가입된 보험 계약에서 보상한 금액이 본인이 부담한 의료비를 초과하였을 때에는 보험금이 지급되지 않을 수 있습니다. ( 갱신형 실손의료비 특별약관은 기본계약 보험기간 이내에서 매 1년마다 자동갱신되며, 갱신시 연령의 증가와 적용요율 등의 변동에 따라 보험료가 달라 질 수 있으며, 보험료 인상시에는 추가납입 하여야 계약이 유지됩니다. 3 피보험자가 동일한 회사에 보험기간이 3개월 이상인 해외실손의료비에 가입하고, 연속하여 3개월이상의 해외 체류사실이 확인되는 경우 실손의료보험의 보험료납입을 일정기간 중지해주거나 사후에 해당 기간의 표준화실손상품(",
          "reason": "응급실 내원",
          "diagnosis": "을 지원하는 계약, 보험기간(보장기간)이 90일 이내인 계약, 법률에 따라 가입의무 부과 및 해제·해지가 가능한 보험 (다만, 계약자가 동종의 다른 보험에 가입한 경우는 제외)은 청약을 철회할 수 없습니다. 5 화재손해특약은 계약 체결시에 보험에 가입한 물건의 가치(이하 '보험가액'이라 합니다)를 평가하지 않고 사고시 보험가액을 산정하여 보험가입 금액을 한도로 보상하는 미평가 보험입니다. 보험가입금액은 시가와 똑같이 정해야 합니다. 만약 시가보다 낮게 정하면 납입보험료 부담은 줄어 들지만 사고가 발생하였을 때 줄어든 비율만큼 적게 보상받고 높게 정하더라도 사고가 발생하면 실제로 입은 손해액만큼 보상받게 됩니다. 6 가재도구를 보험에 가입할 경우 귀금속. 귀중품(무게나 부피가 휴대할 수 있으며 점당 300만원이상). 골동품 등은 별도로 기재하여야만 보상의 대상이 됩니다. · 약관의 보상하는 손해와 보상하지 아니하는 손해를 확인하셔야 합니다. ※ 보험금 수익자의 지정에 관한 사항 계약자는 사망보험금, 중도보험금, 만기보험금, 장해보험금, 입원보험금 등 약관상 보험금 지급사유가 발생하는 때에 회사에 보험금을 청구하여 받을 수 있는 사람(보험수익자)을 지정하실 수 있습니다. 사망보험금 수익자를 지점/변경하고자 할 경우에는 사망보험금 지급사유가 발생하기 전에 피보험자가 서면으로 동의해야 합니다. 만약 계약자가 보험 수익자를 지정하지 않은 때에는 민법상 피보험자의 법정상속인 순위로 보험수익자를 정합니다. 민법상 법정상속인 순위 : 1. 직계비속. 2. 직계존속. 3. 형제자매. 4. 4촌 이내의 방계 혈족 배우자는 위의 1. 2순위 상속인이 있는 경우에 그 상속인과 동순위로 공동상속인이 되고, 그 상속인이 없는 때에는 단독상속인이 됨 (수익자 지정/변경 등에 필요한}구비서류 : (계약자 및 피보험자와 변경 후 수익자) 각 신분증 [수역자 지정 관련 문의 : 콜센터(1644-9000)] ☞ 보험에 가입하신 후 d. 보험증권을 받으시면 청약서 내용과 다름이 없는 지 또는 누락이 없는 지 확인하시기 바랍니다. 1 청약서 기재사항에 변동사항(피보험자의 직업 및 직무의 변경, 보험목적의 양도, 건물 구조 또는 용도의 변경, 보험목적을 다른 장소로 옮기는 경우, 수리하는 경우 등)이 있거나 다른 보험에 가입하실 경우 회사에 즉시 연락하시기 바랍니다. 3 보험계약의 내용을 변경하고자 할 경우에는 회사의 승낙을 얻어야 합니다. 4 손해가 생긴 경우에는 지체없이 이를 회사에 알려서 필요한 절차를 안내 받으시기 바랍니다. 5 보험금 지급사유의 조사 및 확인을 위하여 보험금 지급기일 초과가 명백히 예상되는 경우에는 피보험자 또는 수익자의 청구에 따라 회사가 추정 하는 보험금의 50% 상당액을 가지급보험금으로 지급하여 드립니다. [ 실손의료비를 가입하신 경우 이 보험계약에서 보장하는 실손의료비는 동 비용을 담보하는 다수의 보험계약에 체결되어 있는 경우, 약관에 따라 비례하여 보상합니다. 다만, 이미 가입된 보험 계약에서 보상한 금액이 본인이 부담한 의료비를 초과하였을 때에는 보험금이 지급되지 않을 수 있습니다. ( 갱신형 실손의료비 특별약관은 기본계약 보험기간 이내에서 매 1년마다 자동갱신되며, 갱신시 연령의 증가와 적용요율 등의 변동에 따라 보험료가 달라 질 수 있으며, 보험료 인상시에는 추가납입 하여야 계약이 유지됩니다. 3 피보험자가 동일한 회사에 보험기간이 3개월 이상인 해외실손의료비에 가입하고, 연속하여 3개월이상의 해외 체류사실이 확인되는 경우 실손의료보험의 보험료납입을 일정기간 중지해주거나 사후에 해당 기간의 표준화실손상품(",
          "admissionPeriod": "undefined ~ undefined",
          "surgeryInfo": null,
          "notes": ""
        },
        {
          "date": "",
          "hospital": "SEVERANCE HOSPITAL 퇴원요약",
          "reason": "(*) Diabetes mellitus other, without complication; Diabetes mellitus type 2, without complication; Diabetic polyneuropathy; Internal carotid artery stenosis;Internal carotid artery stenosis, right;Type 2 diabetes mellitus, coronary artery disease; E11.58;E11.9;E13.9;E14.41;165.2; For PTA 과거력 및 현재병력 상기 64세 남환 DM, CAOD (2vd, s/p CAG), PAOD 진단 받은 분으로 PTA 시행 위해 금일 입원함. V/S 120/70 78 20 Current Sx: none 이상 진찰 소견 (★) n-s 재원중 투약내역 (*) n-s 투여된 약물 중 잔류효과로 퇴원 후 주의가 필요한 약물 (*) 없음 있음 Aspirin protect->출혈의 위험성이 증가되므로 상처나 멍이 생기지 않도록 주의하십시오.; Platless-> 출혈의 위험성이 증가되므로 상처나 멍이 생기지 않도록 주의하십시오.; 전자서명자: 안철민 세브란스병원 SEVERANCE HOSPITAL 퇴원요약",
          "diagnosis": "(*) 순서 한국질병 구분 확진 진단명 분류번호 1 주진단 확진 Peripheral arterial occlusive disease (lower extremities) 170.29 2 기타진단 확진 Unstable angina 120.0 3 기타진단 확진 Coronary artery disease (left main) 125.1 4 기타진단 확진 Coronary artery disease (2 vessel disease) 125.1 5 기타진단 확진 S/P Coronary artery bypass graft Z95.1 과거진단명 과거진단코드 주호소 (*) Diabetes mellitus other, without complication; Diabetes mellitus type 2, without complication; Diabetic polyneuropathy; Internal carotid artery stenosis;Internal carotid artery stenosis, right;Type 2 diabetes mellitus, coronary artery disease; E11.58;E11.9;E13.9;E14.41;165.2; For PTA 과거력 및 현재병력 상기 64세 남환 DM, CAOD (2vd, s/p CAG), PAOD 진단 받은 분으로 PTA 시행 위해 금일 입원함. V/S 120/70 78 20 Current Sx: none 이상 진찰 소견 (★) n-s 재원중 투약내역 (*) n-s 투여된 약물 중 잔류효과로 퇴원 후 주의가 필요한 약물 (*) 없음 있음 Aspirin protect->출혈의 위험성이 증가되므로 상처나 멍이 생기지 않도록 주의하십시오.; Platless-> 출혈의 위험성이 증가되므로 상처나 멍이 생기지 않도록 주의하십시오.; 전자서명자: 안철민 세브란스병원 SEVERANCE HOSPITAL 퇴원요약",
          "admissionPeriod": "undefined ~ undefined",
          "surgeryInfo": null,
          "notes": "진단 확진 Unstable angina 120.0 3 기타진단 확진 Coronary artery disease (left main) 125.1 4 기타진단 확진 Coronary artery disease (2 vessel disease) 125.1 5 기타진단 확진 S/P Coronary artery bypass graft Z95.1 과거진단명 과거진단코드 주호소 (*) Diabetes mellitus other, without complication; Diabetes mellitus type 2, without complication; Diabetic polyneuropathy; Internal carotid artery stenosis;Internal carotid artery stenosis, right;Type 2 diabetes mellitus, coronary artery disease; E11.58;E11.9;E13.9;E14.41;165.2; For PTA 과거력 및 현재병력 상기 64세 남환 DM, CAOD (2vd, s/p CAG), PAOD 진단 받은 분으로 PTA 시행 위해 금일 입원함. V/S 120/70 78 20 Current Sx: none 이상 진찰 소견 (★) n-s 재원중 투약내역 (*) n-s 투여된 약물 중 잔류효과로 퇴원 후 주의가 필요한 약물 (*) 없음 있음 Aspirin protect->출혈의 위험성이 증가되므로 상처나 멍이 생기지 않도록 주의하십시오.; Platless-> 출혈의 위험성이 증가되므로 상처나 멍이 생기지 않도록 주의하십시오.; 전자서명자: 안철민 세브란스병원 SEVERANCE HOSPITAL 퇴원요약; (★) n-s 재원중 투약내역 (*) n-s 투여된 약물 중 잔류효과로 퇴원 후 주의가 필요한 약물 (*) 없음 있음 Aspirin protect->출혈의 위험성이 증가되므로 상처나 멍이 생기지 않도록 주의하십시오.; Platless-> 출혈의 위험성이 증가되므로 상처나 멍이 생기지 않도록 주의하십시오.; 전자서명자: 안철민 세브란스병원 SEVERANCE HOSPITAL 퇴원요약"
        },
        {
          "date": "",
          "hospital": "SEVERANCE HOSPITAL 출력자: 김경미 원본대조필 등록번호: 8633158 주민등록번호: 550112-125**** 남/64세 환자명: 이광욱 퇴원약 약품명 (Name) 용량(Dose) 일수(Days) 용법(Direction) 처방 분류 (Type) 효능 아스피린프로텍트 1 14 정100mg 아침 식후 30분 복용하십시오 퇴원약 헤르벤정 30mg 1 14 아침,저녁 식후 30 퇴원약 분 복용하십시오 리피토정 80mg 1 14 아침 식후 30분 퇴원약 복용하십시오 플래리스정 1 14 아침 식후 30분 복용하십시오 퇴원약 라비에트정10mg 1 14 아침 식전 30분 복 퇴원약 용하십시오 중외시그마트정 1 5mg 14 아침, 저녁 식후 30 퇴원약 분 복용하십시오 코자정100mg 1 14 아침 식후 30분 복용하십시오 퇴원약 아스피린프로텍트 1 19 정100mg 아침 식후 30분 복용하십시오 퇴원약 헤르벤정 30mg 1 19 아침,저녁 식후 30 퇴원약 분 복용하십시오 리피토정 80mg 1 19 아침 식후 30분 퇴원약 복용하십시오 플래리스정 1 19 아침 식후 30분 퇴원약 복용하십시오 라비에트정10mg 1 19 아침 식전 30분 복 퇴원약 용하십시오 중외시그마트정 1 5mg 19 아침,저녁 식후 30 퇴원약 분 복용하십시오 코자정100mg 1 19 아침 식후 30분 복용하십시오 퇴원약 담당 전공의사명 권혜란 기록자명 권혜란 주치의사명 안철민 <약어 설명> CAOD coronary artery obstructive disease RFCA radio-frequency catheter ablation NSTEMI non-ST elevation myocardial infarction C-angio : coronary angiogram A.fib: atrial fibrillation EPS electrophysiologic studies DCMP: dilated cardiomyopathy HCMP hypertrophic cardiomyopathy PAF paroxysmal atrial fibrillation RHD rheumatic heart disease NSVT non-sustained ventricular tachycardia A-flutter : atrial flutter 퇴원요약",
          "reason": "응급실 내원",
          "diagnosis": "미확인",
          "admissionPeriod": "undefined ~ undefined",
          "surgeryInfo": null,
          "notes": ""
        },
        {
          "date": "",
          "hospital": "SEVERANCE HOSPITAL 원본대조필 등록번호: 8633158 주민등록번호: 550112-125****남/64세 환자명: 이광욱 입원일자",
          "reason": "응급실 내원",
          "diagnosis": "미확인",
          "admissionPeriod": "undefined ~ undefined",
          "surgeryInfo": null,
          "notes": ""
        },
        {
          "date": "",
          "hospital": "SEVERANCE HOSPITAL 입원기록",
          "reason": "또는 입원사유 For PTA 현재질병상태 상기 64세 남환 DM, CAOD (2vd, s/p CAG), PAOD 진단 받은 분으로 PTA 시행 위해 금일 입원함. V/S 120/70 78 20 Current Sx none 과거력 Hypertension No Yes Pul. Tbc No Yes DM No Yes Hepatitis No Yes Smoking No Yes 금연교육 여부 시행 미시행 |해당없음 Alcohol No Yes Drug Allergy No Yes Penicillin Sulfonamide ? Cephalosporin Other 알레르기 No Yes Hypercholesterolemia No Yes Cardiac disease No Yes Old CVA No Yes 말초동맥 및 경동맥 질환 No Yes Coronary artery bypass graft No Yes Others 가족력 계통문진 Generalized Weakness No Easy Fatigue No Fever No Chill No Headache No 00000 Yes Yes Yes Yes Yes Dizziness No Yes Insomnia No Yes 전자서명자: 안철민 세브란스병원 SEVERANCE HOSPITAL 입원기록",
          "diagnosis": "받은 분으로 PTA 시행 위해 금일 입원함. V/S 120/70 78 20 Current Sx none 과거력 Hypertension No Yes Pul. Tbc No Yes DM No Yes Hepatitis No Yes Smoking No Yes 금연교육 여부 시행 미시행 |해당없음 Alcohol No Yes Drug Allergy No Yes Penicillin Sulfonamide ? Cephalosporin Other 알레르기 No Yes Hypercholesterolemia No Yes Cardiac disease No Yes Old CVA No Yes 말초동맥 및 경동맥 질환 No Yes Coronary artery bypass graft No Yes Others 가족력 계통문진 Generalized Weakness No Easy Fatigue No Fever No Chill No Headache No 00000 Yes Yes Yes Yes Yes Dizziness No Yes Insomnia No Yes 전자서명자: 안철민 세브란스병원 SEVERANCE HOSPITAL 입원기록",
          "admissionPeriod": "undefined ~ undefined",
          "surgeryInfo": null,
          "notes": ""
        },
        {
          "date": "",
          "hospital": "SEVERANCE HOSPITAL 입원기록",
          "reason": "응급실 내원",
          "diagnosis": "미확인",
          "admissionPeriod": "undefined ~ undefined",
          "surgeryInfo": null,
          "notes": ""
        },
        {
          "date": "",
          "hospital": "(감염주의 병원) 없음 있음 4. 밀접 접촉자 해당없음 아니오 예 5. 신종 감염병 의심환자 아니오 예 통증평가 통증여부 No Yes 추정진단 PAOD 계획 PTA 고려 퇴원계획 퇴원 후 치료식이 여부 ? N ? Y 추후 관리 계획 |가정간호사업소 호스피스 타 병원 전원 외래 사회 복지서비스 연계 필요성 ? N ? Y 기타 퇴원시 요구사항 치료계획 + Problem Goal 목표일 수정목표일 계획일 부 PAOD PTA",
          "reason": "및 기간 발열 기간 일전 호흡기증상 기간 일전 소화기증상 기간 일전 해당없음 (미상환자 포함) 2. 최근 1달 이내 방문한나라 해당없음 없음 있음 3. 최근 1달 이내 입원했던 병원 (감염주의 병원) 없음 있음 4. 밀접 접촉자 해당없음 아니오 예 5. 신종 감염병 의심환자 아니오 예 통증평가 통증여부 No Yes 추정진단 PAOD 계획 PTA 고려 퇴원계획 퇴원 후 치료식이 여부 ? N ? Y 추후 관리 계획 |가정간호사업소 호스피스 타 병원 전원 외래 사회 복지서비스 연계 필요성 ? N ? Y 기타 퇴원시 요구사항 치료계획 + Problem Goal 목표일 수정목표일 계획일 부 PAOD PTA",
          "diagnosis": "PAOD 계획 PTA 고려 퇴원계획 퇴원 후 치료식이 여부 ? N ? Y 추후 관리 계획 |가정간호사업소 호스피스 타 병원 전원 외래 사회 복지서비스 연계 필요성 ? N ? Y 기타 퇴원시 요구사항 치료계획 + Problem Goal 목표일 수정목표일 계획일 부 PAOD PTA",
          "admissionPeriod": "undefined ~ undefined",
          "surgeryInfo": null,
          "notes": "퇴원시 요구사항 치료계획 + Problem Goal 목표일 수정목표일 계획일 부 PAOD PTA"
        },
        {
          "date": "",
          "hospital": "SEVERANCE HOSPITAL 입원기록",
          "reason": "응급실 내원",
          "diagnosis": "미확인",
          "admissionPeriod": "undefined ~ undefined",
          "surgeryInfo": null,
          "notes": ""
        },
        {
          "date": "",
          "hospital": "SEVERANCE HOSPITAL 원본대조필 등록번호: 8633158 주민등록번호: 550112-125**** 남/64세 환자명: 이광욱 경과 [Puncture site assessment]: POD #1 1. Lt.CFA (Proglide) 1) Bleeding/Oozing (-) 2) Hematoma/Color change (-/-) 3) Distal assessment: Color/Pulse/Temperature change (-/-/-) Lt.DPA (2+) 4) Infection sign (-) 5) Puncture site pulse check (2+) 6) Bruit(+)/ Thrill (-) 7) 기존 compressive Dx 제거 후 betadine ball로 소독함. Medress #1로 새로 DX 시행함. +) Pulse examination * 0-absent/1+ diminished/2+ normal/3+ bounding 퇴원 후 천자부위 통증 증가, 부종, 감염의 징후, 말초부위 피부색 변 화, 상처 악화 등이 있을 경우 병원 내원하거나 연락하시도록 환자와 보호자 교육함. 계획 f/u 기록자명 김지영 전담간호사 경과기록",
          "reason": "응급실 내원",
          "diagnosis": "미확인",
          "admissionPeriod": "undefined ~ undefined",
          "surgeryInfo": null,
          "notes": ""
        },
        {
          "date": "",
          "hospital": "SEVERANCE HOSPITAL 원본대조필 등록번호: 8633158 주민등록번호: 550112-125**** 남/64세 환자명: 이광욱 연령 구분 분류 영유아기 학령전기 학령기 일반 산모 ㅇ정신 청소년기 성인 현병력 주 증상 및 내원 과정 Hx. DM, HTN, dyslipidemia, Unstable angina, CAOD, (2018.04), s/p CABG(2018.04), Rt. ICA stent insertion(2018.09) PTA 위해 입원함. 복용중인 약 투약 상태 개수 약명 횟수 용법 약품 코드 개수 단위 Aspirin protect [100 mg/1 T 1 PO 아침 식후 D2ASPI01 Glupa (48hr 전후 조영제 1 T 1 PO 아침 식후 D2GLUP02 병용금기) [500 mg/T] Herben [30 mg/T) 1 T 2 PO D2HERBO1 Lipitor [80 mg/T] 1 T 1 PO 아침 식후 D2LIPI12 Lozasartan(원외) [100 1 T 1 PO 아침 식후 DZLOZA02 mg/T] Platless [75 mg/T] 1 T 1 PO 아침 식후 D2PLAT01 Rabiet [10mg/T] 1 T 1 Sigmart [5 mg/T] 1 T 2 22 PO 아침 식전 D2RABI01 PO D2SIGM01 Xigduo XR 10/1000 (원 1 T 1 PO 아침 식후 D2XIGD02 외,48hr 전후 조영제 병용 금기) [1/1] 간호정보조사",
          "reason": "및 내원 과정 Hx. DM, HTN, dyslipidemia, Unstable angina, CAOD, (2018.04), s/p CABG(2018.04), Rt. ICA stent insertion(2018.09) PTA 위해 입원함. 복용중인 약 투약 상태 개수 약명 횟수 용법 약품 코드 개수 단위 Aspirin protect [100 mg/1 T 1 PO 아침 식후 D2ASPI01 Glupa (48hr 전후 조영제 1 T 1 PO 아침 식후 D2GLUP02 병용금기) [500 mg/T] Herben [30 mg/T) 1 T 2 PO D2HERBO1 Lipitor [80 mg/T] 1 T 1 PO 아침 식후 D2LIPI12 Lozasartan(원외) [100 1 T 1 PO 아침 식후 DZLOZA02 mg/T] Platless [75 mg/T] 1 T 1 PO 아침 식후 D2PLAT01 Rabiet [10mg/T] 1 T 1 Sigmart [5 mg/T] 1 T 2 22 PO 아침 식전 D2RABI01 PO D2SIGM01 Xigduo XR 10/1000 (원 1 T 1 PO 아침 식후 D2XIGD02 외,48hr 전후 조영제 병용 금기) [1/1] 간호정보조사",
          "diagnosis": "미확인",
          "admissionPeriod": "undefined ~ undefined",
          "surgeryInfo": null,
          "notes": ""
        },
        {
          "date": "",
          "hospital": "SEVERANCE HOSPITAL 2/5 출력일:",
          "reason": "응급실 내원",
          "diagnosis": "미확인",
          "admissionPeriod": "undefined ~ undefined",
          "surgeryInfo": null,
          "notes": "*이동시 주로 사용하는 보조기를 선택해 주세요. 식사하기 독립적 수행가능 목욕하기 독립적 수행가능 개인 위생 독립적 수행가능 옷입기 독립적 수행가능 화장실 사용 독립적 수행가능 계단 오르기 독립적 수행가능 이동하기 독립적 수행가능(휠체어를 제외한 walking aid 사용 할 수 있음) 이동 하기(의자와 침대간) 독립적 수행가능 이동 하기 (휠체어) 운동 규칙적으로 하는 운동 있음 운동의 종류 걷기 □ 달리기 □ 수영 1등산 골프 기타 운동 횟수 (매일 )회/주 1회 운동 시간 1시간~1시간30 음주력 Onondrinker ex-drinker current drinker 음주력(종류, 양, 횟수/wk) 소주 1병 주 3~4회 음주 시작 시기 20살 끊은 시기 2018.4 흡연력 흡연력 Ononsmoker ex-smoker current smoker 하루의 흡연량 (1)갑/일 흡연 시작시기 20살 끊은 시기 2016년 * 끊은 시기가 1년 이하인 경우 꼭 금연교육을 시행해 주세요. (퇴원전까지) 예방 접종 B형 간염 잘모름 Rubella 잘모름 폐구균 잘모름 영양 상태 1개월간 체중변화 없음 ㅇ 증가함 ㅇ 감소함 체중변화 kg 최근 1주일간 식사량 변화 없음 ㅇ 증가 감소 식이 주의 사항 ) 없음 ㅇ 열량 조절 ㅇ 체중 조절 ㅇ 염분 제한 ○ 수분 제한 ○ 단백질 제한 ㅇ 지방 제한 기타 식습관 식사횟수 3회/일 편식 습관 무 선호 음식 기피 음식 수면 상태 전자서명자: 김은경 세브란스병원 SEVERANCE HOSPITAL 2/5 출력일:"
        },
        {
          "date": "",
          "hospital": "요양시설 기타 퇴원 예정 교통 수단(Discharge transportation) 자가 대중 교통 항공 □ 구급차 |기타 일반 정보(6세 이상) 교육 정도 고등졸 결혼 상태 결혼 직업 사무직 원목 연락 전화번호",
          "reason": "응급실 내원",
          "diagnosis": "미확인",
          "admissionPeriod": "undefined ~ undefined",
          "surgeryInfo": null,
          "notes": "퇴원 예정지 ?자택 친척집 타병원 요양시설 기타 퇴원 예정 교통 수단(Discharge transportation) 자가 대중 교통 항공 □ 구급차 |기타 일반 정보(6세 이상) 교육 정도 고등졸 결혼 상태 결혼 직업 사무직 원목 연락 전화번호"
        },
        {
          "date": "",
          "hospital": "미확인 의료기관",
          "reason": "응급실 내원",
          "diagnosis": "미확인",
          "admissionPeriod": "undefined ~ undefined",
          "surgeryInfo": null,
          "notes": ""
        },
        {
          "date": "",
          "hospital": "미확인 의료기관",
          "reason": "(*) Diabetes mellitus other, without complication; Diabetes mellitus type 2, without complication;Diabetic polyneuropathy;Internal carotid artery stenosis;Internal carotid artery stenosis, right;Type 2 diabetes mellitus, coronary artery disease; E11.58;E11.9;E13.9;E14.41;165.2; C.C F/UDSA 과거력 및 현재병력 상기 64세 남환 HTN, DM, CAOD (2vd, s/p CAG), PAOD s/p PTA 과거력 있는분으로 2018.04 CABG 위해 Rt ICA stenosis 로 신경과 협진 후 CD 상 Rt. ICA 75~99% stenosis 있어",
          "diagnosis": "(*) 순서 순 한국질병 구분 확진 진단명 분류번호 1 주진단 확진 Internal carotid artery stenosis 165.2 과거진단명 과거진단코드 주호소 (*) Diabetes mellitus other, without complication; Diabetes mellitus type 2, without complication;Diabetic polyneuropathy;Internal carotid artery stenosis;Internal carotid artery stenosis, right;Type 2 diabetes mellitus, coronary artery disease; E11.58;E11.9;E13.9;E14.41;165.2; C.C F/UDSA 과거력 및 현재병력 상기 64세 남환 HTN, DM, CAOD (2vd, s/p CAG), PAOD s/p PTA 과거력 있는분으로 2018.04 CABG 위해 Rt ICA stenosis 로 신경과 협진 후 CD 상 Rt. ICA 75~99% stenosis 있어",
          "admissionPeriod": "undefined ~ undefined",
          "surgeryInfo": null,
          "notes": ""
        },
        {
          "date": "",
          "hospital": "SEVERANCE HOSPITAL (1) Mental status & Mental function -Mental status: alert -Mental function: all preserved - Orientation Time/Place/Person: +/+/+ - Language Fluency: intact -Comprehension: intact - Reading: intact Writing: intact - Naming intact Repetition: intact (2) Cranial nerve Function: -Isocoria 3mm/3mmcPLR (+/+) -No EOM limitation s nystagmus -No Visual field defect by confrontation test -No facial palsy s sensory change -Gag reflex: ok -No tongue deviation / No uvula deviation 퇴원요약",
          "reason": "응급실 내원",
          "diagnosis": "미확인",
          "admissionPeriod": "undefined ~ undefined",
          "surgeryInfo": null,
          "notes": "## neurologic exam 전자서명자: 남효석 세브란스병원 SEVERANCE HOSPITAL (1) Mental status & Mental function -Mental status: alert -Mental function: all preserved - Orientation Time/Place/Person: +/+/+ - Language Fluency: intact -Comprehension: intact - Reading: intact Writing: intact - Naming intact Repetition: intact (2) Cranial nerve Function: -Isocoria 3mm/3mmcPLR (+/+) -No EOM limitation s nystagmus -No Visual field defect by confrontation test -No facial palsy s sensory change -Gag reflex: ok -No tongue deviation / No uvula deviation 퇴원요약"
        },
        {
          "date": "",
          "hospital": "SEVERANCE HOSPITAL 퇴원요약",
          "reason": "응급실 내원",
          "diagnosis": "미확인",
          "admissionPeriod": "undefined ~ undefined",
          "surgeryInfo": null,
          "notes": "퇴원약 약품명 (Name) 용량(Dose) 일수(Days) 아스피린프로텍트 100 정100mg 용법(Direction) 지참약 계속 복 용) 처방 분류 (Type) 퇴원지참약 효능 헤르벤정 30mg 30 지참약 계속 복 용) 퇴원지참약 리피토정80mg 80 지참약 계속 복 용) 퇴원지참약 플래리스정 75 지참약 계속 복 용) 퇴원지참약 라비에트정10mg 10 지참약 계속 복 용) 퇴원지참약 중외시그마트정 5mg 5 지참약 (계속 복 용) 퇴원지참약 코자정100mg 100 지참약 계속 복 용) 퇴원지참약 트라젠타정 5 지참약 (계속 복 용) 퇴원지참약 직듀오서방정 10/1000 1 지참약 계속 복 용) 퇴원지참약 담당 전공의사명 옥태동 기록자명 옥태동 주치의사명 남효석 전자서명자: 남효석 세브란스병원 SEVERANCE HOSPITAL 퇴원요약"
        },
        {
          "date": "",
          "hospital": "SEVERANCE HOSPITAL 입원기록",
          "reason": "응급실 내원",
          "diagnosis": "미확인",
          "admissionPeriod": "undefined ~ undefined",
          "surgeryInfo": null,
          "notes": ""
        },
        {
          "date": "",
          "hospital": "(감염주의 병원) 없음 있음 4. 밀접 접촉자 해당없음 아니오 예 5. 신종 감염병 의심환자 아니오 통증평가 통증여부 No Yes 계획 추정진단 Rt ICA stenosis s/p stent insertion F/U DSA 퇴원계획 퇴원 후 치료식이 여부 ? N 추후 관리 계획 |가정간호사업소 호스피스 타 병원 전원 √ 외래 사회 복지서비스 연계 필요성 ? N 기타 퇴원시 요구사항 치료계획 + Problem Goal 부 stenosis 목표일 수정목표일 계획일 E cerebral or carotid artery 뇌혈관 촬영을 통하여",
          "reason": "기간 일전 소화기증상 기간 해당없음 (미상환자 포함) 일전 2. 최근 1달 이내 방문한나라 해당없음 없음 있음 3. 최근 1달 이내 입원했던병원 (감염주의 병원) 없음 있음 4. 밀접 접촉자 해당없음 아니오 예 5. 신종 감염병 의심환자 아니오 통증평가 통증여부 No Yes 계획 추정진단 Rt ICA stenosis s/p stent insertion F/U DSA 퇴원계획 퇴원 후 치료식이 여부 ? N 추후 관리 계획 |가정간호사업소 호스피스 타 병원 전원 √ 외래 사회 복지서비스 연계 필요성 ? N 기타 퇴원시 요구사항 치료계획 + Problem Goal 부 stenosis 목표일 수정목표일 계획일 E cerebral or carotid artery 뇌혈관 촬영을 통하여",
          "diagnosis": "Rt ICA stenosis s/p stent insertion F/U DSA 퇴원계획 퇴원 후 치료식이 여부 ? N 추후 관리 계획 |가정간호사업소 호스피스 타 병원 전원 √ 외래 사회 복지서비스 연계 필요성 ? N 기타 퇴원시 요구사항 치료계획 + Problem Goal 부 stenosis 목표일 수정목표일 계획일 E cerebral or carotid artery 뇌혈관 촬영을 통하여",
          "admissionPeriod": "undefined ~ undefined",
          "surgeryInfo": null,
          "notes": "퇴원시 요구사항 치료계획 + Problem Goal 부 stenosis 목표일 수정목표일 계획일 E cerebral or carotid artery 뇌혈관 촬영을 통하여"
        },
        {
          "date": "",
          "hospital": "SEVERANCE HOSPITAL PR: pulse rate Pul. Tbc pulmonary tuberculosis RHB regular heart beat 입원기록",
          "reason": "응급실 내원",
          "diagnosis": "미확인",
          "admissionPeriod": "undefined ~ undefined",
          "surgeryInfo": null,
          "notes": ""
        },
        {
          "date": "",
          "hospital": "미확인 의료기관",
          "reason": "및 내원 과정 follow up DSA(9/5 DSA(stent fu&4-vessel)) [외래->입원] 복용중인 약 ㅇ 무 유 투약 상태 개수 약명 횟수 용법 약품 코드 개수 단위 Aspirin protect [100 mg/1 T 1 PO Cozaar [100 mg/T] 1 T 1 PO Herben [30mg/T] 1 T 2 PO D2ASPI01 D2COZA03 D2HERBO1 Lipitor [80 mg/T] 1 T 1 PO D2LIPI12 Platless [75 mg/T] 1 T 1 PO D2PLAT01 Rabiet [10mg/T] 1 T 1 PO D2RABI01 Sigmart [5 mg/T] 1 T 2 PO D2SIGM01 Trajenta [5mg/T] 1 T 1 PO D2TRAJ01 Xigduo XR 10/1000 (원 1 T 1 PO D2XIGD02 |외 48hr 전후 조영제 병용 금기) [1T/T] 간호정보조사",
          "diagnosis": "미확인",
          "admissionPeriod": "undefined ~ undefined",
          "surgeryInfo": null,
          "notes": ""
        },
        {
          "date": "",
          "hospital": "원본대조필 SEVERANCE HOSPITAL 등록번호: 8633158 주민등록번호: 550112-125****남/64세 환자명: 이광욱 Allergy 없음 약 □ 음식 기능 평가 일상생활(ADL) 수행 능력 독립적 수행 ○ 부분 보조 필요 완전 보조 보조기(이동) 사용 없음 ○ 목발 ㅇ 지팡이 Owalker ○ 휠체어 기타 ?이동시 주로 사용하는 보조기를 선택해 주세요. 식사하기 독립적 수행가능 개인 위생 독립적 수행가능 목욕하기 독립적 수행가능 옷입기 독립적 수행가능 화장실 사용 독립적 수행가능 계단 오르기 독립적 수행가능 이동하기 독립적 수행가능(휠체어를 제외한 walking aid 사용 할 수 있음) 이동하기(의자와 침대간) 독립적 수행가능 이동하기 (휠체어) 운동 규칙적으로 하는 운동 없음 운동의 종류 □ 걷기 달리기 □ 수영 등산 골프 기타 운동 횟수 1회/주 1회 운동 시간 음주력 ㅇnondrinker ex-drinker current drinker 음주력(종류, 양, 횟수/wk) 소주 1병 / 주 3~4회 음주 시작 시기 20살 끊은 시기 2018.4 흡연력 흡연력 Ononsmoker ex-smoker current smoker 하루의 흡연량 (1)갑/일 흡연 시작시기 20살 * 끊은 시기 2016년 끊은 시기가 1년 이하인 경우 꼭 금연교육을 시행해 주세요. (퇴원전까지) 간호정보조사",
          "reason": "응급실 내원",
          "diagnosis": "미확인",
          "admissionPeriod": "undefined ~ undefined",
          "surgeryInfo": null,
          "notes": "?이동시 주로 사용하는 보조기를 선택해 주세요. 식사하기 독립적 수행가능 개인 위생 독립적 수행가능 목욕하기 독립적 수행가능 옷입기 독립적 수행가능 화장실 사용 독립적 수행가능 계단 오르기 독립적 수행가능 이동하기 독립적 수행가능(휠체어를 제외한 walking aid 사용 할 수 있음) 이동하기(의자와 침대간) 독립적 수행가능 이동하기 (휠체어) 운동 규칙적으로 하는 운동 없음 운동의 종류 □ 걷기 달리기 □ 수영 등산 골프 기타 운동 횟수 1회/주 1회 운동 시간 음주력 ㅇnondrinker ex-drinker current drinker 음주력(종류, 양, 횟수/wk) 소주 1병 / 주 3~4회 음주 시작 시기 20살 끊은 시기 2018.4 흡연력 흡연력 Ononsmoker ex-smoker current smoker 하루의 흡연량 (1)갑/일 흡연 시작시기 20살 * 끊은 시기 2016년 끊은 시기가 1년 이하인 경우 꼭 금연교육을 시행해 주세요. (퇴원전까지) 간호정보조사"
        },
        {
          "date": "",
          "hospital": "요양시설 기타 퇴원 예정 교통 수단(Discharge transportation) √ 자가 일반 정보(6세 이상) 대중교통 항공 □ 구급차 | 기타 교육 정도 고등졸 결혼 상태 결혼 전화번호",
          "reason": "응급실 내원",
          "diagnosis": "미확인",
          "admissionPeriod": "undefined ~ undefined",
          "surgeryInfo": null,
          "notes": "퇴원 예정지 자택 ㅇ 친척집 타병원 요양시설 기타 퇴원 예정 교통 수단(Discharge transportation) √ 자가 일반 정보(6세 이상) 대중교통 항공 □ 구급차 | 기타 교육 정도 고등졸 결혼 상태 결혼 전화번호"
        },
        {
          "date": "",
          "hospital": "&약국 연세대학교의과대학세브란스병원 입원(외래)일수 0(13) 총진료비(건강보 2,488,930 빈경환 험적용분) 건강보험 등 혜택 970,830 받은 금액",
          "reason": "응급실 내원",
          "diagnosis": "미확인",
          "admissionPeriod": "undefined ~ undefined",
          "surgeryInfo": null,
          "notes": ""
        },
        {
          "date": "",
          "hospital": "오류 타 노년백 내장, 오른 쪽 1 1,179,290 944,190 235,100 (양방)기 의료법인 세경 타 의심되 50",
          "reason": "응급실 내원",
          "diagnosis": "미확인",
          "admissionPeriod": "undefined ~ undefined",
          "surgeryInfo": null,
          "notes": ""
        }
      ],
      "insuranceClaims": [
        {
          "date": "2003-12-08",
          "company": "미확인 보험사",
          "claimDate": "2003-12-08",
          "paymentDate": null,
          "amount": null,
          "notes": "[ ] 발급일 일 모집인(면담자): 김선형 출금금융기관명 국민카드 출금계좌(카드)번호"
        },
        {
          "date": "",
          "company": "미확인 보험사",
          "diagnosis": ". 장해, 사고 후 보험가입 등)는 형법상 금지된 범죄입니다. 구분! 계약자 자 i 필서명 필: 성명 이조훈 주피보험자 종피보험자 1 종피보험자2 종피보험자3 종피보험자4 종피보험자5 이광욱 법정대리인(친권자) 관 서명 이조훈 이광욱 * 가입자보관용 청약서상에 자필서명하셨습니까? 예 = 아니오 * 보험계약자 또는 피보험자가 미성년자인 경우 법정대리인이 서명하여 주시기 바랍니다. *피보험자(보험대상자 본인이 자필서명을 하지 않으신 경우에는 보험계약이 무효가 되어 보장을 받지 못할 수도 있습니다 *계약의 보장개시 효력은 1회 보험료를 납입하신 때부터입니다. 뒷면의 꼭 아셔야 할 사항을 반드시 확인하시기 바랍니다. ※안내장 발송(7 동의 동의안함 * 안내장 발송형태(ㄷ 모바일 안내장 E-Mail/E-Ma주소 ※약관을 모바일(문자)를 통해 수련하는 것에 대한 동의여부{V 동의 [동의안함) ※본인수의자 지정 변경 관련 추가약정( 5 약정함 이조훈 (서명) 약정하지 아니함 (약정함을 선택한 경우) 본인(보험계약자)이 사망한 경우에는 상속인 등 승계인이 보험수익자 지정·변경권을 행사합니다 부) ※(대상: 피보험자) 의료급여 수급권자 보험료 할인 신청 ( = 여 -자격취득일로부터 실손의료비 보장 보험계약의 매회 납입할 보장종목별 보장보험료의 5%를 할인하여 드립니다. ※청약유효일자: 2024 10-31 까지 LW",
          "paymentDate": null,
          "amount": null,
          "notes": ""
        },
        {
          "date": "",
          "company": "미확인 보험사",
          "diagnosis": "(MR/MRA)으로 인하여 발생한 비급여 의료비(조영제 판독료를 포함합니다). 4. 제11호. 제 -2호, 제3호와 관련하여 자동차보험(공제 포함) 또는 산재보험에서 발생한 본인부담의료비 모집점 금촌농협 모집자 김선형 (",
          "paymentDate": null,
          "amount": null,
          "notes": "과 관련이 없는 검사비용 간별비 9 자동차보험(공제 포함)에서 보상받는 치료관계비(과실상계 후 금액 기준) 또는 산재보험 에서 보상받는 의료비 'C 「국민건강보험법 제42조의 요양기관이 아닌 외국에 있는 의료기관에서 발생한 의료비 11 도수치료 체외충격파치료 증식치료로 인하여 발생한 비급여 의료비 '2 비급여 주사료.3 자기공명영상진단(MR/MRA)으로 인하여 발생한 비급여 의료비(조영제 판독료를 포함합니다). 4. 제11호. 제 -2호, 제3호와 관련하여 자동차보험(공제 포함) 또는 산재보험에서 발생한 본인부담의료비 모집점 금촌농협 모집자 김선형 ("
        },
        {
          "date": "",
          "company": "미확인 보험사",
          "diagnosis": "(MRI/MRA)으로 인하여 발생한 비급여 의료비(조영제, 판독료를 포함합니다) 15 제2호 제: 3호, 제4호와 관련하여 자동차보험(공제 포함) 또는 산재보험에서 발생한 본인부담의료비 모집점 금촌농협 모집자 김선형 (",
          "paymentDate": null,
          "amount": null,
          "notes": "과 관련이 없는 검사비용. 간병비 9. 자동차보험(공제 포함)에서 보상받는 치료관계비(과실상계 후 금액 기준) 또는 산재보험에서 보상 받는 의료비 10 「국민건강보험법 제42조의 요양기관이 아닌 외국에 있는 의료기관에서 발생한 의료비 11 「응급의료에 관한 법률 및 동 시행규칙에서 정한 응급환자에 해당하지 않는 자가 「의료법 제3조의4에 따른 상급종합병원 응급실을 이용하면서 발생한 응급의료관리료 12. 도수치료 체외충격파치료 증식치료 로 인하여 발생한 비급여 의료비 13 비급여 주사료 14 자기공명영상진단(MRI/MRA)으로 인하여 발생한 비급여 의료비(조영제, 판독료를 포함합니다) 15 제2호 제: 3호, 제4호와 관련하여 자동차보험(공제 포함) 또는 산재보험에서 발생한 본인부담의료비 모집점 금촌농협 모집자 김선형 ("
        },
        {
          "date": "",
          "company": "미확인 보험사",
          "diagnosis": "{MR/MRA}으로 인하여 발생한 비급여의료비(조영제 판독료를 포함합니다) 17 제4호, 제15호 제16호와 관련하여 자동차보험(공제 포함) 또는 산재보험에서 발 생한 본인부담의료비 |제도성특약 및 기타사항 보험료 자동납입 자동갱신적용대상 유의사항 제도성 특약 및 기타사항 ⓒ 상기 보장사항의 세부적인 내용은 약관 및 관계 법령을 따릅니다. 불완전판매율 구분 김선형 모집자 업권 평균 손보 생보 0.00 % - % 0.02 % 0.06 % 모집점 모집자 금촌농협 김선형 연락처 (",
          "paymentDate": null,
          "amount": null,
          "notes": "사항 보험료 자동납입 자동갱신적용대상 유의사항 제도성 특약 및 기타사항 ⓒ 상기 보장사항의 세부적인 내용은 약관 및 관계 법령을 따릅니다. 불완전판매율 구분 김선형 모집자 업권 평균 손보 생보 0.00 % - % 0.02 % 0.06 % 모집점 모집자 금촌농협 김선형 연락처 (; 과 관련이 없는 검사비용, 간 병비 10 산재보험에서 보상받는 의료비 11 사람면역결핍바이러스(HIV) 감염으로 인한 치료비+2 「국민건강보험법 제42조의 요양기관이 아닌 외국에 있는 의 '료기관에서 발생한 의료비 13 「움급의료에 관한 법률 및 동 시행규칙에서 정한 응급환자에 해당하지 않는 자가 「의료법 제3조의4에 따른 상급종합병원 응급실 을 이용하면서 발생한 응급의료관리료 14 도수치료 체외충격파치료·증식치료로 인하여 발생한 비급여의료비 15 비급여 주사료 16. 자기공명영상진단 {MR/MRA}으로 인하여 발생한 비급여의료비(조영제 판독료를 포함합니다) 17 제4호, 제15호 제16호와 관련하여 자동차보험(공제 포함) 또는 산재보험에서 발 생한 본인부담의료비 |제도성특약 및 기타사항 보험료 자동납입 자동갱신적용대상 유의사항 제도성 특약 및 기타사항 ⓒ 상기 보장사항의 세부적인 내용은 약관 및 관계 법령을 따릅니다. 불완전판매율 구분 김선형 모집자 업권 평균 손보 생보 0.00 % - % 0.02 % 0.06 % 모집점 모집자 금촌농협 김선형 연락처 ("
        },
        {
          "date": "",
          "company": "미확인 보험사",
          "diagnosis": "을 지원하는 계약, 보험기간(보장기간)이 90일 이내인 계약, 법률에 따라 가입의무 부과 및 해제·해지가 가능한 보험 (다만, 계약자가 동종의 다른 보험에 가입한 경우는 제외)은 청약을 철회할 수 없습니다. 5 화재손해특약은 계약 체결시에 보험에 가입한 물건의 가치(이하 '보험가액'이라 합니다)를 평가하지 않고 사고시 보험가액을 산정하여 보험가입 금액을 한도로 보상하는 미평가 보험입니다. 보험가입금액은 시가와 똑같이 정해야 합니다. 만약 시가보다 낮게 정하면 납입보험료 부담은 줄어 들지만 사고가 발생하였을 때 줄어든 비율만큼 적게 보상받고 높게 정하더라도 사고가 발생하면 실제로 입은 손해액만큼 보상받게 됩니다. 6 가재도구를 보험에 가입할 경우 귀금속. 귀중품(무게나 부피가 휴대할 수 있으며 점당 300만원이상). 골동품 등은 별도로 기재하여야만 보상의 대상이 됩니다. · 약관의 보상하는 손해와 보상하지 아니하는 손해를 확인하셔야 합니다. ※ 보험금 수익자의 지정에 관한 사항 계약자는 사망보험금, 중도보험금, 만기보험금, 장해보험금, 입원보험금 등 약관상 보험금 지급사유가 발생하는 때에 회사에 보험금을 청구하여 받을 수 있는 사람(보험수익자)을 지정하실 수 있습니다. 사망보험금 수익자를 지점/변경하고자 할 경우에는 사망보험금 지급사유가 발생하기 전에 피보험자가 서면으로 동의해야 합니다. 만약 계약자가 보험 수익자를 지정하지 않은 때에는 민법상 피보험자의 법정상속인 순위로 보험수익자를 정합니다. 민법상 법정상속인 순위 : 1. 직계비속. 2. 직계존속. 3. 형제자매. 4. 4촌 이내의 방계 혈족 배우자는 위의 1. 2순위 상속인이 있는 경우에 그 상속인과 동순위로 공동상속인이 되고, 그 상속인이 없는 때에는 단독상속인이 됨 (수익자 지정/변경 등에 필요한}구비서류 : (계약자 및 피보험자와 변경 후 수익자) 각 신분증 [수역자 지정 관련 문의 : 콜센터(1644-9000)] ☞ 보험에 가입하신 후 d. 보험증권을 받으시면 청약서 내용과 다름이 없는 지 또는 누락이 없는 지 확인하시기 바랍니다. 1 청약서 기재사항에 변동사항(피보험자의 직업 및 직무의 변경, 보험목적의 양도, 건물 구조 또는 용도의 변경, 보험목적을 다른 장소로 옮기는 경우, 수리하는 경우 등)이 있거나 다른 보험에 가입하실 경우 회사에 즉시 연락하시기 바랍니다. 3 보험계약의 내용을 변경하고자 할 경우에는 회사의 승낙을 얻어야 합니다. 4 손해가 생긴 경우에는 지체없이 이를 회사에 알려서 필요한 절차를 안내 받으시기 바랍니다. 5 보험금 지급사유의 조사 및 확인을 위하여 보험금 지급기일 초과가 명백히 예상되는 경우에는 피보험자 또는 수익자의 청구에 따라 회사가 추정 하는 보험금의 50% 상당액을 가지급보험금으로 지급하여 드립니다. [ 실손의료비를 가입하신 경우 이 보험계약에서 보장하는 실손의료비는 동 비용을 담보하는 다수의 보험계약에 체결되어 있는 경우, 약관에 따라 비례하여 보상합니다. 다만, 이미 가입된 보험 계약에서 보상한 금액이 본인이 부담한 의료비를 초과하였을 때에는 보험금이 지급되지 않을 수 있습니다. ( 갱신형 실손의료비 특별약관은 기본계약 보험기간 이내에서 매 1년마다 자동갱신되며, 갱신시 연령의 증가와 적용요율 등의 변동에 따라 보험료가 달라 질 수 있으며, 보험료 인상시에는 추가납입 하여야 계약이 유지됩니다. 3 피보험자가 동일한 회사에 보험기간이 3개월 이상인 해외실손의료비에 가입하고, 연속하여 3개월이상의 해외 체류사실이 확인되는 경우 실손의료보험의 보험료납입을 일정기간 중지해주거나 사후에 해당 기간의 표준화실손상품(",
          "paymentDate": null,
          "amount": null,
          "notes": ""
        },
        {
          "date": "2009-10-01",
          "company": "미확인 보험사",
          "claimDate": "2009-10-01",
          "diagnosis": "을 지원하는 계약, 보험기간(보장기 간)이 90일 이내인 계약, 법률에 따라 가입의무 부과 및 해제·해지가 가능한 보험(다만, 계약자가 동종의 다른 보험에 가입한 경우는 제외) 은 청약을 철회할 수 없습니다. 2. 저희 회사는 청약철회 청구서를 접수한 경우 지체없이 이미 납입한 보험료를 돌려드립니다. 3. 청약철회 청구서를 발송한 날 이후(발송일 포함)에 발생한 보험금 지급사유에 대해서는 회사가 책임을 지지 아니하며, 입금처의 거래은행 예금주는 계약자와 동일해야 합니다. ※콜센터 유선신청, 우편신청 또는 인터넷 신청 등에 의하여도 가능합니다. 모집점 모집자 금촌농협 김선형 (",
          "paymentDate": null,
          "amount": null,
          "notes": ""
        },
        {
          "date": "",
          "company": "미확인 보험사",
          "diagnosis": "또는 치료 사실 등 중요한 내용을 (알릴의무) 구두 로만 알릴 경우 계약전 알릴 의무를 이행한 것으로 인정되지 않아 향후 계약이 해지 되거나 보험금을 (구두) (해지) 지급받지 못할 수 있습니다. ?보험계약자 이조훈 (은)는 보험모집자 김선형 (으)로부터 계약전 알릴의무 위반시의 효과(계약해지, 보장제한, 보험금 미지급 등)에 대해 설명을 들었으며, 계약전 알릴의무 사항에 대해 청약서에 사실대로 기재하였음을 확인합니다. 위의 각 계약 전 알릴 의무 사항에 대한 하며, 보험계약자 및 피보험자(보험대상자) 본인이 직접 답변 내용은 사실과 일치 (답변내용은 사실과 일치) 작성하였음을 확인합니다. 또한 회사가 위 사항과 관련하여 필요시에는 별도의 확인을 할 수 있으며 의사에게 본인의 질병 등의 건강 상태를 조회하거나 열람토록 하는것에 동의합니다. 자필서명 구분 보험계약자 피보험자 성명 이조훈 이광욱 서명 이조훈 법정대리인 1 (친권자) 관계 법정대리인 2(친권자) 관계 법정대리인(친권자) 1인이 서명한 경우 본인은 다른 법정대리인(친권자) 1인과 합의하에 공동으로 친권을 행사합니다. 이관욱 피보험자(보험대상자) 본인이 자필서명을 하지 않으신 경우에는 보험계약이 무효가 되어 보장을 받지 못할 수도 있습니다. 보험계약자 또는 피보험자(보험대상자)가 미성년자인 경우 법정대리인이 서명하여 주시기 바랍니다. LW",
          "paymentDate": null,
          "amount": null,
          "notes": ""
        },
        {
          "date": "2025-03-19",
          "company": "미확인 보험사",
          "claimDate": "2025-03-19",
          "paymentDate": null,
          "amount": null,
          "notes": ""
        },
        {
          "date": "",
          "company": "미확인 보험사",
          "paymentDate": null,
          "amount": null,
          "notes": "가 아닌 증빙자료로 사용할 수 없으며, 이용에 관한 책임은 이용자에게 있습니다. 1/10 빈경환"
        },
        {
          "date": "",
          "company": "미확인 보험사",
          "paymentDate": null,
          "amount": null,
          "notes": "가 아닌 증빙자료로 사용할 수 없으며, 이용에 관한 책임은 이용자에게 있습니다. 빈경환 2/10"
        },
        {
          "date": "",
          "company": "미확인 보험사",
          "paymentDate": null,
          "amount": null,
          "notes": "가 아닌 증빙자료로 사용할 수 없으며, 이용에 관한 책임은 이용자에게 있습니다. 3/10 빈경환"
        },
        {
          "date": "",
          "company": "미확인 보험사",
          "paymentDate": null,
          "amount": null,
          "notes": "가 아닌 증빙자료로 사용할 수 없으며, 이용에 관한 책임은 이용자에게 있습니다. 4/10"
        },
        {
          "date": "",
          "company": "미확인 보험사",
          "paymentDate": null,
          "amount": null,
          "notes": "가 아닌 증빙자료로 사용할 수 없으며, 이용에 관한 책임은 이용자에게 있습니다. 5/10"
        },
        {
          "date": "",
          "company": "미확인 보험사",
          "paymentDate": null,
          "amount": null,
          "notes": "가 아닌 증빙자료로 사용할 수 없으며, 이용에 관한 책임은 이용자에게 있습니다. 빈경환 6/10"
        },
        {
          "date": "",
          "company": "미확인 보험사",
          "paymentDate": null,
          "amount": null,
          "notes": "가 아닌 증빙자료로 사용할 수 없으며, 이용에 관한 책임은 이용자에게 있습니다. 7/10 빈경환"
        },
        {
          "date": "",
          "company": "미확인 보험사",
          "paymentDate": null,
          "amount": null,
          "notes": "가 아닌 증빙자료로 사용할 수 없으며, 이용에 관한 책임은 이용자에게 있습니다. 8/10 빈경환"
        },
        {
          "date": "",
          "company": "미확인 보험사",
          "paymentDate": null,
          "amount": null,
          "notes": "가 아닌 증빙자료로 사용할 수 없으며, 이용에 관한 책임은 이용자에게 있습니다. 빈경환 9/10 외래 코드 일수(건강보험 적용분) 혜택받은 금액| (진료비) 100"
        },
        {
          "date": "",
          "company": "미확인 보험사",
          "paymentDate": null,
          "amount": null,
          "notes": "가 아닌 증빙자료로 사용할 수 없으며, 이용에 관한 책임은 이용자에게 있습니다."
        }
      ]
    },
    "progressReport": "NaN\n의료 경과보고서\nMedical Progress Report\n생성일: 2025.08.17\nNaN\n\n■ 환자 정보 (Patient Information)\nNaN\n환자명: 실명번호\n생년월일: 미확인 (만 미확인세)\n등록번호: 550112-1\n성별: 남성\n\n■ 보험 가입 조건 (Insurance Conditions)\nNaN\n1. 미확인 보험사\n   가입일: 미확인\n   상품명: (무) 간편\n   담보내용: 미확인 담보\n   상태: 유효\n\n2. 미확인 보험사\n   가입일: 미확인\n   상품명: 미확인 상품\n   담보내용: ]\n   상태: 유효\n\n3. 미확인 보험사\n   가입일: 미확인\n   상품명: 미확인 상품\n   담보내용: 명 납입유형 피\n   상태: 유효\n\n4. 미확인 보험사\n   가입일: 미확인\n   상품명: 미확인 상품\n   담보내용: 상태 (기본계약)갱신형 실손상해입원의료비(간편\n   상태: 유효\n\n5. 미확인 보험사\n   가입일: 미확인\n   상품명: 미확인 상품\n   담보내용: 보장기간 추가납입형 1년\n   상태: 유효\n\n6. 미확인 보험사\n   가입일: 미확인\n   상품명: 미확인 상품\n   담보내용: 이광욱 (기본계약)갱신형 실손질병입원의료비(간편\n   상태: 유효\n\n7. 미확인 보험사\n   가입일: 미확인\n   상품명: 미확인 상품\n   담보내용: 추가납입형 1년 추가납입형 1년 2024-10-08 200,000원 450원 2025-10-08 2024-10-08 50,000,000원 39,368 (기본계약)갱신형 실손질병통원의료비(간편\n   상태: 유효\n\n8. 미확인 보험사\n   가입일: 미확인\n   상품명: 미확인 상품\n   담보내용: 추가납입형 1년 2025-10-08 2024-10-08 200,000원 11,568원 2025-10-08 [기타특약 담보]\n   상태: 유효\n\n9. 미확인 보험사\n   가입일: 미확인\n   상품명: 미확인 상품\n   담보내용: 명 구분 1 구분 담보상태\n   상태: 유효\n\n10. 미확인 보험사\n   가입일: 미확인\n   상품명: 미확인 상품\n   담보내용: 100세 2054-10-08 제도성 자동갱신적용대상 선택담보 해당없음 2024-10-08 0원 0원 100세 2054-10-08 002 / 002 (무) 간편\n   상태: 유효\n\n11. 미확인 보험사\n   가입일: 미확인\n   상품명: 미확인 상품\n   담보내용: 및 기타사항】\n   상태: 유효\n\n12. 미확인 보험사\n   가입일: 미확인\n   상품명: 미확인 상품\n   담보내용: 및 기타사항 증권번호 319-1472-7663-13\n   상태: 유효\n\n13. 미확인 보험사\n   가입일: 미확인\n   상품명: 미확인 상품\n   담보내용: 별 상세내용은\n   상태: 유효\n\n14. 미확인 보험사\n   가입일: 미확인\n   상품명: 미확인 상품\n   담보내용: 별 만기가 기본계약의 만기 이전에 종료될 수 있으므로 반드시 특약별 만기를 확인하시기 바랍니다. ※ 담보종목별 자세한 보상내용은 약관을 참조하시기 바랍니다. ※ 청약서 주요내용 작성시 사실 그대로를 알리지 않았거나, 자필서명을 본인이 직접서명(날인)하지 않은경우는 보상되지 않을 수 있습니다. ※ 상해담보\n   상태: 유효\n\n15. 미확인 보험사\n   가입일: 미확인\n   상품명: 미확인 상품\n   담보내용: 갱신에 관한 사항] ※ 갱신시점의\n   상태: 유효\n\n16. 미확인 보험사\n   가입일: 미확인\n   상품명: 미확인 상품\n   담보내용: 은 기본계약의 납입기간과 관계없이\n   상태: 유효\n\n17. 미확인 보험사\n   가입일: 미확인\n   상품명: 미확인 상품\n   담보내용: 의\n   상태: 유효\n\n18. 미확인 보험사\n   가입일: 미확인\n   상품명: 미확인 상품\n   담보내용: 은 해지된 것으로 봅니다. ※ [갱신형 담보 자동갱신에 관한 사항] ※자동갱신 적용대상 계약이\n   상태: 유효\n\n19. 미확인 보험사\n   가입일: 미확인\n   상품명: 미확인 상품\n   담보내용: 의\n   상태: 유효\n\n20. 미확인 보험사\n   가입일: 미확인\n   상품명: 미확인 상품\n   담보내용: 보장기간으로 합니다. 다만, 갱신시점의 피\n   상태: 유효\n\n21. 미확인 보험사\n   가입일: 미확인\n   상품명: 미확인 상품\n   담보내용: 보장기간 미만일 경우에는 그 잔여기간을\n   상태: 유효\n\n22. 미확인 보험사\n   가입일: 미확인\n   상품명: 미확인 상품\n   담보내용: 미확인 담보\n   상태: 유효\n\n23. 미확인 보험사\n   가입일: 미확인\n   상품명: 미확인 상품\n   담보내용: | 소재지계약목록 No 1 기사고(피\n   상태: 유효\n\n24. 미확인 보험사\n   가입일: 미확인\n   상품명: 계약자명 319-1472-7663-13 0 (무) 간편\n   담보내용: 미확인 담보\n   상태: 유효\n\n25. 미확인 보험사\n   가입일: 미확인\n   상품명: 미확인 상품\n   담보내용: 목록 □ 계약담보조회 No 증권번호 소재지 손해목적 서열 통화 피해서열 계약목적물명\n   상태: 유효\n\n26. 미확인 보험사\n   가입일: 미확인\n   상품명: 미확인 상품\n   담보내용: 담보명 제외 보상담보명 계약목적물일련번호 이표번호 특약담보코드 위험코드 1 319-1472-7663-13 0 인 1 KRW 1 이광욱 200,000(기본계약) 2 ? 319-1472-7663-13 0 인 1 KRW 1 이광욱 간편\n   상태: 유효\n\n27. 미확인 보험사\n   가입일: 미확인\n   상품명: 미확인 상품\n   담보내용: 계약변경 부활유무 휴면미지급 유의계약자→녹취→ 건별 SMS발송 타사간사 분리사고접수 4세대실손할증비급여 삭제 저장 NH농협손해\n   상태: 유효\n\n28. 기(고의사고 허위사고, 허위입원. 진단. 장해, 사고 후\n   가입일: 미확인\n   상품명: 미확인 상품\n   담보내용: 미확인 담보\n   상태: 유효\n\n29. 미확인 보험사\n   가입일: 미확인\n   상품명: 미확인 상품\n   담보내용: 및 기타사항\n   상태: 유효\n\n30. 미확인 보험사\n   가입일: 미확인\n   상품명: 미확인 상품\n   담보내용: 및 기타사항 ⓒ 상기 보장사항의 세부적인 내용은 약관 및 관계 법령을 따릅니다. 불완전판매율 구분 김선형 모집자 업권 평균 손보 생보 0.00 % - % 0.02 % 0.06 % 모집점 모집자 금촌농협 김선형 연락처 (201203841 C:04) 031-941-366: 설계번호 24-0081-063096 설계일자 2024-10-08 발행일시 2024-10-08 16:20:03 5/7 NH농협손해\n   상태: 유효\n\n31. 미확인 보험사\n   가입일: 미확인\n   상품명: 미확인 상품\n   담보내용: 은 계약 체결시에\n   상태: 유효\n\n32. 미확인 보험사\n   가입일: 미확인\n   상품명: 미확인 상품\n   담보내용: 하는 다수의\n   상태: 유효\n\n33. 미확인 보험사\n   가입일: 미확인\n   상품명: 미확인 상품\n   담보내용: 미확인 담보\n   상태: 유효\n\n34. 제출 123 매 의무기록 사본 증명서 이 사본은 의무기록 원본과 틀림이 없음을 증명합니다. 이 사본은 위의 용도 외에는 사용할 수 없습니다. 의무기록 사본 증명서 2025년 04월 11일 담당자: 김경미 (인) 담당자의 날인이 없는 것은 무효임 여래대학교 연세대학교 의과대학 학과대학 세브란스병원 병원 세브란스병원 SEVERANCE HOSPITAL 등록번호: 8633158 주민등록번호: 550112-125**** 남/63세 환자명: 이광욱 외래재진기록 2019-01-02 진료과 심장내과 주치의 안철민 BP(S) 181 mmHg BP(D) 95 mmHg HR 90/min Subjective Objective CT angio Assessment Good/No interval change Multifocal stenosis with calcifications in both SFA and both ATA. Diffuse atherosclerosis with calcification, infrarenal aorta. Varicose vein, left calf. No evidence of DVT. Otherwise unremarkable. CAD(2vd+ LM) s/pCAG(2018.04, 일산백) s/p 2018-04-09 4OPCAB(LIMA to dLAD, to OM(seq) to DG with RIMA composite Y, Aorta to rPL with RA) DM s/p carotid stenting Plan PTA 고려 SFA os, Rt contralateral approach 2월 10일입원, 11일 시술 기록자명 안철민 전자서명자: 안철민 세브란스병원 SEVERANCE HOSPITAL 1/1 출력일: 2025-04-11 출력자: 김경미 원본대조필 등록번호: 8633158 주민등록번호: 550112-125**** 남/64세 환자명: 이광욱 입원정보 입원일자 2019-01-27 입원과 심장내과 입원주치의 안철민 퇴원정보 퇴원일자 2019-01-29 퇴원과 심장내과 퇴원주치의 안철민 최종진단명(*) 순서 한국질병 구분 확진 진단명 분류번호 1 주진단 확진 Peripheral arterial occlusive disease (lower extremities) 170.29 2 기타진단 확진 Unstable angina 120.0 3 기타진단 확진 Coronary artery disease (left main) 125.1 4 기타진단 확진 Coronary artery disease (2 vessel disease) 125.1 5 기타진단 확진 S/P Coronary artery bypass graft Z95.1 과거진단명 과거진단코드 주호소 (*) Diabetes mellitus other, without complication; Diabetes mellitus type 2, without complication; Diabetic polyneuropathy; Internal carotid artery stenosis;Internal carotid artery stenosis, right;Type 2 diabetes mellitus, coronary artery disease; E11.58;E11.9;E13.9;E14.41;165.2; For PTA 과거력 및 현재병력 상기 64세 남환 DM, CAOD (2vd, s/p CAG), PAOD 진단 받은 분으로 PTA 시행 위해 금일 입원함. V/S 120/70 78 20 Current Sx: none 이상 진찰 소견 (★) n-s 재원중 투약내역 (*) n-s 투여된 약물 중 잔류효과로 퇴원 후 주의가 필요한 약물 (*) 없음 있음 Aspirin protect->출혈의 위험성이 증가되므로 상처나 멍이 생기지 않도록 주의하십시오.; Platless-> 출혈의 위험성이 증가되므로 상처나 멍이 생기지 않도록 주의하십시오.; 전자서명자: 안철민 세브란스병원 SEVERANCE HOSPITAL 퇴원요약 2019-01-29 1/3 출력일: 2025-04-11 출력자: 김경미 원본대조필 등록번호: 8633158 주민등록번호: 550112-125****남/64세 환자명: 이광욱 검사소견 (*) 치료 및 효과 (*) @PTA(19.1.28) Access site Lt CFA Approach method contralateral antegrade Peripheral angiography with JR 5F catheter revealed total occlusion of Rt. SFA OS (TIMI 1) with diffuse irregular up to 70% LN of p-mSFA total occlusion of Rt. ATA (TIMI O) Taget lesion: Rt. SFA 7F Balkin sheath c 018 command wire The guiding wire was passed through the lesion. Balloon angioplasty was done with 6x60 mm Mustang PTA balloon at Rt. SFA OS~MSFA F/U angio revealed 60% residual stenosis without dissection Two DCB with 6x150 mm Inpact Admiral were inflated at Rt. SFA OS~MSFA F/U angio revealed 10 % residual stenosis without dissection or flow limitation conclusion>> Successful PTA C DCB at Rt. SFA @Successful PTA c DCB at Rt. SFA(19.1.28) 시행 후 acute complication 없이 퇴원함. @PTA(19.1.28) 주시술명 주시술코드 3950 기타시술명 기타시술코드 Implantable Medical Device 사용 여부 No Yes 치료결과 (*) 완쾌 경쾌 호전안됨 진단뿐 가망없는 퇴원 48시간이내 사망 선행사인 48시간이후 사망 선행사인 선행사인 분류코드 활력증상 혈압 120/75 mmHg 맥박수 70 퇴원형태 (★) 퇴원지시후 타병원전원 회/분 체온 36.8 자의퇴원 ㅇ 탈원 호흡수 20 회/분 향후 치료계획 외래 추후관리 재입원 없음 기타 퇴원요약 2019-01-29 전자서명자: 안철민 2/3 출력일: 2025-04-11 세브란스병원 SEVERANCE HOSPITAL 출력자: 김경미 원본대조필 등록번호: 8633158 주민등록번호: 550112-125**** 남/64세 환자명: 이광욱 퇴원약 약품명 (Name) 용량(Dose) 일수(Days) 용법(Direction) 처방 분류 (Type) 효능 아스피린프로텍트 1 14 정100mg 아침 식후 30분 복용하십시오 퇴원약 헤르벤정 30mg 1 14 아침,저녁 식후 30 퇴원약 분 복용하십시오 리피토정 80mg 1 14 아침 식후 30분 퇴원약 복용하십시오 플래리스정 1 14 아침 식후 30분 복용하십시오 퇴원약 라비에트정10mg 1 14 아침 식전 30분 복 퇴원약 용하십시오 중외시그마트정 1 5mg 14 아침, 저녁 식후 30 퇴원약 분 복용하십시오 코자정100mg 1 14 아침 식후 30분 복용하십시오 퇴원약 아스피린프로텍트 1 19 정100mg 아침 식후 30분 복용하십시오 퇴원약 헤르벤정 30mg 1 19 아침,저녁 식후 30 퇴원약 분 복용하십시오 리피토정 80mg 1 19 아침 식후 30분 퇴원약 복용하십시오 플래리스정 1 19 아침 식후 30분 퇴원약 복용하십시오 라비에트정10mg 1 19 아침 식전 30분 복 퇴원약 용하십시오 중외시그마트정 1 5mg 19 아침,저녁 식후 30 퇴원약 분 복용하십시오 코자정100mg 1 19 아침 식후 30분 복용하십시오 퇴원약 담당 전공의사명 권혜란 기록자명 권혜란 주치의사명 안철민 <약어 설명> CAOD coronary artery obstructive disease RFCA radio-frequency catheter ablation NSTEMI non-ST elevation myocardial infarction C-angio : coronary angiogram A.fib: atrial fibrillation EPS electrophysiologic studies DCMP: dilated cardiomyopathy HCMP hypertrophic cardiomyopathy PAF paroxysmal atrial fibrillation RHD rheumatic heart disease NSVT non-sustained ventricular tachycardia A-flutter : atrial flutter 퇴원요약 2019-01-29 전자서명자: 안철민 3/3 출력일: 2025-04-11 출력자: 김경미 세브란스병원 SEVERANCE HOSPITAL 원본대조필 등록번호: 8633158 주민등록번호: 550112-125****남/64세 환자명: 이광욱 입원일자 2019-01-27 입원과 심장내과 입원주치의 안철민 입원결정의사 안철민 주호소 또는 입원사유 For PTA 현재질병상태 상기 64세 남환 DM, CAOD (2vd, s/p CAG), PAOD 진단 받은 분으로 PTA 시행 위해 금일 입원함. V/S 120/70 78 20 Current Sx none 과거력 Hypertension No Yes Pul. Tbc No Yes DM No Yes Hepatitis No Yes Smoking No Yes 금연교육 여부 시행 미시행 |해당없음 Alcohol No Yes Drug Allergy No Yes Penicillin Sulfonamide ? Cephalosporin Other 알레르기 No Yes Hypercholesterolemia No Yes Cardiac disease No Yes Old CVA No Yes 말초동맥 및 경동맥 질환 No Yes Coronary artery bypass graft No Yes Others 가족력 계통문진 Generalized Weakness No Easy Fatigue No Fever No Chill No Headache No 00000 Yes Yes Yes Yes Yes Dizziness No Yes Insomnia No Yes 전자서명자: 안철민 세브란스병원 SEVERANCE HOSPITAL 입원기록 2019-01-27 1/5 출력일: 2025-04-11 출력자: 김경미 원본대조필 등록번호: 8633158 주민등록번호: 550112-125**** 남/64세 환자명: 이광욱 입원기록 2019-01-27 Cough Sputum Dyspnea DOE z z zz z z z z z z z No No Yes Yes Yes No Yes No No No Yes Yes Yes No Yes No Yes No Yes 0000000000 Chest pain Palpitation Hemoptysis Hematemesis Anorexia Nausea No Vomiting No Yes Constipation No Yes Diarrhea No Yes Abdominal pain No Yes Abdominal discomfort No Hematochezia No Melena No 000 Yes Yes Yes Dysuria No Yes Oliguria No Yes Hematuria No Yes Poor oral intake No Yes Weight Loss No Yes Weight Gain No Yes Others 신체조사 General Appearance Appearance Not so ill-looking appearance Mental Status Alert Drowsy Stupor Semicoma Coma Nutritional and Developement status Good Moderate Poor Skin 피부 Abnormal skin rash Warm ? Cold Wet Dry No Yes Skin tugor Good HEENT Normocephaly without deformity Yes No Sclera not icteric not injected Throat 전자서명자: 안철민 세브란스병원 SEVERANCE HOSPITAL Conjunctiva not pale Lips & tongues not dried 2/5 출력일: 2025-04-11 출력자: 김경미 원본대조필 등록번호: 8633158 주민등록번호: 550112-125**** 남/64세 환자명: 이광욱 Neck Stiffness supple Cervical LNs not palpable Neck veins not engorged Chest/lung Symmetric expansion Yes No Retraction No Yes ( Both Rt Lt) Breath sounds clear increased decreased character High-pitched sound Continuous sound Wheezing Discontinuous sound Fine crackle Low-pitched sound Location Stridor ? Velcro rale Right upper lung field Rhonchi ? Coarse crackle Right middle lung field Left upper lung field ? Left middle lung field Right lower lung field ? Left lower lung field Heart PMI (5th ICS LMCL) 이상 RHB without murmur with murmur Thrill No Yes Heaving No Yes Abdomen Palpation ? soft ? rigid flat distended Bowel sound normoative Tenderness No Yes Palpation of organ No liver kidney spleen Shifting dullness No Yes Fluid wave No Yes Back and Extremity LOM No Yes CVA tenderness No Rt. Lt. Both Pitting edema No Yes Paresthesia No Yes 전자서명자: 안철민 세브란스병원 SEVERANCE HOSPITAL 입원기록 2019-01-27 3/5 출력일: 2025-04-11 출력자: 김경미 원본대조필 등록번호: 8633158 주민등록번호: 550112-125**** 남/64세 환자명: 이광욱 입원기록 2019-01-27 others (Physical Exam) 감염성질환 초기평가 1. 증상 및 기간 발열 기간 일전 호흡기증상 기간 일전 소화기증상 기간 일전 해당없음 (미상환자 포함) 2. 최근 1달 이내 방문한나라 해당없음 없음 있음 3. 최근 1달 이내 입원했던 병원 (감염주의 병원) 없음 있음 4. 밀접 접촉자 해당없음 아니오 예 5. 신종 감염병 의심환자 아니오 예 통증평가 통증여부 No Yes 추정진단 PAOD 계획 PTA 고려 퇴원계획 퇴원 후 치료식이 여부 ? N ? Y 추후 관리 계획 |가정간호사업소 호스피스 타 병원 전원 외래 사회 복지서비스 연계 필요성 ? N ? Y 기타 퇴원시 요구사항 치료계획 + Problem Goal 목표일 수정목표일 계획일 부 PAOD PTA 2019-01-28 2019-01-27 기록자명 하장우 <약어 설명> BMI : body mass index BP(D): Blood Pressure(Diastolic) BP(S) : Blood Pressure(Systolic) BT body temperature 전자서명자: 안철민 세브란스병원 SEVERANCE HOSPITAL ICS: impulse conducting system(of the heart) LMCL left midclavicular line LNs lymph nodes LOM limitation of motion 4/5 출력일: 2025-04-11 출력자: 김경미 원본대조필 등록번호: 8633158 주민등록번호: 550112-125****남/68세 환자명: 이광욱 검사결과 1. ABI (Ankle / Brachial Index) - Rt: 0.90 /Lt: 0.84 1-1. TBI (Toe / Brachial Index)- Rt: 0.39/Lt: 0.36 Impression Name Image 1 전자서명자: 모혜인 세브란스병원 SEVERANCE HOSPITAL 기능검사결과(I/F형) 2023-03-22 1/2 출력일: 2025-04-11 출력자: 김경미 원본대조필 등록번호: 8633158 주민등록번호: 550112-125**** 남/68세 환자명: 이광욱 Name: LEE K.W. ID #: 8633158 Exam Date: 03/22/2023 11:08 AM Operator: M 기능검사결과(I/F형) SEVERANCE HOSPITAL Sex: M MultiLab Series !! SEGMENTAL PRESSURE AND PVR STUDY Brachial RIGHT LEFT 108 109 RIGHT LEFT 0.85 93 PT 92 0.84 0.90 98 DP 91 0.83 ми PVR 64mmHg 187cc LEFT Ankle ABI: 0.84 Gain: 2 Spd:25 Amp:16 TBI: 0.36 0.39 43 39 0.36 PVR 65mmHg 175cc RIGHT Ankle Gain: 2 Spd:25 Amp:19 ABI: 0.90 TBI: 0.39 PPG RIGHT Great Toe Gain:.50 Speed: 25 Amp:01 판독의(1차) 박한진 판독의(2차) 안철민 ABI INDEX 0.97- 1.25 NORMAL 0.75 0.96 MILD 0.50 0.74 MODERATE <0.50 SEVEREE TBI(FBI) INDEX >0.80 NORMAL 0.20 0.54 CLAUDICATION <0.20 REST PAIN PPG LEFT Great Toe Gain:.50 Speed: 25 Amp:01 2023-03-22 전자서명자: 모혜인 2/2 출력일: 2025-04-11 출력자: 김경미 세브란스병원 SEVERANCE HOSPITAL 원본대조필 등록번호: 8633158 주민등록번호: 550112-125**** 남/67세 환자명 : 이광욱 진료과 내분비내과 주치의 강은석 BP(S) 150mmHg BP(D) 58 mmHg HR 89/min 경과 및 Plan 진단명 구분 확진 CAD(2vd+ LM) s/p CAG (2018.04, 일산백) s/p 4OPCAB(LIMA to dLAD, to OM(seq) to DG with RIMA composite Y, Aorta to rPL with RA) (2018-04-09) Rt. ICA stenosis s/p stent insertion (2018.10.02) PAD s/p PTA c DCB at Rt. SFA (2019.01.28) DM(11yrs) Ex-smoker (30yr, 2년전 중단) Aorta to rPL with RA) Glucose 140 Glycoalbumin 20.6 Glucose (연속) - 식후 2시간 195 HbA1c 7.3 Cholesterol 121 Triglyceride 77 HDL-Cholesterol 56 LDL-Cholesterol (Friedewald) 49.6 BUN 24.4 Creatinine 1.22 Urine Albumin-to-Creatinine Ratio 78.07 >> 생활습관 개선 필요함 repeat med 6mo f/u 주진단 확진 Diabetes mellitus type 2 with dyslipidemia 기타진단 확진 Thyroid nodule 기타진단 확진 Internal carotid artery stenosis 기록자명 강은석 진단명 외래재진기록 2022-07-19 전자서명자: 강은석 1/1 출력일: 2025-04-11 출력자: 김경미 세브란스병원 SEVERANCE HOSPITAL 원본대조필 등록번호: 8633158 주민등록번호: 550112-125****남/67세 환자명: 이광욱 외래재진기록 2022-09-21 진료과 심장내과 주치의 일반 BP(S) mmHg HR /min Subjective Objective Assessment Plan 진단명 구분 확진 주진단 기타진단 기타진단 확진 확진 확진 BP(D) mmHg chest pain / discomfort (-/-) dyspnea / DOE (-/-) palpitation (-) functional capacity >4METS 잘지냈다. 증상없음 PAD, S/P PTA 2019.1.28 - IVUS-DCB - s/p PTA DCB at Rt. SFA[2019-01-28] ABI 1.04/1.09 <== 0.69/0.99 CAD(2vd+ LM) s/pCAG(2018.04, 일산백) s/p 2018-04-09 4OPCAB(LIMA to dLAD, to OM(seq) to DG with RIMA composite Y, Aorta to rPL with RA) DM herben 일년 정도 사용 - 유경종 교수님 - radial graft HTN_Q Repeat med Unstable angina Coronary artery disease (left main) Coronary artery disease (2 vessel disease) 기록자명 최기정 <약어 설명> BP(D) : Blood Pressure(Diastolic) 진단명 HR : Heart Rate BP(S) : Blood Pressure (Systolic) med Medication 전자서명자: 최기정 세브란스병원 1/1 출력일: 2025-04-11 출력자: 김경미 원본대조필 SEVERANCE HOSPITAL 등록번호: 8633158 주민등록번호: 550112-125****남/67세 환자명: 이광욱 진료과 신경과 주치의 홍순호 SBP 129 mmHg DBP 60mmHg 맥박 81회/분 경과 Rt. pICA severe stenosis s/p stent insertion (2018) --4 vessel 2019.09.05 Occlusion of Lt VA. No residual stenosis or in-stent thrombosis in Rt pICA. --brain MRIA 2022.09.14 Small old infarction in left side medulla. Microbleed in right parietal lobe. Stenosis in right carotid bulb and right distal VA. Steno-occlusion in left VA. Stenosis in left proximal ICA, left cavernous ICA. -->interval change 없어보임. 별일 없으셨다 2024 brain MRIA 외래재진기록 2022-09-21 전자서명자: 홍순호 1/2 출력일: 2025-04-11 출력자: 김경미 세브란스병원 SEVERANCE HOSPITAL 원본대조필 등록번호: 8633158 주민등록번호: 550112-125**** 남/67세 환자명: 이광욱 진단명 구분 확진 주진단 확진 |기타진단 확진 |기타진단 확진 Internal carotid artery stenosis Unstable angina Coronary artery disease (2 vessel disease) 진단명 기록자명 홍순호 외래재진기록 2022-09-21 전자서명자: 홍순호 2/2 출력일: 2025-04-11 출력자: 김경미 세브란스병원 SEVERANCE HOSPITAL 원본대조필 등록번호: 8633158 주민등록번호: 550112-125**** 남/69세 환자명: 이광욱 영상검사 CT& MR 영상검사 CT& MR 검사명 MRI Brain & Angio 3D(Neck포함) (contrast) 검사방법 검사일자 판독일자 2024.09.12 10:33 2024.10.22 15:34 촬영실 MRI 74호(본관 4층) Description 판독의/전문의 Clinical information: Internal carotid artery stenosis Imaging technique: sagittal T1Wl, axial T1WI, T2WI, T2 FLAIR. T2*WI, contrast enhanced 3D T1Wl with axial/coronal/sagittal reconstruction, intracranial TOF MRA, contrast enhanced intracranial and neck MRA. Contrast media: Used Small old infarction in left side medulla. Microbleed in right parietal lobe. Stenosis in right carotid bulb and right distal VA. Steno-occlusion in left VA. Stenosis in left proximal ICA, left cavernous ICA. IMP: No interval change ④조영제 Dotarem inj[20ml/Syringe] [Meglumine gadoterate 376.9mg/ml] [20ml/Syringe]:1 안성수/안성수/안성수 전자서명자: 안성수 1/1 출력일: 2025-04-11 출력자: 김경미 세브란스병원 SEVERANCE HOSPITAL 원본대조필 등록번호: 8633158 주민등록번호: 550112-125**** 남/68세 환자명: 이광욱 진료과 내분비내과 주치의 강은석 BP(S) 163mmHg BP(D) 70mmHg HR 91/min 경과 및 Plan CAD(2vd+ LM) s/p CAG (2018.04, 일산백) s/p 4OPCAB(LIMA to dLAD, to OM(seq) to DG with RIMA composite Y, Aorta to rPL with RA) (2018-04-09) Rt. ICA stenosis s/p stent insertion (2018.10.02) PAD s/p PTA c DCB at Rt. SFA (2019.01.28) DM(11yrs) Ex-smoker (30yr, 2년전 중단) Aorta to rPL with RA) Glucose 124 Glycoalbumin 20.9 Glucose (연속) - 식후 2시간 226 HbA1c 7.2 Cholesterol 116 Triglyceride 76 HDL-Cholesterol 50 LDL-Cholesterol (Friedewald) 50.8 Urine Albumin-to-Creatinine Ratio 69.81 >> 운동 및 생활습관 개선 필요함 repeat med 6mof/u 진단명 구분 확진 주진단 확진 기타진단 확진 기타진단 확진 Diabetes mellitus type 2 with dyslipidemia Thyroid nodule Internal carotid artery stenosis 기록자명 강은석 진단명 외래재진기록 2023-01-17 전자서명자: 강은석 1/1 출력일: 2025-04-11 출력자: 김경미 세브란스병원 SEVERANCE HOSPITAL 원본대조필 등록번호: 8633158 주민등록번호: 550112-125**** 남/68세 환자명: 이광욱 외래재진기록 2023-03-22 진료과 심장내과 주치의 안철민 BP(S) 122 mmHg BP(D) 52mmHg HR 88/min Subjective Objective Assessment Plan Good/No interval change Non-HDL Cholesterol 53 LDL-Cholesterol (Friedewald) 39.4 Glucose 134 BUN 19.8 Creatinine 1.06 TMT 10.1 METs, equivocal ABI (Ankle / Brachial Index) 0.84/Lt: 0.82 PAD, s/p PTA 2019.1.28 - IVUS-DCB - - Rt: 0.90 /Lt: 0.84 <==Rt: 0.96/Lt: 0.88 <== Rt: s/p PTA DCB at Rt. SFA[2019-01-28] ABI 1.04/1.09 <== 0.69/0.99 CAD(2vd+ LM) s/p CAG(2018.04, 일산백) s/p 2018-04-09 4OPCAB(LIMA to dLAD, to OM(seq) to DG with RIMA composite Y, Aorta to rPL with RA) DM herben 일년 정도 사용 - 유경종 교수님 - radial graft HTN Repeat med 3개월 후 local refer 2yr EKG/CXR/LAB/full(비급여 설명드림) 진단명 구분 확진 주진단 확진 Unstable angina |기타진단 확진 Coronary artery disease (left main) |기타진단 확진 Coronary artery disease (2 vessel disease) 기록자명 안철민 전자서명자: 안철민 세브란스병원 SEVERANCE HOSPITAL 진단명 1/1 출력일: 2025-04-11 출력자: 김경미 원본대조필 등록번호: 8633158 주민등록번호: 550112-125****남/70세 환자명: 이광욱 검사결과 1. ABI (Ankle/ Brachial Index) - Rt: 0.80 /Lt: 0.72 1-1. TBI (Toe Brachial Index) - Rt: 0.51/Lt: 0.33 Impression Name Image 1 0.5- 0- Patient name: 012 Patient ID: 8633158 Gender: R Thigh PVR E 0.5- 0- 0.98 124] 127 1.00 -0.5- 기능검사결과(I/F형) 2025-03-19 Exam Date/Time: 19-03-2025 10:27 Examiner: Ref Physician: L Thigh -3.5- 45 P=59 HR-73 Amp-1.060 RT-232 Sc=x4 G=6 R BI Knee PVR 0.99 126 131 1.03 0.5- 0.5- 0.90 114 113 89 0- 0- -05- 4s R P=56 HR=72 Amp=1.248 RT=264 Sc=x4 G=6 R Ankle 0.80 10192 0.72 0.75 95 OP 90 0.71 0.79 100 103 0.81 0.51 65 42 0.33 -0.5- PVR 0.5- L Ankle 0.5- 0- -0.5- 0.5 0- -0.5- 0- -0.5- 4s P=57 HR=75 Amp=0.678 RT=236 Sc=x4 G=6 R Metatarsal PVR 0.5 0- -0.5- 4s P=62 HR 75 Amp=0.270 RT-244 Sc=x4 G=6 R Toe 1 A ниш 0- -10- 45 HR 73 Amp=17.4 RT=282 Sc=x4 G=4 판독의(1차) 이찬주 판독의(2차) 안철민 전자서명자: 이재인 세브란스병원 SEVERANCE HOSPITAL VIASONIX 0- -10- PVR 4s P=59 HR=73 Amp=0.938 RT=264 Sc=x4 G=6 L BI Knee PVR ни 45 P=57 HR=72 Amp=1.185 RT=238 Sc=x4 G=6 PVR ми P=55 HR=N/A Amp=N/A RT=N/A Sc=x4 G=6 L Metatarsal PVR 45 P=58 HR=N/A Amp=N/A RT=N/A Sc=x4 G=6 L Toe 1 ми 4s HR 73 Amp=20.4 RT=282 Sc=x4 G=4 Page 1 of 1 1/1 출력일: 2025-04-11 출력자: 김경미 원본대조필 등록번호: 8633158 주민등록번호: 550112-125**** 남/64세 환자명: 이광욱 C-sec: cesarean section CVA cerebrovascular accident CVA tenderness costovertebral angle DM diabetes mellitus DOE dyspnea on exertion ECOG eastern cooperative oncology group HEENT: head, ear, eye, nose and throat NSVD normal spontaneous vaginal delivery PAOD peripheral arterial occlusive disease : PMI point of maximum impulse PR: pulse rate Pul. Tbc pulmonary tuberculosis RHB regular heart beat 전자서명자: 안철민 세브란스병원 SEVERANCE HOSPITAL 입원기록 2019-01-27 5/5 출력일: 2025-04-11 출력자: 김경미 원본대조필 등록번호: 8633158 주민등록번호: 550112-125****남/64세 환자명: 이광욱 진료과 심장내과 주치의 안철민 경과 계획 >>PTA CAD(2vd+ LM) s/pCAG(2018.04, 일산백) s/p_20182-04-09 4OPCAB(LIMA to dLAD, to OM(seq) to DG with RIMA composite Y, Aorta to rPL with RA) DM s/p carotid stenting @ CT angio Multifocal stenosis with calcifications in both SFA and both ATA. Diffuse atherosclerosis with calcification, infrarenal aorta. Varicose vein, left calf. No evidence of DVT. Otherwise unremarkable. PTA 치료계획: 주치의가 환자의 치료계획을 확인함. 주치의 Comment 주치의가 회진을 돌아 환자의 상태를 확인하였고 처방상태를 확인 후 환자에게 현재 상태를 설명함. 치료계획 + Problem 부 E Acute myocardial infarction, ST elevation E PAOD 기록자명 권혜란 Goal PTA PTA 목표일 수정목표일 계획일 2019-01-28 2019-01-27 2019-01-28 전자서명자: 안철민 1/1 세브란스병원 SEVERANCE HOSPITAL 2019-01-27 출력일: 2025-04-11 경과기록 2019-01-27 출력자: 김경미 원본대조필 등록번호: 8633158 주민등록번호: 550112-125****남/64세 환자명: 이광욱 진료과 심장내과 주치의 안철민 경과 계획 >>PTA CAD(2vd+ LM) s/p CAG(2018.04, 일산백) s/p_20182-04-09 40PCAB(LIMA to dLAD, to OM(seq) to DG with RIMA composite Y, Aorta to rPL with RA) DM s/p carotid stenting @ CT angio Multifocal stenosis with calcifications in both SFA and both ATA. Diffuse atherosclerosis with calcification, infrarenal aorta. Varicose vein, left calf. No evidence of DVT. Otherwise unremarkable. @PTA(19.1.28) PTA 치료계획: 주치의가 환자의 치료계획을 확인함. 주치의 Comment 치료계획 + Problem 부 E Acute myocardial 주치의가 회진을 돌아 환자의 상태를 확인하였고 처방상태를 확인 후 환자에게 현재 상태를 설명함. Goal PTA 목표일 수정목표일 계획일 2019-01-28 2019-01-27 infarction, ST elevation E PAOD 기록자명 권혜란 전자서명자: 안철민 세브란스병원 SEVERANCE HOSPITAL PTA 2019-01-28 1/1 2019-01-27 출력일: 2025-04-11 경과기록 2019-01-28 출력자: 김경미 원본대조필 등록번호: 8633158 주민등록번호: 550112-125**** 남/64세 환자명: 이광욱 경과 계획 [Puncture site assessment]: POD #0 1. Lt.CFA (Proglide) 1) Bleeding/Oozing (-) 2) Hematoma/Color change (-/-) 3) Distal assessment: Color/Pulse/Temperature change (-/-/-) * Lt.DPA (2+) 4) Infection sign (-) 5) Puncture site pulse check (2+) +) Pulse examination * 0-absent/1+ diminished/2+ normal/3+ bounding 천자부위가 점점 부어오르는 느낌이나 거즈 위로 피가 배어나오거나 흐르는 경우, 갑자기 어지럽거나 통증 및 불편감 심해지는 경우 즉시 의료진에게 알리도록 환자와 보호자 교육함. Puncture site close monitoring 4hrs ABR 기록자명 김지영 전담간호사 경과기록 2019-01-28 전자서명자: 김지영 1/1 출력일: 2025-04-11 출력자: 김경미 세브란스병원 SEVERANCE HOSPITAL 원본대조필 등록번호: 8633158 주민등록번호: 550112-125**** 남/64세 환자명: 이광욱 경과 [Puncture site assessment]: POD #1 1. Lt.CFA (Proglide) 1) Bleeding/Oozing (-) 2) Hematoma/Color change (-/-) 3) Distal assessment: Color/Pulse/Temperature change (-/-/-) Lt.DPA (2+) 4) Infection sign (-) 5) Puncture site pulse check (2+) 6) Bruit(+)/ Thrill (-) 7) 기존 compressive Dx 제거 후 betadine ball로 소독함. Medress #1로 새로 DX 시행함. +) Pulse examination * 0-absent/1+ diminished/2+ normal/3+ bounding 퇴원 후 천자부위 통증 증가, 부종, 감염의 징후, 말초부위 피부색 변 화, 상처 악화 등이 있을 경우 병원 내원하거나 연락하시도록 환자와 보호자 교육함. 계획 f/u 기록자명 김지영 전담간호사 경과기록 2019-01-29 전자서명자: 김지영 1/1 출력일: 2025-04-11 출력자: 김경미 세브란스병원 SEVERANCE HOSPITAL 원본대조필 등록번호: 8633158 주민등록번호: 550112-125**** 남/64세 환자명: 이광욱 연령 구분 분류 영유아기 학령전기 학령기 일반 산모 ㅇ정신 청소년기 성인 현병력 주 증상 및 내원 과정 Hx. DM, HTN, dyslipidemia, Unstable angina, CAOD, (2018.04), s/p CABG(2018.04), Rt. ICA stent insertion(2018.09) PTA 위해 입원함. 복용중인 약 투약 상태 개수 약명 횟수 용법 약품 코드 개수 단위 Aspirin protect [100 mg/1 T 1 PO 아침 식후 D2ASPI01 Glupa (48hr 전후 조영제 1 T 1 PO 아침 식후 D2GLUP02 병용금기) [500 mg/T] Herben [30 mg/T) 1 T 2 PO D2HERBO1 Lipitor [80 mg/T] 1 T 1 PO 아침 식후 D2LIPI12 Lozasartan(원외) [100 1 T 1 PO 아침 식후 DZLOZA02 mg/T] Platless [75 mg/T] 1 T 1 PO 아침 식후 D2PLAT01 Rabiet [10mg/T] 1 T 1 Sigmart [5 mg/T] 1 T 2 22 PO 아침 식전 D2RABI01 PO D2SIGM01 Xigduo XR 10/1000 (원 1 T 1 PO 아침 식후 D2XIGD02 외,48hr 전후 조영제 병용 금기) [1/1] 간호정보조사 2019-01-27 통증 통증 없음 있음 입원 전에 있었음 과거력 과거력 무 유 입원 및 수술 이력 없음 과거병력 고혈압 당뇨 □ 결핵 □암 □ 간염 있음 잘모름 경련 | 기타 CAOD 2vd s/pCABG 과거력(입원 및 수술) 입원시 진단명 및 수술명 입원 및 수술 시기 CAOD 2vd s/pCABG 2018.4월 Rt. ICA stent insertion 2018.09 s/p CAG 전자서명자: 김은경 세브란스병원 SEVERANCE HOSPITAL (2018.04, 일산백) 1/5 출력일: 2025-04-11 출력자: 김경미 원본대조필 등록번호: 8633158 주민등록번호: 550112-125****남/64세 환자명 : 이광욱 간호정보조사 2019-01-27 Allergy Allergy 없음 □ 약 □ 음식 기능 평가 일상생활(ADL) 수행 능력 독립적 수행 부분 보조 필요 완전 보조 보조기(이동) 사용 없음 ㅇ 목발 ㅇ 지팡이 Owalker 휠체어 ㅇ기타 *이동시 주로 사용하는 보조기를 선택해 주세요. 식사하기 독립적 수행가능 목욕하기 독립적 수행가능 개인 위생 독립적 수행가능 옷입기 독립적 수행가능 화장실 사용 독립적 수행가능 계단 오르기 독립적 수행가능 이동하기 독립적 수행가능(휠체어를 제외한 walking aid 사용 할 수 있음) 이동 하기(의자와 침대간) 독립적 수행가능 이동 하기 (휠체어) 운동 규칙적으로 하는 운동 있음 운동의 종류 걷기 □ 달리기 □ 수영 1등산 골프 기타 운동 횟수 (매일 )회/주 1회 운동 시간 1시간~1시간30 음주력 Onondrinker ex-drinker current drinker 음주력(종류, 양, 횟수/wk) 소주 1병 주 3~4회 음주 시작 시기 20살 끊은 시기 2018.4 흡연력 흡연력 Ononsmoker ex-smoker current smoker 하루의 흡연량 (1)갑/일 흡연 시작시기 20살 끊은 시기 2016년 * 끊은 시기가 1년 이하인 경우 꼭 금연교육을 시행해 주세요. (퇴원전까지) 예방 접종 B형 간염 잘모름 Rubella 잘모름 폐구균 잘모름 영양 상태 1개월간 체중변화 없음 ㅇ 증가함 ㅇ 감소함 체중변화 kg 최근 1주일간 식사량 변화 없음 ㅇ 증가 감소 식이 주의 사항 ) 없음 ㅇ 열량 조절 ㅇ 체중 조절 ㅇ 염분 제한 ○ 수분 제한 ○ 단백질 제한 ㅇ 지방 제한 기타 식습관 식사횟수 3회/일 편식 습관 무 선호 음식 기피 음식 수면 상태 전자서명자: 김은경 세브란스병원 SEVERANCE HOSPITAL 2/5 출력일: 2025-04-11 출력자: 김경미 원본대조필 등록번호: 8633158 주민등록번호: 550112-125**** 남/64세 환자명: 이광욱 수면시간 5시간 수면을 돕는법 무 수면장애 없음 신경계 시간에 대한 지남력 있음 장소에 대한 지남력 있음 사람에 대한 지남력 있음 의사 소통 □ 원만함 어려움 □ 불가능함 □ 기타 정서 상태 지난 2주동안 기분이 가라앉거나, 우울하거나, 희망이 없다고 느낀 기간 ) 없음 2~3일 이상 ○7일 이상 ○ 거의 매일 ○ 확인 불가능 지난 2주동안 평소 하던 일에 대한 흥미가 없어지거나 즐거움을 느끼지 못한 기간 없음 ○ 2~3일 이상 ○7일 이상 ○ 거의 매일 확인불가능 정서 평가 0 *The Patient Health Questionnaire -2(PHQ-2) (2003). 마비 무 유확인 불가능 Weakness 무 확인 불가능 시각 시력 장애 유 시력 장애 시력장애 부위 양안 시력저하 □ 시력상실 □ 복시 □ 반점 □ 통증 안경 |기타 보조기 사용 청각 청력 장애 무 ot 소화기계 소화기 관련 증상 배변 양상 배변 횟수 1회/일 유 대변 색깔 □ 누런색 갈색 □ 녹색 □ 검은색 간호정보조사 2019-01-27 배변 장애 무유 선홍색 |흰색 |기타 배변 조절 조절에 문제 없음 배뇨 양상 배뇨 방법 ? spont voiding Foley catheter ? CIC Kissmo □ 기타 catheter 교환 예정일 배뇨 장애 무 ○ 유 배뇨 조절 조절에 문제 없음 기능평가 100 순환기계 맥박 규칙적임 Pacemaker 없음 부종 없음 있음 순환기 관련증상 없음 있음 호흡기계 호흡양상 Regular ? Irregular Suppressed Labored 기타 호흡기 관련증상 없음 있음 전자서명자 : 김은경 세브란스병원 SEVERANCE HOSPITAL 3/5 출력일: 2025-04-11 출력자: 김경미 원본대조필 등록번호: 8633158 주민등록번호: 550112-125**** 남/64세 환자명 : 이광욱 피부 피부 온도 따뜻함 피부 습도 적당함 피부색 이상없음 피부 변화 무 유 ото ото [Comment] 사망 사망 사망 사망 형: CAOD 사망 사망 PT 간호정보조사 퇴원 퇴원 후 보호자 (Main care giver) 없음 배우자 부 모 □ 자녀 조부 ? 조모 형제자매 간병인 기타 퇴원 예정지 ?자택 친척집 타병원 요양시설 기타 퇴원 예정 교통 수단(Discharge transportation) 자가 대중 교통 항공 □ 구급차 |기타 일반 정보(6세 이상) 교육 정도 고등졸 결혼 상태 결혼 직업 사무직 원목 연락 전화번호 01037588088 원함 원하지 않음 종교 없음 기독교 천주교 불교 기타 보호자 (Main care giver) □ 없음 V배우자 부 자녀 조부 조모 형제 자매 간병인 □ 기타 교육 요구도 환자 보호자 기타 교육 요구 주 사용 언어 한국어 □ 영어 일본어 □ 중국어 □ 러시아어 □ 기타 교육 방법(환자 선호) 구두□ 유인물 □ 시범 보이기 |시청각 매체(가능하다면) 읽고 쓰는데 어려움 없음 □ 있음 □ 기타 원하는 교육 내용 □ 질병 □ 약물 □ 검사 □ 수술 □자가 간호 □ 기타 영양 교육과 진료에 영향을 주는 가치와 신념(Value & belief) 없음 있음 경제적 상태 전자서명자: 김은경 세브란스병원 SEVERANCE HOSPITAL 2019-01-27 4/5 출력일: 2025-04-11 출력자: 김경미 원본대조필 |등록번호: 8633158 주민등록번호: 550112-125****남/64세 환자명: 이광욱 입원비 지불의 어려움 있음 없음 기타 입원비 지불과 관련한 사회 사업팀 상담 필요 있음 없음 기타 간호정보조사 2019-01-27 전자서명자: 김은경 5/5 출력일: 2025-04-11 출력자: 김경미 세브란스병원 SEVERANCE HOSPITAL 원본대조필 등록번호: 8633158 주민등록번호: 550112-125****남/70세 환자명 : 이광욱 검사결과 Impression Image Name 전자서명자: 서동우 세브란스병원 SEVERANCE HOSPITAL 기능검사결과(I/F형) *CAD-2VD, S/POPCAB(2018), DM, HTN *Compare with previous echo (2018.04.16) 1. No RWMA 2. Still enlarged LA(LAVI : 39ml/m2) with normal global LV systolic function (EF: 77%) 3. Relaxation abnormality of LV filling pattern with elevated LV filling pressure (E/e': 10->15) 4. Mild pulmonary hypertension (RVSP: 41mmHg) 5. Slightly dilated sinus of Valsalva (38mm) and ascending aorta (39mm) 1/2 출력일: 2025-04-11 출력자: 김경미 원본대조필 등록번호: 8633158 주민등록번호: 550112-125****남/70세 환자명: 이광욱 기능검사결과(I/F형) ECHOCARDIOGRAPHY LABORATORY, SEVERANCE CARDIOVASCULAR HOSPITAL YONSEI UNIVERSITY COLLEGE OF MEDICINE, SEOUL KOREA Exam Date: 2025-03-19 Patient ID: 8633158 Echo No.: 25 Name: 이광욱 Referring Dr.: 안철민 Sex/Age: M 1 70Y Location: OPD Study Remark: Height 170.0cm Weight 78kg BSA 1.89m2 BP 149/62mmHg 1. Comments 전문심초음파 *CAD-2VD, S/P OPCAB(2018), DM, HTN \"Compare with previous echo (2018.04.16) 1. No RWMA 2. Still enlarged LA(LAVI 39ml/m2) with normal global LV systolic function (EF: 77%) 3. Relaxation abnormality of LV filling pattern with elevated LV filling pressure (E/e: 10->15) 4. Mild pulmonary hypertension (RVSP: 41mmHg) 5. Slightly dilated sinus of Valsalva (38mm) and ascending aorta (39mm) 2. Regional Wall Motion Abnormality: No 3. [LV GLS]: 15-20% 4. Valves: MV Native Slightly thickened AV Native Senile sclerocalcified TV Native Slightly thickened 5. Regurgitation: MR Trivial AR No TR. GI PR No 6. Stenosis: MS No AS No 7. Pericardial Effusion: No TS: Intracardiac Thrombi: No No PS No Mass: No 8. Diastolic function: Relaxation abnormality of LV filling pattern M-mode/2D Measurement RVD (9-26) mm LVEDD (42-54): 51 mm IVSD (8-11): IVSS: 11 mm Ao root (22-33) mm 13 mm LA (AP/ML/SI): 40// mm LVESD (24-36): 29 mm PWD (8-11): 9 mm LA Vol LVEF (55-76): PWS: 13 mm by M-mode: 77 % LVOT (18-22): mm by Biplane. % LV Mass: 188.0 g by prolate ellipse by mod simpson LA Vol index (18-28) ml 76.0 ml TV Annulus: mm LV Mass index: 97.9 g/m2 IVC: mm RWT: 0.35 Echo Score: Doppler Measurement Total M T S C by prolate ellipse: by mod simpson MV Annulus (4C/2C): 39.6 ml/m2 ml/m2 mm Aortic Mitral Tricuspid LVOT (TVI): AV (TVI): cm cm TVI of MR jet: cm TR jet. 2.98 m/sec E (0.6-1): 0.77 m/sec RVSP: 41 mmHg LVOT peak V m/sec A (0.3-0.8): 1.10 m/sec RAP 5 mmHg PSPG/MSPG: 1 mmHg DT (170-210) 224 msec MPAP mmHg AV Peak V: m/sec PHT: msec PVR PSPG/MSPG: 9/5 mmHg MDPG: mmHg MDPG mmHg AVA by 2D HR: /min RVOT VTI cm by continuity: cm2 MVA by 2D: cm2 Pulmonic PHT of AR jet: msec by PHT: cm2 PSPG/MSPG: mmHg by continuity: cm2 TDI S 11.0 cm/sec E': 5.0 cm/sec A 11.0 RVOT AT: cm/sec m/sec E/E 15.40 Reported by: 서동우 판독의(1차) 서동우 판독의(2차) 심지영 전자서명자: 서동우 세브란스병원 SEVERANCE HOSPITAL Responsible Dr. : 심지영 2/2 출력일: 2025-04-11 출력자: 김경미 원본대조필 등록번호: 8633158 주민등록번호: 550112-125****남/68세 환자명: 이광욱 진료과 내분비내과 주치의 강은석 BP(S) 132 mmHg BP(D) 62 mmHg HR 82/min 경과 및 Plan CAD(2vd+ LM) s/p CAG (2018.04, 일산백) s/p 40PCAB(LIMA to dLAD, to OM(seq) to DG with RIMA composite Y, Aorta to rPL with RA) (2018-04-09) Rt. ICA stenosis s/p stent insertion (2018.10.02) PAD s/p PTA c DCB at Rt. SFA (2019.01.28) DM(11yrs) Ex-smoker (30yr, 2년전 중단) Aorta to rPL with RA) Glucose 114 Glycoalbumin 20.5 Glucose (연속) - 식후 2시간 181 HbA1c 7.2 Cholesterol 112 Triglyceride 57 HDL-Cholesterol 48 LDL-Cholesterol (Friedewald) 52.6 Urine Albumin-to-Creatinine Ratio 42.04 >> repeat med 6mo f/u 진단명 구분 확진 주진단 기타진단 기타진단 Thyroid nodule 확진 Diabetes mellitus type 2 with dyslipidemia 확진 확진 Internal carotid artery stenosis 기록자명 강은석 전자서명자: 강은석 세브란스병원 SEVERANCE HOSPITAL 진단명 외래재진기록 2023-07-18 1/1 출력일: 2025-04-11 출력자: 김경미 원본대조필 등록번호: 8633158 주민등록번호: 550112-125**** 남/69세 환자명: 이광욱 진료과 내분비내과 주치의 김다함 Progress U/S 경부(neck)(Doppler) 2024.01.16 Clinical information: Diabetes mellitus type 2 with dyslipidemia US examination was done with linear transducer> =10 MHz (central frequency). 이전 US와 비교함 Both thyroid gland 에 multiple probably benign nodules 들이 관찰되며 가장 큰 것은 Rt thyroid lower pole의 21mm 크기의 nodule 임. Background echotexture subtle heterogeneous mild diffuse enlarge 001 음.. Both neck에 pathologically enlarged LNs 없음. Doppler ultrasound images 상 특이소견 없음. Imp: Multiple probably benign nodules in both thyroids (K-TIRADS: 3) R/O Diffuse thyroid disease recommend follow up. T3 0.47 Free T4 1.08 TSH 2.12 추가사항 Thyroid nodule Plan 2y f/u 진단명 구분 확진 주진단 확진 Diabetes mellitus type 2 with dyslipidemia |기타진단 확진 Diabetic polyneuropathy |기타진단 확진 Internal carotid artery stenosis 진단명 기록자명 김다함 외래재진기록 2024-01-16 전자서명자: 김다함 1/1 출력일: 2025-04-11 출력자: 김경미 세브란스병원 SEVERANCE HOSPITAL 원본대조필 등록번호: 8633158 주민등록번호: 550112-125**** 남/69세 환자명: 이광욱 진료과 내분비내과 주치의 강은석 BP(S) 142 mmHg BP(D) 62 mmHg HR 77/min 경과 및 Plan CAD(2vd+ LM) s/p CAG (2018.04, 일산백) s/p 40PCAB(LIMA to dLAD, to OM(seq) to DG with RIMA composite Y, Aorta to rPL with RA) (2018-04-09) Rt. ICA stenosis s/p stent insertion (2018.10.02) PAD s/p PTA DCB at Rt. SFA (2019.01.28) DM(11yrs) Ex-smoker (30yr, 2년전 중단) Aorta to rPL with RA) Glucose 106 Glycoalbumin20.0 Glucose (연속) - 식후 2시간 177 HbA1c 7.0 Cholesterol 104 Triglyceride 77 HDL-Cholesterol 42 LDL-Cholesterol (Friedewald) 46.6 Urine Albumin-to-Creatinine Ratio 69.15 가끔씩 졸린 증상? >> 식습관 꾸준히 관리해보시고, 식후 1시간 자가혈당 측정해보세요. repeat med 6mo f/u 진단명 구분 확진 주진단 확진 Diabetes mellitus type 2 with dyslipidemia |기타진단 확진 Diabetic polyneuropathy |기타진단 확진 Internal carotid artery stenosis 기록자명 강은석 전자서명자: 강은석 세브란스병원 SEVERANCE HOSPITAL 진단명 외래재진기록 2024-01-16 1/1 출력일: 2025-04-11 출력자: 김경미 원본대조필 | 등록번호: 8633158 주민등록번호: 550112-125****남/69세 환자명: 이광욱 진료과 내분비내과 주치의 강은석 BP(S) mmHg BP(D) mmHg HR /min 경과 및 Plan 진단명 구분 확진 CAD(2vd+ LM) s/p CAG (2018.04, 일산백) s/p 40PCAB(LIMA to dLAD, to OM(seq) to DG with RIMA composite Y, Aorta to rPL with RA) (2018-04-09) Rt. ICA stenosis s/p stent insertion (2018.10.02) PAD s/p PTA c DCB at Rt. SFA (2019.01.28) DM(11yrs) Ex-smoker (30yr, 2년전 중단) Aorta to rPL with RA) Glucose 121 Glycoalbumin23.6 Glucose (연속) - 식후 2시간 116 HbA1c 6.9 Cholesterol 115 Triglyceride 57 HDL-Cholesterol 51 LDL-Cholesterol (Friedewald) 52.6 Urine Albumin-to-Creatinine Ratio 36.11 >> repeat med 6mo f/u 주진단 확진 Diabetes mellitus type 2 with dyslipidemia 확진 Thyroid nodule 기타진단 기타진단 확진 Internal carotid artery stenosis 기록자명 강은석(의사) 전자서명자: 강은석 세브란스병원 SEVERANCE HOSPITAL 진단명 외래재진기록 2024-07-16 1/1 출력일: 2025-04-11 출력자: 김경미 원본대조필 등록번호: 8633158 주민등록번호: 550112-125**** 남/69세 환자명: 이광욱 외래재진기록 2024-10-01 진료과 신경과 주치의 남효석 Subjective Brain MRI and MRA 2024-09-12 Small old infarction in left side medulla. Stenosis in right carotid bulb and right distal VA. Steno-occlusion in left VA. Stenosis in left proximal ICA, left cavernous ICA. --> 비슷하십니다. 평소에 괜찮음. 운전하고 내릴 때 어찔함. <5초 - 2022-09-14 에 비해서 Rt distal VA stenosis 가 심해짐. one-way 라서 우려됨. LDL-Cholesterol (Friedewald) 52.6 Objective Assessment Plan plavix, 아모잘탄 Q (로수바 20 복합제) ▶아스피린 추가 Stroke 발생 Cerebral infarction Hemorrhage stroke Unknown stroke TIA Stroke 발생 날짜 Stroke Comment CAOD 발생 ? Acute MI ? Unstable angina PTCA/stent CABG Others CAOD 발생 날짜 CAOD 발생 Comment 전자서명자: 남효석 세브란스병원 SEVERANCE HOSPITAL 1/3 출력일: 2025-04-11 출력자: 김경미 원본대조필 등록번호: 8633158 주민등록번호: 550112-125****남/69세 환자명: 이광욱 외래재진기록 2024-10-01 121067Y|M 8633158 Study Date 2022-09-14 A1069Y|M 8633158 Study Date 2024-09-12 AR 전자서명자: 남효석 세브란스병원 SEVERANCE HOSPITAL B1050mm RF 2/3 출력일: 2025-04-11 출력자: 김경미 원본대조필 등록번호: 8633158 주민등록번호: 550112-125**** 남/69세 환자명: 이광욱 진단명 구분 확진 HP Bricktha Study Date 202409 12 LH 11069YM 8633158 Study Dale 2024-09-12 503 18m RA 주진단 확진 Internal carotid artery stenosis HP 기타진단 확진 기타진단 확진 Coronary artery disease (2 vessel disease) Unstable angina 기록자명 남효석(의사) 전자서명자: 남효석 세브란스병원 SEVERANCE HOSPITAL 진단명 외래재진기록 2024-10-01 3/3 출력일: 2025-04-11 출력자: 김경미 원본대조필 등록번호: 8633158 주민등록번호: 550112-125****남/70세 환자명: 이광욱 진료과 내분비내과 주치의 강은석 BP(S) 170mmHg BP(D) 50mmHg HR 103/min 경과 및 Plan CAD(2vd+ LM) s/p CAG (2018.04, 일산백) s/p 40PCAB(LIMA to dLAD, to OM(seq) to DG with RIMA composite Y, Aorta to rPL with RA) (2018-04-09) Rt. ICA stenosis s/p stent insertion (2018.10.02) PAD s/p PTA c DCB at Rt. SFA (2019.01.28) DM(11yrs) Ex-smoker (30yr, 2년전 중단) Aorta to rPL with RA) Glucose 132 20.1 Glycoalbumin Glucose (연속) - 식후 2시간 235 HbA1c 6.8 Total cholesterol 112 Triglyceride 70 HDL-Cholesterol 56 LDL-Cholesterol (Friedewald) 42 Urine Albumin-to-Creatinine Ratio 63.99 체중 이전과 비슷함 >> repeat med 6mo f/u 진단명 구분 확진 주진단 확진 기타진단 확진 기타진단 확진 Diabetes mellitus type 2 with dyslipidemia Diabetic polyneuropathy 진단명 Internal carotid artery stenosis 기록자명 강은석(의사) 전자서명자: 강은석 세브란스병원 SEVERANCE HOSPITAL 외래재진기록 2025-01-14 1/1 출력일: 2025-04-11 출력자: 김경미 원본대조필 등록번호: 8633158 주민등록번호: 550112-125****남/70세 환자명: 이광욱 진료과 심장내과 주치의 안철민 BP(S) 131 mmHg BP(D) 56mmHg HR 86/min Subjective Good/No interval change Objective Non-HDL Cholesterol 50 Assessment LDL-Cholesterol (Friedewald) 34.8 외래재진기록 일산21세기병원 약) Platless 75mg qd, Amosartan Q5/100/20mg qd, Sigmart 5mg bid, Herben 30mg bid ABI (Ankle / Brachial Index) - Rt: 0.80 /Lt: 0.72 <=-Rt: 0.90 /Lt: 0.84 <== Rt: 0.96 /Lt: 0.88 <==Rt: 0.84/Lt: 0.82 echo *CAD-2VD, S/P OPCAB(2018), DM, HTN *Compare with previous echo (2018.04.16) 1. No RWMA 2. Still enlarged LA(LAVI: 39ml/m2) with normal global LV systolic function (EF: 77%) 3. Relaxation abnormality of LV filling pattern with elevated LV filling pressure (E/e': 10->15) 4. Mild pulmonary hypertension (RVSP: 41mmHg) 5. Slightly dilated sinus of Valsalva (38mm) and ascending aorta (39mm) TMT 10.1 METS equivocal PAD, s/p PTA 2019.1.28 - IVUS-DCB - s/p PTA CDCB at Rt. SFA[2019-01-28] ABI 1.04/1.09 <== 0.69/0.99 CAD(2vd+ LM) s/pCAG(2018.04, 일산백) s/p 2018-04-09 4OPCAB(LIMA to dLAD, to OM(seq) to DG with RIMA composite Y, Aorta to rPL with RA) DM herben 일년 정도 사용 - 유경종 교수님 - radial graft HTN Plan 2yr EKG/CXR/LAB/full(비급여 설명드림) 진단명 구분 확진 진단명 주진단 확진 Unstable angina |기타진단 확진 Peripheral arterial occlusive disease (lower extremities) |기타진단 확진 Coronary artery disease (2 vessel disease) 전자서명자: 안철민 세브란스병원 SEVERANCE HOSPITAL 2025-03-26 1/2 출력일: 2025-04-11 출력자: 김경미 원본대조필 등록번호: 8633158 주민등록번호: 550112-125****남/70세 환자명 : 이광욱 외래재진기록 2025-03-26 기록자명 안철민(의사) 전자서명자: 안철민 세브란스병원 SEVERANCE HOSPITAL 2/2 출력일: 2025-04-11 출력자: 김경미 원본대조필 등록번호: 8633158 주민등록번호: 550112-125**** 남/70세 환자명: 이광욱 진료과 신경과 주치의 남효석 Subjective Objective Assessment Plan Rt distal VA stenosis 가 진행한 것 같습니다. 위험석이 커서 증상이 있으면 스텐트 고려하겠습니다. Stroke 발생 Cerebral infarction Hemorrhage stroke Unknown stroke TIA Stroke 발생 날짜 Stroke Comment CAOD 발생 Acute MI ? Unstable angina PTCA/stent CABG Others CAOD 발생 날짜 CAOD 발생 Comment 전자서명자: 남효석 세브란스병원 SEVERANCE HOSPITAL 8633158M070YCT Brain + Angio (Brain+Neck) (contrast 2025-03-19 13 08:17 AL 외래재진기록 2025-03-26 1/3 출력일: 2025-04-11 출력자: 김경미 원본대조필 | 등록번호: 8633158 주민등록번호: 550112-125****남/70세 환자명 : 이광욱 전자서명자: 남효석 세브란스병원 SEVERANCE HOSPITAL JOYCT Brain + Angio (Brain+Neck) (contrast)2025-03-19 13:08:17 HR M070YCT Brain + Angio (Brain+Neck) (contrast)2025-03-19 13:08 17 A 외래재진기록 2025-03-26 2/3 출력일: 2025-04-11 출력자: 김경미 원본대조필 등록번호: 8633158 주민등록번호: 550112-125****남/70세 환자명 : 이광욱 BOYCT Brain + Angio (Brain+Neck) (contrast)2025-03-19 13:08:17 A 진단명 구분 확진 진단명 주진단 확진 기타진단 확진 Unstable angina Internal carotid artery stenosis 기타진단 확진 Coronary artery disease (2 vessel disease) 기록자명 남효석(의사) 전자서명자: 남효석 세브란스병원 SEVERANCE HOSPITAL 외래재진기록 2025-03-26 3/3 출력일: 2025-04-11 출력자: 김경미 원본대조필 진료비 세부산정내역(외래) 환자등록번호 8633158 환자성명 이광욱 환자구분 건강\n   가입일: 미확인\n   상품명: 미확인 상품\n   담보내용: 미확인 담보\n   상태: 유효\n\n■ 보험 가입 이력 (Insurance History)\nNaN\n[보험 가입 3개월 이내]\n미확인 미확인 보험사 가입 (미확인)\n\n[보험 가입 3개월 이내]\n미확인 미확인 보험사 가입 (미확인)\n\n[보험 가입 3개월 이내]\n미확인 미확인 보험사 가입 (미확인)\n\n[보험 가입 3개월 이내]\n미확인 미확인 보험사 가입 (미확인)\n\n[보험 가입 3개월 이내]\n미확인 미확인 보험사 가입 (미확인)\n\n[보험 가입 3개월 이내]\n미확인 미확인 보험사 가입 (미확인)\n\n[보험 가입 3개월 이내]\n미확인 미확인 보험사 가입 (미확인)\n\n[보험 가입 3개월 이내]\n미확인 미확인 보험사 가입 (미확인)\n\n[보험 가입 3개월 이내]\n미확인 미확인 보험사 가입 (미확인)\n\n[보험 가입 3개월 이내]\n미확인 미확인 보험사 가입 (미확인)\n\n[보험 가입 3개월 이내]\n미확인 미확인 보험사 가입 (미확인)\n\n[보험 가입 3개월 이내]\n미확인 미확인 보험사 가입 (미확인)\n\n[보험 가입 3개월 이내]\n미확인 미확인 보험사 가입 (미확인)\n\n[보험 가입 3개월 이내]\n미확인 미확인 보험사 가입 (미확인)\n\n[보험 가입 3개월 이내]\n미확인 미확인 보험사 가입 (미확인)\n\n[보험 가입 3개월 이내]\n미확인 미확인 보험사 가입 (미확인)\n\n[보험 가입 3개월 이내]\n미확인 미확인 보험사 가입 (미확인)\n\n[보험 가입 3개월 이내]\n미확인 미확인 보험사 가입 (미확인)\n\n[보험 가입 3개월 이내]\n미확인 미확인 보험사 가입 (미확인)\n\n[보험 가입 3개월 이내]\n미확인 미확인 보험사 가입 (미확인)\n\n[보험 가입 3개월 이내]\n미확인 미확인 보험사 가입 (미확인)\n\n[보험 가입 3개월 이내]\n미확인 미확인 보험사 가입 (미확인)\n\n[보험 가입 3개월 이내]\n미확인 미확인 보험사 가입 (미확인)\n\n[보험 가입 3개월 이내]\n미확인 미확인 보험사 가입 (미확인)\n\n[보험 가입 3개월 이내]\n미확인 미확인 보험사 가입 (미확인)\n\n[보험 가입 3개월 이내]\n미확인 미확인 보험사 가입 (미확인)\n\n[보험 가입 3개월 이내]\n미확인 미확인 보험사 가입 (미확인)\n\n[보험 가입 3개월 이내]\n미확인 기(고의사고 허위사고, 허위입원. 진단. 장해, 사고 후 가입 (미확인)\n\n[보험 가입 3개월 이내]\n미확인 미확인 보험사 가입 (미확인)\n\n[보험 가입 3개월 이내]\n미확인 미확인 보험사 가입 (미확인)\n\n[보험 가입 3개월 이내]\n미확인 미확인 보험사 가입 (미확인)\n\n[보험 가입 3개월 이내]\n미확인 미확인 보험사 가입 (미확인)\n\n[보험 가입 3개월 이내]\n미확인 미확인 보험사 가입 (미확인)\n\n[보험 가입 3개월 이내]\n미확인 제출 123 매 의무기록 사본 증명서 이 사본은 의무기록 원본과 틀림이 없음을 증명합니다. 이 사본은 위의 용도 외에는 사용할 수 없습니다. 의무기록 사본 증명서 2025년 04월 11일 담당자: 김경미 (인) 담당자의 날인이 없는 것은 무효임 여래대학교 연세대학교 의과대학 학과대학 세브란스병원 병원 세브란스병원 SEVERANCE HOSPITAL 등록번호: 8633158 주민등록번호: 550112-125**** 남/63세 환자명: 이광욱 외래재진기록 2019-01-02 진료과 심장내과 주치의 안철민 BP(S) 181 mmHg BP(D) 95 mmHg HR 90/min Subjective Objective CT angio Assessment Good/No interval change Multifocal stenosis with calcifications in both SFA and both ATA. Diffuse atherosclerosis with calcification, infrarenal aorta. Varicose vein, left calf. No evidence of DVT. Otherwise unremarkable. CAD(2vd+ LM) s/pCAG(2018.04, 일산백) s/p 2018-04-09 4OPCAB(LIMA to dLAD, to OM(seq) to DG with RIMA composite Y, Aorta to rPL with RA) DM s/p carotid stenting Plan PTA 고려 SFA os, Rt contralateral approach 2월 10일입원, 11일 시술 기록자명 안철민 전자서명자: 안철민 세브란스병원 SEVERANCE HOSPITAL 1/1 출력일: 2025-04-11 출력자: 김경미 원본대조필 등록번호: 8633158 주민등록번호: 550112-125**** 남/64세 환자명: 이광욱 입원정보 입원일자 2019-01-27 입원과 심장내과 입원주치의 안철민 퇴원정보 퇴원일자 2019-01-29 퇴원과 심장내과 퇴원주치의 안철민 최종진단명(*) 순서 한국질병 구분 확진 진단명 분류번호 1 주진단 확진 Peripheral arterial occlusive disease (lower extremities) 170.29 2 기타진단 확진 Unstable angina 120.0 3 기타진단 확진 Coronary artery disease (left main) 125.1 4 기타진단 확진 Coronary artery disease (2 vessel disease) 125.1 5 기타진단 확진 S/P Coronary artery bypass graft Z95.1 과거진단명 과거진단코드 주호소 (*) Diabetes mellitus other, without complication; Diabetes mellitus type 2, without complication; Diabetic polyneuropathy; Internal carotid artery stenosis;Internal carotid artery stenosis, right;Type 2 diabetes mellitus, coronary artery disease; E11.58;E11.9;E13.9;E14.41;165.2; For PTA 과거력 및 현재병력 상기 64세 남환 DM, CAOD (2vd, s/p CAG), PAOD 진단 받은 분으로 PTA 시행 위해 금일 입원함. V/S 120/70 78 20 Current Sx: none 이상 진찰 소견 (★) n-s 재원중 투약내역 (*) n-s 투여된 약물 중 잔류효과로 퇴원 후 주의가 필요한 약물 (*) 없음 있음 Aspirin protect->출혈의 위험성이 증가되므로 상처나 멍이 생기지 않도록 주의하십시오.; Platless-> 출혈의 위험성이 증가되므로 상처나 멍이 생기지 않도록 주의하십시오.; 전자서명자: 안철민 세브란스병원 SEVERANCE HOSPITAL 퇴원요약 2019-01-29 1/3 출력일: 2025-04-11 출력자: 김경미 원본대조필 등록번호: 8633158 주민등록번호: 550112-125****남/64세 환자명: 이광욱 검사소견 (*) 치료 및 효과 (*) @PTA(19.1.28) Access site Lt CFA Approach method contralateral antegrade Peripheral angiography with JR 5F catheter revealed total occlusion of Rt. SFA OS (TIMI 1) with diffuse irregular up to 70% LN of p-mSFA total occlusion of Rt. ATA (TIMI O) Taget lesion: Rt. SFA 7F Balkin sheath c 018 command wire The guiding wire was passed through the lesion. Balloon angioplasty was done with 6x60 mm Mustang PTA balloon at Rt. SFA OS~MSFA F/U angio revealed 60% residual stenosis without dissection Two DCB with 6x150 mm Inpact Admiral were inflated at Rt. SFA OS~MSFA F/U angio revealed 10 % residual stenosis without dissection or flow limitation conclusion>> Successful PTA C DCB at Rt. SFA @Successful PTA c DCB at Rt. SFA(19.1.28) 시행 후 acute complication 없이 퇴원함. @PTA(19.1.28) 주시술명 주시술코드 3950 기타시술명 기타시술코드 Implantable Medical Device 사용 여부 No Yes 치료결과 (*) 완쾌 경쾌 호전안됨 진단뿐 가망없는 퇴원 48시간이내 사망 선행사인 48시간이후 사망 선행사인 선행사인 분류코드 활력증상 혈압 120/75 mmHg 맥박수 70 퇴원형태 (★) 퇴원지시후 타병원전원 회/분 체온 36.8 자의퇴원 ㅇ 탈원 호흡수 20 회/분 향후 치료계획 외래 추후관리 재입원 없음 기타 퇴원요약 2019-01-29 전자서명자: 안철민 2/3 출력일: 2025-04-11 세브란스병원 SEVERANCE HOSPITAL 출력자: 김경미 원본대조필 등록번호: 8633158 주민등록번호: 550112-125**** 남/64세 환자명: 이광욱 퇴원약 약품명 (Name) 용량(Dose) 일수(Days) 용법(Direction) 처방 분류 (Type) 효능 아스피린프로텍트 1 14 정100mg 아침 식후 30분 복용하십시오 퇴원약 헤르벤정 30mg 1 14 아침,저녁 식후 30 퇴원약 분 복용하십시오 리피토정 80mg 1 14 아침 식후 30분 퇴원약 복용하십시오 플래리스정 1 14 아침 식후 30분 복용하십시오 퇴원약 라비에트정10mg 1 14 아침 식전 30분 복 퇴원약 용하십시오 중외시그마트정 1 5mg 14 아침, 저녁 식후 30 퇴원약 분 복용하십시오 코자정100mg 1 14 아침 식후 30분 복용하십시오 퇴원약 아스피린프로텍트 1 19 정100mg 아침 식후 30분 복용하십시오 퇴원약 헤르벤정 30mg 1 19 아침,저녁 식후 30 퇴원약 분 복용하십시오 리피토정 80mg 1 19 아침 식후 30분 퇴원약 복용하십시오 플래리스정 1 19 아침 식후 30분 퇴원약 복용하십시오 라비에트정10mg 1 19 아침 식전 30분 복 퇴원약 용하십시오 중외시그마트정 1 5mg 19 아침,저녁 식후 30 퇴원약 분 복용하십시오 코자정100mg 1 19 아침 식후 30분 복용하십시오 퇴원약 담당 전공의사명 권혜란 기록자명 권혜란 주치의사명 안철민 <약어 설명> CAOD coronary artery obstructive disease RFCA radio-frequency catheter ablation NSTEMI non-ST elevation myocardial infarction C-angio : coronary angiogram A.fib: atrial fibrillation EPS electrophysiologic studies DCMP: dilated cardiomyopathy HCMP hypertrophic cardiomyopathy PAF paroxysmal atrial fibrillation RHD rheumatic heart disease NSVT non-sustained ventricular tachycardia A-flutter : atrial flutter 퇴원요약 2019-01-29 전자서명자: 안철민 3/3 출력일: 2025-04-11 출력자: 김경미 세브란스병원 SEVERANCE HOSPITAL 원본대조필 등록번호: 8633158 주민등록번호: 550112-125****남/64세 환자명: 이광욱 입원일자 2019-01-27 입원과 심장내과 입원주치의 안철민 입원결정의사 안철민 주호소 또는 입원사유 For PTA 현재질병상태 상기 64세 남환 DM, CAOD (2vd, s/p CAG), PAOD 진단 받은 분으로 PTA 시행 위해 금일 입원함. V/S 120/70 78 20 Current Sx none 과거력 Hypertension No Yes Pul. Tbc No Yes DM No Yes Hepatitis No Yes Smoking No Yes 금연교육 여부 시행 미시행 |해당없음 Alcohol No Yes Drug Allergy No Yes Penicillin Sulfonamide ? Cephalosporin Other 알레르기 No Yes Hypercholesterolemia No Yes Cardiac disease No Yes Old CVA No Yes 말초동맥 및 경동맥 질환 No Yes Coronary artery bypass graft No Yes Others 가족력 계통문진 Generalized Weakness No Easy Fatigue No Fever No Chill No Headache No 00000 Yes Yes Yes Yes Yes Dizziness No Yes Insomnia No Yes 전자서명자: 안철민 세브란스병원 SEVERANCE HOSPITAL 입원기록 2019-01-27 1/5 출력일: 2025-04-11 출력자: 김경미 원본대조필 등록번호: 8633158 주민등록번호: 550112-125**** 남/64세 환자명: 이광욱 입원기록 2019-01-27 Cough Sputum Dyspnea DOE z z zz z z z z z z z No No Yes Yes Yes No Yes No No No Yes Yes Yes No Yes No Yes No Yes 0000000000 Chest pain Palpitation Hemoptysis Hematemesis Anorexia Nausea No Vomiting No Yes Constipation No Yes Diarrhea No Yes Abdominal pain No Yes Abdominal discomfort No Hematochezia No Melena No 000 Yes Yes Yes Dysuria No Yes Oliguria No Yes Hematuria No Yes Poor oral intake No Yes Weight Loss No Yes Weight Gain No Yes Others 신체조사 General Appearance Appearance Not so ill-looking appearance Mental Status Alert Drowsy Stupor Semicoma Coma Nutritional and Developement status Good Moderate Poor Skin 피부 Abnormal skin rash Warm ? Cold Wet Dry No Yes Skin tugor Good HEENT Normocephaly without deformity Yes No Sclera not icteric not injected Throat 전자서명자: 안철민 세브란스병원 SEVERANCE HOSPITAL Conjunctiva not pale Lips & tongues not dried 2/5 출력일: 2025-04-11 출력자: 김경미 원본대조필 등록번호: 8633158 주민등록번호: 550112-125**** 남/64세 환자명: 이광욱 Neck Stiffness supple Cervical LNs not palpable Neck veins not engorged Chest/lung Symmetric expansion Yes No Retraction No Yes ( Both Rt Lt) Breath sounds clear increased decreased character High-pitched sound Continuous sound Wheezing Discontinuous sound Fine crackle Low-pitched sound Location Stridor ? Velcro rale Right upper lung field Rhonchi ? Coarse crackle Right middle lung field Left upper lung field ? Left middle lung field Right lower lung field ? Left lower lung field Heart PMI (5th ICS LMCL) 이상 RHB without murmur with murmur Thrill No Yes Heaving No Yes Abdomen Palpation ? soft ? rigid flat distended Bowel sound normoative Tenderness No Yes Palpation of organ No liver kidney spleen Shifting dullness No Yes Fluid wave No Yes Back and Extremity LOM No Yes CVA tenderness No Rt. Lt. Both Pitting edema No Yes Paresthesia No Yes 전자서명자: 안철민 세브란스병원 SEVERANCE HOSPITAL 입원기록 2019-01-27 3/5 출력일: 2025-04-11 출력자: 김경미 원본대조필 등록번호: 8633158 주민등록번호: 550112-125**** 남/64세 환자명: 이광욱 입원기록 2019-01-27 others (Physical Exam) 감염성질환 초기평가 1. 증상 및 기간 발열 기간 일전 호흡기증상 기간 일전 소화기증상 기간 일전 해당없음 (미상환자 포함) 2. 최근 1달 이내 방문한나라 해당없음 없음 있음 3. 최근 1달 이내 입원했던 병원 (감염주의 병원) 없음 있음 4. 밀접 접촉자 해당없음 아니오 예 5. 신종 감염병 의심환자 아니오 예 통증평가 통증여부 No Yes 추정진단 PAOD 계획 PTA 고려 퇴원계획 퇴원 후 치료식이 여부 ? N ? Y 추후 관리 계획 |가정간호사업소 호스피스 타 병원 전원 외래 사회 복지서비스 연계 필요성 ? N ? Y 기타 퇴원시 요구사항 치료계획 + Problem Goal 목표일 수정목표일 계획일 부 PAOD PTA 2019-01-28 2019-01-27 기록자명 하장우 <약어 설명> BMI : body mass index BP(D): Blood Pressure(Diastolic) BP(S) : Blood Pressure(Systolic) BT body temperature 전자서명자: 안철민 세브란스병원 SEVERANCE HOSPITAL ICS: impulse conducting system(of the heart) LMCL left midclavicular line LNs lymph nodes LOM limitation of motion 4/5 출력일: 2025-04-11 출력자: 김경미 원본대조필 등록번호: 8633158 주민등록번호: 550112-125****남/68세 환자명: 이광욱 검사결과 1. ABI (Ankle / Brachial Index) - Rt: 0.90 /Lt: 0.84 1-1. TBI (Toe / Brachial Index)- Rt: 0.39/Lt: 0.36 Impression Name Image 1 전자서명자: 모혜인 세브란스병원 SEVERANCE HOSPITAL 기능검사결과(I/F형) 2023-03-22 1/2 출력일: 2025-04-11 출력자: 김경미 원본대조필 등록번호: 8633158 주민등록번호: 550112-125**** 남/68세 환자명: 이광욱 Name: LEE K.W. ID #: 8633158 Exam Date: 03/22/2023 11:08 AM Operator: M 기능검사결과(I/F형) SEVERANCE HOSPITAL Sex: M MultiLab Series !! SEGMENTAL PRESSURE AND PVR STUDY Brachial RIGHT LEFT 108 109 RIGHT LEFT 0.85 93 PT 92 0.84 0.90 98 DP 91 0.83 ми PVR 64mmHg 187cc LEFT Ankle ABI: 0.84 Gain: 2 Spd:25 Amp:16 TBI: 0.36 0.39 43 39 0.36 PVR 65mmHg 175cc RIGHT Ankle Gain: 2 Spd:25 Amp:19 ABI: 0.90 TBI: 0.39 PPG RIGHT Great Toe Gain:.50 Speed: 25 Amp:01 판독의(1차) 박한진 판독의(2차) 안철민 ABI INDEX 0.97- 1.25 NORMAL 0.75 0.96 MILD 0.50 0.74 MODERATE <0.50 SEVEREE TBI(FBI) INDEX >0.80 NORMAL 0.20 0.54 CLAUDICATION <0.20 REST PAIN PPG LEFT Great Toe Gain:.50 Speed: 25 Amp:01 2023-03-22 전자서명자: 모혜인 2/2 출력일: 2025-04-11 출력자: 김경미 세브란스병원 SEVERANCE HOSPITAL 원본대조필 등록번호: 8633158 주민등록번호: 550112-125**** 남/67세 환자명 : 이광욱 진료과 내분비내과 주치의 강은석 BP(S) 150mmHg BP(D) 58 mmHg HR 89/min 경과 및 Plan 진단명 구분 확진 CAD(2vd+ LM) s/p CAG (2018.04, 일산백) s/p 4OPCAB(LIMA to dLAD, to OM(seq) to DG with RIMA composite Y, Aorta to rPL with RA) (2018-04-09) Rt. ICA stenosis s/p stent insertion (2018.10.02) PAD s/p PTA c DCB at Rt. SFA (2019.01.28) DM(11yrs) Ex-smoker (30yr, 2년전 중단) Aorta to rPL with RA) Glucose 140 Glycoalbumin 20.6 Glucose (연속) - 식후 2시간 195 HbA1c 7.3 Cholesterol 121 Triglyceride 77 HDL-Cholesterol 56 LDL-Cholesterol (Friedewald) 49.6 BUN 24.4 Creatinine 1.22 Urine Albumin-to-Creatinine Ratio 78.07 >> 생활습관 개선 필요함 repeat med 6mo f/u 주진단 확진 Diabetes mellitus type 2 with dyslipidemia 기타진단 확진 Thyroid nodule 기타진단 확진 Internal carotid artery stenosis 기록자명 강은석 진단명 외래재진기록 2022-07-19 전자서명자: 강은석 1/1 출력일: 2025-04-11 출력자: 김경미 세브란스병원 SEVERANCE HOSPITAL 원본대조필 등록번호: 8633158 주민등록번호: 550112-125****남/67세 환자명: 이광욱 외래재진기록 2022-09-21 진료과 심장내과 주치의 일반 BP(S) mmHg HR /min Subjective Objective Assessment Plan 진단명 구분 확진 주진단 기타진단 기타진단 확진 확진 확진 BP(D) mmHg chest pain / discomfort (-/-) dyspnea / DOE (-/-) palpitation (-) functional capacity >4METS 잘지냈다. 증상없음 PAD, S/P PTA 2019.1.28 - IVUS-DCB - s/p PTA DCB at Rt. SFA[2019-01-28] ABI 1.04/1.09 <== 0.69/0.99 CAD(2vd+ LM) s/pCAG(2018.04, 일산백) s/p 2018-04-09 4OPCAB(LIMA to dLAD, to OM(seq) to DG with RIMA composite Y, Aorta to rPL with RA) DM herben 일년 정도 사용 - 유경종 교수님 - radial graft HTN_Q Repeat med Unstable angina Coronary artery disease (left main) Coronary artery disease (2 vessel disease) 기록자명 최기정 <약어 설명> BP(D) : Blood Pressure(Diastolic) 진단명 HR : Heart Rate BP(S) : Blood Pressure (Systolic) med Medication 전자서명자: 최기정 세브란스병원 1/1 출력일: 2025-04-11 출력자: 김경미 원본대조필 SEVERANCE HOSPITAL 등록번호: 8633158 주민등록번호: 550112-125****남/67세 환자명: 이광욱 진료과 신경과 주치의 홍순호 SBP 129 mmHg DBP 60mmHg 맥박 81회/분 경과 Rt. pICA severe stenosis s/p stent insertion (2018) --4 vessel 2019.09.05 Occlusion of Lt VA. No residual stenosis or in-stent thrombosis in Rt pICA. --brain MRIA 2022.09.14 Small old infarction in left side medulla. Microbleed in right parietal lobe. Stenosis in right carotid bulb and right distal VA. Steno-occlusion in left VA. Stenosis in left proximal ICA, left cavernous ICA. -->interval change 없어보임. 별일 없으셨다 2024 brain MRIA 외래재진기록 2022-09-21 전자서명자: 홍순호 1/2 출력일: 2025-04-11 출력자: 김경미 세브란스병원 SEVERANCE HOSPITAL 원본대조필 등록번호: 8633158 주민등록번호: 550112-125**** 남/67세 환자명: 이광욱 진단명 구분 확진 주진단 확진 |기타진단 확진 |기타진단 확진 Internal carotid artery stenosis Unstable angina Coronary artery disease (2 vessel disease) 진단명 기록자명 홍순호 외래재진기록 2022-09-21 전자서명자: 홍순호 2/2 출력일: 2025-04-11 출력자: 김경미 세브란스병원 SEVERANCE HOSPITAL 원본대조필 등록번호: 8633158 주민등록번호: 550112-125**** 남/69세 환자명: 이광욱 영상검사 CT& MR 영상검사 CT& MR 검사명 MRI Brain & Angio 3D(Neck포함) (contrast) 검사방법 검사일자 판독일자 2024.09.12 10:33 2024.10.22 15:34 촬영실 MRI 74호(본관 4층) Description 판독의/전문의 Clinical information: Internal carotid artery stenosis Imaging technique: sagittal T1Wl, axial T1WI, T2WI, T2 FLAIR. T2*WI, contrast enhanced 3D T1Wl with axial/coronal/sagittal reconstruction, intracranial TOF MRA, contrast enhanced intracranial and neck MRA. Contrast media: Used Small old infarction in left side medulla. Microbleed in right parietal lobe. Stenosis in right carotid bulb and right distal VA. Steno-occlusion in left VA. Stenosis in left proximal ICA, left cavernous ICA. IMP: No interval change ④조영제 Dotarem inj[20ml/Syringe] [Meglumine gadoterate 376.9mg/ml] [20ml/Syringe]:1 안성수/안성수/안성수 전자서명자: 안성수 1/1 출력일: 2025-04-11 출력자: 김경미 세브란스병원 SEVERANCE HOSPITAL 원본대조필 등록번호: 8633158 주민등록번호: 550112-125**** 남/68세 환자명: 이광욱 진료과 내분비내과 주치의 강은석 BP(S) 163mmHg BP(D) 70mmHg HR 91/min 경과 및 Plan CAD(2vd+ LM) s/p CAG (2018.04, 일산백) s/p 4OPCAB(LIMA to dLAD, to OM(seq) to DG with RIMA composite Y, Aorta to rPL with RA) (2018-04-09) Rt. ICA stenosis s/p stent insertion (2018.10.02) PAD s/p PTA c DCB at Rt. SFA (2019.01.28) DM(11yrs) Ex-smoker (30yr, 2년전 중단) Aorta to rPL with RA) Glucose 124 Glycoalbumin 20.9 Glucose (연속) - 식후 2시간 226 HbA1c 7.2 Cholesterol 116 Triglyceride 76 HDL-Cholesterol 50 LDL-Cholesterol (Friedewald) 50.8 Urine Albumin-to-Creatinine Ratio 69.81 >> 운동 및 생활습관 개선 필요함 repeat med 6mof/u 진단명 구분 확진 주진단 확진 기타진단 확진 기타진단 확진 Diabetes mellitus type 2 with dyslipidemia Thyroid nodule Internal carotid artery stenosis 기록자명 강은석 진단명 외래재진기록 2023-01-17 전자서명자: 강은석 1/1 출력일: 2025-04-11 출력자: 김경미 세브란스병원 SEVERANCE HOSPITAL 원본대조필 등록번호: 8633158 주민등록번호: 550112-125**** 남/68세 환자명: 이광욱 외래재진기록 2023-03-22 진료과 심장내과 주치의 안철민 BP(S) 122 mmHg BP(D) 52mmHg HR 88/min Subjective Objective Assessment Plan Good/No interval change Non-HDL Cholesterol 53 LDL-Cholesterol (Friedewald) 39.4 Glucose 134 BUN 19.8 Creatinine 1.06 TMT 10.1 METs, equivocal ABI (Ankle / Brachial Index) 0.84/Lt: 0.82 PAD, s/p PTA 2019.1.28 - IVUS-DCB - - Rt: 0.90 /Lt: 0.84 <==Rt: 0.96/Lt: 0.88 <== Rt: s/p PTA DCB at Rt. SFA[2019-01-28] ABI 1.04/1.09 <== 0.69/0.99 CAD(2vd+ LM) s/p CAG(2018.04, 일산백) s/p 2018-04-09 4OPCAB(LIMA to dLAD, to OM(seq) to DG with RIMA composite Y, Aorta to rPL with RA) DM herben 일년 정도 사용 - 유경종 교수님 - radial graft HTN Repeat med 3개월 후 local refer 2yr EKG/CXR/LAB/full(비급여 설명드림) 진단명 구분 확진 주진단 확진 Unstable angina |기타진단 확진 Coronary artery disease (left main) |기타진단 확진 Coronary artery disease (2 vessel disease) 기록자명 안철민 전자서명자: 안철민 세브란스병원 SEVERANCE HOSPITAL 진단명 1/1 출력일: 2025-04-11 출력자: 김경미 원본대조필 등록번호: 8633158 주민등록번호: 550112-125****남/70세 환자명: 이광욱 검사결과 1. ABI (Ankle/ Brachial Index) - Rt: 0.80 /Lt: 0.72 1-1. TBI (Toe Brachial Index) - Rt: 0.51/Lt: 0.33 Impression Name Image 1 0.5- 0- Patient name: 012 Patient ID: 8633158 Gender: R Thigh PVR E 0.5- 0- 0.98 124] 127 1.00 -0.5- 기능검사결과(I/F형) 2025-03-19 Exam Date/Time: 19-03-2025 10:27 Examiner: Ref Physician: L Thigh -3.5- 45 P=59 HR-73 Amp-1.060 RT-232 Sc=x4 G=6 R BI Knee PVR 0.99 126 131 1.03 0.5- 0.5- 0.90 114 113 89 0- 0- -05- 4s R P=56 HR=72 Amp=1.248 RT=264 Sc=x4 G=6 R Ankle 0.80 10192 0.72 0.75 95 OP 90 0.71 0.79 100 103 0.81 0.51 65 42 0.33 -0.5- PVR 0.5- L Ankle 0.5- 0- -0.5- 0.5 0- -0.5- 0- -0.5- 4s P=57 HR=75 Amp=0.678 RT=236 Sc=x4 G=6 R Metatarsal PVR 0.5 0- -0.5- 4s P=62 HR 75 Amp=0.270 RT-244 Sc=x4 G=6 R Toe 1 A ниш 0- -10- 45 HR 73 Amp=17.4 RT=282 Sc=x4 G=4 판독의(1차) 이찬주 판독의(2차) 안철민 전자서명자: 이재인 세브란스병원 SEVERANCE HOSPITAL VIASONIX 0- -10- PVR 4s P=59 HR=73 Amp=0.938 RT=264 Sc=x4 G=6 L BI Knee PVR ни 45 P=57 HR=72 Amp=1.185 RT=238 Sc=x4 G=6 PVR ми P=55 HR=N/A Amp=N/A RT=N/A Sc=x4 G=6 L Metatarsal PVR 45 P=58 HR=N/A Amp=N/A RT=N/A Sc=x4 G=6 L Toe 1 ми 4s HR 73 Amp=20.4 RT=282 Sc=x4 G=4 Page 1 of 1 1/1 출력일: 2025-04-11 출력자: 김경미 원본대조필 등록번호: 8633158 주민등록번호: 550112-125**** 남/64세 환자명: 이광욱 C-sec: cesarean section CVA cerebrovascular accident CVA tenderness costovertebral angle DM diabetes mellitus DOE dyspnea on exertion ECOG eastern cooperative oncology group HEENT: head, ear, eye, nose and throat NSVD normal spontaneous vaginal delivery PAOD peripheral arterial occlusive disease : PMI point of maximum impulse PR: pulse rate Pul. Tbc pulmonary tuberculosis RHB regular heart beat 전자서명자: 안철민 세브란스병원 SEVERANCE HOSPITAL 입원기록 2019-01-27 5/5 출력일: 2025-04-11 출력자: 김경미 원본대조필 등록번호: 8633158 주민등록번호: 550112-125****남/64세 환자명: 이광욱 진료과 심장내과 주치의 안철민 경과 계획 >>PTA CAD(2vd+ LM) s/pCAG(2018.04, 일산백) s/p_20182-04-09 4OPCAB(LIMA to dLAD, to OM(seq) to DG with RIMA composite Y, Aorta to rPL with RA) DM s/p carotid stenting @ CT angio Multifocal stenosis with calcifications in both SFA and both ATA. Diffuse atherosclerosis with calcification, infrarenal aorta. Varicose vein, left calf. No evidence of DVT. Otherwise unremarkable. PTA 치료계획: 주치의가 환자의 치료계획을 확인함. 주치의 Comment 주치의가 회진을 돌아 환자의 상태를 확인하였고 처방상태를 확인 후 환자에게 현재 상태를 설명함. 치료계획 + Problem 부 E Acute myocardial infarction, ST elevation E PAOD 기록자명 권혜란 Goal PTA PTA 목표일 수정목표일 계획일 2019-01-28 2019-01-27 2019-01-28 전자서명자: 안철민 1/1 세브란스병원 SEVERANCE HOSPITAL 2019-01-27 출력일: 2025-04-11 경과기록 2019-01-27 출력자: 김경미 원본대조필 등록번호: 8633158 주민등록번호: 550112-125****남/64세 환자명: 이광욱 진료과 심장내과 주치의 안철민 경과 계획 >>PTA CAD(2vd+ LM) s/p CAG(2018.04, 일산백) s/p_20182-04-09 40PCAB(LIMA to dLAD, to OM(seq) to DG with RIMA composite Y, Aorta to rPL with RA) DM s/p carotid stenting @ CT angio Multifocal stenosis with calcifications in both SFA and both ATA. Diffuse atherosclerosis with calcification, infrarenal aorta. Varicose vein, left calf. No evidence of DVT. Otherwise unremarkable. @PTA(19.1.28) PTA 치료계획: 주치의가 환자의 치료계획을 확인함. 주치의 Comment 치료계획 + Problem 부 E Acute myocardial 주치의가 회진을 돌아 환자의 상태를 확인하였고 처방상태를 확인 후 환자에게 현재 상태를 설명함. Goal PTA 목표일 수정목표일 계획일 2019-01-28 2019-01-27 infarction, ST elevation E PAOD 기록자명 권혜란 전자서명자: 안철민 세브란스병원 SEVERANCE HOSPITAL PTA 2019-01-28 1/1 2019-01-27 출력일: 2025-04-11 경과기록 2019-01-28 출력자: 김경미 원본대조필 등록번호: 8633158 주민등록번호: 550112-125**** 남/64세 환자명: 이광욱 경과 계획 [Puncture site assessment]: POD #0 1. Lt.CFA (Proglide) 1) Bleeding/Oozing (-) 2) Hematoma/Color change (-/-) 3) Distal assessment: Color/Pulse/Temperature change (-/-/-) * Lt.DPA (2+) 4) Infection sign (-) 5) Puncture site pulse check (2+) +) Pulse examination * 0-absent/1+ diminished/2+ normal/3+ bounding 천자부위가 점점 부어오르는 느낌이나 거즈 위로 피가 배어나오거나 흐르는 경우, 갑자기 어지럽거나 통증 및 불편감 심해지는 경우 즉시 의료진에게 알리도록 환자와 보호자 교육함. Puncture site close monitoring 4hrs ABR 기록자명 김지영 전담간호사 경과기록 2019-01-28 전자서명자: 김지영 1/1 출력일: 2025-04-11 출력자: 김경미 세브란스병원 SEVERANCE HOSPITAL 원본대조필 등록번호: 8633158 주민등록번호: 550112-125**** 남/64세 환자명: 이광욱 경과 [Puncture site assessment]: POD #1 1. Lt.CFA (Proglide) 1) Bleeding/Oozing (-) 2) Hematoma/Color change (-/-) 3) Distal assessment: Color/Pulse/Temperature change (-/-/-) Lt.DPA (2+) 4) Infection sign (-) 5) Puncture site pulse check (2+) 6) Bruit(+)/ Thrill (-) 7) 기존 compressive Dx 제거 후 betadine ball로 소독함. Medress #1로 새로 DX 시행함. +) Pulse examination * 0-absent/1+ diminished/2+ normal/3+ bounding 퇴원 후 천자부위 통증 증가, 부종, 감염의 징후, 말초부위 피부색 변 화, 상처 악화 등이 있을 경우 병원 내원하거나 연락하시도록 환자와 보호자 교육함. 계획 f/u 기록자명 김지영 전담간호사 경과기록 2019-01-29 전자서명자: 김지영 1/1 출력일: 2025-04-11 출력자: 김경미 세브란스병원 SEVERANCE HOSPITAL 원본대조필 등록번호: 8633158 주민등록번호: 550112-125**** 남/64세 환자명: 이광욱 연령 구분 분류 영유아기 학령전기 학령기 일반 산모 ㅇ정신 청소년기 성인 현병력 주 증상 및 내원 과정 Hx. DM, HTN, dyslipidemia, Unstable angina, CAOD, (2018.04), s/p CABG(2018.04), Rt. ICA stent insertion(2018.09) PTA 위해 입원함. 복용중인 약 투약 상태 개수 약명 횟수 용법 약품 코드 개수 단위 Aspirin protect [100 mg/1 T 1 PO 아침 식후 D2ASPI01 Glupa (48hr 전후 조영제 1 T 1 PO 아침 식후 D2GLUP02 병용금기) [500 mg/T] Herben [30 mg/T) 1 T 2 PO D2HERBO1 Lipitor [80 mg/T] 1 T 1 PO 아침 식후 D2LIPI12 Lozasartan(원외) [100 1 T 1 PO 아침 식후 DZLOZA02 mg/T] Platless [75 mg/T] 1 T 1 PO 아침 식후 D2PLAT01 Rabiet [10mg/T] 1 T 1 Sigmart [5 mg/T] 1 T 2 22 PO 아침 식전 D2RABI01 PO D2SIGM01 Xigduo XR 10/1000 (원 1 T 1 PO 아침 식후 D2XIGD02 외,48hr 전후 조영제 병용 금기) [1/1] 간호정보조사 2019-01-27 통증 통증 없음 있음 입원 전에 있었음 과거력 과거력 무 유 입원 및 수술 이력 없음 과거병력 고혈압 당뇨 □ 결핵 □암 □ 간염 있음 잘모름 경련 | 기타 CAOD 2vd s/pCABG 과거력(입원 및 수술) 입원시 진단명 및 수술명 입원 및 수술 시기 CAOD 2vd s/pCABG 2018.4월 Rt. ICA stent insertion 2018.09 s/p CAG 전자서명자: 김은경 세브란스병원 SEVERANCE HOSPITAL (2018.04, 일산백) 1/5 출력일: 2025-04-11 출력자: 김경미 원본대조필 등록번호: 8633158 주민등록번호: 550112-125****남/64세 환자명 : 이광욱 간호정보조사 2019-01-27 Allergy Allergy 없음 □ 약 □ 음식 기능 평가 일상생활(ADL) 수행 능력 독립적 수행 부분 보조 필요 완전 보조 보조기(이동) 사용 없음 ㅇ 목발 ㅇ 지팡이 Owalker 휠체어 ㅇ기타 *이동시 주로 사용하는 보조기를 선택해 주세요. 식사하기 독립적 수행가능 목욕하기 독립적 수행가능 개인 위생 독립적 수행가능 옷입기 독립적 수행가능 화장실 사용 독립적 수행가능 계단 오르기 독립적 수행가능 이동하기 독립적 수행가능(휠체어를 제외한 walking aid 사용 할 수 있음) 이동 하기(의자와 침대간) 독립적 수행가능 이동 하기 (휠체어) 운동 규칙적으로 하는 운동 있음 운동의 종류 걷기 □ 달리기 □ 수영 1등산 골프 기타 운동 횟수 (매일 )회/주 1회 운동 시간 1시간~1시간30 음주력 Onondrinker ex-drinker current drinker 음주력(종류, 양, 횟수/wk) 소주 1병 주 3~4회 음주 시작 시기 20살 끊은 시기 2018.4 흡연력 흡연력 Ononsmoker ex-smoker current smoker 하루의 흡연량 (1)갑/일 흡연 시작시기 20살 끊은 시기 2016년 * 끊은 시기가 1년 이하인 경우 꼭 금연교육을 시행해 주세요. (퇴원전까지) 예방 접종 B형 간염 잘모름 Rubella 잘모름 폐구균 잘모름 영양 상태 1개월간 체중변화 없음 ㅇ 증가함 ㅇ 감소함 체중변화 kg 최근 1주일간 식사량 변화 없음 ㅇ 증가 감소 식이 주의 사항 ) 없음 ㅇ 열량 조절 ㅇ 체중 조절 ㅇ 염분 제한 ○ 수분 제한 ○ 단백질 제한 ㅇ 지방 제한 기타 식습관 식사횟수 3회/일 편식 습관 무 선호 음식 기피 음식 수면 상태 전자서명자: 김은경 세브란스병원 SEVERANCE HOSPITAL 2/5 출력일: 2025-04-11 출력자: 김경미 원본대조필 등록번호: 8633158 주민등록번호: 550112-125**** 남/64세 환자명: 이광욱 수면시간 5시간 수면을 돕는법 무 수면장애 없음 신경계 시간에 대한 지남력 있음 장소에 대한 지남력 있음 사람에 대한 지남력 있음 의사 소통 □ 원만함 어려움 □ 불가능함 □ 기타 정서 상태 지난 2주동안 기분이 가라앉거나, 우울하거나, 희망이 없다고 느낀 기간 ) 없음 2~3일 이상 ○7일 이상 ○ 거의 매일 ○ 확인 불가능 지난 2주동안 평소 하던 일에 대한 흥미가 없어지거나 즐거움을 느끼지 못한 기간 없음 ○ 2~3일 이상 ○7일 이상 ○ 거의 매일 확인불가능 정서 평가 0 *The Patient Health Questionnaire -2(PHQ-2) (2003). 마비 무 유확인 불가능 Weakness 무 확인 불가능 시각 시력 장애 유 시력 장애 시력장애 부위 양안 시력저하 □ 시력상실 □ 복시 □ 반점 □ 통증 안경 |기타 보조기 사용 청각 청력 장애 무 ot 소화기계 소화기 관련 증상 배변 양상 배변 횟수 1회/일 유 대변 색깔 □ 누런색 갈색 □ 녹색 □ 검은색 간호정보조사 2019-01-27 배변 장애 무유 선홍색 |흰색 |기타 배변 조절 조절에 문제 없음 배뇨 양상 배뇨 방법 ? spont voiding Foley catheter ? CIC Kissmo □ 기타 catheter 교환 예정일 배뇨 장애 무 ○ 유 배뇨 조절 조절에 문제 없음 기능평가 100 순환기계 맥박 규칙적임 Pacemaker 없음 부종 없음 있음 순환기 관련증상 없음 있음 호흡기계 호흡양상 Regular ? Irregular Suppressed Labored 기타 호흡기 관련증상 없음 있음 전자서명자 : 김은경 세브란스병원 SEVERANCE HOSPITAL 3/5 출력일: 2025-04-11 출력자: 김경미 원본대조필 등록번호: 8633158 주민등록번호: 550112-125**** 남/64세 환자명 : 이광욱 피부 피부 온도 따뜻함 피부 습도 적당함 피부색 이상없음 피부 변화 무 유 ото ото [Comment] 사망 사망 사망 사망 형: CAOD 사망 사망 PT 간호정보조사 퇴원 퇴원 후 보호자 (Main care giver) 없음 배우자 부 모 □ 자녀 조부 ? 조모 형제자매 간병인 기타 퇴원 예정지 ?자택 친척집 타병원 요양시설 기타 퇴원 예정 교통 수단(Discharge transportation) 자가 대중 교통 항공 □ 구급차 |기타 일반 정보(6세 이상) 교육 정도 고등졸 결혼 상태 결혼 직업 사무직 원목 연락 전화번호 01037588088 원함 원하지 않음 종교 없음 기독교 천주교 불교 기타 보호자 (Main care giver) □ 없음 V배우자 부 자녀 조부 조모 형제 자매 간병인 □ 기타 교육 요구도 환자 보호자 기타 교육 요구 주 사용 언어 한국어 □ 영어 일본어 □ 중국어 □ 러시아어 □ 기타 교육 방법(환자 선호) 구두□ 유인물 □ 시범 보이기 |시청각 매체(가능하다면) 읽고 쓰는데 어려움 없음 □ 있음 □ 기타 원하는 교육 내용 □ 질병 □ 약물 □ 검사 □ 수술 □자가 간호 □ 기타 영양 교육과 진료에 영향을 주는 가치와 신념(Value & belief) 없음 있음 경제적 상태 전자서명자: 김은경 세브란스병원 SEVERANCE HOSPITAL 2019-01-27 4/5 출력일: 2025-04-11 출력자: 김경미 원본대조필 |등록번호: 8633158 주민등록번호: 550112-125****남/64세 환자명: 이광욱 입원비 지불의 어려움 있음 없음 기타 입원비 지불과 관련한 사회 사업팀 상담 필요 있음 없음 기타 간호정보조사 2019-01-27 전자서명자: 김은경 5/5 출력일: 2025-04-11 출력자: 김경미 세브란스병원 SEVERANCE HOSPITAL 원본대조필 등록번호: 8633158 주민등록번호: 550112-125****남/70세 환자명 : 이광욱 검사결과 Impression Image Name 전자서명자: 서동우 세브란스병원 SEVERANCE HOSPITAL 기능검사결과(I/F형) *CAD-2VD, S/POPCAB(2018), DM, HTN *Compare with previous echo (2018.04.16) 1. No RWMA 2. Still enlarged LA(LAVI : 39ml/m2) with normal global LV systolic function (EF: 77%) 3. Relaxation abnormality of LV filling pattern with elevated LV filling pressure (E/e': 10->15) 4. Mild pulmonary hypertension (RVSP: 41mmHg) 5. Slightly dilated sinus of Valsalva (38mm) and ascending aorta (39mm) 1/2 출력일: 2025-04-11 출력자: 김경미 원본대조필 등록번호: 8633158 주민등록번호: 550112-125****남/70세 환자명: 이광욱 기능검사결과(I/F형) ECHOCARDIOGRAPHY LABORATORY, SEVERANCE CARDIOVASCULAR HOSPITAL YONSEI UNIVERSITY COLLEGE OF MEDICINE, SEOUL KOREA Exam Date: 2025-03-19 Patient ID: 8633158 Echo No.: 25 Name: 이광욱 Referring Dr.: 안철민 Sex/Age: M 1 70Y Location: OPD Study Remark: Height 170.0cm Weight 78kg BSA 1.89m2 BP 149/62mmHg 1. Comments 전문심초음파 *CAD-2VD, S/P OPCAB(2018), DM, HTN \"Compare with previous echo (2018.04.16) 1. No RWMA 2. Still enlarged LA(LAVI 39ml/m2) with normal global LV systolic function (EF: 77%) 3. Relaxation abnormality of LV filling pattern with elevated LV filling pressure (E/e: 10->15) 4. Mild pulmonary hypertension (RVSP: 41mmHg) 5. Slightly dilated sinus of Valsalva (38mm) and ascending aorta (39mm) 2. Regional Wall Motion Abnormality: No 3. [LV GLS]: 15-20% 4. Valves: MV Native Slightly thickened AV Native Senile sclerocalcified TV Native Slightly thickened 5. Regurgitation: MR Trivial AR No TR. GI PR No 6. Stenosis: MS No AS No 7. Pericardial Effusion: No TS: Intracardiac Thrombi: No No PS No Mass: No 8. Diastolic function: Relaxation abnormality of LV filling pattern M-mode/2D Measurement RVD (9-26) mm LVEDD (42-54): 51 mm IVSD (8-11): IVSS: 11 mm Ao root (22-33) mm 13 mm LA (AP/ML/SI): 40// mm LVESD (24-36): 29 mm PWD (8-11): 9 mm LA Vol LVEF (55-76): PWS: 13 mm by M-mode: 77 % LVOT (18-22): mm by Biplane. % LV Mass: 188.0 g by prolate ellipse by mod simpson LA Vol index (18-28) ml 76.0 ml TV Annulus: mm LV Mass index: 97.9 g/m2 IVC: mm RWT: 0.35 Echo Score: Doppler Measurement Total M T S C by prolate ellipse: by mod simpson MV Annulus (4C/2C): 39.6 ml/m2 ml/m2 mm Aortic Mitral Tricuspid LVOT (TVI): AV (TVI): cm cm TVI of MR jet: cm TR jet. 2.98 m/sec E (0.6-1): 0.77 m/sec RVSP: 41 mmHg LVOT peak V m/sec A (0.3-0.8): 1.10 m/sec RAP 5 mmHg PSPG/MSPG: 1 mmHg DT (170-210) 224 msec MPAP mmHg AV Peak V: m/sec PHT: msec PVR PSPG/MSPG: 9/5 mmHg MDPG: mmHg MDPG mmHg AVA by 2D HR: /min RVOT VTI cm by continuity: cm2 MVA by 2D: cm2 Pulmonic PHT of AR jet: msec by PHT: cm2 PSPG/MSPG: mmHg by continuity: cm2 TDI S 11.0 cm/sec E': 5.0 cm/sec A 11.0 RVOT AT: cm/sec m/sec E/E 15.40 Reported by: 서동우 판독의(1차) 서동우 판독의(2차) 심지영 전자서명자: 서동우 세브란스병원 SEVERANCE HOSPITAL Responsible Dr. : 심지영 2/2 출력일: 2025-04-11 출력자: 김경미 원본대조필 등록번호: 8633158 주민등록번호: 550112-125****남/68세 환자명: 이광욱 진료과 내분비내과 주치의 강은석 BP(S) 132 mmHg BP(D) 62 mmHg HR 82/min 경과 및 Plan CAD(2vd+ LM) s/p CAG (2018.04, 일산백) s/p 40PCAB(LIMA to dLAD, to OM(seq) to DG with RIMA composite Y, Aorta to rPL with RA) (2018-04-09) Rt. ICA stenosis s/p stent insertion (2018.10.02) PAD s/p PTA c DCB at Rt. SFA (2019.01.28) DM(11yrs) Ex-smoker (30yr, 2년전 중단) Aorta to rPL with RA) Glucose 114 Glycoalbumin 20.5 Glucose (연속) - 식후 2시간 181 HbA1c 7.2 Cholesterol 112 Triglyceride 57 HDL-Cholesterol 48 LDL-Cholesterol (Friedewald) 52.6 Urine Albumin-to-Creatinine Ratio 42.04 >> repeat med 6mo f/u 진단명 구분 확진 주진단 기타진단 기타진단 Thyroid nodule 확진 Diabetes mellitus type 2 with dyslipidemia 확진 확진 Internal carotid artery stenosis 기록자명 강은석 전자서명자: 강은석 세브란스병원 SEVERANCE HOSPITAL 진단명 외래재진기록 2023-07-18 1/1 출력일: 2025-04-11 출력자: 김경미 원본대조필 등록번호: 8633158 주민등록번호: 550112-125**** 남/69세 환자명: 이광욱 진료과 내분비내과 주치의 김다함 Progress U/S 경부(neck)(Doppler) 2024.01.16 Clinical information: Diabetes mellitus type 2 with dyslipidemia US examination was done with linear transducer> =10 MHz (central frequency). 이전 US와 비교함 Both thyroid gland 에 multiple probably benign nodules 들이 관찰되며 가장 큰 것은 Rt thyroid lower pole의 21mm 크기의 nodule 임. Background echotexture subtle heterogeneous mild diffuse enlarge 001 음.. Both neck에 pathologically enlarged LNs 없음. Doppler ultrasound images 상 특이소견 없음. Imp: Multiple probably benign nodules in both thyroids (K-TIRADS: 3) R/O Diffuse thyroid disease recommend follow up. T3 0.47 Free T4 1.08 TSH 2.12 추가사항 Thyroid nodule Plan 2y f/u 진단명 구분 확진 주진단 확진 Diabetes mellitus type 2 with dyslipidemia |기타진단 확진 Diabetic polyneuropathy |기타진단 확진 Internal carotid artery stenosis 진단명 기록자명 김다함 외래재진기록 2024-01-16 전자서명자: 김다함 1/1 출력일: 2025-04-11 출력자: 김경미 세브란스병원 SEVERANCE HOSPITAL 원본대조필 등록번호: 8633158 주민등록번호: 550112-125**** 남/69세 환자명: 이광욱 진료과 내분비내과 주치의 강은석 BP(S) 142 mmHg BP(D) 62 mmHg HR 77/min 경과 및 Plan CAD(2vd+ LM) s/p CAG (2018.04, 일산백) s/p 40PCAB(LIMA to dLAD, to OM(seq) to DG with RIMA composite Y, Aorta to rPL with RA) (2018-04-09) Rt. ICA stenosis s/p stent insertion (2018.10.02) PAD s/p PTA DCB at Rt. SFA (2019.01.28) DM(11yrs) Ex-smoker (30yr, 2년전 중단) Aorta to rPL with RA) Glucose 106 Glycoalbumin20.0 Glucose (연속) - 식후 2시간 177 HbA1c 7.0 Cholesterol 104 Triglyceride 77 HDL-Cholesterol 42 LDL-Cholesterol (Friedewald) 46.6 Urine Albumin-to-Creatinine Ratio 69.15 가끔씩 졸린 증상? >> 식습관 꾸준히 관리해보시고, 식후 1시간 자가혈당 측정해보세요. repeat med 6mo f/u 진단명 구분 확진 주진단 확진 Diabetes mellitus type 2 with dyslipidemia |기타진단 확진 Diabetic polyneuropathy |기타진단 확진 Internal carotid artery stenosis 기록자명 강은석 전자서명자: 강은석 세브란스병원 SEVERANCE HOSPITAL 진단명 외래재진기록 2024-01-16 1/1 출력일: 2025-04-11 출력자: 김경미 원본대조필 | 등록번호: 8633158 주민등록번호: 550112-125****남/69세 환자명: 이광욱 진료과 내분비내과 주치의 강은석 BP(S) mmHg BP(D) mmHg HR /min 경과 및 Plan 진단명 구분 확진 CAD(2vd+ LM) s/p CAG (2018.04, 일산백) s/p 40PCAB(LIMA to dLAD, to OM(seq) to DG with RIMA composite Y, Aorta to rPL with RA) (2018-04-09) Rt. ICA stenosis s/p stent insertion (2018.10.02) PAD s/p PTA c DCB at Rt. SFA (2019.01.28) DM(11yrs) Ex-smoker (30yr, 2년전 중단) Aorta to rPL with RA) Glucose 121 Glycoalbumin23.6 Glucose (연속) - 식후 2시간 116 HbA1c 6.9 Cholesterol 115 Triglyceride 57 HDL-Cholesterol 51 LDL-Cholesterol (Friedewald) 52.6 Urine Albumin-to-Creatinine Ratio 36.11 >> repeat med 6mo f/u 주진단 확진 Diabetes mellitus type 2 with dyslipidemia 확진 Thyroid nodule 기타진단 기타진단 확진 Internal carotid artery stenosis 기록자명 강은석(의사) 전자서명자: 강은석 세브란스병원 SEVERANCE HOSPITAL 진단명 외래재진기록 2024-07-16 1/1 출력일: 2025-04-11 출력자: 김경미 원본대조필 등록번호: 8633158 주민등록번호: 550112-125**** 남/69세 환자명: 이광욱 외래재진기록 2024-10-01 진료과 신경과 주치의 남효석 Subjective Brain MRI and MRA 2024-09-12 Small old infarction in left side medulla. Stenosis in right carotid bulb and right distal VA. Steno-occlusion in left VA. Stenosis in left proximal ICA, left cavernous ICA. --> 비슷하십니다. 평소에 괜찮음. 운전하고 내릴 때 어찔함. <5초 - 2022-09-14 에 비해서 Rt distal VA stenosis 가 심해짐. one-way 라서 우려됨. LDL-Cholesterol (Friedewald) 52.6 Objective Assessment Plan plavix, 아모잘탄 Q (로수바 20 복합제) ▶아스피린 추가 Stroke 발생 Cerebral infarction Hemorrhage stroke Unknown stroke TIA Stroke 발생 날짜 Stroke Comment CAOD 발생 ? Acute MI ? Unstable angina PTCA/stent CABG Others CAOD 발생 날짜 CAOD 발생 Comment 전자서명자: 남효석 세브란스병원 SEVERANCE HOSPITAL 1/3 출력일: 2025-04-11 출력자: 김경미 원본대조필 등록번호: 8633158 주민등록번호: 550112-125****남/69세 환자명: 이광욱 외래재진기록 2024-10-01 121067Y|M 8633158 Study Date 2022-09-14 A1069Y|M 8633158 Study Date 2024-09-12 AR 전자서명자: 남효석 세브란스병원 SEVERANCE HOSPITAL B1050mm RF 2/3 출력일: 2025-04-11 출력자: 김경미 원본대조필 등록번호: 8633158 주민등록번호: 550112-125**** 남/69세 환자명: 이광욱 진단명 구분 확진 HP Bricktha Study Date 202409 12 LH 11069YM 8633158 Study Dale 2024-09-12 503 18m RA 주진단 확진 Internal carotid artery stenosis HP 기타진단 확진 기타진단 확진 Coronary artery disease (2 vessel disease) Unstable angina 기록자명 남효석(의사) 전자서명자: 남효석 세브란스병원 SEVERANCE HOSPITAL 진단명 외래재진기록 2024-10-01 3/3 출력일: 2025-04-11 출력자: 김경미 원본대조필 등록번호: 8633158 주민등록번호: 550112-125****남/70세 환자명: 이광욱 진료과 내분비내과 주치의 강은석 BP(S) 170mmHg BP(D) 50mmHg HR 103/min 경과 및 Plan CAD(2vd+ LM) s/p CAG (2018.04, 일산백) s/p 40PCAB(LIMA to dLAD, to OM(seq) to DG with RIMA composite Y, Aorta to rPL with RA) (2018-04-09) Rt. ICA stenosis s/p stent insertion (2018.10.02) PAD s/p PTA c DCB at Rt. SFA (2019.01.28) DM(11yrs) Ex-smoker (30yr, 2년전 중단) Aorta to rPL with RA) Glucose 132 20.1 Glycoalbumin Glucose (연속) - 식후 2시간 235 HbA1c 6.8 Total cholesterol 112 Triglyceride 70 HDL-Cholesterol 56 LDL-Cholesterol (Friedewald) 42 Urine Albumin-to-Creatinine Ratio 63.99 체중 이전과 비슷함 >> repeat med 6mo f/u 진단명 구분 확진 주진단 확진 기타진단 확진 기타진단 확진 Diabetes mellitus type 2 with dyslipidemia Diabetic polyneuropathy 진단명 Internal carotid artery stenosis 기록자명 강은석(의사) 전자서명자: 강은석 세브란스병원 SEVERANCE HOSPITAL 외래재진기록 2025-01-14 1/1 출력일: 2025-04-11 출력자: 김경미 원본대조필 등록번호: 8633158 주민등록번호: 550112-125****남/70세 환자명: 이광욱 진료과 심장내과 주치의 안철민 BP(S) 131 mmHg BP(D) 56mmHg HR 86/min Subjective Good/No interval change Objective Non-HDL Cholesterol 50 Assessment LDL-Cholesterol (Friedewald) 34.8 외래재진기록 일산21세기병원 약) Platless 75mg qd, Amosartan Q5/100/20mg qd, Sigmart 5mg bid, Herben 30mg bid ABI (Ankle / Brachial Index) - Rt: 0.80 /Lt: 0.72 <=-Rt: 0.90 /Lt: 0.84 <== Rt: 0.96 /Lt: 0.88 <==Rt: 0.84/Lt: 0.82 echo *CAD-2VD, S/P OPCAB(2018), DM, HTN *Compare with previous echo (2018.04.16) 1. No RWMA 2. Still enlarged LA(LAVI: 39ml/m2) with normal global LV systolic function (EF: 77%) 3. Relaxation abnormality of LV filling pattern with elevated LV filling pressure (E/e': 10->15) 4. Mild pulmonary hypertension (RVSP: 41mmHg) 5. Slightly dilated sinus of Valsalva (38mm) and ascending aorta (39mm) TMT 10.1 METS equivocal PAD, s/p PTA 2019.1.28 - IVUS-DCB - s/p PTA CDCB at Rt. SFA[2019-01-28] ABI 1.04/1.09 <== 0.69/0.99 CAD(2vd+ LM) s/pCAG(2018.04, 일산백) s/p 2018-04-09 4OPCAB(LIMA to dLAD, to OM(seq) to DG with RIMA composite Y, Aorta to rPL with RA) DM herben 일년 정도 사용 - 유경종 교수님 - radial graft HTN Plan 2yr EKG/CXR/LAB/full(비급여 설명드림) 진단명 구분 확진 진단명 주진단 확진 Unstable angina |기타진단 확진 Peripheral arterial occlusive disease (lower extremities) |기타진단 확진 Coronary artery disease (2 vessel disease) 전자서명자: 안철민 세브란스병원 SEVERANCE HOSPITAL 2025-03-26 1/2 출력일: 2025-04-11 출력자: 김경미 원본대조필 등록번호: 8633158 주민등록번호: 550112-125****남/70세 환자명 : 이광욱 외래재진기록 2025-03-26 기록자명 안철민(의사) 전자서명자: 안철민 세브란스병원 SEVERANCE HOSPITAL 2/2 출력일: 2025-04-11 출력자: 김경미 원본대조필 등록번호: 8633158 주민등록번호: 550112-125**** 남/70세 환자명: 이광욱 진료과 신경과 주치의 남효석 Subjective Objective Assessment Plan Rt distal VA stenosis 가 진행한 것 같습니다. 위험석이 커서 증상이 있으면 스텐트 고려하겠습니다. Stroke 발생 Cerebral infarction Hemorrhage stroke Unknown stroke TIA Stroke 발생 날짜 Stroke Comment CAOD 발생 Acute MI ? Unstable angina PTCA/stent CABG Others CAOD 발생 날짜 CAOD 발생 Comment 전자서명자: 남효석 세브란스병원 SEVERANCE HOSPITAL 8633158M070YCT Brain + Angio (Brain+Neck) (contrast 2025-03-19 13 08:17 AL 외래재진기록 2025-03-26 1/3 출력일: 2025-04-11 출력자: 김경미 원본대조필 | 등록번호: 8633158 주민등록번호: 550112-125****남/70세 환자명 : 이광욱 전자서명자: 남효석 세브란스병원 SEVERANCE HOSPITAL JOYCT Brain + Angio (Brain+Neck) (contrast)2025-03-19 13:08:17 HR M070YCT Brain + Angio (Brain+Neck) (contrast)2025-03-19 13:08 17 A 외래재진기록 2025-03-26 2/3 출력일: 2025-04-11 출력자: 김경미 원본대조필 등록번호: 8633158 주민등록번호: 550112-125****남/70세 환자명 : 이광욱 BOYCT Brain + Angio (Brain+Neck) (contrast)2025-03-19 13:08:17 A 진단명 구분 확진 진단명 주진단 확진 기타진단 확진 Unstable angina Internal carotid artery stenosis 기타진단 확진 Coronary artery disease (2 vessel disease) 기록자명 남효석(의사) 전자서명자: 남효석 세브란스병원 SEVERANCE HOSPITAL 외래재진기록 2025-03-26 3/3 출력일: 2025-04-11 출력자: 김경미 원본대조필 진료비 세부산정내역(외래) 환자등록번호 8633158 환자성명 이광욱 환자구분 건강 가입 (미확인)\n\n■ 진료 기록 (Medical Records)\nNaN\n[2025.03.24] 미확인 의료기관\n내원일: 2025.03.24\n내원사유: 정기 진료\n진단명: 미확인\n중증도: 경미\n\n[2003.12.08] 미확인 의료기관\n내원일: 2003.12.08\n내원사유: 정보 국적 직업/업종 주민번호 고객과의 관계 신분증사본 징구여부 연락처 [ 여/ 부 실명확인 (택일) 월 주민등록증(www.minwon.go.kr) ㄷ 외국인등록증(www.hikorea.go.kr) 발급기관/면허번호/ 발행국가 년 운전면허증(www.safedriving.or.kr) 「여권 [ 기타[ ] 발급일 일 모집인(면담자): 김선형 출금금융기관명 국민카드 출금계좌(카드)번호\n진단명: 미확인\n특이사항: [ ] 발급일 일 모집인(면담자): 김선형 출금금융기관명 국민카드 출금계좌(카드)번호\n중증도: 경미\n\n[2009.10.01] 유선신청, 우편신청 또는 인터넷 신청 등에 의하여도 가능합니다. 모집점 모집자 금촌농협 김선형 (\n내원일: 2009.10.01\n내원사유: 입금계좌 은행 예금주(계약자) : 계좌번호 1. 계약자는 보험증권을 받은 날 부터 15일이내에 청약을 철회할 수 있습니다. 다만, 전문금융소비자가 체결한 보험계약, 청약일부터 30일 초과, 회사가 건강상태 진단을 지원하는 계약, 보험기간(보장기 간)이 90일 이내인 계약, 법률에 따라 가입의무 부과 및 해제·해지가 가능한 보험(다만, 계약자가 동종의 다른 보험에 가입한 경우는 제외) 은 청약을 철회할 수 없습니다. 2. 저희 회사는 청약철회 청구서를 접수한 경우 지체없이 이미 납입한 보험료를 돌려드립니다. 3. 청약철회 청구서를 발송한 날 이후(발송일 포함)에 발생한 보험금 지급사유에 대해서는 회사가 책임을 지지 아니하며, 입금처의 거래은행 예금주는 계약자와 동일해야 합니다. ※콜센터 유선신청, 우편신청 또는 인터넷 신청 등에 의하여도 가능합니다. 모집점 모집자 금촌농협 김선형 (\n진단명: 을 지원하는 계약, 보험기간(보장기 간)이 90일 이내인 계약, 법률에 따라 가입의무 부과 및 해제·해지가 가능한 보험(다만, 계약자가 동종의 다른 보험에 가입한 경우는 제외) 은 청약을 철회할 수 없습니다. 2. 저희 회사는 청약철회 청구서를 접수한 경우 지체없이 이미 납입한 보험료를 돌려드립니다. 3. 청약철회 청구서를 발송한 날 이후(발송일 포함)에 발생한 보험금 지급사유에 대해서는 회사가 책임을 지지 아니하며, 입금처의 거래은행 예금주는 계약자와 동일해야 합니다. ※콜센터 유선신청, 우편신청 또는 인터넷 신청 등에 의하여도 가능합니다. 모집점 모집자 금촌농협 김선형 (\n중증도: 경미\n\n[미확인] 미확인 의료기관\n내원일: 미확인\n내원사유: 정기 진료\n진단명: 또는 치료 사실 등 중요한 내용을 (알릴의무) 구두 로만 알릴 경우 계약전 알릴 의무를 이행한 것으로 인정되지 않아 향후 계약이 해지 되거나 보험금을 (구두) (해지) 지급받지 못할 수 있습니다. ?보험계약자 이조훈 (은)는 보험모집자 김선형 (으)로부터 계약전 알릴의무 위반시의 효과(계약해지, 보장제한, 보험금 미지급 등)에 대해 설명을 들었으며, 계약전 알릴의무 사항에 대해 청약서에 사실대로 기재하였음을 확인합니다. 위의 각 계약 전 알릴 의무 사항에 대한 하며, 보험계약자 및 피보험자(보험대상자) 본인이 직접 답변 내용은 사실과 일치 (답변내용은 사실과 일치) 작성하였음을 확인합니다. 또한 회사가 위 사항과 관련하여 필요시에는 별도의 확인을 할 수 있으며 의사에게 본인의 질병 등의 건강 상태를 조회하거나 열람토록 하는것에 동의합니다. 자필서명 구분 보험계약자 피보험자 성명 이조훈 이광욱 서명 이조훈 법정대리인 1 (친권자) 관계 법정대리인 2(친권자) 관계 법정대리인(친권자) 1인이 서명한 경우 본인은 다른 법정대리인(친권자) 1인과 합의하에 공동으로 친권을 행사합니다. 이관욱 피보험자(보험대상자) 본인이 자필서명을 하지 않으신 경우에는 보험계약이 무효가 되어 보장을 받지 못할 수도 있습니다. 보험계약자 또는 피보험자(보험대상자)가 미성년자인 경우 법정대리인이 서명하여 주시기 바랍니다. LW\n중증도: 경미\n\n[2024.12.11] 미확인 의료기관\n내원일: 2024.12.11\n내원사유: 정기 진료\n진단명: 미확인\n중증도: 경미\n\n[2025.03.19] 미확인 의료기관\n내원일: 2025.03.19\n내원사유: 정기 진료\n진단명: 미확인\n중증도: 경미\n\n[미확인] 1644- 9000 ※추가서류제출: 스캔 또는 심사자 개인 팩스로 전송하시길 바랍니다. 0301 0001 0101 CL\n내원일: 미확인\n내원사유: 정기 진료\n진단명: 미확인\n중증도: 경미\n\n[미확인] 의무기록사본 총 1부 (표지제외) 빈경환 UNIVER 세브란스병원 SEVERANCE HOSPITAL 발행번호: 등록번호: 2025-41122 8633158 환자성명: 용도: 발급매수: 이광욱 보험회사제출 123 매 의무기록 사본 증명서 이 사본은 의무기록 원본과 틀림이 없음을 증명합니다. 이 사본은 위의 용도 외에는 사용할 수 없습니다. 의무기록 사본 증명서\n내원일: 미확인\n내원사유: 정기 진료\n진단명: 미확인\n중증도: 경미\n\n[2025.04.11] 병원 세브란스병원 SEVERANCE HOSPITAL 등록번호: 8633158 주민등록번호: 550112-125**** 남/63세 환자명: 이광욱 외래재진기록\n내원일: 2025.04.11\n내원사유: 정기 진료\n진단명: 미확인\n중증도: 경미\n\n[미확인] SEVERANCE HOSPITAL Conjunctiva not pale Lips & tongues not dried 2/5 출력일:\n내원일: 미확인\n내원사유: 정기 진료\n진단명: 미확인\n중증도: 경미\n\n[미확인] SEVERANCE HOSPITAL ICS: impulse conducting system(of the heart) LMCL left midclavicular line LNs lymph nodes LOM limitation of motion 4/5 출력일:\n내원일: 미확인\n내원사유: 정기 진료\n진단명: 미확인\n중증도: 경미\n\n[미확인] SEVERANCE HOSPITAL 기능검사결과(I/F형)\n내원일: 미확인\n내원사유: 정기 진료\n진단명: 미확인\n특이사항: 1. ABI (Ankle / Brachial Index) - Rt: 0.90 /Lt: 0.84 1-1. TBI (Toe / Brachial Index)- Rt: 0.39/Lt: 0.36 Impression Name Image 1 전자서명자: 모혜인 세브란스병원 SEVERANCE HOSPITAL 기능검사결과(I/F형)\n중증도: 경미\n\n[미확인] SEVERANCE HOSPITAL 원본대조필 등록번호: 8633158 주민등록번호: 550112-125**** 남/67세 환자명 : 이광욱 진료과 내분비내과 주치의 강은석 BP(S) 150mmHg BP(D) 58 mmHg HR 89/min 경과 및 Plan 진단명 구분 확진 CAD(2vd+ LM) s/p CAG (2018.04, 일산백) s/p 4OPCAB(LIMA to dLAD, to OM(seq) to DG with RIMA composite Y, Aorta to rPL with RA) (\n내원일: 미확인\n내원사유: 정기 진료\n진단명: 구분 확진 CAD(2vd+ LM) s/p CAG (2018.04, 일산백) s/p 4OPCAB(LIMA to dLAD, to OM(seq) to DG with RIMA composite Y, Aorta to rPL with RA) (\n중증도: 경미\n\n[미확인] 미확인 의료기관\n내원일: 미확인\n내원사유: 정기 진료\n진단명: 확진 Diabetes mellitus type 2 with dyslipidemia 기타진단 확진 Thyroid nodule 기타진단 확진 Internal carotid artery stenosis 기록자명 강은석 진단명 외래재진기록\n특이사항: 진단 확진 Thyroid nodule 기타진단 확진 Internal carotid artery stenosis 기록자명 강은석 진단명 외래재진기록\n중증도: 경미\n\n[미확인] SEVERANCE HOSPITAL 원본대조필 등록번호: 8633158 주민등록번호: 550112-125****남/67세 환자명: 이광욱 외래재진기록\n내원일: 미확인\n내원사유: 정기 진료\n진단명: 미확인\n중증도: 경미\n\n[미확인] 미확인 의료기관\n내원일: 미확인\n내원사유: 없음 PAD, S/P PTA\n진단명: 구분 확진 주진단 기타진단 기타진단 확진 확진 확진 BP(D) mmHg chest pain / discomfort (-/-) dyspnea / DOE (-/-) palpitation (-) functional capacity >4METS 잘지냈다. 증상없음 PAD, S/P PTA\n특이사항: 진단 기타진단 확진 확진 확진 BP(D) mmHg chest pain / discomfort (-/-) dyspnea / DOE (-/-) palpitation (-) functional capacity >4METS 잘지냈다. 증상없음 PAD, S/P PTA\n중증도: 경미\n\n[미확인] 1/1 출력일:\n내원일: 미확인\n내원사유: 정기 진료\n진단명: HR : Heart Rate BP(S) : Blood Pressure (Systolic) med Medication 전자서명자: 최기정 세브란스병원 1/1 출력일:\n중증도: 경미\n\n[미확인] SEVERANCE HOSPITAL 원본대조필 등록번호: 8633158 주민등록번호: 550112-125**** 남/67세 환자명: 이광욱 진단명 구분 확진 주진단 확진 |기타진단 확진 |기타진단 확진 Internal carotid artery stenosis Unstable angina Coronary artery disease (2 vessel disease) 진단명 기록자명 홍순호 외래재진기록\n내원일: 미확인\n내원사유: 정기 진료\n진단명: 구분 확진 주진단 확진 |기타진단 확진 |기타진단 확진 Internal carotid artery stenosis Unstable angina Coronary artery disease (2 vessel disease) 진단명 기록자명 홍순호 외래재진기록\n특이사항: 진단 확진 |기타진단 확진 Internal carotid artery stenosis Unstable angina Coronary artery disease (2 vessel disease) 진단명 기록자명 홍순호 외래재진기록\n중증도: 경미\n\n[미확인] SEVERANCE HOSPITAL 원본대조필 등록번호: 8633158 주민등록번호: 550112-125**** 남/69세 환자명: 이광욱 영상검사 CT& MR 영상검사 CT& MR 검사명 MRI Brain & Angio 3D(Neck포함) (contrast) 검사방법 검사일자 판독일자\n내원일: 미확인\n내원사유: 정기 진료\n진단명: 미확인\n중증도: 경미\n\n[미확인] SEVERANCE HOSPITAL 원본대조필 등록번호: 8633158 주민등록번호: 550112-125**** 남/68세 환자명: 이광욱 진료과 내분비내과 주치의 강은석 BP(S) 163mmHg BP(D) 70mmHg HR 91/min 경과 및 Plan CAD(2vd+ LM) s/p CAG (2018.04, 일산백) s/p 4OPCAB(LIMA to dLAD, to OM(seq) to DG with RIMA composite Y, Aorta to rPL with RA) (\n내원일: 미확인\n내원사유: 정기 진료\n진단명: 미확인\n중증도: 경미\n\n[미확인] 미확인 의료기관\n내원일: 미확인\n내원사유: 정기 진료\n진단명: 구분 확진 주진단 확진 기타진단 확진 기타진단 확진 Diabetes mellitus type 2 with dyslipidemia Thyroid nodule Internal carotid artery stenosis 기록자명 강은석 진단명 외래재진기록\n특이사항: 진단 확진 기타진단 확진 Diabetes mellitus type 2 with dyslipidemia Thyroid nodule Internal carotid artery stenosis 기록자명 강은석 진단명 외래재진기록\n중증도: 경미\n\n[미확인] SEVERANCE HOSPITAL 원본대조필 등록번호: 8633158 주민등록번호: 550112-125**** 남/68세 환자명: 이광욱 외래재진기록\n내원일: 미확인\n내원사유: 정기 진료\n진단명: 미확인\n중증도: 경미\n\n[미확인] SEVERANCE HOSPITAL 진단명 1/1 출력일:\n내원일: 미확인\n내원사유: 정기 진료\n진단명: 구분 확진 주진단 확진 Unstable angina |기타진단 확진 Coronary artery disease (left main) |기타진단 확진 Coronary artery disease (2 vessel disease) 기록자명 안철민 전자서명자: 안철민 세브란스병원 SEVERANCE HOSPITAL 진단명 1/1 출력일:\n특이사항: 진단 확진 Coronary artery disease (left main) |기타진단 확진 Coronary artery disease (2 vessel disease) 기록자명 안철민 전자서명자: 안철민 세브란스병원 SEVERANCE HOSPITAL 진단명 1/1 출력일:\n중증도: 경미\n\n[미확인] SEVERANCE HOSPITAL VIASONIX 0- -10- PVR 4s P=59 HR=73 Amp=0.938 RT=264 Sc=x4 G=6 L BI Knee PVR ни 45 P=57 HR=72 Amp=1.185 RT=238 Sc=x4 G=6 PVR ми P=55 HR=N/A Amp=N/A RT=N/A Sc=x4 G=6 L Metatarsal PVR 45 P=58 HR=N/A Amp=N/A RT=N/A Sc=x4 G=6 L Toe 1 ми 4s HR 73 Amp=20.4 RT=282 Sc=x4 G=4 Page 1 of 1 1/1 출력일:\n내원일: 미확인\n내원사유: 정기 진료\n진단명: 미확인\n중증도: 경미\n\n[미확인] 미확인 의료기관\n내원일: 미확인\n내원사유: 정기 진료\n진단명: 미확인\n처방: 상태를 확인 후 환자에게 현재 상태를 설명함. 치료계획 + Problem 부 E Acute myocardial infarction, ST elevation E PAOD 기록자명 권혜란 Goal PTA PTA 목표일 수정목표일 계획일\n중증도: 경미\n\n[미확인] SEVERANCE HOSPITAL\n내원일: 미확인\n내원사유: 정기 진료\n진단명: 미확인\n중증도: 경미\n\n[미확인] 미확인 의료기관\n내원일: 미확인\n내원사유: 정기 진료\n진단명: 미확인\n처방: 상태를 확인 후 환자에게 현재 상태를 설명함. Goal PTA 목표일 수정목표일 계획일\n중증도: 경미\n\n[미확인] SEVERANCE HOSPITAL PTA\n내원일: 미확인\n내원사유: 정기 진료\n진단명: 미확인\n중증도: 경미\n\n[미확인] SEVERANCE HOSPITAL 3/5 출력일:\n내원일: 미확인\n내원사유: 없음 있음 호흡기계 호흡양상 Regular ? Irregular Suppressed Labored 기타 호흡기 관련증상 없음 있음 전자서명자 : 김은경 세브란스병원 SEVERANCE HOSPITAL 3/5 출력일:\n진단명: 미확인\n특이사항: 배변 조절 조절에 문제 없음 배뇨 양상 배뇨 방법 ? spont voiding Foley catheter ? CIC Kissmo □ 기타 catheter 교환 예정일 배뇨 장애 무 ○ 유 배뇨 조절 조절에 문제 없음 기능평가 100 순환기계 맥박 규칙적임 Pacemaker 없음 부종 없음 있음 순환기 관련증상 없음 있음 호흡기계 호흡양상 Regular ? Irregular Suppressed Labored 기타 호흡기 관련증상 없음 있음 전자서명자 : 김은경 세브란스병원 SEVERANCE HOSPITAL 3/5 출력일:\n중증도: 경미\n\n[미확인] SEVERANCE HOSPITAL 원본대조필 등록번호: 8633158 주민등록번호: 550112-125****남/70세 환자명 : 이광욱 검사결과 Impression Image Name 전자서명자: 서동우 세브란스병원 SEVERANCE HOSPITAL 기능검사결과(I/F형) *CAD-2VD, S/POPCAB(2018), DM, HTN *Compare with previous echo (\n내원일: 미확인\n내원사유: 정기 진료\n진단명: 미확인\n특이사항: Impression Image Name 전자서명자: 서동우 세브란스병원 SEVERANCE HOSPITAL 기능검사결과(I/F형) *CAD-2VD, S/POPCAB(2018), DM, HTN *Compare with previous echo (\n중증도: 경미\n\n[미확인] SEVERANCE HOSPITAL Responsible Dr. : 심지영 2/2 출력일:\n내원일: 미확인\n내원사유: 정기 진료\n진단명: 미확인\n중증도: 경미\n\n[미확인] SEVERANCE HOSPITAL 진단명 외래재진기록\n내원일: 미확인\n내원사유: 정기 진료\n진단명: 구분 확진 주진단 기타진단 기타진단 Thyroid nodule 확진 Diabetes mellitus type 2 with dyslipidemia 확진 확진 Internal carotid artery stenosis 기록자명 강은석 전자서명자: 강은석 세브란스병원 SEVERANCE HOSPITAL 진단명 외래재진기록\n특이사항: 진단 기타진단 Thyroid nodule 확진 Diabetes mellitus type 2 with dyslipidemia 확진 확진 Internal carotid artery stenosis 기록자명 강은석 전자서명자: 강은석 세브란스병원 SEVERANCE HOSPITAL 진단명 외래재진기록\n중증도: 경미\n\n[미확인] 미확인 의료기관\n내원일: 미확인\n내원사유: 정기 진료\n진단명: 구분 확진 주진단 확진 Diabetes mellitus type 2 with dyslipidemia |기타진단 확진 Diabetic polyneuropathy |기타진단 확진 Internal carotid artery stenosis 진단명 기록자명 김다함 외래재진기록\n특이사항: 진단 확진 Diabetic polyneuropathy |기타진단 확진 Internal carotid artery stenosis 진단명 기록자명 김다함 외래재진기록; 없음. Imp: Multiple probably benign nodules in both thyroids (K-TIRADS: 3) R/O Diffuse thyroid disease recommend follow up. T3 0.47 Free T4 1.08 TSH 2.12 추가사항 Thyroid nodule Plan 2y f/u 진단명 구분 확진 주진단 확진 Diabetes mellitus type 2 with dyslipidemia |기타진단 확진 Diabetic polyneuropathy |기타진단 확진 Internal carotid artery stenosis 진단명 기록자명 김다함 외래재진기록\n중증도: 경미\n\n[미확인] SEVERANCE HOSPITAL 원본대조필 등록번호: 8633158 주민등록번호: 550112-125**** 남/69세 환자명: 이광욱 진료과 내분비내과 주치의 강은석 BP(S) 142 mmHg BP(D) 62 mmHg HR 77/min 경과 및 Plan CAD(2vd+ LM) s/p CAG (2018.04, 일산백) s/p 40PCAB(LIMA to dLAD, to OM(seq) to DG with RIMA composite Y, Aorta to rPL with RA) (\n내원일: 미확인\n내원사유: 정기 진료\n진단명: 미확인\n중증도: 경미\n\n[미확인] SEVERANCE HOSPITAL 진단명 외래재진기록\n내원일: 미확인\n내원사유: ? >> 식습관 꾸준히 관리해보시고, 식후 1시간 자가혈당 측정해보세요. repeat med 6mo f/u 진단명 구분 확진 주진단 확진 Diabetes mellitus type 2 with dyslipidemia |기타진단 확진 Diabetic polyneuropathy |기타진단 확진 Internal carotid artery stenosis 기록자명 강은석 전자서명자: 강은석 세브란스병원 SEVERANCE HOSPITAL 진단명 외래재진기록\n진단명: 구분 확진 주진단 확진 Diabetes mellitus type 2 with dyslipidemia |기타진단 확진 Diabetic polyneuropathy |기타진단 확진 Internal carotid artery stenosis 기록자명 강은석 전자서명자: 강은석 세브란스병원 SEVERANCE HOSPITAL 진단명 외래재진기록\n특이사항: 진단 확진 Diabetic polyneuropathy |기타진단 확진 Internal carotid artery stenosis 기록자명 강은석 전자서명자: 강은석 세브란스병원 SEVERANCE HOSPITAL 진단명 외래재진기록\n중증도: 경미\n\n[미확인] 미확인 의료기관\n내원일: 미확인\n내원사유: 정기 진료\n진단명: 구분 확진 CAD(2vd+ LM) s/p CAG (2018.04, 일산백) s/p 40PCAB(LIMA to dLAD, to OM(seq) to DG with RIMA composite Y, Aorta to rPL with RA) (\n중증도: 경미\n\n[미확인] SEVERANCE HOSPITAL 진단명 외래재진기록\n내원일: 미확인\n내원사유: 정기 진료\n진단명: 확진 Diabetes mellitus type 2 with dyslipidemia 확진 Thyroid nodule 기타진단 기타진단 확진 Internal carotid artery stenosis 기록자명 강은석(의사) 전자서명자: 강은석 세브란스병원 SEVERANCE HOSPITAL 진단명 외래재진기록\n특이사항: 진단 기타진단 확진 Internal carotid artery stenosis 기록자명 강은석(의사) 전자서명자: 강은석 세브란스병원 SEVERANCE HOSPITAL 진단명 외래재진기록\n중증도: 경미\n\n[미확인] SEVERANCE HOSPITAL 1/3 출력일:\n내원일: 미확인\n내원사유: 정기 진료\n진단명: 미확인\n중증도: 경미\n\n[미확인] SEVERANCE HOSPITAL B1050mm RF 2/3 출력일:\n내원일: 미확인\n내원사유: 정기 진료\n진단명: 미확인\n중증도: 경미\n\n[미확인] 미확인 의료기관\n내원일: 미확인\n내원사유: 정기 진료\n진단명: 구분 확진 HP Bricktha Study Date 202409 12 LH 11069YM 8633158 Study Dale\n중증도: 경미\n\n[미확인] SEVERANCE HOSPITAL 진단명 외래재진기록\n내원일: 미확인\n내원사유: 정기 진료\n진단명: 확진 Internal carotid artery stenosis HP 기타진단 확진 기타진단 확진 Coronary artery disease (2 vessel disease) Unstable angina 기록자명 남효석(의사) 전자서명자: 남효석 세브란스병원 SEVERANCE HOSPITAL 진단명 외래재진기록\n특이사항: 진단 확진 기타진단 확진 Coronary artery disease (2 vessel disease) Unstable angina 기록자명 남효석(의사) 전자서명자: 남효석 세브란스병원 SEVERANCE HOSPITAL 진단명 외래재진기록\n중증도: 경미\n\n[미확인] SEVERANCE HOSPITAL 외래재진기록\n내원일: 미확인\n내원사유: 정기 진료\n진단명: 구분 확진 주진단 확진 기타진단 확진 기타진단 확진 Diabetes mellitus type 2 with dyslipidemia Diabetic polyneuropathy 진단명 Internal carotid artery stenosis 기록자명 강은석(의사) 전자서명자: 강은석 세브란스병원 SEVERANCE HOSPITAL 외래재진기록\n특이사항: 진단 확진 기타진단 확진 Diabetes mellitus type 2 with dyslipidemia Diabetic polyneuropathy 진단명 Internal carotid artery stenosis 기록자명 강은석(의사) 전자서명자: 강은석 세브란스병원 SEVERANCE HOSPITAL 외래재진기록\n중증도: 경미\n\n[미확인] 약) Platless 75mg qd, Amosartan Q5/100/20mg qd, Sigmart 5mg bid, Herben 30mg bid ABI (Ankle / Brachial Index) - Rt: 0.80 /Lt: 0.72 <=-Rt: 0.90 /Lt: 0.84 <== Rt: 0.96 /Lt: 0.88 <==Rt: 0.84/Lt: 0.82 echo *CAD-2VD, S/P OPCAB(2018), DM, HTN *Compare with previous echo (\n내원일: 미확인\n내원사유: 정기 진료\n진단명: 미확인\n중증도: 경미\n\n[미확인] SEVERANCE HOSPITAL\n내원일: 미확인\n내원사유: 정기 진료\n진단명: 구분 확진 진단명 주진단 확진 Unstable angina |기타진단 확진 Peripheral arterial occlusive disease (lower extremities) |기타진단 확진 Coronary artery disease (2 vessel disease) 전자서명자: 안철민 세브란스병원 SEVERANCE HOSPITAL\n특이사항: 진단 확진 Peripheral arterial occlusive disease (lower extremities) |기타진단 확진 Coronary artery disease (2 vessel disease) 전자서명자: 안철민 세브란스병원 SEVERANCE HOSPITAL\n중증도: 경미\n\n[미확인] SEVERANCE HOSPITAL 2/2 출력일:\n내원일: 미확인\n내원사유: 정기 진료\n진단명: 미확인\n중증도: 경미\n\n[미확인] SEVERANCE HOSPITAL 8633158M070YCT Brain + Angio (Brain+Neck) (contrast\n내원일: 미확인\n내원사유: 이 있으면 스텐트 고려하겠습니다. Stroke 발생 Cerebral infarction Hemorrhage stroke Unknown stroke TIA Stroke 발생 날짜 Stroke Comment CAOD 발생 Acute MI ? Unstable angina PTCA/stent CABG Others CAOD 발생 날짜 CAOD 발생 Comment 전자서명자: 남효석 세브란스병원 SEVERANCE HOSPITAL 8633158M070YCT Brain + Angio (Brain+Neck) (contrast\n진단명: 미확인\n중증도: 경미\n\n[미확인] SEVERANCE HOSPITAL JOYCT Brain + Angio (Brain+Neck) (contrast)\n내원일: 미확인\n내원사유: 정기 진료\n진단명: 미확인\n중증도: 경미\n\n[미확인] SEVERANCE HOSPITAL 외래재진기록\n내원일: 미확인\n내원사유: 정기 진료\n진단명: 구분 확진 진단명 주진단 확진 기타진단 확진 Unstable angina Internal carotid artery stenosis 기타진단 확진 Coronary artery disease (2 vessel disease) 기록자명 남효석(의사) 전자서명자: 남효석 세브란스병원 SEVERANCE HOSPITAL 외래재진기록\n특이사항: 진단 확진 Unstable angina Internal carotid artery stenosis 기타진단 확진 Coronary artery disease (2 vessel disease) 기록자명 남효석(의사) 전자서명자: 남효석 세브란스병원 SEVERANCE HOSPITAL 외래재진기록\n중증도: 경미\n\n[2025.01.08] 미확인 의료기관\n내원일: 2025.01.08\n내원사유: 정기 진료\n진단명: 미확인\n중증도: 경미\n\n[2025.01.08] 미확인 의료기관\n내원일: 2025.01.08\n내원사유: 정기 진료\n진단명: 미확인\n중증도: 경미\n\n[2025.01.08] 미확인 의료기관\n내원일: 2025.01.08\n내원사유: 정기 진료\n진단명: 미확인\n중증도: 경미\n\n[2025.01.08] 미확인 의료기관\n내원일: 2025.01.08\n내원사유: 정기 진료\n진단명: 미확인\n중증도: 경미\n\n[2025.01.08] 미확인 의료기관\n내원일: 2025.01.08\n내원사유: 정기 진료\n진단명: 미확인\n중증도: 경미\n\n[2025.01.08] 미확인 의료기관\n내원일: 2025.01.08\n내원사유: 정기 진료\n진단명: 미확인\n중증도: 경미\n\n[2025.01.08] 미확인 의료기관\n내원일: 2025.01.08\n내원사유: 정기 진료\n진단명: 미확인\n중증도: 경미\n\n[2025.01.08] 미확인 의료기관\n내원일: 2025.01.08\n내원사유: 정기 진료\n진단명: 미확인\n중증도: 경미\n\n[2025.01.08] 미확인 의료기관\n내원일: 2025.01.08\n내원사유: 정기 진료\n진단명: 미확인\n중증도: 경미\n\n[2025.01.08] 미확인 의료기관\n내원일: 2025.01.08\n내원사유: 정기 진료\n진단명: 미확인\n중증도: 경미\n\n[2025.01.08] 미확인 의료기관\n내원일: 2025.01.08\n내원사유: 정기 진료\n진단명: 미확인\n중증도: 경미\n\n[2025.01.08] 미확인 의료기관\n내원일: 2025.01.08\n내원사유: 정기 진료\n진단명: 미확인\n중증도: 경미\n\n[2025.01.08] 미확인 의료기관\n내원일: 2025.01.08\n내원사유: 정기 진료\n진단명: 미확인\n중증도: 경미\n\n[2025.01.08] 미확인 의료기관\n내원일: 2025.01.08\n내원사유: 정기 진료\n진단명: 미확인\n중증도: 경미\n\n[2025.01.08] 미확인 의료기관\n내원일: 2025.01.08\n내원사유: 정기 진료\n진단명: 미확인\n중증도: 경미\n\n[2025.01.08] 미확인 의료기관\n내원일: 2025.01.08\n내원사유: 정기 진료\n진단명: 미확인\n중증도: 경미\n\n[2025.01.08] 미확인 의료기관\n내원일: 2025.01.08\n내원사유: 정기 진료\n진단명: 미확인\n중증도: 경미\n\n[2025.01.08] 미확인 의료기관\n내원일: 2025.01.08\n내원사유: 정기 진료\n진단명: 미확인\n중증도: 경미\n\n[2025.01.08] 미확인 의료기관\n내원일: 2025.01.08\n내원사유: 정기 진료\n진단명: 미확인\n중증도: 경미\n\n[2025.01.08] 미확인 의료기관\n내원일: 2025.01.08\n내원사유: 정기 진료\n진단명: 미확인\n중증도: 경미\n\n[2025.01.08] 미확인 의료기관\n내원일: 2025.01.08\n내원사유: 정기 진료\n진단명: 미확인\n중증도: 경미\n\n[2025.01.08] 미확인 의료기관\n내원일: 2025.01.08\n내원사유: 정기 진료\n진단명: 미확인\n중증도: 경미\n\n[2025.01.08] 미확인 의료기관\n내원일: 2025.01.08\n내원사유: 정기 진료\n진단명: 미확인\n중증도: 경미\n\n[2025.01.08] 미확인 의료기관\n내원일: 2025.01.08\n내원사유: 정기 진료\n진단명: 미확인\n중증도: 경미\n\n[2025.01.08] 미확인 의료기관\n내원일: 2025.01.08\n내원사유: 정기 진료\n진단명: 미확인\n중증도: 경미\n\n[2025.01.08] 미확인 의료기관\n내원일: 2025.01.08\n내원사유: 정기 진료\n진단명: 미확인\n중증도: 경미\n\n[2025.01.08] 미확인 의료기관\n내원일: 2025.01.08\n내원사유: 정기 진료\n진단명: 미확인\n중증도: 경미\n\n[2025.01.08] 미확인 의료기관\n내원일: 2025.01.08\n내원사유: 정기 진료\n진단명: 미확인\n중증도: 경미\n\n[2025.01.08] 미확인 의료기관\n내원일: 2025.01.08\n내원사유: 정기 진료\n진단명: 미확인\n중증도: 경미\n\n[2025.01.08] 미확인 의료기관\n내원일: 2025.01.08\n내원사유: 정기 진료\n진단명: 미확인\n중증도: 경미\n\n[2025.01.08] 미확인 의료기관\n내원일: 2025.01.08\n내원사유: 정기 진료\n진단명: 미확인\n중증도: 경미\n\n[2025.01.08] 미확인 의료기관\n내원일: 2025.01.08\n내원사유: 정기 진료\n진단명: 미확인\n중증도: 경미\n\n[2025.01.08] 미확인 의료기관\n내원일: 2025.01.08\n내원사유: 정기 진료\n진단명: 미확인\n중증도: 경미\n\n[2025.01.08] 미확인 의료기관\n내원일: 2025.01.08\n내원사유: 정기 진료\n진단명: 미확인\n중증도: 경미\n\n[2025.01.08] 미확인 의료기관\n내원일: 2025.01.08\n내원사유: 정기 진료\n진단명: 미확인\n특이사항: )의 요청에 따라 진료비 계산서·영수증 세부산정내역을 발급합니다.\n중증도: 경미\n\n[2025.04.11] 미확인 의료기관\n내원일: 2025.04.11\n내원사유: 정기 진료\n진단명: 미확인\n중증도: 경미\n\n[미확인] 미확인 의료기관\n내원일: 미확인\n내원사유: 정기 진료\n진단명: 미확인\n처방: ·조제 행위료\n중증도: 경미\n\n[2025.01.14] 미확인 의료기관\n내원일: 2025.01.14\n내원사유: 정기 진료\n진단명: 미확인\n중증도: 경미\n\n[2025.01.14] 미확인 의료기관\n내원일: 2025.01.14\n내원사유: 정기 진료\n진단명: 미확인\n중증도: 경미\n\n[2025.01.14] 미확인 의료기관\n내원일: 2025.01.14\n내원사유: 정기 진료\n진단명: 미확인\n중증도: 경미\n\n[2025.01.14] 미확인 의료기관\n내원일: 2025.01.14\n내원사유: 정기 진료\n진단명: 미확인\n특이사항: )의 요청에 따라 진료비 계산서·영수증 세부산정내역을 발급합니다.\n중증도: 경미\n\n[2025.03.19] 미확인 의료기관\n내원일: 2025.03.19\n내원사유: 정기 진료\n진단명: 미확인\n중증도: 경미\n\n[2025.03.19] 미확인 의료기관\n내원일: 2025.03.19\n내원사유: 정기 진료\n진단명: 미확인\n중증도: 경미\n\n[2025.03.19] 미확인 의료기관\n내원일: 2025.03.19\n내원사유: 정기 진료\n진단명: 미확인\n중증도: 경미\n\n[2025.03.19] 미확인 의료기관\n내원일: 2025.03.19\n내원사유: 정기 진료\n진단명: 미확인\n중증도: 경미\n\n[2025.03.19] 미확인 의료기관\n내원일: 2025.03.19\n내원사유: 정기 진료\n진단명: 미확인\n중증도: 경미\n\n[2025.03.19] 미확인 의료기관\n내원일: 2025.03.19\n내원사유: 정기 진료\n진단명: 미확인\n중증도: 경미\n\n[2025.03.19] 미확인 의료기관\n내원일: 2025.03.19\n내원사유: 정기 진료\n진단명: 미확인\n중증도: 경미\n\n[2025.03.19] 미확인 의료기관\n내원일: 2025.03.19\n내원사유: 정기 진료\n진단명: 미확인\n중증도: 경미\n\n[2025.03.19] 미확인 의료기관\n내원일: 2025.03.19\n내원사유: 정기 진료\n진단명: 미확인\n중증도: 경미\n\n[2025.03.19] 미확인 의료기관\n내원일: 2025.03.19\n내원사유: 정기 진료\n진단명: 미확인\n중증도: 경미\n\n[2025.03.19] 미확인 의료기관\n내원일: 2025.03.19\n내원사유: 정기 진료\n진단명: 미확인\n중증도: 경미\n\n[2025.03.19] 미확인 의료기관\n내원일: 2025.03.19\n내원사유: 정기 진료\n진단명: 미확인\n중증도: 경미\n\n[2025.03.19] 미확인 의료기관\n내원일: 2025.03.19\n내원사유: 정기 진료\n진단명: 미확인\n중증도: 경미\n\n[2025.03.19] 미확인 의료기관\n내원일: 2025.03.19\n내원사유: 정기 진료\n진단명: 미확인\n중증도: 경미\n\n[2025.03.19] 미확인 의료기관\n내원일: 2025.03.19\n내원사유: 정기 진료\n진단명: 미확인\n중증도: 경미\n\n[2025.03.19] 미확인 의료기관\n내원일: 2025.03.19\n내원사유: 정기 진료\n진단명: 미확인\n중증도: 경미\n\n[2025.03.19] 미확인 의료기관\n내원일: 2025.03.19\n내원사유: 정기 진료\n진단명: 미확인\n중증도: 경미\n\n[2025.03.19] 미확인 의료기관\n내원일: 2025.03.19\n내원사유: 정기 진료\n진단명: 미확인\n중증도: 경미\n\n[2025.03.19] 미확인 의료기관\n내원일: 2025.03.19\n내원사유: 정기 진료\n진단명: 미확인\n중증도: 경미\n\n[2025.03.19] 미확인 의료기관\n내원일: 2025.03.19\n내원사유: 정기 진료\n진단명: 미확인\n중증도: 경미\n\n[2025.03.19] 미확인 의료기관\n내원일: 2025.03.19\n내원사유: 정기 진료\n진단명: 미확인\n중증도: 경미\n\n[2025.03.19] 미확인 의료기관\n내원일: 2025.03.19\n내원사유: 정기 진료\n진단명: 미확인\n중증도: 경미\n\n[2025.03.19] 미확인 의료기관\n내원일: 2025.03.19\n내원사유: 정기 진료\n진단명: 미확인\n중증도: 경미\n\n[2025.03.19] 미확인 의료기관\n내원일: 2025.03.19\n내원사유: 정기 진료\n진단명: 미확인\n중증도: 경미\n\n[2025.03.19] 미확인 의료기관\n내원일: 2025.03.19\n내원사유: 정기 진료\n진단명: 미확인\n중증도: 경미\n\n[2025.03.19] 미확인 의료기관\n내원일: 2025.03.19\n내원사유: 정기 진료\n진단명: 미확인\n중증도: 경미\n\n[2025.03.19] 미확인 의료기관\n내원일: 2025.03.19\n내원사유: 정기 진료\n진단명: 미확인\n중증도: 경미\n\n[2025.03.19] 미확인 의료기관\n내원일: 2025.03.19\n내원사유: 정기 진료\n진단명: 미확인\n중증도: 경미\n\n[2025.03.19] 미확인 의료기관\n내원일: 2025.03.19\n내원사유: 정기 진료\n진단명: 료\n중증도: 경미\n\n[2025.03.19] 미확인 의료기관\n내원일: 2025.03.19\n내원사유: 정기 진료\n진단명: 료\n중증도: 경미\n\n[2025.03.19] 미확인 의료기관\n내원일: 2025.03.19\n내원사유: 정기 진료\n진단명: 료\n중증도: 경미\n\n[2025.03.19] 미확인 의료기관\n내원일: 2025.03.19\n내원사유: 정기 진료\n진단명: 료\n중증도: 경미\n\n[2025.03.19] 미확인 의료기관\n내원일: 2025.03.19\n내원사유: 정기 진료\n진단명: 미확인\n특이사항: )의 요청에 따라 진료비 계산서·영수증 세부산정내역을 발급합니다.\n중증도: 경미\n\n[2025.03.19] 미확인 의료기관\n내원일: 2025.03.19\n내원사유: 정기 진료\n진단명: 료 CT진단료\n중증도: 경미\n\n[2025.03.19] 미확인 의료기관\n내원일: 2025.03.19\n내원사유: 정기 진료\n진단명: 료\n중증도: 경미\n\n[2025.03.19] 미확인 의료기관\n내원일: 2025.03.19\n내원사유: 정기 진료\n진단명: 미확인\n중증도: 경미\n\n[2025.03.19] 미확인 의료기관\n내원일: 2025.03.19\n내원사유: 정기 진료\n진단명: 미확인\n특이사항: )의 요청에 따라 진료비 계산서·영수증 세부산정내역을 발급합니다.\n중증도: 경미\n\n[2025.03.26] 미확인 의료기관\n내원일: 2025.03.26\n내원사유: 정기 진료\n진단명: 미확인\n중증도: 경미\n\n[2025.03.26] 미확인 의료기관\n내원일: 2025.03.26\n내원사유: 정기 진료\n진단명: 미확인\n중증도: 경미\n\n[2025.03.26] 미확인 의료기관\n내원일: 2025.03.26\n내원사유: 정기 진료\n진단명: 미확인\n중증도: 경미\n\n[2025.03.26] 미확인 의료기관\n내원일: 2025.03.26\n내원사유: 정기 진료\n진단명: 미확인\n특이사항: )의 요청에 따라 진료비 계산서·영수증 세부산정내역을 발급합니다.\n중증도: 경미\n\n[2025.03.26] 미확인 의료기관\n내원일: 2025.03.26\n내원사유: 정기 진료\n진단명: 미확인\n중증도: 경미\n\n[2025.03.26] 미확인 의료기관\n내원일: 2025.03.26\n내원사유: 정기 진료\n진단명: 미확인\n중증도: 경미\n\n[2025.03.26] 미확인 의료기관\n내원일: 2025.03.26\n내원사유: 정기 진료\n진단명: 미확인\n중증도: 경미\n\n[2025.03.26] 미확인 의료기관\n내원일: 2025.03.26\n내원사유: 정기 진료\n진단명: 미확인\n중증도: 경미\n\n[2025.03.26] 미확인 의료기관\n내원일: 2025.03.26\n내원사유: 정기 진료\n진단명: 미확인\n특이사항: )의 요청에 따라 진료비 계산서·영수증 세부산정내역을 발급합니다.\n중증도: 경미\n\n[2025.04.11] 미확인 의료기관\n내원일: 2025.04.11\n내원사유: 정기 진료\n진단명: 미확인\n중증도: 경미\n\n[2025.04.11] 미확인 의료기관\n내원일: 2025.04.11\n내원사유: 정기 진료\n진단명: 미확인\n특이사항: 내분비내과 진료기간\n중증도: 경미\n\n[2025.04.11] 미확인 의료기관\n내원일: 2025.04.11\n내원사유: 정기 진료\n진단명: 미확인\n특이사항: 진료과 신경과 진료기간\n중증도: 경미\n\n[2025.04.11] 미확인 의료기관\n내원일: 2025.04.11\n내원사유: 정기 진료\n진단명: 미확인\n특이사항: 진료과 심장내과 진료기간\n중증도: 경미\n\n[2025.04.11] 진료기간\n내원일: 2025.04.11\n내원사유: 정기 진료\n진단명: 미확인\n특이사항: 세브)서류영상발급센터 진료기간\n중증도: 경미\n\n[2025.04.11] 미확인 의료기관\n내원일: 2025.04.11\n내원사유: 정기 진료\n진단명: 미확인\n중증도: 경미\n\n[2025.04.11] 미확인 의료기관\n내원일: 2025.04.11\n내원사유: 정기 진료\n진단명: 미확인\n특이사항: )의 요청에 따라 진료비 계산서·영수증 세부산정내역을 발급합니다.\n중증도: 경미\n\n[2025.04.11] SEVERANCE HOSPITAL Hybrid peripheral angiography (Lower extremity)\n내원일: 2025.04.11\n내원사유: 정기 진료\n진단명: 미확인\n중증도: 경미\n\n[미확인] SEVERANCE HOSPITAL 원본대조필 등록번호: 8633158 주민등록번호: 550112-125**** 남/64세 환자명: 이광욱 판독의(1차) 최정호 판독의(2차) 안철민 전자서명자: 한혜수 세브란스병원 SEVERANCE HOSPITAL 기능검사결과(I/F형) 2/2 출력일:\n내원일: 미확인\n내원사유: 정기 진료\n진단명: 미확인\n특이사항: (I/F형) 2/2 출력일:\n중증도: 경미\n\n[미확인] SEVERANCE HOSPITAL 기능검사결과(I/F형)\n내원일: 미확인\n내원사유: 정기 진료\n진단명: 미확인\n특이사항: Impression Skin Perfusion Pressure Test 1. Rt: 65mmHg/ Lt: 76mmHg <발등> 2. Rt: 77mmHg/Lt: 77mmHg <발바닥> (Normal value: 50 이상) n Name 107161 Image1 전자서명자: 한혜수 세브란스병원 SEVERANCE HOSPITAL 기능검사결과(I/F형)\n중증도: 경미\n\n[미확인] SEVERANCE HOSPITAL 원본대조필 등록번호: 8633158 주민등록번호: 550112-125****남/64세 환자명 : 이광욱 Cath No. Date\n내원일: 미확인\n내원사유: 정기 진료\n진단명: 미확인\n중증도: 경미\n\n[미확인] SEVERANCE HOSPITAL 원본대조필 등록번호: 8633158 주민등록번호: 550112-125**** 남/64세 환자명 : 이광욱 외래재진기록\n내원일: 미확인\n내원사유: 정기 진료\n진단명: 미확인\n중증도: 경미\n\n[미확인] SEVERANCE HOSPITAL 1/1 출력일:\n내원일: 미확인\n내원사유: 정기 진료\n진단명: 미확인\n중증도: 경미\n\n[미확인] SEVERANCE HOSPITAL 133572P1104102 AATI 966-691-MCU308 1/2 출력일:\n내원일: 미확인\n내원사유: 정기 진료\n진단명: 미확인\n중증도: 경미\n\n[미확인] SEVERANCE HOSPITAL Comments/Revising point for measurement 2/2 출력일:\n내원일: 미확인\n내원사유: 정기 진료\n진단명: 미확인\n중증도: 경미\n\n[미확인] SEVERANCE HOSPITAL 외래재진기록\n내원일: 미확인\n내원사유: 정기 진료\n진단명: 미확인\n중증도: 경미\n\n[미확인] SEVERANCE HOSPITAL 원본대조필 등록번호: 8633158 주민등록번호: 550112-125**** 남/64세 환자명: 이광욱 외래재진기록\n내원일: 미확인\n내원사유: 정기 진료\n진단명: 미확인\n중증도: 경미\n\n[미확인] SEVERANCE HOSPITAL 1/1 출력일:\n내원일: 미확인\n내원사유: 정기 진료\n진단명: 미확인\n중증도: 경미\n\n[미확인] SEVERANCE HOSPITAL 원본대조필 등록번호: 8633158 주민등록번호: 550112-125**** 남/64세 환자명: 이광욱 판독의(1차) 이용준 판독의(2차) 안철민 전자서명자: 한혜수 세브란스병원 SEVERANCE HOSPITAL 기능검사결과(I/F형) 2/2 출력일:\n내원일: 미확인\n내원사유: 정기 진료\n진단명: 미확인\n특이사항: (I/F형) 2/2 출력일:\n중증도: 경미\n\n[미확인] SEVERANCE HOSPITAL 1/1 출력일:\n내원일: 미확인\n내원사유: 정기 진료\n진단명: 미확인\n중증도: 경미\n\n[미확인] 1/6 출력일:\n내원일: 미확인\n내원사유: 정기 진료\n진단명: 미확인\n중증도: 경미\n\n[미확인] SEVERANCE HOSPITAL 2/6 출력일:\n내원일: 미확인\n내원사유: 정기 진료\n진단명: 미확인\n중증도: 경미\n\n[미확인] SEVERANCE HOSPITAL 3/6 출력일:\n내원일: 미확인\n내원사유: 정기 진료\n진단명: 미확인\n중증도: 경미\n\n[미확인] SEVERANCE HOSPITAL ICS: impulse conducting system(of the heart) LMCL left midclavicular line LNs lymph nodes LOM limitation of motion NSVD normal spontaneous vaginal delivery PAOD peripheral arterial occlusive disease PMI point of maximum impulse 5/6 출력일:\n내원일: 미확인\n내원사유: 정기 진료\n진단명: 미확인\n중증도: 경미\n\n[미확인] SEVERANCE HOSPITAL 1/2 출력일:\n내원일: 미확인\n내원사유: 정기 진료\n진단명: 미확인\n중증도: 경미\n\n[미확인] 2/2 출력일:\n내원일: 미확인\n내원사유: 정기 진료\n진단명: 미확인\n중증도: 경미\n\n[미확인] SEVERANCE HOSPITAL 2/4 출력일:\n내원일: 미확인\n내원사유: 정기 진료\n진단명: 미확인\n특이사항: 체중변화 kg ㆍ염분 제한 수분 제한 단백질 제한 ○ 지방 제한 식습관 식사횟수 3회/일 편식 습관 무 선호 음식 기피 음식 수면 상태 수면시간 6 수면을 돕는법 수면장애 없음 전자서명자 : 함경희 세브란스병원 SEVERANCE HOSPITAL 2/4 출력일:\n중증도: 경미\n\n[미확인] SEVERANCE HOSPITAL 원본대조필 등록번호: 8633158 주민등록번호: 550112-125****남/64세 환자명 : 이광욱 간호정보조사\n내원일: 미확인\n내원사유: 정기 진료\n진단명: 미확인\n중증도: 경미\n\n[미확인] SEVERANCE HOSPITAL 1/1 출력일:\n내원일: 미확인\n내원사유: 정기 진료\n진단명: 미확인\n중증도: 경미\n\n[미확인] 28 /30 점 1/2 출력일:\n내원일: 미확인\n내원사유: 정기 진료\n진단명: 미확인\n중증도: 경미\n\n[미확인] SEVERANCE HOSPITAL 출력자: 김경미 원본대조필 등록번호: 8633158 주민등록번호: 550112-125**** 남/64세 환자명: 이광욱 / 오른손잡이 2. 대졸 3. 돈 계산. 4.읽기? 쓰기 ㅇ 5. 공무원 간이 정신상태 검사 (Korean version of Mini-Mental State Exam, K-MMSE) 등록번호: 8633158 환자성명: 이광욱 성별/나이: M,64세 항 목 점수 항 목 점수 2019 0 0 비행기 주전자 기억회상 0 연필 0 3점 일 4 0 8.9] 수 0 ① 소나무 이름대기 X 0 1 시게 0 지남력 가운 04 볼펜 0 ст 대한민국 0 ① 언어 명령시행 종이를 뒤집고 0 ① 도 서울 0 및 반으로 접은 다음 0 무엇 하는 곳 병원 0 시공간 저에게 주세요. I 현재장소명 세브란스 0 구성 따라 말하기 “백문이 불여일견\" 0 몇중 14층 0 4 9점 오각형 0 비행기 주전자 0 읽 기억 양말 0 기 Mi 기 \"눈을 감으세요\" 0 L 0 소나무 명시 0 100 -7 93 0 총점: 28 130 주의집중 -7 86 0 0 및 계산 -7 79 0 5점 -7 72 0 -7 65 0 8 학력: 무학/초졸/중졸/고졸/맨솔 5 오각형 그리기 ▷ 읽기 D 눈을 감으세요 ▶ 쓰기 (오늘 기분이나 날씨에 대해 한 문장으로 써보세요) 세브란스병원 비온후검 Scan 작성자 : 박우현 1/1 출력일:\n내원일: 미확인\n내원사유: 정기 진료\n진단명: 미확인\n중증도: 경미\n\n[미확인] 원본대조필 SEVERANCE HOSPITAL 등록번호: 8633158 주민등록번호: 550112-125**** 남/64세 환자명 : 이광욱 외래재진기록\n내원일: 미확인\n내원사유: 정기 진료\n진단명: 미확인\n중증도: 경미\n\n[미확인] SEVERANCE HOSPITAL 1/1 출력일:\n내원일: 미확인\n내원사유: 정기 진료\n진단명: 미확인\n중증도: 경미\n\n[미확인] SEVERANCE HOSPITAL 원본대조필 등록번호: 8633158 주민등록번호: 550112-125****남/65세 환자명: 이광욱 시행일자\n내원일: 미확인\n내원사유: 정기 진료\n진단명: 미확인\n중증도: 경미\n\n[미확인] SEVERANCE HOSPITAL 백민렬 1/2 출력일:\n내원일: 미확인\n내원사유: 정기 진료\n진단명: 미확인\n중증도: 경미\n\n[미확인] SEVERANCE HOSPITAL 2/2 출력일:\n내원일: 미확인\n내원사유: 정기 진료\n진단명: 미확인\n중증도: 경미\n\n[미확인] SEVERANCE HOSPITAL TCD report 1/2 출력일:\n내원일: 미확인\n내원사유: 정기 진료\n진단명: 미확인\n특이사항: Normal Abnormal Undetermined TCD study The temporal window temporal window was good poor site bilateral side right side The Ophthalmic flow ophthalmic flow was The ACA flow normal direction reversed direction site left side bilateral side left side Oright side ACA flow was normal direction site bilateral side I reversed direction left side right side Findings Increased MV on Lt Siph (84cm/s) and BA (77cm/s). Conclusion)) 1. The previous DSA study showed occlusion of Lt VA. 2. This hemodynamic study showed increased MV on Lt Siph and BA, which may suggest stenosis or increased blood flow. 3. We recommend the follow up TCD study to check up the interval change of vessel status. Findings Right Findings Left MV Pl MV PI Rt. MCA pro 61 1.21 Lt MCA pro 71 1.17 Rt. MCA dis 60 1.13 Lt. MCA dis 70 1.15 -52 1.19 Rt. ACA Lt. ACA -44 1.41 Rt. PCA -21 1.17 Lt. PCA -27 1.15 Rt. Opth 20 1.06 Lt. Opth 25 1.48 Rt. Siph1 48 1.26 Lt. Siph1 -84 1.06 Rt.VA -33 1.31 Lt VA BA pro ?? -67 1.12 BA dis -77 1.17 전자서명자: 백민렬 세브란스병원 SEVERANCE HOSPITAL TCD report 1/2 출력일:\n중증도: 경미\n\n[미확인] SEVERANCE HOSPITAL 출력자: 김경미 원본대조필 등록번호: 8633158 주민등록번호: 550112-125****남/65세 환자명 : 이광욱 Hame LEE KWANG OOK TCD ID 8633158 ①LACA ⓡ LMCA LPCA BA LPCoA ⓡ LICA LOA Depth 50 Proce 1.6 ROA 50 Maan → RACA ①RMCA RPCA ⓡ ACOA RPCoA RICA Depth Prope 50 1.6 25 Pl 1.48 Pask 34 Mean r 20 FI 1.06 LSIPHON T Depth 74 Proce 1.6 RSIPHON Depth 78 Prope 1.6 Pask 135 Mean 76 PI 1.18 Peak 89 Mean 48 Pl 1.26 LSIPHON 130 on Depth 74 Proce 1.6 Posk -143 Meani -84 FI LMCA Depth 48 1.06 Probe 1.6 RSIPHON 130 0 RMCA 170 Paak 83 Mean 45 Fl 1.28 Peak 전자서명자: 백민렬 세브란스병원 SEVERANCE HOSPITAL Depth 78 Prope 1.6 -80 Mean -35 FI 1.96 Depth 44 Probe 1.6 70 70 Mea 38 1.31 TCD report 2/6 1/6 출력일:\n내원일: 미확인\n내원사유: 정기 진료\n진단명: 미확인\n중증도: 경미\n\n[미확인] SEVERANCE HOSPITAL TCD report 3/6 2/6 출력일:\n내원일: 미확인\n내원사유: 정기 진료\n진단명: 미확인\n중증도: 경미\n\n[미확인] SEVERANCE HOSPITAL Depth 54 Prope 1.6 RPCA Depre 60 Prode 1.6 Depth 64 F1 Probe 1.6 Peak RVA Pask RVA Depth 66 Proce 1.6 -38 Mean -21 PI 1.17 Depth 54 Prote 1.6 -60 Mean -32 Pl 1.33 Depth 60 Proce 1.6 Peak -62 Mean -33 1.31 TCD report 4/6 3/6 출력일:\n내원일: 미확인\n내원사유: 정기 진료\n진단명: 미확인\n중증도: 경미\n\n[미확인] SEVERANCE HOSPITAL Depth Proce RVA 64 1.6 Depth BA prox. 120 78 -60 Mean -32 F1 1.27 Probe 1.6 Peak -120 Mean -69 P 1.11 BA prox. Depth 84 Proce 1.6 Peak -117 Mean -67 BA dis. 136 -129 BA dis. 1.12 Depth Probe 88 1.6 Mean -73 F 1.16 Depth 90 Proce 1.6 Pazk -123 Mean -70 Pl 1.14 TCD report 5/6 4/6 출력일:\n내원일: 미확인\n내원사유: 정기 진료\n진단명: 미확인\n중증도: 경미\n\n[미확인] SEVERANCE HOSPITAL 원본대조필 등록번호: 8633158 주민등록번호: 550112-125****남/65세 환자명: 이광욱 SEVERANCE HOSPITAL Name Gender LEE KWANG OOK^^^^ Male TCD ID 8633158 Exam Date Age D.O.B Exam Type\n내원일: 미확인\n내원사유: 정기 진료\n진단명: 미확인\n중증도: 경미\n\n[미확인] 원본대조필 SEVERANCE HOSPITAL 등록번호: 8633158 주민등록번호: 550112-125**** 남/64세 환자명: 이광욱 외래재진기록\n내원일: 미확인\n내원사유: 정기 진료\n진단명: 미확인\n중증도: 경미\n\n[미확인] SEVERANCE HOSPITAL 1/1 출력일:\n내원일: 미확인\n내원사유: 정기 진료\n진단명: 미확인\n중증도: 경미\n\n[미확인] SEVERANCE HOSPITAL 출력자: 김경미 원본대조필 등록번호: 8633158 주민등록번호: 550112-125****남/65세 환자명: 이광욱 검사결과 ABI (Ankle/Brachial Index) - Rt: 0.77 /Lt: 0.90 Impression Image Name pvr Image1 Name: LEE GWANG WOOK 8633158 Exam Date:\n내원일: 미확인\n내원사유: 정기 진료\n진단명: 미확인\n특이사항: ABI (Ankle/Brachial Index) - Rt: 0.77 /Lt: 0.90 Impression Image Name pvr Image1 Name: LEE GWANG WOOK 8633158 Exam Date:\n중증도: 경미\n\n[미확인] SEVERANCE HOSPITAL 원본대조필 등록번호: 8633158 주민등록번호: 550112-125**** 남/65세 환자명 : 이광욱 판독의(1차) 이선화 판독의(2차) 안철민 전자서명자: 박규리 세브란스병원 SEVERANCE HOSPITAL 기능검사결과(I/F형) 2/2 출력일:\n내원일: 미확인\n내원사유: 정기 진료\n진단명: 미확인\n특이사항: (I/F형) 2/2 출력일:\n중증도: 경미\n\n[미확인] SEVERANCE HOSPITAL 외래재진기록\n내원일: 미확인\n내원사유: 정기 진료\n진단명: 미확인\n중증도: 경미\n\n[미확인] SEVERANCE HOSPITAL 외래재진기록\n내원일: 미확인\n내원사유: 정기 진료\n진단명: 미확인\n중증도: 경미\n\n[미확인] SEVERANCE HOSPITAL 1/1 출력일:\n내원일: 미확인\n내원사유: 정기 진료\n진단명: 미확인\n중증도: 경미\n\n[미확인] SEVERANCE HOSPITAL 원본대조필 등록번호: 8633158 주민등록번호: 550112-125**** 남/65세 환자명: 이광욱 판독의(1차) 이찬주 판독의(2차) 안철민 전자서명자: 박규리 세브란스병원 SEVERANCE HOSPITAL 기능검사결과(I/F형) 2/2 출력일:\n내원일: 미확인\n내원사유: 정기 진료\n진단명: 미확인\n특이사항: (I/F형) 2/2 출력일:\n중증도: 경미\n\n[미확인] SEVERANCE HOSPITAL 외래재진기록\n내원일: 미확인\n내원사유: 정기 진료\n진단명: 미확인\n중증도: 경미\n\n[미확인] SEVERANCE HOSPITAL 159 / 77 CD, TCD\n내원일: 미확인\n내원사유: 정기 진료\n진단명: 미확인\n중증도: 경미\n\n[미확인] SEVERANCE HOSPITAL 원본대조필 등록번호: 8633158 주민등록번호: 550112-125****남/65세 환자명: 이광욱 외래재진기록\n내원일: 미확인\n내원사유: 정기 진료\n진단명: 미확인\n중증도: 경미\n\n[미확인] SEVERANCE HOSPITAL 원본대조필 등록번호: 8633158 주민등록번호: 550112-125**** 남/67세 환자명: 이광욱 영상검사 CT& MR 영상검사 CT& MR 검사명 MRI Brain & Angio 3D(Neck포함) (contrast) 검사방법 검사일자 판독일자\n내원일: 미확인\n내원사유: 정기 진료\n진단명: 미확인\n중증도: 경미\n\n[미확인] SEVERANCE HOSPITAL 원본대조필 등록번호: 8633158 주민등록번호: 550112-125****남/65세 환자명 : 이광욱 외래재진기록\n내원일: 미확인\n내원사유: 정기 진료\n진단명: 미확인\n중증도: 경미\n\n[미확인] SEVERANCE HOSPITAL 1/1 출력일:\n내원일: 미확인\n내원사유: 정기 진료\n진단명: 미확인\n중증도: 경미\n\n[미확인] SEVERANCE HOSPITAL 원본대조필 등록번호: 8633158 기능검사결과(I/F형) 주민등록번호: 550112-125**** 남/66세 환자명: 이광욱\n내원일: 미확인\n내원사유: 정기 진료\n진단명: 미확인\n특이사항: (I/F형) 주민등록번호: 550112-125**** 남/66세 환자명: 이광욱\n중증도: 경미\n\n[미확인] SEVERANCE HOSPITAL 2/2 출력일:\n내원일: 미확인\n내원사유: 정기 진료\n진단명: 미확인\n중증도: 경미\n\n[미확인] SEVERANCE HOSPITAL 원본대조필 등록번호: 8633158 주민등록번호: 550112-125**** 남/65세 환자명: 이광욱 영상검사 특수촬영-초음파 영상검사 특수촬영-초음파 검사명 U/S 경부(neck)(Doppler) 검사방법 검사일자 판독일자\n내원일: 미확인\n내원사유: 정기 진료\n진단명: 미확인\n중증도: 경미\n\n[미확인] SEVERANCE HOSPITAL Both thyroid gland 에 multiple probably benign nodules 들이 관찰되며, 가장 큰 것은 Rt thyroid lower pole의 15mm 크기의 nodule 임. Both neck에 pathologically enlarged LNs 없음. Doppler ultrasound images 상 특이소견 없음. IMP: Multiple probably benign nodules in both thyroids, recommend follow up. 손진우/손진우/윤정현 1/1 출력일:\n내원일: 미확인\n내원사유: 정기 진료\n진단명: 미확인\n특이사항: 없음. IMP: Multiple probably benign nodules in both thyroids, recommend follow up. 손진우/손진우/윤정현 1/1 출력일:\n중증도: 경미\n\n[미확인] SEVERANCE HOSPITAL 원본대조필 등록번호: 8633158 주민등록번호: 550112-125**** 남/67세 환자명: 이광욱 검사명 검사방법 검사일자 판독일자 Description 판독의/전문의 영상검사 특수촬영-초음파 영상검사 특수촬영-초음파 U/S 경부(neck)(Doppler)\n내원일: 미확인\n내원사유: 정기 진료\n진단명: 미확인\n중증도: 경미\n\n[미확인] SEVERANCE HOSPITAL 원본대조필 등록번호: 8633158 주민등록번호: 550112-125**** 남/65세 환자명: 이광욱 진료과 내분비내과 주치의 강은석 BP(S) 146 mmHg BP(D) 경과 및 Plan 기록자명 강은석 75mmHg HR 85/min CAD(2vd+ LM) s/p CAG (2018.04, 일산백) s/p 4OPCAB(LIMA to dLAD, to OM(seq) to DG with RIMA composite Y, Aorta to rPL with RA) (\n내원일: 미확인\n내원사유: 정기 진료\n진단명: 미확인\n중증도: 경미\n\n[미확인] SEVERANCE HOSPITAL 원본대조필 등록번호: 8633158 주민등록번호: 550112-125**** 남/66세 환자명: 이광욱 외래재진기록\n내원일: 미확인\n내원사유: 정기 진료\n진단명: 미확인\n중증도: 경미\n\n[미확인] SEVERANCE HOSPITAL 원본대조필 등록번호: 8633158 기능검사결과(I/F형) 주민등록번호: 550112-125**** 남/66세 환자명: 이광욱\n내원일: 미확인\n내원사유: 정기 진료\n진단명: 미확인\n특이사항: (I/F형) 주민등록번호: 550112-125**** 남/66세 환자명: 이광욱\n중증도: 경미\n\n[미확인] SEVERANCE HOSPITAL 2/2 출력일:\n내원일: 미확인\n내원사유: 정기 진료\n진단명: 미확인\n중증도: 경미\n\n[미확인] SEVERANCE HOSPITAL 70mmHg HR 86/min CAD(2vd+ LM) s/p CAG (2018.04, 일산백) s/p 4OPCAB(LIMA to dLAD, to OM(seq) to DG with RIMA composite Y, Aorta to rPL with RA) (\n내원일: 미확인\n내원사유: 정기 진료\n진단명: 미확인\n중증도: 경미\n\n[미확인] 미확인 의료기관\n내원일: 미확인\n내원사유: 정기 진료\n진단명: 구분 확진 주진단 확진 기타진단 확진 |기타진단 확진 - s/p PTA c DCB at Rt. SFA\n특이사항: 진단 확진 |기타진단 확진 - s/p PTA c DCB at Rt. SFA\n중증도: 경미\n\n[미확인] 미확인 의료기관\n내원일: 미확인\n내원사유: 정기 진료\n진단명: 전자서명자: 안철민 1/1 출력일:\n중증도: 경미\n\n[미확인] SEVERANCE HOSPITAL 원본대조필 등록번호: 8633158 주민등록번호: 550112-125**** 남/67세 환자명 : 이광욱 검사결과 1. ABI (Ankle/ Brachial Index) Rt: 0.96 /Lt: 0.88 - Impression Name Image 1 Name: ID #: Exam Date: LEE K.W 8633158\n내원일: 미확인\n내원사유: 정기 진료\n진단명: 미확인\n특이사항: 1. ABI (Ankle/ Brachial Index) Rt: 0.96 /Lt: 0.88 - Impression Name Image 1 Name: ID #: Exam Date: LEE K.W 8633158\n중증도: 경미\n\n[미확인] SEVERANCE HOSPITAL 원본대조필 등록번호: 8633158 기능검사결과(I/F형) 주민등록번호: 550112-125****남/67세 환자명: 이광욱\n내원일: 미확인\n내원사유: 정기 진료\n진단명: 미확인\n특이사항: (I/F형) 주민등록번호: 550112-125****남/67세 환자명: 이광욱\n중증도: 경미\n\n[미확인] SEVERANCE HOSPITAL 2/2 출력일:\n내원일: 미확인\n내원사유: 정기 진료\n진단명: 미확인\n중증도: 경미\n\n[미확인] 미확인 의료기관\n내원일: 미확인\n내원사유: 정기 진료\n진단명: 구분 확진 CAD(2vd+LM) s/p CAG (2018.04, 일산백) s/p_4OPCAB(LIMA to dLAD, to OM(seq) to DG with RIMA composite Y, Aorta to rPL with RA) (\n중증도: 경미\n\n[미확인] SEVERANCE HOSPITAL 진단명 외래재진기록\n내원일: 미확인\n내원사유: 정기 진료\n진단명: 확진 Diabetes mellitus type 2 with dyslipidemia |기타진단 확진 Thyroid nodule |기타진단 확진 Internal carotid artery stenosis 기록자명 강은석 전자서명자: 강은석 세브란스병원 SEVERANCE HOSPITAL 진단명 외래재진기록\n특이사항: 진단 확진 Thyroid nodule |기타진단 확진 Internal carotid artery stenosis 기록자명 강은석 전자서명자: 강은석 세브란스병원 SEVERANCE HOSPITAL 진단명 외래재진기록\n중증도: 경미\n\n[미확인] 미확인 의료기관\n내원일: 미확인\n내원사유: 정기 진료\n진단명: 구분 확진 주진단 확진 |기타진단 확진 Diabetes mellitus type 2 with dyslipidemia Thyroid nodule |기타진단 확진 Internal carotid artery stenosis 진단명 기록자명 김다함 외래재진기록\n특이사항: 진단 확진 Diabetes mellitus type 2 with dyslipidemia Thyroid nodule |기타진단 확진 Internal carotid artery stenosis 진단명 기록자명 김다함 외래재진기록; 없음. Imp: Multiple probably benign nodules in both thyroids(K-TIRADS: 3) recommend follow up. T3 0.89 Free T4 1.04 TSH2.58 추가사항 Thyroid nodule Plan 2yf/u 진단명 구분 확진 주진단 확진 |기타진단 확진 Diabetes mellitus type 2 with dyslipidemia Thyroid nodule |기타진단 확진 Internal carotid artery stenosis 진단명 기록자명 김다함 외래재진기록\n중증도: 경미\n\n[미확인] SEVERANCE HOSPITAL 원본대조필 등록번호: 8633158 주민등록번호: 550112-125**** 남/69세 환자명: 이광욱 영상검사 특수촬영 - 초음파 영상검사 특수촬영-초음파 검사명 U/S 경부(neck)(Doppler) 검사방법 검사일자 판독일자\n내원일: 미확인\n내원사유: 정기 진료\n진단명: 미확인\n중증도: 경미\n\n[미확인] SEVERANCE HOSPITAL 촬영실 암)갑상선초음파 1검사실 Clinical information: Diabetes mellitus type 2 with dyslipidemia US examination was done with linear transducer> =10 MHz (central frequency). 이전 US와 비교함 Both thyroid gland 에 multiple probably benign nodules 들이 관찰되며 가장 큰 것은 Rt thyroid lower pole의 21mm 크기의 nodule 임. Background echotexture는 subtle heterogeneous 하며 mild diffuse enlarge 되어 있음. Both neck에 pathologically enlarged LNs 없음. Doppler ultrasound images 상 특이소견 없음. Imp: Multiple probably benign nodules in both thyroids (K-TIRADS: 3) R/O Diffuse thyroid disease recommend follow up. 함주현/함주현/함주현 1/1 출력일:\n내원일: 미확인\n내원사유: 정기 진료\n진단명: 미확인\n특이사항: 없음. Imp: Multiple probably benign nodules in both thyroids (K-TIRADS: 3) R/O Diffuse thyroid disease recommend follow up. 함주현/함주현/함주현 1/1 출력일:\n중증도: 경미\n\n[미확인] 미확인 의료기관\n내원일: 미확인\n내원사유: 정기 진료\n진단명: 구분 확진 CAD(2vd+ LM) s/p CAG (2018.04, 일산백) s/p4OPCAB(LIMA to dLAD, to OM(seq) to DG with RIMA composite Y, Aorta to rPL with RA) (\n중증도: 경미\n\n[미확인] 미확인 의료기관\n내원일: 미확인\n내원사유: 정기 진료\n진단명: 확진 Diabetes mellitus type 2 with dyslipidemia |기타진단 확진 Thyroid nodule |기타진단 확진 Internal carotid artery stenosis 기록자명 강은석 진단명 외래재진기록\n특이사항: 진단 확진 Thyroid nodule |기타진단 확진 Internal carotid artery stenosis 기록자명 강은석 진단명 외래재진기록\n중증도: 경미\n\n[미확인] 1/1 출력일:\n내원일: 미확인\n내원사유: 정기 진료\n진단명: 미확인\n중증도: 경미\n\n[미확인] 미확인 의료기관\n내원일: 미확인\n내원사유: 정기 진료\n진단명: 구분 확진 주진단 확진 Unstable angina 기타진단 확진 Coronary artery disease (left main) 기타진단 확진 Coronary artery disease (2 vessel disease) 기록자명 안철민 진단명 전자서명자: 안철민 1/1 출력일:\n특이사항: 진단 확진 Coronary artery disease (left main) 기타진단 확진 Coronary artery disease (2 vessel disease) 기록자명 안철민 진단명 전자서명자: 안철민 1/1 출력일:\n중증도: 경미\n\n[미확인] SEVERANCE HOSPITAL 원본대조필 ========== 파일: i?￢i??i?? i§?e￡?e?´i?­.pdf ==========\n내원일: 미확인\n내원사유: 정기 진료\n진단명: 미확인\n중증도: 경미\n\n[미확인] &약국별 개인진료정보요약 정보주체 : 이광욱 열람대상기간 :\n내원일: 미확인\n내원사유: 정기 진료\n진단명: 미확인\n처방: 조제정보 병·의원&약국별 개인진료정보요약 정보주체 : 이광욱 열람대상기간 :\n중증도: 경미\n\n[미확인] (양방)경 28,030 3,830 24,200 쇄 및 협착 (양방)경 2\n내원일: 미확인\n내원사유: 정기 진료\n진단명: 미확인\n중증도: 경미\n\n[미확인] 1 778,260 311,360 466,900 쇄 및 협착 의료법인 세경 4\n내원일: 미확인\n내원사유: 정기 진료\n진단명: 미확인\n중증도: 경미\n\n[미확인] (양방)녹 145,440 내장 의심 87,340 58,100 5\n내원일: 미확인\n내원사유: 정기 진료\n진단명: 미확인\n중증도: 경미\n\n[미확인] 25,640 3,840 21,800 타 명시된 합병증을 7\n내원일: 미확인\n내원사유: 정기 진료\n진단명: 미확인\n중증도: 경미\n\n[미확인] 80,810 32,410 48,400 타 명시된 합병증을 9\n내원일: 미확인\n내원사유: 정기 진료\n진단명: 미확인\n중증도: 경미\n\n[미확인] 학과 (양방)기 타 및 상세 외래 Al109 불명의 원 발성 고혈 압 1 21,170 12,770 8,400 (양방)지 10\n내원일: 미확인\n내원사유: 정기 진료\n진단명: 미확인\n중증도: 경미\n\n[미확인] 목의 상세 외래 AS6359 불명 부분 의 염좌 긴장 1 39,420 23,720 15,700 . 본 자료는 병·의원&약국에서 청구한 요양급여비용 명세서를 기준으로 작성된 자료입니다. 진료비에는 국민건강보험법 제41조의4에 따른 선별급여 관련 금액이 포함되어 있지 않습니다. 이에 본 자료를 단순 참고가 아닌 증빙자료로 사용할 수 없으며, 이용에 관한 책임은 이용자에게 있습니다. 1/10 빈경환\n내원일: 미확인\n내원사유: 정기 진료\n진단명: 미확인\n특이사항: 가 아닌 증빙자료로 사용할 수 없으며, 이용에 관한 책임은 이용자에게 있습니다. 1/10 빈경환\n중증도: 경미\n\n[미확인] 세불명의 1 급성 상기 도감염 24,130 19,330 4,800 (양방)달 리 분류되 15\n내원일: 미확인\n내원사유: 정기 진료\n진단명: 미확인\n중증도: 경미\n\n[미확인] 타 명시된 합병증을 1 145,330 51,730 93,600 16\n내원일: 미확인\n내원사유: 정기 진료\n진단명: 미확인\n중증도: 경미\n\n[미확인] 가정의 학과 (양방)죽 외래 A1251 상경화성 심장병 1 12,290 7,390 4,900 (양방)상 19\n내원일: 미확인\n내원사유: 정기 진료\n진단명: 미확인\n중증도: 경미\n\n[미확인] 내과 외래 AJ209 세불명의 급성 기관 지염 16,960 11,060 5,900 (양방)급 20\n내원일: 미확인\n내원사유: 정기 진료\n진단명: 미확인\n중증도: 경미\n\n[미확인] 1 113,930 39,330 74,600 타 명시된 합병증을 (양방)상 22\n내원일: 미확인\n내원사유: 정기 진료\n진단명: 미확인\n중증도: 경미\n\n[미확인] 세불명 부 외래 학과 AI213 위의 급성 경색증 1 16,650 10,050 6,600 전층심근 본 자료는 병·의원&약국에서 청구한 요양급여비용 명세서를 기준으로 작성된 자료입니다. 진료비에는 국민건강보험법 제41조의4에 따른 선별급여 관련 금액이 포함되어 있지 않습니다. . . 이에 본 자료를 단순 참고가 아닌 증빙자료로 사용할 수 없으며, 이용에 관한 책임은 이용자에게 있습니다. 빈경환 2/10\n내원일: 미확인\n내원사유: 정기 진료\n진단명: 미확인\n특이사항: 가 아닌 증빙자료로 사용할 수 없으며, 이용에 관한 책임은 이용자에게 있습니다. 빈경환 2/10\n중증도: 경미\n\n[미확인] (양방)녹 1 196,190 117,790 78,400 내장 의심 26\n내원일: 미확인\n내원사유: 정기 진료\n진단명: 미확인\n중증도: 경미\n\n[미확인] (양방)불 195,570 104,370 91,200 증 28\n내원일: 미확인\n내원사유: 정기 진료\n진단명: 미확인\n중증도: 경미\n\n[미확인] (양방)녹 23,890 내장 의심 14,390 9,500 30\n내원일: 미확인\n내원사유: 정기 진료\n진단명: 미확인\n중증도: 경미\n\n[미확인] 31\n내원일: 미확인\n내원사유: 정기 진료\n진단명: 미확인\n중증도: 경미\n\n[미확인] 타 명시된 1 88,760 35,560 53,200 합병증을 ?본 자료는 병·의원&약국에서 청구한 요양급여비용 명세서를 기준으로 작성된 자료입니다. 진료비에는 국민건강보험법 제41조의4에 따른 선별급여 관련 금액이 포함되어 있지 않습니다. 이에 본 자료를 단순 참고가 아닌 증빙자료로 사용할 수 없으며, 이용에 관한 책임은 이용자에게 있습니다. 3/10 빈경환\n내원일: 미확인\n내원사유: 정기 진료\n진단명: 미확인\n특이사항: 가 아닌 증빙자료로 사용할 수 없으며, 이용에 관한 책임은 이용자에게 있습니다. 3/10 빈경환\n중증도: 경미\n\n[미확인] (양방)녹 내장 의심 23,050 13,850 9,200 35\n내원일: 미확인\n내원사유: 정기 진료\n진단명: 미확인\n중증도: 경미\n\n[미확인] (양방)녹 1 내장 의심 131,150 78,750 52,400 37\n내원일: 미확인\n내원사유: 정기 진료\n진단명: 미확인\n중증도: 경미\n\n[미확인] 24,760 3,760 21,000 연세대학교의 (양방)경 39\n내원일: 미확인\n내원사유: 정기 진료\n진단명: 미확인\n중증도: 경미\n\n[미확인] 24,760 3,760 21,000 쇄 및 협착 <\n내원일: 미확인\n내원사유: 정기 진료\n진단명: 미확인\n중증도: 경미\n\n[미확인] 845,790 338,390 507,400 쇄 및 협착 (양방)달 연세대학교의 리 분류되 42\n내원일: 미확인\n내원사유: 정기 진료\n진단명: 미확인\n중증도: 경미\n\n[미확인] 타 명시된 합병증을 43\n내원일: 미확인\n내원사유: 정기 진료\n진단명: 미확인\n중증도: 경미\n\n[미확인] 타 및 상세 \"불명의 난 26,020 15,620 10,400 \"시\" 의료법인 세경 진료과 (양방)기 49\n내원일: 미확인\n내원사유: 정기 진료\n진단명: 미확인\n중증도: 경미\n\n[미확인] <\n내원일: 미확인\n내원사유: 정기 진료\n진단명: 미확인\n중증도: 경미\n\n[미확인] 99,460 59,760 39,700 내장, 양쪽 의료법인 세경 (양방)기 55\n내원일: 미확인\n내원사유: 정기 진료\n진단명: 미확인\n중증도: 경미\n\n[미확인] 타 및 상세 1 126,890 76,190 50,700 시 본 자료는 병·의원&약국에서 청구한 요양급여비용 명세서를 기준으로 작성된 자료입니다. . 진료비에는 국민건강보험법 제41조의4에 따른 선별급여 관련 금액이 포함되어 있지 않습니다. . 빈경환 이에 본 자료를 단순 참고가 아닌 증빙자료로 사용할 수 없으며, 이용에 관한 책임은 이용자에게 있습니다. 5/10\n내원일: 미확인\n내원사유: 정기 진료\n진단명: 미확인\n특이사항: 가 아닌 증빙자료로 사용할 수 없으며, 이용에 관한 책임은 이용자에게 있습니다. 5/10\n중증도: 경미\n\n[미확인] &약국에서 청구한 요양급여비용 명세서를 기준으로 작성된 자료입니다. . 진료비에는 국민건강보험법 제41조의4에 따른 선별급여 관련 금액이 포함되어 있지 않습니다. ?이에 본 자료를 단순 참고가 아닌 증빙자료로 사용할 수 없으며, 이용에 관한 책임은 이용자에게 있습니다. 빈경환 6/10\n내원일: 미확인\n내원사유: 정기 진료\n진단명: 미확인\n특이사항: 가 아닌 증빙자료로 사용할 수 없으며, 이용에 관한 책임은 이용자에게 있습니다. 빈경환 6/10\n중증도: 경미\n\n[미확인] (양방)만 치주과 외래 AK0530 성 단순치 1 주영 53,340 37,340 16,000 68\n내원일: 미확인\n내원사유: 정기 진료\n진단명: 미확인\n중증도: 경미\n\n[미확인] 이비인 후과 외래 AH612 (양방)귀 지떡 1 52,650 36,950 15,700 69\n내원일: 미확인\n내원사유: 정기 진료\n진단명: 미확인\n중증도: 경미\n\n[미확인] 치과보 철과 외래 AK081 또는 국한 성치주병 에의한 치 1 564,010 394,810 169,200 74\n내원일: 미확인\n내원사유: 정기 진료\n진단명: 미확인\n중증도: 경미\n\n[미확인] 철과 외래 AK081 또는 국한 성치주병 에 의한 0 558,750 391,150 167,600 77\n내원일: 미확인\n내원사유: 정기 진료\n진단명: 미확인\n중증도: 경미\n\n[미확인] (양방)만 치주과 외래 AK0530 성 단순치 1 주염 37,990 26,690 11,300 본 자료는 병·의원&약국에서 청구한 요양급여비용 명세서를 기준으로 작성된 자료입니다. 진료비에는 국민건강보험법 제41조의4에 따른 선별급여 관련 금액이 포함되어 있지 않습니다. ?이에 본 자료를 단순 참고가 아닌 증빙자료로 사용할 수 없으며, 이용에 관한 책임은 이용자에게 있습니다. 7/10 빈경환\n내원일: 미확인\n내원사유: 정기 진료\n진단명: 미확인\n특이사항: 가 아닌 증빙자료로 사용할 수 없으며, 이용에 관한 책임은 이용자에게 있습니다. 7/10 빈경환\n중증도: 경미\n\n[미확인] 치과보 존과 외래 AK081 또는 국한 성치주병 에 의한 치 1 545,790 382,090 163,700 (양방)사 79\n내원일: 미확인\n내원사유: 정기 진료\n진단명: 미확인\n중증도: 경미\n\n[미확인] 치과보 철과 외래 AK081 또는 국한 성치주병 에 의한 116,800 81,800 35,000 82\n내원일: 미확인\n내원사유: 정기 진료\n진단명: 미확인\n중증도: 경미\n\n[미확인] 구강악 (양방)만 안면외 외래 AK0531 성 복합치 1 과 주영 25,480 17,880 7,600 (양방)만 88\n내원일: 미확인\n내원사유: 정기 진료\n진단명: 미확인\n중증도: 경미\n\n[미확인] &약국에서 청구한 요양급여비용 명세서를 기준으로 작성된 자료입니다. ?진료비에는 국민건강보험법 제41조의4에 따른 선별급여 관련 금액이 포함되어 있지 않습니다. ?이에 본 자료를 단순 참고가 아닌 증빙자료로 사용할 수 없으며, 이용에 관한 책임은 이용자에게 있습니다. 8/10 빈경환\n내원일: 미확인\n내원사유: 정기 진료\n진단명: 미확인\n특이사항: 가 아닌 증빙자료로 사용할 수 없으며, 이용에 관한 책임은 이용자에게 있습니다. 8/10 빈경환\n중증도: 경미\n\n[미확인] 구강악 (양방)만 안면외 외래 AK0531 성 복합치 1 과 주염 13,720 12,220 1,500 (양방)만 90\n내원일: 미확인\n내원사유: 정기 진료\n진단명: 미확인\n중증도: 경미\n\n[미확인] (양방)만 치주과 외래 AK0530 성 단순치 주염 1 32,540 22,840 9,700 92\n내원일: 미확인\n내원사유: 정기 진료\n진단명: 미확인\n중증도: 경미\n\n[미확인] 치과보 존과 (양방)상 외래 AK074 세불명의 부정교합 1 17,880 16,180 1,700 (양방)만 93\n내원일: 미확인\n내원사유: 정기 진료\n진단명: 미확인\n중증도: 경미\n\n[미확인] 철과 외래 AK081 또는 국한 116,800 81,800 35,000 성 치주병 에 의한 치 (양방)사 고, 추출 <\n내원일: 미확인\n내원사유: 정기 진료\n진단명: 미확인\n중증도: 경미\n\n[미확인] 철과 외래 AK081 또는 국한 성치주병 에 의한 치 1 546,230 382,430 163,800 (양방)사 고, 추출 99\n내원일: 미확인\n내원사유: 정기 진료\n진단명: 미확인\n중증도: 경미\n\n[미확인] 치과보 철과 외래 AK081 또는 국한 1 116,800 81,800 35,000 성 치주병 에 의한 치 본 자료는 병·의원&약국에서 청구한 요양급여비용 명세서를 기준으로 작성된 자료입니다. . 진료비에는 국민건강보험법 제41조의4에 따른 선별급여 관련 금액이 포함되어 있지 않습니다. . 이에 본 자료를 단순 참고가 아닌 증빙자료로 사용할 수 없으며, 이용에 관한 책임은 이용자에게 있습니다. 빈경환 9/10 외래 코드 일수(건강보험 적용분) 혜택받은 금액| (진료비) 100\n내원일: 미확인\n내원사유: 정기 진료\n진단명: 미확인\n특이사항: 가 아닌 증빙자료로 사용할 수 없으며, 이용에 관한 책임은 이용자에게 있습니다. 빈경환 9/10 외래 코드 일수(건강보험 적용분) 혜택받은 금액| (진료비) 100\n중증도: 경미\n\n[미확인] &약국에서 청구한 요양급여비용 명세서를 기준으로 작성된 자료입니다. 진료비에는 국민건강보험법 제41조의4에 따른 선별급여 관련 금액이 포함되어 있지 않습니다. 이에 본 자료를 단순 참고가 아닌 증빙자료로 사용할 수 없으며, 이용에 관한 책임은 이용자에게 있습니다.\n내원일: 미확인\n내원사유: 정기 진료\n진단명: 미확인\n특이사항: 가 아닌 증빙자료로 사용할 수 없으며, 이용에 관한 책임은 이용자에게 있습니다.\n중증도: 경미\n\n■ 입원 기록 (Hospitalization Records)\nNaN\n[미확인] 미확인 의료기관\n내원일: 미확인\n내원사유: ※약관을 모바일(문자)를 통해 수련하는 것에 대한 동의여부{V 동의 [동의안함) ※본인수의자 지정 변경 관련 추가약정( 5 약정함 이조훈 (서명) 약정하지 아니함 (약정함을 선택한 경우) 본인(보험계약자)이 사망한 경우에는 상속인 등 승계인이 보험수익자 지정·변경권을 행사합니다 부) ※(대상: 피보험자) 의료급여 수급권자 보험료 할인 신청 ( = 여 -자격취득일로부터 실손의료비 보장 보험계약의 매회 납입할 보장종목별 보장보험료의 5%를 할인하여 드립니다. ※청약유효일자: 2024 10-31 까지 LW\n진단명: . 장해, 사고 후 보험가입 등)는 형법상 금지된 범죄입니다. 구분! 계약자 자 i 필서명 필: 성명 이조훈 주피보험자 종피보험자 1 종피보험자2 종피보험자3 종피보험자4 종피보험자5 이광욱 법정대리인(친권자) 관 서명 이조훈 이광욱 * 가입자보관용 청약서상에 자필서명하셨습니까? 예 = 아니오 * 보험계약자 또는 피보험자가 미성년자인 경우 법정대리인이 서명하여 주시기 바랍니다. *피보험자(보험대상자 본인이 자필서명을 하지 않으신 경우에는 보험계약이 무효가 되어 보장을 받지 못할 수도 있습니다 *계약의 보장개시 효력은 1회 보험료를 납입하신 때부터입니다. 뒷면의 꼭 아셔야 할 사항을 반드시 확인하시기 바랍니다. ※안내장 발송(7 동의 동의안함 * 안내장 발송형태(ㄷ 모바일 안내장 E-Mail/E-Ma주소 ※약관을 모바일(문자)를 통해 수련하는 것에 대한 동의여부{V 동의 [동의안함) ※본인수의자 지정 변경 관련 추가약정( 5 약정함 이조훈 (서명) 약정하지 아니함 (약정함을 선택한 경우) 본인(보험계약자)이 사망한 경우에는 상속인 등 승계인이 보험수익자 지정·변경권을 행사합니다 부) ※(대상: 피보험자) 의료급여 수급권자 보험료 할인 신청 ( = 여 -자격취득일로부터 실손의료비 보장 보험계약의 매회 납입할 보장종목별 보장보험료의 5%를 할인하여 드립니다. ※청약유효일자: 2024 10-31 까지 LW\n입원기간: undefined ~ undefined\n\n[미확인] (1644-9000)] ☞ 보험에 가입하신 후 d. 보험증권을 받으시면 청약서 내용과 다름이 없는 지 또는 누락이 없는 지 확인하시기 바랍니다. 1 청약서 기재사항에 변동사항(피보험자의 직업 및 직무의 변경, 보험목적의 양도, 건물 구조 또는 용도의 변경, 보험목적을 다른 장소로 옮기는 경우, 수리하는 경우 등)이 있거나 다른 보험에 가입하실 경우 회사에 즉시 연락하시기 바랍니다. 3 보험계약의 내용을 변경하고자 할 경우에는 회사의 승낙을 얻어야 합니다. 4 손해가 생긴 경우에는 지체없이 이를 회사에 알려서 필요한 절차를 안내 받으시기 바랍니다. 5 보험금 지급사유의 조사 및 확인을 위하여 보험금 지급기일 초과가 명백히 예상되는 경우에는 피보험자 또는 수익자의 청구에 따라 회사가 추정 하는 보험금의 50% 상당액을 가지급보험금으로 지급하여 드립니다. [ 실손의료비를 가입하신 경우 이 보험계약에서 보장하는 실손의료비는 동 비용을 담보하는 다수의 보험계약에 체결되어 있는 경우, 약관에 따라 비례하여 보상합니다. 다만, 이미 가입된 보험 계약에서 보상한 금액이 본인이 부담한 의료비를 초과하였을 때에는 보험금이 지급되지 않을 수 있습니다. ( 갱신형 실손의료비 특별약관은 기본계약 보험기간 이내에서 매 1년마다 자동갱신되며, 갱신시 연령의 증가와 적용요율 등의 변동에 따라 보험료가 달라 질 수 있으며, 보험료 인상시에는 추가납입 하여야 계약이 유지됩니다. 3 피보험자가 동일한 회사에 보험기간이 3개월 이상인 해외실손의료비에 가입하고, 연속하여 3개월이상의 해외 체류사실이 확인되는 경우 실손의료보험의 보험료납입을 일정기간 중지해주거나 사후에 해당 기간의 표준화실손상품(\n내원일: 미확인\n내원사유: 응급실 내원\n진단명: 을 지원하는 계약, 보험기간(보장기간)이 90일 이내인 계약, 법률에 따라 가입의무 부과 및 해제·해지가 가능한 보험 (다만, 계약자가 동종의 다른 보험에 가입한 경우는 제외)은 청약을 철회할 수 없습니다. 5 화재손해특약은 계약 체결시에 보험에 가입한 물건의 가치(이하 '보험가액'이라 합니다)를 평가하지 않고 사고시 보험가액을 산정하여 보험가입 금액을 한도로 보상하는 미평가 보험입니다. 보험가입금액은 시가와 똑같이 정해야 합니다. 만약 시가보다 낮게 정하면 납입보험료 부담은 줄어 들지만 사고가 발생하였을 때 줄어든 비율만큼 적게 보상받고 높게 정하더라도 사고가 발생하면 실제로 입은 손해액만큼 보상받게 됩니다. 6 가재도구를 보험에 가입할 경우 귀금속. 귀중품(무게나 부피가 휴대할 수 있으며 점당 300만원이상). 골동품 등은 별도로 기재하여야만 보상의 대상이 됩니다. · 약관의 보상하는 손해와 보상하지 아니하는 손해를 확인하셔야 합니다. ※ 보험금 수익자의 지정에 관한 사항 계약자는 사망보험금, 중도보험금, 만기보험금, 장해보험금, 입원보험금 등 약관상 보험금 지급사유가 발생하는 때에 회사에 보험금을 청구하여 받을 수 있는 사람(보험수익자)을 지정하실 수 있습니다. 사망보험금 수익자를 지점/변경하고자 할 경우에는 사망보험금 지급사유가 발생하기 전에 피보험자가 서면으로 동의해야 합니다. 만약 계약자가 보험 수익자를 지정하지 않은 때에는 민법상 피보험자의 법정상속인 순위로 보험수익자를 정합니다. 민법상 법정상속인 순위 : 1. 직계비속. 2. 직계존속. 3. 형제자매. 4. 4촌 이내의 방계 혈족 배우자는 위의 1. 2순위 상속인이 있는 경우에 그 상속인과 동순위로 공동상속인이 되고, 그 상속인이 없는 때에는 단독상속인이 됨 (수익자 지정/변경 등에 필요한}구비서류 : (계약자 및 피보험자와 변경 후 수익자) 각 신분증 [수역자 지정 관련 문의 : 콜센터(1644-9000)] ☞ 보험에 가입하신 후 d. 보험증권을 받으시면 청약서 내용과 다름이 없는 지 또는 누락이 없는 지 확인하시기 바랍니다. 1 청약서 기재사항에 변동사항(피보험자의 직업 및 직무의 변경, 보험목적의 양도, 건물 구조 또는 용도의 변경, 보험목적을 다른 장소로 옮기는 경우, 수리하는 경우 등)이 있거나 다른 보험에 가입하실 경우 회사에 즉시 연락하시기 바랍니다. 3 보험계약의 내용을 변경하고자 할 경우에는 회사의 승낙을 얻어야 합니다. 4 손해가 생긴 경우에는 지체없이 이를 회사에 알려서 필요한 절차를 안내 받으시기 바랍니다. 5 보험금 지급사유의 조사 및 확인을 위하여 보험금 지급기일 초과가 명백히 예상되는 경우에는 피보험자 또는 수익자의 청구에 따라 회사가 추정 하는 보험금의 50% 상당액을 가지급보험금으로 지급하여 드립니다. [ 실손의료비를 가입하신 경우 이 보험계약에서 보장하는 실손의료비는 동 비용을 담보하는 다수의 보험계약에 체결되어 있는 경우, 약관에 따라 비례하여 보상합니다. 다만, 이미 가입된 보험 계약에서 보상한 금액이 본인이 부담한 의료비를 초과하였을 때에는 보험금이 지급되지 않을 수 있습니다. ( 갱신형 실손의료비 특별약관은 기본계약 보험기간 이내에서 매 1년마다 자동갱신되며, 갱신시 연령의 증가와 적용요율 등의 변동에 따라 보험료가 달라 질 수 있으며, 보험료 인상시에는 추가납입 하여야 계약이 유지됩니다. 3 피보험자가 동일한 회사에 보험기간이 3개월 이상인 해외실손의료비에 가입하고, 연속하여 3개월이상의 해외 체류사실이 확인되는 경우 실손의료보험의 보험료납입을 일정기간 중지해주거나 사후에 해당 기간의 표준화실손상품(\n입원기간: undefined ~ undefined\n\n[미확인] SEVERANCE HOSPITAL 퇴원요약\n내원일: 미확인\n내원사유: (*) Diabetes mellitus other, without complication; Diabetes mellitus type 2, without complication; Diabetic polyneuropathy; Internal carotid artery stenosis;Internal carotid artery stenosis, right;Type 2 diabetes mellitus, coronary artery disease; E11.58;E11.9;E13.9;E14.41;165.2; For PTA 과거력 및 현재병력 상기 64세 남환 DM, CAOD (2vd, s/p CAG), PAOD 진단 받은 분으로 PTA 시행 위해 금일 입원함. V/S 120/70 78 20 Current Sx: none 이상 진찰 소견 (★) n-s 재원중 투약내역 (*) n-s 투여된 약물 중 잔류효과로 퇴원 후 주의가 필요한 약물 (*) 없음 있음 Aspirin protect->출혈의 위험성이 증가되므로 상처나 멍이 생기지 않도록 주의하십시오.; Platless-> 출혈의 위험성이 증가되므로 상처나 멍이 생기지 않도록 주의하십시오.; 전자서명자: 안철민 세브란스병원 SEVERANCE HOSPITAL 퇴원요약\n진단명: (*) 순서 한국질병 구분 확진 진단명 분류번호 1 주진단 확진 Peripheral arterial occlusive disease (lower extremities) 170.29 2 기타진단 확진 Unstable angina 120.0 3 기타진단 확진 Coronary artery disease (left main) 125.1 4 기타진단 확진 Coronary artery disease (2 vessel disease) 125.1 5 기타진단 확진 S/P Coronary artery bypass graft Z95.1 과거진단명 과거진단코드 주호소 (*) Diabetes mellitus other, without complication; Diabetes mellitus type 2, without complication; Diabetic polyneuropathy; Internal carotid artery stenosis;Internal carotid artery stenosis, right;Type 2 diabetes mellitus, coronary artery disease; E11.58;E11.9;E13.9;E14.41;165.2; For PTA 과거력 및 현재병력 상기 64세 남환 DM, CAOD (2vd, s/p CAG), PAOD 진단 받은 분으로 PTA 시행 위해 금일 입원함. V/S 120/70 78 20 Current Sx: none 이상 진찰 소견 (★) n-s 재원중 투약내역 (*) n-s 투여된 약물 중 잔류효과로 퇴원 후 주의가 필요한 약물 (*) 없음 있음 Aspirin protect->출혈의 위험성이 증가되므로 상처나 멍이 생기지 않도록 주의하십시오.; Platless-> 출혈의 위험성이 증가되므로 상처나 멍이 생기지 않도록 주의하십시오.; 전자서명자: 안철민 세브란스병원 SEVERANCE HOSPITAL 퇴원요약\n입원기간: undefined ~ undefined\n특이사항: 진단 확진 Unstable angina 120.0 3 기타진단 확진 Coronary artery disease (left main) 125.1 4 기타진단 확진 Coronary artery disease (2 vessel disease) 125.1 5 기타진단 확진 S/P Coronary artery bypass graft Z95.1 과거진단명 과거진단코드 주호소 (*) Diabetes mellitus other, without complication; Diabetes mellitus type 2, without complication; Diabetic polyneuropathy; Internal carotid artery stenosis;Internal carotid artery stenosis, right;Type 2 diabetes mellitus, coronary artery disease; E11.58;E11.9;E13.9;E14.41;165.2; For PTA 과거력 및 현재병력 상기 64세 남환 DM, CAOD (2vd, s/p CAG), PAOD 진단 받은 분으로 PTA 시행 위해 금일 입원함. V/S 120/70 78 20 Current Sx: none 이상 진찰 소견 (★) n-s 재원중 투약내역 (*) n-s 투여된 약물 중 잔류효과로 퇴원 후 주의가 필요한 약물 (*) 없음 있음 Aspirin protect->출혈의 위험성이 증가되므로 상처나 멍이 생기지 않도록 주의하십시오.; Platless-> 출혈의 위험성이 증가되므로 상처나 멍이 생기지 않도록 주의하십시오.; 전자서명자: 안철민 세브란스병원 SEVERANCE HOSPITAL 퇴원요약; (★) n-s 재원중 투약내역 (*) n-s 투여된 약물 중 잔류효과로 퇴원 후 주의가 필요한 약물 (*) 없음 있음 Aspirin protect->출혈의 위험성이 증가되므로 상처나 멍이 생기지 않도록 주의하십시오.; Platless-> 출혈의 위험성이 증가되므로 상처나 멍이 생기지 않도록 주의하십시오.; 전자서명자: 안철민 세브란스병원 SEVERANCE HOSPITAL 퇴원요약\n\n[미확인] SEVERANCE HOSPITAL 출력자: 김경미 원본대조필 등록번호: 8633158 주민등록번호: 550112-125**** 남/64세 환자명: 이광욱 퇴원약 약품명 (Name) 용량(Dose) 일수(Days) 용법(Direction) 처방 분류 (Type) 효능 아스피린프로텍트 1 14 정100mg 아침 식후 30분 복용하십시오 퇴원약 헤르벤정 30mg 1 14 아침,저녁 식후 30 퇴원약 분 복용하십시오 리피토정 80mg 1 14 아침 식후 30분 퇴원약 복용하십시오 플래리스정 1 14 아침 식후 30분 복용하십시오 퇴원약 라비에트정10mg 1 14 아침 식전 30분 복 퇴원약 용하십시오 중외시그마트정 1 5mg 14 아침, 저녁 식후 30 퇴원약 분 복용하십시오 코자정100mg 1 14 아침 식후 30분 복용하십시오 퇴원약 아스피린프로텍트 1 19 정100mg 아침 식후 30분 복용하십시오 퇴원약 헤르벤정 30mg 1 19 아침,저녁 식후 30 퇴원약 분 복용하십시오 리피토정 80mg 1 19 아침 식후 30분 퇴원약 복용하십시오 플래리스정 1 19 아침 식후 30분 퇴원약 복용하십시오 라비에트정10mg 1 19 아침 식전 30분 복 퇴원약 용하십시오 중외시그마트정 1 5mg 19 아침,저녁 식후 30 퇴원약 분 복용하십시오 코자정100mg 1 19 아침 식후 30분 복용하십시오 퇴원약 담당 전공의사명 권혜란 기록자명 권혜란 주치의사명 안철민 <약어 설명> CAOD coronary artery obstructive disease RFCA radio-frequency catheter ablation NSTEMI non-ST elevation myocardial infarction C-angio : coronary angiogram A.fib: atrial fibrillation EPS electrophysiologic studies DCMP: dilated cardiomyopathy HCMP hypertrophic cardiomyopathy PAF paroxysmal atrial fibrillation RHD rheumatic heart disease NSVT non-sustained ventricular tachycardia A-flutter : atrial flutter 퇴원요약\n내원일: 미확인\n내원사유: 응급실 내원\n진단명: 미확인\n입원기간: undefined ~ undefined\n\n[미확인] SEVERANCE HOSPITAL 원본대조필 등록번호: 8633158 주민등록번호: 550112-125****남/64세 환자명: 이광욱 입원일자\n내원일: 미확인\n내원사유: 응급실 내원\n진단명: 미확인\n입원기간: undefined ~ undefined\n\n[미확인] SEVERANCE HOSPITAL 입원기록\n내원일: 미확인\n내원사유: 또는 입원사유 For PTA 현재질병상태 상기 64세 남환 DM, CAOD (2vd, s/p CAG), PAOD 진단 받은 분으로 PTA 시행 위해 금일 입원함. V/S 120/70 78 20 Current Sx none 과거력 Hypertension No Yes Pul. Tbc No Yes DM No Yes Hepatitis No Yes Smoking No Yes 금연교육 여부 시행 미시행 |해당없음 Alcohol No Yes Drug Allergy No Yes Penicillin Sulfonamide ? Cephalosporin Other 알레르기 No Yes Hypercholesterolemia No Yes Cardiac disease No Yes Old CVA No Yes 말초동맥 및 경동맥 질환 No Yes Coronary artery bypass graft No Yes Others 가족력 계통문진 Generalized Weakness No Easy Fatigue No Fever No Chill No Headache No 00000 Yes Yes Yes Yes Yes Dizziness No Yes Insomnia No Yes 전자서명자: 안철민 세브란스병원 SEVERANCE HOSPITAL 입원기록\n진단명: 받은 분으로 PTA 시행 위해 금일 입원함. V/S 120/70 78 20 Current Sx none 과거력 Hypertension No Yes Pul. Tbc No Yes DM No Yes Hepatitis No Yes Smoking No Yes 금연교육 여부 시행 미시행 |해당없음 Alcohol No Yes Drug Allergy No Yes Penicillin Sulfonamide ? Cephalosporin Other 알레르기 No Yes Hypercholesterolemia No Yes Cardiac disease No Yes Old CVA No Yes 말초동맥 및 경동맥 질환 No Yes Coronary artery bypass graft No Yes Others 가족력 계통문진 Generalized Weakness No Easy Fatigue No Fever No Chill No Headache No 00000 Yes Yes Yes Yes Yes Dizziness No Yes Insomnia No Yes 전자서명자: 안철민 세브란스병원 SEVERANCE HOSPITAL 입원기록\n입원기간: undefined ~ undefined\n\n[미확인] SEVERANCE HOSPITAL 입원기록\n내원일: 미확인\n내원사유: 응급실 내원\n진단명: 미확인\n입원기간: undefined ~ undefined\n\n[미확인] (감염주의 병원) 없음 있음 4. 밀접 접촉자 해당없음 아니오 예 5. 신종 감염병 의심환자 아니오 예 통증평가 통증여부 No Yes 추정진단 PAOD 계획 PTA 고려 퇴원계획 퇴원 후 치료식이 여부 ? N ? Y 추후 관리 계획 |가정간호사업소 호스피스 타 병원 전원 외래 사회 복지서비스 연계 필요성 ? N ? Y 기타 퇴원시 요구사항 치료계획 + Problem Goal 목표일 수정목표일 계획일 부 PAOD PTA\n내원일: 미확인\n내원사유: 및 기간 발열 기간 일전 호흡기증상 기간 일전 소화기증상 기간 일전 해당없음 (미상환자 포함) 2. 최근 1달 이내 방문한나라 해당없음 없음 있음 3. 최근 1달 이내 입원했던 병원 (감염주의 병원) 없음 있음 4. 밀접 접촉자 해당없음 아니오 예 5. 신종 감염병 의심환자 아니오 예 통증평가 통증여부 No Yes 추정진단 PAOD 계획 PTA 고려 퇴원계획 퇴원 후 치료식이 여부 ? N ? Y 추후 관리 계획 |가정간호사업소 호스피스 타 병원 전원 외래 사회 복지서비스 연계 필요성 ? N ? Y 기타 퇴원시 요구사항 치료계획 + Problem Goal 목표일 수정목표일 계획일 부 PAOD PTA\n진단명: PAOD 계획 PTA 고려 퇴원계획 퇴원 후 치료식이 여부 ? N ? Y 추후 관리 계획 |가정간호사업소 호스피스 타 병원 전원 외래 사회 복지서비스 연계 필요성 ? N ? Y 기타 퇴원시 요구사항 치료계획 + Problem Goal 목표일 수정목표일 계획일 부 PAOD PTA\n입원기간: undefined ~ undefined\n특이사항: 퇴원시 요구사항 치료계획 + Problem Goal 목표일 수정목표일 계획일 부 PAOD PTA\n\n[미확인] SEVERANCE HOSPITAL 입원기록\n내원일: 미확인\n내원사유: 응급실 내원\n진단명: 미확인\n입원기간: undefined ~ undefined\n\n[미확인] SEVERANCE HOSPITAL 원본대조필 등록번호: 8633158 주민등록번호: 550112-125**** 남/64세 환자명: 이광욱 경과 [Puncture site assessment]: POD #1 1. Lt.CFA (Proglide) 1) Bleeding/Oozing (-) 2) Hematoma/Color change (-/-) 3) Distal assessment: Color/Pulse/Temperature change (-/-/-) Lt.DPA (2+) 4) Infection sign (-) 5) Puncture site pulse check (2+) 6) Bruit(+)/ Thrill (-) 7) 기존 compressive Dx 제거 후 betadine ball로 소독함. Medress #1로 새로 DX 시행함. +) Pulse examination * 0-absent/1+ diminished/2+ normal/3+ bounding 퇴원 후 천자부위 통증 증가, 부종, 감염의 징후, 말초부위 피부색 변 화, 상처 악화 등이 있을 경우 병원 내원하거나 연락하시도록 환자와 보호자 교육함. 계획 f/u 기록자명 김지영 전담간호사 경과기록\n내원일: 미확인\n내원사유: 응급실 내원\n진단명: 미확인\n입원기간: undefined ~ undefined\n\n[미확인] SEVERANCE HOSPITAL 원본대조필 등록번호: 8633158 주민등록번호: 550112-125**** 남/64세 환자명: 이광욱 연령 구분 분류 영유아기 학령전기 학령기 일반 산모 ㅇ정신 청소년기 성인 현병력 주 증상 및 내원 과정 Hx. DM, HTN, dyslipidemia, Unstable angina, CAOD, (2018.04), s/p CABG(2018.04), Rt. ICA stent insertion(2018.09) PTA 위해 입원함. 복용중인 약 투약 상태 개수 약명 횟수 용법 약품 코드 개수 단위 Aspirin protect [100 mg/1 T 1 PO 아침 식후 D2ASPI01 Glupa (48hr 전후 조영제 1 T 1 PO 아침 식후 D2GLUP02 병용금기) [500 mg/T] Herben [30 mg/T) 1 T 2 PO D2HERBO1 Lipitor [80 mg/T] 1 T 1 PO 아침 식후 D2LIPI12 Lozasartan(원외) [100 1 T 1 PO 아침 식후 DZLOZA02 mg/T] Platless [75 mg/T] 1 T 1 PO 아침 식후 D2PLAT01 Rabiet [10mg/T] 1 T 1 Sigmart [5 mg/T] 1 T 2 22 PO 아침 식전 D2RABI01 PO D2SIGM01 Xigduo XR 10/1000 (원 1 T 1 PO 아침 식후 D2XIGD02 외,48hr 전후 조영제 병용 금기) [1/1] 간호정보조사\n내원일: 미확인\n내원사유: 및 내원 과정 Hx. DM, HTN, dyslipidemia, Unstable angina, CAOD, (2018.04), s/p CABG(2018.04), Rt. ICA stent insertion(2018.09) PTA 위해 입원함. 복용중인 약 투약 상태 개수 약명 횟수 용법 약품 코드 개수 단위 Aspirin protect [100 mg/1 T 1 PO 아침 식후 D2ASPI01 Glupa (48hr 전후 조영제 1 T 1 PO 아침 식후 D2GLUP02 병용금기) [500 mg/T] Herben [30 mg/T) 1 T 2 PO D2HERBO1 Lipitor [80 mg/T] 1 T 1 PO 아침 식후 D2LIPI12 Lozasartan(원외) [100 1 T 1 PO 아침 식후 DZLOZA02 mg/T] Platless [75 mg/T] 1 T 1 PO 아침 식후 D2PLAT01 Rabiet [10mg/T] 1 T 1 Sigmart [5 mg/T] 1 T 2 22 PO 아침 식전 D2RABI01 PO D2SIGM01 Xigduo XR 10/1000 (원 1 T 1 PO 아침 식후 D2XIGD02 외,48hr 전후 조영제 병용 금기) [1/1] 간호정보조사\n진단명: 미확인\n입원기간: undefined ~ undefined\n\n[미확인] SEVERANCE HOSPITAL 2/5 출력일:\n내원일: 미확인\n내원사유: 응급실 내원\n진단명: 미확인\n입원기간: undefined ~ undefined\n특이사항: *이동시 주로 사용하는 보조기를 선택해 주세요. 식사하기 독립적 수행가능 목욕하기 독립적 수행가능 개인 위생 독립적 수행가능 옷입기 독립적 수행가능 화장실 사용 독립적 수행가능 계단 오르기 독립적 수행가능 이동하기 독립적 수행가능(휠체어를 제외한 walking aid 사용 할 수 있음) 이동 하기(의자와 침대간) 독립적 수행가능 이동 하기 (휠체어) 운동 규칙적으로 하는 운동 있음 운동의 종류 걷기 □ 달리기 □ 수영 1등산 골프 기타 운동 횟수 (매일 )회/주 1회 운동 시간 1시간~1시간30 음주력 Onondrinker ex-drinker current drinker 음주력(종류, 양, 횟수/wk) 소주 1병 주 3~4회 음주 시작 시기 20살 끊은 시기 2018.4 흡연력 흡연력 Ononsmoker ex-smoker current smoker 하루의 흡연량 (1)갑/일 흡연 시작시기 20살 끊은 시기 2016년 * 끊은 시기가 1년 이하인 경우 꼭 금연교육을 시행해 주세요. (퇴원전까지) 예방 접종 B형 간염 잘모름 Rubella 잘모름 폐구균 잘모름 영양 상태 1개월간 체중변화 없음 ㅇ 증가함 ㅇ 감소함 체중변화 kg 최근 1주일간 식사량 변화 없음 ㅇ 증가 감소 식이 주의 사항 ) 없음 ㅇ 열량 조절 ㅇ 체중 조절 ㅇ 염분 제한 ○ 수분 제한 ○ 단백질 제한 ㅇ 지방 제한 기타 식습관 식사횟수 3회/일 편식 습관 무 선호 음식 기피 음식 수면 상태 전자서명자: 김은경 세브란스병원 SEVERANCE HOSPITAL 2/5 출력일:\n\n[미확인] 요양시설 기타 퇴원 예정 교통 수단(Discharge transportation) 자가 대중 교통 항공 □ 구급차 |기타 일반 정보(6세 이상) 교육 정도 고등졸 결혼 상태 결혼 직업 사무직 원목 연락 전화번호\n내원일: 미확인\n내원사유: 응급실 내원\n진단명: 미확인\n입원기간: undefined ~ undefined\n특이사항: 퇴원 예정지 ?자택 친척집 타병원 요양시설 기타 퇴원 예정 교통 수단(Discharge transportation) 자가 대중 교통 항공 □ 구급차 |기타 일반 정보(6세 이상) 교육 정도 고등졸 결혼 상태 결혼 직업 사무직 원목 연락 전화번호\n\n[미확인] 미확인 의료기관\n내원일: 미확인\n내원사유: 응급실 내원\n진단명: 미확인\n입원기간: undefined ~ undefined\n\n[미확인] 미확인 의료기관\n내원일: 미확인\n내원사유: (*) Diabetes mellitus other, without complication; Diabetes mellitus type 2, without complication;Diabetic polyneuropathy;Internal carotid artery stenosis;Internal carotid artery stenosis, right;Type 2 diabetes mellitus, coronary artery disease; E11.58;E11.9;E13.9;E14.41;165.2; C.C F/UDSA 과거력 및 현재병력 상기 64세 남환 HTN, DM, CAOD (2vd, s/p CAG), PAOD s/p PTA 과거력 있는분으로 2018.04 CABG 위해 Rt ICA stenosis 로 신경과 협진 후 CD 상 Rt. ICA 75~99% stenosis 있어\n진단명: (*) 순서 순 한국질병 구분 확진 진단명 분류번호 1 주진단 확진 Internal carotid artery stenosis 165.2 과거진단명 과거진단코드 주호소 (*) Diabetes mellitus other, without complication; Diabetes mellitus type 2, without complication;Diabetic polyneuropathy;Internal carotid artery stenosis;Internal carotid artery stenosis, right;Type 2 diabetes mellitus, coronary artery disease; E11.58;E11.9;E13.9;E14.41;165.2; C.C F/UDSA 과거력 및 현재병력 상기 64세 남환 HTN, DM, CAOD (2vd, s/p CAG), PAOD s/p PTA 과거력 있는분으로 2018.04 CABG 위해 Rt ICA stenosis 로 신경과 협진 후 CD 상 Rt. ICA 75~99% stenosis 있어\n입원기간: undefined ~ undefined\n\n[미확인] SEVERANCE HOSPITAL (1) Mental status & Mental function -Mental status: alert -Mental function: all preserved - Orientation Time/Place/Person: +/+/+ - Language Fluency: intact -Comprehension: intact - Reading: intact Writing: intact - Naming intact Repetition: intact (2) Cranial nerve Function: -Isocoria 3mm/3mmcPLR (+/+) -No EOM limitation s nystagmus -No Visual field defect by confrontation test -No facial palsy s sensory change -Gag reflex: ok -No tongue deviation / No uvula deviation 퇴원요약\n내원일: 미확인\n내원사유: 응급실 내원\n진단명: 미확인\n입원기간: undefined ~ undefined\n특이사항: ## neurologic exam 전자서명자: 남효석 세브란스병원 SEVERANCE HOSPITAL (1) Mental status & Mental function -Mental status: alert -Mental function: all preserved - Orientation Time/Place/Person: +/+/+ - Language Fluency: intact -Comprehension: intact - Reading: intact Writing: intact - Naming intact Repetition: intact (2) Cranial nerve Function: -Isocoria 3mm/3mmcPLR (+/+) -No EOM limitation s nystagmus -No Visual field defect by confrontation test -No facial palsy s sensory change -Gag reflex: ok -No tongue deviation / No uvula deviation 퇴원요약\n\n[미확인] SEVERANCE HOSPITAL 퇴원요약\n내원일: 미확인\n내원사유: 응급실 내원\n진단명: 미확인\n입원기간: undefined ~ undefined\n특이사항: 퇴원약 약품명 (Name) 용량(Dose) 일수(Days) 아스피린프로텍트 100 정100mg 용법(Direction) 지참약 계속 복 용) 처방 분류 (Type) 퇴원지참약 효능 헤르벤정 30mg 30 지참약 계속 복 용) 퇴원지참약 리피토정80mg 80 지참약 계속 복 용) 퇴원지참약 플래리스정 75 지참약 계속 복 용) 퇴원지참약 라비에트정10mg 10 지참약 계속 복 용) 퇴원지참약 중외시그마트정 5mg 5 지참약 (계속 복 용) 퇴원지참약 코자정100mg 100 지참약 계속 복 용) 퇴원지참약 트라젠타정 5 지참약 (계속 복 용) 퇴원지참약 직듀오서방정 10/1000 1 지참약 계속 복 용) 퇴원지참약 담당 전공의사명 옥태동 기록자명 옥태동 주치의사명 남효석 전자서명자: 남효석 세브란스병원 SEVERANCE HOSPITAL 퇴원요약\n\n[미확인] SEVERANCE HOSPITAL 입원기록\n내원일: 미확인\n내원사유: 응급실 내원\n진단명: 미확인\n입원기간: undefined ~ undefined\n\n[미확인] (감염주의 병원) 없음 있음 4. 밀접 접촉자 해당없음 아니오 예 5. 신종 감염병 의심환자 아니오 통증평가 통증여부 No Yes 계획 추정진단 Rt ICA stenosis s/p stent insertion F/U DSA 퇴원계획 퇴원 후 치료식이 여부 ? N 추후 관리 계획 |가정간호사업소 호스피스 타 병원 전원 √ 외래 사회 복지서비스 연계 필요성 ? N 기타 퇴원시 요구사항 치료계획 + Problem Goal 부 stenosis 목표일 수정목표일 계획일 E cerebral or carotid artery 뇌혈관 촬영을 통하여\n내원일: 미확인\n내원사유: 기간 일전 소화기증상 기간 해당없음 (미상환자 포함) 일전 2. 최근 1달 이내 방문한나라 해당없음 없음 있음 3. 최근 1달 이내 입원했던병원 (감염주의 병원) 없음 있음 4. 밀접 접촉자 해당없음 아니오 예 5. 신종 감염병 의심환자 아니오 통증평가 통증여부 No Yes 계획 추정진단 Rt ICA stenosis s/p stent insertion F/U DSA 퇴원계획 퇴원 후 치료식이 여부 ? N 추후 관리 계획 |가정간호사업소 호스피스 타 병원 전원 √ 외래 사회 복지서비스 연계 필요성 ? N 기타 퇴원시 요구사항 치료계획 + Problem Goal 부 stenosis 목표일 수정목표일 계획일 E cerebral or carotid artery 뇌혈관 촬영을 통하여\n진단명: Rt ICA stenosis s/p stent insertion F/U DSA 퇴원계획 퇴원 후 치료식이 여부 ? N 추후 관리 계획 |가정간호사업소 호스피스 타 병원 전원 √ 외래 사회 복지서비스 연계 필요성 ? N 기타 퇴원시 요구사항 치료계획 + Problem Goal 부 stenosis 목표일 수정목표일 계획일 E cerebral or carotid artery 뇌혈관 촬영을 통하여\n입원기간: undefined ~ undefined\n특이사항: 퇴원시 요구사항 치료계획 + Problem Goal 부 stenosis 목표일 수정목표일 계획일 E cerebral or carotid artery 뇌혈관 촬영을 통하여\n\n[미확인] SEVERANCE HOSPITAL PR: pulse rate Pul. Tbc pulmonary tuberculosis RHB regular heart beat 입원기록\n내원일: 미확인\n내원사유: 응급실 내원\n진단명: 미확인\n입원기간: undefined ~ undefined\n\n[미확인] 미확인 의료기관\n내원일: 미확인\n내원사유: 및 내원 과정 follow up DSA(9/5 DSA(stent fu&4-vessel)) [외래->입원] 복용중인 약 ㅇ 무 유 투약 상태 개수 약명 횟수 용법 약품 코드 개수 단위 Aspirin protect [100 mg/1 T 1 PO Cozaar [100 mg/T] 1 T 1 PO Herben [30mg/T] 1 T 2 PO D2ASPI01 D2COZA03 D2HERBO1 Lipitor [80 mg/T] 1 T 1 PO D2LIPI12 Platless [75 mg/T] 1 T 1 PO D2PLAT01 Rabiet [10mg/T] 1 T 1 PO D2RABI01 Sigmart [5 mg/T] 1 T 2 PO D2SIGM01 Trajenta [5mg/T] 1 T 1 PO D2TRAJ01 Xigduo XR 10/1000 (원 1 T 1 PO D2XIGD02 |외 48hr 전후 조영제 병용 금기) [1T/T] 간호정보조사\n진단명: 미확인\n입원기간: undefined ~ undefined\n\n[미확인] 원본대조필 SEVERANCE HOSPITAL 등록번호: 8633158 주민등록번호: 550112-125****남/64세 환자명: 이광욱 Allergy 없음 약 □ 음식 기능 평가 일상생활(ADL) 수행 능력 독립적 수행 ○ 부분 보조 필요 완전 보조 보조기(이동) 사용 없음 ○ 목발 ㅇ 지팡이 Owalker ○ 휠체어 기타 ?이동시 주로 사용하는 보조기를 선택해 주세요. 식사하기 독립적 수행가능 개인 위생 독립적 수행가능 목욕하기 독립적 수행가능 옷입기 독립적 수행가능 화장실 사용 독립적 수행가능 계단 오르기 독립적 수행가능 이동하기 독립적 수행가능(휠체어를 제외한 walking aid 사용 할 수 있음) 이동하기(의자와 침대간) 독립적 수행가능 이동하기 (휠체어) 운동 규칙적으로 하는 운동 없음 운동의 종류 □ 걷기 달리기 □ 수영 등산 골프 기타 운동 횟수 1회/주 1회 운동 시간 음주력 ㅇnondrinker ex-drinker current drinker 음주력(종류, 양, 횟수/wk) 소주 1병 / 주 3~4회 음주 시작 시기 20살 끊은 시기 2018.4 흡연력 흡연력 Ononsmoker ex-smoker current smoker 하루의 흡연량 (1)갑/일 흡연 시작시기 20살 * 끊은 시기 2016년 끊은 시기가 1년 이하인 경우 꼭 금연교육을 시행해 주세요. (퇴원전까지) 간호정보조사\n내원일: 미확인\n내원사유: 응급실 내원\n진단명: 미확인\n입원기간: undefined ~ undefined\n특이사항: ?이동시 주로 사용하는 보조기를 선택해 주세요. 식사하기 독립적 수행가능 개인 위생 독립적 수행가능 목욕하기 독립적 수행가능 옷입기 독립적 수행가능 화장실 사용 독립적 수행가능 계단 오르기 독립적 수행가능 이동하기 독립적 수행가능(휠체어를 제외한 walking aid 사용 할 수 있음) 이동하기(의자와 침대간) 독립적 수행가능 이동하기 (휠체어) 운동 규칙적으로 하는 운동 없음 운동의 종류 □ 걷기 달리기 □ 수영 등산 골프 기타 운동 횟수 1회/주 1회 운동 시간 음주력 ㅇnondrinker ex-drinker current drinker 음주력(종류, 양, 횟수/wk) 소주 1병 / 주 3~4회 음주 시작 시기 20살 끊은 시기 2018.4 흡연력 흡연력 Ononsmoker ex-smoker current smoker 하루의 흡연량 (1)갑/일 흡연 시작시기 20살 * 끊은 시기 2016년 끊은 시기가 1년 이하인 경우 꼭 금연교육을 시행해 주세요. (퇴원전까지) 간호정보조사\n\n[미확인] 요양시설 기타 퇴원 예정 교통 수단(Discharge transportation) √ 자가 일반 정보(6세 이상) 대중교통 항공 □ 구급차 | 기타 교육 정도 고등졸 결혼 상태 결혼 전화번호\n내원일: 미확인\n내원사유: 응급실 내원\n진단명: 미확인\n입원기간: undefined ~ undefined\n특이사항: 퇴원 예정지 자택 ㅇ 친척집 타병원 요양시설 기타 퇴원 예정 교통 수단(Discharge transportation) √ 자가 일반 정보(6세 이상) 대중교통 항공 □ 구급차 | 기타 교육 정도 고등졸 결혼 상태 결혼 전화번호\n\n[미확인] &약국 연세대학교의과대학세브란스병원 입원(외래)일수 0(13) 총진료비(건강보 2,488,930 빈경환 험적용분) 건강보험 등 혜택 970,830 받은 금액\n내원일: 미확인\n내원사유: 응급실 내원\n진단명: 미확인\n입원기간: undefined ~ undefined\n\n[미확인] 오류 타 노년백 내장, 오른 쪽 1 1,179,290 944,190 235,100 (양방)기 의료법인 세경 타 의심되 50\n내원일: 미확인\n내원사유: 응급실 내원\n진단명: 미확인\n입원기간: undefined ~ undefined\n\n■ 보험 청구 이력 (Insurance Claims)\nNaN\n[2003.12.08] 미확인 보험사\n청구일: 2003.12.08\n진단명: 미확인\n지급일: 미확인\n상태: 처리 중\n특이사항: [ ] 발급일 일 모집인(면담자): 김선형 출금금융기관명 국민카드 출금계좌(카드)번호\n\n[미확인] 미확인 보험사\n청구일: 미확인\n진단명: . 장해, 사고 후 보험가입 등)는 형법상 금지된 범죄입니다. 구분! 계약자 자 i 필서명 필: 성명 이조훈 주피보험자 종피보험자 1 종피보험자2 종피보험자3 종피보험자4 종피보험자5 이광욱 법정대리인(친권자) 관 서명 이조훈 이광욱 * 가입자보관용 청약서상에 자필서명하셨습니까? 예 = 아니오 * 보험계약자 또는 피보험자가 미성년자인 경우 법정대리인이 서명하여 주시기 바랍니다. *피보험자(보험대상자 본인이 자필서명을 하지 않으신 경우에는 보험계약이 무효가 되어 보장을 받지 못할 수도 있습니다 *계약의 보장개시 효력은 1회 보험료를 납입하신 때부터입니다. 뒷면의 꼭 아셔야 할 사항을 반드시 확인하시기 바랍니다. ※안내장 발송(7 동의 동의안함 * 안내장 발송형태(ㄷ 모바일 안내장 E-Mail/E-Ma주소 ※약관을 모바일(문자)를 통해 수련하는 것에 대한 동의여부{V 동의 [동의안함) ※본인수의자 지정 변경 관련 추가약정( 5 약정함 이조훈 (서명) 약정하지 아니함 (약정함을 선택한 경우) 본인(보험계약자)이 사망한 경우에는 상속인 등 승계인이 보험수익자 지정·변경권을 행사합니다 부) ※(대상: 피보험자) 의료급여 수급권자 보험료 할인 신청 ( = 여 -자격취득일로부터 실손의료비 보장 보험계약의 매회 납입할 보장종목별 보장보험료의 5%를 할인하여 드립니다. ※청약유효일자: 2024 10-31 까지 LW\n지급일: 미확인\n상태: 처리 중\n\n[미확인] 미확인 보험사\n청구일: 미확인\n진단명: (MR/MRA)으로 인하여 발생한 비급여 의료비(조영제 판독료를 포함합니다). 4. 제11호. 제 -2호, 제3호와 관련하여 자동차보험(공제 포함) 또는 산재보험에서 발생한 본인부담의료비 모집점 금촌농협 모집자 김선형 (\n지급일: 미확인\n상태: 처리 중\n특이사항: 과 관련이 없는 검사비용 간별비 9 자동차보험(공제 포함)에서 보상받는 치료관계비(과실상계 후 금액 기준) 또는 산재보험 에서 보상받는 의료비 'C 「국민건강보험법 제42조의 요양기관이 아닌 외국에 있는 의료기관에서 발생한 의료비 11 도수치료 체외충격파치료 증식치료로 인하여 발생한 비급여 의료비 '2 비급여 주사료.3 자기공명영상진단(MR/MRA)으로 인하여 발생한 비급여 의료비(조영제 판독료를 포함합니다). 4. 제11호. 제 -2호, 제3호와 관련하여 자동차보험(공제 포함) 또는 산재보험에서 발생한 본인부담의료비 모집점 금촌농협 모집자 김선형 (\n\n[미확인] 미확인 보험사\n청구일: 미확인\n진단명: (MRI/MRA)으로 인하여 발생한 비급여 의료비(조영제, 판독료를 포함합니다) 15 제2호 제: 3호, 제4호와 관련하여 자동차보험(공제 포함) 또는 산재보험에서 발생한 본인부담의료비 모집점 금촌농협 모집자 김선형 (\n지급일: 미확인\n상태: 처리 중\n특이사항: 과 관련이 없는 검사비용. 간병비 9. 자동차보험(공제 포함)에서 보상받는 치료관계비(과실상계 후 금액 기준) 또는 산재보험에서 보상 받는 의료비 10 「국민건강보험법 제42조의 요양기관이 아닌 외국에 있는 의료기관에서 발생한 의료비 11 「응급의료에 관한 법률 및 동 시행규칙에서 정한 응급환자에 해당하지 않는 자가 「의료법 제3조의4에 따른 상급종합병원 응급실을 이용하면서 발생한 응급의료관리료 12. 도수치료 체외충격파치료 증식치료 로 인하여 발생한 비급여 의료비 13 비급여 주사료 14 자기공명영상진단(MRI/MRA)으로 인하여 발생한 비급여 의료비(조영제, 판독료를 포함합니다) 15 제2호 제: 3호, 제4호와 관련하여 자동차보험(공제 포함) 또는 산재보험에서 발생한 본인부담의료비 모집점 금촌농협 모집자 김선형 (\n\n[미확인] 미확인 보험사\n청구일: 미확인\n진단명: {MR/MRA}으로 인하여 발생한 비급여의료비(조영제 판독료를 포함합니다) 17 제4호, 제15호 제16호와 관련하여 자동차보험(공제 포함) 또는 산재보험에서 발 생한 본인부담의료비 |제도성특약 및 기타사항 보험료 자동납입 자동갱신적용대상 유의사항 제도성 특약 및 기타사항 ⓒ 상기 보장사항의 세부적인 내용은 약관 및 관계 법령을 따릅니다. 불완전판매율 구분 김선형 모집자 업권 평균 손보 생보 0.00 % - % 0.02 % 0.06 % 모집점 모집자 금촌농협 김선형 연락처 (\n지급일: 미확인\n상태: 처리 중\n특이사항: 사항 보험료 자동납입 자동갱신적용대상 유의사항 제도성 특약 및 기타사항 ⓒ 상기 보장사항의 세부적인 내용은 약관 및 관계 법령을 따릅니다. 불완전판매율 구분 김선형 모집자 업권 평균 손보 생보 0.00 % - % 0.02 % 0.06 % 모집점 모집자 금촌농협 김선형 연락처 (; 과 관련이 없는 검사비용, 간 병비 10 산재보험에서 보상받는 의료비 11 사람면역결핍바이러스(HIV) 감염으로 인한 치료비+2 「국민건강보험법 제42조의 요양기관이 아닌 외국에 있는 의 '료기관에서 발생한 의료비 13 「움급의료에 관한 법률 및 동 시행규칙에서 정한 응급환자에 해당하지 않는 자가 「의료법 제3조의4에 따른 상급종합병원 응급실 을 이용하면서 발생한 응급의료관리료 14 도수치료 체외충격파치료·증식치료로 인하여 발생한 비급여의료비 15 비급여 주사료 16. 자기공명영상진단 {MR/MRA}으로 인하여 발생한 비급여의료비(조영제 판독료를 포함합니다) 17 제4호, 제15호 제16호와 관련하여 자동차보험(공제 포함) 또는 산재보험에서 발 생한 본인부담의료비 |제도성특약 및 기타사항 보험료 자동납입 자동갱신적용대상 유의사항 제도성 특약 및 기타사항 ⓒ 상기 보장사항의 세부적인 내용은 약관 및 관계 법령을 따릅니다. 불완전판매율 구분 김선형 모집자 업권 평균 손보 생보 0.00 % - % 0.02 % 0.06 % 모집점 모집자 금촌농협 김선형 연락처 (\n\n[미확인] 미확인 보험사\n청구일: 미확인\n진단명: 을 지원하는 계약, 보험기간(보장기간)이 90일 이내인 계약, 법률에 따라 가입의무 부과 및 해제·해지가 가능한 보험 (다만, 계약자가 동종의 다른 보험에 가입한 경우는 제외)은 청약을 철회할 수 없습니다. 5 화재손해특약은 계약 체결시에 보험에 가입한 물건의 가치(이하 '보험가액'이라 합니다)를 평가하지 않고 사고시 보험가액을 산정하여 보험가입 금액을 한도로 보상하는 미평가 보험입니다. 보험가입금액은 시가와 똑같이 정해야 합니다. 만약 시가보다 낮게 정하면 납입보험료 부담은 줄어 들지만 사고가 발생하였을 때 줄어든 비율만큼 적게 보상받고 높게 정하더라도 사고가 발생하면 실제로 입은 손해액만큼 보상받게 됩니다. 6 가재도구를 보험에 가입할 경우 귀금속. 귀중품(무게나 부피가 휴대할 수 있으며 점당 300만원이상). 골동품 등은 별도로 기재하여야만 보상의 대상이 됩니다. · 약관의 보상하는 손해와 보상하지 아니하는 손해를 확인하셔야 합니다. ※ 보험금 수익자의 지정에 관한 사항 계약자는 사망보험금, 중도보험금, 만기보험금, 장해보험금, 입원보험금 등 약관상 보험금 지급사유가 발생하는 때에 회사에 보험금을 청구하여 받을 수 있는 사람(보험수익자)을 지정하실 수 있습니다. 사망보험금 수익자를 지점/변경하고자 할 경우에는 사망보험금 지급사유가 발생하기 전에 피보험자가 서면으로 동의해야 합니다. 만약 계약자가 보험 수익자를 지정하지 않은 때에는 민법상 피보험자의 법정상속인 순위로 보험수익자를 정합니다. 민법상 법정상속인 순위 : 1. 직계비속. 2. 직계존속. 3. 형제자매. 4. 4촌 이내의 방계 혈족 배우자는 위의 1. 2순위 상속인이 있는 경우에 그 상속인과 동순위로 공동상속인이 되고, 그 상속인이 없는 때에는 단독상속인이 됨 (수익자 지정/변경 등에 필요한}구비서류 : (계약자 및 피보험자와 변경 후 수익자) 각 신분증 [수역자 지정 관련 문의 : 콜센터(1644-9000)] ☞ 보험에 가입하신 후 d. 보험증권을 받으시면 청약서 내용과 다름이 없는 지 또는 누락이 없는 지 확인하시기 바랍니다. 1 청약서 기재사항에 변동사항(피보험자의 직업 및 직무의 변경, 보험목적의 양도, 건물 구조 또는 용도의 변경, 보험목적을 다른 장소로 옮기는 경우, 수리하는 경우 등)이 있거나 다른 보험에 가입하실 경우 회사에 즉시 연락하시기 바랍니다. 3 보험계약의 내용을 변경하고자 할 경우에는 회사의 승낙을 얻어야 합니다. 4 손해가 생긴 경우에는 지체없이 이를 회사에 알려서 필요한 절차를 안내 받으시기 바랍니다. 5 보험금 지급사유의 조사 및 확인을 위하여 보험금 지급기일 초과가 명백히 예상되는 경우에는 피보험자 또는 수익자의 청구에 따라 회사가 추정 하는 보험금의 50% 상당액을 가지급보험금으로 지급하여 드립니다. [ 실손의료비를 가입하신 경우 이 보험계약에서 보장하는 실손의료비는 동 비용을 담보하는 다수의 보험계약에 체결되어 있는 경우, 약관에 따라 비례하여 보상합니다. 다만, 이미 가입된 보험 계약에서 보상한 금액이 본인이 부담한 의료비를 초과하였을 때에는 보험금이 지급되지 않을 수 있습니다. ( 갱신형 실손의료비 특별약관은 기본계약 보험기간 이내에서 매 1년마다 자동갱신되며, 갱신시 연령의 증가와 적용요율 등의 변동에 따라 보험료가 달라 질 수 있으며, 보험료 인상시에는 추가납입 하여야 계약이 유지됩니다. 3 피보험자가 동일한 회사에 보험기간이 3개월 이상인 해외실손의료비에 가입하고, 연속하여 3개월이상의 해외 체류사실이 확인되는 경우 실손의료보험의 보험료납입을 일정기간 중지해주거나 사후에 해당 기간의 표준화실손상품(\n지급일: 미확인\n상태: 처리 중\n\n[2009.10.01] 미확인 보험사\n청구일: 2009.10.01\n진단명: 을 지원하는 계약, 보험기간(보장기 간)이 90일 이내인 계약, 법률에 따라 가입의무 부과 및 해제·해지가 가능한 보험(다만, 계약자가 동종의 다른 보험에 가입한 경우는 제외) 은 청약을 철회할 수 없습니다. 2. 저희 회사는 청약철회 청구서를 접수한 경우 지체없이 이미 납입한 보험료를 돌려드립니다. 3. 청약철회 청구서를 발송한 날 이후(발송일 포함)에 발생한 보험금 지급사유에 대해서는 회사가 책임을 지지 아니하며, 입금처의 거래은행 예금주는 계약자와 동일해야 합니다. ※콜센터 유선신청, 우편신청 또는 인터넷 신청 등에 의하여도 가능합니다. 모집점 모집자 금촌농협 김선형 (\n지급일: 미확인\n상태: 처리 중\n\n[미확인] 미확인 보험사\n청구일: 미확인\n진단명: 또는 치료 사실 등 중요한 내용을 (알릴의무) 구두 로만 알릴 경우 계약전 알릴 의무를 이행한 것으로 인정되지 않아 향후 계약이 해지 되거나 보험금을 (구두) (해지) 지급받지 못할 수 있습니다. ?보험계약자 이조훈 (은)는 보험모집자 김선형 (으)로부터 계약전 알릴의무 위반시의 효과(계약해지, 보장제한, 보험금 미지급 등)에 대해 설명을 들었으며, 계약전 알릴의무 사항에 대해 청약서에 사실대로 기재하였음을 확인합니다. 위의 각 계약 전 알릴 의무 사항에 대한 하며, 보험계약자 및 피보험자(보험대상자) 본인이 직접 답변 내용은 사실과 일치 (답변내용은 사실과 일치) 작성하였음을 확인합니다. 또한 회사가 위 사항과 관련하여 필요시에는 별도의 확인을 할 수 있으며 의사에게 본인의 질병 등의 건강 상태를 조회하거나 열람토록 하는것에 동의합니다. 자필서명 구분 보험계약자 피보험자 성명 이조훈 이광욱 서명 이조훈 법정대리인 1 (친권자) 관계 법정대리인 2(친권자) 관계 법정대리인(친권자) 1인이 서명한 경우 본인은 다른 법정대리인(친권자) 1인과 합의하에 공동으로 친권을 행사합니다. 이관욱 피보험자(보험대상자) 본인이 자필서명을 하지 않으신 경우에는 보험계약이 무효가 되어 보장을 받지 못할 수도 있습니다. 보험계약자 또는 피보험자(보험대상자)가 미성년자인 경우 법정대리인이 서명하여 주시기 바랍니다. LW\n지급일: 미확인\n상태: 처리 중\n\n[2025.03.19] 미확인 보험사\n청구일: 2025.03.19\n진단명: 미확인\n지급일: 미확인\n상태: 처리 중\n\n[미확인] 미확인 보험사\n청구일: 미확인\n진단명: 미확인\n지급일: 미확인\n상태: 처리 중\n특이사항: 가 아닌 증빙자료로 사용할 수 없으며, 이용에 관한 책임은 이용자에게 있습니다. 1/10 빈경환\n\n[미확인] 미확인 보험사\n청구일: 미확인\n진단명: 미확인\n지급일: 미확인\n상태: 처리 중\n특이사항: 가 아닌 증빙자료로 사용할 수 없으며, 이용에 관한 책임은 이용자에게 있습니다. 빈경환 2/10\n\n[미확인] 미확인 보험사\n청구일: 미확인\n진단명: 미확인\n지급일: 미확인\n상태: 처리 중\n특이사항: 가 아닌 증빙자료로 사용할 수 없으며, 이용에 관한 책임은 이용자에게 있습니다. 3/10 빈경환\n\n[미확인] 미확인 보험사\n청구일: 미확인\n진단명: 미확인\n지급일: 미확인\n상태: 처리 중\n특이사항: 가 아닌 증빙자료로 사용할 수 없으며, 이용에 관한 책임은 이용자에게 있습니다. 4/10\n\n[미확인] 미확인 보험사\n청구일: 미확인\n진단명: 미확인\n지급일: 미확인\n상태: 처리 중\n특이사항: 가 아닌 증빙자료로 사용할 수 없으며, 이용에 관한 책임은 이용자에게 있습니다. 5/10\n\n[미확인] 미확인 보험사\n청구일: 미확인\n진단명: 미확인\n지급일: 미확인\n상태: 처리 중\n특이사항: 가 아닌 증빙자료로 사용할 수 없으며, 이용에 관한 책임은 이용자에게 있습니다. 빈경환 6/10\n\n[미확인] 미확인 보험사\n청구일: 미확인\n진단명: 미확인\n지급일: 미확인\n상태: 처리 중\n특이사항: 가 아닌 증빙자료로 사용할 수 없으며, 이용에 관한 책임은 이용자에게 있습니다. 7/10 빈경환\n\n[미확인] 미확인 보험사\n청구일: 미확인\n진단명: 미확인\n지급일: 미확인\n상태: 처리 중\n특이사항: 가 아닌 증빙자료로 사용할 수 없으며, 이용에 관한 책임은 이용자에게 있습니다. 8/10 빈경환\n\n[미확인] 미확인 보험사\n청구일: 미확인\n진단명: 미확인\n지급일: 미확인\n상태: 처리 중\n특이사항: 가 아닌 증빙자료로 사용할 수 없으며, 이용에 관한 책임은 이용자에게 있습니다. 빈경환 9/10 외래 코드 일수(건강보험 적용분) 혜택받은 금액| (진료비) 100\n\n[미확인] 미확인 보험사\n청구일: 미확인\n진단명: 미확인\n지급일: 미확인\n상태: 처리 중\n특이사항: 가 아닌 증빙자료로 사용할 수 없으며, 이용에 관한 책임은 이용자에게 있습니다.\n\n■ 종합 소견 (Summary)\nNaN\n총 진료 기록: 287건\n진료 기간: 2003.12.08 ~ 미확인\n주요 진단명: 을 지원하는 계약, 보험기간(보장기 간)이 90일 이내인 계약, 법률에 따라 가입의무 부과 및 해제·해지가 가능한 보험(다만, 계약자가 동종의 다른 보험에 가입한 경우는 제외) 은 청약을 철회할 수 없습니다. 2. 저희 회사는 청약철회 청구서를 접수한 경우 지체없이 이미 납입한 보험료를 돌려드립니다. 3. 청약철회 청구서를 발송한 날 이후(발송일 포함)에 발생한 보험금 지급사유에 대해서는 회사가 책임을 지지 아니하며, 입금처의 거래은행 예금주는 계약자와 동일해야 합니다. ※콜센터 유선신청, 우편신청 또는 인터넷 신청 등에 의하여도 가능합니다. 모집점 모집자 금촌농협 김선형 (, 또는 치료 사실 등 중요한 내용을 (알릴의무) 구두 로만 알릴 경우 계약전 알릴 의무를 이행한 것으로 인정되지 않아 향후 계약이 해지 되거나 보험금을 (구두) (해지) 지급받지 못할 수 있습니다. ?보험계약자 이조훈 (은)는 보험모집자 김선형 (으)로부터 계약전 알릴의무 위반시의 효과(계약해지, 보장제한, 보험금 미지급 등)에 대해 설명을 들었으며, 계약전 알릴의무 사항에 대해 청약서에 사실대로 기재하였음을 확인합니다. 위의 각 계약 전 알릴 의무 사항에 대한 하며, 보험계약자 및 피보험자(보험대상자) 본인이 직접 답변 내용은 사실과 일치 (답변내용은 사실과 일치) 작성하였음을 확인합니다. 또한 회사가 위 사항과 관련하여 필요시에는 별도의 확인을 할 수 있으며 의사에게 본인의 질병 등의 건강 상태를 조회하거나 열람토록 하는것에 동의합니다. 자필서명 구분 보험계약자 피보험자 성명 이조훈 이광욱 서명 이조훈 법정대리인 1 (친권자) 관계 법정대리인 2(친권자) 관계 법정대리인(친권자) 1인이 서명한 경우 본인은 다른 법정대리인(친권자) 1인과 합의하에 공동으로 친권을 행사합니다. 이관욱 피보험자(보험대상자) 본인이 자필서명을 하지 않으신 경우에는 보험계약이 무효가 되어 보장을 받지 못할 수도 있습니다. 보험계약자 또는 피보험자(보험대상자)가 미성년자인 경우 법정대리인이 서명하여 주시기 바랍니다. LW, 구분 확진 CAD(2vd+ LM) s/p CAG (2018.04, 일산백) s/p 4OPCAB(LIMA to dLAD, to OM(seq) to DG with RIMA composite Y, Aorta to rPL with RA) (, 확진 Diabetes mellitus type 2 with dyslipidemia 기타진단 확진 Thyroid nodule 기타진단 확진 Internal carotid artery stenosis 기록자명 강은석 진단명 외래재진기록, 구분 확진 주진단 기타진단 기타진단 확진 확진 확진 BP(D) mmHg chest pain / discomfort (-/-) dyspnea / DOE (-/-) palpitation (-) functional capacity >4METS 잘지냈다. 증상없음 PAD, S/P PTA\n주요 소견:\n  - 총 25회 입원 이력\n  - 총 19건 보험 청구 이력\n\nNaN\n보고서 생성 완료 - 2025. 8. 17. 오후 10:28:28\nNaN",
    "reportMetadata": {
      "generatedAt": "2025-08-17T13:28:28.100Z",
      "format": "text",
      "totalSections": 10,
      "recordCount": 374
    },
    "statistics": {
      "originalLength": 148119,
      "processedLength": 137007,
      "recordsFound": 305,
      "insuranceCount": 34,
      "timelineEvents": 305
    },
    "processingTime": 1755437308101
  }
}