{
  "caseNumber": 12,
  "timestamp": "2025-08-17T13:28:28.469Z",
  "detailedResult": {
    "caseNumber": 12,
    "hasReportFile": true,
    "processingTime": 19,
    "success": true,
    "validation": {
      "hasPatientInfo": true,
      "hasValidName": true,
      "hasMedicalRecords": true,
      "hasInsuranceInfo": true,
      "noNaNValues": false,
      "processingSuccess": true,
      "overallScore": 0.8333333333333334
    },
    "patientInfo": {
      "patientName": "발급목적",
      "birthDate": "1971-10-24",
      "registrationNumber": "711024"
    },
    "medicalRecordsCount": 69,
    "insuranceInfoCount": 5,
    "hospitalizationCount": 21,
    "testResultsCount": 0,
    "nanIssues": {
      "hasNaN": true,
      "locations": [
        ".progressReport"
      ]
    },
    "memoryUsage": {
      "rss": 70602752,
      "heapTotal": 31883264,
      "heapUsed": 20981528,
      "external": 1815551,
      "arrayBuffers": 10515
    }
  },
  "fullResult": {
    "success": true,
    "normalizedReport": {
      "header": {
        "patientName": "발급목적",
        "birthDate": "1971-10-24",
        "registrationNumber": "711024"
      },
      "insuranceConditions": [
        {
          "conditionNumber": 1,
          "company": ", 7) 위탁여부, 8)기타 24.03.27 1. 사고)경우( 25.02.20. 봄익병원 → 이대목동서 빈경환 1월 말 빈혈 증상으로 전남대시. 수혈 시행 명절 방문. 다른 화면. 주변에서 병원 방식을 요구 거부. 형제들과 같이 붙어서 노뜬 검사 (간경화 진단) 진료의뢰→ 이라서 입원 ICV. 입원 2일경 간경화 - 위장관 출력을 직접 사안으로 사망. 김민성 (아드님). 따님(19세). 대표 박사 김민성님 지능.. 2. 수익자 배우자님 이는 2019년 정도. 당시 간질환등 알고 있는 기저질의 X. 건강하시고 병원을 잘안가신. 답변자 SUNRISE SURVEYORS & CLAIMS ADJUSTERS CO., LTD. (인) 2025-02-28 17:30:27 3. 다"
        },
        {
          "conditionNumber": 2,
          "company": "미래에셋. 종신. - 접수 실상 대기다 4. 직업직무 청약시 - 지영업 사그림사 회사원 5. 식인수중상한제 청구-이대목동 영광클립해 나원→ 진료우리→ 전남대병원. 이효구- 봉익병원. 상기의 내용은 신의 성실에 입각하여 사실대로 기재하였음을 확인하며 아래에 서명 및 날인 합니다. 빈경환 답변일자 : 2025.3.02 답변장소 : 답변자 : 김민성 김민성 피("
        },
        {
          "conditionNumber": 3,
          "company": "발급일 2025-03-10 매수 21 발급자 황재호 10 첨부한 사본은 의무기록 원본과 같음을 증명합니다. EWHAN 이화여자대학교, ? EU 0 CENTER *상기용도 이외에는 이 사본을 사용할 수 없으며, 사용용도 또는 사용기간이 완료 된 후 즉시 파본, 폐기하여야 합니다. INS XMED * 검사결과가 나오지 않은 것은 사본발급 되지 않습니다. 이화여자대학교 의과대학부속 목동병원장 (07985) 서울특별시 양천구 안양천로 1071 EUMC 이대목동병원 MOKDONG 요양급여의뢰서 건강"
        },
        {
          "conditionNumber": 4,
          "productName": "진료기간 2025/02/19 의뢰사유 □ 의사 판단 주호소 의상 상병 분류기호 진료구분 □ 입원 외래 환자 요청 상기 환자는 3주 전 타병원에서 처음 alcoholic LC로 진단받은 자로 이에 대한 치료 위해 본원 소화기내과에 내원하였습니다. 그 전에는 알고 있는 기저 질환이 없다고 하였습니다. 환자는 아래 lab 상심한 hypoglycemia가 있고 CG도 상승되어 있어 이에 대한 상급 병원 진료가 필요하다고 판단되어 의뢰드리오니 바쁘신 가운데 고진선처 부탁드립니다. 감사합니다. 진료 소견 환자상태 및 진료소 결 긴급 진료 필요 여부 □ Y (구체적 긴급 진료 필요 사유 기술) 치료 · 검사 내역 CBC 10800(83.8%)-8.0-85k CRP 4.55 glucose 35 TB/DB 6.2/4.8 [AST/ALT 143/31 N 과거력 및 투익력 BUN/Cr 13.9/1.98 TG/LDL 459/38 ALP/GTP 154/290 amylase/lipase 109/124 [특종] 2025-02-19 MOR 김선삼 (0002) 71102453/M 11016279 AER 기타 가족력 알리지 유무 등 회신 요청 예 아니오 진료정보제공 한자동의서 본인은 상호 진료협력을 위해서 본인의 진료 결과 및 진료회신서 등의 진료정보를 의뢰의사에게 제공(인터넷 조회)하는 것을 동의합니다. 환자 또는 보호사 : 위와 같이 진료를 의뢰합니다. 환자와의 관계: 2025년 02월 19일 의료기관명칭 : 홍익병원 담당의사 면허번호: 115932 담당의사 성명: 송경한 의료기관대표시 귀하 1. 이 진료의뢰서는 협력기관간 진료의뢰 화 시범사업기관으로 지정받은 1단계 진료기관에서 환자의 상태에 따라 2단계 진료기관으로 요양급여 담당의사가 작성하며, 비용은 의뢰환자관리료의 소정점수에 포함됩니다. '진료의뢰서는 의사의 발급일로부터 7일(공휴일 제외)이내에 제출하여야 합니다. [특] 2025-02-19 MDR (0001) 김선삼 711024 53/M 11016279 AER 요양급여 회송(의뢰)서 연번호 2025-A0007152 건강"
        },
        {
          "conditionNumber": 5,
          "company": "제출용 매 수 : 7 매 첨부한 사본은 의무기록 원본과 틀림이 없음을 증명합니다. ※본 의무기록 사본은 상기 용도 이외에는 사용할 수 없음 ※ 2025년 03월 10일 담당자: 송현정 Leng ※담당자의 날인(서명)이 없는 것은 무효임※ 홍익병원 장 홍익병원 HONG IK HOSPITAL 경과기록지 등록번호: 97360430 주민번호 : 711024-1****** 주소: 서울 강서구 화곡로18길 38 [공인인증] 2025/02/19 경과기록지 [송경한] 성명: 김선삼 나이/성별: 53/M 유형 :"
        }
      ],
      "insuranceHistory": [
        {
          "period": "[보험 가입 3개월 이내]",
          "company": ", 7) 위탁여부, 8)기타 24.03.27 1. 사고)경우( 25.02.20. 봄익병원 → 이대목동서 빈경환 1월 말 빈혈 증상으로 전남대시. 수혈 시행 명절 방문. 다른 화면. 주변에서 병원 방식을 요구 거부. 형제들과 같이 붙어서 노뜬 검사 (간경화 진단) 진료의뢰→ 이라서 입원 ICV. 입원 2일경 간경화 - 위장관 출력을 직접 사안으로 사망. 김민성 (아드님). 따님(19세). 대표 박사 김민성님 지능.. 2. 수익자 배우자님 이는 2019년 정도. 당시 간질환등 알고 있는 기저질의 X. 건강하시고 병원을 잘안가신. 답변자 SUNRISE SURVEYORS & CLAIMS ADJUSTERS CO., LTD. (인) 2025-02-28 17:30:27 3. 다"
        },
        {
          "period": "[보험 가입 3개월 이내]",
          "company": "미래에셋. 종신. - 접수 실상 대기다 4. 직업직무 청약시 - 지영업 사그림사 회사원 5. 식인수중상한제 청구-이대목동 영광클립해 나원→ 진료우리→ 전남대병원. 이효구- 봉익병원. 상기의 내용은 신의 성실에 입각하여 사실대로 기재하였음을 확인하며 아래에 서명 및 날인 합니다. 빈경환 답변일자 : 2025.3.02 답변장소 : 답변자 : 김민성 김민성 피("
        },
        {
          "period": "[보험 가입 3개월 이내]",
          "company": "발급일 2025-03-10 매수 21 발급자 황재호 10 첨부한 사본은 의무기록 원본과 같음을 증명합니다. EWHAN 이화여자대학교, ? EU 0 CENTER *상기용도 이외에는 이 사본을 사용할 수 없으며, 사용용도 또는 사용기간이 완료 된 후 즉시 파본, 폐기하여야 합니다. INS XMED * 검사결과가 나오지 않은 것은 사본발급 되지 않습니다. 이화여자대학교 의과대학부속 목동병원장 (07985) 서울특별시 양천구 안양천로 1071 EUMC 이대목동병원 MOKDONG 요양급여의뢰서 건강"
        },
        {
          "period": "[보험 가입 3개월 이내]"
        },
        {
          "period": "[보험 가입 3개월 이내]",
          "company": "제출용 매 수 : 7 매 첨부한 사본은 의무기록 원본과 틀림이 없음을 증명합니다. ※본 의무기록 사본은 상기 용도 이외에는 사용할 수 없음 ※ 2025년 03월 10일 담당자: 송현정 Leng ※담당자의 날인(서명)이 없는 것은 무효임※ 홍익병원 장 홍익병원 HONG IK HOSPITAL 경과기록지 등록번호: 97360430 주민번호 : 711024-1****** 주소: 서울 강서구 화곡로18길 38 [공인인증] 2025/02/19 경과기록지 [송경한] 성명: 김선삼 나이/성별: 53/M 유형 :"
        }
      ],
      "medicalRecords": [
        {
          "date": "",
          "hospital": ". 이효구- 봉익병원. 상기의 내용은 신의 성실에 입각하여 사실대로 기재하였음을 확인하며 아래에 서명 및 날인 합니다. 빈경환 답변일자 :",
          "reason": "정기 진료",
          "diagnosis": "미확인",
          "notes": ""
        },
        {
          "date": "",
          "hospital": "미확인 의료기관",
          "reason": "정기 진료",
          "diagnosis": "미확인",
          "prescription": ")일수 상병명 요양기관명 요양기관연락처 공단부담금 본인부담금 총건수 27 100/100미만 본인부담금 총진료비 합계 공단부담금합계 본인부담금 합계 100/100미만공단부담금합계 100/100미만본인부담금합계 100/100미만공단부담금 1,193,830 716,530 477,300 0 0 1",
          "notes": ""
        },
        {
          "date": "",
          "hospital": "12,620 5,300 2",
          "reason": "정기 진료",
          "diagnosis": "미확인",
          "notes": ""
        },
        {
          "date": "",
          "hospital": "12,590 12,400 0 4",
          "reason": "정기 진료",
          "diagnosis": "미확인",
          "notes": ""
        },
        {
          "date": "",
          "hospital": "02-2693-5555 38,520 38,400 0 5",
          "reason": "정기 진료",
          "diagnosis": "미확인",
          "notes": ""
        },
        {
          "date": "",
          "hospital": "6,800 02-2693-5555 0 0 외래 M1097 홍익병원 6,850 6,800 8",
          "reason": "정기 진료",
          "diagnosis": "미확인",
          "notes": ""
        },
        {
          "date": "",
          "hospital": "02-2693-5555 7,960 7,800 0 0 10",
          "reason": "정기 진료",
          "diagnosis": "미확인",
          "notes": ""
        },
        {
          "date": "",
          "hospital": "미확인 의료기관",
          "reason": "정기 진료",
          "diagnosis": "미확인",
          "prescription": ")일수 상병명 요양기관명 요양기관연락처 공단부담금 본인부담금 총건수 27 100/100미만 본인부담금 총진료비 합계 공단부담금합계 본인부담금 합계 100/100미만공단부담금합계 100/100미만본인부담금합계 100/100미만공단부담금 1,193,830 716,530 477,300 0 11",
          "notes": ""
        },
        {
          "date": "",
          "hospital": "-1544-2875 51,820 34,500 0 0 12",
          "reason": "정기 진료",
          "diagnosis": "미확인",
          "notes": ""
        },
        {
          "date": "",
          "hospital": "-1544-2875 77,940 51,800 0 0 14",
          "reason": "정기 진료",
          "diagnosis": "미확인",
          "notes": ""
        },
        {
          "date": "",
          "hospital": "-1544-2875 34,710 23,000 0 15",
          "reason": "정기 진료",
          "diagnosis": "미확인",
          "notes": "명시된급성치주염 목동중앙치과병원 -1544-2875 34,710 23,000 0 15"
        },
        {
          "date": "",
          "hospital": "50,790 17",
          "reason": "정기 진료",
          "diagnosis": "미확인",
          "notes": ""
        },
        {
          "date": "",
          "hospital": "-1544-2875 51,780 18",
          "reason": "정기 진료",
          "diagnosis": "미확인",
          "notes": ""
        },
        {
          "date": "",
          "hospital": "-1544-2875 47,410 19",
          "reason": "정기 진료",
          "diagnosis": "미확인",
          "notes": ""
        },
        {
          "date": "",
          "hospital": "-1544-2875 55,250 36,700 0 20",
          "reason": "정기 진료",
          "diagnosis": "미확인",
          "notes": ""
        },
        {
          "date": "",
          "hospital": "-1544-2875 99,900 66,500 0 0002 / 0004 건강보험 요양급여내역 전체 출력 선택 출력 성명 발급목적 급여기간 김선삼 순번 진료개시일 사망한 가족의 진료내역",
          "reason": "정기 진료",
          "diagnosis": "미확인",
          "notes": ""
        },
        {
          "date": "",
          "hospital": "미확인 의료기관",
          "reason": "정기 진료",
          "diagnosis": "미확인",
          "prescription": ")일수 상병명 요양기관명 요양기관연락처 공단부담금 본인부담금 100/100미만공단부담금 100/100미만 본인부담금 총건수 27 총진료비 합계 공단부담금합계 본인부담금 합계 100/100미만공단부담금합계 100/100미만본인부담금합계 21 1,193,830",
          "notes": ""
        },
        {
          "date": "",
          "hospital": "477,300 1 어지럼증및어지럼 02-2066-7513 0 22 11,030 22",
          "reason": "정기 진료",
          "diagnosis": "미확인",
          "notes": ""
        },
        {
          "date": "",
          "hospital": "-1544-2875 11,440 7,600 0 0 23",
          "reason": "정기 진료",
          "diagnosis": "미확인",
          "notes": ""
        },
        {
          "date": "",
          "hospital": "-1544-2875 40,270 26,800 0 0 24",
          "reason": "정기 진료",
          "diagnosis": "미확인",
          "notes": ""
        },
        {
          "date": "",
          "hospital": "02-976-3658 8,280 3,500 25",
          "reason": "정기 진료",
          "diagnosis": "미확인",
          "notes": ""
        },
        {
          "date": "",
          "hospital": "02-976-3658 11,580 4,900 0 26",
          "reason": "정기 진료",
          "diagnosis": "미확인",
          "notes": ""
        },
        {
          "date": "",
          "hospital": "18,890 12,500 27",
          "reason": "정기 진료",
          "diagnosis": "미확인",
          "notes": ""
        },
        {
          "date": "",
          "hospital": "의무기록사본 총 0부 (표지제외) 빈경환 의무기록사본증명서 등록번호 환자성명 김선삼",
          "reason": "정기 진료",
          "diagnosis": "미확인",
          "notes": ""
        },
        {
          "date": "",
          "hospital": "장 (07985) 서울특별시 양천구 안양천로 1071 EUMC 이대목동병원 MOKDONG 요양급여의뢰서 건강보험증번호(사업장기호)",
          "reason": "정기 진료",
          "diagnosis": "미확인",
          "notes": "가 나오지 않은 것은 사본발급 되지 않습니다. 이화여자대학교 의과대학부속 목동병원장 (07985) 서울특별시 양천구 안양천로 1071 EUMC 이대목동병원 MOKDONG 요양급여의뢰서 건강보험증번호(사업장기호)"
        },
        {
          "date": "2025-02-19",
          "hospital": "담당의사 면허번호: 115932 담당의사 성명: 송경한 의료기관대표시 귀하 1. 이 진료의뢰서는 협력기관간 진료의뢰 화 시범사업기관으로 지정받은 1단계 진료기관에서 환자의 상태에 따라 2단계 진료기관으로 요양급여 담당의사가 작성하며, 비용은 의뢰환자관리료의 소정점수에 포함됩니다. '진료의뢰서는 의사의 발급일로부터 7일(공휴일 제외)이내에 제출하여야 합니다. [특]",
          "visitDate": "2025-02-19",
          "reason": "정기 진료",
          "diagnosis": "미확인",
          "notes": ""
        },
        {
          "date": "",
          "hospital": "[환자상태 및 진료소견] ■ 평가 및 치료계획 ■ 환자상태(회송사유) 상기 환자 특이 기저질환 없는 자로,",
          "reason": "정기 진료",
          "diagnosis": "미확인",
          "notes": "] ■ 평가 및 치료계획 ■ 환자상태(회송사유) 상기 환자 특이 기저질환 없는 자로,"
        },
        {
          "date": "",
          "hospital": "일자 검사명/결과",
          "reason": "정기 진료",
          "diagnosis": "미확인",
          "notes": ""
        },
        {
          "date": "",
          "hospital": "EUMC 이대목동병원 MOKDONG 등록번호 :",
          "reason": "정기 진료",
          "diagnosis": "미확인",
          "notes": ""
        },
        {
          "date": "",
          "hospital": "미확인 의료기관",
          "reason": "정기 진료",
          "diagnosis": "서 수정 원하셔서 오심 Objective information Vital Signs Ht: 153 cm Assessment #LC with bleeding Plan 진단서 보완해드림 EWHA WOMANS EU MC CENTER MEDICAL 응급초진 작성과: 응급의학과 (",
          "notes": "및 계획 Subjective information 진단서 수정 원하셔서 오심 Objective information Vital Signs Ht: 153 cm Assessment #LC with bleeding Plan 진단서 보완해드림 EWHA WOMANS EU MC CENTER MEDICAL 응급초진 작성과: 응급의학과 ("
        },
        {
          "date": "",
          "hospital": "MOKOONG 등록번호 :",
          "reason": "정기 진료",
          "diagnosis": "미확인",
          "notes": ""
        },
        {
          "date": "",
          "hospital": "MOKDONG 등록번호:",
          "reason": "정기 진료",
          "diagnosis": "미확인",
          "notes": ""
        },
        {
          "date": "",
          "hospital": "미확인 의료기관",
          "reason": "정기 진료",
          "diagnosis": "[주]Gastrointestinal hemorrhage 첨부한 사본은 의무기록 원본과 같음을 증명합니다. 3/12 출력자 : 황재호 (",
          "notes": ""
        },
        {
          "date": "",
          "hospital": "MOKDONG 등록번호 :",
          "reason": "정기 진료",
          "diagnosis": "미확인",
          "notes": ""
        },
        {
          "date": "",
          "hospital": "MOKDONG 등록번호 :",
          "reason": "정기 진료",
          "diagnosis": "미확인",
          "notes": ""
        },
        {
          "date": "",
          "hospital": "MOKDONG 등록번호 :",
          "reason": "정기 진료",
          "diagnosis": "미확인",
          "notes": ""
        },
        {
          "date": "",
          "hospital": "MOKOONG 등록번호:",
          "reason": "정기 진료",
          "diagnosis": "미확인",
          "notes": ""
        },
        {
          "date": "",
          "hospital": "MOKDONG 등록번호 :",
          "reason": "정기 진료",
          "diagnosis": "미확인",
          "notes": ""
        },
        {
          "date": "",
          "hospital": "MOKDONG 등록번호 :",
          "reason": "정기 진료",
          "diagnosis": "미확인",
          "notes": ""
        },
        {
          "date": "",
          "hospital": "미확인 의료기관",
          "reason": "정기 진료",
          "diagnosis": "기준 5) 소화기계 문제 전격간부전 8) 기타 신기능 부전 EWH EU 작성자 정의선 정의선 Check principal diagnostic categories leading to ICU admission I. Non-operative patients 5. Other Gl Bleeding Gastrointestinal WQgAN CENTER 6. If not in one of the specific groups above, then which major vital organ system was the principal reason for admission? UNIVERSITY MEDIC 타과의뢰 작성과: 소화기내과 (",
          "notes": "신기능 부전 EWH EU 작성자 정의선 정의선 Check principal diagnostic categories leading to ICU admission I. Non-operative patients 5. Other Gl Bleeding Gastrointestinal WQgAN CENTER 6. If not in one of the specific groups above, then which major vital organ system was the principal reason for admission? UNIVERSITY MEDIC 타과의뢰 작성과: 소화기내과 ("
        },
        {
          "date": "",
          "hospital": "미확인 의료기관",
          "reason": "정기 진료",
          "diagnosis": "Hepatorenal syndrome Alcoholic LC 첨부한 사본은 의무기록 원본과 같음을 증명합니다. 작성자 정의선 정의선 9/12 출력자 : 황재호 (",
          "notes": ""
        },
        {
          "date": "",
          "hospital": "MOKOONG 등록번호 :",
          "reason": "정기 진료",
          "diagnosis": "미확인",
          "notes": ""
        },
        {
          "date": "",
          "hospital": "MOKDONG 등록번호 :",
          "reason": "정기 진료",
          "diagnosis": "미확인",
          "notes": ""
        },
        {
          "date": "",
          "hospital": "MOKDONG 등록번호 :",
          "reason": "정기 진료",
          "diagnosis": "미확인",
          "notes": ""
        },
        {
          "date": "",
          "hospital": "MOKOONG 등록번호 :",
          "reason": "정기 진료",
          "diagnosis": "미확인",
          "notes": ""
        },
        {
          "date": "",
          "hospital": "미확인 의료기관",
          "reason": "정기 진료",
          "diagnosis": "Gastrointestinal hemorrhage 임상소견 및 병력: 검사명: Chest PA [Finding] There is no abnormality in the lung. The heart is within normal limit in size and shape. There is no visible abnormality of the pleura. Others are not remarkable. [Conclusion] Negative chest 영상검사결과 EWHA WOM 진료과/병동 (의뢰처) : 응급실 (응급) be대학교의료, EU MC (의뢰일 :",
          "notes": "및 병력: 검사명: Chest PA [Finding] There is no abnormality in the lung. The heart is within normal limit in size and shape. There is no visible abnormality of the pleura. Others are not remarkable. [Conclusion] Negative chest 영상검사결과 EWHA WOM 진료과/병동 (의뢰처) : 응급실 (응급) be대학교의료, EU MC (의뢰일 :"
        },
        {
          "date": "",
          "hospital": "미확인 의료기관",
          "reason": "정기 진료",
          "diagnosis": "Gastrointestinal hemorrhage 임상소견 및 병력: 검사명: Abdomen Supine [Finding] CENTER",
          "notes": "및 병력: 검사명: Abdomen Supine [Finding] CENTER"
        },
        {
          "date": "",
          "hospital": "MOKOONG 등록번호:",
          "reason": "정기 진료",
          "diagnosis": "미확인",
          "notes": ""
        },
        {
          "date": "",
          "hospital": "미확인 의료기관",
          "reason": "정기 진료",
          "diagnosis": "Gastrointestinal hemorrhage 임상소견 및 병력: 판독의 : 박정환, 박정환, 박정환 의료 료원 검사명: CT Abdomen/Pelvis [Finding] 이화여자대학교, Precontrast scan 만을 시행하였음. Liver의 volume이 증가되어 있고 attenuation이 감소되어 있으며 umbilical vein의 recanalization이 있어 alcoholic liver cirrhosis로 생각됨. 다량의 ascites가 있음. Stomach의 fluid distension이 있음. Ureteral obstruction은 동반되어 있지 않음. Abnormal bowel dilatation 보이지 않음. [Conclusion] MA 1. Possibility of alcoholic liver cirrhosis. 2. A large amount of ascites. 3. Gastric distension with fluid. MC UNIVERSITY MEDICAL CEN 영상검사결과 진료과/병동 (의뢰처) : 소화기내과 (EICU) (의뢰일 :",
          "notes": "및 병력: 판독의 : 박정환, 박정환, 박정환 의료 료원 검사명: CT Abdomen/Pelvis [Finding] 이화여자대학교, Precontrast scan 만을 시행하였음. Liver의 volume이 증가되어 있고 attenuation이 감소되어 있으며 umbilical vein의 recanalization이 있어 alcoholic liver cirrhosis로 생각됨. 다량의 ascites가 있음. Stomach의 fluid distension이 있음. Ureteral obstruction은 동반되어 있지 않음. Abnormal bowel dilatation 보이지 않음. [Conclusion] MA 1. Possibility of alcoholic liver cirrhosis. 2. A large amount of ascites. 3. Gastric distension with fluid. MC UNIVERSITY MEDICAL CEN 영상검사결과 진료과/병동 (의뢰처) : 소화기내과 (EICU) (의뢰일 :"
        },
        {
          "date": "",
          "hospital": "미확인 의료기관",
          "reason": "정기 진료",
          "diagnosis": "Hypoprothrombinemia secondary to liver disease 임상소견 및 병력: 판독의 : 이정경, 이정경 첨부한 사본은 의무기록 원본과 같음을 증명합니다. 2/6 출력자 : 황재호 (",
          "notes": "및 병력: 판독의 : 이정경, 이정경 첨부한 사본은 의무기록 원본과 같음을 증명합니다. 2/6 출력자 : 황재호 ("
        },
        {
          "date": "",
          "hospital": "MOKDONG 등록번호 :",
          "reason": "정기 진료",
          "diagnosis": "미확인",
          "notes": ""
        },
        {
          "date": "",
          "hospital": "미확인 의료기관",
          "reason": "정기 진료",
          "diagnosis": "Hypoprothrombinemia secondary to liver disease 임상소견 및 병력: 검사명: Abdomen Supine [Finding] r/o mechanical ileus [Conclusion] WHA WOMANS U MC 영상검사결과 진료과/병동 (의뢰처) : 소화기내과 (EICU) (의뢰일 :",
          "notes": "및 병력: 검사명: Abdomen Supine [Finding] r/o mechanical ileus [Conclusion] WHA WOMANS U MC 영상검사결과 진료과/병동 (의뢰처) : 소화기내과 (EICU) (의뢰일 :"
        },
        {
          "date": "",
          "hospital": "미확인 의료기관",
          "reason": "정기 진료",
          "diagnosis": "Hypoprothrombinemia secondary to liver disease 판독의 : 박호영, 박호영, 박호영 CENTER 판독의 : 박정환, 박정환, 박정환 첨부한 사본은 의무기록 원본과 같음을 증명합니다. 3/6 출력자 : 황재호 (",
          "notes": ""
        },
        {
          "date": "",
          "hospital": "MOKDONG 등록번호 :",
          "reason": "정기 진료",
          "diagnosis": "미확인",
          "notes": ""
        },
        {
          "date": "",
          "hospital": "MOKDONG 등록번호:",
          "reason": "정기 진료",
          "diagnosis": "미확인",
          "notes": ""
        },
        {
          "date": "",
          "hospital": "MOKOONG 등록번호:",
          "reason": "정기 진료",
          "diagnosis": "미확인",
          "notes": ""
        },
        {
          "date": "",
          "hospital": "MOKDONG 등록번호 :",
          "reason": "정기 진료",
          "diagnosis": "미확인",
          "notes": ""
        },
        {
          "date": "",
          "hospital": "종류 : 종합병원 내원전 병원명 : 홍익병원 내원수단 : 기타 자동차 내원사유(질병여부) : 질병 내원 주증상 : abdominal distension 내원 주증상2:gum bleeding ~화여자대학교, 내원동기 및 현상태 : abdominal distension, gum bleeding 신체사정 활력징후 SBP(mmHg) :160 DBP(mmHg) :90 PR(회/min) :137 RR(회/min) :22 BT(°C):35 SpO2(%):100 전반적 상태 통증 유무 : 유 통증 도구 : NRS 통증 강도:8 의식상태 내원시 반응 :alert 호흡기계 호흡기장애 유무 : 유 EWHA 의료 료원 EU MC WOMANS 호흡기장애 종류 :호흡곤란 감염의심정보 열(1주일이내 37.5℃ 이상) :무 CENTER MEDICAL 해외 여행력(3주 이내) :무 발진 : 무 작성자 박은빈 박은빈 초기간호정보 첨부한 사본은 의무기록 원본과 같음을 증명합니다. 1/3 출력자 : 황재호 (",
          "reason": "abdominal distension 내원 주증상2:gum bleeding ~화여자대학교, 내원동기 및 현상태 : abdominal distension, gum bleeding 신체사정 활력징후 SBP(mmHg) :160 DBP(mmHg) :90 PR(회/min) :137 RR(회/min) :22 BT(°C):35 SpO2(%):100 전반적 상태 통증 유무 : 유 통증 도구 : NRS 통증 강도:8 의식상태 내원시 반응 :alert 호흡기계 호흡기장애 유무 : 유 EWHA 의료 료원 EU MC WOMANS 호흡기장애 종류 :호흡곤란 감염의심정보 열(1주일이내 37.5℃ 이상) :무 CENTER MEDICAL 해외 여행력(3주 이내) :무 발진 : 무 작성자 박은빈 박은빈 초기간호정보 첨부한 사본은 의무기록 원본과 같음을 증명합니다. 1/3 출력자 : 황재호 (",
          "diagnosis": "미확인",
          "notes": "자동차 내원사유(질병여부) : 질병 내원 주증상 : abdominal distension 내원 주증상2:gum bleeding ~화여자대학교, 내원동기 및 현상태 : abdominal distension, gum bleeding 신체사정 활력징후 SBP(mmHg) :160 DBP(mmHg) :90 PR(회/min) :137 RR(회/min) :22 BT(°C):35 SpO2(%):100 전반적 상태 통증 유무 : 유 통증 도구 : NRS 통증 강도:8 의식상태 내원시 반응 :alert 호흡기계 호흡기장애 유무 : 유 EWHA 의료 료원 EU MC WOMANS 호흡기장애 종류 :호흡곤란 감염의심정보 열(1주일이내 37.5℃ 이상) :무 CENTER MEDICAL 해외 여행력(3주 이내) :무 발진 : 무 작성자 박은빈 박은빈 초기간호정보 첨부한 사본은 의무기록 원본과 같음을 증명합니다. 1/3 출력자 : 황재호 ("
        },
        {
          "date": "",
          "hospital": "MOKDONG 등록번호 :",
          "reason": "정기 진료",
          "diagnosis": "미확인",
          "notes": ""
        },
        {
          "date": "",
          "hospital": "MOKOONG 등록번호:",
          "reason": "정기 진료",
          "diagnosis": "미확인",
          "notes": ""
        },
        {
          "date": "",
          "hospital": "의무기록사본 총 0부 (표지제외) 빈경환 의무기록 사본 증명서 등록번호 :",
          "reason": "정기 진료",
          "diagnosis": "미확인",
          "notes": ""
        },
        {
          "date": "2025-03-10",
          "hospital": "장 홍익병원 HONG IK HOSPITAL 경과기록지 등록번호:",
          "visitDate": "2025-03-10",
          "reason": "정기 진료",
          "diagnosis": "미확인",
          "notes": ""
        },
        {
          "date": "",
          "hospital": "에서 alcoholi LC로 진단받고 이에 대해 치료 받기 위해 내원함. * 본 의무기록은 홍익병원 전산시스템으로 출력하여 원본 1 출력일 :",
          "reason": "정기 진료",
          "diagnosis": "받고 이에 대해 치료 받기 위해 내원함. * 본 의무기록은 홍익병원 전산시스템으로 출력하여 원본 1 출력일 :",
          "notes": ""
        },
        {
          "date": "",
          "hospital": "HONG IK HOSPITAL 담당의사: 노형진 con E ㅎ이변의 저사시ㅅㅇㄹ 추려하여 위보가 다르이 없습니다 출력일시:",
          "reason": "headache 현병력 다친 후 금일 s/o 위해 내원함. 진료내용 과거력) ? None ? DM ? HTN ? TBC ? CVA Hx 사회력) ? None ? Alcohol 회/주 ? Smoking 갑/일 알러지) 계통문진) 신체검사) 통증평가 □무 숫자통증도구(NRS) 2 점 통증위치: 머리 양상: □ 둔함 □ 쑤심 빈도: □ 저림 □ 날카로움 □ 찌르는듯함 □ 기타 기간: □ 계속적 □ 주기적 수일. □ 간헐적 □ 기타 특이사항 r/o laceration scalp 진단명 ctx 치료계획 및 검사내용 )홍익병원 HONG IK HOSPITAL 담당의사: 노형진 con E ㅎ이변의 저사시ㅅㅇㄹ 추려하여 위보가 다르이 없습니다 출력일시:",
          "diagnosis": "ctx 치료계획 및 검사내용 )홍익병원 HONG IK HOSPITAL 담당의사: 노형진 con E ㅎ이변의 저사시ㅅㅇㄹ 추려하여 위보가 다르이 없습니다 출력일시:",
          "notes": "기간: □ 계속적 □ 주기적 수일. □ 간헐적 □ 기타 특이사항 r/o laceration scalp 진단명 ctx 치료계획 및 검사내용 )홍익병원 HONG IK HOSPITAL 담당의사: 노형진 con E ㅎ이변의 저사시ㅅㅇㄹ 추려하여 위보가 다르이 없습니다 출력일시:"
        },
        {
          "date": "",
          "hospital": "*보 이무기록지는 홍익병원전산 시스템으로 출력하여 원본과 다름이 없습니다. 출력일:",
          "reason": "빈도 : Imp: gout foot Rt. Plan : nausea/vomiting/diarrhea(-/-/-) headache/LBP/L.E.P/Pain On (-/-/-/-) 홍익병원 *보 이무기록지는 홍익병원전산 시스템으로 출력하여 원본과 다름이 없습니다. 출력일:",
          "diagnosis": "미확인",
          "notes": ""
        },
        {
          "date": "",
          "hospital": "전산시스템으로 출력하여 원톤 1 출력일 :",
          "reason": "정기 진료",
          "diagnosis": "미확인",
          "notes": ""
        },
        {
          "date": "",
          "hospital": "AU214 의료질평가지원금- 의료질 및 환자번호 환자성명 진료기간 병실",
          "reason": "정기 진료",
          "diagnosis": "미확인",
          "notes": ""
        },
        {
          "date": "",
          "hospital": "(",
          "reason": "정기 진료",
          "diagnosis": "미확인",
          "notes": ""
        },
        {
          "date": "",
          "hospital": "미확인 의료기관",
          "reason": "정기 진료",
          "diagnosis": "미확인",
          "prescription": "내역 등이 확인되므로 원칙적으로 환자 본인 외에 발급을 금합니다. 다만, 본 세부내역서 발급에 대해 별도로 환자 본인으로부터 위임을 받은 것이 확인된 자 또는 법정대리인에겐 발급이 가능합니다. 2. 비고란은 세부산정내역을 발부하는 영수증번호 등 요양기관이 필요한 경우 추가 기재하는 공간으로 활용할 수 있습니다. 3. 동 서식에 명시된 항목은 [국민건강보험 요양급여의 기준에 관한 규칙] 제7조제3항에 따라 필수 기재되어야 합니다.",
          "notes": "란은 세부산정내역을 발부하는 영수증번호 등 요양기관이 필요한 경우 추가 기재하는 공간으로 활용할 수 있습니다. 3. 동 서식에 명시된 항목은 [국민건강보험 요양급여의 기준에 관한 규칙] 제7조제3항에 따라 필수 기재되어야 합니다."
        }
      ],
      "hospitalizationRecords": [
        {
          "date": "",
          "hospital": "→ 이대목동서 빈경환 1월 말 빈혈 증상으로 전남대시. 수혈 시행 명절 방문. 다른 화면. 주변에서 병원 방식을 요구 거부. 형제들과 같이 붙어서 노뜬 검사 (간경화 진단) 진료의뢰→ 이라서 입원 ICV. 입원 2일경 간경화 - 위장관 출력을 직접 사안으로 사망. 김민성 (아드님). 따님(19세). 대표 박사 김민성님 지능.. 2. 수익자 배우자님 이는 2019년 정도. 당시 간질환등 알고 있는 기저질의 X. 건강하시고 병원을 잘안가신. 답변자 SUNRISE SURVEYORS & CLAIMS ADJUSTERS CO., LTD. (인)",
          "reason": "으로 전남대시. 수혈 시행 명절 방문. 다른 화면. 주변에서 병원 방식을 요구 거부. 형제들과 같이 붙어서 노뜬 검사 (간경화 진단) 진료의뢰→ 이라서 입원 ICV. 입원 2일경 간경화 - 위장관 출력을 직접 사안으로 사망. 김민성 (아드님). 따님(19세). 대표 박사 김민성님 지능.. 2. 수익자 배우자님 이는 2019년 정도. 당시 간질환등 알고 있는 기저질의 X. 건강하시고 병원을 잘안가신. 답변자 SUNRISE SURVEYORS & CLAIMS ADJUSTERS CO., LTD. (인)",
          "diagnosis": ") 진료의뢰→ 이라서 입원 ICV. 입원 2일경 간경화 - 위장관 출력을 직접 사안으로 사망. 김민성 (아드님). 따님(19세). 대표 박사 김민성님 지능.. 2. 수익자 배우자님 이는 2019년 정도. 당시 간질환등 알고 있는 기저질의 X. 건강하시고 병원을 잘안가신. 답변자 SUNRISE SURVEYORS & CLAIMS ADJUSTERS CO., LTD. (인)",
          "admissionPeriod": "undefined ~ undefined",
          "surgeryInfo": null,
          "notes": ""
        },
        {
          "date": "",
          "hospital": "에서 처음 alcoholic LC로 진단받은 자로 이에 대한 치료 위해 본원 소화기내과에 내원하였습니다. 그 전에는 알고 있는 기저 질환이 없다고 하였습니다. 환자는 아래 lab 상심한 hypoglycemia가 있고 CG도 상승되어 있어 이에 대한 상급 병원 진료가 필요하다고 판단되어 의뢰드리오니 바쁘신 가운데 고진선처 부탁드립니다. 감사합니다. 진료 소견 환자상태 및 진료소 결 긴급 진료 필요 여부 □ Y (구체적 긴급 진료 필요 사유 기술) 치료 · 검사 내역 CBC 10800(83.8%)-8.0-85k CRP 4.55 glucose 35 TB/DB 6.2/4.8 [AST/ALT 143/31 N 과거력 및 투익력 BUN/Cr",
          "reason": "의상 상병 분류기호 진료구분 □ 입원 외래 환자 요청 상기 환자는 3주 전 타병원에서 처음 alcoholic LC로 진단받은 자로 이에 대한 치료 위해 본원 소화기내과에 내원하였습니다. 그 전에는 알고 있는 기저 질환이 없다고 하였습니다. 환자는 아래 lab 상심한 hypoglycemia가 있고 CG도 상승되어 있어 이에 대한 상급 병원 진료가 필요하다고 판단되어 의뢰드리오니 바쁘신 가운데 고진선처 부탁드립니다. 감사합니다. 진료 소견 환자상태 및 진료소 결 긴급 진료 필요 여부 □ Y (구체적 긴급 진료 필요 사유 기술) 치료 · 검사 내역 CBC 10800(83.8%)-8.0-85k CRP 4.55 glucose 35 TB/DB 6.2/4.8 [AST/ALT 143/31 N 과거력 및 투익력 BUN/Cr",
          "diagnosis": "받은 자로 이에 대한 치료 위해 본원 소화기내과에 내원하였습니다. 그 전에는 알고 있는 기저 질환이 없다고 하였습니다. 환자는 아래 lab 상심한 hypoglycemia가 있고 CG도 상승되어 있어 이에 대한 상급 병원 진료가 필요하다고 판단되어 의뢰드리오니 바쁘신 가운데 고진선처 부탁드립니다. 감사합니다. 진료 소견 환자상태 및 진료소 결 긴급 진료 필요 여부 □ Y (구체적 긴급 진료 필요 사유 기술) 치료 · 검사 내역 CBC 10800(83.8%)-8.0-85k CRP 4.55 glucose 35 TB/DB 6.2/4.8 [AST/ALT 143/31 N 과거력 및 투익력 BUN/Cr",
          "admissionPeriod": "undefined ~ undefined",
          "surgeryInfo": null,
          "notes": "환자상태 및 진료소 결 긴급 진료 필요 여부 □ Y (구체적 긴급 진료 필요 사유 기술) 치료 · 검사 내역 CBC 10800(83.8%)-8.0-85k CRP 4.55 glucose 35 TB/DB 6.2/4.8 [AST/ALT 143/31 N 과거력 및 투익력 BUN/Cr"
        },
        {
          "date": "",
          "hospital": "미확인 의료기관",
          "reason": "응급실 내원",
          "diagnosis": "일 KCD 진단명(한글) 진단부서",
          "admissionPeriod": "undefined ~ undefined",
          "surgeryInfo": null,
          "notes": ""
        },
        {
          "date": "",
          "hospital": ") 내원하여 시 행한 검사 상 rlo undocumented alchoholic LC 의심 하에 본원 응급센터 전원 됨. #영광종합병원 진료의뢰서 impression: 1. r/o undocumented alchoholic LC 2. r/o fever d/t SBP 이전 병원 다니거나 진단받은 적 없으심. chronic alcohol drinker로 Hgb 4.0 Total calcium 7.7 Magnesium 1.2 Inorganic phosphorus 1.8 Sodium 136 Potassium 3.4 Chloride 103 Total protein 5.8 Albumin 2.5 Alkaline phosphatase 126 gamma-GTP 203 AST 98 ALT 23 Total bilirubin 3.64 Direct bilirubin 1.76 BUN 28.7 Creatinine 1.76 Glucose 158 Amylase 215 Creatine kinase 225 CRP2 (high sensitivity) 2.09 transfusion 2 pint하였고, 타원에서 당일 항생제 투약함. 입원 권유하였으나, 연고지관계상 입원 치료 힘들다고 함. 전원 소견서 작성 및 연고지에서 즉시 치료하시도록 말씀드렸습니다. 귀원에서 치료위해 의뢰드립니다. [배룡]",
          "reason": "로 local(영광종합병원) 내원하여 시 행한 검사 상 rlo undocumented alchoholic LC 의심 하에 본원 응급센터 전원 됨. #영광종합병원 진료의뢰서 impression: 1. r/o undocumented alchoholic LC 2. r/o fever d/t SBP 이전 병원 다니거나 진단받은 적 없으심. chronic alcohol drinker로 Hgb 4.0 Total calcium 7.7 Magnesium 1.2 Inorganic phosphorus 1.8 Sodium 136 Potassium 3.4 Chloride 103 Total protein 5.8 Albumin 2.5 Alkaline phosphatase 126 gamma-GTP 203 AST 98 ALT 23 Total bilirubin 3.64 Direct bilirubin 1.76 BUN 28.7 Creatinine 1.76 Glucose 158 Amylase 215 Creatine kinase 225 CRP2 (high sensitivity) 2.09 transfusion 2 pint하였고, 타원에서 당일 항생제 투약함. 입원 권유하였으나, 연고지관계상 입원 치료 힘들다고 함. 전원 소견서 작성 및 연고지에서 즉시 치료하시도록 말씀드렸습니다. 귀원에서 치료위해 의뢰드립니다. [배룡]",
          "diagnosis": "받은 적 없으심. chronic alcohol drinker로 Hgb 4.0 Total calcium 7.7 Magnesium 1.2 Inorganic phosphorus 1.8 Sodium 136 Potassium 3.4 Chloride 103 Total protein 5.8 Albumin 2.5 Alkaline phosphatase 126 gamma-GTP 203 AST 98 ALT 23 Total bilirubin 3.64 Direct bilirubin 1.76 BUN 28.7 Creatinine 1.76 Glucose 158 Amylase 215 Creatine kinase 225 CRP2 (high sensitivity) 2.09 transfusion 2 pint하였고, 타원에서 당일 항생제 투약함. 입원 권유하였으나, 연고지관계상 입원 치료 힘들다고 함. 전원 소견서 작성 및 연고지에서 즉시 치료하시도록 말씀드렸습니다. 귀원에서 치료위해 의뢰드립니다. [배룡]",
          "admissionPeriod": "undefined ~ undefined",
          "surgeryInfo": null,
          "notes": "서 작성 및 연고지에서 즉시 치료하시도록 말씀드렸습니다. 귀원에서 치료위해 의뢰드립니다. [배룡]"
        },
        {
          "date": "",
          "hospital": ") 내원시 r/o undocumented alchoholic LC 2, r/o fever d/t SBP 로IV antibiotics 투여, 전남대학병원 refer 되어 Hb 4.0 으로 T/F 2pint 이후 입원 권고하였으나 연고지 문 제로 refuse 이후 자택에서 지냈다고 함. 2주 전부터 gum bleeding, abdomen distension 있어 금일 타병원(홍익병원) 오전 내원하였으며 시행한 혈액 검사 결과 상 hypoglycemia, Cr elevation 있어 further evaluation 위해 본원 ER refer 됨. 본원 ER 내원 직후 측정한 BST 36mg/dL, M/S alert 확인됨. * 내원 당일 타병원(홍익병원) 검사 결과 CBC 10800(83.8%)-8.0-85K CRP 4.55 glucose 35 TB/DB 6.2/4.8 AST/ALT 143/31 ALP/GTP 154/290 BUN/Cr",
          "reason": "응급실 내원",
          "diagnosis": "미확인",
          "admissionPeriod": "undefined ~ undefined",
          "surgeryInfo": null,
          "notes": ""
        },
        {
          "date": "",
          "hospital": ") 내원시 r/o undocumented alchoholic LC 2, r/o fever d/t SBP 로IV antibiotics 투여, 전남대학병원 refer 되어 Hb 4.0 으로 T/F 2pint 이후 입원 권고하였으나 연고지 문 제로 refuse 이후 자택에서 지냈다고 함. * 2주 전부터 gum bleeding, abdomen distension 있어 금일 타병원(홍익병원) 오전 내원하였으며 시행한 혈액 검사 결과 상 hypoglycemia, Cr elevation 있어 further evaluation 위해 본원 ER refer 됨. 본원 ER 내원 직후 측정한 BST 36mg/dL, M/S alert 확인됨. 내원 당일 타병원(홍익병원) 검사 결과 CBC 10800(83.8%)-8.0-85K CRP 4.55 glucose 35 TB/DB 6.2/4.8 AST/ALT 143/31 ALP/GTP 154/290 BUN/Cr",
          "reason": "응급실 내원",
          "diagnosis": "미확인",
          "admissionPeriod": "undefined ~ undefined",
          "surgeryInfo": null,
          "notes": ""
        },
        {
          "date": "",
          "hospital": ") 내원시 r/o undocumented alchoholic LC 2, r/o fever d/t SBP 로IV antibiotics 투여, 전남대학병원 refer 되어 Hb 4.0 으로 T/F 2pint 이후 입원 권고하였으나 연고지 문 제로 refuse 이후 자택에서 지냈다고 함. 2주 전부터 gum bleeding, abdomen distension 있어 금일 타병원(홍익병원) 오전 내원하였으며 시행한 혈액 검사 결과 hypoglycemia, Cr elevation of further evaluation HER refer. 최근 예방접종 정보(Vaccination) 유행성 독감 예방주사 모름 최근 1년의 해외여행 경험 모름 Past History Past history All denied Operation 확인필요 Current medications 자가약 확인필요 Review Of System General condition normal Head and neck normal Cardiovascular normal Respiratory normal Gastrointestinal abdominal distension Urinary normal Endocrine normal Musculoskeletal normal Neurologic normal Physical Examination Vital sign EWHA 이화여자대학교의료원 EU MC WOMANS Systolic blood pressure(mmHg) 121 Diastolic blood pressure (mmHg) 66 Body temperature (°C) 36.1 Respiration rate (/) 28 Pulse rate (/) 124 Height 153 Weight 48 General finding normal Head and neck normal Chest UNIVERSITY CENTER MEDICAL normal Heart 첨부한 사본은 의무기록 원본과 같음을 증명합니다. 5/12 출력자 : 황재호 (",
          "reason": "응급실 내원",
          "diagnosis": "미확인",
          "admissionPeriod": "undefined ~ undefined",
          "surgeryInfo": null,
          "notes": ""
        },
        {
          "date": "",
          "hospital": "Refer 되어 HB 4.0으로 T/F 및 입원 권고 받았으나 연고지 문제로 Refuse 후 자택에서 지냈다고 함. 내원 2주 전부터 gum bledding, abdomen distention 발생하여 타병원(홍익병원) 내원, 혈액검사상 hypoglycemia, Cr elevation, Hb 저하등으로 ER Refer 되어 내원함. 입원 후 r/o Varix bleeding 으로 Masive hematemesis, active bleeding 발생하여 CPR 시행 후 ROSC 되었으나 Bleeding 재발생되어 SB Tube insertion 시행함. 또한 HRS 진행, Metabolic acidosis로 CRRT, ventilator 적용하였으나 호전 보이지 않았으며 V/S unstable 하여 T/F 및 Intoropics 고용량으로 사용함. 응급 TIPS 고려 하였으나 사망가능성 높아 중단, 이후 내시경지혈술 시행, CRRT, Ventilator 적용 했음에도 Arrest 발생하여 사망함. S 입원경과 ICU Care 작성과: 소화기내과 (",
          "reason": "응급실 내원",
          "diagnosis": "미확인",
          "admissionPeriod": "undefined ~ undefined",
          "surgeryInfo": null,
          "notes": ""
        },
        {
          "date": "",
          "hospital": "Refer 되어 HB 4.0으로 T/F 및 입원 권고 받았으나 연고 지 문제로 Refuse 후 자택에서 지냈다고 함. 내원 2주 전부터 gum bledding, abdomen distention 발생하여 타병원(홍익병원) 내원, 혈액검사상 hypoglycemia, Cr elevation, Hb 저하등으로 ER Refer 되어 내원함. 입원 후 r/o Varix bleeding 으로 Masive hematemesis, active bleeding 발생하여 CPR 시행 후 ROSC 되었으나 Bleeding 재발생되어 SB Tube insertion 시행함. 또한 HRS 진행, Metabolic acidosis로 CRRT, ventilator 적용하였으나 호전 보이지 않았으며 V/S unstable 하여 T/F 및 Intoropics 고용량으로 사용 했음에도 V/S unstable 하였음. 응급 TIPS 고려 하였으나 사망가능성 높아 중단하였으며 내시경지혈술 시행, CRRT, Ventilator 적용 했음에도 Arrest 발생하여 사망함. 합병증 무 첨부한 사본은 의무기록 원본과 같음을 증명합니다. 11/12 출력자 : 황재호 (",
          "reason": "응급실 내원",
          "diagnosis": "미확인",
          "admissionPeriod": "undefined ~ undefined",
          "surgeryInfo": null,
          "notes": "WBC 5.36 2.13 RBC 1.36 1.26 Hb 4.0 3.7 Hct 12.3 10.9 Platelet 44 39 pH, arterial 6.898 6.991 pCO2, arterial 44.7 69.5 pO2, arterial 83.5 62.5 Bicarbonate, arterial 8.5 Base excess, arterial -21.8 -13.7 CO2content, arterial 9.9 18.5 O2 saturate, arterial 85.8 82.5 이화여자대학교의료원 16.4 EU MC HA WOMANS UNIVERSITY CENTER MEDICAL Lactate, arterial 220.5 198.7 FiO2 100.0 100.0 Hct, arterial 12 17 Hb, arterial 4.2 5.7 Phosphorus 9.3 9.3 Na 156 153 K 6.2 6.3 Cl 99 96 TCO2 9 15 Mg 2.01 2.03 경과요약 상환 특이병력 없으셨던 분으로 daily 소주 1병 드시던 분. 최근 3일간 물, 소주만 드셨던 분으로 1/30 발생한 발열 및 오한 으로 local 내원, r/o Alcoholic LC, r/o SBP, r/o HRS 로 전남대병원 Refer 되어 HB 4.0으로 T/F 및 입원 권고 받았으나 연고 지 문제로 Refuse 후 자택에서 지냈다고 함. 내원 2주 전부터 gum bledding, abdomen distention 발생하여 타병원(홍익병원) 내원, 혈액검사상 hypoglycemia, Cr elevation, Hb 저하등으로 ER Refer 되어 내원함. 입원 후 r/o Varix bleeding 으로 Masive hematemesis, active bleeding 발생하여 CPR 시행 후 ROSC 되었으나 Bleeding 재발생되어 SB Tube insertion 시행함. 또한 HRS 진행, Metabolic acidosis로 CRRT, ventilator 적용하였으나 호전 보이지 않았으며 V/S unstable 하여 T/F 및 Intoropics 고용량으로 사용 했음에도 V/S unstable 하였음. 응급 TIPS 고려 하였으나 사망가능성 높아 중단하였으며 내시경지혈술 시행, CRRT, Ventilator 적용 했음에도 Arrest 발생하여 사망함. 합병증 무 첨부한 사본은 의무기록 원본과 같음을 증명합니다. 11/12 출력자 : 황재호 ("
        },
        {
          "date": "",
          "hospital": "재원여부 : 아니오 입원방법 :눕는차 주증상 :hematochezia EU 최근 발병시기:2/19 CENTER 입원동기 : 상환 이전 특이 병력 없으며 daily 소주 1병 섭취(내원 당일은 음주하지 않음) 하며 최근 3일간 물, 소주만 섭취한 환자로",
          "reason": "hematochezia EU 최근 발병시기:2/19 CENTER 입원동기 : 상환 이전 특이 병력 없으며 daily 소주 1병 섭취(내원 당일은 음주하지 않음) 하며 최근 3일간 물, 소주만 섭취한 환자로",
          "diagnosis": "미확인",
          "admissionPeriod": "undefined ~ undefined",
          "surgeryInfo": null,
          "notes": "Allergy 유무 : 무 VIP 여부 :무 입원정보 입원경로 :응급실 이화여자대학교의료원 입원직전 요양원/요양병원 재원여부 : 아니오 입원방법 :눕는차 주증상 :hematochezia EU 최근 발병시기:2/19 CENTER 입원동기 : 상환 이전 특이 병력 없으며 daily 소주 1병 섭취(내원 당일은 음주하지 않음) 하며 최근 3일간 물, 소주만 섭취한 환자로"
        },
        {
          "date": "2025-02-20",
          "hospital": "미확인 의료기관",
          "visitDate": "2025-02-20",
          "reason": "응급실 내원",
          "diagnosis": "미확인",
          "admissionPeriod": "undefined ~ undefined",
          "surgeryInfo": null,
          "notes": ""
        },
        {
          "date": "2025-02-20",
          "hospital": "미확인 의료기관",
          "visitDate": "2025-02-20",
          "reason": "응급실 내원",
          "diagnosis": "미확인",
          "admissionPeriod": "undefined ~ undefined",
          "surgeryInfo": null,
          "notes": ""
        },
        {
          "date": "2025-02-20",
          "hospital": "미확인 의료기관",
          "visitDate": "2025-02-20",
          "reason": "응급실 내원",
          "diagnosis": "미확인",
          "admissionPeriod": "undefined ~ undefined",
          "surgeryInfo": null,
          "notes": ""
        },
        {
          "date": "2025-02-20",
          "hospital": "미확인 의료기관",
          "visitDate": "2025-02-20",
          "reason": "응급실 내원",
          "diagnosis": "미확인",
          "admissionPeriod": "undefined ~ undefined",
          "surgeryInfo": null,
          "notes": ""
        },
        {
          "date": "2025-02-20",
          "hospital": "미확인 의료기관",
          "visitDate": "2025-02-20",
          "reason": "응급실 내원",
          "diagnosis": "미확인",
          "admissionPeriod": "undefined ~ undefined",
          "surgeryInfo": null,
          "notes": ""
        },
        {
          "date": "2025-02-20",
          "hospital": "미확인 의료기관",
          "visitDate": "2025-02-20",
          "reason": "응급실 내원",
          "diagnosis": "미확인",
          "admissionPeriod": "undefined ~ undefined",
          "surgeryInfo": null,
          "notes": ""
        },
        {
          "date": "2025-02-20",
          "hospital": "미확인 의료기관",
          "visitDate": "2025-02-20",
          "reason": "응급실 내원",
          "diagnosis": "미확인",
          "admissionPeriod": "undefined ~ undefined",
          "surgeryInfo": null,
          "notes": ""
        },
        {
          "date": "2025-02-20",
          "hospital": "미확인 의료기관",
          "visitDate": "2025-02-20",
          "reason": "응급실 내원",
          "diagnosis": "미확인",
          "admissionPeriod": "undefined ~ undefined",
          "surgeryInfo": null,
          "notes": ""
        },
        {
          "date": "2025-02-20",
          "hospital": "미확인 의료기관",
          "visitDate": "2025-02-20",
          "reason": "응급실 내원",
          "diagnosis": "미확인",
          "admissionPeriod": "undefined ~ undefined",
          "surgeryInfo": null,
          "notes": ""
        },
        {
          "date": "2025-02-20",
          "hospital": "미확인 의료기관",
          "visitDate": "2025-02-20",
          "reason": "응급실 내원",
          "diagnosis": "미확인",
          "admissionPeriod": "undefined ~ undefined",
          "surgeryInfo": null,
          "notes": "CT(다245마(1) (나)) 90,310 1.1 1 99,340 9,934 89,406 0 0 CT료 HB011 PACS료 (특수영상) (다2절주4) 4,710 1.0 1 4,710 471 4,239 0 0 소계 0.0 0 104,050 10,405 93,645 0 0 수혈료 AL900 혈액관리료 [Unit당](가11-1) 4,430 21.0 21 93,030 9,303 83,727 0 0 수혈료 D1550003 교차시험 [1 [hit당] 5,000 10.4 10 52,000 5,200 46,800 0 0 수혈료 KK052 수혈료 L6001101 수액주사100-500ML(1병또는포장단위당)(마나) 혈액원 MCS ESP WITH FILTER 3,220 21.0 21 77,763 7,770 69,993 0 0 169,253 1.0 1 169,253 16,925 152,328 0 0 수혈료 L6103017 수혈료 X2021 Pre-Storage Filter Blood bag Set 적혈구농축액 3200C(파2가3) 12,650 8.0 8 101,200 10,120 91,080 0 0 59,870 1.0 1 59,870 5,987 53,883 0 0 수혈료 X2022 적혈구농축액 400CC(파2가4) 63,990 1.0 1 63,990 6,399 57,591 0 0 수혈료 X2042 신선동결혈장 400CC(파2가) 65,760 10.0 10 657,600 65,760 591,840 0 0 수혈료 X2112 여과백혈구제거적혈구 400CC(파2가22) 65,300 8.0 8 522,400 52,240 470,160 0 0 수혈료 X2511 백혈구여과제거 성분채집 혈소판(파2나4) 170,050 1.0 1 170,050 17,005 153,045 0 0 소계 0.0 0 1,967,156 196,709 1,770,447 0 0 끝수처리 조정금액 0.0 0 0 -9 1 0 0 본인부담상한차액 0.0 0 0 0 0 0 0 진료비 세부내역서(입원 항목별) 요양기관기호:"
        },
        {
          "date": "2025-02-20",
          "hospital": "이화여자대학 교의과대학 대표자 유경하 일반사항 안내 1. 진료비 계산서·영수증의 세부내역서는 환자의 구체적인 처방 내역 등이 확인되므로 원칙적으로 환자 본인 외에 발급을 금합니다. 다만, 본 세부내역서 발급에 대해 별도로 환자 본인으로부터 위임을 받은 것이 확인된 자 또는 법정대리인에겐 발급이 가능합니다. 2. 비고란은 세부산정내역을 발부하는 영수증번호 등 요양기관이 필요한 경우 추가 기재하는 공간으로 활용할 수 있습니다. 3. 동 서식에 명시된 항목은 「국민건강보험 요양급여의 기준에 관한 규칙」 제7조제3항에 따라 필수 기재되어야 합니다. ========== 파일: i??i?μe³?i??.pdf ==========",
          "visitDate": "2025-02-20",
          "reason": "응급실 내원",
          "diagnosis": "미확인",
          "admissionPeriod": "undefined ~ undefined",
          "surgeryInfo": null,
          "notes": "란은 세부산정내역을 발부하는 영수증번호 등 요양기관이 필요한 경우 추가 기재하는 공간으로 활용할 수 있습니다. 3. 동 서식에 명시된 항목은 「국민건강보험 요양급여의 기준에 관한 규칙」 제7조제3항에 따라 필수 기재되어야 합니다. ========== 파일: i??i?μe³?i??.pdf =========="
        }
      ],
      "insuranceClaims": [
        {
          "date": "",
          "company": "미확인 보험사",
          "paymentDate": null,
          "amount": null,
          "notes": ""
        }
      ]
    },
    "progressReport": "NaN\n의료 경과보고서\nMedical Progress Report\n생성일: 2025.08.17\nNaN\n\n■ 환자 정보 (Patient Information)\nNaN\n환자명: 발급목적\n생년월일: 1971.10.24 (만 53세)\n등록번호: 711024\n\n■ 보험 가입 조건 (Insurance Conditions)\nNaN\n1. , 7) 위탁여부, 8)기타 24.03.27 1. 사고)경우( 25.02.20. 봄익병원 → 이대목동서 빈경환 1월 말 빈혈 증상으로 전남대시. 수혈 시행 명절 방문. 다른 화면. 주변에서 병원 방식을 요구 거부. 형제들과 같이 붙어서 노뜬 검사 (간경화 진단) 진료의뢰→ 이라서 입원 ICV. 입원 2일경 간경화 - 위장관 출력을 직접 사안으로 사망. 김민성 (아드님). 따님(19세). 대표 박사 김민성님 지능.. 2. 수익자 배우자님 이는 2019년 정도. 당시 간질환등 알고 있는 기저질의 X. 건강하시고 병원을 잘안가신. 답변자 SUNRISE SURVEYORS & CLAIMS ADJUSTERS CO., LTD. (인) 2025-02-28 17:30:27 3. 다\n   가입일: 미확인\n   상품명: 미확인 상품\n   담보내용: 미확인 담보\n   상태: 유효\n\n2. 미래에셋. 종신. - 접수 실상 대기다 4. 직업직무 청약시 - 지영업 사그림사 회사원 5. 식인수중상한제 청구-이대목동 영광클립해 나원→ 진료우리→ 전남대병원. 이효구- 봉익병원. 상기의 내용은 신의 성실에 입각하여 사실대로 기재하였음을 확인하며 아래에 서명 및 날인 합니다. 빈경환 답변일자 : 2025.3.02 답변장소 : 답변자 : 김민성 김민성 피(\n   가입일: 미확인\n   상품명: 미확인 상품\n   담보내용: 미확인 담보\n   상태: 유효\n\n3. 발급일 2025-03-10 매수 21 발급자 황재호 10 첨부한 사본은 의무기록 원본과 같음을 증명합니다. EWHAN 이화여자대학교, ? EU 0 CENTER *상기용도 이외에는 이 사본을 사용할 수 없으며, 사용용도 또는 사용기간이 완료 된 후 즉시 파본, 폐기하여야 합니다. INS XMED * 검사결과가 나오지 않은 것은 사본발급 되지 않습니다. 이화여자대학교 의과대학부속 목동병원장 (07985) 서울특별시 양천구 안양천로 1071 EUMC 이대목동병원 MOKDONG 요양급여의뢰서 건강\n   가입일: 미확인\n   상품명: 미확인 상품\n   담보내용: 미확인 담보\n   상태: 유효\n\n4. 미확인 보험사\n   가입일: 미확인\n   상품명: 진료기간 2025/02/19 의뢰사유 □ 의사 판단 주호소 의상 상병 분류기호 진료구분 □ 입원 외래 환자 요청 상기 환자는 3주 전 타병원에서 처음 alcoholic LC로 진단받은 자로 이에 대한 치료 위해 본원 소화기내과에 내원하였습니다. 그 전에는 알고 있는 기저 질환이 없다고 하였습니다. 환자는 아래 lab 상심한 hypoglycemia가 있고 CG도 상승되어 있어 이에 대한 상급 병원 진료가 필요하다고 판단되어 의뢰드리오니 바쁘신 가운데 고진선처 부탁드립니다. 감사합니다. 진료 소견 환자상태 및 진료소 결 긴급 진료 필요 여부 □ Y (구체적 긴급 진료 필요 사유 기술) 치료 · 검사 내역 CBC 10800(83.8%)-8.0-85k CRP 4.55 glucose 35 TB/DB 6.2/4.8 [AST/ALT 143/31 N 과거력 및 투익력 BUN/Cr 13.9/1.98 TG/LDL 459/38 ALP/GTP 154/290 amylase/lipase 109/124 [특종] 2025-02-19 MOR 김선삼 (0002) 71102453/M 11016279 AER 기타 가족력 알리지 유무 등 회신 요청 예 아니오 진료정보제공 한자동의서 본인은 상호 진료협력을 위해서 본인의 진료 결과 및 진료회신서 등의 진료정보를 의뢰의사에게 제공(인터넷 조회)하는 것을 동의합니다. 환자 또는 보호사 : 위와 같이 진료를 의뢰합니다. 환자와의 관계: 2025년 02월 19일 의료기관명칭 : 홍익병원 담당의사 면허번호: 115932 담당의사 성명: 송경한 의료기관대표시 귀하 1. 이 진료의뢰서는 협력기관간 진료의뢰 화 시범사업기관으로 지정받은 1단계 진료기관에서 환자의 상태에 따라 2단계 진료기관으로 요양급여 담당의사가 작성하며, 비용은 의뢰환자관리료의 소정점수에 포함됩니다. '진료의뢰서는 의사의 발급일로부터 7일(공휴일 제외)이내에 제출하여야 합니다. [특] 2025-02-19 MDR (0001) 김선삼 711024 53/M 11016279 AER 요양급여 회송(의뢰)서 연번호 2025-A0007152 건강\n   담보내용: 미확인 담보\n   상태: 유효\n\n5. 제출용 매 수 : 7 매 첨부한 사본은 의무기록 원본과 틀림이 없음을 증명합니다. ※본 의무기록 사본은 상기 용도 이외에는 사용할 수 없음 ※ 2025년 03월 10일 담당자: 송현정 Leng ※담당자의 날인(서명)이 없는 것은 무효임※ 홍익병원 장 홍익병원 HONG IK HOSPITAL 경과기록지 등록번호: 97360430 주민번호 : 711024-1****** 주소: 서울 강서구 화곡로18길 38 [공인인증] 2025/02/19 경과기록지 [송경한] 성명: 김선삼 나이/성별: 53/M 유형 :\n   가입일: 미확인\n   상품명: 미확인 상품\n   담보내용: 미확인 담보\n   상태: 유효\n\n■ 보험 가입 이력 (Insurance History)\nNaN\n[보험 가입 3개월 이내]\n미확인 , 7) 위탁여부, 8)기타 24.03.27 1. 사고)경우( 25.02.20. 봄익병원 → 이대목동서 빈경환 1월 말 빈혈 증상으로 전남대시. 수혈 시행 명절 방문. 다른 화면. 주변에서 병원 방식을 요구 거부. 형제들과 같이 붙어서 노뜬 검사 (간경화 진단) 진료의뢰→ 이라서 입원 ICV. 입원 2일경 간경화 - 위장관 출력을 직접 사안으로 사망. 김민성 (아드님). 따님(19세). 대표 박사 김민성님 지능.. 2. 수익자 배우자님 이는 2019년 정도. 당시 간질환등 알고 있는 기저질의 X. 건강하시고 병원을 잘안가신. 답변자 SUNRISE SURVEYORS & CLAIMS ADJUSTERS CO., LTD. (인) 2025-02-28 17:30:27 3. 다 가입 (미확인)\n\n[보험 가입 3개월 이내]\n미확인 미래에셋. 종신. - 접수 실상 대기다 4. 직업직무 청약시 - 지영업 사그림사 회사원 5. 식인수중상한제 청구-이대목동 영광클립해 나원→ 진료우리→ 전남대병원. 이효구- 봉익병원. 상기의 내용은 신의 성실에 입각하여 사실대로 기재하였음을 확인하며 아래에 서명 및 날인 합니다. 빈경환 답변일자 : 2025.3.02 답변장소 : 답변자 : 김민성 김민성 피( 가입 (미확인)\n\n[보험 가입 3개월 이내]\n미확인 발급일 2025-03-10 매수 21 발급자 황재호 10 첨부한 사본은 의무기록 원본과 같음을 증명합니다. EWHAN 이화여자대학교, ? EU 0 CENTER *상기용도 이외에는 이 사본을 사용할 수 없으며, 사용용도 또는 사용기간이 완료 된 후 즉시 파본, 폐기하여야 합니다. INS XMED * 검사결과가 나오지 않은 것은 사본발급 되지 않습니다. 이화여자대학교 의과대학부속 목동병원장 (07985) 서울특별시 양천구 안양천로 1071 EUMC 이대목동병원 MOKDONG 요양급여의뢰서 건강 가입 (미확인)\n\n[보험 가입 3개월 이내]\n미확인 미확인 보험사 가입 (미확인)\n\n[보험 가입 3개월 이내]\n미확인 제출용 매 수 : 7 매 첨부한 사본은 의무기록 원본과 틀림이 없음을 증명합니다. ※본 의무기록 사본은 상기 용도 이외에는 사용할 수 없음 ※ 2025년 03월 10일 담당자: 송현정 Leng ※담당자의 날인(서명)이 없는 것은 무효임※ 홍익병원 장 홍익병원 HONG IK HOSPITAL 경과기록지 등록번호: 97360430 주민번호 : 711024-1****** 주소: 서울 강서구 화곡로18길 38 [공인인증] 2025/02/19 경과기록지 [송경한] 성명: 김선삼 나이/성별: 53/M 유형 : 가입 (미확인)\n\n■ 진료 기록 (Medical Records)\nNaN\n[미확인] . 이효구- 봉익병원. 상기의 내용은 신의 성실에 입각하여 사실대로 기재하였음을 확인하며 아래에 서명 및 날인 합니다. 빈경환 답변일자 :\n내원일: 미확인\n내원사유: 정기 진료\n진단명: 미확인\n중증도: 경미\n\n[미확인] 미확인 의료기관\n내원일: 미확인\n내원사유: 정기 진료\n진단명: 미확인\n처방: )일수 상병명 요양기관명 요양기관연락처 공단부담금 본인부담금 총건수 27 100/100미만 본인부담금 총진료비 합계 공단부담금합계 본인부담금 합계 100/100미만공단부담금합계 100/100미만본인부담금합계 100/100미만공단부담금 1,193,830 716,530 477,300 0 0 1\n중증도: 경미\n\n[미확인] 12,620 5,300 2\n내원일: 미확인\n내원사유: 정기 진료\n진단명: 미확인\n중증도: 경미\n\n[미확인] 12,590 12,400 0 4\n내원일: 미확인\n내원사유: 정기 진료\n진단명: 미확인\n중증도: 경미\n\n[미확인] 02-2693-5555 38,520 38,400 0 5\n내원일: 미확인\n내원사유: 정기 진료\n진단명: 미확인\n중증도: 경미\n\n[미확인] 6,800 02-2693-5555 0 0 외래 M1097 홍익병원 6,850 6,800 8\n내원일: 미확인\n내원사유: 정기 진료\n진단명: 미확인\n중증도: 경미\n\n[미확인] 02-2693-5555 7,960 7,800 0 0 10\n내원일: 미확인\n내원사유: 정기 진료\n진단명: 미확인\n중증도: 경미\n\n[미확인] 미확인 의료기관\n내원일: 미확인\n내원사유: 정기 진료\n진단명: 미확인\n처방: )일수 상병명 요양기관명 요양기관연락처 공단부담금 본인부담금 총건수 27 100/100미만 본인부담금 총진료비 합계 공단부담금합계 본인부담금 합계 100/100미만공단부담금합계 100/100미만본인부담금합계 100/100미만공단부담금 1,193,830 716,530 477,300 0 11\n중증도: 경미\n\n[미확인] -1544-2875 51,820 34,500 0 0 12\n내원일: 미확인\n내원사유: 정기 진료\n진단명: 미확인\n중증도: 경미\n\n[미확인] -1544-2875 77,940 51,800 0 0 14\n내원일: 미확인\n내원사유: 정기 진료\n진단명: 미확인\n중증도: 경미\n\n[미확인] -1544-2875 34,710 23,000 0 15\n내원일: 미확인\n내원사유: 정기 진료\n진단명: 미확인\n특이사항: 명시된급성치주염 목동중앙치과병원 -1544-2875 34,710 23,000 0 15\n중증도: 경미\n\n[미확인] 50,790 17\n내원일: 미확인\n내원사유: 정기 진료\n진단명: 미확인\n중증도: 경미\n\n[미확인] -1544-2875 51,780 18\n내원일: 미확인\n내원사유: 정기 진료\n진단명: 미확인\n중증도: 경미\n\n[미확인] -1544-2875 47,410 19\n내원일: 미확인\n내원사유: 정기 진료\n진단명: 미확인\n중증도: 경미\n\n[미확인] -1544-2875 55,250 36,700 0 20\n내원일: 미확인\n내원사유: 정기 진료\n진단명: 미확인\n중증도: 경미\n\n[미확인] -1544-2875 99,900 66,500 0 0002 / 0004 건강보험 요양급여내역 전체 출력 선택 출력 성명 발급목적 급여기간 김선삼 순번 진료개시일 사망한 가족의 진료내역\n내원일: 미확인\n내원사유: 정기 진료\n진단명: 미확인\n중증도: 경미\n\n[미확인] 미확인 의료기관\n내원일: 미확인\n내원사유: 정기 진료\n진단명: 미확인\n처방: )일수 상병명 요양기관명 요양기관연락처 공단부담금 본인부담금 100/100미만공단부담금 100/100미만 본인부담금 총건수 27 총진료비 합계 공단부담금합계 본인부담금 합계 100/100미만공단부담금합계 100/100미만본인부담금합계 21 1,193,830\n중증도: 경미\n\n[미확인] 477,300 1 어지럼증및어지럼 02-2066-7513 0 22 11,030 22\n내원일: 미확인\n내원사유: 정기 진료\n진단명: 미확인\n중증도: 경미\n\n[미확인] -1544-2875 11,440 7,600 0 0 23\n내원일: 미확인\n내원사유: 정기 진료\n진단명: 미확인\n중증도: 경미\n\n[미확인] -1544-2875 40,270 26,800 0 0 24\n내원일: 미확인\n내원사유: 정기 진료\n진단명: 미확인\n중증도: 경미\n\n[미확인] 02-976-3658 8,280 3,500 25\n내원일: 미확인\n내원사유: 정기 진료\n진단명: 미확인\n중증도: 경미\n\n[미확인] 02-976-3658 11,580 4,900 0 26\n내원일: 미확인\n내원사유: 정기 진료\n진단명: 미확인\n중증도: 경미\n\n[미확인] 18,890 12,500 27\n내원일: 미확인\n내원사유: 정기 진료\n진단명: 미확인\n중증도: 경미\n\n[미확인] 의무기록사본 총 0부 (표지제외) 빈경환 의무기록사본증명서 등록번호 환자성명 김선삼\n내원일: 미확인\n내원사유: 정기 진료\n진단명: 미확인\n중증도: 경미\n\n[미확인] 장 (07985) 서울특별시 양천구 안양천로 1071 EUMC 이대목동병원 MOKDONG 요양급여의뢰서 건강보험증번호(사업장기호)\n내원일: 미확인\n내원사유: 정기 진료\n진단명: 미확인\n특이사항: 가 나오지 않은 것은 사본발급 되지 않습니다. 이화여자대학교 의과대학부속 목동병원장 (07985) 서울특별시 양천구 안양천로 1071 EUMC 이대목동병원 MOKDONG 요양급여의뢰서 건강보험증번호(사업장기호)\n중증도: 경미\n\n[2025.02.19] 담당의사 면허번호: 115932 담당의사 성명: 송경한 의료기관대표시 귀하 1. 이 진료의뢰서는 협력기관간 진료의뢰 화 시범사업기관으로 지정받은 1단계 진료기관에서 환자의 상태에 따라 2단계 진료기관으로 요양급여 담당의사가 작성하며, 비용은 의뢰환자관리료의 소정점수에 포함됩니다. '진료의뢰서는 의사의 발급일로부터 7일(공휴일 제외)이내에 제출하여야 합니다. [특]\n내원일: 2025.02.19\n내원사유: 정기 진료\n진단명: 미확인\n중증도: 경미\n\n[미확인] [환자상태 및 진료소견] ■ 평가 및 치료계획 ■ 환자상태(회송사유) 상기 환자 특이 기저질환 없는 자로,\n내원일: 미확인\n내원사유: 정기 진료\n진단명: 미확인\n특이사항: ] ■ 평가 및 치료계획 ■ 환자상태(회송사유) 상기 환자 특이 기저질환 없는 자로,\n중증도: 경미\n\n[미확인] 일자 검사명/결과\n내원일: 미확인\n내원사유: 정기 진료\n진단명: 미확인\n중증도: 경미\n\n[미확인] EUMC 이대목동병원 MOKDONG 등록번호 :\n내원일: 미확인\n내원사유: 정기 진료\n진단명: 미확인\n중증도: 경미\n\n[미확인] 미확인 의료기관\n내원일: 미확인\n내원사유: 정기 진료\n진단명: 서 수정 원하셔서 오심 Objective information Vital Signs Ht: 153 cm Assessment #LC with bleeding Plan 진단서 보완해드림 EWHA WOMANS EU MC CENTER MEDICAL 응급초진 작성과: 응급의학과 (\n특이사항: 및 계획 Subjective information 진단서 수정 원하셔서 오심 Objective information Vital Signs Ht: 153 cm Assessment #LC with bleeding Plan 진단서 보완해드림 EWHA WOMANS EU MC CENTER MEDICAL 응급초진 작성과: 응급의학과 (\n중증도: 위중\n\n[미확인] MOKOONG 등록번호 :\n내원일: 미확인\n내원사유: 정기 진료\n진단명: 미확인\n중증도: 경미\n\n[미확인] MOKDONG 등록번호:\n내원일: 미확인\n내원사유: 정기 진료\n진단명: 미확인\n중증도: 경미\n\n[미확인] 미확인 의료기관\n내원일: 미확인\n내원사유: 정기 진료\n진단명: [주]Gastrointestinal hemorrhage 첨부한 사본은 의무기록 원본과 같음을 증명합니다. 3/12 출력자 : 황재호 (\n중증도: 경미\n\n[미확인] MOKDONG 등록번호 :\n내원일: 미확인\n내원사유: 정기 진료\n진단명: 미확인\n중증도: 경미\n\n[미확인] MOKDONG 등록번호 :\n내원일: 미확인\n내원사유: 정기 진료\n진단명: 미확인\n중증도: 경미\n\n[미확인] MOKDONG 등록번호 :\n내원일: 미확인\n내원사유: 정기 진료\n진단명: 미확인\n중증도: 경미\n\n[미확인] MOKOONG 등록번호:\n내원일: 미확인\n내원사유: 정기 진료\n진단명: 미확인\n중증도: 경미\n\n[미확인] MOKDONG 등록번호 :\n내원일: 미확인\n내원사유: 정기 진료\n진단명: 미확인\n중증도: 경미\n\n[미확인] MOKDONG 등록번호 :\n내원일: 미확인\n내원사유: 정기 진료\n진단명: 미확인\n중증도: 경미\n\n[미확인] 미확인 의료기관\n내원일: 미확인\n내원사유: 정기 진료\n진단명: 기준 5) 소화기계 문제 전격간부전 8) 기타 신기능 부전 EWH EU 작성자 정의선 정의선 Check principal diagnostic categories leading to ICU admission I. Non-operative patients 5. Other Gl Bleeding Gastrointestinal WQgAN CENTER 6. If not in one of the specific groups above, then which major vital organ system was the principal reason for admission? UNIVERSITY MEDIC 타과의뢰 작성과: 소화기내과 (\n특이사항: 신기능 부전 EWH EU 작성자 정의선 정의선 Check principal diagnostic categories leading to ICU admission I. Non-operative patients 5. Other Gl Bleeding Gastrointestinal WQgAN CENTER 6. If not in one of the specific groups above, then which major vital organ system was the principal reason for admission? UNIVERSITY MEDIC 타과의뢰 작성과: 소화기내과 (\n중증도: 경미\n\n[미확인] 미확인 의료기관\n내원일: 미확인\n내원사유: 정기 진료\n진단명: Hepatorenal syndrome Alcoholic LC 첨부한 사본은 의무기록 원본과 같음을 증명합니다. 작성자 정의선 정의선 9/12 출력자 : 황재호 (\n중증도: 경미\n\n[미확인] MOKOONG 등록번호 :\n내원일: 미확인\n내원사유: 정기 진료\n진단명: 미확인\n중증도: 경미\n\n[미확인] MOKDONG 등록번호 :\n내원일: 미확인\n내원사유: 정기 진료\n진단명: 미확인\n중증도: 경미\n\n[미확인] MOKDONG 등록번호 :\n내원일: 미확인\n내원사유: 정기 진료\n진단명: 미확인\n중증도: 경미\n\n[미확인] MOKOONG 등록번호 :\n내원일: 미확인\n내원사유: 정기 진료\n진단명: 미확인\n중증도: 경미\n\n[미확인] 미확인 의료기관\n내원일: 미확인\n내원사유: 정기 진료\n진단명: Gastrointestinal hemorrhage 임상소견 및 병력: 검사명: Chest PA [Finding] There is no abnormality in the lung. The heart is within normal limit in size and shape. There is no visible abnormality of the pleura. Others are not remarkable. [Conclusion] Negative chest 영상검사결과 EWHA WOM 진료과/병동 (의뢰처) : 응급실 (응급) be대학교의료, EU MC (의뢰일 :\n특이사항: 및 병력: 검사명: Chest PA [Finding] There is no abnormality in the lung. The heart is within normal limit in size and shape. There is no visible abnormality of the pleura. Others are not remarkable. [Conclusion] Negative chest 영상검사결과 EWHA WOM 진료과/병동 (의뢰처) : 응급실 (응급) be대학교의료, EU MC (의뢰일 :\n중증도: 위중\n\n[미확인] 미확인 의료기관\n내원일: 미확인\n내원사유: 정기 진료\n진단명: Gastrointestinal hemorrhage 임상소견 및 병력: 검사명: Abdomen Supine [Finding] CENTER\n특이사항: 및 병력: 검사명: Abdomen Supine [Finding] CENTER\n중증도: 경미\n\n[미확인] MOKOONG 등록번호:\n내원일: 미확인\n내원사유: 정기 진료\n진단명: 미확인\n중증도: 경미\n\n[미확인] 미확인 의료기관\n내원일: 미확인\n내원사유: 정기 진료\n진단명: Gastrointestinal hemorrhage 임상소견 및 병력: 판독의 : 박정환, 박정환, 박정환 의료 료원 검사명: CT Abdomen/Pelvis [Finding] 이화여자대학교, Precontrast scan 만을 시행하였음. Liver의 volume이 증가되어 있고 attenuation이 감소되어 있으며 umbilical vein의 recanalization이 있어 alcoholic liver cirrhosis로 생각됨. 다량의 ascites가 있음. Stomach의 fluid distension이 있음. Ureteral obstruction은 동반되어 있지 않음. Abnormal bowel dilatation 보이지 않음. [Conclusion] MA 1. Possibility of alcoholic liver cirrhosis. 2. A large amount of ascites. 3. Gastric distension with fluid. MC UNIVERSITY MEDICAL CEN 영상검사결과 진료과/병동 (의뢰처) : 소화기내과 (EICU) (의뢰일 :\n특이사항: 및 병력: 판독의 : 박정환, 박정환, 박정환 의료 료원 검사명: CT Abdomen/Pelvis [Finding] 이화여자대학교, Precontrast scan 만을 시행하였음. Liver의 volume이 증가되어 있고 attenuation이 감소되어 있으며 umbilical vein의 recanalization이 있어 alcoholic liver cirrhosis로 생각됨. 다량의 ascites가 있음. Stomach의 fluid distension이 있음. Ureteral obstruction은 동반되어 있지 않음. Abnormal bowel dilatation 보이지 않음. [Conclusion] MA 1. Possibility of alcoholic liver cirrhosis. 2. A large amount of ascites. 3. Gastric distension with fluid. MC UNIVERSITY MEDICAL CEN 영상검사결과 진료과/병동 (의뢰처) : 소화기내과 (EICU) (의뢰일 :\n중증도: 경미\n\n[미확인] 미확인 의료기관\n내원일: 미확인\n내원사유: 정기 진료\n진단명: Hypoprothrombinemia secondary to liver disease 임상소견 및 병력: 판독의 : 이정경, 이정경 첨부한 사본은 의무기록 원본과 같음을 증명합니다. 2/6 출력자 : 황재호 (\n특이사항: 및 병력: 판독의 : 이정경, 이정경 첨부한 사본은 의무기록 원본과 같음을 증명합니다. 2/6 출력자 : 황재호 (\n중증도: 경미\n\n[미확인] MOKDONG 등록번호 :\n내원일: 미확인\n내원사유: 정기 진료\n진단명: 미확인\n중증도: 경미\n\n[미확인] 미확인 의료기관\n내원일: 미확인\n내원사유: 정기 진료\n진단명: Hypoprothrombinemia secondary to liver disease 임상소견 및 병력: 검사명: Abdomen Supine [Finding] r/o mechanical ileus [Conclusion] WHA WOMANS U MC 영상검사결과 진료과/병동 (의뢰처) : 소화기내과 (EICU) (의뢰일 :\n특이사항: 및 병력: 검사명: Abdomen Supine [Finding] r/o mechanical ileus [Conclusion] WHA WOMANS U MC 영상검사결과 진료과/병동 (의뢰처) : 소화기내과 (EICU) (의뢰일 :\n중증도: 경미\n\n[미확인] 미확인 의료기관\n내원일: 미확인\n내원사유: 정기 진료\n진단명: Hypoprothrombinemia secondary to liver disease 판독의 : 박호영, 박호영, 박호영 CENTER 판독의 : 박정환, 박정환, 박정환 첨부한 사본은 의무기록 원본과 같음을 증명합니다. 3/6 출력자 : 황재호 (\n중증도: 경미\n\n[미확인] MOKDONG 등록번호 :\n내원일: 미확인\n내원사유: 정기 진료\n진단명: 미확인\n중증도: 경미\n\n[미확인] MOKDONG 등록번호:\n내원일: 미확인\n내원사유: 정기 진료\n진단명: 미확인\n중증도: 경미\n\n[미확인] MOKOONG 등록번호:\n내원일: 미확인\n내원사유: 정기 진료\n진단명: 미확인\n중증도: 경미\n\n[미확인] MOKDONG 등록번호 :\n내원일: 미확인\n내원사유: 정기 진료\n진단명: 미확인\n중증도: 경미\n\n[미확인] 종류 : 종합병원 내원전 병원명 : 홍익병원 내원수단 : 기타 자동차 내원사유(질병여부) : 질병 내원 주증상 : abdominal distension 내원 주증상2:gum bleeding ~화여자대학교, 내원동기 및 현상태 : abdominal distension, gum bleeding 신체사정 활력징후 SBP(mmHg) :160 DBP(mmHg) :90 PR(회/min) :137 RR(회/min) :22 BT(°C):35 SpO2(%):100 전반적 상태 통증 유무 : 유 통증 도구 : NRS 통증 강도:8 의식상태 내원시 반응 :alert 호흡기계 호흡기장애 유무 : 유 EWHA 의료 료원 EU MC WOMANS 호흡기장애 종류 :호흡곤란 감염의심정보 열(1주일이내 37.5℃ 이상) :무 CENTER MEDICAL 해외 여행력(3주 이내) :무 발진 : 무 작성자 박은빈 박은빈 초기간호정보 첨부한 사본은 의무기록 원본과 같음을 증명합니다. 1/3 출력자 : 황재호 (\n내원일: 미확인\n내원사유: abdominal distension 내원 주증상2:gum bleeding ~화여자대학교, 내원동기 및 현상태 : abdominal distension, gum bleeding 신체사정 활력징후 SBP(mmHg) :160 DBP(mmHg) :90 PR(회/min) :137 RR(회/min) :22 BT(°C):35 SpO2(%):100 전반적 상태 통증 유무 : 유 통증 도구 : NRS 통증 강도:8 의식상태 내원시 반응 :alert 호흡기계 호흡기장애 유무 : 유 EWHA 의료 료원 EU MC WOMANS 호흡기장애 종류 :호흡곤란 감염의심정보 열(1주일이내 37.5℃ 이상) :무 CENTER MEDICAL 해외 여행력(3주 이내) :무 발진 : 무 작성자 박은빈 박은빈 초기간호정보 첨부한 사본은 의무기록 원본과 같음을 증명합니다. 1/3 출력자 : 황재호 (\n진단명: 미확인\n특이사항: 자동차 내원사유(질병여부) : 질병 내원 주증상 : abdominal distension 내원 주증상2:gum bleeding ~화여자대학교, 내원동기 및 현상태 : abdominal distension, gum bleeding 신체사정 활력징후 SBP(mmHg) :160 DBP(mmHg) :90 PR(회/min) :137 RR(회/min) :22 BT(°C):35 SpO2(%):100 전반적 상태 통증 유무 : 유 통증 도구 : NRS 통증 강도:8 의식상태 내원시 반응 :alert 호흡기계 호흡기장애 유무 : 유 EWHA 의료 료원 EU MC WOMANS 호흡기장애 종류 :호흡곤란 감염의심정보 열(1주일이내 37.5℃ 이상) :무 CENTER MEDICAL 해외 여행력(3주 이내) :무 발진 : 무 작성자 박은빈 박은빈 초기간호정보 첨부한 사본은 의무기록 원본과 같음을 증명합니다. 1/3 출력자 : 황재호 (\n중증도: 경미\n\n[미확인] MOKDONG 등록번호 :\n내원일: 미확인\n내원사유: 정기 진료\n진단명: 미확인\n중증도: 경미\n\n[미확인] MOKOONG 등록번호:\n내원일: 미확인\n내원사유: 정기 진료\n진단명: 미확인\n중증도: 경미\n\n[미확인] 의무기록사본 총 0부 (표지제외) 빈경환 의무기록 사본 증명서 등록번호 :\n내원일: 미확인\n내원사유: 정기 진료\n진단명: 미확인\n중증도: 경미\n\n[2025.03.10] 장 홍익병원 HONG IK HOSPITAL 경과기록지 등록번호:\n내원일: 2025.03.10\n내원사유: 정기 진료\n진단명: 미확인\n중증도: 경미\n\n[미확인] 에서 alcoholi LC로 진단받고 이에 대해 치료 받기 위해 내원함. * 본 의무기록은 홍익병원 전산시스템으로 출력하여 원본 1 출력일 :\n내원일: 미확인\n내원사유: 정기 진료\n진단명: 받고 이에 대해 치료 받기 위해 내원함. * 본 의무기록은 홍익병원 전산시스템으로 출력하여 원본 1 출력일 :\n중증도: 경미\n\n[미확인] HONG IK HOSPITAL 담당의사: 노형진 con E ㅎ이변의 저사시ㅅㅇㄹ 추려하여 위보가 다르이 없습니다 출력일시:\n내원일: 미확인\n내원사유: headache 현병력 다친 후 금일 s/o 위해 내원함. 진료내용 과거력) ? None ? DM ? HTN ? TBC ? CVA Hx 사회력) ? None ? Alcohol 회/주 ? Smoking 갑/일 알러지) 계통문진) 신체검사) 통증평가 □무 숫자통증도구(NRS) 2 점 통증위치: 머리 양상: □ 둔함 □ 쑤심 빈도: □ 저림 □ 날카로움 □ 찌르는듯함 □ 기타 기간: □ 계속적 □ 주기적 수일. □ 간헐적 □ 기타 특이사항 r/o laceration scalp 진단명 ctx 치료계획 및 검사내용 )홍익병원 HONG IK HOSPITAL 담당의사: 노형진 con E ㅎ이변의 저사시ㅅㅇㄹ 추려하여 위보가 다르이 없습니다 출력일시:\n진단명: ctx 치료계획 및 검사내용 )홍익병원 HONG IK HOSPITAL 담당의사: 노형진 con E ㅎ이변의 저사시ㅅㅇㄹ 추려하여 위보가 다르이 없습니다 출력일시:\n특이사항: 기간: □ 계속적 □ 주기적 수일. □ 간헐적 □ 기타 특이사항 r/o laceration scalp 진단명 ctx 치료계획 및 검사내용 )홍익병원 HONG IK HOSPITAL 담당의사: 노형진 con E ㅎ이변의 저사시ㅅㅇㄹ 추려하여 위보가 다르이 없습니다 출력일시:\n중증도: 경미\n\n[미확인] *보 이무기록지는 홍익병원전산 시스템으로 출력하여 원본과 다름이 없습니다. 출력일:\n내원일: 미확인\n내원사유: 빈도 : Imp: gout foot Rt. Plan : nausea/vomiting/diarrhea(-/-/-) headache/LBP/L.E.P/Pain On (-/-/-/-) 홍익병원 *보 이무기록지는 홍익병원전산 시스템으로 출력하여 원본과 다름이 없습니다. 출력일:\n진단명: 미확인\n중증도: 경미\n\n[미확인] 전산시스템으로 출력하여 원톤 1 출력일 :\n내원일: 미확인\n내원사유: 정기 진료\n진단명: 미확인\n중증도: 경미\n\n[미확인] AU214 의료질평가지원금- 의료질 및 환자번호 환자성명 진료기간 병실\n내원일: 미확인\n내원사유: 정기 진료\n진단명: 미확인\n중증도: 경미\n\n[미확인] (\n내원일: 미확인\n내원사유: 정기 진료\n진단명: 미확인\n중증도: 경미\n\n[미확인] 미확인 의료기관\n내원일: 미확인\n내원사유: 정기 진료\n진단명: 미확인\n처방: 내역 등이 확인되므로 원칙적으로 환자 본인 외에 발급을 금합니다. 다만, 본 세부내역서 발급에 대해 별도로 환자 본인으로부터 위임을 받은 것이 확인된 자 또는 법정대리인에겐 발급이 가능합니다. 2. 비고란은 세부산정내역을 발부하는 영수증번호 등 요양기관이 필요한 경우 추가 기재하는 공간으로 활용할 수 있습니다. 3. 동 서식에 명시된 항목은 [국민건강보험 요양급여의 기준에 관한 규칙] 제7조제3항에 따라 필수 기재되어야 합니다.\n특이사항: 란은 세부산정내역을 발부하는 영수증번호 등 요양기관이 필요한 경우 추가 기재하는 공간으로 활용할 수 있습니다. 3. 동 서식에 명시된 항목은 [국민건강보험 요양급여의 기준에 관한 규칙] 제7조제3항에 따라 필수 기재되어야 합니다.\n중증도: 경미\n\n■ 입원 기록 (Hospitalization Records)\nNaN\n[미확인] → 이대목동서 빈경환 1월 말 빈혈 증상으로 전남대시. 수혈 시행 명절 방문. 다른 화면. 주변에서 병원 방식을 요구 거부. 형제들과 같이 붙어서 노뜬 검사 (간경화 진단) 진료의뢰→ 이라서 입원 ICV. 입원 2일경 간경화 - 위장관 출력을 직접 사안으로 사망. 김민성 (아드님). 따님(19세). 대표 박사 김민성님 지능.. 2. 수익자 배우자님 이는 2019년 정도. 당시 간질환등 알고 있는 기저질의 X. 건강하시고 병원을 잘안가신. 답변자 SUNRISE SURVEYORS & CLAIMS ADJUSTERS CO., LTD. (인)\n내원일: 미확인\n내원사유: 으로 전남대시. 수혈 시행 명절 방문. 다른 화면. 주변에서 병원 방식을 요구 거부. 형제들과 같이 붙어서 노뜬 검사 (간경화 진단) 진료의뢰→ 이라서 입원 ICV. 입원 2일경 간경화 - 위장관 출력을 직접 사안으로 사망. 김민성 (아드님). 따님(19세). 대표 박사 김민성님 지능.. 2. 수익자 배우자님 이는 2019년 정도. 당시 간질환등 알고 있는 기저질의 X. 건강하시고 병원을 잘안가신. 답변자 SUNRISE SURVEYORS & CLAIMS ADJUSTERS CO., LTD. (인)\n진단명: ) 진료의뢰→ 이라서 입원 ICV. 입원 2일경 간경화 - 위장관 출력을 직접 사안으로 사망. 김민성 (아드님). 따님(19세). 대표 박사 김민성님 지능.. 2. 수익자 배우자님 이는 2019년 정도. 당시 간질환등 알고 있는 기저질의 X. 건강하시고 병원을 잘안가신. 답변자 SUNRISE SURVEYORS & CLAIMS ADJUSTERS CO., LTD. (인)\n입원기간: undefined ~ undefined\n\n[미확인] 에서 처음 alcoholic LC로 진단받은 자로 이에 대한 치료 위해 본원 소화기내과에 내원하였습니다. 그 전에는 알고 있는 기저 질환이 없다고 하였습니다. 환자는 아래 lab 상심한 hypoglycemia가 있고 CG도 상승되어 있어 이에 대한 상급 병원 진료가 필요하다고 판단되어 의뢰드리오니 바쁘신 가운데 고진선처 부탁드립니다. 감사합니다. 진료 소견 환자상태 및 진료소 결 긴급 진료 필요 여부 □ Y (구체적 긴급 진료 필요 사유 기술) 치료 · 검사 내역 CBC 10800(83.8%)-8.0-85k CRP 4.55 glucose 35 TB/DB 6.2/4.8 [AST/ALT 143/31 N 과거력 및 투익력 BUN/Cr\n내원일: 미확인\n내원사유: 의상 상병 분류기호 진료구분 □ 입원 외래 환자 요청 상기 환자는 3주 전 타병원에서 처음 alcoholic LC로 진단받은 자로 이에 대한 치료 위해 본원 소화기내과에 내원하였습니다. 그 전에는 알고 있는 기저 질환이 없다고 하였습니다. 환자는 아래 lab 상심한 hypoglycemia가 있고 CG도 상승되어 있어 이에 대한 상급 병원 진료가 필요하다고 판단되어 의뢰드리오니 바쁘신 가운데 고진선처 부탁드립니다. 감사합니다. 진료 소견 환자상태 및 진료소 결 긴급 진료 필요 여부 □ Y (구체적 긴급 진료 필요 사유 기술) 치료 · 검사 내역 CBC 10800(83.8%)-8.0-85k CRP 4.55 glucose 35 TB/DB 6.2/4.8 [AST/ALT 143/31 N 과거력 및 투익력 BUN/Cr\n진단명: 받은 자로 이에 대한 치료 위해 본원 소화기내과에 내원하였습니다. 그 전에는 알고 있는 기저 질환이 없다고 하였습니다. 환자는 아래 lab 상심한 hypoglycemia가 있고 CG도 상승되어 있어 이에 대한 상급 병원 진료가 필요하다고 판단되어 의뢰드리오니 바쁘신 가운데 고진선처 부탁드립니다. 감사합니다. 진료 소견 환자상태 및 진료소 결 긴급 진료 필요 여부 □ Y (구체적 긴급 진료 필요 사유 기술) 치료 · 검사 내역 CBC 10800(83.8%)-8.0-85k CRP 4.55 glucose 35 TB/DB 6.2/4.8 [AST/ALT 143/31 N 과거력 및 투익력 BUN/Cr\n입원기간: undefined ~ undefined\n특이사항: 환자상태 및 진료소 결 긴급 진료 필요 여부 □ Y (구체적 긴급 진료 필요 사유 기술) 치료 · 검사 내역 CBC 10800(83.8%)-8.0-85k CRP 4.55 glucose 35 TB/DB 6.2/4.8 [AST/ALT 143/31 N 과거력 및 투익력 BUN/Cr\n\n[미확인] 미확인 의료기관\n내원일: 미확인\n내원사유: 응급실 내원\n진단명: 일 KCD 진단명(한글) 진단부서\n입원기간: undefined ~ undefined\n\n[미확인] ) 내원하여 시 행한 검사 상 rlo undocumented alchoholic LC 의심 하에 본원 응급센터 전원 됨. #영광종합병원 진료의뢰서 impression: 1. r/o undocumented alchoholic LC 2. r/o fever d/t SBP 이전 병원 다니거나 진단받은 적 없으심. chronic alcohol drinker로 Hgb 4.0 Total calcium 7.7 Magnesium 1.2 Inorganic phosphorus 1.8 Sodium 136 Potassium 3.4 Chloride 103 Total protein 5.8 Albumin 2.5 Alkaline phosphatase 126 gamma-GTP 203 AST 98 ALT 23 Total bilirubin 3.64 Direct bilirubin 1.76 BUN 28.7 Creatinine 1.76 Glucose 158 Amylase 215 Creatine kinase 225 CRP2 (high sensitivity) 2.09 transfusion 2 pint하였고, 타원에서 당일 항생제 투약함. 입원 권유하였으나, 연고지관계상 입원 치료 힘들다고 함. 전원 소견서 작성 및 연고지에서 즉시 치료하시도록 말씀드렸습니다. 귀원에서 치료위해 의뢰드립니다. [배룡]\n내원일: 미확인\n내원사유: 로 local(영광종합병원) 내원하여 시 행한 검사 상 rlo undocumented alchoholic LC 의심 하에 본원 응급센터 전원 됨. #영광종합병원 진료의뢰서 impression: 1. r/o undocumented alchoholic LC 2. r/o fever d/t SBP 이전 병원 다니거나 진단받은 적 없으심. chronic alcohol drinker로 Hgb 4.0 Total calcium 7.7 Magnesium 1.2 Inorganic phosphorus 1.8 Sodium 136 Potassium 3.4 Chloride 103 Total protein 5.8 Albumin 2.5 Alkaline phosphatase 126 gamma-GTP 203 AST 98 ALT 23 Total bilirubin 3.64 Direct bilirubin 1.76 BUN 28.7 Creatinine 1.76 Glucose 158 Amylase 215 Creatine kinase 225 CRP2 (high sensitivity) 2.09 transfusion 2 pint하였고, 타원에서 당일 항생제 투약함. 입원 권유하였으나, 연고지관계상 입원 치료 힘들다고 함. 전원 소견서 작성 및 연고지에서 즉시 치료하시도록 말씀드렸습니다. 귀원에서 치료위해 의뢰드립니다. [배룡]\n진단명: 받은 적 없으심. chronic alcohol drinker로 Hgb 4.0 Total calcium 7.7 Magnesium 1.2 Inorganic phosphorus 1.8 Sodium 136 Potassium 3.4 Chloride 103 Total protein 5.8 Albumin 2.5 Alkaline phosphatase 126 gamma-GTP 203 AST 98 ALT 23 Total bilirubin 3.64 Direct bilirubin 1.76 BUN 28.7 Creatinine 1.76 Glucose 158 Amylase 215 Creatine kinase 225 CRP2 (high sensitivity) 2.09 transfusion 2 pint하였고, 타원에서 당일 항생제 투약함. 입원 권유하였으나, 연고지관계상 입원 치료 힘들다고 함. 전원 소견서 작성 및 연고지에서 즉시 치료하시도록 말씀드렸습니다. 귀원에서 치료위해 의뢰드립니다. [배룡]\n입원기간: undefined ~ undefined\n특이사항: 서 작성 및 연고지에서 즉시 치료하시도록 말씀드렸습니다. 귀원에서 치료위해 의뢰드립니다. [배룡]\n\n[미확인] ) 내원시 r/o undocumented alchoholic LC 2, r/o fever d/t SBP 로IV antibiotics 투여, 전남대학병원 refer 되어 Hb 4.0 으로 T/F 2pint 이후 입원 권고하였으나 연고지 문 제로 refuse 이후 자택에서 지냈다고 함. 2주 전부터 gum bleeding, abdomen distension 있어 금일 타병원(홍익병원) 오전 내원하였으며 시행한 혈액 검사 결과 상 hypoglycemia, Cr elevation 있어 further evaluation 위해 본원 ER refer 됨. 본원 ER 내원 직후 측정한 BST 36mg/dL, M/S alert 확인됨. * 내원 당일 타병원(홍익병원) 검사 결과 CBC 10800(83.8%)-8.0-85K CRP 4.55 glucose 35 TB/DB 6.2/4.8 AST/ALT 143/31 ALP/GTP 154/290 BUN/Cr\n내원일: 미확인\n내원사유: 응급실 내원\n진단명: 미확인\n입원기간: undefined ~ undefined\n\n[미확인] ) 내원시 r/o undocumented alchoholic LC 2, r/o fever d/t SBP 로IV antibiotics 투여, 전남대학병원 refer 되어 Hb 4.0 으로 T/F 2pint 이후 입원 권고하였으나 연고지 문 제로 refuse 이후 자택에서 지냈다고 함. * 2주 전부터 gum bleeding, abdomen distension 있어 금일 타병원(홍익병원) 오전 내원하였으며 시행한 혈액 검사 결과 상 hypoglycemia, Cr elevation 있어 further evaluation 위해 본원 ER refer 됨. 본원 ER 내원 직후 측정한 BST 36mg/dL, M/S alert 확인됨. 내원 당일 타병원(홍익병원) 검사 결과 CBC 10800(83.8%)-8.0-85K CRP 4.55 glucose 35 TB/DB 6.2/4.8 AST/ALT 143/31 ALP/GTP 154/290 BUN/Cr\n내원일: 미확인\n내원사유: 응급실 내원\n진단명: 미확인\n입원기간: undefined ~ undefined\n\n[미확인] ) 내원시 r/o undocumented alchoholic LC 2, r/o fever d/t SBP 로IV antibiotics 투여, 전남대학병원 refer 되어 Hb 4.0 으로 T/F 2pint 이후 입원 권고하였으나 연고지 문 제로 refuse 이후 자택에서 지냈다고 함. 2주 전부터 gum bleeding, abdomen distension 있어 금일 타병원(홍익병원) 오전 내원하였으며 시행한 혈액 검사 결과 hypoglycemia, Cr elevation of further evaluation HER refer. 최근 예방접종 정보(Vaccination) 유행성 독감 예방주사 모름 최근 1년의 해외여행 경험 모름 Past History Past history All denied Operation 확인필요 Current medications 자가약 확인필요 Review Of System General condition normal Head and neck normal Cardiovascular normal Respiratory normal Gastrointestinal abdominal distension Urinary normal Endocrine normal Musculoskeletal normal Neurologic normal Physical Examination Vital sign EWHA 이화여자대학교의료원 EU MC WOMANS Systolic blood pressure(mmHg) 121 Diastolic blood pressure (mmHg) 66 Body temperature (°C) 36.1 Respiration rate (/) 28 Pulse rate (/) 124 Height 153 Weight 48 General finding normal Head and neck normal Chest UNIVERSITY CENTER MEDICAL normal Heart 첨부한 사본은 의무기록 원본과 같음을 증명합니다. 5/12 출력자 : 황재호 (\n내원일: 미확인\n내원사유: 응급실 내원\n진단명: 미확인\n입원기간: undefined ~ undefined\n\n[미확인] Refer 되어 HB 4.0으로 T/F 및 입원 권고 받았으나 연고지 문제로 Refuse 후 자택에서 지냈다고 함. 내원 2주 전부터 gum bledding, abdomen distention 발생하여 타병원(홍익병원) 내원, 혈액검사상 hypoglycemia, Cr elevation, Hb 저하등으로 ER Refer 되어 내원함. 입원 후 r/o Varix bleeding 으로 Masive hematemesis, active bleeding 발생하여 CPR 시행 후 ROSC 되었으나 Bleeding 재발생되어 SB Tube insertion 시행함. 또한 HRS 진행, Metabolic acidosis로 CRRT, ventilator 적용하였으나 호전 보이지 않았으며 V/S unstable 하여 T/F 및 Intoropics 고용량으로 사용함. 응급 TIPS 고려 하였으나 사망가능성 높아 중단, 이후 내시경지혈술 시행, CRRT, Ventilator 적용 했음에도 Arrest 발생하여 사망함. S 입원경과 ICU Care 작성과: 소화기내과 (\n내원일: 미확인\n내원사유: 응급실 내원\n진단명: 미확인\n입원기간: undefined ~ undefined\n\n[미확인] Refer 되어 HB 4.0으로 T/F 및 입원 권고 받았으나 연고 지 문제로 Refuse 후 자택에서 지냈다고 함. 내원 2주 전부터 gum bledding, abdomen distention 발생하여 타병원(홍익병원) 내원, 혈액검사상 hypoglycemia, Cr elevation, Hb 저하등으로 ER Refer 되어 내원함. 입원 후 r/o Varix bleeding 으로 Masive hematemesis, active bleeding 발생하여 CPR 시행 후 ROSC 되었으나 Bleeding 재발생되어 SB Tube insertion 시행함. 또한 HRS 진행, Metabolic acidosis로 CRRT, ventilator 적용하였으나 호전 보이지 않았으며 V/S unstable 하여 T/F 및 Intoropics 고용량으로 사용 했음에도 V/S unstable 하였음. 응급 TIPS 고려 하였으나 사망가능성 높아 중단하였으며 내시경지혈술 시행, CRRT, Ventilator 적용 했음에도 Arrest 발생하여 사망함. 합병증 무 첨부한 사본은 의무기록 원본과 같음을 증명합니다. 11/12 출력자 : 황재호 (\n내원일: 미확인\n내원사유: 응급실 내원\n진단명: 미확인\n입원기간: undefined ~ undefined\n특이사항: WBC 5.36 2.13 RBC 1.36 1.26 Hb 4.0 3.7 Hct 12.3 10.9 Platelet 44 39 pH, arterial 6.898 6.991 pCO2, arterial 44.7 69.5 pO2, arterial 83.5 62.5 Bicarbonate, arterial 8.5 Base excess, arterial -21.8 -13.7 CO2content, arterial 9.9 18.5 O2 saturate, arterial 85.8 82.5 이화여자대학교의료원 16.4 EU MC HA WOMANS UNIVERSITY CENTER MEDICAL Lactate, arterial 220.5 198.7 FiO2 100.0 100.0 Hct, arterial 12 17 Hb, arterial 4.2 5.7 Phosphorus 9.3 9.3 Na 156 153 K 6.2 6.3 Cl 99 96 TCO2 9 15 Mg 2.01 2.03 경과요약 상환 특이병력 없으셨던 분으로 daily 소주 1병 드시던 분. 최근 3일간 물, 소주만 드셨던 분으로 1/30 발생한 발열 및 오한 으로 local 내원, r/o Alcoholic LC, r/o SBP, r/o HRS 로 전남대병원 Refer 되어 HB 4.0으로 T/F 및 입원 권고 받았으나 연고 지 문제로 Refuse 후 자택에서 지냈다고 함. 내원 2주 전부터 gum bledding, abdomen distention 발생하여 타병원(홍익병원) 내원, 혈액검사상 hypoglycemia, Cr elevation, Hb 저하등으로 ER Refer 되어 내원함. 입원 후 r/o Varix bleeding 으로 Masive hematemesis, active bleeding 발생하여 CPR 시행 후 ROSC 되었으나 Bleeding 재발생되어 SB Tube insertion 시행함. 또한 HRS 진행, Metabolic acidosis로 CRRT, ventilator 적용하였으나 호전 보이지 않았으며 V/S unstable 하여 T/F 및 Intoropics 고용량으로 사용 했음에도 V/S unstable 하였음. 응급 TIPS 고려 하였으나 사망가능성 높아 중단하였으며 내시경지혈술 시행, CRRT, Ventilator 적용 했음에도 Arrest 발생하여 사망함. 합병증 무 첨부한 사본은 의무기록 원본과 같음을 증명합니다. 11/12 출력자 : 황재호 (\n\n[미확인] 재원여부 : 아니오 입원방법 :눕는차 주증상 :hematochezia EU 최근 발병시기:2/19 CENTER 입원동기 : 상환 이전 특이 병력 없으며 daily 소주 1병 섭취(내원 당일은 음주하지 않음) 하며 최근 3일간 물, 소주만 섭취한 환자로\n내원일: 미확인\n내원사유: hematochezia EU 최근 발병시기:2/19 CENTER 입원동기 : 상환 이전 특이 병력 없으며 daily 소주 1병 섭취(내원 당일은 음주하지 않음) 하며 최근 3일간 물, 소주만 섭취한 환자로\n진단명: 미확인\n입원기간: undefined ~ undefined\n특이사항: Allergy 유무 : 무 VIP 여부 :무 입원정보 입원경로 :응급실 이화여자대학교의료원 입원직전 요양원/요양병원 재원여부 : 아니오 입원방법 :눕는차 주증상 :hematochezia EU 최근 발병시기:2/19 CENTER 입원동기 : 상환 이전 특이 병력 없으며 daily 소주 1병 섭취(내원 당일은 음주하지 않음) 하며 최근 3일간 물, 소주만 섭취한 환자로\n\n[2025.02.20] 미확인 의료기관\n내원일: 2025.02.20\n내원사유: 응급실 내원\n진단명: 미확인\n입원기간: undefined ~ undefined\n\n[2025.02.20] 미확인 의료기관\n내원일: 2025.02.20\n내원사유: 응급실 내원\n진단명: 미확인\n입원기간: undefined ~ undefined\n\n[2025.02.20] 미확인 의료기관\n내원일: 2025.02.20\n내원사유: 응급실 내원\n진단명: 미확인\n입원기간: undefined ~ undefined\n\n[2025.02.20] 미확인 의료기관\n내원일: 2025.02.20\n내원사유: 응급실 내원\n진단명: 미확인\n입원기간: undefined ~ undefined\n\n[2025.02.20] 미확인 의료기관\n내원일: 2025.02.20\n내원사유: 응급실 내원\n진단명: 미확인\n입원기간: undefined ~ undefined\n\n[2025.02.20] 미확인 의료기관\n내원일: 2025.02.20\n내원사유: 응급실 내원\n진단명: 미확인\n입원기간: undefined ~ undefined\n\n[2025.02.20] 미확인 의료기관\n내원일: 2025.02.20\n내원사유: 응급실 내원\n진단명: 미확인\n입원기간: undefined ~ undefined\n\n[2025.02.20] 미확인 의료기관\n내원일: 2025.02.20\n내원사유: 응급실 내원\n진단명: 미확인\n입원기간: undefined ~ undefined\n\n[2025.02.20] 미확인 의료기관\n내원일: 2025.02.20\n내원사유: 응급실 내원\n진단명: 미확인\n입원기간: undefined ~ undefined\n\n[2025.02.20] 미확인 의료기관\n내원일: 2025.02.20\n내원사유: 응급실 내원\n진단명: 미확인\n입원기간: undefined ~ undefined\n특이사항: CT(다245마(1) (나)) 90,310 1.1 1 99,340 9,934 89,406 0 0 CT료 HB011 PACS료 (특수영상) (다2절주4) 4,710 1.0 1 4,710 471 4,239 0 0 소계 0.0 0 104,050 10,405 93,645 0 0 수혈료 AL900 혈액관리료 [Unit당](가11-1) 4,430 21.0 21 93,030 9,303 83,727 0 0 수혈료 D1550003 교차시험 [1 [hit당] 5,000 10.4 10 52,000 5,200 46,800 0 0 수혈료 KK052 수혈료 L6001101 수액주사100-500ML(1병또는포장단위당)(마나) 혈액원 MCS ESP WITH FILTER 3,220 21.0 21 77,763 7,770 69,993 0 0 169,253 1.0 1 169,253 16,925 152,328 0 0 수혈료 L6103017 수혈료 X2021 Pre-Storage Filter Blood bag Set 적혈구농축액 3200C(파2가3) 12,650 8.0 8 101,200 10,120 91,080 0 0 59,870 1.0 1 59,870 5,987 53,883 0 0 수혈료 X2022 적혈구농축액 400CC(파2가4) 63,990 1.0 1 63,990 6,399 57,591 0 0 수혈료 X2042 신선동결혈장 400CC(파2가) 65,760 10.0 10 657,600 65,760 591,840 0 0 수혈료 X2112 여과백혈구제거적혈구 400CC(파2가22) 65,300 8.0 8 522,400 52,240 470,160 0 0 수혈료 X2511 백혈구여과제거 성분채집 혈소판(파2나4) 170,050 1.0 1 170,050 17,005 153,045 0 0 소계 0.0 0 1,967,156 196,709 1,770,447 0 0 끝수처리 조정금액 0.0 0 0 -9 1 0 0 본인부담상한차액 0.0 0 0 0 0 0 0 진료비 세부내역서(입원 항목별) 요양기관기호:\n\n[2025.02.20] 이화여자대학 교의과대학 대표자 유경하 일반사항 안내 1. 진료비 계산서·영수증의 세부내역서는 환자의 구체적인 처방 내역 등이 확인되므로 원칙적으로 환자 본인 외에 발급을 금합니다. 다만, 본 세부내역서 발급에 대해 별도로 환자 본인으로부터 위임을 받은 것이 확인된 자 또는 법정대리인에겐 발급이 가능합니다. 2. 비고란은 세부산정내역을 발부하는 영수증번호 등 요양기관이 필요한 경우 추가 기재하는 공간으로 활용할 수 있습니다. 3. 동 서식에 명시된 항목은 「국민건강보험 요양급여의 기준에 관한 규칙」 제7조제3항에 따라 필수 기재되어야 합니다. ========== 파일: i??i?μe³?i??.pdf ==========\n내원일: 2025.02.20\n내원사유: 응급실 내원\n진단명: 미확인\n입원기간: undefined ~ undefined\n특이사항: 란은 세부산정내역을 발부하는 영수증번호 등 요양기관이 필요한 경우 추가 기재하는 공간으로 활용할 수 있습니다. 3. 동 서식에 명시된 항목은 「국민건강보험 요양급여의 기준에 관한 규칙」 제7조제3항에 따라 필수 기재되어야 합니다. ========== 파일: i??i?μe³?i??.pdf ==========\n\n■ 보험 청구 이력 (Insurance Claims)\nNaN\n[미확인] 미확인 보험사\n청구일: 미확인\n진단명: 미확인\n지급일: 미확인\n상태: 처리 중\n\n■ 종합 소견 (Summary)\nNaN\n총 진료 기록: 90건\n진료 기간: 미확인 ~ 2025.02.20\n주요 진단명: 서 수정 원하셔서 오심 Objective information Vital Signs Ht: 153 cm Assessment #LC with bleeding Plan 진단서 보완해드림 EWHA WOMANS EU MC CENTER MEDICAL 응급초진 작성과: 응급의학과 (, [주]Gastrointestinal hemorrhage 첨부한 사본은 의무기록 원본과 같음을 증명합니다. 3/12 출력자 : 황재호 (, 기준 5) 소화기계 문제 전격간부전 8) 기타 신기능 부전 EWH EU 작성자 정의선 정의선 Check principal diagnostic categories leading to ICU admission I. Non-operative patients 5. Other Gl Bleeding Gastrointestinal WQgAN CENTER 6. If not in one of the specific groups above, then which major vital organ system was the principal reason for admission? UNIVERSITY MEDIC 타과의뢰 작성과: 소화기내과 (, Hepatorenal syndrome Alcoholic LC 첨부한 사본은 의무기록 원본과 같음을 증명합니다. 작성자 정의선 정의선 9/12 출력자 : 황재호 (, Gastrointestinal hemorrhage 임상소견 및 병력: 검사명: Chest PA [Finding] There is no abnormality in the lung. The heart is within normal limit in size and shape. There is no visible abnormality of the pleura. Others are not remarkable. [Conclusion] Negative chest 영상검사결과 EWHA WOM 진료과/병동 (의뢰처) : 응급실 (응급) be대학교의료, EU MC (의뢰일 :\n주요 소견:\n  - 총 21회 입원 이력\n  - 총 1건 보험 청구 이력\n\nNaN\n보고서 생성 완료 - 2025. 8. 17. 오후 10:28:28\nNaN",
    "reportMetadata": {
      "generatedAt": "2025-08-17T13:28:28.468Z",
      "format": "text",
      "totalSections": 10,
      "recordCount": 101
    },
    "statistics": {
      "originalLength": 63642,
      "processedLength": 57510,
      "recordsFound": 99,
      "insuranceCount": 5,
      "timelineEvents": 99
    },
    "processingTime": 1755437308468
  }
}