{
  "caseNumber": 1,
  "timestamp": "2025-08-17T13:28:27.704Z",
  "detailedResult": {
    "caseNumber": 1,
    "hasReportFile": true,
    "processingTime": 198,
    "success": true,
    "validation": {
      "hasPatientInfo": true,
      "hasValidName": true,
      "hasMedicalRecords": true,
      "hasInsuranceInfo": true,
      "noNaNValues": false,
      "processingSuccess": true,
      "overallScore": 0.8333333333333334
    },
    "patientInfo": {
      "patientName": "김명희",
      "birthDate": "yyyy-mm-dd",
      "registrationNumber": "250026063"
    },
    "medicalRecordsCount": 108,
    "insuranceInfoCount": 3,
    "hospitalizationCount": 13,
    "testResultsCount": 0,
    "nanIssues": {
      "hasNaN": true,
      "locations": [
        ".progressReport"
      ]
    },
    "memoryUsage": {
      "rss": 42913792,
      "heapTotal": 9994240,
      "heapUsed": 5680952,
      "external": 1815511,
      "arrayBuffers": 10515
    }
  },
  "fullResult": {
    "success": true,
    "normalizedReport": {
      "header": {
        "patientName": "김명희",
        "birthDate": "yyyy-mm-dd",
        "registrationNumber": "250026063"
      },
      "insuranceConditions": [
        {
          "conditionNumber": 1,
          "company": "제출 구비서류 (신)신분증,(환)신분증,(환)동의서,(환)위임장 첨부한 사본은 의무기록 원본과 틀림이 없음을 증명합니다. 2025-03-10 발급자 서명 김지현 주. 1. 의무기록팀 \"발급자 서명\"이 없는 것은 무효입니다. 2. 상기 용도 외에는 이 사본을 사용할 수 없으며, 용도가 완료된 후 즉시 파본, 폐기하여야 합니다. 한림대학교강남성심병원 \"직인생략\" 250026063 김명희 570725-2 진료의뢰서 250026063"
        },
        {
          "conditionNumber": 2,
          "company": "서류발급 2025-03-18"
        },
        {
          "conditionNumber": 3,
          "company": "서류발급(흥국화재) 내당 최내과 의 원 강~! rent x 90x4 6 ========== 파일: i?￢i??i?? i§?e￡?e?´i?­.pdf ========== 2025-03-24 20:47:05 CH 48181 해오름손해사정(주) PENTARY SUNRISE SURVEYORS & CLAIM ADJUSTERS CO., LTD. 심평원 진료내역 피"
        }
      ],
      "insuranceHistory": [
        {
          "period": "[보험 가입 3개월 이내]",
          "company": "제출 구비서류 (신)신분증,(환)신분증,(환)동의서,(환)위임장 첨부한 사본은 의무기록 원본과 틀림이 없음을 증명합니다. 2025-03-10 발급자 서명 김지현 주. 1. 의무기록팀 \"발급자 서명\"이 없는 것은 무효입니다. 2. 상기 용도 외에는 이 사본을 사용할 수 없으며, 용도가 완료된 후 즉시 파본, 폐기하여야 합니다. 한림대학교강남성심병원 \"직인생략\" 250026063 김명희 570725-2 진료의뢰서 250026063"
        },
        {
          "period": "[보험 가입 3개월 이내]",
          "company": "서류발급 2025-03-18"
        },
        {
          "period": "[보험 가입 3개월 이내]",
          "company": "서류발급(흥국화재) 내당 최내과 의 원 강~! rent x 90x4 6 ========== 파일: i?￢i??i?? i§?e￡?e?´i?­.pdf ========== 2025-03-24 20:47:05 CH 48181 해오름손해사정(주) PENTARY SUNRISE SURVEYORS & CLAIM ADJUSTERS CO., LTD. 심평원 진료내역 피"
        }
      ],
      "medicalRecords": [
        {
          "date": "",
          "hospital": "의무기록사본 총 0부 (표지제외) 빈경환 의무기록 사본 증명서 발행번호 2025-16564 등록번호",
          "reason": "정기 진료",
          "diagnosis": "미확인",
          "notes": ""
        },
        {
          "date": "",
          "hospital": "]진료과 [뇌신경센터] 신경외과 신청자 대리인 발급매수 14 OH 발급용도 보험회사 제출 구비서류 (신)신분증,(환)신분증,(환)동의서,(환)위임장 첨부한 사본은 의무기록 원본과 틀림이 없음을 증명합니다.",
          "reason": "정기 진료",
          "diagnosis": "미확인",
          "notes": ""
        },
        {
          "date": "",
          "hospital": "\"직인생략\"",
          "reason": "정기 진료",
          "diagnosis": "미확인",
          "notes": ""
        },
        {
          "date": "",
          "hospital": "주: 1. 이 진료의뢰서는 1차진료후 2차진료를 받고자 하는 경우 1차 진료담당의사로부터 요양급여 기준에 따라 무상으로 교부됩니다. 110. 3. 일사상태 국산호초반에홑의현동,검사, 부약사릉추요쟌호내용을 구체적으로 기재하기 바라며",
          "reason": "정기 진료",
          "diagnosis": "미확인",
          "notes": ""
        },
        {
          "date": "",
          "hospital": "작성자: 한정훈 외래기록지",
          "reason": "정기 진료",
          "diagnosis": "미확인",
          "notes": ""
        },
        {
          "date": "",
          "hospital": "미확인 의료기관",
          "reason": "정기 진료",
          "diagnosis": "미확인",
          "prescription": "일/보고일]",
          "notes": ""
        },
        {
          "date": "2025-02-18",
          "hospital": "미확인 의료기관",
          "visitDate": "2025-02-18",
          "reason": "정기 진료",
          "diagnosis": "미확인",
          "notes": ""
        },
        {
          "date": "2025-02-17",
          "hospital": "미확인 의료기관",
          "visitDate": "2025-02-17",
          "reason": "정기 진료",
          "diagnosis": "미확인",
          "notes": ""
        },
        {
          "date": "2025-02-17",
          "hospital": "미확인 의료기관",
          "visitDate": "2025-02-17",
          "reason": "정기 진료",
          "diagnosis": "미확인",
          "notes": ""
        },
        {
          "date": "",
          "hospital": "도착 1개월간 한번이라도 흡연한 적이 있는가?) □ 예 금연상담 여부 예( 아니오 기록 없음/확인불능 의사 간호사) □ 아니오 금연상담 대상 【금연 상담을 제공하지 않은 이유가 있는가?! |환자의 신경학적 결함(의식혼탁 등)으로 인해 금연상담의 이해가 불가능한 경우 1환자의 신체적/정신적 상태로 인해 흡연이 불가능한 경우 1 기타 한림대학교강남성심병원",
          "reason": "정기 진료",
          "diagnosis": "미확인",
          "prescription": "V 흡 연 VI 회/일 변비 유 1 병/회 1 기간 15 | 년 유 유 유 유 무무 종류 용량 기간 유종류 용량 기간 갑/일 기간 년 회/월 종류 맥주 [금연에 대한 조언/상담 시행 비율] 흡연력(병원도착 1개월간 한번이라도 흡연한 적이 있는가?) □ 예 금연상담 여부 예( 아니오 기록 없음/확인불능 의사 간호사) □ 아니오 금연상담 대상 【금연 상담을 제공하지 않은 이유가 있는가?! |환자의 신경학적 결함(의식혼탁 등)으로 인해 금연상담의 이해가 불가능한 경우 1환자의 신체적/정신적 상태로 인해 흡연이 불가능한 경우 1 기타 한림대학교강남성심병원",
          "notes": "이상호흡음 기관절개관 1 토혈 □ 소화장애 복부팽만 혈변 |인공장루 기타 긴급료 실금 임신 여부 통 증 해당무 V 아니오 V 없음 예 최종월경일 V 기타 폐경 ㅣ있음 (부위) 두통흉통 (정도) 둔함 □ 쑤심 복통 퍼짐 신경계 장애 마비 V 없음 있음 □ 오른팔 오른발 사지통 요통 예리함 |찌르는듯함 왼팔 왼발 기타 쥐어짜는듯함 □ 기타 신경근육 V 이상없음 보조 기구 시력 청력 장애 V 없음 장애 V 없음 있음 10 ? □ 무감각 목발 저린감 ]의족 □ 의수 동통 저하 Brace Wheel chair 1부위 의치 기타 ㅣ있음 [안경 렌즈 V 없음 ㅣ있음 |청력저하 의안(Rt) 1의안(Lt) 보청기 기타 이명 청각상실(Rt) 청각상실(Lt) 1 기타 부 종 V 없음 있음 (부위) 전신 사지 상지 하지 얼굴 안검 기타 피부 장애 V 없음 있음 창백 |홍조 청색증 황달 | 가려움증 자반 기타 욕창 【습 관] 배 음 수면장애 변주 수면제복용 V 향정신성 약물 V 흡 연 VI 회/일 변비 유 1 병/회 1 기간 15 | 년 유 유 유 유 무무 종류 용량 기간 유종류 용량 기간 갑/일 기간 년 회/월 종류 맥주 [금연에 대한 조언/상담 시행 비율] 흡연력(병원도착 1개월간 한번이라도 흡연한 적이 있는가?) □ 예 금연상담 여부 예( 아니오 기록 없음/확인불능 의사 간호사) □ 아니오 금연상담 대상 【금연 상담을 제공하지 않은 이유가 있는가?! |환자의 신경학적 결함(의식혼탁 등)으로 인해 금연상담의 이해가 불가능한 경우 1환자의 신체적/정신적 상태로 인해 흡연이 불가능한 경우 1 기타 한림대학교강남성심병원"
        },
        {
          "date": "2025-02-18",
          "hospital": "미확인 의료기관",
          "visitDate": "2025-02-18",
          "reason": "정기 진료",
          "diagnosis": "미확인",
          "notes": ""
        },
        {
          "date": "2025-02-18",
          "hospital": "미확인 의료기관",
          "visitDate": "2025-02-18",
          "reason": "정기 진료",
          "diagnosis": "미확인",
          "notes": ""
        },
        {
          "date": "2025-02-18",
          "hospital": "미확인 의료기관",
          "visitDate": "2025-02-18",
          "reason": "정기 진료",
          "diagnosis": "미확인",
          "notes": ""
        },
        {
          "date": "",
          "hospital": "원본대조필 ========== 파일: e?´e?¹iμ?e?´e³¼i??i??.pdf ==========",
          "reason": "정기 진료",
          "diagnosis": "미확인",
          "notes": ""
        },
        {
          "date": "",
          "hospital": "의무기록사본 총 0부 (표지제외) 빈경환 CHART 4478 No. 2008 년 5 월 9 일 수진자 김명희 주민번호 진료일자 570725-2057811",
          "reason": "정기 진료",
          "diagnosis": "미확인",
          "notes": ""
        },
        {
          "date": "2008-05-09",
          "hospital": "미확인 의료기관",
          "visitDate": "2008-05-09",
          "reason": "정기 진료",
          "diagnosis": "미확인",
          "notes": ""
        },
        {
          "date": "",
          "hospital": "내원한 Glucose + 당뇨 진전 pH 6.0 Blood - Othis mone 1½ (932): none nonopaul 447 Cheif complain: 체중변화더 Flux 3 03:03 패론말 (4): 주로 밖에 장사를 해서 Phgsical exam: 시력장애(t): 김안과 개원 다리가 아르고 (4) 어깨가 동종(다) : 양장 여동생(4) 거리자) 명색증(+): 양쪽 원본대조필 수면장기(+) 치하: fme mim 별세 내당최내과의원 약국소개 DATE",
          "reason": "158-829 서울 양천구 신월3동 174-23호 DIAGNOSIS BP: 110/70 mmHg P: T: W : H 71 84 BST: 230 m²/ℓ(40분) HT: 152.8 cm BW: 47.8 kg BMI: 20.5 % Onset: 피로만 심해서 7일전 소변4종 Protein - Duration: Belk Past History: on As 동네병원 내원한 Glucose + 당뇨 진전 pH 6.0 Blood - Othis mone 1½ (932): none nonopaul 447 Cheif complain: 체중변화더 Flux 3 03:03 패론말 (4): 주로 밖에 장사를 해서 Phgsical exam: 시력장애(t): 김안과 개원 다리가 아르고 (4) 어깨가 동종(다) : 양장 여동생(4) 거리자) 명색증(+): 양쪽 원본대조필 수면장기(+) 치하: fme mim 별세 내당최내과의원 약국소개 DATE",
          "diagnosis": "미확인",
          "notes": ""
        },
        {
          "date": "",
          "hospital": "SIGN DATE",
          "reason": "정기 진료",
          "diagnosis": "미확인",
          "notes": ""
        },
        {
          "date": "",
          "hospital": "8 ② 1월 금융 DATE PROGRESS NOTE",
          "reason": "정기 진료",
          "diagnosis": "미확인",
          "notes": ""
        },
        {
          "date": "",
          "hospital": "SIGN 김→ 본알수 Pry DATE",
          "reason": "정기 진료",
          "diagnosis": "미확인",
          "notes": ""
        },
        {
          "date": "",
          "hospital": "?? DATE PROGRESS NOTE",
          "reason": "정기 진료",
          "diagnosis": "미확인",
          "notes": ""
        },
        {
          "date": "",
          "hospital": "2021년 DATE",
          "reason": "정기 진료",
          "diagnosis": "미확인",
          "notes": ""
        },
        {
          "date": "",
          "hospital": "DATE",
          "reason": "정기 진료",
          "diagnosis": "미확인",
          "notes": ""
        },
        {
          "date": "",
          "hospital": "8.0 m McQ DATE",
          "reason": "정기 진료",
          "diagnosis": "미확인",
          "notes": ""
        },
        {
          "date": "",
          "hospital": "⑤ ? DATE",
          "reason": "정기 진료",
          "diagnosis": "미확인",
          "notes": ""
        },
        {
          "date": "",
          "hospital": "DATE",
          "reason": "정기 진료",
          "diagnosis": "미확인",
          "notes": ""
        },
        {
          "date": "",
          "hospital": "2025년 DATE",
          "reason": "정기 진료",
          "diagnosis": "미확인",
          "notes": ""
        },
        {
          "date": "",
          "hospital": "&약국별 기본진료내역 정보주체 : 김명희 열람대상기간 :",
          "reason": "정기 진료",
          "diagnosis": "미확인",
          "prescription": "조제정보 병·의원&약국별 기본진료내역 정보주체 : 김명희 열람대상기간 :",
          "notes": ""
        },
        {
          "date": "",
          "hospital": "정형외 과 외래 ASOO1 꺼풀 및 눈 주위의 타 박상 1 20,010 16,010 4,000",
          "reason": "정기 진료",
          "diagnosis": "미확인",
          "notes": ""
        },
        {
          "date": "",
          "hospital": "피부과 외래 AL239 인의 알레 1 12,590 11,090 1,500 르기성 접 촉피부염",
          "reason": "정기 진료",
          "diagnosis": "미확인",
          "notes": ""
        },
        {
          "date": "",
          "hospital": "&약국에서 청구한 요양급여비용 명세서를 기준으로 작성된 자료입니다. 진료비에는 국민건강보험법 제41조의4에 따른 선별급여 관련 금액이 포함되어 있지 않습니다. 이에 본 자료를 단순 참고가 아닌 증빙자료로 사용할 수 없으며, 이용에 관한 책임은 이용자에게 있습니다. 1/9 빈경환",
          "reason": "정기 진료",
          "diagnosis": "미확인",
          "notes": "가 아닌 증빙자료로 사용할 수 없으며, 이용에 관한 책임은 이용자에게 있습니다. 1/9 빈경환"
        },
        {
          "date": "",
          "hospital": "내과 외래 AJ209 (양방)상 세불명의 급성 기관 지염 1 18,440 16,640 1,800 13",
          "reason": "정기 진료",
          "diagnosis": "미확인",
          "notes": ""
        },
        {
          "date": "",
          "hospital": "내과 외래 AJ209 (양방)상 세불명의 급성 기관 지염 1 15,690 14,190 1,500 15",
          "reason": "정기 진료",
          "diagnosis": "미확인",
          "notes": ""
        },
        {
          "date": "",
          "hospital": "내과 외래 AJ209 (양방)상 세불명의 급성 기관 지염 1 15,690 14,190 1,500 17",
          "reason": "정기 진료",
          "diagnosis": "미확인",
          "notes": ""
        },
        {
          "date": "",
          "hospital": "내과 외래 AJ040 (양방)급 성 후두염 14,830 13,330 1,500 19",
          "reason": "정기 진료",
          "diagnosis": "미확인",
          "notes": ""
        },
        {
          "date": "",
          "hospital": "내과 외래 AJ040 (양방)급 성후두염 12,590 11,090 1,500 21",
          "reason": "정기 진료",
          "diagnosis": "미확인",
          "notes": ""
        },
        {
          "date": "",
          "hospital": "(양방)관 외래 AM2550절통, 여러 1 \"부위\"' 14,760 13,260 1,500 본 자료는 병·의원&약국에서 청구한 요양급여비용 명세서를 기준으로 작성된 자료입니다. 빈경환 진료비에는 국민건강보험법 제41조의4에 따른 선별급여 관련 금액이 포함되어 있지 않습니다. 이에 본 자료를 단순 참고가 아닌 증빙자료로 사용할 수 없으며, 이용에 관한 책임은 이용자에게 있습니다. 2/9",
          "reason": "정기 진료",
          "diagnosis": "미확인",
          "notes": "가 아닌 증빙자료로 사용할 수 없으며, 이용에 관한 책임은 이용자에게 있습니다. 2/9"
        },
        {
          "date": "",
          "hospital": "내과 외래 AJ040 (양방)급 1 12,380 10,880 1,500 성 후두염 25",
          "reason": "정기 진료",
          "diagnosis": "미확인",
          "notes": ""
        },
        {
          "date": "",
          "hospital": "내과 외래 AJ040 (양방)급 성 후두염 14,660 13,160 1,500 29",
          "reason": "정기 진료",
          "diagnosis": "미확인",
          "notes": ""
        },
        {
          "date": "",
          "hospital": "피부과 외래 AL239 인의 알레 17,320 15,620 1,700 르기성 접 촉피부염 메디팜성화약 31",
          "reason": "정기 진료",
          "diagnosis": "미확인",
          "notes": ""
        },
        {
          "date": "",
          "hospital": "&약국에서 청구한 요양급여비용 명세서를 기준으로 작성된 자료입니다. 진료비에는 국민건강보험법 제41조의4에 따른 선별급여 관련 금액이 포함되어 있지 않습니다. ?이에 본 자료를 단순 참고가 아닌 증빙자료로 사용할 수 없으며, 이용에 관한 책임은 이용자에게 있습니다. 3/9 빈경환",
          "reason": "정기 진료",
          "diagnosis": "미확인",
          "notes": "가 아닌 증빙자료로 사용할 수 없으며, 이용에 관한 책임은 이용자에게 있습니다. 3/9 빈경환"
        },
        {
          "date": "",
          "hospital": "내과 외래 AJ040 (양방)급 성 후두염 1 12,380 10,880 1,500 38",
          "reason": "정기 진료",
          "diagnosis": "미확인",
          "notes": ""
        },
        {
          "date": "",
          "hospital": "피부과 외래 AL272 취한 음식 물에 의한 피부염 1 14,460 12,960 1,500 40",
          "reason": "정기 진료",
          "diagnosis": "미확인",
          "notes": ""
        },
        {
          "date": "",
          "hospital": "내과 외래 AK297 세불명의 1 위염 12,380 10,880 1,500 42",
          "reason": "정기 진료",
          "diagnosis": "미확인",
          "notes": ""
        },
        {
          "date": "",
          "hospital": "내과 외래 AJ040 (양방)급 1 성후두염 16,970 15,370 1,600 44",
          "reason": "정기 진료",
          "diagnosis": "미확인",
          "notes": ""
        },
        {
          "date": "",
          "hospital": "&약국에서 청구한 요양급여비용 명세서를 기준으로 작성된 자료입니다. 진료비에는 국민건강보험법 제41조의4에 따른 선별급여 관련 금액이 포함되어 있지 않습니다. ?이에 본 자료를 단순 참고가 아닌 증빙자료로 사용할 수 없으며, 이용에 관한 책임은 이용자에게 있습니다. 4/9 빈경환",
          "reason": "정기 진료",
          "diagnosis": "미확인",
          "notes": "가 아닌 증빙자료로 사용할 수 없으며, 이용에 관한 책임은 이용자에게 있습니다. 4/9 빈경환"
        },
        {
          "date": "",
          "hospital": "정형외 과 212 AS007 리의 다발 성표재성 손상 1 21,260 14,960 6,300 (양방)머 정형외 50",
          "reason": "정기 진료",
          "diagnosis": "미확인",
          "notes": ""
        },
        {
          "date": "",
          "hospital": "외래 AS007 리의 다발 성표재성 손상 1 21,260 14,960 6,300",
          "reason": "정기 진료",
          "diagnosis": "미확인",
          "notes": ""
        },
        {
          "date": "",
          "hospital": "내과 외래 AJ029 (양방)상 세불명의 급성 인두 1 33,570 28,570 5,000 염 53",
          "reason": "정기 진료",
          "diagnosis": "미확인",
          "notes": ""
        },
        {
          "date": "",
          "hospital": "내과 외래 AJ029 (양방)상 세불명의 급성 인두 염 1 40 40 40 0 54",
          "reason": "정기 진료",
          "diagnosis": "미확인",
          "notes": ""
        },
        {
          "date": "",
          "hospital": "&약국에서 청구한 요양급여비용 명세서를 기준으로 작성된 자료입니다. 진료비에는 국민건강보험법 제41조의4에 따른 선별급여 관련 금액이 포함되어 있지 않습니다. 이에 본 자료를 단순 참고가 아닌 증빙자료로 사용할 수 없으며, 이용에 관한 책임은 이용자에게 있습니다. 5/9 빈경환",
          "reason": "정기 진료",
          "diagnosis": "미확인",
          "notes": "가 아닌 증빙자료로 사용할 수 없으며, 이용에 관한 책임은 이용자에게 있습니다. 5/9 빈경환"
        },
        {
          "date": "",
          "hospital": "신경과 외래 AG470 (양방)수 면 개시 및 유지 장애 1 16,970 11,970 5,000 불면증] 58",
          "reason": "정기 진료",
          "diagnosis": "미확인",
          "notes": ""
        },
        {
          "date": "",
          "hospital": "&약국에서 청구한 요양급여비용 명세서를 기준으로 작성된 자료입니다. 진료비에는 국민건강보험법 제41조의4에 따른 선별급여 관련 금액이 포함되어 있지 않습니다. 이에 본 자료를 단순 참고가 아닌 증빙자료로 사용할 수 없으며, 이용에 관한 책임은 이용자에게 있습니다. 6/9 빈경환",
          "reason": "정기 진료",
          "diagnosis": "미확인",
          "notes": "가 아닌 증빙자료로 사용할 수 없으며, 이용에 관한 책임은 이용자에게 있습니다. 6/9 빈경환"
        },
        {
          "date": "",
          "hospital": "피부과 외래 AL239 인의 알레 1 13,760 9,660 4,100 르기성 촉피부염 69",
          "reason": "정기 진료",
          "diagnosis": "미확인",
          "notes": ""
        },
        {
          "date": "",
          "hospital": "피부과 외래 AL272 취한 음식 물에 의한 피부염 1 13,760 9,660 4,100",
          "reason": "정기 진료",
          "diagnosis": "미확인",
          "notes": ""
        },
        {
          "date": "",
          "hospital": "피부과 외래 AL272 1 13,760 9,660 4,100 물에 의한 피부염 (양방)섭 75",
          "reason": "정기 진료",
          "diagnosis": "미확인",
          "notes": ""
        },
        {
          "date": "",
          "hospital": "피부과 외래 AL272 취한 음식 물에 의한 피부염 18,460 12,960 5,500 76",
          "reason": "정기 진료",
          "diagnosis": "미확인",
          "notes": ""
        },
        {
          "date": "",
          "hospital": "&약국에서 청구한 요양급여비용 명세서를 기준으로 작성된 자료입니다. 진료비에는 국민건강보험법 제41조의4에 따른 선별급여 관련 금액이 포함되어 있지 않습니다. ?이에 본 자료를 단순 참고가 아닌 증빙자료로 사용할 수 없으며, 이용에 관한 책임은 이용자에게 있습니다. 7/9 빈경환",
          "reason": "정기 진료",
          "diagnosis": "미확인",
          "notes": "가 아닌 증빙자료로 사용할 수 없으며, 이용에 관한 책임은 이용자에게 있습니다. 7/9 빈경환"
        },
        {
          "date": "",
          "hospital": "&약국에서 청구한 요양급여비용 명세서를 기준으로 작성된 자료입니다. . 진료비에는 국민건강보험법 제41조의4에 따른 선별급여 관련 금액이 포함되어 있지 않습니다. 이에 본 자료를 단순 참고가 아닌 증빙자료로 사용할 수 없으며, 이용에 관한 책임은 이용자에게 있습니다. 8/9 빈경환 LIㄱㄹ ㅇㄱㄱㄱ TOOO 외래 코드 일수(건강보험 적용분) 혜택받은 금액| (진료비) 89",
          "reason": "정기 진료",
          "diagnosis": "미확인",
          "notes": "가 아닌 증빙자료로 사용할 수 없으며, 이용에 관한 책임은 이용자에게 있습니다. 8/9 빈경환 LIㄱㄹ ㅇㄱㄱㄱ TOOO 외래 코드 일수(건강보험 적용분) 혜택받은 금액| (진료비) 89"
        },
        {
          "date": "",
          "hospital": "&약국에서 청구한 요양급여비용 명세서를 기준으로 작성된 자료입니다. 진료비에는 국민건강보험법 제41조의4에 따른 선별급여 관련 금액이 포함되어 있지 않습니다. ?이에 본 자료를 단순 참고가 아닌 증빙자료로 사용할 수 없으며, 이용에 관한 책임은 이용자에게 있습니다. 9/9 빈경환 ========== 파일: i?´e¸°i?­i??i??.pdf ==========",
          "reason": "정기 진료",
          "diagnosis": "미확인",
          "notes": "가 아닌 증빙자료로 사용할 수 없으며, 이용에 관한 책임은 이용자에게 있습니다. 9/9 빈경환 ========== 파일: i?´e¸°i?­i??i??.pdf =========="
        },
        {
          "date": "",
          "hospital": "의무기록사본 총 0부 (표지제외) 빈경환 차트번호: 2817, 김명희 피보험자 김명희 전화번호 2699-0913 Clinical Chart 현대조 증번호",
          "reason": "정기 진료",
          "diagnosis": "미확인",
          "notes": ""
        },
        {
          "date": "2019-09-02",
          "hospital": "미확인 의료기관",
          "visitDate": "2019-09-02",
          "reason": "정기 진료",
          "diagnosis": "미확인",
          "notes": ""
        },
        {
          "date": "2020-10-28",
          "hospital": "미확인 의료기관",
          "visitDate": "2020-10-28",
          "reason": "정기 진료",
          "diagnosis": "미확인",
          "notes": ""
        },
        {
          "date": "2021-02-16",
          "hospital": "미확인 의료기관",
          "visitDate": "2021-02-16",
          "reason": "정기 진료",
          "diagnosis": "미확인",
          "notes": ""
        },
        {
          "date": "2021-02-17",
          "hospital": "미확인 의료기관",
          "visitDate": "2021-02-17",
          "reason": "정기 진료",
          "diagnosis": "미확인",
          "notes": ""
        },
        {
          "date": "2021-05-11",
          "hospital": "미확인 의료기관",
          "visitDate": "2021-05-11",
          "reason": "정기 진료",
          "diagnosis": "미확인",
          "notes": ""
        },
        {
          "date": "",
          "hospital": "차트번호: 2817, 김명희 이마의 가려움 상복부 불쾌감 *이학적 검사 이마의 발진 << Diagnosis >> Clinical Chart (L239) 상세불명 원인의 알레르기성 접촉피부염 4 (K297) 상세불명의 위염 4회 << Treatment >> 소론도정(내복)(원외) 알마겔정(원외) 22 33 2 2 베포리진정10mg(원외) 유한디나트륨인산덱사메타손주사액 21 2 1 이기섭 내원일:",
          "reason": "2쪽 4.5 43 22 33 진찰구분: 재진 이기섭의원 차트번호: 2817, 김명희 이마의 가려움 상복부 불쾌감 *이학적 검사 이마의 발진 << Diagnosis >> Clinical Chart (L239) 상세불명 원인의 알레르기성 접촉피부염 4 (K297) 상세불명의 위염 4회 << Treatment >> 소론도정(내복)(원외) 알마겔정(원외) 22 33 2 2 베포리진정10mg(원외) 유한디나트륨인산덱사메타손주사액 21 2 1 이기섭 내원일:",
          "diagnosis": "미확인",
          "notes": ""
        },
        {
          "date": "2021-06-08",
          "hospital": "미확인 의료기관",
          "visitDate": "2021-06-08",
          "reason": "정기 진료",
          "diagnosis": "미확인",
          "notes": ""
        },
        {
          "date": "2021-06-24",
          "hospital": "미확인 의료기관",
          "visitDate": "2021-06-24",
          "reason": "정기 진료",
          "diagnosis": "미확인",
          "notes": ""
        },
        {
          "date": "",
          "hospital": "에서 정밀검사 받도록 함 내원일:",
          "reason": "눈이 흐려진다함-코로나19예방접종 한지 14일 후부터 따님이 전화함 -종합병원에서 정밀검사 받도록 함 내원일:",
          "diagnosis": "미확인",
          "notes": ""
        },
        {
          "date": "2021-08-24",
          "hospital": "미확인 의료기관",
          "visitDate": "2021-08-24",
          "reason": "정기 진료",
          "diagnosis": "미확인",
          "notes": ""
        },
        {
          "date": "",
          "hospital": "Clinical Chart 차트번호: 2817, 김명희 코로나19 1 1 1 코로나19(아스트라)0.5cc 내원일:",
          "reason": "정기 진료",
          "diagnosis": "미확인",
          "notes": ""
        },
        {
          "date": "2021-12-15",
          "hospital": "미확인 의료기관",
          "visitDate": "2021-12-15",
          "reason": "정기 진료",
          "diagnosis": "미확인",
          "notes": ""
        },
        {
          "date": "2022-03-07",
          "hospital": "미확인 의료기관",
          "visitDate": "2022-03-07",
          "reason": "정기 진료",
          "diagnosis": "미확인",
          "notes": ""
        },
        {
          "date": "2022-05-30",
          "hospital": "미확인 의료기관",
          "visitDate": "2022-05-30",
          "reason": "정기 진료",
          "diagnosis": "미확인",
          "notes": ""
        },
        {
          "date": "",
          "hospital": "Clinical Chart 차트번호: 2817, 김명희 이연리보스타마이신주사액 1 1 1 이기섭 내원일:",
          "reason": "얼굴 우측 눈주위, 우측 뺨, 우측 무릎 찰과상 & 멍듬 소화불량 << Diagnosis >> (S007) 머리의 다발성 표재성 손상 (S800) 무릎의 타박상[우측] (S808) 아래다리의 기타 표재성 손상[우측] (K297) 상세불명의 위염 << Treatment >> 단순처치[1일당]() 록스펜정(원외) 1 1 1 타이록신캡슐(원외) 3 3 4 알마겔정(원외) 4쪽 33 33 44 이기섭의원 Clinical Chart 차트번호: 2817, 김명희 이연리보스타마이신주사액 1 1 1 이기섭 내원일:",
          "diagnosis": "미확인",
          "notes": "표재성 손상[우측] (K297) 상세불명의 위염 << Treatment >> 단순처치[1일당]() 록스펜정(원외) 1 1 1 타이록신캡슐(원외) 3 3 4 알마겔정(원외) 4쪽 33 33 44 이기섭의원 Clinical Chart 차트번호: 2817, 김명희 이연리보스타마이신주사액 1 1 1 이기섭 내원일:"
        },
        {
          "date": "2022-05-31",
          "hospital": "미확인 의료기관",
          "visitDate": "2022-05-31",
          "reason": "정기 진료",
          "diagnosis": "미확인",
          "notes": ""
        },
        {
          "date": "2022-08-03",
          "hospital": "미확인 의료기관",
          "visitDate": "2022-08-03",
          "reason": "정기 진료",
          "diagnosis": "미확인",
          "notes": ""
        },
        {
          "date": "2022-11-28",
          "hospital": "미확인 의료기관",
          "visitDate": "2022-11-28",
          "reason": "정기 진료",
          "diagnosis": "미확인",
          "notes": ""
        },
        {
          "date": "",
          "hospital": "Clinical Chart 차트번호: 2817, 김명희 독감(Influenza)9세 1 1 1 인푸루엔자 0.5cc 내원일:",
          "reason": "정기 진료",
          "diagnosis": "미확인",
          "notes": ""
        },
        {
          "date": "2022-12-27",
          "hospital": "미확인 의료기관",
          "visitDate": "2022-12-27",
          "reason": "정기 진료",
          "diagnosis": "미확인",
          "notes": ""
        },
        {
          "date": "2023-02-20",
          "hospital": "미확인 의료기관",
          "visitDate": "2023-02-20",
          "reason": "정기 진료",
          "diagnosis": "미확인",
          "notes": ""
        },
        {
          "date": "2023-04-04",
          "hospital": "미확인 의료기관",
          "visitDate": "2023-04-04",
          "reason": "정기 진료",
          "diagnosis": "미확인",
          "notes": ""
        },
        {
          "date": "",
          "hospital": "Clinical Chart 차트번호: 2817, 김명희 -3-4시간 전 양파즙을 먹은 후 *이학적 검사 머리, 등이 발진 << Diagnosis >> (L272) 섭취한 음식물에 의한 피부염 (K297) 상세불명의 위염 << Treatment >> 소론도정(내복)(원외) 알마겔정(원외) 22 22 2 3 33 내원일:",
          "reason": "머리, 등이 발진, 가려움 세토리드정(원외) 파리에트정5mg(내복)(원외) 33 32 32 진찰구분: 재진 6쪽 이기섭의원 Clinical Chart 차트번호: 2817, 김명희 -3-4시간 전 양파즙을 먹은 후 *이학적 검사 머리, 등이 발진 << Diagnosis >> (L272) 섭취한 음식물에 의한 피부염 (K297) 상세불명의 위염 << Treatment >> 소론도정(내복)(원외) 알마겔정(원외) 22 22 2 3 33 내원일:",
          "diagnosis": "미확인",
          "notes": ""
        },
        {
          "date": "2023-04-28",
          "hospital": "미확인 의료기관",
          "visitDate": "2023-04-28",
          "reason": "정기 진료",
          "diagnosis": "미확인",
          "notes": ""
        },
        {
          "date": "2023-10-06",
          "hospital": "미확인 의료기관",
          "visitDate": "2023-10-06",
          "reason": "정기 진료",
          "diagnosis": "미확인",
          "notes": ""
        },
        {
          "date": "",
          "hospital": "Clinical Chart 차트번호: 2817, 김명희 내원일:",
          "reason": "정기 진료",
          "diagnosis": "미확인",
          "notes": ""
        },
        {
          "date": "2023-10-20",
          "hospital": "미확인 의료기관",
          "visitDate": "2023-10-20",
          "reason": "정기 진료",
          "diagnosis": "미확인",
          "notes": ""
        },
        {
          "date": "2023-11-01",
          "hospital": "미확인 의료기관",
          "visitDate": "2023-11-01",
          "reason": "정기 진료",
          "diagnosis": "미확인",
          "notes": ""
        },
        {
          "date": "2023-12-04",
          "hospital": "미확인 의료기관",
          "visitDate": "2023-12-04",
          "reason": "정기 진료",
          "diagnosis": "미확인",
          "notes": ""
        },
        {
          "date": "",
          "hospital": "Clinical Chart 차트번호: 2817, 김명희 콧물 약간 발열 약간 그저께부터 * 이학적 검사 맑은 호흡음 소화불량 << Diagnosis >> (J040) 급성 후두염 (J068) 기타 다발부위의 급성 상기도감염 (J304) 상세불명의 알레르기비염[의증] (K297) 상세불명의 위염 << Treatment >> 코데닝정(원외) 뮤코스텐캡슐(원외) 알마겔정(원외) 333 33 3 333 맥시부펜이알정300mg(원외) 베포탄정(원외) 3 3 3 2 2 33 내원일:",
          "reason": "목이 아픔. 기침 약간 321 320 진찰구분: 재진 4 4 1 1 1 진찰구분: 재진 8쪽 이기섭의원 Clinical Chart 차트번호: 2817, 김명희 콧물 약간 발열 약간 그저께부터 * 이학적 검사 맑은 호흡음 소화불량 << Diagnosis >> (J040) 급성 후두염 (J068) 기타 다발부위의 급성 상기도감염 (J304) 상세불명의 알레르기비염[의증] (K297) 상세불명의 위염 << Treatment >> 코데닝정(원외) 뮤코스텐캡슐(원외) 알마겔정(원외) 333 33 3 333 맥시부펜이알정300mg(원외) 베포탄정(원외) 3 3 3 2 2 33 내원일:",
          "diagnosis": "미확인",
          "notes": "다발부위의 급성 상기도감염 (J304) 상세불명의 알레르기비염[의증] (K297) 상세불명의 위염 << Treatment >> 코데닝정(원외) 뮤코스텐캡슐(원외) 알마겔정(원외) 333 33 3 333 맥시부펜이알정300mg(원외) 베포탄정(원외) 3 3 3 2 2 33 내원일:"
        },
        {
          "date": "2023-12-28",
          "hospital": "미확인 의료기관",
          "visitDate": "2023-12-28",
          "reason": "정기 진료",
          "diagnosis": "미확인",
          "notes": ""
        },
        {
          "date": "2024-01-15",
          "hospital": "미확인 의료기관",
          "visitDate": "2024-01-15",
          "reason": "정기 진료",
          "diagnosis": "미확인",
          "notes": ""
        },
        {
          "date": "2024-01-19",
          "hospital": "미확인 의료기관",
          "visitDate": "2024-01-19",
          "reason": "정기 진료",
          "diagnosis": "미확인",
          "notes": ""
        },
        {
          "date": "2024-01-23",
          "hospital": "미확인 의료기관",
          "visitDate": "2024-01-23",
          "reason": "정기 진료",
          "diagnosis": "미확인",
          "notes": ""
        },
        {
          "date": "",
          "hospital": "차트번호: 2817, 김명희 가래 많다-가슴에 가래 낌 기침 많다 콧물 많다. 누런 콧물 코막힘 목이 아픔. 두통 약간 발열(-) Clinical Chart *이학적 검사 맑은 호흡음 << Diagnosis >> (J209) 상세불명의 급성 기관지염[의증] (J040) 급성 후두염 (J068) 기타 다발부위의 급성 상기도감염 (K297) 상세불명의 위염 (J304) 상세불명의 알레르기비염[의증] << Treatment >> 엘도스캡슐(원외) 3 3 3 뮤코스텐캡슐(원외) 맥시부펜이알정300mg(원외) 3 3 3 위더스세파클러캡슐250mg(원외) 알마겔정(원외) 3 3 3 코슈엘정(내복)(원외) 삼진토브라마이신주사80mg,2mL/앰 1 1 1 내원일:",
          "reason": "10 쪽 333 332 332 진찰구분: 재진 이기섭의원 차트번호: 2817, 김명희 가래 많다-가슴에 가래 낌 기침 많다 콧물 많다. 누런 콧물 코막힘 목이 아픔. 두통 약간 발열(-) Clinical Chart *이학적 검사 맑은 호흡음 << Diagnosis >> (J209) 상세불명의 급성 기관지염[의증] (J040) 급성 후두염 (J068) 기타 다발부위의 급성 상기도감염 (K297) 상세불명의 위염 (J304) 상세불명의 알레르기비염[의증] << Treatment >> 엘도스캡슐(원외) 3 3 3 뮤코스텐캡슐(원외) 맥시부펜이알정300mg(원외) 3 3 3 위더스세파클러캡슐250mg(원외) 알마겔정(원외) 3 3 3 코슈엘정(내복)(원외) 삼진토브라마이신주사80mg,2mL/앰 1 1 1 내원일:",
          "diagnosis": "미확인",
          "notes": "다발부위의 급성 상기도감염 (K297) 상세불명의 위염 (J304) 상세불명의 알레르기비염[의증] << Treatment >> 엘도스캡슐(원외) 3 3 3 뮤코스텐캡슐(원외) 맥시부펜이알정300mg(원외) 3 3 3 위더스세파클러캡슐250mg(원외) 알마겔정(원외) 3 3 3 코슈엘정(내복)(원외) 삼진토브라마이신주사80mg,2mL/앰 1 1 1 내원일:"
        },
        {
          "date": "2024-01-25",
          "hospital": "미확인 의료기관",
          "visitDate": "2024-01-25",
          "reason": "정기 진료",
          "diagnosis": "미확인",
          "notes": ""
        },
        {
          "date": "",
          "hospital": "Clinical Chart 차트번호: 2817, 김명희 맥시부펜이알정300mg(원외) 3 3 3 위더스세파클러캡슐250mg(원외) 알마겔정(원외) 3 삼진토브라마이신주사80mg,2mL/앰 1 31 3 코슈엘정(내복)(원외) 1 리알트리스나잘스프레이액,18mL/병(1 331 321 32 이기섭 내원일:",
          "reason": "가래 많다-가슴에 가래 낌 기침 많다 콧물 많다, 누런콧물 코막힘 목이 아픔. 두통 약간 발열(-) *이학적 검사 맑은 호흡음 << Diagnosis >> (J209) 상세불명의 급성 기관지염[의증] (JO40) 급성 후두염 (J0190) 재발성으로 명시되어 있지 않은 상세불명의 급성 부비동염 (K297) 상세불명의 위염 (J304) 상세불명의 알레르기비염 << Treatment >> 엘도스캡슐(원외) 333 33 33 2 2 진찰구분: 재진 3 3 3 뮤코스텐캡슐(원외) 3 3 3 11 쪽 이기섭의원 Clinical Chart 차트번호: 2817, 김명희 맥시부펜이알정300mg(원외) 3 3 3 위더스세파클러캡슐250mg(원외) 알마겔정(원외) 3 삼진토브라마이신주사80mg,2mL/앰 1 31 3 코슈엘정(내복)(원외) 1 리알트리스나잘스프레이액,18mL/병(1 331 321 32 이기섭 내원일:",
          "diagnosis": "미확인",
          "notes": ""
        },
        {
          "date": "2024-01-27",
          "hospital": "미확인 의료기관",
          "visitDate": "2024-01-27",
          "reason": "정기 진료",
          "diagnosis": "미확인",
          "notes": ""
        },
        {
          "date": "2024-04-11",
          "hospital": "미확인 의료기관",
          "visitDate": "2024-04-11",
          "reason": "정기 진료",
          "diagnosis": "미확인",
          "notes": ""
        },
        {
          "date": "2024-10-14",
          "hospital": "미확인 의료기관",
          "visitDate": "2024-10-14",
          "reason": "정기 진료",
          "diagnosis": "미확인",
          "notes": ""
        },
        {
          "date": "",
          "hospital": "Clinical Chart 차트번호: 2817, 김명희 좌측 이마, 눈주위 멍듬 좌측 팔꿈치 통증 -어제(",
          "reason": "12 쪽 이기섭의원 Clinical Chart 차트번호: 2817, 김명희 좌측 이마, 눈주위 멍듬 좌측 팔꿈치 통증 -어제(",
          "diagnosis": "미확인",
          "notes": ""
        },
        {
          "date": "2024-11-14",
          "hospital": "미확인 의료기관",
          "visitDate": "2024-11-14",
          "reason": "정기 진료",
          "diagnosis": "미확인",
          "notes": ""
        },
        {
          "date": "2025-01-21",
          "hospital": "미확인 의료기관",
          "visitDate": "2025-01-21",
          "reason": "정기 진료",
          "diagnosis": "미확인",
          "notes": ""
        },
        {
          "date": "2025-01-22",
          "hospital": "미확인 의료기관",
          "visitDate": "2025-01-22",
          "reason": "정기 진료",
          "diagnosis": "미확인",
          "notes": ""
        },
        {
          "date": "2025-01-31",
          "hospital": "미확인 의료기관",
          "visitDate": "2025-01-31",
          "reason": "정기 진료",
          "diagnosis": "미확인",
          "notes": ""
        },
        {
          "date": "2025-02-17",
          "hospital": "미확인 의료기관",
          "visitDate": "2025-02-17",
          "reason": "정기 진료",
          "diagnosis": "미확인",
          "notes": ""
        },
        {
          "date": "",
          "hospital": "·가정의학과 전문의 주소:양천구 신월3동 194-26. 14:695-0660, 2007-7174 요약지정번호:",
          "reason": "양천구 신월3동 194-26. 14:695-0660, 2007-7174 요약지정번호:",
          "diagnosis": "미확인",
          "notes": ""
        }
      ],
      "hospitalizationRecords": [
        {
          "date": "",
          "hospital": "가정의학과 전문의.. 주소:양천구 신월3동 194-26 전화:605-8983,",
          "reason": "양천구 신월3동 194-26 전화:605-8983,",
          "diagnosis": "미확인",
          "admissionPeriod": "undefined ~ undefined",
          "surgeryInfo": null,
          "notes": ""
        },
        {
          "date": "",
          "hospital": "미확인 의료기관",
          "reason": "응급실 내원",
          "diagnosis": "서 입퇴원 확인서 작성 삼성화재 작성자: 한정훈 이 하 여 배 외래기록지 한림대학교강남성심병원",
          "admissionPeriod": "undefined ~ undefined",
          "surgeryInfo": null,
          "notes": ""
        },
        {
          "date": "",
          "hospital": "미확인 의료기관",
          "reason": "증상(C.C) 두통, 어지럼증 입원사유 및 현병력(PI) 2025.01부터 일어날때 어지럽고 옆쪽머리가 찢어지는 것처럼 아파서 내원함. 입원경과 및 치료과정 요약 2025.01부터 일어날때 어지럽고 옆쪽머리가 찢어지는 것처럼 아파서 내원하여 정밀 검사상 뇌혈 관질환 진단하에 약물 주사치료하고 증상개선되어 퇴원 검사소견 ?",
          "diagnosis": "] 주진단 Other specified cerebrovascular diseases [입원 경과] 주호소 증상(C.C) 두통, 어지럼증 입원사유 및 현병력(PI) 2025.01부터 일어날때 어지럽고 옆쪽머리가 찢어지는 것처럼 아파서 내원함. 입원경과 및 치료과정 요약 2025.01부터 일어날때 어지럽고 옆쪽머리가 찢어지는 것처럼 아파서 내원하여 정밀 검사상 뇌혈 관질환 진단하에 약물 주사치료하고 증상개선되어 퇴원 검사소견 ?",
          "admissionPeriod": "undefined ~ undefined",
          "surgeryInfo": null,
          "notes": "?"
        },
        {
          "date": "",
          "hospital": "퇴원요약지",
          "reason": "응급실 내원",
          "diagnosis": "미확인",
          "admissionPeriod": "undefined ~ undefined",
          "surgeryInfo": null,
          "notes": ""
        },
        {
          "date": "",
          "hospital": "미확인 의료기관",
          "reason": "응급실 내원",
          "diagnosis": "미확인",
          "admissionPeriod": "undefined ~ undefined",
          "surgeryInfo": null,
          "notes": ""
        },
        {
          "date": "",
          "hospital": "퇴원요약지 등록번호:",
          "reason": "응급실 내원",
          "diagnosis": "미확인",
          "admissionPeriod": "undefined ~ undefined",
          "surgeryInfo": null,
          "notes": ""
        },
        {
          "date": "",
          "hospital": "입원기록지(초기평가)",
          "reason": "응급실 내원",
          "diagnosis": "미확인",
          "admissionPeriod": "undefined ~ undefined",
          "surgeryInfo": null,
          "notes": ""
        },
        {
          "date": "",
          "hospital": "미확인 의료기관",
          "reason": "응급실 내원",
          "diagnosis": "미확인",
          "admissionPeriod": "undefined ~ undefined",
          "surgeryInfo": null,
          "notes": ""
        },
        {
          "date": "",
          "hospital": "입원기록지(초기평가) 등성 등록번호:",
          "reason": "응급실 내원",
          "diagnosis": "미확인",
          "admissionPeriod": "undefined ~ undefined",
          "surgeryInfo": null,
          "notes": ""
        },
        {
          "date": "",
          "hospital": "미확인 의료기관",
          "reason": "응급실 내원",
          "diagnosis": "미확인",
          "admissionPeriod": "undefined ~ undefined",
          "surgeryInfo": null,
          "notes": ""
        },
        {
          "date": "",
          "hospital": "미확인 의료기관",
          "reason": "응급실 내원",
          "diagnosis": "미확인",
          "admissionPeriod": "undefined ~ undefined",
          "surgeryInfo": null,
          "notes": ""
        },
        {
          "date": "",
          "hospital": "내 시설안내] V 휴게실 기타 은행 V 편의점 V 식당 V 인터넷 【화재방지 및 비상시 안내】 V 전열기구 사용금지 V 비상구 V 소화전 V 소화기 위치안내 V 가스 [개인용품] V 보청기 좌(V무유), 우( 자가혈당조절기 V 무 인공심장박동기 【감염관리안내] V 틀니 상(V무 유), 하(V무 유) √ 꽃, 화분 반입 제한 √ 어린이(만13세 미만) 면회제한 손위생 기침예절 [기타] √ 귀중품 관리 및 도난방지 V 낙상방지 V 보호자 면회 및 식사시간 V 진단서발급 V 사회복지서비스 안내 V 환자권리 안내 V 위해도구 반입금지 (칼, 가위, 라이터, 끈 등) V 분리수거 V 주차관리 √ 린넨관리 V 회진시간 고충처리 상담안내 V 금연 V 소등시간 V 종교활동 제한 V 사생활 보호 V 기타 1. 환자안전을 위해 무단외출 및 침대바퀴고정, 병실내 자리이동을 금지함. 2. 린넨관리, 진단서 발급,소등시간, 사회복지서비스 안내, 사식(음식점배달)반입을 금지함 3. 정수기, 탕비실, 화장실 비상벨 위치 교육함. 4. 화재교 육 실시함- 소화기, 소화전 위치와 비상시 양쪽 복도 끝 계단과 간호사실 앞 중앙계단 이용 및 대피도설명 함 5. 진단서등 퇴원시 필요한 서류는 퇴원 전날 신청 설명함 6. 상주보호자 1인을 제외한 방문객의 면회는 금 지. 7. 불만 및 고충접수방법(권리와 의무)교육함. 8. 필요시 마스크 착용 작성일 :",
          "reason": "응급실 내원",
          "diagnosis": "서발급 V 사회복지서비스 안내 V 환자권리 안내 V 위해도구 반입금지 (칼, 가위, 라이터, 끈 등) V 분리수거 V 주차관리 √ 린넨관리 V 회진시간 고충처리 상담안내 V 금연 V 소등시간 V 종교활동 제한 V 사생활 보호 V 기타 1. 환자안전을 위해 무단외출 및 침대바퀴고정, 병실내 자리이동을 금지함. 2. 린넨관리, 진단서 발급,소등시간, 사회복지서비스 안내, 사식(음식점배달)반입을 금지함 3. 정수기, 탕비실, 화장실 비상벨 위치 교육함. 4. 화재교 육 실시함- 소화기, 소화전 위치와 비상시 양쪽 복도 끝 계단과 간호사실 앞 중앙계단 이용 및 대피도설명 함 5. 진단서등 퇴원시 필요한 서류는 퇴원 전날 신청 설명함 6. 상주보호자 1인을 제외한 방문객의 면회는 금 지. 7. 불만 및 고충접수방법(권리와 의무)교육함. 8. 필요시 마스크 착용 작성일 :",
          "admissionPeriod": "undefined ~ undefined",
          "surgeryInfo": null,
          "notes": "[병실 및 병동내 시설안내] V 물통 물컵 V 실내화 V 휴지 간호정보조사지(성인) V 침대, 식탁 √ 침상등 V 전자렌지 V 냉장고 V 정수기 √ 간호사호출기 [V 세탁물보관실 V 화장실 V 샤워실 [V 화장실호출기 V 오물처리실 V 다용도실 V 휴게실 [병원내 시설안내] V 휴게실 기타 은행 V 편의점 V 식당 V 인터넷 【화재방지 및 비상시 안내】 V 전열기구 사용금지 V 비상구 V 소화전 V 소화기 위치안내 V 가스 [개인용품] V 보청기 좌(V무유), 우( 자가혈당조절기 V 무 인공심장박동기 【감염관리안내] V 틀니 상(V무 유), 하(V무 유) √ 꽃, 화분 반입 제한 √ 어린이(만13세 미만) 면회제한 손위생 기침예절 [기타] √ 귀중품 관리 및 도난방지 V 낙상방지 V 보호자 면회 및 식사시간 V 진단서발급 V 사회복지서비스 안내 V 환자권리 안내 V 위해도구 반입금지 (칼, 가위, 라이터, 끈 등) V 분리수거 V 주차관리 √ 린넨관리 V 회진시간 고충처리 상담안내 V 금연 V 소등시간 V 종교활동 제한 V 사생활 보호 V 기타 1. 환자안전을 위해 무단외출 및 침대바퀴고정, 병실내 자리이동을 금지함. 2. 린넨관리, 진단서 발급,소등시간, 사회복지서비스 안내, 사식(음식점배달)반입을 금지함 3. 정수기, 탕비실, 화장실 비상벨 위치 교육함. 4. 화재교 육 실시함- 소화기, 소화전 위치와 비상시 양쪽 복도 끝 계단과 간호사실 앞 중앙계단 이용 및 대피도설명 함 5. 진단서등 퇴원시 필요한 서류는 퇴원 전날 신청 설명함 6. 상주보호자 1인을 제외한 방문객의 면회는 금 지. 7. 불만 및 고충접수방법(권리와 의무)교육함. 8. 필요시 마스크 착용 작성일 :"
        },
        {
          "date": "",
          "hospital": "&약국 예성약국 진단과 일반의 입원/외래 외래 주상병코드 AE1178 주상병명 (양방)기타 다발성 합병증을 동반한 빈경환 TOOO 외래 코드 일수(건강보험 적용분) 혜택받은 금액| (진료비) (양방)기 타다발성 1",
          "reason": "응급실 내원",
          "diagnosis": "과 일반의 입원/외래 외래 주상병코드 AE1178 주상병명 (양방)기타 다발성 합병증을 동반한 빈경환 TOOO 외래 코드 일수(건강보험 적용분) 혜택받은 금액| (진료비) (양방)기 타다발성 1",
          "admissionPeriod": "undefined ~ undefined",
          "surgeryInfo": null,
          "notes": "다발성 합병증을 동반한 빈경환 TOOO 외래 코드 일수(건강보험 적용분) 혜택받은 금액| (진료비) (양방)기 타다발성 1"
        }
      ],
      "insuranceClaims": [
        {
          "date": "",
          "company": "미확인 보험사",
          "paymentDate": null,
          "amount": null,
          "notes": "가 아닌 증빙자료로 사용할 수 없으며, 이용에 관한 책임은 이용자에게 있습니다. 1/9 빈경환"
        },
        {
          "date": "",
          "company": "미확인 보험사",
          "paymentDate": null,
          "amount": null,
          "notes": "가 아닌 증빙자료로 사용할 수 없으며, 이용에 관한 책임은 이용자에게 있습니다. 2/9"
        },
        {
          "date": "",
          "company": "미확인 보험사",
          "paymentDate": null,
          "amount": null,
          "notes": "가 아닌 증빙자료로 사용할 수 없으며, 이용에 관한 책임은 이용자에게 있습니다. 3/9 빈경환"
        },
        {
          "date": "",
          "company": "미확인 보험사",
          "paymentDate": null,
          "amount": null,
          "notes": "가 아닌 증빙자료로 사용할 수 없으며, 이용에 관한 책임은 이용자에게 있습니다. 4/9 빈경환"
        },
        {
          "date": "",
          "company": "미확인 보험사",
          "paymentDate": null,
          "amount": null,
          "notes": "가 아닌 증빙자료로 사용할 수 없으며, 이용에 관한 책임은 이용자에게 있습니다. 5/9 빈경환"
        },
        {
          "date": "",
          "company": "미확인 보험사",
          "paymentDate": null,
          "amount": null,
          "notes": "가 아닌 증빙자료로 사용할 수 없으며, 이용에 관한 책임은 이용자에게 있습니다. 6/9 빈경환"
        },
        {
          "date": "",
          "company": "미확인 보험사",
          "paymentDate": null,
          "amount": null,
          "notes": "가 아닌 증빙자료로 사용할 수 없으며, 이용에 관한 책임은 이용자에게 있습니다. 7/9 빈경환"
        },
        {
          "date": "",
          "company": "미확인 보험사",
          "paymentDate": null,
          "amount": null,
          "notes": "가 아닌 증빙자료로 사용할 수 없으며, 이용에 관한 책임은 이용자에게 있습니다. 8/9 빈경환 LIㄱㄹ ㅇㄱㄱㄱ TOOO 외래 코드 일수(건강보험 적용분) 혜택받은 금액| (진료비) 89"
        },
        {
          "date": "",
          "company": "미확인 보험사",
          "paymentDate": null,
          "amount": null,
          "notes": "가 아닌 증빙자료로 사용할 수 없으며, 이용에 관한 책임은 이용자에게 있습니다. 9/9 빈경환 ========== 파일: i?´e¸°i?­i??i??.pdf =========="
        }
      ]
    },
    "progressReport": "NaN\n의료 경과보고서\nMedical Progress Report\n생성일: 2025.08.17\nNaN\n\n■ 환자 정보 (Patient Information)\nNaN\n환자명: 김명희\n생년월일: 미확인 (만 미확인세)\n등록번호: 250026063\n성별: 여성\n\n■ 보험 가입 조건 (Insurance Conditions)\nNaN\n1. 제출 구비서류 (신)신분증,(환)신분증,(환)동의서,(환)위임장 첨부한 사본은 의무기록 원본과 틀림이 없음을 증명합니다. 2025-03-10 발급자 서명 김지현 주. 1. 의무기록팀 \"발급자 서명\"이 없는 것은 무효입니다. 2. 상기 용도 외에는 이 사본을 사용할 수 없으며, 용도가 완료된 후 즉시 파본, 폐기하여야 합니다. 한림대학교강남성심병원 \"직인생략\" 250026063 김명희 570725-2 진료의뢰서 250026063\n   가입일: 미확인\n   상품명: 미확인 상품\n   담보내용: 미확인 담보\n   상태: 유효\n\n2. 서류발급 2025-03-18\n   가입일: 미확인\n   상품명: 미확인 상품\n   담보내용: 미확인 담보\n   상태: 유효\n\n3. 서류발급(흥국화재) 내당 최내과 의 원 강~! rent x 90x4 6 ========== 파일: i?￢i??i?? i§?e￡?e?´i?­.pdf ========== 2025-03-24 20:47:05 CH 48181 해오름손해사정(주) PENTARY SUNRISE SURVEYORS & CLAIM ADJUSTERS CO., LTD. 심평원 진료내역 피\n   가입일: 미확인\n   상품명: 미확인 상품\n   담보내용: 미확인 담보\n   상태: 유효\n\n■ 보험 가입 이력 (Insurance History)\nNaN\n[보험 가입 3개월 이내]\n미확인 제출 구비서류 (신)신분증,(환)신분증,(환)동의서,(환)위임장 첨부한 사본은 의무기록 원본과 틀림이 없음을 증명합니다. 2025-03-10 발급자 서명 김지현 주. 1. 의무기록팀 \"발급자 서명\"이 없는 것은 무효입니다. 2. 상기 용도 외에는 이 사본을 사용할 수 없으며, 용도가 완료된 후 즉시 파본, 폐기하여야 합니다. 한림대학교강남성심병원 \"직인생략\" 250026063 김명희 570725-2 진료의뢰서 250026063 가입 (미확인)\n\n[보험 가입 3개월 이내]\n미확인 서류발급 2025-03-18 가입 (미확인)\n\n[보험 가입 3개월 이내]\n미확인 서류발급(흥국화재) 내당 최내과 의 원 강~! rent x 90x4 6 ========== 파일: i?￢i??i?? i§?e￡?e?´i?­.pdf ========== 2025-03-24 20:47:05 CH 48181 해오름손해사정(주) PENTARY SUNRISE SURVEYORS & CLAIM ADJUSTERS CO., LTD. 심평원 진료내역 피 가입 (미확인)\n\n■ 진료 기록 (Medical Records)\nNaN\n[미확인] 의무기록사본 총 0부 (표지제외) 빈경환 의무기록 사본 증명서 발행번호 2025-16564 등록번호\n내원일: 미확인\n내원사유: 정기 진료\n진단명: 미확인\n중증도: 경미\n\n[미확인] ]진료과 [뇌신경센터] 신경외과 신청자 대리인 발급매수 14 OH 발급용도 보험회사 제출 구비서류 (신)신분증,(환)신분증,(환)동의서,(환)위임장 첨부한 사본은 의무기록 원본과 틀림이 없음을 증명합니다.\n내원일: 미확인\n내원사유: 정기 진료\n진단명: 미확인\n중증도: 경미\n\n[미확인] \"직인생략\"\n내원일: 미확인\n내원사유: 정기 진료\n진단명: 미확인\n중증도: 경미\n\n[미확인] 주: 1. 이 진료의뢰서는 1차진료후 2차진료를 받고자 하는 경우 1차 진료담당의사로부터 요양급여 기준에 따라 무상으로 교부됩니다. 110. 3. 일사상태 국산호초반에홑의현동,검사, 부약사릉추요쟌호내용을 구체적으로 기재하기 바라며\n내원일: 미확인\n내원사유: 정기 진료\n진단명: 미확인\n중증도: 경미\n\n[미확인] 작성자: 한정훈 외래기록지\n내원일: 미확인\n내원사유: 정기 진료\n진단명: 미확인\n중증도: 경미\n\n[미확인] 미확인 의료기관\n내원일: 미확인\n내원사유: 정기 진료\n진단명: 미확인\n처방: 일/보고일]\n중증도: 경미\n\n[2025.02.18] 미확인 의료기관\n내원일: 2025.02.18\n내원사유: 정기 진료\n진단명: 미확인\n중증도: 경미\n\n[2025.02.17] 미확인 의료기관\n내원일: 2025.02.17\n내원사유: 정기 진료\n진단명: 미확인\n중증도: 경미\n\n[2025.02.17] 미확인 의료기관\n내원일: 2025.02.17\n내원사유: 정기 진료\n진단명: 미확인\n중증도: 경미\n\n[미확인] 도착 1개월간 한번이라도 흡연한 적이 있는가?) □ 예 금연상담 여부 예( 아니오 기록 없음/확인불능 의사 간호사) □ 아니오 금연상담 대상 【금연 상담을 제공하지 않은 이유가 있는가?! |환자의 신경학적 결함(의식혼탁 등)으로 인해 금연상담의 이해가 불가능한 경우 1환자의 신체적/정신적 상태로 인해 흡연이 불가능한 경우 1 기타 한림대학교강남성심병원\n내원일: 미확인\n내원사유: 정기 진료\n진단명: 미확인\n처방: V 흡 연 VI 회/일 변비 유 1 병/회 1 기간 15 | 년 유 유 유 유 무무 종류 용량 기간 유종류 용량 기간 갑/일 기간 년 회/월 종류 맥주 [금연에 대한 조언/상담 시행 비율] 흡연력(병원도착 1개월간 한번이라도 흡연한 적이 있는가?) □ 예 금연상담 여부 예( 아니오 기록 없음/확인불능 의사 간호사) □ 아니오 금연상담 대상 【금연 상담을 제공하지 않은 이유가 있는가?! |환자의 신경학적 결함(의식혼탁 등)으로 인해 금연상담의 이해가 불가능한 경우 1환자의 신체적/정신적 상태로 인해 흡연이 불가능한 경우 1 기타 한림대학교강남성심병원\n특이사항: 이상호흡음 기관절개관 1 토혈 □ 소화장애 복부팽만 혈변 |인공장루 기타 긴급료 실금 임신 여부 통 증 해당무 V 아니오 V 없음 예 최종월경일 V 기타 폐경 ㅣ있음 (부위) 두통흉통 (정도) 둔함 □ 쑤심 복통 퍼짐 신경계 장애 마비 V 없음 있음 □ 오른팔 오른발 사지통 요통 예리함 |찌르는듯함 왼팔 왼발 기타 쥐어짜는듯함 □ 기타 신경근육 V 이상없음 보조 기구 시력 청력 장애 V 없음 장애 V 없음 있음 10 ? □ 무감각 목발 저린감 ]의족 □ 의수 동통 저하 Brace Wheel chair 1부위 의치 기타 ㅣ있음 [안경 렌즈 V 없음 ㅣ있음 |청력저하 의안(Rt) 1의안(Lt) 보청기 기타 이명 청각상실(Rt) 청각상실(Lt) 1 기타 부 종 V 없음 있음 (부위) 전신 사지 상지 하지 얼굴 안검 기타 피부 장애 V 없음 있음 창백 |홍조 청색증 황달 | 가려움증 자반 기타 욕창 【습 관] 배 음 수면장애 변주 수면제복용 V 향정신성 약물 V 흡 연 VI 회/일 변비 유 1 병/회 1 기간 15 | 년 유 유 유 유 무무 종류 용량 기간 유종류 용량 기간 갑/일 기간 년 회/월 종류 맥주 [금연에 대한 조언/상담 시행 비율] 흡연력(병원도착 1개월간 한번이라도 흡연한 적이 있는가?) □ 예 금연상담 여부 예( 아니오 기록 없음/확인불능 의사 간호사) □ 아니오 금연상담 대상 【금연 상담을 제공하지 않은 이유가 있는가?! |환자의 신경학적 결함(의식혼탁 등)으로 인해 금연상담의 이해가 불가능한 경우 1환자의 신체적/정신적 상태로 인해 흡연이 불가능한 경우 1 기타 한림대학교강남성심병원\n중증도: 경미\n\n[2025.02.18] 미확인 의료기관\n내원일: 2025.02.18\n내원사유: 정기 진료\n진단명: 미확인\n중증도: 경미\n\n[2025.02.18] 미확인 의료기관\n내원일: 2025.02.18\n내원사유: 정기 진료\n진단명: 미확인\n중증도: 경미\n\n[2025.02.18] 미확인 의료기관\n내원일: 2025.02.18\n내원사유: 정기 진료\n진단명: 미확인\n중증도: 경미\n\n[미확인] 원본대조필 ========== 파일: e?´e?¹iμ?e?´e³¼i??i??.pdf ==========\n내원일: 미확인\n내원사유: 정기 진료\n진단명: 미확인\n중증도: 경미\n\n[미확인] 의무기록사본 총 0부 (표지제외) 빈경환 CHART 4478 No. 2008 년 5 월 9 일 수진자 김명희 주민번호 진료일자 570725-2057811\n내원일: 미확인\n내원사유: 정기 진료\n진단명: 미확인\n중증도: 경미\n\n[2008.05.09] 미확인 의료기관\n내원일: 2008.05.09\n내원사유: 정기 진료\n진단명: 미확인\n중증도: 경미\n\n[미확인] 내원한 Glucose + 당뇨 진전 pH 6.0 Blood - Othis mone 1½ (932): none nonopaul 447 Cheif complain: 체중변화더 Flux 3 03:03 패론말 (4): 주로 밖에 장사를 해서 Phgsical exam: 시력장애(t): 김안과 개원 다리가 아르고 (4) 어깨가 동종(다) : 양장 여동생(4) 거리자) 명색증(+): 양쪽 원본대조필 수면장기(+) 치하: fme mim 별세 내당최내과의원 약국소개 DATE\n내원일: 미확인\n내원사유: 158-829 서울 양천구 신월3동 174-23호 DIAGNOSIS BP: 110/70 mmHg P: T: W : H 71 84 BST: 230 m²/ℓ(40분) HT: 152.8 cm BW: 47.8 kg BMI: 20.5 % Onset: 피로만 심해서 7일전 소변4종 Protein - Duration: Belk Past History: on As 동네병원 내원한 Glucose + 당뇨 진전 pH 6.0 Blood - Othis mone 1½ (932): none nonopaul 447 Cheif complain: 체중변화더 Flux 3 03:03 패론말 (4): 주로 밖에 장사를 해서 Phgsical exam: 시력장애(t): 김안과 개원 다리가 아르고 (4) 어깨가 동종(다) : 양장 여동생(4) 거리자) 명색증(+): 양쪽 원본대조필 수면장기(+) 치하: fme mim 별세 내당최내과의원 약국소개 DATE\n진단명: 미확인\n중증도: 경미\n\n[미확인] SIGN DATE\n내원일: 미확인\n내원사유: 정기 진료\n진단명: 미확인\n중증도: 경미\n\n[미확인] 8 ② 1월 금융 DATE PROGRESS NOTE\n내원일: 미확인\n내원사유: 정기 진료\n진단명: 미확인\n중증도: 경미\n\n[미확인] SIGN 김→ 본알수 Pry DATE\n내원일: 미확인\n내원사유: 정기 진료\n진단명: 미확인\n중증도: 경미\n\n[미확인] ?? DATE PROGRESS NOTE\n내원일: 미확인\n내원사유: 정기 진료\n진단명: 미확인\n중증도: 경미\n\n[미확인] 2021년 DATE\n내원일: 미확인\n내원사유: 정기 진료\n진단명: 미확인\n중증도: 경미\n\n[미확인] DATE\n내원일: 미확인\n내원사유: 정기 진료\n진단명: 미확인\n중증도: 경미\n\n[미확인] 8.0 m McQ DATE\n내원일: 미확인\n내원사유: 정기 진료\n진단명: 미확인\n중증도: 경미\n\n[미확인] ⑤ ? DATE\n내원일: 미확인\n내원사유: 정기 진료\n진단명: 미확인\n중증도: 경미\n\n[미확인] DATE\n내원일: 미확인\n내원사유: 정기 진료\n진단명: 미확인\n중증도: 경미\n\n[미확인] 2025년 DATE\n내원일: 미확인\n내원사유: 정기 진료\n진단명: 미확인\n중증도: 경미\n\n[미확인] &약국별 기본진료내역 정보주체 : 김명희 열람대상기간 :\n내원일: 미확인\n내원사유: 정기 진료\n진단명: 미확인\n처방: 조제정보 병·의원&약국별 기본진료내역 정보주체 : 김명희 열람대상기간 :\n중증도: 경미\n\n[미확인] 정형외 과 외래 ASOO1 꺼풀 및 눈 주위의 타 박상 1 20,010 16,010 4,000\n내원일: 미확인\n내원사유: 정기 진료\n진단명: 미확인\n중증도: 경미\n\n[미확인] 피부과 외래 AL239 인의 알레 1 12,590 11,090 1,500 르기성 접 촉피부염\n내원일: 미확인\n내원사유: 정기 진료\n진단명: 미확인\n중증도: 경미\n\n[미확인] &약국에서 청구한 요양급여비용 명세서를 기준으로 작성된 자료입니다. 진료비에는 국민건강보험법 제41조의4에 따른 선별급여 관련 금액이 포함되어 있지 않습니다. 이에 본 자료를 단순 참고가 아닌 증빙자료로 사용할 수 없으며, 이용에 관한 책임은 이용자에게 있습니다. 1/9 빈경환\n내원일: 미확인\n내원사유: 정기 진료\n진단명: 미확인\n특이사항: 가 아닌 증빙자료로 사용할 수 없으며, 이용에 관한 책임은 이용자에게 있습니다. 1/9 빈경환\n중증도: 경미\n\n[미확인] 내과 외래 AJ209 (양방)상 세불명의 급성 기관 지염 1 18,440 16,640 1,800 13\n내원일: 미확인\n내원사유: 정기 진료\n진단명: 미확인\n중증도: 경미\n\n[미확인] 내과 외래 AJ209 (양방)상 세불명의 급성 기관 지염 1 15,690 14,190 1,500 15\n내원일: 미확인\n내원사유: 정기 진료\n진단명: 미확인\n중증도: 경미\n\n[미확인] 내과 외래 AJ209 (양방)상 세불명의 급성 기관 지염 1 15,690 14,190 1,500 17\n내원일: 미확인\n내원사유: 정기 진료\n진단명: 미확인\n중증도: 경미\n\n[미확인] 내과 외래 AJ040 (양방)급 성 후두염 14,830 13,330 1,500 19\n내원일: 미확인\n내원사유: 정기 진료\n진단명: 미확인\n중증도: 경미\n\n[미확인] 내과 외래 AJ040 (양방)급 성후두염 12,590 11,090 1,500 21\n내원일: 미확인\n내원사유: 정기 진료\n진단명: 미확인\n중증도: 경미\n\n[미확인] (양방)관 외래 AM2550절통, 여러 1 \"부위\"' 14,760 13,260 1,500 본 자료는 병·의원&약국에서 청구한 요양급여비용 명세서를 기준으로 작성된 자료입니다. 빈경환 진료비에는 국민건강보험법 제41조의4에 따른 선별급여 관련 금액이 포함되어 있지 않습니다. 이에 본 자료를 단순 참고가 아닌 증빙자료로 사용할 수 없으며, 이용에 관한 책임은 이용자에게 있습니다. 2/9\n내원일: 미확인\n내원사유: 정기 진료\n진단명: 미확인\n특이사항: 가 아닌 증빙자료로 사용할 수 없으며, 이용에 관한 책임은 이용자에게 있습니다. 2/9\n중증도: 경미\n\n[미확인] 내과 외래 AJ040 (양방)급 1 12,380 10,880 1,500 성 후두염 25\n내원일: 미확인\n내원사유: 정기 진료\n진단명: 미확인\n중증도: 경미\n\n[미확인] 내과 외래 AJ040 (양방)급 성 후두염 14,660 13,160 1,500 29\n내원일: 미확인\n내원사유: 정기 진료\n진단명: 미확인\n중증도: 경미\n\n[미확인] 피부과 외래 AL239 인의 알레 17,320 15,620 1,700 르기성 접 촉피부염 메디팜성화약 31\n내원일: 미확인\n내원사유: 정기 진료\n진단명: 미확인\n중증도: 경미\n\n[미확인] &약국에서 청구한 요양급여비용 명세서를 기준으로 작성된 자료입니다. 진료비에는 국민건강보험법 제41조의4에 따른 선별급여 관련 금액이 포함되어 있지 않습니다. ?이에 본 자료를 단순 참고가 아닌 증빙자료로 사용할 수 없으며, 이용에 관한 책임은 이용자에게 있습니다. 3/9 빈경환\n내원일: 미확인\n내원사유: 정기 진료\n진단명: 미확인\n특이사항: 가 아닌 증빙자료로 사용할 수 없으며, 이용에 관한 책임은 이용자에게 있습니다. 3/9 빈경환\n중증도: 경미\n\n[미확인] 내과 외래 AJ040 (양방)급 성 후두염 1 12,380 10,880 1,500 38\n내원일: 미확인\n내원사유: 정기 진료\n진단명: 미확인\n중증도: 경미\n\n[미확인] 피부과 외래 AL272 취한 음식 물에 의한 피부염 1 14,460 12,960 1,500 40\n내원일: 미확인\n내원사유: 정기 진료\n진단명: 미확인\n중증도: 경미\n\n[미확인] 내과 외래 AK297 세불명의 1 위염 12,380 10,880 1,500 42\n내원일: 미확인\n내원사유: 정기 진료\n진단명: 미확인\n중증도: 경미\n\n[미확인] 내과 외래 AJ040 (양방)급 1 성후두염 16,970 15,370 1,600 44\n내원일: 미확인\n내원사유: 정기 진료\n진단명: 미확인\n중증도: 경미\n\n[미확인] &약국에서 청구한 요양급여비용 명세서를 기준으로 작성된 자료입니다. 진료비에는 국민건강보험법 제41조의4에 따른 선별급여 관련 금액이 포함되어 있지 않습니다. ?이에 본 자료를 단순 참고가 아닌 증빙자료로 사용할 수 없으며, 이용에 관한 책임은 이용자에게 있습니다. 4/9 빈경환\n내원일: 미확인\n내원사유: 정기 진료\n진단명: 미확인\n특이사항: 가 아닌 증빙자료로 사용할 수 없으며, 이용에 관한 책임은 이용자에게 있습니다. 4/9 빈경환\n중증도: 경미\n\n[미확인] 정형외 과 212 AS007 리의 다발 성표재성 손상 1 21,260 14,960 6,300 (양방)머 정형외 50\n내원일: 미확인\n내원사유: 정기 진료\n진단명: 미확인\n중증도: 경미\n\n[미확인] 외래 AS007 리의 다발 성표재성 손상 1 21,260 14,960 6,300\n내원일: 미확인\n내원사유: 정기 진료\n진단명: 미확인\n중증도: 경미\n\n[미확인] 내과 외래 AJ029 (양방)상 세불명의 급성 인두 1 33,570 28,570 5,000 염 53\n내원일: 미확인\n내원사유: 정기 진료\n진단명: 미확인\n중증도: 경미\n\n[미확인] 내과 외래 AJ029 (양방)상 세불명의 급성 인두 염 1 40 40 40 0 54\n내원일: 미확인\n내원사유: 정기 진료\n진단명: 미확인\n중증도: 경미\n\n[미확인] &약국에서 청구한 요양급여비용 명세서를 기준으로 작성된 자료입니다. 진료비에는 국민건강보험법 제41조의4에 따른 선별급여 관련 금액이 포함되어 있지 않습니다. 이에 본 자료를 단순 참고가 아닌 증빙자료로 사용할 수 없으며, 이용에 관한 책임은 이용자에게 있습니다. 5/9 빈경환\n내원일: 미확인\n내원사유: 정기 진료\n진단명: 미확인\n특이사항: 가 아닌 증빙자료로 사용할 수 없으며, 이용에 관한 책임은 이용자에게 있습니다. 5/9 빈경환\n중증도: 경미\n\n[미확인] 신경과 외래 AG470 (양방)수 면 개시 및 유지 장애 1 16,970 11,970 5,000 불면증] 58\n내원일: 미확인\n내원사유: 정기 진료\n진단명: 미확인\n중증도: 경미\n\n[미확인] &약국에서 청구한 요양급여비용 명세서를 기준으로 작성된 자료입니다. 진료비에는 국민건강보험법 제41조의4에 따른 선별급여 관련 금액이 포함되어 있지 않습니다. 이에 본 자료를 단순 참고가 아닌 증빙자료로 사용할 수 없으며, 이용에 관한 책임은 이용자에게 있습니다. 6/9 빈경환\n내원일: 미확인\n내원사유: 정기 진료\n진단명: 미확인\n특이사항: 가 아닌 증빙자료로 사용할 수 없으며, 이용에 관한 책임은 이용자에게 있습니다. 6/9 빈경환\n중증도: 경미\n\n[미확인] 피부과 외래 AL239 인의 알레 1 13,760 9,660 4,100 르기성 촉피부염 69\n내원일: 미확인\n내원사유: 정기 진료\n진단명: 미확인\n중증도: 경미\n\n[미확인] 피부과 외래 AL272 취한 음식 물에 의한 피부염 1 13,760 9,660 4,100\n내원일: 미확인\n내원사유: 정기 진료\n진단명: 미확인\n중증도: 경미\n\n[미확인] 피부과 외래 AL272 1 13,760 9,660 4,100 물에 의한 피부염 (양방)섭 75\n내원일: 미확인\n내원사유: 정기 진료\n진단명: 미확인\n중증도: 경미\n\n[미확인] 피부과 외래 AL272 취한 음식 물에 의한 피부염 18,460 12,960 5,500 76\n내원일: 미확인\n내원사유: 정기 진료\n진단명: 미확인\n중증도: 경미\n\n[미확인] &약국에서 청구한 요양급여비용 명세서를 기준으로 작성된 자료입니다. 진료비에는 국민건강보험법 제41조의4에 따른 선별급여 관련 금액이 포함되어 있지 않습니다. ?이에 본 자료를 단순 참고가 아닌 증빙자료로 사용할 수 없으며, 이용에 관한 책임은 이용자에게 있습니다. 7/9 빈경환\n내원일: 미확인\n내원사유: 정기 진료\n진단명: 미확인\n특이사항: 가 아닌 증빙자료로 사용할 수 없으며, 이용에 관한 책임은 이용자에게 있습니다. 7/9 빈경환\n중증도: 경미\n\n[미확인] &약국에서 청구한 요양급여비용 명세서를 기준으로 작성된 자료입니다. . 진료비에는 국민건강보험법 제41조의4에 따른 선별급여 관련 금액이 포함되어 있지 않습니다. 이에 본 자료를 단순 참고가 아닌 증빙자료로 사용할 수 없으며, 이용에 관한 책임은 이용자에게 있습니다. 8/9 빈경환 LIㄱㄹ ㅇㄱㄱㄱ TOOO 외래 코드 일수(건강보험 적용분) 혜택받은 금액| (진료비) 89\n내원일: 미확인\n내원사유: 정기 진료\n진단명: 미확인\n특이사항: 가 아닌 증빙자료로 사용할 수 없으며, 이용에 관한 책임은 이용자에게 있습니다. 8/9 빈경환 LIㄱㄹ ㅇㄱㄱㄱ TOOO 외래 코드 일수(건강보험 적용분) 혜택받은 금액| (진료비) 89\n중증도: 경미\n\n[미확인] &약국에서 청구한 요양급여비용 명세서를 기준으로 작성된 자료입니다. 진료비에는 국민건강보험법 제41조의4에 따른 선별급여 관련 금액이 포함되어 있지 않습니다. ?이에 본 자료를 단순 참고가 아닌 증빙자료로 사용할 수 없으며, 이용에 관한 책임은 이용자에게 있습니다. 9/9 빈경환 ========== 파일: i?´e¸°i?­i??i??.pdf ==========\n내원일: 미확인\n내원사유: 정기 진료\n진단명: 미확인\n특이사항: 가 아닌 증빙자료로 사용할 수 없으며, 이용에 관한 책임은 이용자에게 있습니다. 9/9 빈경환 ========== 파일: i?´e¸°i?­i??i??.pdf ==========\n중증도: 경미\n\n[미확인] 의무기록사본 총 0부 (표지제외) 빈경환 차트번호: 2817, 김명희 피보험자 김명희 전화번호 2699-0913 Clinical Chart 현대조 증번호\n내원일: 미확인\n내원사유: 정기 진료\n진단명: 미확인\n중증도: 경미\n\n[2019.09.02] 미확인 의료기관\n내원일: 2019.09.02\n내원사유: 정기 진료\n진단명: 미확인\n중증도: 경미\n\n[2020.10.28] 미확인 의료기관\n내원일: 2020.10.28\n내원사유: 정기 진료\n진단명: 미확인\n중증도: 경미\n\n[2021.02.16] 미확인 의료기관\n내원일: 2021.02.16\n내원사유: 정기 진료\n진단명: 미확인\n중증도: 경미\n\n[2021.02.17] 미확인 의료기관\n내원일: 2021.02.17\n내원사유: 정기 진료\n진단명: 미확인\n중증도: 경미\n\n[2021.05.11] 미확인 의료기관\n내원일: 2021.05.11\n내원사유: 정기 진료\n진단명: 미확인\n중증도: 경미\n\n[미확인] 차트번호: 2817, 김명희 이마의 가려움 상복부 불쾌감 *이학적 검사 이마의 발진 << Diagnosis >> Clinical Chart (L239) 상세불명 원인의 알레르기성 접촉피부염 4 (K297) 상세불명의 위염 4회 << Treatment >> 소론도정(내복)(원외) 알마겔정(원외) 22 33 2 2 베포리진정10mg(원외) 유한디나트륨인산덱사메타손주사액 21 2 1 이기섭 내원일:\n내원일: 미확인\n내원사유: 2쪽 4.5 43 22 33 진찰구분: 재진 이기섭의원 차트번호: 2817, 김명희 이마의 가려움 상복부 불쾌감 *이학적 검사 이마의 발진 << Diagnosis >> Clinical Chart (L239) 상세불명 원인의 알레르기성 접촉피부염 4 (K297) 상세불명의 위염 4회 << Treatment >> 소론도정(내복)(원외) 알마겔정(원외) 22 33 2 2 베포리진정10mg(원외) 유한디나트륨인산덱사메타손주사액 21 2 1 이기섭 내원일:\n진단명: 미확인\n중증도: 경미\n\n[2021.06.08] 미확인 의료기관\n내원일: 2021.06.08\n내원사유: 정기 진료\n진단명: 미확인\n중증도: 경미\n\n[2021.06.24] 미확인 의료기관\n내원일: 2021.06.24\n내원사유: 정기 진료\n진단명: 미확인\n중증도: 경미\n\n[미확인] 에서 정밀검사 받도록 함 내원일:\n내원일: 미확인\n내원사유: 눈이 흐려진다함-코로나19예방접종 한지 14일 후부터 따님이 전화함 -종합병원에서 정밀검사 받도록 함 내원일:\n진단명: 미확인\n중증도: 경미\n\n[2021.08.24] 미확인 의료기관\n내원일: 2021.08.24\n내원사유: 정기 진료\n진단명: 미확인\n중증도: 경미\n\n[미확인] Clinical Chart 차트번호: 2817, 김명희 코로나19 1 1 1 코로나19(아스트라)0.5cc 내원일:\n내원일: 미확인\n내원사유: 정기 진료\n진단명: 미확인\n중증도: 경미\n\n[2021.12.15] 미확인 의료기관\n내원일: 2021.12.15\n내원사유: 정기 진료\n진단명: 미확인\n중증도: 경미\n\n[2022.03.07] 미확인 의료기관\n내원일: 2022.03.07\n내원사유: 정기 진료\n진단명: 미확인\n중증도: 경미\n\n[2022.05.30] 미확인 의료기관\n내원일: 2022.05.30\n내원사유: 정기 진료\n진단명: 미확인\n중증도: 경미\n\n[미확인] Clinical Chart 차트번호: 2817, 김명희 이연리보스타마이신주사액 1 1 1 이기섭 내원일:\n내원일: 미확인\n내원사유: 얼굴 우측 눈주위, 우측 뺨, 우측 무릎 찰과상 & 멍듬 소화불량 << Diagnosis >> (S007) 머리의 다발성 표재성 손상 (S800) 무릎의 타박상[우측] (S808) 아래다리의 기타 표재성 손상[우측] (K297) 상세불명의 위염 << Treatment >> 단순처치[1일당]() 록스펜정(원외) 1 1 1 타이록신캡슐(원외) 3 3 4 알마겔정(원외) 4쪽 33 33 44 이기섭의원 Clinical Chart 차트번호: 2817, 김명희 이연리보스타마이신주사액 1 1 1 이기섭 내원일:\n진단명: 미확인\n특이사항: 표재성 손상[우측] (K297) 상세불명의 위염 << Treatment >> 단순처치[1일당]() 록스펜정(원외) 1 1 1 타이록신캡슐(원외) 3 3 4 알마겔정(원외) 4쪽 33 33 44 이기섭의원 Clinical Chart 차트번호: 2817, 김명희 이연리보스타마이신주사액 1 1 1 이기섭 내원일:\n중증도: 경미\n\n[2022.05.31] 미확인 의료기관\n내원일: 2022.05.31\n내원사유: 정기 진료\n진단명: 미확인\n중증도: 경미\n\n[2022.08.03] 미확인 의료기관\n내원일: 2022.08.03\n내원사유: 정기 진료\n진단명: 미확인\n중증도: 경미\n\n[2022.11.28] 미확인 의료기관\n내원일: 2022.11.28\n내원사유: 정기 진료\n진단명: 미확인\n중증도: 경미\n\n[미확인] Clinical Chart 차트번호: 2817, 김명희 독감(Influenza)9세 1 1 1 인푸루엔자 0.5cc 내원일:\n내원일: 미확인\n내원사유: 정기 진료\n진단명: 미확인\n중증도: 경미\n\n[2022.12.27] 미확인 의료기관\n내원일: 2022.12.27\n내원사유: 정기 진료\n진단명: 미확인\n중증도: 경미\n\n[2023.02.20] 미확인 의료기관\n내원일: 2023.02.20\n내원사유: 정기 진료\n진단명: 미확인\n중증도: 경미\n\n[2023.04.04] 미확인 의료기관\n내원일: 2023.04.04\n내원사유: 정기 진료\n진단명: 미확인\n중증도: 경미\n\n[미확인] Clinical Chart 차트번호: 2817, 김명희 -3-4시간 전 양파즙을 먹은 후 *이학적 검사 머리, 등이 발진 << Diagnosis >> (L272) 섭취한 음식물에 의한 피부염 (K297) 상세불명의 위염 << Treatment >> 소론도정(내복)(원외) 알마겔정(원외) 22 22 2 3 33 내원일:\n내원일: 미확인\n내원사유: 머리, 등이 발진, 가려움 세토리드정(원외) 파리에트정5mg(내복)(원외) 33 32 32 진찰구분: 재진 6쪽 이기섭의원 Clinical Chart 차트번호: 2817, 김명희 -3-4시간 전 양파즙을 먹은 후 *이학적 검사 머리, 등이 발진 << Diagnosis >> (L272) 섭취한 음식물에 의한 피부염 (K297) 상세불명의 위염 << Treatment >> 소론도정(내복)(원외) 알마겔정(원외) 22 22 2 3 33 내원일:\n진단명: 미확인\n중증도: 경미\n\n[2023.04.28] 미확인 의료기관\n내원일: 2023.04.28\n내원사유: 정기 진료\n진단명: 미확인\n중증도: 경미\n\n[2023.10.06] 미확인 의료기관\n내원일: 2023.10.06\n내원사유: 정기 진료\n진단명: 미확인\n중증도: 경미\n\n[미확인] Clinical Chart 차트번호: 2817, 김명희 내원일:\n내원일: 미확인\n내원사유: 정기 진료\n진단명: 미확인\n중증도: 경미\n\n[2023.10.20] 미확인 의료기관\n내원일: 2023.10.20\n내원사유: 정기 진료\n진단명: 미확인\n중증도: 경미\n\n[2023.11.01] 미확인 의료기관\n내원일: 2023.11.01\n내원사유: 정기 진료\n진단명: 미확인\n중증도: 경미\n\n[2023.12.04] 미확인 의료기관\n내원일: 2023.12.04\n내원사유: 정기 진료\n진단명: 미확인\n중증도: 경미\n\n[미확인] Clinical Chart 차트번호: 2817, 김명희 콧물 약간 발열 약간 그저께부터 * 이학적 검사 맑은 호흡음 소화불량 << Diagnosis >> (J040) 급성 후두염 (J068) 기타 다발부위의 급성 상기도감염 (J304) 상세불명의 알레르기비염[의증] (K297) 상세불명의 위염 << Treatment >> 코데닝정(원외) 뮤코스텐캡슐(원외) 알마겔정(원외) 333 33 3 333 맥시부펜이알정300mg(원외) 베포탄정(원외) 3 3 3 2 2 33 내원일:\n내원일: 미확인\n내원사유: 목이 아픔. 기침 약간 321 320 진찰구분: 재진 4 4 1 1 1 진찰구분: 재진 8쪽 이기섭의원 Clinical Chart 차트번호: 2817, 김명희 콧물 약간 발열 약간 그저께부터 * 이학적 검사 맑은 호흡음 소화불량 << Diagnosis >> (J040) 급성 후두염 (J068) 기타 다발부위의 급성 상기도감염 (J304) 상세불명의 알레르기비염[의증] (K297) 상세불명의 위염 << Treatment >> 코데닝정(원외) 뮤코스텐캡슐(원외) 알마겔정(원외) 333 33 3 333 맥시부펜이알정300mg(원외) 베포탄정(원외) 3 3 3 2 2 33 내원일:\n진단명: 미확인\n특이사항: 다발부위의 급성 상기도감염 (J304) 상세불명의 알레르기비염[의증] (K297) 상세불명의 위염 << Treatment >> 코데닝정(원외) 뮤코스텐캡슐(원외) 알마겔정(원외) 333 33 3 333 맥시부펜이알정300mg(원외) 베포탄정(원외) 3 3 3 2 2 33 내원일:\n중증도: 경미\n\n[2023.12.28] 미확인 의료기관\n내원일: 2023.12.28\n내원사유: 정기 진료\n진단명: 미확인\n중증도: 경미\n\n[2024.01.15] 미확인 의료기관\n내원일: 2024.01.15\n내원사유: 정기 진료\n진단명: 미확인\n중증도: 경미\n\n[2024.01.19] 미확인 의료기관\n내원일: 2024.01.19\n내원사유: 정기 진료\n진단명: 미확인\n중증도: 경미\n\n[2024.01.23] 미확인 의료기관\n내원일: 2024.01.23\n내원사유: 정기 진료\n진단명: 미확인\n중증도: 경미\n\n[미확인] 차트번호: 2817, 김명희 가래 많다-가슴에 가래 낌 기침 많다 콧물 많다. 누런 콧물 코막힘 목이 아픔. 두통 약간 발열(-) Clinical Chart *이학적 검사 맑은 호흡음 << Diagnosis >> (J209) 상세불명의 급성 기관지염[의증] (J040) 급성 후두염 (J068) 기타 다발부위의 급성 상기도감염 (K297) 상세불명의 위염 (J304) 상세불명의 알레르기비염[의증] << Treatment >> 엘도스캡슐(원외) 3 3 3 뮤코스텐캡슐(원외) 맥시부펜이알정300mg(원외) 3 3 3 위더스세파클러캡슐250mg(원외) 알마겔정(원외) 3 3 3 코슈엘정(내복)(원외) 삼진토브라마이신주사80mg,2mL/앰 1 1 1 내원일:\n내원일: 미확인\n내원사유: 10 쪽 333 332 332 진찰구분: 재진 이기섭의원 차트번호: 2817, 김명희 가래 많다-가슴에 가래 낌 기침 많다 콧물 많다. 누런 콧물 코막힘 목이 아픔. 두통 약간 발열(-) Clinical Chart *이학적 검사 맑은 호흡음 << Diagnosis >> (J209) 상세불명의 급성 기관지염[의증] (J040) 급성 후두염 (J068) 기타 다발부위의 급성 상기도감염 (K297) 상세불명의 위염 (J304) 상세불명의 알레르기비염[의증] << Treatment >> 엘도스캡슐(원외) 3 3 3 뮤코스텐캡슐(원외) 맥시부펜이알정300mg(원외) 3 3 3 위더스세파클러캡슐250mg(원외) 알마겔정(원외) 3 3 3 코슈엘정(내복)(원외) 삼진토브라마이신주사80mg,2mL/앰 1 1 1 내원일:\n진단명: 미확인\n특이사항: 다발부위의 급성 상기도감염 (K297) 상세불명의 위염 (J304) 상세불명의 알레르기비염[의증] << Treatment >> 엘도스캡슐(원외) 3 3 3 뮤코스텐캡슐(원외) 맥시부펜이알정300mg(원외) 3 3 3 위더스세파클러캡슐250mg(원외) 알마겔정(원외) 3 3 3 코슈엘정(내복)(원외) 삼진토브라마이신주사80mg,2mL/앰 1 1 1 내원일:\n중증도: 경미\n\n[2024.01.25] 미확인 의료기관\n내원일: 2024.01.25\n내원사유: 정기 진료\n진단명: 미확인\n중증도: 경미\n\n[미확인] Clinical Chart 차트번호: 2817, 김명희 맥시부펜이알정300mg(원외) 3 3 3 위더스세파클러캡슐250mg(원외) 알마겔정(원외) 3 삼진토브라마이신주사80mg,2mL/앰 1 31 3 코슈엘정(내복)(원외) 1 리알트리스나잘스프레이액,18mL/병(1 331 321 32 이기섭 내원일:\n내원일: 미확인\n내원사유: 가래 많다-가슴에 가래 낌 기침 많다 콧물 많다, 누런콧물 코막힘 목이 아픔. 두통 약간 발열(-) *이학적 검사 맑은 호흡음 << Diagnosis >> (J209) 상세불명의 급성 기관지염[의증] (JO40) 급성 후두염 (J0190) 재발성으로 명시되어 있지 않은 상세불명의 급성 부비동염 (K297) 상세불명의 위염 (J304) 상세불명의 알레르기비염 << Treatment >> 엘도스캡슐(원외) 333 33 33 2 2 진찰구분: 재진 3 3 3 뮤코스텐캡슐(원외) 3 3 3 11 쪽 이기섭의원 Clinical Chart 차트번호: 2817, 김명희 맥시부펜이알정300mg(원외) 3 3 3 위더스세파클러캡슐250mg(원외) 알마겔정(원외) 3 삼진토브라마이신주사80mg,2mL/앰 1 31 3 코슈엘정(내복)(원외) 1 리알트리스나잘스프레이액,18mL/병(1 331 321 32 이기섭 내원일:\n진단명: 미확인\n중증도: 경미\n\n[2024.01.27] 미확인 의료기관\n내원일: 2024.01.27\n내원사유: 정기 진료\n진단명: 미확인\n중증도: 경미\n\n[2024.04.11] 미확인 의료기관\n내원일: 2024.04.11\n내원사유: 정기 진료\n진단명: 미확인\n중증도: 경미\n\n[2024.10.14] 미확인 의료기관\n내원일: 2024.10.14\n내원사유: 정기 진료\n진단명: 미확인\n중증도: 경미\n\n[미확인] Clinical Chart 차트번호: 2817, 김명희 좌측 이마, 눈주위 멍듬 좌측 팔꿈치 통증 -어제(\n내원일: 미확인\n내원사유: 12 쪽 이기섭의원 Clinical Chart 차트번호: 2817, 김명희 좌측 이마, 눈주위 멍듬 좌측 팔꿈치 통증 -어제(\n진단명: 미확인\n중증도: 경미\n\n[2024.11.14] 미확인 의료기관\n내원일: 2024.11.14\n내원사유: 정기 진료\n진단명: 미확인\n중증도: 경미\n\n[2025.01.21] 미확인 의료기관\n내원일: 2025.01.21\n내원사유: 정기 진료\n진단명: 미확인\n중증도: 경미\n\n[2025.01.22] 미확인 의료기관\n내원일: 2025.01.22\n내원사유: 정기 진료\n진단명: 미확인\n중증도: 경미\n\n[2025.01.31] 미확인 의료기관\n내원일: 2025.01.31\n내원사유: 정기 진료\n진단명: 미확인\n중증도: 경미\n\n[2025.02.17] 미확인 의료기관\n내원일: 2025.02.17\n내원사유: 정기 진료\n진단명: 미확인\n중증도: 경미\n\n[미확인] ·가정의학과 전문의 주소:양천구 신월3동 194-26. 14:695-0660, 2007-7174 요약지정번호:\n내원일: 미확인\n내원사유: 양천구 신월3동 194-26. 14:695-0660, 2007-7174 요약지정번호:\n진단명: 미확인\n중증도: 경미\n\n■ 입원 기록 (Hospitalization Records)\nNaN\n[미확인] 가정의학과 전문의.. 주소:양천구 신월3동 194-26 전화:605-8983,\n내원일: 미확인\n내원사유: 양천구 신월3동 194-26 전화:605-8983,\n진단명: 미확인\n입원기간: undefined ~ undefined\n\n[미확인] 미확인 의료기관\n내원일: 미확인\n내원사유: 응급실 내원\n진단명: 서 입퇴원 확인서 작성 삼성화재 작성자: 한정훈 이 하 여 배 외래기록지 한림대학교강남성심병원\n입원기간: undefined ~ undefined\n\n[미확인] 미확인 의료기관\n내원일: 미확인\n내원사유: 증상(C.C) 두통, 어지럼증 입원사유 및 현병력(PI) 2025.01부터 일어날때 어지럽고 옆쪽머리가 찢어지는 것처럼 아파서 내원함. 입원경과 및 치료과정 요약 2025.01부터 일어날때 어지럽고 옆쪽머리가 찢어지는 것처럼 아파서 내원하여 정밀 검사상 뇌혈 관질환 진단하에 약물 주사치료하고 증상개선되어 퇴원 검사소견 ?\n진단명: ] 주진단 Other specified cerebrovascular diseases [입원 경과] 주호소 증상(C.C) 두통, 어지럼증 입원사유 및 현병력(PI) 2025.01부터 일어날때 어지럽고 옆쪽머리가 찢어지는 것처럼 아파서 내원함. 입원경과 및 치료과정 요약 2025.01부터 일어날때 어지럽고 옆쪽머리가 찢어지는 것처럼 아파서 내원하여 정밀 검사상 뇌혈 관질환 진단하에 약물 주사치료하고 증상개선되어 퇴원 검사소견 ?\n입원기간: undefined ~ undefined\n특이사항: ?\n\n[미확인] 퇴원요약지\n내원일: 미확인\n내원사유: 응급실 내원\n진단명: 미확인\n입원기간: undefined ~ undefined\n\n[미확인] 미확인 의료기관\n내원일: 미확인\n내원사유: 응급실 내원\n진단명: 미확인\n입원기간: undefined ~ undefined\n\n[미확인] 퇴원요약지 등록번호:\n내원일: 미확인\n내원사유: 응급실 내원\n진단명: 미확인\n입원기간: undefined ~ undefined\n\n[미확인] 입원기록지(초기평가)\n내원일: 미확인\n내원사유: 응급실 내원\n진단명: 미확인\n입원기간: undefined ~ undefined\n\n[미확인] 미확인 의료기관\n내원일: 미확인\n내원사유: 응급실 내원\n진단명: 미확인\n입원기간: undefined ~ undefined\n\n[미확인] 입원기록지(초기평가) 등성 등록번호:\n내원일: 미확인\n내원사유: 응급실 내원\n진단명: 미확인\n입원기간: undefined ~ undefined\n\n[미확인] 미확인 의료기관\n내원일: 미확인\n내원사유: 응급실 내원\n진단명: 미확인\n입원기간: undefined ~ undefined\n\n[미확인] 미확인 의료기관\n내원일: 미확인\n내원사유: 응급실 내원\n진단명: 미확인\n입원기간: undefined ~ undefined\n\n[미확인] 내 시설안내] V 휴게실 기타 은행 V 편의점 V 식당 V 인터넷 【화재방지 및 비상시 안내】 V 전열기구 사용금지 V 비상구 V 소화전 V 소화기 위치안내 V 가스 [개인용품] V 보청기 좌(V무유), 우( 자가혈당조절기 V 무 인공심장박동기 【감염관리안내] V 틀니 상(V무 유), 하(V무 유) √ 꽃, 화분 반입 제한 √ 어린이(만13세 미만) 면회제한 손위생 기침예절 [기타] √ 귀중품 관리 및 도난방지 V 낙상방지 V 보호자 면회 및 식사시간 V 진단서발급 V 사회복지서비스 안내 V 환자권리 안내 V 위해도구 반입금지 (칼, 가위, 라이터, 끈 등) V 분리수거 V 주차관리 √ 린넨관리 V 회진시간 고충처리 상담안내 V 금연 V 소등시간 V 종교활동 제한 V 사생활 보호 V 기타 1. 환자안전을 위해 무단외출 및 침대바퀴고정, 병실내 자리이동을 금지함. 2. 린넨관리, 진단서 발급,소등시간, 사회복지서비스 안내, 사식(음식점배달)반입을 금지함 3. 정수기, 탕비실, 화장실 비상벨 위치 교육함. 4. 화재교 육 실시함- 소화기, 소화전 위치와 비상시 양쪽 복도 끝 계단과 간호사실 앞 중앙계단 이용 및 대피도설명 함 5. 진단서등 퇴원시 필요한 서류는 퇴원 전날 신청 설명함 6. 상주보호자 1인을 제외한 방문객의 면회는 금 지. 7. 불만 및 고충접수방법(권리와 의무)교육함. 8. 필요시 마스크 착용 작성일 :\n내원일: 미확인\n내원사유: 응급실 내원\n진단명: 서발급 V 사회복지서비스 안내 V 환자권리 안내 V 위해도구 반입금지 (칼, 가위, 라이터, 끈 등) V 분리수거 V 주차관리 √ 린넨관리 V 회진시간 고충처리 상담안내 V 금연 V 소등시간 V 종교활동 제한 V 사생활 보호 V 기타 1. 환자안전을 위해 무단외출 및 침대바퀴고정, 병실내 자리이동을 금지함. 2. 린넨관리, 진단서 발급,소등시간, 사회복지서비스 안내, 사식(음식점배달)반입을 금지함 3. 정수기, 탕비실, 화장실 비상벨 위치 교육함. 4. 화재교 육 실시함- 소화기, 소화전 위치와 비상시 양쪽 복도 끝 계단과 간호사실 앞 중앙계단 이용 및 대피도설명 함 5. 진단서등 퇴원시 필요한 서류는 퇴원 전날 신청 설명함 6. 상주보호자 1인을 제외한 방문객의 면회는 금 지. 7. 불만 및 고충접수방법(권리와 의무)교육함. 8. 필요시 마스크 착용 작성일 :\n입원기간: undefined ~ undefined\n특이사항: [병실 및 병동내 시설안내] V 물통 물컵 V 실내화 V 휴지 간호정보조사지(성인) V 침대, 식탁 √ 침상등 V 전자렌지 V 냉장고 V 정수기 √ 간호사호출기 [V 세탁물보관실 V 화장실 V 샤워실 [V 화장실호출기 V 오물처리실 V 다용도실 V 휴게실 [병원내 시설안내] V 휴게실 기타 은행 V 편의점 V 식당 V 인터넷 【화재방지 및 비상시 안내】 V 전열기구 사용금지 V 비상구 V 소화전 V 소화기 위치안내 V 가스 [개인용품] V 보청기 좌(V무유), 우( 자가혈당조절기 V 무 인공심장박동기 【감염관리안내] V 틀니 상(V무 유), 하(V무 유) √ 꽃, 화분 반입 제한 √ 어린이(만13세 미만) 면회제한 손위생 기침예절 [기타] √ 귀중품 관리 및 도난방지 V 낙상방지 V 보호자 면회 및 식사시간 V 진단서발급 V 사회복지서비스 안내 V 환자권리 안내 V 위해도구 반입금지 (칼, 가위, 라이터, 끈 등) V 분리수거 V 주차관리 √ 린넨관리 V 회진시간 고충처리 상담안내 V 금연 V 소등시간 V 종교활동 제한 V 사생활 보호 V 기타 1. 환자안전을 위해 무단외출 및 침대바퀴고정, 병실내 자리이동을 금지함. 2. 린넨관리, 진단서 발급,소등시간, 사회복지서비스 안내, 사식(음식점배달)반입을 금지함 3. 정수기, 탕비실, 화장실 비상벨 위치 교육함. 4. 화재교 육 실시함- 소화기, 소화전 위치와 비상시 양쪽 복도 끝 계단과 간호사실 앞 중앙계단 이용 및 대피도설명 함 5. 진단서등 퇴원시 필요한 서류는 퇴원 전날 신청 설명함 6. 상주보호자 1인을 제외한 방문객의 면회는 금 지. 7. 불만 및 고충접수방법(권리와 의무)교육함. 8. 필요시 마스크 착용 작성일 :\n\n[미확인] &약국 예성약국 진단과 일반의 입원/외래 외래 주상병코드 AE1178 주상병명 (양방)기타 다발성 합병증을 동반한 빈경환 TOOO 외래 코드 일수(건강보험 적용분) 혜택받은 금액| (진료비) (양방)기 타다발성 1\n내원일: 미확인\n내원사유: 응급실 내원\n진단명: 과 일반의 입원/외래 외래 주상병코드 AE1178 주상병명 (양방)기타 다발성 합병증을 동반한 빈경환 TOOO 외래 코드 일수(건강보험 적용분) 혜택받은 금액| (진료비) (양방)기 타다발성 1\n입원기간: undefined ~ undefined\n특이사항: 다발성 합병증을 동반한 빈경환 TOOO 외래 코드 일수(건강보험 적용분) 혜택받은 금액| (진료비) (양방)기 타다발성 1\n\n■ 보험 청구 이력 (Insurance Claims)\nNaN\n[미확인] 미확인 보험사\n청구일: 미확인\n진단명: 미확인\n지급일: 미확인\n상태: 처리 중\n특이사항: 가 아닌 증빙자료로 사용할 수 없으며, 이용에 관한 책임은 이용자에게 있습니다. 1/9 빈경환\n\n[미확인] 미확인 보험사\n청구일: 미확인\n진단명: 미확인\n지급일: 미확인\n상태: 처리 중\n특이사항: 가 아닌 증빙자료로 사용할 수 없으며, 이용에 관한 책임은 이용자에게 있습니다. 2/9\n\n[미확인] 미확인 보험사\n청구일: 미확인\n진단명: 미확인\n지급일: 미확인\n상태: 처리 중\n특이사항: 가 아닌 증빙자료로 사용할 수 없으며, 이용에 관한 책임은 이용자에게 있습니다. 3/9 빈경환\n\n[미확인] 미확인 보험사\n청구일: 미확인\n진단명: 미확인\n지급일: 미확인\n상태: 처리 중\n특이사항: 가 아닌 증빙자료로 사용할 수 없으며, 이용에 관한 책임은 이용자에게 있습니다. 4/9 빈경환\n\n[미확인] 미확인 보험사\n청구일: 미확인\n진단명: 미확인\n지급일: 미확인\n상태: 처리 중\n특이사항: 가 아닌 증빙자료로 사용할 수 없으며, 이용에 관한 책임은 이용자에게 있습니다. 5/9 빈경환\n\n[미확인] 미확인 보험사\n청구일: 미확인\n진단명: 미확인\n지급일: 미확인\n상태: 처리 중\n특이사항: 가 아닌 증빙자료로 사용할 수 없으며, 이용에 관한 책임은 이용자에게 있습니다. 6/9 빈경환\n\n[미확인] 미확인 보험사\n청구일: 미확인\n진단명: 미확인\n지급일: 미확인\n상태: 처리 중\n특이사항: 가 아닌 증빙자료로 사용할 수 없으며, 이용에 관한 책임은 이용자에게 있습니다. 7/9 빈경환\n\n[미확인] 미확인 보험사\n청구일: 미확인\n진단명: 미확인\n지급일: 미확인\n상태: 처리 중\n특이사항: 가 아닌 증빙자료로 사용할 수 없으며, 이용에 관한 책임은 이용자에게 있습니다. 8/9 빈경환 LIㄱㄹ ㅇㄱㄱㄱ TOOO 외래 코드 일수(건강보험 적용분) 혜택받은 금액| (진료비) 89\n\n[미확인] 미확인 보험사\n청구일: 미확인\n진단명: 미확인\n지급일: 미확인\n상태: 처리 중\n특이사항: 가 아닌 증빙자료로 사용할 수 없으며, 이용에 관한 책임은 이용자에게 있습니다. 9/9 빈경환 ========== 파일: i?´e¸°i?­i??i??.pdf ==========\n\n■ 종합 소견 (Summary)\nNaN\n총 진료 기록: 121건\n진료 기간: 미확인 ~ 미확인\n주요 진단명: 서 입퇴원 확인서 작성 삼성화재 작성자: 한정훈 이 하 여 배 외래기록지 한림대학교강남성심병원, ] 주진단 Other specified cerebrovascular diseases [입원 경과] 주호소 증상(C.C) 두통, 어지럼증 입원사유 및 현병력(PI) 2025.01부터 일어날때 어지럽고 옆쪽머리가 찢어지는 것처럼 아파서 내원함. 입원경과 및 치료과정 요약 2025.01부터 일어날때 어지럽고 옆쪽머리가 찢어지는 것처럼 아파서 내원하여 정밀 검사상 뇌혈 관질환 진단하에 약물 주사치료하고 증상개선되어 퇴원 검사소견 ?, 서발급 V 사회복지서비스 안내 V 환자권리 안내 V 위해도구 반입금지 (칼, 가위, 라이터, 끈 등) V 분리수거 V 주차관리 √ 린넨관리 V 회진시간 고충처리 상담안내 V 금연 V 소등시간 V 종교활동 제한 V 사생활 보호 V 기타 1. 환자안전을 위해 무단외출 및 침대바퀴고정, 병실내 자리이동을 금지함. 2. 린넨관리, 진단서 발급,소등시간, 사회복지서비스 안내, 사식(음식점배달)반입을 금지함 3. 정수기, 탕비실, 화장실 비상벨 위치 교육함. 4. 화재교 육 실시함- 소화기, 소화전 위치와 비상시 양쪽 복도 끝 계단과 간호사실 앞 중앙계단 이용 및 대피도설명 함 5. 진단서등 퇴원시 필요한 서류는 퇴원 전날 신청 설명함 6. 상주보호자 1인을 제외한 방문객의 면회는 금 지. 7. 불만 및 고충접수방법(권리와 의무)교육함. 8. 필요시 마스크 착용 작성일 :, 과 일반의 입원/외래 외래 주상병코드 AE1178 주상병명 (양방)기타 다발성 합병증을 동반한 빈경환 TOOO 외래 코드 일수(건강보험 적용분) 혜택받은 금액| (진료비) (양방)기 타다발성 1\n주요 소견:\n  - 총 13회 입원 이력\n  - 총 9건 보험 청구 이력\n\nNaN\n보고서 생성 완료 - 2025. 8. 17. 오후 10:28:27\nNaN",
    "reportMetadata": {
      "generatedAt": "2025-08-17T13:28:27.699Z",
      "format": "text",
      "totalSections": 10,
      "recordCount": 136
    },
    "statistics": {
      "originalLength": 40502,
      "processedLength": 36961,
      "recordsFound": 122,
      "insuranceCount": 3,
      "timelineEvents": 122
    },
    "processingTime": 1755437307699
  }
}