{
  "caseNumber": 2,
  "success": true,
  "processingTime": 30,
  "statistics": {
    "originalLength": 22902,
    "processedLength": 21459,
    "recordsFound": 52,
    "insuranceCount": 1,
    "timelineEvents": 52
  },
  "analysis": {
    "dataExtracted": {
      "patientInfo": true,
      "insuranceInfo": true,
      "medicalRecords": true,
      "hospitalizationRecords": true
    },
    "recordCounts": {
      "medical": 41,
      "hospitalization": 3,
      "insurance": 1
    },
    "qualityMetrics": {
      "completeness": 1,
      "consistency": 0.5,
      "accuracy": 0
    }
  },
  "normalizedData": {
    "header": {
      "patientName": "김미화",
      "birthDate": "yyyy-mm-dd",
      "registrationNumber": "533-87-85-4"
    },
    "insuranceConditions": [
      {
        "conditionNumber": 1,
        "company": "제출 발급매수: 20매 삼성서울병원 첨부한 사본은 의무기록 원본과 틀림이 없음을 증명합니다. 2025 년 03 월 21 일 담당자 삼성서울병원장 ※담당자의 날인이 없는 것은 무효임 전효안 +541331041 서울특별시 강남구 일원로81 (06351) 삼성서울병원 / 대표전화 1599-3114 의무기록사본증명서 진료의뢰서 53387854 김미화 871026-2****** F CDXI FRAMHETERO"
      }
    ],
    "insuranceHistory": [
      {
        "period": "[보험 가입 3개월 이내]",
        "company": "제출 발급매수: 20매 삼성서울병원 첨부한 사본은 의무기록 원본과 틀림이 없음을 증명합니다. 2025 년 03 월 21 일 담당자 삼성서울병원장 ※담당자의 날인이 없는 것은 무효임 전효안 +541331041 서울특별시 강남구 일원로81 (06351) 삼성서울병원 / 대표전화 1599-3114 의무기록사본증명서 진료의뢰서 53387854 김미화 871026-2****** F CDXI FRAMHETERO"
      }
    ],
    "medicalRecords": [
      {
        "date": "",
        "hospital": "의무기록사본 총 1부 (표지제외) 빈경환 SMMC SAMSUNG MEDICAL CENTER 의무기록사본증명서 발행번호: 25-053929 신청번호 :",
        "reason": "정기 진료",
        "diagnosis": "미확인",
        "notes": ""
      },
      {
        "date": "",
        "hospital": "첨부한 사본은 의무기록 원본과 틀림이 없음을 증명합니다. 2025 년 03 월 21 일 담당자 삼성서울병원장 ※담당자의 날인이 없는 것은 무효임 전효안 +",
        "reason": "정기 진료",
        "diagnosis": "미확인",
        "notes": ""
      },
      {
        "date": "",
        "hospital": "/ 대표전화 1599-3114 의무기록사본증명서 진료의뢰서",
        "reason": "정기 진료",
        "diagnosis": "미확인",
        "notes": ""
      },
      {
        "date": "2024-04-03",
        "hospital": "미확인 의료기관",
        "visitDate": "2024-04-03",
        "reason": "정기 진료",
        "diagnosis": "미확인",
        "notes": ""
      },
      {
        "date": "2024-04-03",
        "hospital": "미확인 의료기관",
        "visitDate": "2024-04-03",
        "reason": "정기 진료",
        "diagnosis": "미확인",
        "notes": ""
      },
      {
        "date": "2024-04-03",
        "hospital": "미확인 의료기관",
        "visitDate": "2024-04-03",
        "reason": "및 명칭 : 서울특별시 관악구 관악로 1 서울대학교 63동 3층 전화 및 팩스: (Tel)02-880-5338, (Fax)02-871-5452 면허번호: 제 109528 호 의사성명: 양예슬 예술 (주) 1. 동진료의뢰서는 1차진료후 2차진료를 받고자 하는경우 1차진료담당의사로 부터 요양급여기준에 따라 우선으로 교부됩니다. 2. 의사의 발급일로부터 7일(공휴일제외)이내에 사용해야 합니다. 3. 환자상태 및 진료소견에는 투약, 주요실시검사등 주요진료내용을 간략하게 포함하여 기재하기 바라며 여백부족시에는 뒷면을 활용하기 바랍니다. 등록번호: 성 5",
        "diagnosis": "미확인",
        "prescription": ", 주요실시검사등 주요진료내용을 간략하게 포함하여 기재하기 바라며 여백부족시에는 뒷면을 활용하기 바랍니다. 등록번호: 성 5",
        "notes": "에는 투약, 주요실시검사등 주요진료내용을 간략하게 포함하여 기재하기 바라며 여백부족시에는 뒷면을 활용하기 바랍니다. 등록번호: 성 5"
      },
      {
        "date": "",
        "hospital": "미확인 의료기관",
        "reason": "*주증상 간종괴 2017년 간혈관종 4.5cm 진단됨 이후 매년 크기 증가하여 2023.8. 8x6cm 으로 자람 계통문진 특이사항 없음 신체검진 n.s. ■ 통증평가 통증 : 무 진단명 Hemangioma of liver 간혈관종, 크기 증가 진료계획 *치료계획 협진의뢰 : 외과 밑그림 및 이미지 초진기록 SMC SAMSUNG MEDICAL CENTER 작성의사: 곽금연 <이하여백>> 1/1 원본대조필",
        "diagnosis": "됨 이후 매년 크기 증가하여 2023.8. 8x6cm 으로 자람 계통문진 특이사항 없음 신체검진 n.s. ■ 통증평가 통증 : 무 진단명 Hemangioma of liver 간혈관종, 크기 증가 진료계획 *치료계획 협진의뢰 : 외과 밑그림 및 이미지 초진기록 SMC SAMSUNG MEDICAL CENTER 작성의사: 곽금연 <이하여백>> 1/1 원본대조필",
        "notes": "없음 신체검진 n.s. ■ 통증평가 통증 : 무 진단명 Hemangioma of liver 간혈관종, 크기 증가 진료계획 *치료계획 협진의뢰 : 외과 밑그림 및 이미지 초진기록 SMC SAMSUNG MEDICAL CENTER 작성의사: 곽금연 <이하여백>> 1/1 원본대조필"
      },
      {
        "date": "",
        "hospital": "(207878) Liver right hemihepatectomy . Cavernous hemangioma. S5 and 6: 1) size: 8.1x5x4.1 cm 2) negative resection margin (safety margin: 3.5 cm) Background liver: no significant pathological alteration Gallbladder. cholecystectomy: No significant pathological alteration 진단명 Hemangioma of liver",
        "reason": "정기 진료",
        "diagnosis": "Hemangioma of liver",
        "notes": ""
      },
      {
        "date": "",
        "hospital": "3/3 원본대조필",
        "reason": "정기 진료",
        "diagnosis": "계획 Liver CT *치료계획 OPD F/U: 2개월 후 재진기록 SMMC SAMSUNG MEDICAL CENTER 작성의사: 김종만 <이하여백> 삼성서울병원 3/3 원본대조필",
        "notes": ""
      },
      {
        "date": "",
        "hospital": "미확인 의료기관",
        "reason": "정기 진료",
        "diagnosis": "1. Increased size of hepatic hemangioma in right liver. 1/4 원본대조필",
        "notes": ""
      },
      {
        "date": "",
        "hospital": "등록번호: 성 5",
        "reason": "정기 진료",
        "diagnosis": "미확인",
        "notes": ""
      },
      {
        "date": "",
        "hospital": "미확인 의료기관",
        "reason": "정기 진료",
        "diagnosis": "1. Increased size of hepatic hemangioma in right liver. 2. Possible new hemangioma in S3/4. 문제목록 Increased size of hepatic hemangioma in right liver 진단명 Hemangioma of liver 진료계획 1/2 원본대조필",
        "notes": ""
      },
      {
        "date": "",
        "hospital": "미확인 의료기관",
        "reason": "정기 진료",
        "diagnosis": "(A) Hemangioma of liver <[수L-RH] Hemangioma of liver in Rt. lobe. 8.7cm> 진료계획 (P) conservative management. 경과기록 SMC SAMSUNG MEDICAL CENTER 작성의사: 홍지윤",
        "notes": "(S) sputum (+) 객관적 소견 (0) 일주일전에 influenza (+) 타미플루 치료 완료. 진단명 (A) Hemangioma of liver <[수L-RH] Hemangioma of liver in Rt. lobe. 8.7cm> 진료계획 (P) conservative management. 경과기록 SMC SAMSUNG MEDICAL CENTER 작성의사: 홍지윤"
      },
      {
        "date": "",
        "hospital": "진료계획 현재 치료 유지 POD 4 JP removed. 경과기록 SMC SAMSUNG MEDICAL CENTER 작성의사: 홍지윤 <이하여백> 2/2 원본대조필",
        "reason": "정기 진료",
        "diagnosis": "미확인",
        "notes": ""
      },
      {
        "date": "",
        "hospital": "3/3",
        "reason": "정기 진료",
        "diagnosis": "미확인",
        "notes": ""
      },
      {
        "date": "",
        "hospital": "1 / 2",
        "reason": "정기 진료",
        "diagnosis": "(207878) Liver, right hemihepatectomy Cavernous hemangioma, S5 and 6; 1) size: 8.1x5x4.1 cm 2) negative resection margin (safety margin: 3.5 cm) Background liver: no significant pathological alteration Gallbladder. cholecystectomy: No significant pathological alteration 【GROSS DESCRIPTION 】 (298059) 육안담당의: 장기택 PA: 배문환 (1) Type of operation: right hemihepatectomy (2) Resected organs: liver (17x9x8.5 cm), gallbladder (8x4.5 m) (3) Hemangioma Number of hemangioma: 1 Location: S5 and 6 Size: 8.1x5x4.1 cm Serosa invasion: no (distance from hepatic capsule: 0.1 cm) Invasion into adjacent organ or structure: no Resection margin involvement: no (distance from hepatic resection margin: 3.5 cm) (4) Background liver: unremarkable (5) Gallbladder: unremarkable Slide key A-H: MASS, ONE PLANE I-L: MASS, SERIAL SECTION M-N: BACKGROUND LIVER 0: GALLBLADDER 삼성서울병원 1 / 2",
        "notes": ""
      },
      {
        "date": "",
        "hospital": "2/2",
        "reason": "정기 진료",
        "diagnosis": "미확인",
        "notes": "SMC SAMSUNG MEDICAL CENTER 삼성서울병원 2/2"
      },
      {
        "date": "",
        "hospital": "미확인 의료기관",
        "reason": "정기 진료",
        "diagnosis": "미확인",
        "prescription": "일】",
        "notes": "SMC SAMSUNG MEDICAL CENTER 【검사명】 ROP (ABDOMEN & PELVIS CT, OTHERS) [RC3122RO 【구분] 외래 【처방일】"
      },
      {
        "date": "",
        "hospital": "미확인 의료기관",
        "reason": "정기 진료",
        "diagnosis": "Giant hepatic hemangioma in right lobe. 【검사명】 LIVER AND PELVIS CT (POST-CONTRAST) [RC20301] 【구분】 외래 【처방일】",
        "icdCode": "C20",
        "prescription": "일】",
        "notes": "보이지 않음. 커진 lymph node나 peritoneal nodule 보이지 않음. Left kidney에 수 mm 크기의 cyst가 보임. 결론 및 진단 Giant hepatic hemangioma in right lobe. 【검사명】 LIVER AND PELVIS CT (POST-CONTRAST) [RC20301] 【구분】 외래 【처방일】"
      },
      {
        "date": "",
        "hospital": "1 / 1",
        "reason": "정기 진료",
        "diagnosis": "1. Increased size of hepatic hemangioma in right liver. 2. Possible new hemangioma in S3/4. 삼성서울병원 1 / 1",
        "notes": ""
      },
      {
        "date": "",
        "hospital": "미확인 의료기관",
        "reason": "정기 진료",
        "diagnosis": "미확인",
        "prescription": "내역:",
        "notes": ""
      },
      {
        "date": "",
        "hospital": "미확인 의료기관",
        "reason": "정기 진료",
        "diagnosis": "미확인",
        "prescription": "명 1회투 횟수 1일 총 날수 경로 용법/검체 상태 시행자 비고 -[R2] 이창수 외래 방사선 Abdomen Angiography. Phase 3 Dynamic syudyCT 1 1 08 완료 방사선옴니엑솔주 350(이오헥술)500ml 방사선 elaban 0.26 1 08 T 1 08 [경과기록:",
        "notes": "-[R2] 이창수 외래 방사선 Abdomen Angiography. Phase 3 Dynamic syudyCT 1 1 08 완료 방사선옴니엑솔주 350(이오헥술)500ml 방사선 elaban 0.26 1 08 T 1 08 [경과기록:"
      },
      {
        "date": "",
        "hospital": "Page 1 by Dr. 이창수 빈경환",
        "reason": "정기 진료",
        "diagnosis": "미확인",
        "notes": ""
      },
      {
        "date": "",
        "hospital": "미확인 의료기관",
        "reason": "정기 진료",
        "diagnosis": "미확인",
        "prescription": "내역:",
        "notes": ""
      },
      {
        "date": "",
        "hospital": "미확인 의료기관",
        "reason": "정기 진료",
        "diagnosis": "미확인",
        "prescription": "명 1회투 횟수 1일 총 날수 경로 용법/경제 상태 시행자 비고 - [R2] 이창수 외래 방사선 FULL PACS (특수영상) 방사선 Abdomen CT Dynamic 1 1 08 1 1 08 완료 방사선옴니엑술주 350 (이오엑술) 500ml 방사선elabam 0.24 1 08 1 1 08 [경과기록:",
        "notes": "- [R2] 이창수 외래 방사선 FULL PACS (특수영상) 방사선 Abdomen CT Dynamic 1 1 08 1 1 08 완료 방사선옴니엑술주 350 (이오엑술) 500ml 방사선elabam 0.24 1 08 1 1 08 [경과기록:"
      },
      {
        "date": "",
        "hospital": "Page 1 by Di. 이창수 빈경환",
        "reason": "정기 진료",
        "diagnosis": "미확인",
        "notes": ""
      },
      {
        "date": "",
        "hospital": "Page 1 by Dr. 박순창 빈경환",
        "reason": "정기 진료",
        "diagnosis": "미확인",
        "notes": ""
      },
      {
        "date": "",
        "hospital": "미확인 의료기관",
        "reason": "정기 진료",
        "diagnosis": "미확인",
        "prescription": "내역:",
        "notes": ""
      },
      {
        "date": "",
        "hospital": "미확인 의료기관",
        "reason": "정기 진료",
        "diagnosis": "미확인",
        "prescription": "영 1회투 횟수 1일 총 날수 경로 용법/검체 상태 시행자 비고 -[R2] 이창수 외래 방사선 FULL PACS (특수영상) 방사선옴니헥솔주 350(이오엑술)500ml 방사선 elaban 방사선 Abdomen CT Dynamic 【경과기록:",
        "notes": "-[R2] 이창수 외래 방사선 FULL PACS (특수영상) 방사선옴니헥솔주 350(이오엑술)500ml 방사선 elaban 방사선 Abdomen CT Dynamic 【경과기록:"
      },
      {
        "date": "",
        "hospital": "Page 1 by Di. 이창수 빈경환",
        "reason": "정기 진료",
        "diagnosis": "미확인",
        "notes": ""
      },
      {
        "date": "",
        "hospital": "미확인 의료기관",
        "reason": "정기 진료",
        "diagnosis": "미확인",
        "prescription": "내역:",
        "notes": "사항 2022 07 19 01802 간담도계의 혈관종 [처방내역:"
      },
      {
        "date": "",
        "hospital": "미확인 의료기관",
        "reason": "정기 진료",
        "diagnosis": "미확인",
        "prescription": "영 1회투 횟수 1일 총 날수 경로 용법/검체 상태 시행자 비고 -[81] 박원규 외래 방사선 FULL PACS (특수영상) 방사선 Abdomen CT Dynamic 1 1 08 1 1 08 완료 방사선옴! 엑솔주 350(이오엑술)500ml 방사선 elaban 0.24 1 08 1 1 08 방사선 Nature Ct (Filter3) 1 1 08 【경과기록:",
        "notes": "-[81] 박원규 외래 방사선 FULL PACS (특수영상) 방사선 Abdomen CT Dynamic 1 1 08 1 1 08 완료 방사선옴! 엑솔주 350(이오엑술)500ml 방사선 elaban 0.24 1 08 1 1 08 방사선 Nature Ct (Filter3) 1 1 08 【경과기록:"
      },
      {
        "date": "",
        "hospital": "Page 1 by Dr. 박원규 빈경환",
        "reason": "정기 진료",
        "diagnosis": "미확인",
        "notes": ""
      },
      {
        "date": "",
        "hospital": "미확인 의료기관",
        "reason": "정기 진료",
        "diagnosis": "미확인",
        "prescription": "내역:",
        "notes": "및 상세불명의 난소낭 【처방내역:"
      },
      {
        "date": "",
        "hospital": "미확인 의료기관",
        "reason": "정기 진료",
        "diagnosis": "미확인",
        "prescription": "명 1회 투 횟수 1일 총 날수 경로 용법/검체 상태 시행자 비고 - [R1] 박원규 외래 검 사신장기능검사 2종 (BUN/Cre) 방사선 FULL PACS (특수영상) 1 1 완료 1 1 08 방사선 Abdomen CI Dynamic 1 1 방사선옴니헥술주 350(이오헥술)500ml 방사선 elaban 0.24 1 08 1 1 08 방사선 Nature Ct (Filter3) 1 1 08 23388 08 완료 과처방 CD 1 1 【경과기록:",
        "notes": "- [R1] 박원규 외래 검 사신장기능검사 2종 (BUN/Cre) 방사선 FULL PACS (특수영상) 1 1 완료 1 1 08 방사선 Abdomen CI Dynamic 1 1 방사선옴니헥술주 350(이오헥술)500ml 방사선 elaban 0.24 1 08 1 1 08 방사선 Nature Ct (Filter3) 1 1 08 23388 08 완료 과처방 CD 1 1 【경과기록:"
      },
      {
        "date": "",
        "hospital": "Page 1 by Dr. 박원규 빈경환",
        "reason": "정기 진료",
        "diagnosis": "미확인",
        "notes": ""
      },
      {
        "date": "",
        "hospital": "Tel. 053-420-1100 Fax. 053-420-1101 E-mail. office@smradiology.com",
        "reason": "정기 진료",
        "diagnosis": "미확인",
        "notes": ""
      },
      {
        "date": "",
        "hospital": "Tel. 053-420-1100 Fax. 053-420-1101 E-mail. office@smradiology.com 에스엠영상의학과 SM RADIOLOGY CLINIC",
        "reason": "정기 진료",
        "diagnosis": "미확인",
        "notes": ""
      },
      {
        "date": "",
        "hospital": "Tel. 053-420-1100 Fax. 053-420-1101 E-mail, office@smradiology.com",
        "reason": "정기 진료",
        "diagnosis": "미확인",
        "notes": ""
      },
      {
        "date": "2021-07-09",
        "hospital": "Tel. 053-420-1100 Fax. 053-420-1101 E-mail. office@sriradiology.com",
        "visitDate": "2021-07-09",
        "reason": "정기 진료",
        "diagnosis": "미확인",
        "notes": ""
      },
      {
        "date": "2022-07-19",
        "hospital": "Tel. 053-420-1100 Fax. 053-420-1101 E-mail. office@smr adiology.com",
        "visitDate": "2022-07-19",
        "reason": "정기 진료",
        "diagnosis": "미확인",
        "notes": ""
      }
    ],
    "hospitalizationRecords": [
      {
        "date": "",
        "hospital": "*진단계획 preop risk evaluation *치료계획 L-RH *퇴원계획 (퇴원계획일 :",
        "reason": "응급실 내원",
        "diagnosis": "계획 preop risk evaluation *치료계획 L-RH *퇴원계획 (퇴원계획일 :",
        "admissionPeriod": "undefined ~ undefined",
        "surgeryInfo": null,
        "notes": ""
      },
      {
        "date": "",
        "hospital": "간호정보조사지 SIMC SAMSUNG MEDICAL CENTER 2/3",
        "reason": "응급실 내원",
        "diagnosis": "미확인",
        "admissionPeriod": "undefined ~ undefined",
        "surgeryInfo": null,
        "notes": ""
      },
      {
        "date": "",
        "hospital": "미확인 의료기관",
        "reason": "응급실 내원",
        "diagnosis": "미확인",
        "admissionPeriod": "undefined ~ undefined",
        "surgeryInfo": null,
        "notes": "SMC SAMSUNG MEDICAL CENTER 【검사명】 절제조직(양성종양성) 블록 10개이상 Level C추가코드 [BP1A2031] 【구분] 입원 【처방일】"
      }
    ],
    "insuranceClaims": []
  },
  "progressReport": "NaN\n의료 경과보고서\nMedical Progress Report\n생성일: 2025.10.19\nNaN\n\n■ 환자 정보 (Patient Information)\nNaN\n환자명: 김미화\n생년월일: 미확인 (만 미확인세)\n등록번호: 533-87-85-4\n\n■ 보험 가입 조건 (Insurance Conditions)\nNaN\n1. 제출 발급매수: 20매 삼성서울병원 첨부한 사본은 의무기록 원본과 틀림이 없음을 증명합니다. 2025 년 03 월 21 일 담당자 삼성서울병원장 ※담당자의 날인이 없는 것은 무효임 전효안 +541331041 서울특별시 강남구 일원로81 (06351) 삼성서울병원 / 대표전화 1599-3114 의무기록사본증명서 진료의뢰서 53387854 김미화 871026-2****** F CDXI FRAMHETERO\n   가입일: 미확인\n   상품명: 미확인 상품\n   담보내용: 미확인 담보\n   상태: 유효\n\n■ 보험 가입 이력 (Insurance History)\nNaN\n[보험 가입 3개월 이내]\n미확인 제출 발급매수: 20매 삼성서울병원 첨부한 사본은 의무기록 원본과 틀림이 없음을 증명합니다. 2025 년 03 월 21 일 담당자 삼성서울병원장 ※담당자의 날인이 없는 것은 무효임 전효안 +541331041 서울특별시 강남구 일원로81 (06351) 삼성서울병원 / 대표전화 1599-3114 의무기록사본증명서 진료의뢰서 53387854 김미화 871026-2****** F CDXI FRAMHETERO 가입 (미확인)\n\n■ 진료 기록 (Medical Records)\nNaN\n[미확인] 의무기록사본 총 1부 (표지제외) 빈경환 SMMC SAMSUNG MEDICAL CENTER 의무기록사본증명서 발행번호: 25-053929 신청번호 :\n내원일: 미확인\n내원사유: 정기 진료\n진단명: 미확인\n중증도: 경미\n\n[미확인] 첨부한 사본은 의무기록 원본과 틀림이 없음을 증명합니다. 2025 년 03 월 21 일 담당자 삼성서울병원장 ※담당자의 날인이 없는 것은 무효임 전효안 +\n내원일: 미확인\n내원사유: 정기 진료\n진단명: 미확인\n중증도: 경미\n\n[미확인] / 대표전화 1599-3114 의무기록사본증명서 진료의뢰서\n내원일: 미확인\n내원사유: 정기 진료\n진단명: 미확인\n중증도: 경미\n\n[2024.04.03] 미확인 의료기관\n내원일: 2024.04.03\n내원사유: 정기 진료\n진단명: 미확인\n중증도: 경미\n\n[2024.04.03] 미확인 의료기관\n내원일: 2024.04.03\n내원사유: 정기 진료\n진단명: 미확인\n중증도: 경미\n\n[2024.04.03] 미확인 의료기관\n내원일: 2024.04.03\n내원사유: 및 명칭 : 서울특별시 관악구 관악로 1 서울대학교 63동 3층 전화 및 팩스: (Tel)02-880-5338, (Fax)02-871-5452 면허번호: 제 109528 호 의사성명: 양예슬 예술 (주) 1. 동진료의뢰서는 1차진료후 2차진료를 받고자 하는경우 1차진료담당의사로 부터 요양급여기준에 따라 우선으로 교부됩니다. 2. 의사의 발급일로부터 7일(공휴일제외)이내에 사용해야 합니다. 3. 환자상태 및 진료소견에는 투약, 주요실시검사등 주요진료내용을 간략하게 포함하여 기재하기 바라며 여백부족시에는 뒷면을 활용하기 바랍니다. 등록번호: 성 5\n진단명: 미확인\n처방: , 주요실시검사등 주요진료내용을 간략하게 포함하여 기재하기 바라며 여백부족시에는 뒷면을 활용하기 바랍니다. 등록번호: 성 5\n특이사항: 에는 투약, 주요실시검사등 주요진료내용을 간략하게 포함하여 기재하기 바라며 여백부족시에는 뒷면을 활용하기 바랍니다. 등록번호: 성 5\n중증도: 경미\n\n[미확인] 미확인 의료기관\n내원일: 미확인\n내원사유: *주증상 간종괴 2017년 간혈관종 4.5cm 진단됨 이후 매년 크기 증가하여 2023.8. 8x6cm 으로 자람 계통문진 특이사항 없음 신체검진 n.s. ■ 통증평가 통증 : 무 진단명 Hemangioma of liver 간혈관종, 크기 증가 진료계획 *치료계획 협진의뢰 : 외과 밑그림 및 이미지 초진기록 SMC SAMSUNG MEDICAL CENTER 작성의사: 곽금연 <이하여백>> 1/1 원본대조필\n진단명: 됨 이후 매년 크기 증가하여 2023.8. 8x6cm 으로 자람 계통문진 특이사항 없음 신체검진 n.s. ■ 통증평가 통증 : 무 진단명 Hemangioma of liver 간혈관종, 크기 증가 진료계획 *치료계획 협진의뢰 : 외과 밑그림 및 이미지 초진기록 SMC SAMSUNG MEDICAL CENTER 작성의사: 곽금연 <이하여백>> 1/1 원본대조필\n특이사항: 없음 신체검진 n.s. ■ 통증평가 통증 : 무 진단명 Hemangioma of liver 간혈관종, 크기 증가 진료계획 *치료계획 협진의뢰 : 외과 밑그림 및 이미지 초진기록 SMC SAMSUNG MEDICAL CENTER 작성의사: 곽금연 <이하여백>> 1/1 원본대조필\n중증도: 보통\n\n[미확인] (207878) Liver right hemihepatectomy . Cavernous hemangioma. S5 and 6: 1) size: 8.1x5x4.1 cm 2) negative resection margin (safety margin: 3.5 cm) Background liver: no significant pathological alteration Gallbladder. cholecystectomy: No significant pathological alteration 진단명 Hemangioma of liver\n내원일: 미확인\n내원사유: 정기 진료\n진단명: Hemangioma of liver\n중증도: 경미\n\n[미확인] 3/3 원본대조필\n내원일: 미확인\n내원사유: 정기 진료\n진단명: 계획 Liver CT *치료계획 OPD F/U: 2개월 후 재진기록 SMMC SAMSUNG MEDICAL CENTER 작성의사: 김종만 <이하여백> 삼성서울병원 3/3 원본대조필\n중증도: 경미\n\n[미확인] 미확인 의료기관\n내원일: 미확인\n내원사유: 정기 진료\n진단명: 1. Increased size of hepatic hemangioma in right liver. 1/4 원본대조필\n중증도: 경미\n\n[미확인] 등록번호: 성 5\n내원일: 미확인\n내원사유: 정기 진료\n진단명: 미확인\n중증도: 경미\n\n[미확인] 미확인 의료기관\n내원일: 미확인\n내원사유: 정기 진료\n진단명: 1. Increased size of hepatic hemangioma in right liver. 2. Possible new hemangioma in S3/4. 문제목록 Increased size of hepatic hemangioma in right liver 진단명 Hemangioma of liver 진료계획 1/2 원본대조필\n중증도: 경미\n\n[미확인] 미확인 의료기관\n내원일: 미확인\n내원사유: 정기 진료\n진단명: (A) Hemangioma of liver <[수L-RH] Hemangioma of liver in Rt. lobe. 8.7cm> 진료계획 (P) conservative management. 경과기록 SMC SAMSUNG MEDICAL CENTER 작성의사: 홍지윤\n특이사항: (S) sputum (+) 객관적 소견 (0) 일주일전에 influenza (+) 타미플루 치료 완료. 진단명 (A) Hemangioma of liver <[수L-RH] Hemangioma of liver in Rt. lobe. 8.7cm> 진료계획 (P) conservative management. 경과기록 SMC SAMSUNG MEDICAL CENTER 작성의사: 홍지윤\n중증도: 경미\n\n[미확인] 진료계획 현재 치료 유지 POD 4 JP removed. 경과기록 SMC SAMSUNG MEDICAL CENTER 작성의사: 홍지윤 <이하여백> 2/2 원본대조필\n내원일: 미확인\n내원사유: 정기 진료\n진단명: 미확인\n중증도: 경미\n\n[미확인] 3/3\n내원일: 미확인\n내원사유: 정기 진료\n진단명: 미확인\n중증도: 경미\n\n[미확인] 1 / 2\n내원일: 미확인\n내원사유: 정기 진료\n진단명: (207878) Liver, right hemihepatectomy Cavernous hemangioma, S5 and 6; 1) size: 8.1x5x4.1 cm 2) negative resection margin (safety margin: 3.5 cm) Background liver: no significant pathological alteration Gallbladder. cholecystectomy: No significant pathological alteration 【GROSS DESCRIPTION 】 (298059) 육안담당의: 장기택 PA: 배문환 (1) Type of operation: right hemihepatectomy (2) Resected organs: liver (17x9x8.5 cm), gallbladder (8x4.5 m) (3) Hemangioma Number of hemangioma: 1 Location: S5 and 6 Size: 8.1x5x4.1 cm Serosa invasion: no (distance from hepatic capsule: 0.1 cm) Invasion into adjacent organ or structure: no Resection margin involvement: no (distance from hepatic resection margin: 3.5 cm) (4) Background liver: unremarkable (5) Gallbladder: unremarkable Slide key A-H: MASS, ONE PLANE I-L: MASS, SERIAL SECTION M-N: BACKGROUND LIVER 0: GALLBLADDER 삼성서울병원 1 / 2\n중증도: 경미\n\n[미확인] 2/2\n내원일: 미확인\n내원사유: 정기 진료\n진단명: 미확인\n특이사항: SMC SAMSUNG MEDICAL CENTER 삼성서울병원 2/2\n중증도: 경미\n\n[미확인] 미확인 의료기관\n내원일: 미확인\n내원사유: 정기 진료\n진단명: 미확인\n처방: 일】\n특이사항: SMC SAMSUNG MEDICAL CENTER 【검사명】 ROP (ABDOMEN & PELVIS CT, OTHERS) [RC3122RO 【구분] 외래 【처방일】\n중증도: 경미\n\n[미확인] 미확인 의료기관\n내원일: 미확인\n내원사유: 정기 진료\n진단명: Giant hepatic hemangioma in right lobe. 【검사명】 LIVER AND PELVIS CT (POST-CONTRAST) [RC20301] 【구분】 외래 【처방일】 (C20)\n처방: 일】\n특이사항: 보이지 않음. 커진 lymph node나 peritoneal nodule 보이지 않음. Left kidney에 수 mm 크기의 cyst가 보임. 결론 및 진단 Giant hepatic hemangioma in right lobe. 【검사명】 LIVER AND PELVIS CT (POST-CONTRAST) [RC20301] 【구분】 외래 【처방일】\n중증도: 경미\n\n[미확인] 1 / 1\n내원일: 미확인\n내원사유: 정기 진료\n진단명: 1. Increased size of hepatic hemangioma in right liver. 2. Possible new hemangioma in S3/4. 삼성서울병원 1 / 1\n중증도: 경미\n\n[미확인] 미확인 의료기관\n내원일: 미확인\n내원사유: 정기 진료\n진단명: 미확인\n처방: 내역:\n중증도: 경미\n\n[미확인] 미확인 의료기관\n내원일: 미확인\n내원사유: 정기 진료\n진단명: 미확인\n처방: 명 1회투 횟수 1일 총 날수 경로 용법/검체 상태 시행자 비고 -[R2] 이창수 외래 방사선 Abdomen Angiography. Phase 3 Dynamic syudyCT 1 1 08 완료 방사선옴니엑솔주 350(이오헥술)500ml 방사선 elaban 0.26 1 08 T 1 08 [경과기록:\n특이사항: -[R2] 이창수 외래 방사선 Abdomen Angiography. Phase 3 Dynamic syudyCT 1 1 08 완료 방사선옴니엑솔주 350(이오헥술)500ml 방사선 elaban 0.26 1 08 T 1 08 [경과기록:\n중증도: 경미\n\n[미확인] Page 1 by Dr. 이창수 빈경환\n내원일: 미확인\n내원사유: 정기 진료\n진단명: 미확인\n중증도: 경미\n\n[미확인] 미확인 의료기관\n내원일: 미확인\n내원사유: 정기 진료\n진단명: 미확인\n처방: 내역:\n중증도: 경미\n\n[미확인] 미확인 의료기관\n내원일: 미확인\n내원사유: 정기 진료\n진단명: 미확인\n처방: 명 1회투 횟수 1일 총 날수 경로 용법/경제 상태 시행자 비고 - [R2] 이창수 외래 방사선 FULL PACS (특수영상) 방사선 Abdomen CT Dynamic 1 1 08 1 1 08 완료 방사선옴니엑술주 350 (이오엑술) 500ml 방사선elabam 0.24 1 08 1 1 08 [경과기록:\n특이사항: - [R2] 이창수 외래 방사선 FULL PACS (특수영상) 방사선 Abdomen CT Dynamic 1 1 08 1 1 08 완료 방사선옴니엑술주 350 (이오엑술) 500ml 방사선elabam 0.24 1 08 1 1 08 [경과기록:\n중증도: 경미\n\n[미확인] Page 1 by Di. 이창수 빈경환\n내원일: 미확인\n내원사유: 정기 진료\n진단명: 미확인\n중증도: 경미\n\n[미확인] Page 1 by Dr. 박순창 빈경환\n내원일: 미확인\n내원사유: 정기 진료\n진단명: 미확인\n중증도: 경미\n\n[미확인] 미확인 의료기관\n내원일: 미확인\n내원사유: 정기 진료\n진단명: 미확인\n처방: 내역:\n중증도: 경미\n\n[미확인] 미확인 의료기관\n내원일: 미확인\n내원사유: 정기 진료\n진단명: 미확인\n처방: 영 1회투 횟수 1일 총 날수 경로 용법/검체 상태 시행자 비고 -[R2] 이창수 외래 방사선 FULL PACS (특수영상) 방사선옴니헥솔주 350(이오엑술)500ml 방사선 elaban 방사선 Abdomen CT Dynamic 【경과기록:\n특이사항: -[R2] 이창수 외래 방사선 FULL PACS (특수영상) 방사선옴니헥솔주 350(이오엑술)500ml 방사선 elaban 방사선 Abdomen CT Dynamic 【경과기록:\n중증도: 경미\n\n[미확인] Page 1 by Di. 이창수 빈경환\n내원일: 미확인\n내원사유: 정기 진료\n진단명: 미확인\n중증도: 경미\n\n[미확인] 미확인 의료기관\n내원일: 미확인\n내원사유: 정기 진료\n진단명: 미확인\n처방: 내역:\n특이사항: 사항 2022 07 19 01802 간담도계의 혈관종 [처방내역:\n중증도: 경미\n\n[미확인] 미확인 의료기관\n내원일: 미확인\n내원사유: 정기 진료\n진단명: 미확인\n처방: 영 1회투 횟수 1일 총 날수 경로 용법/검체 상태 시행자 비고 -[81] 박원규 외래 방사선 FULL PACS (특수영상) 방사선 Abdomen CT Dynamic 1 1 08 1 1 08 완료 방사선옴! 엑솔주 350(이오엑술)500ml 방사선 elaban 0.24 1 08 1 1 08 방사선 Nature Ct (Filter3) 1 1 08 【경과기록:\n특이사항: -[81] 박원규 외래 방사선 FULL PACS (특수영상) 방사선 Abdomen CT Dynamic 1 1 08 1 1 08 완료 방사선옴! 엑솔주 350(이오엑술)500ml 방사선 elaban 0.24 1 08 1 1 08 방사선 Nature Ct (Filter3) 1 1 08 【경과기록:\n중증도: 경미\n\n[미확인] Page 1 by Dr. 박원규 빈경환\n내원일: 미확인\n내원사유: 정기 진료\n진단명: 미확인\n중증도: 경미\n\n[미확인] 미확인 의료기관\n내원일: 미확인\n내원사유: 정기 진료\n진단명: 미확인\n처방: 내역:\n특이사항: 및 상세불명의 난소낭 【처방내역:\n중증도: 경미\n\n[미확인] 미확인 의료기관\n내원일: 미확인\n내원사유: 정기 진료\n진단명: 미확인\n처방: 명 1회 투 횟수 1일 총 날수 경로 용법/검체 상태 시행자 비고 - [R1] 박원규 외래 검 사신장기능검사 2종 (BUN/Cre) 방사선 FULL PACS (특수영상) 1 1 완료 1 1 08 방사선 Abdomen CI Dynamic 1 1 방사선옴니헥술주 350(이오헥술)500ml 방사선 elaban 0.24 1 08 1 1 08 방사선 Nature Ct (Filter3) 1 1 08 23388 08 완료 과처방 CD 1 1 【경과기록:\n특이사항: - [R1] 박원규 외래 검 사신장기능검사 2종 (BUN/Cre) 방사선 FULL PACS (특수영상) 1 1 완료 1 1 08 방사선 Abdomen CI Dynamic 1 1 방사선옴니헥술주 350(이오헥술)500ml 방사선 elaban 0.24 1 08 1 1 08 방사선 Nature Ct (Filter3) 1 1 08 23388 08 완료 과처방 CD 1 1 【경과기록:\n중증도: 경미\n\n[미확인] Page 1 by Dr. 박원규 빈경환\n내원일: 미확인\n내원사유: 정기 진료\n진단명: 미확인\n중증도: 경미\n\n[미확인] Tel. 053-420-1100 Fax. 053-420-1101 E-mail. office@smradiology.com\n내원일: 미확인\n내원사유: 정기 진료\n진단명: 미확인\n중증도: 경미\n\n[미확인] Tel. 053-420-1100 Fax. 053-420-1101 E-mail. office@smradiology.com 에스엠영상의학과 SM RADIOLOGY CLINIC\n내원일: 미확인\n내원사유: 정기 진료\n진단명: 미확인\n중증도: 경미\n\n[미확인] Tel. 053-420-1100 Fax. 053-420-1101 E-mail, office@smradiology.com\n내원일: 미확인\n내원사유: 정기 진료\n진단명: 미확인\n중증도: 경미\n\n[2021.07.09] Tel. 053-420-1100 Fax. 053-420-1101 E-mail. office@sriradiology.com\n내원일: 2021.07.09\n내원사유: 정기 진료\n진단명: 미확인\n중증도: 경미\n\n[2022.07.19] Tel. 053-420-1100 Fax. 053-420-1101 E-mail. office@smr adiology.com\n내원일: 2022.07.19\n내원사유: 정기 진료\n진단명: 미확인\n중증도: 경미\n\n■ 입원 기록 (Hospitalization Records)\nNaN\n[미확인] *진단계획 preop risk evaluation *치료계획 L-RH *퇴원계획 (퇴원계획일 :\n내원일: 미확인\n내원사유: 응급실 내원\n진단명: 계획 preop risk evaluation *치료계획 L-RH *퇴원계획 (퇴원계획일 :\n입원기간: undefined ~ undefined\n\n[미확인] 간호정보조사지 SIMC SAMSUNG MEDICAL CENTER 2/3\n내원일: 미확인\n내원사유: 응급실 내원\n진단명: 미확인\n입원기간: undefined ~ undefined\n\n[미확인] 미확인 의료기관\n내원일: 미확인\n내원사유: 응급실 내원\n진단명: 미확인\n입원기간: undefined ~ undefined\n특이사항: SMC SAMSUNG MEDICAL CENTER 【검사명】 절제조직(양성종양성) 블록 10개이상 Level C추가코드 [BP1A2031] 【구분] 입원 【처방일】\n\n■ 종합 소견 (Summary)\nNaN\n총 진료 기록: 44건\n진료 기간: 미확인 ~ 미확인\n주요 진단명: 됨 이후 매년 크기 증가하여 2023.8. 8x6cm 으로 자람 계통문진 특이사항 없음 신체검진 n.s. ■ 통증평가 통증 : 무 진단명 Hemangioma of liver 간혈관종, 크기 증가 진료계획 *치료계획 협진의뢰 : 외과 밑그림 및 이미지 초진기록 SMC SAMSUNG MEDICAL CENTER 작성의사: 곽금연 <이하여백>> 1/1 원본대조필, Hemangioma of liver, 계획 Liver CT *치료계획 OPD F/U: 2개월 후 재진기록 SMMC SAMSUNG MEDICAL CENTER 작성의사: 김종만 <이하여백> 삼성서울병원 3/3 원본대조필, 1. Increased size of hepatic hemangioma in right liver. 1/4 원본대조필, 1. Increased size of hepatic hemangioma in right liver. 2. Possible new hemangioma in S3/4. 문제목록 Increased size of hepatic hemangioma in right liver 진단명 Hemangioma of liver 진료계획 1/2 원본대조필\n주요 소견:\n  - 총 3회 입원 이력\n\nNaN\n보고서 생성 완료 - 2025. 10. 19. 오후 10:09:21\nNaN"
}