{
  "caseNumber": 6,
  "timestamp": "2025-08-17T13:28:27.891Z",
  "detailedResult": {
    "caseNumber": 6,
    "hasReportFile": true,
    "processingTime": 32,
    "success": true,
    "validation": {
      "hasPatientInfo": true,
      "hasValidName": true,
      "hasMedicalRecords": true,
      "hasInsuranceInfo": true,
      "noNaNValues": false,
      "processingSuccess": true,
      "overallScore": 0.8333333333333334
    },
    "patientInfo": {
      "patientName": "석향숙",
      "birthDate": "yyyy-mm-dd",
      "registrationNumber": "641020-"
    },
    "medicalRecordsCount": 116,
    "insuranceInfoCount": 4,
    "hospitalizationCount": 22,
    "testResultsCount": 0,
    "nanIssues": {
      "hasNaN": true,
      "locations": [
        ".normalizedReport.insuranceConditions.3.company",
        ".normalizedReport.insuranceHistory.3.company",
        ".progressReport"
      ]
    },
    "memoryUsage": {
      "rss": 51081216,
      "heapTotal": 15708160,
      "heapUsed": 10564624,
      "external": 1815551,
      "arrayBuffers": 10515
    }
  },
  "fullResult": {
    "success": true,
    "normalizedReport": {
      "header": {
        "patientName": "석향숙",
        "birthDate": "yyyy-mm-dd",
        "registrationNumber": "641020-"
      },
      "insuranceConditions": [
        {
          "conditionNumber": 1,
          "company": "제출용 비 고 「의료법」 제17조 및 같은 법 시행규칙 제9조제1항에 따라 위와 같이 진단합니다. 의료기관 명칭: 명지병원 長病明 2025년 02월 26일 전화번호 : 031) 810-5114 주소: 경기도 고양시 덕양구 화수로 14번길 55 팩스번호 : 031) 810-5190 √ 의사 [ 치과의사 한의사 상한의사 면허번호 제 103836 호 성명: 이지현 작성방법 1. 환자의 인적사항은 진찰한 의사, 치과의사 또는 한의사가 주민등록증, 기간 만료 전 여권, 운전면허증, 공무원증, 국립·공립대학 학생증, 군무원증, 건강"
        },
        {
          "conditionNumber": 2,
          "company": "제출용 발급매수 : 37 의무기록 사본 증명서 제공되는 의무기록은 석향숙님의 의료정보로 안전하게 관리하여 주시고,"
        },
        {
          "conditionNumber": 3,
          "company": "제출용 용도 외에는 이용할 수 없으며,"
        },
        {
          "conditionNumber": 4,
          "company": "제출용 목적 달성 시 즉시 파기하여 주시기 바랍니다. 첨부한 사본은 의무기록 원본과 틀림이 없음을 증명합니다. 2025 년 03 월 10 일 의료법인 명지의료재단 명지병원장 長明 三輪知 ※ 담당자 서명이 없는 것은 무효임 담당자 명지병원 MYONGJI HOSPITA 환자번호 01371838 환자이름 석향숙 진료과 심장내과 담당의 이지현 진료일자 2025-02-26 Vital Sign SBP 101 (mmHg) 외래 재진기록지 성별/나이 01/60 주민등록번호 641020-2****** 전자서명자 이지현A DBP 59 (mmHg) 맥박 74 (/min) 특이사항 퇴원-LAB, EKG,CHEST 약물알러지 있음 없음 또는 알수없음 Summary angina visit: 간헐적으로 답답하고 조여서 내원. 등도 아플때도 있었다. undelrying dz: HTN (10yr) HL (4yrs) DM (1~2yr) self med: 자디앙듀오정12.5/1000mg, 아세타졸정,알티스정480mg,아시돌연질캡슐1g,디핀스정80/5 mg, 에제로바정10/5mg,니자리딘캡슐150mg exertioanal angina occupation: 일하다가 휴직 EGD: 2024 GERD + FHX: 부친 VHD 모친 DM HTN stent never alcohol NSR 65 no cm 2025.2.12 TTE: no RWMA EF 66%, E/e' 8 dilaa 38mm Objective 주요 검사결과 2025.2.19 CAG: minimal CAD, diff. ecc. 30% LN of p-mRCA & 35-40% LN of dLCx, ergonovine provocation test positive 2025.2.19 Carotid US : 1.11/1.23 Assessment 진단명 Variant angina Coronary(artery) disease Nause with vomiting Convalescence following other treatment Hyperlipidaemia, unspecified Type 2 diabetes mellitus, without complications Plan 2025-02-26 =>>> Rosulord tab 5mg/T ((주)종근당) 1 # 1x30 2025-02-26 → Isotril ER tab.60mg/T (코오롱제약(주)) 1 # 2x30 출력일시 2025-03-10 17:16 출력자 이지원 원본대조필 페이지 1/2 명지병원 NYONGI MOSPITAL 환자번호 01371838 진료과 심장내과 환자이름 석향숙 담당의 이지현 2025-02-26 CBC with Diff = => 2025-02-26 BUN, Urea Nitrogen 2025-02-26 Creatinine (serum) => 2025-02-26 Electrolyte 3종 = 2025-02-26 ⇒ ALP = 2025-02-26 AST[SGOT] => 2025-02-26 ALT[SGPT] = 2025-02-26 Y-GT = 2025-02-26 ⇒ CK = 2025-02-26 T.Cholesterol 2025-02-26 => Triglyceride 2025-02-26 HDL-Cholesterol 2025-02-26 LDL-Cholesterol 2025-02-26 Uric acid (serum) 2025-02-26 Glucose(Serum) = 2025-02-26 CRP(hs-CRP) 기존약에 상기약제 복용 1개월후 약제 all change 출력일시 2025-03-10 17:16 출력자 이지원 외래 재진기록지 성별/나이 04/60 주민등록번호 641020-2****** 전자서명자 이지현A 작성의 이지현 원본대조필 ?명지병원 페이지 2/2 단기 입원기록지 환자번호 01371838 진료과 심장내과 환자이름 석향숙 성별/나이 여/60 주민등록번호 담당의 이지현 전자서명자 이지현A 입원일자 2025-02-19 입원과 심장내과 입원의사 이지현 퇴원일자 2025-02-19 퇴원과 심장내과 퇴원의사 이지현 최종진단명 구분 확진 질병코드 진단명 주진단명 1200 Unstable angina 처치명 시행일자 시행과 처치명 2025-02-19 CARDIC CATH 2025-02-19 심장내과 관상동맥 조영촬영 Coronary Angiography 관상동맥 조영촬영 Coronary Angiography 입원기록 요약 및 퇴원시 환자상태 주호소 주호소 for CAG Onset 내원당일 과거력 ㅁ없음 ㅁ모름 ODM OHTN OTB Hepatitis Hyperlipidemia □뇌혈관질환 ㅁ심혈관질환 ㅁ수술력 현재 병력 기타알러지 ■기타하기기재 undelrying dz: HTN (10yr) HL (4yrs) DM (1~2yr) diagsnotic CAG 시행 위하여 DCC 내원함. 신체검사 CE Wnl 경과 및 치료과정 undelrying dz: HTN (10yr) HL (4yrs) DM (1~2yr) diagsnotic CAG 시행 위하여 DCC 내원함. 출력일시 2025-03-10 17:16 출력자 이지원 원본대조필 페이지 1/4 641020-2****** 명지병원 MYONGI ROSPITA 환자번호 진료과 심장내과 01371838 환자이름 석향숙 담당의 이지현 단기 입원기록지 성별/나이 여/60 주민등록번호 641020-2****** 전자서명자 이지현A 2025.2.19 CAG: minimal CAD, diff. ecc. 30% LN of p-mRCA & 35-40% LN of dLCx, ergonovine provocation test positive 2025.2.19 Carotid US: 1.11/1.23 Lab 검사결과 [2025-02-19] Calcium: 8.8 [2025-02-19] I. phosphorus: 3.2 [2025-02-19] Glucose: 104 [2025-02-19] BUN: ↑ 29.2 [2025-02-19] Creatinine : 0.73 [2025-02-19] eGFR (CKD-EPI): 89.8 [2025-02-19] Uric Acid : 3.2 [2025-02-19] T. Protein : 6.5 [2025-02-19] Albumin : 4.5 [2025-02-19] T.Bilirubin : 0.98 [2025-02-19] ALP : 90 [2025-02-19] AST (SGOT): 16 [2025-02-19] y-GT: 14 [2025-02-19] ALT (SGPT): 19 [2025-02-19] CRP: 0.07 [2025-02-19] Na: 142 [2025-02-19] K: 4.0 [2025-02-19] Cl: 1 111 [2025-02-19] CO2 : 23 [2025-02-19] CK: 53 [2025-02-19] CK-MB : 0.4 [2025-02-19] high-sensitivity Troponin 1: < 2.51 [2025-02-19] NT-proBNP ↑ 128.00 [2025-02-19] WBC Count: 8.6 [2025-02-19] RBC Count: 4.5 [2025-02-19] Hemoglobin: 13.1 [2025-02-19] Hematocrit : 40.9 [2025-02-19] Platelet Count : 178 [2025-02-19] MCV : 91.7 [2025-02-19] MCH: 29.4 [2025-02-19] MCHC: 32.0 [2025-02-19] RDW : 13.3 출력일시 2025-03-10 17:16 출력자 이지원 원본대조필 명지병원 페이지 2/4 환자번호 진료과 심장내과 01371838 환자이름 석향숙 담당의 이지현 [2025-02-19] PDW : 9.7 [2025-02-19] MPV : 9.1 단기 입원기록지 [2025-02-19] PCT: 10.160 [2025-02-19] Segmented neutrophil%: 74.0 [2025-02-19] Lymphocyte%: 20.0 [2025-02-19] Monocyte%: 4.8 [2025-02-19] Eosinophil%: 1.1 [2025-02-19] Basophil% : 0.1 성별/나이 04/60 주민등록번호 전자서명자 이지현A [2025-02-19] NRBC : 0.0 [2025-02-19] Lymphocyte# : 1.71 [2025-02-19] Monocyte# : 0.41 [2025-02-19] Eosinophil#: 0.09 [2025-02-19] Basophil# : 0.01 [2025-02-19] (ANC) neutrophil(Segmented,Band) : 6.35 [2025-02-19] D-Dimer : 0.31 퇴원약 약품코드 약품명 용법 용량 횟수 일수 JTNTG Nitroglycerin tab.0.6mg/T (명문 제약(주)) 의사 지시대로 복용 1 1 4 Nitrolingual spray 0.4mg*1회당/ JENTGLS 의사지시대로 1 1 1 14.4ml/BT ((주)한국유니팜) JTROSU Rosulord tab 5mg/T ((주)종근당) 1일 1회 아침식후 30분에 복 용하세요 1 1 10 UTIST6 Isotril ER tab.60mg/T (코오롱제 1일 2회 아침, 저녁식후 30분 약(주)) 1 2 10 에 복용하세요 퇴원형태 퇴원지시후 환자상태 및 진료결과 호전 추후치료계획 외래진료 ○추후 재입원 ○타병원진료 ○가정간호 ㅇ치료종결 외래예약정보 외래예약일 2025-02-28 진료과 주치의 심장내과 이지현 퇴원계획 퇴원예정일 2025-02-19 퇴원 후 치료식이 여부 No ○Yes 추후관리계획 사회 복지서비스 연계 필요성 No 외래 ○가정간호 ○타병원 전원 호스피스 OYes 퇴원 후 거주장소 자가 사회복지시설 ○기타 출력일시 2025-03-10 17:16 출력자 이지원 원본대조필 페이지 3/4 641020-2****** 명지병원 환자번호 01371838 환자이름 석향숙 진료과 심장내과 담당의 이지현 담당의사 이지현 단기 입원기록지 성별/나이 01/60 주민등록번호 전자서명자 이지현A 담당교수 이지현 641020-2****** 원본대조필 명지병원 출력일시 2025-03-10 17:16 출력자 이지원 페이지 4/4 환자번호 진료과 심장내과 01371838 환자이름 석향숙 담당의 이지현 2025-02-19 처방일자 의사지시기록 순번 처방일시 의사지시기록지 성별/나이 01/60 주민등록번호 641020-2****** 전자서명자 이지현 D/C 반납 의사 지시 내용 처방량 처방의 구분 구분 2025-02-19 08 Macperan(맥페란) inj.10mg/2ml/A (1A#1 동화약품(주)) :43:22 2 3 1 2025-02-19 08 Aceta inj.1g/100ml/Bag ((주)비보존 1 BAG # 1 :43:22 제약) * 1 2025-02-19 080.9% NS 50ml/BT (제이더블유생명 1BT#1 :43:22 과학(주)) 1 2025-02-19 08 Tridol inj.100mg/2ml/A ((주)유한양 0.5 A # 1 행) 4 :43:22 1 2025-02-19 08 1A#1 5 Lasix inj.20mg/2ml/A ((주)한독) :43:22 6 7 이지현 이지현 * 이지현 * 이지현 이지현 2025-02-19 08 Tridol inj.100mg/2ml/A ((주)유한양 1A#1 :43:22 행) 1 2025-02-19 08 0.9% NS inj.100ml/bag (제이더블유 1 BAG # 1 :43:22 생명과학(주)) 1 * 이지현 이지현 2025-02-19 08 8 Denogan inj.1g// (영진약품(주)) 1V#1 1 이지현 :43:22 2025-02-19 08 0.5 A # 1 * 9 Lasix inj.20mg/2ml/A ((주)한독) 이지현 :43:22 1 10 2025-02-19 080.9% NS inj.100ml/bag (제이더블유 1 BAG # 1 :43:22 생명과학(주) * 1 2025-02-1908 Apidra inj.1000IU/10ml/N ((주)사노 10 IU # 1 피-아벤티스코리아) 이지현 * 11 이지현 :43:23 1 12 2025-02-19 08 Apidra inj.1000IU/10ml/V ((주)사노 6 IU # 1 :43:23 피-아벤티스코리아) * 이지현 1 13 :43:23 2025-02-1908 Apidra inj.1000IU/10ml/N ((주)사노 4 IU#1 피-아벤티스코리아) * 이지현 1 14 2025-02-19 08 Apidra inj.1000IU/10ml/N ((주)사노 2IU#1 :43:23 피-아벤티스코리아) * 이지현 1 15 2025-02-19 080.9% NS 50ml/BT (제이더블유생명 :43:23 과학(주)) 1 BT #1 * 이지현 1 16 :43:23 17 생명과학(주)) 18 2025-02-19 08 Binicapin(소) inj.5mg/5ml/A ((주)비 2MG #1 씨월드제약) 2025-02-19 080.9% NS inj.100ml/bag (제이더블유 80 ML # 1 :43:23 2025-02-1908 Binicapin(대) inj.20mg/20ml/A ((주)1A #1 이지현 이지현 * 1 * 1 출력일시 2025-03-10 17:16 출력자 이지원 원본대조필 페이지 1/4 * 이지현 명지병원 의사지시기록지 환자번호 01371838 진료과 심장내과 환자이름 석향숙 담당의 이지현 성별/나이 04/60 주민등록번호 전자서명자 이지현 :43:23 비씨월드제약) 1 19 :43:23 2025-02-19 08 Peniramine inj.4mg/2ml/A ((주)유한 1A#1 양행) * 이지현 1 * 20 이지현 21 22 :44:39 23 :44:39 2025-02-19 08Apidra inj.1000IU/10ml/V ((주)사노 8IU#1 :43:23 피-아벤티스코리아) 1 2025-02-19 080.9% NS inj.100ml/bag (제이더블유 1BAG #1 :43:23 생명과학(주)) 1 2025-02-19 080.9% NS 1000ml/bag(중외) (제이더 1 BAG #1 블유생명과학(주)) 1 2025-02-19 08 Muteran(대-뮤테란) inj.600mg/6ml/2A #2 A (한화제약(주)) * 이지현 이지현 이지현 1 CAG 전후 2025-02-1908 관상동맥 조영촬영 Coronary Angio 24 1 * 1 * 1 이지현 :44:39 graphy 2025-02-19 08 25 Portable EKG 1 * * 이지현 :44:39 2025-02-19 08 26 CRP(hs-CRP) 1 1 1 이지현 :44:39 2025-02-19 08 27 27 NT-proBNP 1 1 * 1 이지현 :44:39 2025-02-19 08 28 D-Dimer * 1 * 이지현 :44:39 2025-02-19 08 29 High-Sensitivity Troponin I (TNIH) 1 * 1 * 1 이지현 :44:39 2025-02-19 08 30 CK-MB 1 1 * 1 이지현 :44:39 2025-02-19 08 31 CK 1 * 1 * 1 이지현 :44:39 32 32 2025-02-19 08 Y-GT 1 * 1 * 1 이지현 :44:39 2025-02-19 08 33 ALT[SGPT] 1 * 1 * 1 이지현 :44:39 2025-02-19 08 34 AST[SGOT] 1 1 * 1 이지현 :44:39 2025-02-19 08 35 ALP 1 1 * 1 이지현 :44:39 2025-02-19 08 36 T. Bilirubin (serum) 1 * 1 * 1 이지현 :44:39 2025-02-19 08 37 Uric acid (serum) 1 * 1 * 1 이지현 :44:39 출력일시 2025-03-10 17:16 출력자 이지원 원본대조필 페이지 2/4 641020-2****** ?명지병원 의사지시기록지 환자번호 01371838 진료과 심장내과 환자이름 석향숙 담당의 이지현 성별/나이 01/60 주민등록번호 전자서명자 이지현 2025-02-19 08 38 T. Protein (serum) 1 * * 이지현 :44:39 2025-02-19 08 39 Glucose(Serum) 1 1 1 이지현 :44:39 2025-02-19 08 40 40 Albumin (serum) 1 * 1 * 1 이지현 :44:39 2025-02-19 08 41 1.Phos (serum) * 1 * 1 이지현 :44:39 2025-02-19 08 42 Calcium (serum) 1 * 1 * 1 이지현 :44:39 2025-02-19 08 43 Electrolyte 4종 1 1 * * 1 이지현 :44:39 2025-02-19 08 44 Creatinine (serum) * 1 * 1 이지현 :44:39 2025-02-19 08 45 45 BUN, Urea Nitrogen 1 * 1 * 1 이지현 :44:39 2025-02-19 08 46 CBC with Diff 1 * * 1 이지현 :44:39 2025-02-19 10 47 US-Carotid Artery 1 1 1 이지현 :48:54 2025-02-19 11 48 Gluco-Stick Test 1 * 1 * 1 이지현 :08:34 2025-02-19 11 49 49 EKG 심전도 * 1 * 1 이지현 :26:35 2025-02-19 11 50 High-Sensitivity Troponin I (TNIH) * 1 1 1 * 이지현 :26:35 2025-02-19 11 51 BUN, Urea Nitrogen 1 * 1 * 1 이지현 :26:35 2025-02-19 11 42 52 CK * 1 * 1 이지현 :26:35 2025-02-19 11 53 NT-proBNP * * 1 이지현 :26:35 2025-02-19 11 54 CRP(hs-CRP) 1 * 1 * 1 이지현 :26:35 2025-02-19 11 55 Electrolyte 3종 1 1 * 1 이지현 :26:35 2025-02-19 11 56 Creatinine (serum) 1 * 1 * 1 이지현 :26:35 57 2025-02-19 11 Chest PA 1 1 * * 1 이지현 출력일시 2025-03-10 17:16 출력자 이지원 원본대조필 페이지 3/4 641020-2****** 명지병원 MYONGIKOSPITAL 환자번호 진료과 심장내과 01371838 환자이름 석향숙 담당의 이지현 의사지시기록지 성별/나이 여/60 주민등록번호 전자서명자 이지현 :26:35 2025-02-19 11 58 CBC with Diff 1 * 1 * 1 이지현 :26:35 2025-02-19 11 59 CK-MB 1 * 1 * 1 이지현 :26:35 60 :07:59 2025-02-19 14 Nitroglycerin tab.0.6mg/T (명문제 1T#1 약(주)) 2025-02-19 14 Nitrolingual spray 0.4mg*1회당/14.4 1 BT # 1 * 4 이지현 SIGT1 61 이지현 :07:59 ml/BT ((주)한국유니팜) 1 SIGE 2025-02-19 14 1T#1 * 1 62 Rosulord tab 5mg/T ((주)종근당) 이지현 :08:24 0 QDPC 63 :08:24 )) 2025-02-19 15 64 :24:23 1 :44:39 2 2025-02-19 14|sotril ER tab.60mg/T (코오롱제약(주1T#2 *1 Discharge (퇴원합니다) 2025-02-19 08처치지시 입원:1일:V/S TIME:q 8hr, B ST TIME:1 times 2025-02-19 14 처치지시 퇴원(외출)약/기존 지참약 유지하면서 퇴원약 :07:59 2025-02-19 14 처치지시 퇴원(외출)약/자디앙듀오 2 :07:59 1일 후 부터 복용합니다. 이지현 이지현 이지현 이지현 0 BIDPC 1 * * 1 이지현 처치지시 퇴원(외출)약/*NTG: chest 2025-02-19 14 3 :07:59 pain 발생시 1T SL 10분간격 최대 2 회 출력일시 2025-03-10 17:16 출력자 이지원 이지현 641020-2****** 원본대조필 명지병원 페이지 4/4 1일 입원실 간호기록지 (Daycare Center) 환자번호 진료과 심장내과 01371838 환자이름 석향숙 담당의 이지현 성별/나이 01/60 주민등록번호 641020-2****** 전자서명자 이지영 입원일자 2025-02-19 일반정보 입원경로 Ambulatory OWheel chair OCart 입원시 동반자 ㅇ없음 가족 ㅇ기타 입원시 교육 입원시 준비물품 1입원시 생활안내문 설명 ?가스 전열기구 사용금지 및 화재방지 ■환자권리장전 및 환자 책임에 대하여 설명 ㅣ금연교육 함 귀중품 관리 및 도난방지 [쓰레기 분리수거 린넨관리 1주차관리 약물알러지 있음 )없음 또는 알수없음 기타알러지 음식 없음 있음 기타 없음 있음 약품 입원직전 복용하던 약 ㅇ없음 있음타원 HTN, HL 현재 가지고 온약 ) 없음 있음 입원일시 2025-02-19 08:36 신장 164 (cm) 체중 77 (Kg) BMI 28.6(kg/m²) 직업 회사원 입원동기 주증상 For CAG 과거병력 ㅁ없음 ㅣ고혈압 당뇨 간염 ■기타 HL 활력징후 날짜 시간 SBP DBP 체온 맥박 호흡 2025-02-19 09:00 147 82 36.3 52 20 20 11:05 163 87 36.2 59 20 11:40 150 78 36.2 60 20 1. 통증사정도구 NRS OFPRS OFLACC Ⅲ. 통증양상 1. 쑤시는 듯한 2. 날카로운 3. 짓누르는 4. 타는 듯한 5. 욱신욱신 쑤심 6. 쥐어짜는 듯한 7. 바늘로 찌르는 듯한 8. 콕콕 쑤시는 9. 따끔거림 10. 화끈거림 출력일시 2025-03-10 17:16 출력자 이지원 원본대조필 페이지 1/3 명지병원 MYONGIKOSPITAL 1일 입원실 간호기록지 (Daycare Center) 환자번호 진료과 심장내과 01371838 환자이름 석향숙 담당의 이지현 Ⅲ. 비약물 중재 성별/나이 01/60 주민등록번호 641020-2****** 전자서명자 이지영 마사지, 지압, 냉찜질, 온찜질, 심호흡, 이완요법, 심상요법, 전환요법 (영화감상, TV시청, 음악감상, 산책 등) 평가일시 강도 위치 양상 빈도 지속시간 중재(약물 또는 비약물) 간호사 이도윤(D 초기평가 02-19 08:45 0 CC) 이도윤(D 재평가 02-19 11:05 0 CC) 재평가 재평가 재평가 재평가 재평가 날짜 시간 간호기록 간호사 2025-02-19 08:45 외래 통해 걸어서 입원함 CA안슬기에게 알림 금식, 속옷, 장신구 제거 확인함 금일 아침 약 복용 유무 확인함 \"그저께 NTG 복용했어요.\" 이도윤(DC 보호자 같이 내원했는지 확인함 이도윤(DC 09:06 portable EKG 시행함 이도윤(DC 09:20 Full voiding 후 CAG위해 이동침대로 심혈관촬영실감 C) 11:05 CAG 시행후 이동침대로 병실복귀함 식이 가능함을 설명함 Rt.radial CAG site compression set Rt.finger's s ense, motor 양호함 사정 : 금일 CAG 시행함 계획 및 수행 : CAG 부위 관찰함 계획 및 수행 : 출혈즉시 간호사에게 말하도록 교육함 계획 및 수행: 침상안정해야 함을 설명함 이도윤(DC 계획 및 수행 : 검사 및 시술 후 주의사항 안내문을 지급함 출력일시 2025-03-10 17:16 원본대조필 출력자 이지원 페이지 2/3 명지병원 MYONGJI KOSITA 1일 입원실 간호기록지 (Daycare Center) 환자번호 01371838 환자이름 석향숙 진료과 심장내과 담당의 이지현 성별/나이 04/60 주민등록번호 641020-2****** 전자서명자 이지영 11:06 V/S 163/87-59-36.2 \"머리가 조금 아파요\"CA안슬기에게 알 이도윤(DC 림 C) 이도윤(DC 11:35 평가: CAG 부위 출혈없음 C) 이도윤(DC 11:40 V/S 150/78-36.2-60-20 측정됨을 CA안슬기에게 알림 C) 이도윤(DC 13:35 US-Carotid Artery위해 심초음파실 이동함. 이지영(DC) 14:20 병실복귀함 이지영(DC 15:03 CAG site bleeding,hematoma 없이 침상안정 중임 15:25 Rt.radial CAG site compression Dressing 시행함 by CA안 이도윤(DC 슬기 C) 15:38 퇴원 후 압박 Dressing 제거 시간 설명함 퇴원 후 주의사항 설명함 익일 CAG site 소독방법 설명함 이지영(DC 퇴원약 지급하고 외래예약/ 외래검사 설명함 이지영(DC 15:40 보호자와 함께 걸어서 퇴원함 출력일시 2025-03-10 17:16 출력자 이지원 원본대조필 명지병원 페이지 3/3 환자번호 진료과 심장내과 01371838 환자이름 석향숙 담당의 이지현 임상화학검사(일반) 성별/나이 04/60 주민등록번호 641020-2***** 전자서명자 조해원 등록번호 01371838 진료과 심장내과 검사자 N/A 환자명 석향숙 성별/나이F/60 의뢰의사 이지현 병동 DCC/DCC 확인의사 조해원 검체명 Serum, SST 진단명 Unstable angina 처방일시 2025-02-19 08:44 접수일시 2025-02-19 09:06 보고일시 2025-02-19 09:58 검체번호 20250219A00467 0 검사 결과 검사명 결과 H/L 참고치 단위 Calcium 8.8 8.7 10.4 mg/dL 1. phosphorus 3.2 2.4 5.1 mg/dL Glucose 104 73 106 mg/dL BUN 29.2 H 9 23 mg/dL Creatinine 0.73 0.5 1.1 ~ mg/dL mL/min/1.7 ...eGFR (CKD-EPI) 89.8 > 60.0 3m2 Uric Acid 3.2 3.0 7.0 mg/dL T. Protein 6.5 5.7 2 8.2 g/dL Albumin 4.5 ~ 3.2 4.8 g/dL T. Bilirubin 0.98 0.30 ~ 1.20 mg/dL ALP 90 ~ 46 116 U/L AST (SGOT) 16 < 34 U/L ALT (SGPT) 19 10 49 U/L Y-GT 14 < 38 U/L Na 142 ~ 132 146 mmol/L Electrolyte (4종) K 4.0 3.5 5.5 mmol/L Cl 111 H 99 109 mmol/L CO2 23 20 31 mmol/L CK 53 40 ~ 235 U/L CK-MB 0.4 <= 5 ng/mL high-sensitivity Troponin I < 2.51 < 38.64 pg/mL NT-proBNP 128.00 H <125 pg/mL 출력일시 2025-03-10 17:16 원본대조필 명지병원 출력자 이지원 페이지 1/1 CAG 환자번호 01371838 환자이름 석향숙 진료과 심장내과 담당의 이지현 성별/나이 여/60 전자서명자 주민등록번호 641020-2****** CAG MYONGJI HOSPITAL Coronary Angiography & PCI Report Date: 2025.19 Age/Sex: 60 ( ) M (4) F Cath. No : Name: : Hos. ID 1471836 Clinical Diagnosis: No unstable signa ~ Vent Ref. Dr. : Puncture Site Femoral Operator: Rt.( ) Lt. ( ) 01 시현 Radial Rt.Lt. ( ) Others Cardiogenic shock: Y( ) N( CHF : Y( ) Nex 2 Ar shorth Rt dominant coronary artery AGA ZJR 4-x upto drt.co. 30x wf parked 014 Conclusion: Comments: 출력일시 2025-03-10 17:16 출력자 이지원 PILO S LGA2744-35 .diff. ea. upho крашенню 13: Ang Poppins provocanter text & Voca 85 Vasspor ··RCA As well. Variant anjha Mrinal CAD Medical Textment Cardiac Catheterization Laboratory 7697-24 Tel: 031-810-6776, 6786 원본대조필 페이지 1/1 0/2/82 명지병원 환자번호 진료과 심장내과 01371838 환자이름 석향숙 담당의 이지현 CA ECHO검사 Exam Date 2025-02-19 Patient ID: 01371838 Location: DCC Height: cm Comments RT- CA ECHO검사 성별/나이 여/60 주민등록번호 전자서명자 서용성 ECHOCARDIOGRAPHY LABORATORY MYONGJIHOSPITAL Carotid Duplex Ultrasound Report Weight: Echo No.: 25 - 02 Name: 석향숙 Referring Dr.: 0 Sex/Age: F Referral Reason: Subclinical atherosclerosis screening BSA: m2 BP: kig LT 060Y /mmHg 1. Significant thickened IMT (far wall: 1.11mm) in Rt proximal CCA without significant stenotic flow & Significant thickened IMT(far wall: 1.07mm) in Rt distal CCA without significant stenotic flow. Carotid IMT(CCA) Right CCA 1. Significant thickened IMT (far wall: 1.09mm) in Lt distal CCA without significant stenotic flow. 2. Mild homogeneous plaque(far wall:1.23mm) in Lt proximal CCA without significant stenotic flow. Left CCA ICA ECA CCA R ICA ECA CCA MAX IMT Rt far wall prox: 1.11 mm Lt far wall prox: mm Rt far wall dist 1.07 mm Lt far wall dist: 1.09 mm Carotid Plaque Absence Single Multiple Location & Size CR: CCA R: ICA CRt bulb Morphology Echogenecity: Texture: Hyperechoic Homogenous Surface feature: Smooth Calcification: Present Doppler Study mm DL: CCA 1.23 mm mm DL: ICA mm mm CLt bulb mm CEchogenic Heterogenous Dirregular Absent Hypoechoic Acoustic Shadowing Right PSV (cm/sec) Right EDV (cm/sec) Left PSV (cm/sec) Left EDV (cm/sec) CCA proximal 73.8 7.2 88.3 17 CCA distal 64.8 10.2 84.9 109 ICA 46.8 15.1 56.4 174 ICA/CCA ratio 0.63 2.10 0.64 1.02 ECA 76.3 8.06 52.2 3 Vertebral artery 23.1 541 23.4 1.2 Confirmed by: 488 (62830) Sonographer: 김승아 Responsible Dr.: 18(81700) 출력일시 2025-03-10 17:16 원본대조필 출력자 이지원 페이지 1/2 641020-2****** 명지병원 MYONGJI HOSPITA炭 환자번호 01371838 환자이름 석향숙 진료과 심장내과 담당의 이지현 출력일시 2025-03-10 17:16 출력자 이지원 CA ECHO검사 성별/나이 01/60 주민등록번호 641020-2****** 전자서명자 서용성 원본대조필 명지병원 페이지 2/2 EKG 환자번호 진료과 심장내과 01371838 환자이름 석향숙 성별/나이 여/60 주민등록번호 641020-2****** 담당의 이지현 전자서명자 황의석 EKG REST ECG/4* 2.5s+ 1Rhythm S HS Patient ID: 01371838 2025/02/19 09:18:36 60YEARS Vent. Rate 48 bpm PR interval 172 ms QRS duration 104 ms Interpretation Sinus bradycardia Otherwise normal ECG QT/QTC P-R-T axes 430/384 ms -6/38/50 AiTiA-LVSD Score 0.1 (Low risk) P duration Confirmed By: EuiSeock Hwang aVR V1 V4 || aVL V2 V5 2025-03-10 17:16 출력일시 출력자 이지원 원본대조필 명지병원 페이지 1/2 h h EKG 환자번호 01371838 환자이름 석향숙 성별/나이 여/60 진료과 심장내과 담당의 이지현 전자서명자 황의석 = GE MAC5K V008B(1) 25mm/s 10mm/mV 16-150Hz 60Hz 출력일시 2025-03-10 17:16 출력자 이지원 aVF 주민등록번호 641020-2****** V3 Attending MD: 원본대조필 명지병원 페이지 2/2 MY ON GAI HOSPIT la h 'V6 환자번호 진료과 심장내과 01371838 환자이름 석향숙 담당의 이지현 임상화학검사(일반) 성별/나이 여/60 주민등록번호 641020-2****** 전자서명자 조해원 등록번호 01371838 진료과 심장내과 검사자 N/A 처방일시 2025-02-19 15:47 환자명 석향숙 성별/나이 F/60 의뢰의사 이지현 병동 확인의사 조해원 검체명 Serum, SST 진단명 Variant angina 접수일시 2025-02-26 10:56 보고일시 2025-02-26 11:41 검체번호 20250226A00712 0 검사 결과 검사명 결과 H/L 참고치 단위 BUN 22.7 9 23 mg/dL Creatinine 0.89 0.5 1.1 mg/dL mL/min/1.7 ....eGFR (CKD-EPI) 70.7 > 60.0 3m2 Na 141 2 132 146 mmol/L Electrolyte (3종) K 4.1 ~ 3.5 5.5 mmol/L Cl 108 99 109 mmol/L CK 57 40 235 U/L CK-MB 0.8 <= 5 ng/mL high-sensitivity Troponin I <2.51 < 38.64 pg/mL NT-proBNP 62.00 <125 pg/mL 출력일시 2025-03-10 17:16 출력자 이지원 원본대조필 명지병원 페이지 1/1 일반촬영검사 판독결과지 환자번호 01371838 진료과 심장내과 환자이름 석향숙 성별/나이 여/60 주민등록번호 담당의 임정기 전자서명자 임정기 처방일자 2025/02/19 촬영일자 2025/02/26 판독일자 2025/02/26 판독의(1) N/A 판독의(2) 임정기 전사자 N/A 소견 Chest PA(2025-02-19 00:00:00) Within normal limits. 출력일시 2025-03-10 17:16 출력자 이지원 원본대조필 페이지 1/1 641020-2****** 명지병원 EKG 환자번호 01371838 환자이름 석향숙 성별/나이 여/60 주민등록번호 641020-2****** 진료과 심장내과 담당의 이지현 전자서명자 황의석 EKG SHS Patient ID: 01371838 2025/02/26 11:11:57 60YEARS Vent. Rate 63 bpm PR interval 168 ms QRS duration QT/QTC P-R-T axes P duration 94 ms 398/407 ms 4/42/46 2025-03-10 17:16 출력일시 출력자 이지원 aVR aVL 원본대조필 페이지 1/2 REST ECG/4* 2.5s+ 1Rhythm Interpretation Normal sinus rhythm Normal ECG AiTiA-LVSD Score 0.1 (Low risk) Confirmed By: EuiSeock Hwang r 명지병원 M? ONG HOSPITA 나나무 V5 h EKG 환자번호 01371838 환자이름 진료과 심장내과 담당의 석향숙 이지현 성별/나이 여/60 주민등록번호 641020-2****** 전자서명자 황의석 GE MAC5K V008B(1) 25mm/s 10mm/mV 16-150Hz 60Hz 출력일시 2025-03-10 17:16 출력자 이지원 aVF Attending MD: 원본대조필 명지병원 MY ONG II HOSPIT 페이지 2/2 ? V6 환자번호 01371838 진료과 심장내과 담당의 환자이름 석향숙 이지현 진료일자 2025-02-12 Vital Sign 외래 재진기록지 성별/나이 01/60 주민등록번호 641020-2****** 전자서명자 이지현A SBP 124 (mmHg) DBP 70 (mmHg) 맥박 78/min) 특이사항 LAB,TTE 약물알러지 있음 없음 또는 알수없음 Summary angina visit: 간헐적으로 답답하고 조여서 내원. 등도 아플때도 있었다. undelrying dz: HTN (10yr) HL (4yrs) DM (1~2yr) self med: 자디앙듀오정12.5/1000mg, 아세타졸정,알티스정480mg, 아시돌연질캡슐1g, 디핀스정80/5 mg, 에제로바정10/5mg, 니자리딘캡슐150mg exertioanal angina occupation: 일하다가 휴직 EGD: 2024 GERD + FHX: 부친 VHD 모친 DM HTN stent never alcohol NSR 65 no cm Objective 주요 검사결과 HbA1c 6.1 lipid 155/139/50/83 glc 91 CE wnl NT-proBNP 55 2025.2.12 TTE 1. No RWMA. 2. Normal sized cardiac chambers with normal LV systolic function (EF: 66%). 3. Relaxation abnormality of LV filling pressure (E/e': 8). 4. Concentric remodeling. 5. Dilated ascending aorta (38mm). Assessment 진단명 Chest pain (unspecified) Hypertensive heart disease NOS Type 2 diabetes mellitus, without complications Plan 2025-02-12 → Nitroglycerin tab.0.6mg/T (명문제약(주)) 1 # 1x4 출력일시 2025-03-10 17:16 출력자 이지원 원본대조필 페이지 1/2 명지병원 외래 재진기록지 환자번호 01371838 진료과 심장내과 환자이름 석향숙 담당의 이지현 성별/나이 01/60 주민등록번호 전자서명자 이지현A 2025.2.19 DCC adm. for diagsnotic CAG jardiance duo 2일전부터 skip 출력일시 2025-03-10 17:16 출력자 이지원 작성의 이지현 641020-2****** 원본대조필 명지병원 페이지 2/2 환자번호 01371838 진료과 심장내과 환자이름 석향숙 담당의 이지현 진료일자 2025-02-05 외래 초진기록지 성별/나이 여/60 주민등록번호 641020-2****** 전자서명자 이지현A 휴대폰 01031785794 주소 (230-19)인천 강화군 송해면 전망대로 127-42 신장 164 (cm) 체중 79 (Kg) BMI 29.3 (kg/m²) Vital Sign SBP 124 (mmHg) DBP 70 (mmHg) 맥박 78 (/min) 특이사항 신환 가슴통증, 답답 약- 자디앙듀오정12.5/1000mg,아세타졸정,알티스정480mg, 아시돌연질캡슐1ug, 디핀스 정80/5mg,에제로바정10/5mg, 니자리딘캡슐150mg EKG,CHEST 약물알러지 있음 없음 또는 알수없음 통증평가 ㅇ유 ○평가불가 - 사유 : 현재 병력 angina visit: 간헐적으로 답답하고 조여서 내원. 등도 아플때도 있었다. undelrying dz: HTN (10yr) HL (4yrs) DM (1~2yr) self med: 자디앙듀오정12.5/1000mg,아세타졸정,알티스정480mg,아시돌연질캡슐1g,디핀스정80/5 mg,에제로바정10/5mg, 니자리딘캡슐150mg exertioanal angina occupation: 일하다가 휴직 EGD: 2024 GERD + 가족력 ONO 사회력 주요 검사결과 NSR 65 no cm 진단명 주진단명 Yes 부친 VHD 모친 DM HTN stent Smokingnever Drinkingnever Chest pain (unspecified) Hypertensive heart disease NOS 진단명 Type 2 diabetes mellitus, without complications 구분 확진 기타진단명 기타진단명 치료계획 2025-02-05 = = CBC with Diff 출력일시 2025-03-10 17:16 출력자 이지원 원본대조필 명지병원 페이지 1/3 환자번호 진료과 심장내과 01371838 환자이름 석향숙 담당의 이지현 2025-02-05 => PT 2025-02-05 ⇒ aPTT 2025-02-05 Calcium (serum) = 2025-02-05 1.Phos (serum) 2025-02-05 BUN, Urea Nitrogen 2025-02-05 Creatinine (serum) 2025-02-05 Glucose (Serum) 2025-02-05 T. Protein (serum) = 2025-02-05 Albumin (serum) 2025-02-05 2025-02-05 2025-02-05 = Uric acid (serum) T.Cholesterol T. Bilirubin (serum) 2025-02-05 ⇒ ALP 2025-02-05 = AST[SGOT] 2025-02-05 → ALT[SGPT] 2025-02-05 ⇒ CK => 2025-02-05 ⇒ Hb A1c 2025-02-05 Triglyceride = 2025-02-05 = HDL-Cholesterol 외래 초진기록지 2025-02-05 LDL-Cholesterol 2025-02-05 Electrolyte 3 = 2025-02-05 ⇒ Free T4 = 2025-02-05 ⇒ TSH = 2025-02-05 => Routine U/A with Micro 2025-02-05 → CRP(hs-CRP) 2025-02-05 = Y-GT 2025-02-05 = T. Protein (urine) 2025-02-05: ⇒ Creatinine (urine) 2025-02-05: => Microalbumin (Urine) 2025-02-05: ⇒ CK-MB 2025-02-05 => High-Sensitivity Troponin I (TNIH) 2025-02-05 = NT-proBNP 2025-02-05 ⇒ D-Dimer 2025-02-05 Chest PA, Lat (L) 2025-02-05 → EKG 심전도 2025-02-05 => [전문] 경흉부초음파 (TTE) 상기 검사 후 fu 출력일시 2025-03-10 17:16 출력자 이지원 성별/나이 01/60 주민등록번호 전자서명자 이지현A 원본대조필 페이지 2/3 작성의 이지현 641020-2****** 명지병원 환자번호 01371838 환자이름 석향숙 진료과 심장내과 담당의 이지현 출력일시 2025-03-10 17:16 출력자 이지원 외래 초진기록지 성별/나이 여/60 주민등록번호 641020-2****** 전자서명자 이지현A 원본대조필 명지병원 페이지 3/3 환자번호 01371838 진료과 심장내과 환자이름 석향숙 담당의 이지현 임상화학검사(일반) 성별/나이 01/60 주민등록번호 641020-2****** 전자서명자 조해원 등록번호 01371838 진료과 심장내과 검사자 N/A 처방일시 2025-02-05 15:02 환자명 석향숙 성별/나이 F/60 의뢰의사 이지현 병동 확인의사 조해원 검체명 Serum, SST 진단명 Chest pain (unspecified) 접수일시 2025-02-12 11:57 보고일시 2025-02-12 12:46 검체번호 20250212A00883 0 검사 결과 검사명 결과 H/L 참고치 단위 Calcium 9.0 8.7 10.4 mg/dL I. phosphorus 3.8 2.4 5.1 mg/dL Glucose 91 73 106 mg/dL BUN 19.1 9 23 mg/dL Creatinine 0.73 2 0.5 1.1 mg/dL mL/min/1.7 ...eGFR (CKD-EPI) 89.8 > 60.0 3m2 Uric Acid 3.4 3.0 7.0 mg/dL T.Cholesterol 155 < 239 mg/dL T. Protein 6.9 5.7 8.2 g/dL Albumin 4.5 3.2 4.8 g/dL T.Bilirubin 1.75 H 0.30 1.20 mg/dL ALP 101 46 116 U/L AST (SGOT) 19 < 34 U/L ALT (SGPT) 21 10 49 U/L Y-GT 16 < 38 U/L Triglyceride 139 <150 mg/dL HDL-Cholesterol 50 > 40 mg/dL LDL-Cholesterol 83 <129 mg/dL Amylase 165 H 30 ~ 118 U/L Lipase 29 12 53 U/L Na 141 ~ 132 146 mmol/L Electrolyte (3) K 4.5 3.5 5.5 mmol/L CI 109 99 109 mmol/L CK 157 40 235 U/L CK-MB 0.6 <= 5 ng/mL high-sensitivity Troponin I 3.91 < 38.64 pg/mL NT-proBNP 55.00 <125 pg/mL 출력일시 2025-03-10 17:16 원본대조필 출력자 이지원 페이지 1/2 명지병원 임상화학검사(일반) 환자번호 01371838 환자이름 석향숙 진료과 심장내과 담당의 이지현 Free T4 1.24 TSH 1.52 2025-03-10 17:16 출력일시 출력자 이지원 성별/나이 01/60 주민등록번호 전자서명자 조해원 0.89~1.76 ng/dL 0.55~4.78 ulU/mL 641020-2****** 원본대조필 명지병원 페이지 2/2 일반촬영검사 판독결과지 환자번호 01371838 진료과 심장내과 환자이름 석향숙 성별/나이 04/60 주민등록번호 담당의 박지연 전자서명자 박지연 처방일자 2025/02/05 촬영일자 2025/02/05 판독일자 2025/02/05 판독의(1) N/A 판독의(2) 박지연 전사자 N/A 소견 Chest PA, Lat (L) (2025-02-05 00:00:00) No active lung lesion 결 론 No active lung lesion 출력일시 2025-03-10 17:16 출력자 이지원 641020-2****** 원본대조필 명지병원 페이지 1/1 환자번호 진료과 심장내과 01371838 환자이름 석향숙 담당의 이지현 CA ECHO검사 CA ECHO검사 성별/나이 01/60 주민등록번호 전자서명자 서용성 Exam Date 2025-02-12 Patient ID: 01371838 Location: OPD ECHOCARDIOGRAPHY LABORATORY MYONGJI HOSPITAL Transthoracic echocardiography report Height 164.0 cm Weight 77.0 kg Echo No.: 25 2 Name: 석향숙 Referral Reason: Chest pain 1.84 m2 BSA Referring Dr.: 이지현 Sex/Age: F 1 060Y BP 124/70 mmHg HR 78 bpm 1. Comments Echo for chest pain DM, HTN, HL 1. No RWMA 2. Normal sized cardiac chambers with normal LV systolic function (EF: 66%) 3. Relaxation abnormality of LV filling pressure (E/e: 8). 4. Concentric remodeling. 5. Dilated ascending aorta (38mm). Global strain rate -19.4% 2. Regional Wall motion Abnormality: 3. Valves: 4. Regurgitation: 5. Stenosis: 6. Pericardial Effusion: No Image: No MV Native AV Native TV Native MR No Slightly thickened Senile sclerocalcified Normal AR No TR Trivial PR Trivial MS No AS No TS. No PS No No Intracardiac Thrombi: No Mass: No 7. Diastolic function: Relaxation abnormality of LV filling pattern M-mode/2D Measurement RVD1: mm RVD2 mm IVSD (8-11). IVSS: RVD3 mm LVEDD (42-54): 43 mm PWD (8-11) PWs: omom 10 mm Aortic annulus 19.0 mm 13 mm sinus of Valsalva 31.0 mm 10 mm ST Junction 27.0 mm 13 mm Ascending aorta. 38.0 mm LVESD (24-36): 28 mm LVOT (18-22) mm LA (AP/ML/SI) mm LVEF (55-76): LV Mass 142.5 g LA Vol by M-mode. 66 % LV Mass index 76.2 g/m2 by prolate ellipse ml by Biplane % RWT 0.47 by mod simpson 65 ml TV Annulus mm LA Vol index (18-28) NC mm by prolate ellipse Echo Score Doppler Measurement Total M T S C by mod simpson MV Annulus (4C/2C): 35 ml/m2 ml/m2 mm Aortic Mitral Tricuspid LVOT (TVI) 22.0 cm TVI of MR jet cm TR jet 1.54 m/sec AV (TVI) cm E (0.6-1) 0.59 m/sec RVSP 14 mmHg LVOT peak V 1.0 m/sec A (0.3.0.8) 0.67 m/sec RAP 5 mmHg PSPG/MSPG 4.1/2.4 mmHg DT (170-210) 193.51 msec MPAP mmHg AV Peak V PSPG/MSPG AVA by 2D m/sec PHT msec PVR mmHg MDPG mmHg MDPG HR /min RVOT VTL mmHg CM by continuity cm2 MVA by 2D cm2 Pulmonic PHT of AR jet RV function TAPSE msec by PHT: cm2 by continuity cm2 PSPG/MSPG RVOT AT 1 mmHg m/sec TDI S FAC TDI mm cm/sec % S 7.2 cm'sec E 7.2 cm/sec A 10.4 cm/sec EE 8 Contirmed by: 서용성 (81700) Sonographer: 조수현 Responsible Dr.: 4188(81700) 출력일시 2025-03-10 17:16 출력자 이지원 원본대조필 페이지 1/2 641020-2****** 명지병원 환자번호 01371838 환자이름 석향숙 진료과 심장내과 담당의 이지현 CA ECHO검사 성별/나이 01/60 주민등록번호 641020-2****** 전자서명자 서용성 출력일시 2025-03-10 17:16 출력자 이지원 원본대조필 페이지 2/2 명지병원 MYONGI HOSPITA 환자번호 진료과 심장내과 01371838 환자이름 석향숙 담당의 이지현 CA ECHO검사 CA ECHO검사 성별/나이 01/60 주민등록번호 전자서명자 서용성 Exam Date 2025-02-12 Patient ID: 01371838 Location: OPD ECHOCARDIOGRAPHY LABORATORY MYONGJI HOSPITAL Transthoracic echocardiography report Echo No.: 25 2 Name: 석향숙 Referral Reason: Chest pain Referring Dr.: 이지현 Sex/Age: F / 060Y Height 164.0 cm Weight 77.0 kg BSA 1.84 m2 1. Comments Echo for chest pain : DM, HTN, HL 1. No RWMA. 2. Normal sized cardiac chambers with normal LV systolic function (EF: 66%). 3. Relaxation abnormality of LV filling pressure (E/e: 8). 4. Concentric remodeling. 5. Dilated ascending aorta (38mm). * Global strain rate: -19.4% 2. Regional Wall motion Abnormality: 3. Valves: 4. Regurgitation: 5. Stenosis: 6. Pericardial Effusion: 7. Diastolic function: BP 124/70 mmHg HR 78 bpm No Image: No MV AV Native Native Slightly thickened Senile sclerocalcified TV Native Normal MR No AR TR No Trivial PR Trivial MS No AS No TS No PS No No Intracardiac Thrombi: No Mass: No Relaxation abnormality of LV filling pattern M-mode/2D Measurement RVD1 mm IVSD (8-11) 10 mm Aortic annulus. 19.0 mm RVD2 mm IVSS 13 mm sinus of Valsalva 31.0 mm RVD3 mm PWD (8-11) 10 mm ST Junction 27.0 mm LVEDD (42-54) LVESD (24-36). 28 43 mm PWs: 13 mm Ascending aorta 38.0 mm mm LVOT (18-22) mm LA (AP/ML/SI) mm LVEF (55-76) LV Mass 142.5 9 LA Vol by M-mode. 66 % by Biplane % LV Mass index. RWT 76.2 g/m2 0.47 by prolate ellipse by mod simpson mi 65 ml TV Annulus: mm NVC mm Echo Score Doppler Measurement Total M T S C LA Vol index (18-28) by prolate ellipse by mod simpson MV Annulus (4C/2C) 35 ml/m2 ml/m2 mm Aortic Mitral LVOT (TVI) 22.0 cm TVI of MR jet cm Tricuspid TR jet 1.54 1 m/sec AV (TVI) LVOT peak V 1.0 cm m/sec E (06-1) 0.59 m/sec RVSP 14 mmHg A (0.3.0.8) 0.67 m/sec RAP 5 mmHg PSPG/MSPG. 4.1/2.4 mmHg DT (170-210) 193.51 msec MPAP mmHg AV Peak V PSPG/MSPG 1 m/sec mmHg PHT msec PVR MDPG mmHg MDPG mmHg AVA by 2D by continuity PHT of AR jet RV function TAPSE TDI S HR /min RVOT VTI CM cm2 MVA by 20 cm2 Pulmonic msec by PHT cm2 by continuity cm2 PSPGMSPG RVOTAT mmHg m/sec mm cm/sec FAC TDI S 72 cm/sec E 7.2 cm/sec A 10.4 cm/sec EE 8 Confirmed by: (81700) Sonographer: 조수현 Responsible Dr.: 488(81700) 출력일시 2025-03-10 17:16 출력자 이지원 원본대조필 페이지 1/2 641020-2****** 명지병원 환자번호 01371838 환자이름 석향숙 진료과 심장내과 담당의 이지현 출력일시 2025-03-10 17:16 출력자 이지원 CA ECHO검사 성별/나이 여/60 주민등록번호 641020-2****** 전자서명자 서용성 원본대조필 명지병원 페이지 2/2 EKG 환자번호 01371838 환자이름 석향숙 성별/나이 여/60 주민등록번호 641020-2****** 진료과 심장내과 담당의 이지현 전자서명자 황의석 EKG SHS Patient ID: 01371838 2025/02/05 13:46:02 60YEARS = Vent. Rate PR interval 65 bpm 166 ms QRS duration 92 ms QT/QTC P-R-T axes 396/411 ms 1/35/52 P duration 출력일시 2025-03-10 17:16 출력자 이지원 REST ECG/4* 2.5s+ 1Rhythm Interpretation Normal sinus rhythm Nonspecific ST abnormality Abnormal ECG AiTiA-LVSD Score 0.0 (Low risk) Confirmed By: EuiSeock Hwang aVR T 5 T T V4 V5 V2 aVL 원본대조필 명지병원 MY ONG HOSPIT 페이지 1/2 EKG 환자번호 진료과 01371838 환자이름 석향숙 성별/나이 여/60 주민등록번호 641020-2****** 심장내과 담당의 이지현 전자서명자 황의석 = GE MAC5K V008B(1) 25mm/s 10mm/mV 16-150Hz 60Hz aVF V3 Attending MD: 원본대조필 명지병원 출력일시 2025-03-10 17:16 출력자 이지원 페이지 2/2 MY ONG HOSPITA V6 [별지 제1호 서식] 진료비 세부산정내역 서식 (제2조제1항 관련) 진료비 세부산정내역 환자등록번호 01371838 환자성명 진료기간 병실 환자구분 비고 석향숙 2025-02-26 2025-02-26 심장내과 [건강"
        }
      ],
      "insuranceHistory": [
        {
          "period": "[보험 가입 3개월 이내]",
          "company": "제출용 비 고 「의료법」 제17조 및 같은 법 시행규칙 제9조제1항에 따라 위와 같이 진단합니다. 의료기관 명칭: 명지병원 長病明 2025년 02월 26일 전화번호 : 031) 810-5114 주소: 경기도 고양시 덕양구 화수로 14번길 55 팩스번호 : 031) 810-5190 √ 의사 [ 치과의사 한의사 상한의사 면허번호 제 103836 호 성명: 이지현 작성방법 1. 환자의 인적사항은 진찰한 의사, 치과의사 또는 한의사가 주민등록증, 기간 만료 전 여권, 운전면허증, 공무원증, 국립·공립대학 학생증, 군무원증, 건강"
        },
        {
          "period": "[보험 가입 3개월 이내]",
          "company": "제출용 발급매수 : 37 의무기록 사본 증명서 제공되는 의무기록은 석향숙님의 의료정보로 안전하게 관리하여 주시고,"
        },
        {
          "period": "[보험 가입 3개월 이내]",
          "company": "제출용 용도 외에는 이용할 수 없으며,"
        },
        {
          "period": "[보험 가입 3개월 이내]",
          "company": "제출용 목적 달성 시 즉시 파기하여 주시기 바랍니다. 첨부한 사본은 의무기록 원본과 틀림이 없음을 증명합니다. 2025 년 03 월 10 일 의료법인 명지의료재단 명지병원장 長明 三輪知 ※ 담당자 서명이 없는 것은 무효임 담당자 명지병원 MYONGJI HOSPITA 환자번호 01371838 환자이름 석향숙 진료과 심장내과 담당의 이지현 진료일자 2025-02-26 Vital Sign SBP 101 (mmHg) 외래 재진기록지 성별/나이 01/60 주민등록번호 641020-2****** 전자서명자 이지현A DBP 59 (mmHg) 맥박 74 (/min) 특이사항 퇴원-LAB, EKG,CHEST 약물알러지 있음 없음 또는 알수없음 Summary angina visit: 간헐적으로 답답하고 조여서 내원. 등도 아플때도 있었다. undelrying dz: HTN (10yr) HL (4yrs) DM (1~2yr) self med: 자디앙듀오정12.5/1000mg, 아세타졸정,알티스정480mg,아시돌연질캡슐1g,디핀스정80/5 mg, 에제로바정10/5mg,니자리딘캡슐150mg exertioanal angina occupation: 일하다가 휴직 EGD: 2024 GERD + FHX: 부친 VHD 모친 DM HTN stent never alcohol NSR 65 no cm 2025.2.12 TTE: no RWMA EF 66%, E/e' 8 dilaa 38mm Objective 주요 검사결과 2025.2.19 CAG: minimal CAD, diff. ecc. 30% LN of p-mRCA & 35-40% LN of dLCx, ergonovine provocation test positive 2025.2.19 Carotid US : 1.11/1.23 Assessment 진단명 Variant angina Coronary(artery) disease Nause with vomiting Convalescence following other treatment Hyperlipidaemia, unspecified Type 2 diabetes mellitus, without complications Plan 2025-02-26 =>>> Rosulord tab 5mg/T ((주)종근당) 1 # 1x30 2025-02-26 → Isotril ER tab.60mg/T (코오롱제약(주)) 1 # 2x30 출력일시 2025-03-10 17:16 출력자 이지원 원본대조필 페이지 1/2 명지병원 NYONGI MOSPITAL 환자번호 01371838 진료과 심장내과 환자이름 석향숙 담당의 이지현 2025-02-26 CBC with Diff = => 2025-02-26 BUN, Urea Nitrogen 2025-02-26 Creatinine (serum) => 2025-02-26 Electrolyte 3종 = 2025-02-26 ⇒ ALP = 2025-02-26 AST[SGOT] => 2025-02-26 ALT[SGPT] = 2025-02-26 Y-GT = 2025-02-26 ⇒ CK = 2025-02-26 T.Cholesterol 2025-02-26 => Triglyceride 2025-02-26 HDL-Cholesterol 2025-02-26 LDL-Cholesterol 2025-02-26 Uric acid (serum) 2025-02-26 Glucose(Serum) = 2025-02-26 CRP(hs-CRP) 기존약에 상기약제 복용 1개월후 약제 all change 출력일시 2025-03-10 17:16 출력자 이지원 외래 재진기록지 성별/나이 04/60 주민등록번호 641020-2****** 전자서명자 이지현A 작성의 이지현 원본대조필 ?명지병원 페이지 2/2 단기 입원기록지 환자번호 01371838 진료과 심장내과 환자이름 석향숙 성별/나이 여/60 주민등록번호 담당의 이지현 전자서명자 이지현A 입원일자 2025-02-19 입원과 심장내과 입원의사 이지현 퇴원일자 2025-02-19 퇴원과 심장내과 퇴원의사 이지현 최종진단명 구분 확진 질병코드 진단명 주진단명 1200 Unstable angina 처치명 시행일자 시행과 처치명 2025-02-19 CARDIC CATH 2025-02-19 심장내과 관상동맥 조영촬영 Coronary Angiography 관상동맥 조영촬영 Coronary Angiography 입원기록 요약 및 퇴원시 환자상태 주호소 주호소 for CAG Onset 내원당일 과거력 ㅁ없음 ㅁ모름 ODM OHTN OTB Hepatitis Hyperlipidemia □뇌혈관질환 ㅁ심혈관질환 ㅁ수술력 현재 병력 기타알러지 ■기타하기기재 undelrying dz: HTN (10yr) HL (4yrs) DM (1~2yr) diagsnotic CAG 시행 위하여 DCC 내원함. 신체검사 CE Wnl 경과 및 치료과정 undelrying dz: HTN (10yr) HL (4yrs) DM (1~2yr) diagsnotic CAG 시행 위하여 DCC 내원함. 출력일시 2025-03-10 17:16 출력자 이지원 원본대조필 페이지 1/4 641020-2****** 명지병원 MYONGI ROSPITA 환자번호 진료과 심장내과 01371838 환자이름 석향숙 담당의 이지현 단기 입원기록지 성별/나이 여/60 주민등록번호 641020-2****** 전자서명자 이지현A 2025.2.19 CAG: minimal CAD, diff. ecc. 30% LN of p-mRCA & 35-40% LN of dLCx, ergonovine provocation test positive 2025.2.19 Carotid US: 1.11/1.23 Lab 검사결과 [2025-02-19] Calcium: 8.8 [2025-02-19] I. phosphorus: 3.2 [2025-02-19] Glucose: 104 [2025-02-19] BUN: ↑ 29.2 [2025-02-19] Creatinine : 0.73 [2025-02-19] eGFR (CKD-EPI): 89.8 [2025-02-19] Uric Acid : 3.2 [2025-02-19] T. Protein : 6.5 [2025-02-19] Albumin : 4.5 [2025-02-19] T.Bilirubin : 0.98 [2025-02-19] ALP : 90 [2025-02-19] AST (SGOT): 16 [2025-02-19] y-GT: 14 [2025-02-19] ALT (SGPT): 19 [2025-02-19] CRP: 0.07 [2025-02-19] Na: 142 [2025-02-19] K: 4.0 [2025-02-19] Cl: 1 111 [2025-02-19] CO2 : 23 [2025-02-19] CK: 53 [2025-02-19] CK-MB : 0.4 [2025-02-19] high-sensitivity Troponin 1: < 2.51 [2025-02-19] NT-proBNP ↑ 128.00 [2025-02-19] WBC Count: 8.6 [2025-02-19] RBC Count: 4.5 [2025-02-19] Hemoglobin: 13.1 [2025-02-19] Hematocrit : 40.9 [2025-02-19] Platelet Count : 178 [2025-02-19] MCV : 91.7 [2025-02-19] MCH: 29.4 [2025-02-19] MCHC: 32.0 [2025-02-19] RDW : 13.3 출력일시 2025-03-10 17:16 출력자 이지원 원본대조필 명지병원 페이지 2/4 환자번호 진료과 심장내과 01371838 환자이름 석향숙 담당의 이지현 [2025-02-19] PDW : 9.7 [2025-02-19] MPV : 9.1 단기 입원기록지 [2025-02-19] PCT: 10.160 [2025-02-19] Segmented neutrophil%: 74.0 [2025-02-19] Lymphocyte%: 20.0 [2025-02-19] Monocyte%: 4.8 [2025-02-19] Eosinophil%: 1.1 [2025-02-19] Basophil% : 0.1 성별/나이 04/60 주민등록번호 전자서명자 이지현A [2025-02-19] NRBC : 0.0 [2025-02-19] Lymphocyte# : 1.71 [2025-02-19] Monocyte# : 0.41 [2025-02-19] Eosinophil#: 0.09 [2025-02-19] Basophil# : 0.01 [2025-02-19] (ANC) neutrophil(Segmented,Band) : 6.35 [2025-02-19] D-Dimer : 0.31 퇴원약 약품코드 약품명 용법 용량 횟수 일수 JTNTG Nitroglycerin tab.0.6mg/T (명문 제약(주)) 의사 지시대로 복용 1 1 4 Nitrolingual spray 0.4mg*1회당/ JENTGLS 의사지시대로 1 1 1 14.4ml/BT ((주)한국유니팜) JTROSU Rosulord tab 5mg/T ((주)종근당) 1일 1회 아침식후 30분에 복 용하세요 1 1 10 UTIST6 Isotril ER tab.60mg/T (코오롱제 1일 2회 아침, 저녁식후 30분 약(주)) 1 2 10 에 복용하세요 퇴원형태 퇴원지시후 환자상태 및 진료결과 호전 추후치료계획 외래진료 ○추후 재입원 ○타병원진료 ○가정간호 ㅇ치료종결 외래예약정보 외래예약일 2025-02-28 진료과 주치의 심장내과 이지현 퇴원계획 퇴원예정일 2025-02-19 퇴원 후 치료식이 여부 No ○Yes 추후관리계획 사회 복지서비스 연계 필요성 No 외래 ○가정간호 ○타병원 전원 호스피스 OYes 퇴원 후 거주장소 자가 사회복지시설 ○기타 출력일시 2025-03-10 17:16 출력자 이지원 원본대조필 페이지 3/4 641020-2****** 명지병원 환자번호 01371838 환자이름 석향숙 진료과 심장내과 담당의 이지현 담당의사 이지현 단기 입원기록지 성별/나이 01/60 주민등록번호 전자서명자 이지현A 담당교수 이지현 641020-2****** 원본대조필 명지병원 출력일시 2025-03-10 17:16 출력자 이지원 페이지 4/4 환자번호 진료과 심장내과 01371838 환자이름 석향숙 담당의 이지현 2025-02-19 처방일자 의사지시기록 순번 처방일시 의사지시기록지 성별/나이 01/60 주민등록번호 641020-2****** 전자서명자 이지현 D/C 반납 의사 지시 내용 처방량 처방의 구분 구분 2025-02-19 08 Macperan(맥페란) inj.10mg/2ml/A (1A#1 동화약품(주)) :43:22 2 3 1 2025-02-19 08 Aceta inj.1g/100ml/Bag ((주)비보존 1 BAG # 1 :43:22 제약) * 1 2025-02-19 080.9% NS 50ml/BT (제이더블유생명 1BT#1 :43:22 과학(주)) 1 2025-02-19 08 Tridol inj.100mg/2ml/A ((주)유한양 0.5 A # 1 행) 4 :43:22 1 2025-02-19 08 1A#1 5 Lasix inj.20mg/2ml/A ((주)한독) :43:22 6 7 이지현 이지현 * 이지현 * 이지현 이지현 2025-02-19 08 Tridol inj.100mg/2ml/A ((주)유한양 1A#1 :43:22 행) 1 2025-02-19 08 0.9% NS inj.100ml/bag (제이더블유 1 BAG # 1 :43:22 생명과학(주)) 1 * 이지현 이지현 2025-02-19 08 8 Denogan inj.1g// (영진약품(주)) 1V#1 1 이지현 :43:22 2025-02-19 08 0.5 A # 1 * 9 Lasix inj.20mg/2ml/A ((주)한독) 이지현 :43:22 1 10 2025-02-19 080.9% NS inj.100ml/bag (제이더블유 1 BAG # 1 :43:22 생명과학(주) * 1 2025-02-1908 Apidra inj.1000IU/10ml/N ((주)사노 10 IU # 1 피-아벤티스코리아) 이지현 * 11 이지현 :43:23 1 12 2025-02-19 08 Apidra inj.1000IU/10ml/V ((주)사노 6 IU # 1 :43:23 피-아벤티스코리아) * 이지현 1 13 :43:23 2025-02-1908 Apidra inj.1000IU/10ml/N ((주)사노 4 IU#1 피-아벤티스코리아) * 이지현 1 14 2025-02-19 08 Apidra inj.1000IU/10ml/N ((주)사노 2IU#1 :43:23 피-아벤티스코리아) * 이지현 1 15 2025-02-19 080.9% NS 50ml/BT (제이더블유생명 :43:23 과학(주)) 1 BT #1 * 이지현 1 16 :43:23 17 생명과학(주)) 18 2025-02-19 08 Binicapin(소) inj.5mg/5ml/A ((주)비 2MG #1 씨월드제약) 2025-02-19 080.9% NS inj.100ml/bag (제이더블유 80 ML # 1 :43:23 2025-02-1908 Binicapin(대) inj.20mg/20ml/A ((주)1A #1 이지현 이지현 * 1 * 1 출력일시 2025-03-10 17:16 출력자 이지원 원본대조필 페이지 1/4 * 이지현 명지병원 의사지시기록지 환자번호 01371838 진료과 심장내과 환자이름 석향숙 담당의 이지현 성별/나이 04/60 주민등록번호 전자서명자 이지현 :43:23 비씨월드제약) 1 19 :43:23 2025-02-19 08 Peniramine inj.4mg/2ml/A ((주)유한 1A#1 양행) * 이지현 1 * 20 이지현 21 22 :44:39 23 :44:39 2025-02-19 08Apidra inj.1000IU/10ml/V ((주)사노 8IU#1 :43:23 피-아벤티스코리아) 1 2025-02-19 080.9% NS inj.100ml/bag (제이더블유 1BAG #1 :43:23 생명과학(주)) 1 2025-02-19 080.9% NS 1000ml/bag(중외) (제이더 1 BAG #1 블유생명과학(주)) 1 2025-02-19 08 Muteran(대-뮤테란) inj.600mg/6ml/2A #2 A (한화제약(주)) * 이지현 이지현 이지현 1 CAG 전후 2025-02-1908 관상동맥 조영촬영 Coronary Angio 24 1 * 1 * 1 이지현 :44:39 graphy 2025-02-19 08 25 Portable EKG 1 * * 이지현 :44:39 2025-02-19 08 26 CRP(hs-CRP) 1 1 1 이지현 :44:39 2025-02-19 08 27 27 NT-proBNP 1 1 * 1 이지현 :44:39 2025-02-19 08 28 D-Dimer * 1 * 이지현 :44:39 2025-02-19 08 29 High-Sensitivity Troponin I (TNIH) 1 * 1 * 1 이지현 :44:39 2025-02-19 08 30 CK-MB 1 1 * 1 이지현 :44:39 2025-02-19 08 31 CK 1 * 1 * 1 이지현 :44:39 32 32 2025-02-19 08 Y-GT 1 * 1 * 1 이지현 :44:39 2025-02-19 08 33 ALT[SGPT] 1 * 1 * 1 이지현 :44:39 2025-02-19 08 34 AST[SGOT] 1 1 * 1 이지현 :44:39 2025-02-19 08 35 ALP 1 1 * 1 이지현 :44:39 2025-02-19 08 36 T. Bilirubin (serum) 1 * 1 * 1 이지현 :44:39 2025-02-19 08 37 Uric acid (serum) 1 * 1 * 1 이지현 :44:39 출력일시 2025-03-10 17:16 출력자 이지원 원본대조필 페이지 2/4 641020-2****** ?명지병원 의사지시기록지 환자번호 01371838 진료과 심장내과 환자이름 석향숙 담당의 이지현 성별/나이 01/60 주민등록번호 전자서명자 이지현 2025-02-19 08 38 T. Protein (serum) 1 * * 이지현 :44:39 2025-02-19 08 39 Glucose(Serum) 1 1 1 이지현 :44:39 2025-02-19 08 40 40 Albumin (serum) 1 * 1 * 1 이지현 :44:39 2025-02-19 08 41 1.Phos (serum) * 1 * 1 이지현 :44:39 2025-02-19 08 42 Calcium (serum) 1 * 1 * 1 이지현 :44:39 2025-02-19 08 43 Electrolyte 4종 1 1 * * 1 이지현 :44:39 2025-02-19 08 44 Creatinine (serum) * 1 * 1 이지현 :44:39 2025-02-19 08 45 45 BUN, Urea Nitrogen 1 * 1 * 1 이지현 :44:39 2025-02-19 08 46 CBC with Diff 1 * * 1 이지현 :44:39 2025-02-19 10 47 US-Carotid Artery 1 1 1 이지현 :48:54 2025-02-19 11 48 Gluco-Stick Test 1 * 1 * 1 이지현 :08:34 2025-02-19 11 49 49 EKG 심전도 * 1 * 1 이지현 :26:35 2025-02-19 11 50 High-Sensitivity Troponin I (TNIH) * 1 1 1 * 이지현 :26:35 2025-02-19 11 51 BUN, Urea Nitrogen 1 * 1 * 1 이지현 :26:35 2025-02-19 11 42 52 CK * 1 * 1 이지현 :26:35 2025-02-19 11 53 NT-proBNP * * 1 이지현 :26:35 2025-02-19 11 54 CRP(hs-CRP) 1 * 1 * 1 이지현 :26:35 2025-02-19 11 55 Electrolyte 3종 1 1 * 1 이지현 :26:35 2025-02-19 11 56 Creatinine (serum) 1 * 1 * 1 이지현 :26:35 57 2025-02-19 11 Chest PA 1 1 * * 1 이지현 출력일시 2025-03-10 17:16 출력자 이지원 원본대조필 페이지 3/4 641020-2****** 명지병원 MYONGIKOSPITAL 환자번호 진료과 심장내과 01371838 환자이름 석향숙 담당의 이지현 의사지시기록지 성별/나이 여/60 주민등록번호 전자서명자 이지현 :26:35 2025-02-19 11 58 CBC with Diff 1 * 1 * 1 이지현 :26:35 2025-02-19 11 59 CK-MB 1 * 1 * 1 이지현 :26:35 60 :07:59 2025-02-19 14 Nitroglycerin tab.0.6mg/T (명문제 1T#1 약(주)) 2025-02-19 14 Nitrolingual spray 0.4mg*1회당/14.4 1 BT # 1 * 4 이지현 SIGT1 61 이지현 :07:59 ml/BT ((주)한국유니팜) 1 SIGE 2025-02-19 14 1T#1 * 1 62 Rosulord tab 5mg/T ((주)종근당) 이지현 :08:24 0 QDPC 63 :08:24 )) 2025-02-19 15 64 :24:23 1 :44:39 2 2025-02-19 14|sotril ER tab.60mg/T (코오롱제약(주1T#2 *1 Discharge (퇴원합니다) 2025-02-19 08처치지시 입원:1일:V/S TIME:q 8hr, B ST TIME:1 times 2025-02-19 14 처치지시 퇴원(외출)약/기존 지참약 유지하면서 퇴원약 :07:59 2025-02-19 14 처치지시 퇴원(외출)약/자디앙듀오 2 :07:59 1일 후 부터 복용합니다. 이지현 이지현 이지현 이지현 0 BIDPC 1 * * 1 이지현 처치지시 퇴원(외출)약/*NTG: chest 2025-02-19 14 3 :07:59 pain 발생시 1T SL 10분간격 최대 2 회 출력일시 2025-03-10 17:16 출력자 이지원 이지현 641020-2****** 원본대조필 명지병원 페이지 4/4 1일 입원실 간호기록지 (Daycare Center) 환자번호 진료과 심장내과 01371838 환자이름 석향숙 담당의 이지현 성별/나이 01/60 주민등록번호 641020-2****** 전자서명자 이지영 입원일자 2025-02-19 일반정보 입원경로 Ambulatory OWheel chair OCart 입원시 동반자 ㅇ없음 가족 ㅇ기타 입원시 교육 입원시 준비물품 1입원시 생활안내문 설명 ?가스 전열기구 사용금지 및 화재방지 ■환자권리장전 및 환자 책임에 대하여 설명 ㅣ금연교육 함 귀중품 관리 및 도난방지 [쓰레기 분리수거 린넨관리 1주차관리 약물알러지 있음 )없음 또는 알수없음 기타알러지 음식 없음 있음 기타 없음 있음 약품 입원직전 복용하던 약 ㅇ없음 있음타원 HTN, HL 현재 가지고 온약 ) 없음 있음 입원일시 2025-02-19 08:36 신장 164 (cm) 체중 77 (Kg) BMI 28.6(kg/m²) 직업 회사원 입원동기 주증상 For CAG 과거병력 ㅁ없음 ㅣ고혈압 당뇨 간염 ■기타 HL 활력징후 날짜 시간 SBP DBP 체온 맥박 호흡 2025-02-19 09:00 147 82 36.3 52 20 20 11:05 163 87 36.2 59 20 11:40 150 78 36.2 60 20 1. 통증사정도구 NRS OFPRS OFLACC Ⅲ. 통증양상 1. 쑤시는 듯한 2. 날카로운 3. 짓누르는 4. 타는 듯한 5. 욱신욱신 쑤심 6. 쥐어짜는 듯한 7. 바늘로 찌르는 듯한 8. 콕콕 쑤시는 9. 따끔거림 10. 화끈거림 출력일시 2025-03-10 17:16 출력자 이지원 원본대조필 페이지 1/3 명지병원 MYONGIKOSPITAL 1일 입원실 간호기록지 (Daycare Center) 환자번호 진료과 심장내과 01371838 환자이름 석향숙 담당의 이지현 Ⅲ. 비약물 중재 성별/나이 01/60 주민등록번호 641020-2****** 전자서명자 이지영 마사지, 지압, 냉찜질, 온찜질, 심호흡, 이완요법, 심상요법, 전환요법 (영화감상, TV시청, 음악감상, 산책 등) 평가일시 강도 위치 양상 빈도 지속시간 중재(약물 또는 비약물) 간호사 이도윤(D 초기평가 02-19 08:45 0 CC) 이도윤(D 재평가 02-19 11:05 0 CC) 재평가 재평가 재평가 재평가 재평가 날짜 시간 간호기록 간호사 2025-02-19 08:45 외래 통해 걸어서 입원함 CA안슬기에게 알림 금식, 속옷, 장신구 제거 확인함 금일 아침 약 복용 유무 확인함 \"그저께 NTG 복용했어요.\" 이도윤(DC 보호자 같이 내원했는지 확인함 이도윤(DC 09:06 portable EKG 시행함 이도윤(DC 09:20 Full voiding 후 CAG위해 이동침대로 심혈관촬영실감 C) 11:05 CAG 시행후 이동침대로 병실복귀함 식이 가능함을 설명함 Rt.radial CAG site compression set Rt.finger's s ense, motor 양호함 사정 : 금일 CAG 시행함 계획 및 수행 : CAG 부위 관찰함 계획 및 수행 : 출혈즉시 간호사에게 말하도록 교육함 계획 및 수행: 침상안정해야 함을 설명함 이도윤(DC 계획 및 수행 : 검사 및 시술 후 주의사항 안내문을 지급함 출력일시 2025-03-10 17:16 원본대조필 출력자 이지원 페이지 2/3 명지병원 MYONGJI KOSITA 1일 입원실 간호기록지 (Daycare Center) 환자번호 01371838 환자이름 석향숙 진료과 심장내과 담당의 이지현 성별/나이 04/60 주민등록번호 641020-2****** 전자서명자 이지영 11:06 V/S 163/87-59-36.2 \"머리가 조금 아파요\"CA안슬기에게 알 이도윤(DC 림 C) 이도윤(DC 11:35 평가: CAG 부위 출혈없음 C) 이도윤(DC 11:40 V/S 150/78-36.2-60-20 측정됨을 CA안슬기에게 알림 C) 이도윤(DC 13:35 US-Carotid Artery위해 심초음파실 이동함. 이지영(DC) 14:20 병실복귀함 이지영(DC 15:03 CAG site bleeding,hematoma 없이 침상안정 중임 15:25 Rt.radial CAG site compression Dressing 시행함 by CA안 이도윤(DC 슬기 C) 15:38 퇴원 후 압박 Dressing 제거 시간 설명함 퇴원 후 주의사항 설명함 익일 CAG site 소독방법 설명함 이지영(DC 퇴원약 지급하고 외래예약/ 외래검사 설명함 이지영(DC 15:40 보호자와 함께 걸어서 퇴원함 출력일시 2025-03-10 17:16 출력자 이지원 원본대조필 명지병원 페이지 3/3 환자번호 진료과 심장내과 01371838 환자이름 석향숙 담당의 이지현 임상화학검사(일반) 성별/나이 04/60 주민등록번호 641020-2***** 전자서명자 조해원 등록번호 01371838 진료과 심장내과 검사자 N/A 환자명 석향숙 성별/나이F/60 의뢰의사 이지현 병동 DCC/DCC 확인의사 조해원 검체명 Serum, SST 진단명 Unstable angina 처방일시 2025-02-19 08:44 접수일시 2025-02-19 09:06 보고일시 2025-02-19 09:58 검체번호 20250219A00467 0 검사 결과 검사명 결과 H/L 참고치 단위 Calcium 8.8 8.7 10.4 mg/dL 1. phosphorus 3.2 2.4 5.1 mg/dL Glucose 104 73 106 mg/dL BUN 29.2 H 9 23 mg/dL Creatinine 0.73 0.5 1.1 ~ mg/dL mL/min/1.7 ...eGFR (CKD-EPI) 89.8 > 60.0 3m2 Uric Acid 3.2 3.0 7.0 mg/dL T. Protein 6.5 5.7 2 8.2 g/dL Albumin 4.5 ~ 3.2 4.8 g/dL T. Bilirubin 0.98 0.30 ~ 1.20 mg/dL ALP 90 ~ 46 116 U/L AST (SGOT) 16 < 34 U/L ALT (SGPT) 19 10 49 U/L Y-GT 14 < 38 U/L Na 142 ~ 132 146 mmol/L Electrolyte (4종) K 4.0 3.5 5.5 mmol/L Cl 111 H 99 109 mmol/L CO2 23 20 31 mmol/L CK 53 40 ~ 235 U/L CK-MB 0.4 <= 5 ng/mL high-sensitivity Troponin I < 2.51 < 38.64 pg/mL NT-proBNP 128.00 H <125 pg/mL 출력일시 2025-03-10 17:16 원본대조필 명지병원 출력자 이지원 페이지 1/1 CAG 환자번호 01371838 환자이름 석향숙 진료과 심장내과 담당의 이지현 성별/나이 여/60 전자서명자 주민등록번호 641020-2****** CAG MYONGJI HOSPITAL Coronary Angiography & PCI Report Date: 2025.19 Age/Sex: 60 ( ) M (4) F Cath. No : Name: : Hos. ID 1471836 Clinical Diagnosis: No unstable signa ~ Vent Ref. Dr. : Puncture Site Femoral Operator: Rt.( ) Lt. ( ) 01 시현 Radial Rt.Lt. ( ) Others Cardiogenic shock: Y( ) N( CHF : Y( ) Nex 2 Ar shorth Rt dominant coronary artery AGA ZJR 4-x upto drt.co. 30x wf parked 014 Conclusion: Comments: 출력일시 2025-03-10 17:16 출력자 이지원 PILO S LGA2744-35 .diff. ea. upho крашенню 13: Ang Poppins provocanter text & Voca 85 Vasspor ··RCA As well. Variant anjha Mrinal CAD Medical Textment Cardiac Catheterization Laboratory 7697-24 Tel: 031-810-6776, 6786 원본대조필 페이지 1/1 0/2/82 명지병원 환자번호 진료과 심장내과 01371838 환자이름 석향숙 담당의 이지현 CA ECHO검사 Exam Date 2025-02-19 Patient ID: 01371838 Location: DCC Height: cm Comments RT- CA ECHO검사 성별/나이 여/60 주민등록번호 전자서명자 서용성 ECHOCARDIOGRAPHY LABORATORY MYONGJIHOSPITAL Carotid Duplex Ultrasound Report Weight: Echo No.: 25 - 02 Name: 석향숙 Referring Dr.: 0 Sex/Age: F Referral Reason: Subclinical atherosclerosis screening BSA: m2 BP: kig LT 060Y /mmHg 1. Significant thickened IMT (far wall: 1.11mm) in Rt proximal CCA without significant stenotic flow & Significant thickened IMT(far wall: 1.07mm) in Rt distal CCA without significant stenotic flow. Carotid IMT(CCA) Right CCA 1. Significant thickened IMT (far wall: 1.09mm) in Lt distal CCA without significant stenotic flow. 2. Mild homogeneous plaque(far wall:1.23mm) in Lt proximal CCA without significant stenotic flow. Left CCA ICA ECA CCA R ICA ECA CCA MAX IMT Rt far wall prox: 1.11 mm Lt far wall prox: mm Rt far wall dist 1.07 mm Lt far wall dist: 1.09 mm Carotid Plaque Absence Single Multiple Location & Size CR: CCA R: ICA CRt bulb Morphology Echogenecity: Texture: Hyperechoic Homogenous Surface feature: Smooth Calcification: Present Doppler Study mm DL: CCA 1.23 mm mm DL: ICA mm mm CLt bulb mm CEchogenic Heterogenous Dirregular Absent Hypoechoic Acoustic Shadowing Right PSV (cm/sec) Right EDV (cm/sec) Left PSV (cm/sec) Left EDV (cm/sec) CCA proximal 73.8 7.2 88.3 17 CCA distal 64.8 10.2 84.9 109 ICA 46.8 15.1 56.4 174 ICA/CCA ratio 0.63 2.10 0.64 1.02 ECA 76.3 8.06 52.2 3 Vertebral artery 23.1 541 23.4 1.2 Confirmed by: 488 (62830) Sonographer: 김승아 Responsible Dr.: 18(81700) 출력일시 2025-03-10 17:16 원본대조필 출력자 이지원 페이지 1/2 641020-2****** 명지병원 MYONGJI HOSPITA炭 환자번호 01371838 환자이름 석향숙 진료과 심장내과 담당의 이지현 출력일시 2025-03-10 17:16 출력자 이지원 CA ECHO검사 성별/나이 01/60 주민등록번호 641020-2****** 전자서명자 서용성 원본대조필 명지병원 페이지 2/2 EKG 환자번호 진료과 심장내과 01371838 환자이름 석향숙 성별/나이 여/60 주민등록번호 641020-2****** 담당의 이지현 전자서명자 황의석 EKG REST ECG/4* 2.5s+ 1Rhythm S HS Patient ID: 01371838 2025/02/19 09:18:36 60YEARS Vent. Rate 48 bpm PR interval 172 ms QRS duration 104 ms Interpretation Sinus bradycardia Otherwise normal ECG QT/QTC P-R-T axes 430/384 ms -6/38/50 AiTiA-LVSD Score 0.1 (Low risk) P duration Confirmed By: EuiSeock Hwang aVR V1 V4 || aVL V2 V5 2025-03-10 17:16 출력일시 출력자 이지원 원본대조필 명지병원 페이지 1/2 h h EKG 환자번호 01371838 환자이름 석향숙 성별/나이 여/60 진료과 심장내과 담당의 이지현 전자서명자 황의석 = GE MAC5K V008B(1) 25mm/s 10mm/mV 16-150Hz 60Hz 출력일시 2025-03-10 17:16 출력자 이지원 aVF 주민등록번호 641020-2****** V3 Attending MD: 원본대조필 명지병원 페이지 2/2 MY ON GAI HOSPIT la h 'V6 환자번호 진료과 심장내과 01371838 환자이름 석향숙 담당의 이지현 임상화학검사(일반) 성별/나이 여/60 주민등록번호 641020-2****** 전자서명자 조해원 등록번호 01371838 진료과 심장내과 검사자 N/A 처방일시 2025-02-19 15:47 환자명 석향숙 성별/나이 F/60 의뢰의사 이지현 병동 확인의사 조해원 검체명 Serum, SST 진단명 Variant angina 접수일시 2025-02-26 10:56 보고일시 2025-02-26 11:41 검체번호 20250226A00712 0 검사 결과 검사명 결과 H/L 참고치 단위 BUN 22.7 9 23 mg/dL Creatinine 0.89 0.5 1.1 mg/dL mL/min/1.7 ....eGFR (CKD-EPI) 70.7 > 60.0 3m2 Na 141 2 132 146 mmol/L Electrolyte (3종) K 4.1 ~ 3.5 5.5 mmol/L Cl 108 99 109 mmol/L CK 57 40 235 U/L CK-MB 0.8 <= 5 ng/mL high-sensitivity Troponin I <2.51 < 38.64 pg/mL NT-proBNP 62.00 <125 pg/mL 출력일시 2025-03-10 17:16 출력자 이지원 원본대조필 명지병원 페이지 1/1 일반촬영검사 판독결과지 환자번호 01371838 진료과 심장내과 환자이름 석향숙 성별/나이 여/60 주민등록번호 담당의 임정기 전자서명자 임정기 처방일자 2025/02/19 촬영일자 2025/02/26 판독일자 2025/02/26 판독의(1) N/A 판독의(2) 임정기 전사자 N/A 소견 Chest PA(2025-02-19 00:00:00) Within normal limits. 출력일시 2025-03-10 17:16 출력자 이지원 원본대조필 페이지 1/1 641020-2****** 명지병원 EKG 환자번호 01371838 환자이름 석향숙 성별/나이 여/60 주민등록번호 641020-2****** 진료과 심장내과 담당의 이지현 전자서명자 황의석 EKG SHS Patient ID: 01371838 2025/02/26 11:11:57 60YEARS Vent. Rate 63 bpm PR interval 168 ms QRS duration QT/QTC P-R-T axes P duration 94 ms 398/407 ms 4/42/46 2025-03-10 17:16 출력일시 출력자 이지원 aVR aVL 원본대조필 페이지 1/2 REST ECG/4* 2.5s+ 1Rhythm Interpretation Normal sinus rhythm Normal ECG AiTiA-LVSD Score 0.1 (Low risk) Confirmed By: EuiSeock Hwang r 명지병원 M? ONG HOSPITA 나나무 V5 h EKG 환자번호 01371838 환자이름 진료과 심장내과 담당의 석향숙 이지현 성별/나이 여/60 주민등록번호 641020-2****** 전자서명자 황의석 GE MAC5K V008B(1) 25mm/s 10mm/mV 16-150Hz 60Hz 출력일시 2025-03-10 17:16 출력자 이지원 aVF Attending MD: 원본대조필 명지병원 MY ONG II HOSPIT 페이지 2/2 ? V6 환자번호 01371838 진료과 심장내과 담당의 환자이름 석향숙 이지현 진료일자 2025-02-12 Vital Sign 외래 재진기록지 성별/나이 01/60 주민등록번호 641020-2****** 전자서명자 이지현A SBP 124 (mmHg) DBP 70 (mmHg) 맥박 78/min) 특이사항 LAB,TTE 약물알러지 있음 없음 또는 알수없음 Summary angina visit: 간헐적으로 답답하고 조여서 내원. 등도 아플때도 있었다. undelrying dz: HTN (10yr) HL (4yrs) DM (1~2yr) self med: 자디앙듀오정12.5/1000mg, 아세타졸정,알티스정480mg, 아시돌연질캡슐1g, 디핀스정80/5 mg, 에제로바정10/5mg, 니자리딘캡슐150mg exertioanal angina occupation: 일하다가 휴직 EGD: 2024 GERD + FHX: 부친 VHD 모친 DM HTN stent never alcohol NSR 65 no cm Objective 주요 검사결과 HbA1c 6.1 lipid 155/139/50/83 glc 91 CE wnl NT-proBNP 55 2025.2.12 TTE 1. No RWMA. 2. Normal sized cardiac chambers with normal LV systolic function (EF: 66%). 3. Relaxation abnormality of LV filling pressure (E/e': 8). 4. Concentric remodeling. 5. Dilated ascending aorta (38mm). Assessment 진단명 Chest pain (unspecified) Hypertensive heart disease NOS Type 2 diabetes mellitus, without complications Plan 2025-02-12 → Nitroglycerin tab.0.6mg/T (명문제약(주)) 1 # 1x4 출력일시 2025-03-10 17:16 출력자 이지원 원본대조필 페이지 1/2 명지병원 외래 재진기록지 환자번호 01371838 진료과 심장내과 환자이름 석향숙 담당의 이지현 성별/나이 01/60 주민등록번호 전자서명자 이지현A 2025.2.19 DCC adm. for diagsnotic CAG jardiance duo 2일전부터 skip 출력일시 2025-03-10 17:16 출력자 이지원 작성의 이지현 641020-2****** 원본대조필 명지병원 페이지 2/2 환자번호 01371838 진료과 심장내과 환자이름 석향숙 담당의 이지현 진료일자 2025-02-05 외래 초진기록지 성별/나이 여/60 주민등록번호 641020-2****** 전자서명자 이지현A 휴대폰 01031785794 주소 (230-19)인천 강화군 송해면 전망대로 127-42 신장 164 (cm) 체중 79 (Kg) BMI 29.3 (kg/m²) Vital Sign SBP 124 (mmHg) DBP 70 (mmHg) 맥박 78 (/min) 특이사항 신환 가슴통증, 답답 약- 자디앙듀오정12.5/1000mg,아세타졸정,알티스정480mg, 아시돌연질캡슐1ug, 디핀스 정80/5mg,에제로바정10/5mg, 니자리딘캡슐150mg EKG,CHEST 약물알러지 있음 없음 또는 알수없음 통증평가 ㅇ유 ○평가불가 - 사유 : 현재 병력 angina visit: 간헐적으로 답답하고 조여서 내원. 등도 아플때도 있었다. undelrying dz: HTN (10yr) HL (4yrs) DM (1~2yr) self med: 자디앙듀오정12.5/1000mg,아세타졸정,알티스정480mg,아시돌연질캡슐1g,디핀스정80/5 mg,에제로바정10/5mg, 니자리딘캡슐150mg exertioanal angina occupation: 일하다가 휴직 EGD: 2024 GERD + 가족력 ONO 사회력 주요 검사결과 NSR 65 no cm 진단명 주진단명 Yes 부친 VHD 모친 DM HTN stent Smokingnever Drinkingnever Chest pain (unspecified) Hypertensive heart disease NOS 진단명 Type 2 diabetes mellitus, without complications 구분 확진 기타진단명 기타진단명 치료계획 2025-02-05 = = CBC with Diff 출력일시 2025-03-10 17:16 출력자 이지원 원본대조필 명지병원 페이지 1/3 환자번호 진료과 심장내과 01371838 환자이름 석향숙 담당의 이지현 2025-02-05 => PT 2025-02-05 ⇒ aPTT 2025-02-05 Calcium (serum) = 2025-02-05 1.Phos (serum) 2025-02-05 BUN, Urea Nitrogen 2025-02-05 Creatinine (serum) 2025-02-05 Glucose (Serum) 2025-02-05 T. Protein (serum) = 2025-02-05 Albumin (serum) 2025-02-05 2025-02-05 2025-02-05 = Uric acid (serum) T.Cholesterol T. Bilirubin (serum) 2025-02-05 ⇒ ALP 2025-02-05 = AST[SGOT] 2025-02-05 → ALT[SGPT] 2025-02-05 ⇒ CK => 2025-02-05 ⇒ Hb A1c 2025-02-05 Triglyceride = 2025-02-05 = HDL-Cholesterol 외래 초진기록지 2025-02-05 LDL-Cholesterol 2025-02-05 Electrolyte 3 = 2025-02-05 ⇒ Free T4 = 2025-02-05 ⇒ TSH = 2025-02-05 => Routine U/A with Micro 2025-02-05 → CRP(hs-CRP) 2025-02-05 = Y-GT 2025-02-05 = T. Protein (urine) 2025-02-05: ⇒ Creatinine (urine) 2025-02-05: => Microalbumin (Urine) 2025-02-05: ⇒ CK-MB 2025-02-05 => High-Sensitivity Troponin I (TNIH) 2025-02-05 = NT-proBNP 2025-02-05 ⇒ D-Dimer 2025-02-05 Chest PA, Lat (L) 2025-02-05 → EKG 심전도 2025-02-05 => [전문] 경흉부초음파 (TTE) 상기 검사 후 fu 출력일시 2025-03-10 17:16 출력자 이지원 성별/나이 01/60 주민등록번호 전자서명자 이지현A 원본대조필 페이지 2/3 작성의 이지현 641020-2****** 명지병원 환자번호 01371838 환자이름 석향숙 진료과 심장내과 담당의 이지현 출력일시 2025-03-10 17:16 출력자 이지원 외래 초진기록지 성별/나이 여/60 주민등록번호 641020-2****** 전자서명자 이지현A 원본대조필 명지병원 페이지 3/3 환자번호 01371838 진료과 심장내과 환자이름 석향숙 담당의 이지현 임상화학검사(일반) 성별/나이 01/60 주민등록번호 641020-2****** 전자서명자 조해원 등록번호 01371838 진료과 심장내과 검사자 N/A 처방일시 2025-02-05 15:02 환자명 석향숙 성별/나이 F/60 의뢰의사 이지현 병동 확인의사 조해원 검체명 Serum, SST 진단명 Chest pain (unspecified) 접수일시 2025-02-12 11:57 보고일시 2025-02-12 12:46 검체번호 20250212A00883 0 검사 결과 검사명 결과 H/L 참고치 단위 Calcium 9.0 8.7 10.4 mg/dL I. phosphorus 3.8 2.4 5.1 mg/dL Glucose 91 73 106 mg/dL BUN 19.1 9 23 mg/dL Creatinine 0.73 2 0.5 1.1 mg/dL mL/min/1.7 ...eGFR (CKD-EPI) 89.8 > 60.0 3m2 Uric Acid 3.4 3.0 7.0 mg/dL T.Cholesterol 155 < 239 mg/dL T. Protein 6.9 5.7 8.2 g/dL Albumin 4.5 3.2 4.8 g/dL T.Bilirubin 1.75 H 0.30 1.20 mg/dL ALP 101 46 116 U/L AST (SGOT) 19 < 34 U/L ALT (SGPT) 21 10 49 U/L Y-GT 16 < 38 U/L Triglyceride 139 <150 mg/dL HDL-Cholesterol 50 > 40 mg/dL LDL-Cholesterol 83 <129 mg/dL Amylase 165 H 30 ~ 118 U/L Lipase 29 12 53 U/L Na 141 ~ 132 146 mmol/L Electrolyte (3) K 4.5 3.5 5.5 mmol/L CI 109 99 109 mmol/L CK 157 40 235 U/L CK-MB 0.6 <= 5 ng/mL high-sensitivity Troponin I 3.91 < 38.64 pg/mL NT-proBNP 55.00 <125 pg/mL 출력일시 2025-03-10 17:16 원본대조필 출력자 이지원 페이지 1/2 명지병원 임상화학검사(일반) 환자번호 01371838 환자이름 석향숙 진료과 심장내과 담당의 이지현 Free T4 1.24 TSH 1.52 2025-03-10 17:16 출력일시 출력자 이지원 성별/나이 01/60 주민등록번호 전자서명자 조해원 0.89~1.76 ng/dL 0.55~4.78 ulU/mL 641020-2****** 원본대조필 명지병원 페이지 2/2 일반촬영검사 판독결과지 환자번호 01371838 진료과 심장내과 환자이름 석향숙 성별/나이 04/60 주민등록번호 담당의 박지연 전자서명자 박지연 처방일자 2025/02/05 촬영일자 2025/02/05 판독일자 2025/02/05 판독의(1) N/A 판독의(2) 박지연 전사자 N/A 소견 Chest PA, Lat (L) (2025-02-05 00:00:00) No active lung lesion 결 론 No active lung lesion 출력일시 2025-03-10 17:16 출력자 이지원 641020-2****** 원본대조필 명지병원 페이지 1/1 환자번호 진료과 심장내과 01371838 환자이름 석향숙 담당의 이지현 CA ECHO검사 CA ECHO검사 성별/나이 01/60 주민등록번호 전자서명자 서용성 Exam Date 2025-02-12 Patient ID: 01371838 Location: OPD ECHOCARDIOGRAPHY LABORATORY MYONGJI HOSPITAL Transthoracic echocardiography report Height 164.0 cm Weight 77.0 kg Echo No.: 25 2 Name: 석향숙 Referral Reason: Chest pain 1.84 m2 BSA Referring Dr.: 이지현 Sex/Age: F 1 060Y BP 124/70 mmHg HR 78 bpm 1. Comments Echo for chest pain DM, HTN, HL 1. No RWMA 2. Normal sized cardiac chambers with normal LV systolic function (EF: 66%) 3. Relaxation abnormality of LV filling pressure (E/e: 8). 4. Concentric remodeling. 5. Dilated ascending aorta (38mm). Global strain rate -19.4% 2. Regional Wall motion Abnormality: 3. Valves: 4. Regurgitation: 5. Stenosis: 6. Pericardial Effusion: No Image: No MV Native AV Native TV Native MR No Slightly thickened Senile sclerocalcified Normal AR No TR Trivial PR Trivial MS No AS No TS. No PS No No Intracardiac Thrombi: No Mass: No 7. Diastolic function: Relaxation abnormality of LV filling pattern M-mode/2D Measurement RVD1: mm RVD2 mm IVSD (8-11). IVSS: RVD3 mm LVEDD (42-54): 43 mm PWD (8-11) PWs: omom 10 mm Aortic annulus 19.0 mm 13 mm sinus of Valsalva 31.0 mm 10 mm ST Junction 27.0 mm 13 mm Ascending aorta. 38.0 mm LVESD (24-36): 28 mm LVOT (18-22) mm LA (AP/ML/SI) mm LVEF (55-76): LV Mass 142.5 g LA Vol by M-mode. 66 % LV Mass index 76.2 g/m2 by prolate ellipse ml by Biplane % RWT 0.47 by mod simpson 65 ml TV Annulus mm LA Vol index (18-28) NC mm by prolate ellipse Echo Score Doppler Measurement Total M T S C by mod simpson MV Annulus (4C/2C): 35 ml/m2 ml/m2 mm Aortic Mitral Tricuspid LVOT (TVI) 22.0 cm TVI of MR jet cm TR jet 1.54 m/sec AV (TVI) cm E (0.6-1) 0.59 m/sec RVSP 14 mmHg LVOT peak V 1.0 m/sec A (0.3.0.8) 0.67 m/sec RAP 5 mmHg PSPG/MSPG 4.1/2.4 mmHg DT (170-210) 193.51 msec MPAP mmHg AV Peak V PSPG/MSPG AVA by 2D m/sec PHT msec PVR mmHg MDPG mmHg MDPG HR /min RVOT VTL mmHg CM by continuity cm2 MVA by 2D cm2 Pulmonic PHT of AR jet RV function TAPSE msec by PHT: cm2 by continuity cm2 PSPG/MSPG RVOT AT 1 mmHg m/sec TDI S FAC TDI mm cm/sec % S 7.2 cm'sec E 7.2 cm/sec A 10.4 cm/sec EE 8 Contirmed by: 서용성 (81700) Sonographer: 조수현 Responsible Dr.: 4188(81700) 출력일시 2025-03-10 17:16 출력자 이지원 원본대조필 페이지 1/2 641020-2****** 명지병원 환자번호 01371838 환자이름 석향숙 진료과 심장내과 담당의 이지현 CA ECHO검사 성별/나이 01/60 주민등록번호 641020-2****** 전자서명자 서용성 출력일시 2025-03-10 17:16 출력자 이지원 원본대조필 페이지 2/2 명지병원 MYONGI HOSPITA 환자번호 진료과 심장내과 01371838 환자이름 석향숙 담당의 이지현 CA ECHO검사 CA ECHO검사 성별/나이 01/60 주민등록번호 전자서명자 서용성 Exam Date 2025-02-12 Patient ID: 01371838 Location: OPD ECHOCARDIOGRAPHY LABORATORY MYONGJI HOSPITAL Transthoracic echocardiography report Echo No.: 25 2 Name: 석향숙 Referral Reason: Chest pain Referring Dr.: 이지현 Sex/Age: F / 060Y Height 164.0 cm Weight 77.0 kg BSA 1.84 m2 1. Comments Echo for chest pain : DM, HTN, HL 1. No RWMA. 2. Normal sized cardiac chambers with normal LV systolic function (EF: 66%). 3. Relaxation abnormality of LV filling pressure (E/e: 8). 4. Concentric remodeling. 5. Dilated ascending aorta (38mm). * Global strain rate: -19.4% 2. Regional Wall motion Abnormality: 3. Valves: 4. Regurgitation: 5. Stenosis: 6. Pericardial Effusion: 7. Diastolic function: BP 124/70 mmHg HR 78 bpm No Image: No MV AV Native Native Slightly thickened Senile sclerocalcified TV Native Normal MR No AR TR No Trivial PR Trivial MS No AS No TS No PS No No Intracardiac Thrombi: No Mass: No Relaxation abnormality of LV filling pattern M-mode/2D Measurement RVD1 mm IVSD (8-11) 10 mm Aortic annulus. 19.0 mm RVD2 mm IVSS 13 mm sinus of Valsalva 31.0 mm RVD3 mm PWD (8-11) 10 mm ST Junction 27.0 mm LVEDD (42-54) LVESD (24-36). 28 43 mm PWs: 13 mm Ascending aorta 38.0 mm mm LVOT (18-22) mm LA (AP/ML/SI) mm LVEF (55-76) LV Mass 142.5 9 LA Vol by M-mode. 66 % by Biplane % LV Mass index. RWT 76.2 g/m2 0.47 by prolate ellipse by mod simpson mi 65 ml TV Annulus: mm NVC mm Echo Score Doppler Measurement Total M T S C LA Vol index (18-28) by prolate ellipse by mod simpson MV Annulus (4C/2C) 35 ml/m2 ml/m2 mm Aortic Mitral LVOT (TVI) 22.0 cm TVI of MR jet cm Tricuspid TR jet 1.54 1 m/sec AV (TVI) LVOT peak V 1.0 cm m/sec E (06-1) 0.59 m/sec RVSP 14 mmHg A (0.3.0.8) 0.67 m/sec RAP 5 mmHg PSPG/MSPG. 4.1/2.4 mmHg DT (170-210) 193.51 msec MPAP mmHg AV Peak V PSPG/MSPG 1 m/sec mmHg PHT msec PVR MDPG mmHg MDPG mmHg AVA by 2D by continuity PHT of AR jet RV function TAPSE TDI S HR /min RVOT VTI CM cm2 MVA by 20 cm2 Pulmonic msec by PHT cm2 by continuity cm2 PSPGMSPG RVOTAT mmHg m/sec mm cm/sec FAC TDI S 72 cm/sec E 7.2 cm/sec A 10.4 cm/sec EE 8 Confirmed by: (81700) Sonographer: 조수현 Responsible Dr.: 488(81700) 출력일시 2025-03-10 17:16 출력자 이지원 원본대조필 페이지 1/2 641020-2****** 명지병원 환자번호 01371838 환자이름 석향숙 진료과 심장내과 담당의 이지현 출력일시 2025-03-10 17:16 출력자 이지원 CA ECHO검사 성별/나이 여/60 주민등록번호 641020-2****** 전자서명자 서용성 원본대조필 명지병원 페이지 2/2 EKG 환자번호 01371838 환자이름 석향숙 성별/나이 여/60 주민등록번호 641020-2****** 진료과 심장내과 담당의 이지현 전자서명자 황의석 EKG SHS Patient ID: 01371838 2025/02/05 13:46:02 60YEARS = Vent. Rate PR interval 65 bpm 166 ms QRS duration 92 ms QT/QTC P-R-T axes 396/411 ms 1/35/52 P duration 출력일시 2025-03-10 17:16 출력자 이지원 REST ECG/4* 2.5s+ 1Rhythm Interpretation Normal sinus rhythm Nonspecific ST abnormality Abnormal ECG AiTiA-LVSD Score 0.0 (Low risk) Confirmed By: EuiSeock Hwang aVR T 5 T T V4 V5 V2 aVL 원본대조필 명지병원 MY ONG HOSPIT 페이지 1/2 EKG 환자번호 진료과 01371838 환자이름 석향숙 성별/나이 여/60 주민등록번호 641020-2****** 심장내과 담당의 이지현 전자서명자 황의석 = GE MAC5K V008B(1) 25mm/s 10mm/mV 16-150Hz 60Hz aVF V3 Attending MD: 원본대조필 명지병원 출력일시 2025-03-10 17:16 출력자 이지원 페이지 2/2 MY ONG HOSPITA V6 [별지 제1호 서식] 진료비 세부산정내역 서식 (제2조제1항 관련) 진료비 세부산정내역 환자등록번호 01371838 환자성명 진료기간 병실 환자구분 비고 석향숙 2025-02-26 2025-02-26 심장내과 [건강"
        }
      ],
      "medicalRecords": [
        {
          "date": "",
          "hospital": "08.70 진료비 납입 확인서 환자성명 석향숙 주민등록번호 641020-******* 진료비 내역 소득공제 대상액 진료일자 급 여 비급여 (진료기간) 구분 총액 2 환자 부담총액 현금 카 드 현 금 (1+2+3) 영수증 공단부담액 환자부담액 환자부담액 (2+3)",
          "reason": "정기 진료",
          "diagnosis": "미확인",
          "notes": ""
        },
        {
          "date": "",
          "hospital": "사업자등록번호 8",
          "reason": "정기 진료",
          "diagnosis": "미확인",
          "notes": ""
        },
        {
          "date": "",
          "hospital": "성 명 김윤호",
          "reason": "정기 진료",
          "diagnosis": "미확인",
          "notes": ""
        },
        {
          "date": "2025-03-24",
          "hospital": "미확인 의료기관",
          "visitDate": "2025-03-24",
          "reason": "정기 진료",
          "diagnosis": "미확인",
          "notes": ""
        },
        {
          "date": "",
          "hospital": ") 질병군 포괄수가 합계 :층 (동선동1가 골든타워! 상한액 초과금 요양기관 종류 1 ⑤ 4,900 2 11,580 3 140.000 의원 사업자등록번호 8",
          "reason": "정기 진료",
          "diagnosis": "미확인",
          "notes": ""
        },
        {
          "date": "",
          "hospital": "대표자 김윤호",
          "reason": "정기 진료",
          "diagnosis": "미확인",
          "notes": ""
        },
        {
          "date": "2025-02-26",
          "hospital": "직인이 없으면 무효임. 등록번호 :",
          "visitDate": "2025-02-26",
          "reason": "경기도 고양시 덕양구 화수로 14번길 55 팩스번호 : 031) 810-5190 √ 의사 [ 치과의사 한의사 상한의사 면허번호 제 103836 호 성명: 이지현 작성방법 1. 환자의 인적사항은 진찰한 의사, 치과의사 또는 한의사가 주민등록증, 기간 만료 전 여권, 운전면허증, 공무원증, 국립·공립대학 학생증, 군무원증, 건강보험증, 외국인등록증 등 국가공인 신분증(환자가 미성년자인 경우에는 주민등록등본·초본, 학생증 등으로 대체 가능합니다)과 대조하여 확인하고 서명 또는 날인합니다. 2. \"병명\"란에는 \"임상적 추정\"과 \"최종진단\" 중 택일하여 [ ]에 √ 표시를 하고, 질병명은 한 한글을 함께 적으며, 질병분류기호도 함께 적습니다. 야 서식은 재발행 서식입니다 3. 본 진단서는 당병원 직인이 없으면 무효임. 등록번호 :",
          "diagnosis": "\" 중 택일하여 [ ]에 √ 표시를 하고, 질병명은 한 한글을 함께 적으며, 질병분류기호도 함께 적습니다. 야 서식은 재발행 서식입니다 3. 본 진단서는 당병원 직인이 없으면 무효임. 등록번호 :",
          "notes": ""
        },
        {
          "date": "",
          "hospital": "의무기록사본 총 1부 (표지제외) 빈경환 의료법 시행규칙 [별지 제5호의2서식] <개정",
          "reason": "정기 진료",
          "diagnosis": "미확인",
          "notes": ""
        },
        {
          "date": "",
          "hospital": "미확인 의료기관",
          "reason": "인천 강화군 송해면 전망대로 127-42 (전화번호:",
          "diagnosis": "단서 환자의 환자의 성명 석향숙 주민등록번호 641020 2336921 환자의 주소 인천 강화군 송해면 전망대로 127-42 (전화번호:",
          "notes": ""
        },
        {
          "date": "",
          "hospital": "미확인 의료기관",
          "reason": "정기 진료",
          "diagnosis": "E785 E119 발병 연월일",
          "icdCode": "E78",
          "notes": ""
        },
        {
          "date": "0000-00-00",
          "hospital": "미확인 의료기관",
          "visitDate": "0000-00-00",
          "reason": "정기 진료",
          "diagnosis": "연월일",
          "notes": ""
        },
        {
          "date": "2025-02-19",
          "hospital": "長病明",
          "visitDate": "2025-02-19",
          "reason": "정기 진료",
          "diagnosis": "합니다. 의료기관 명칭: 명지병원 長病明",
          "notes": ""
        },
        {
          "date": "2025-02-26",
          "hospital": "미확인 의료기관",
          "visitDate": "2025-02-26",
          "reason": "정기 진료",
          "diagnosis": "에 의해",
          "notes": ""
        },
        {
          "date": "",
          "hospital": "장 長明 三輪知 ※ 담당자 서명이 없는 것은 무효임 담당자 명지병원 MYONGJI HOSPITA 환자번호",
          "reason": "정기 진료",
          "diagnosis": "미확인",
          "notes": ""
        },
        {
          "date": "",
          "hospital": "미확인 의료기관",
          "reason": "정기 진료",
          "diagnosis": "Variant angina Coronary(artery) disease Nause with vomiting Convalescence following other treatment Hyperlipidaemia, unspecified Type 2 diabetes mellitus, without complications Plan",
          "notes": ""
        },
        {
          "date": "",
          "hospital": "NYONGI MOSPITAL 환자번호",
          "reason": "정기 진료",
          "diagnosis": "미확인",
          "notes": ""
        },
        {
          "date": "",
          "hospital": "MYONGI ROSPITA 환자번호 진료과 심장내과",
          "reason": "정기 진료",
          "diagnosis": "미확인",
          "notes": ""
        },
        {
          "date": "",
          "hospital": "페이지 2/4 환자번호 진료과 심장내과",
          "reason": "정기 진료",
          "diagnosis": "미확인",
          "notes": ""
        },
        {
          "date": "",
          "hospital": "환자번호",
          "reason": "정기 진료",
          "diagnosis": "미확인",
          "notes": ""
        },
        {
          "date": "",
          "hospital": "미확인 의료기관",
          "reason": "정기 진료",
          "diagnosis": "미확인",
          "prescription": "일자 의사지시기록 순번 처방일시 의사지시기록지 성별/나이 01/60 주민등록번호 641020-2****** 전자서명자 이지현 D/C 반납 의사 지시 내용 처방량 처방의 구분 구분",
          "notes": ""
        },
        {
          "date": "",
          "hospital": "의사지시기록지 환자번호",
          "reason": "정기 진료",
          "diagnosis": "미확인",
          "notes": ""
        },
        {
          "date": "",
          "hospital": "의사지시기록지 환자번호",
          "reason": "정기 진료",
          "diagnosis": "미확인",
          "notes": ""
        },
        {
          "date": "",
          "hospital": "MYONGIKOSPITAL 환자번호 진료과 심장내과",
          "reason": "정기 진료",
          "diagnosis": "미확인",
          "notes": ""
        },
        {
          "date": "",
          "hospital": "미확인 의료기관",
          "reason": "정기 진료",
          "diagnosis": "미확인",
          "prescription": "중재 성별/나이 01/60 주민등록번호 641020-2****** 전자서명자 이지영 마사지, 지압, 냉찜질, 온찜질, 심호흡, 이완요법, 심상요법, 전환요법 (영화감상, TV시청, 음악감상, 산책 등) 평가일시 강도 위치 양상 빈도 지속시간 중재(약물 또는 비약물) 간호사 이도윤(D 초기평가 02-19 08:45 0 CC) 이도윤(D 재평가 02-19 11:05 0 CC) 재평가 재평가 재평가 재평가 재평가 날짜 시간 간호기록 간호사",
          "notes": ""
        },
        {
          "date": "",
          "hospital": "페이지 3/3 환자번호 진료과 심장내과",
          "reason": "정기 진료",
          "diagnosis": "미확인",
          "notes": ""
        },
        {
          "date": "",
          "hospital": "미확인 의료기관",
          "reason": "정기 진료",
          "diagnosis": "Unstable angina 처방일시",
          "prescription": "일시",
          "notes": ""
        },
        {
          "date": "2025-02-19",
          "hospital": "미확인 의료기관",
          "visitDate": "2025-02-19",
          "reason": "정기 진료",
          "diagnosis": "미확인",
          "notes": "치 단위 Calcium 8.8 8.7 10.4 mg/dL 1. phosphorus 3.2 2.4 5.1 mg/dL Glucose 104 73 106 mg/dL BUN 29.2 H 9 23 mg/dL Creatinine 0.73 0.5 1.1 ~ mg/dL mL/min/1.7 ...eGFR (CKD-EPI) 89.8 > 60.0 3m2 Uric Acid 3.2 3.0 7.0 mg/dL T. Protein 6.5 5.7 2 8.2 g/dL Albumin 4.5 ~ 3.2 4.8 g/dL T. Bilirubin 0.98 0.30 ~ 1.20 mg/dL ALP 90 ~ 46 116 U/L AST (SGOT) 16 < 34 U/L ALT (SGPT) 19 10 49 U/L Y-GT 14 < 38 U/L Na 142 ~ 132 146 mmol/L Electrolyte (4종) K 4.0 3.5 5.5 mmol/L Cl 111 H 99 109 mmol/L CO2 23 20 31 mmol/L CK 53 40 ~ 235 U/L CK-MB 0.4 <= 5 ng/mL high-sensitivity Troponin I < 2.51 < 38.64 pg/mL NT-proBNP 128.00 H <125 pg/mL 출력일시"
        },
        {
          "date": "",
          "hospital": "출력자 이지원 페이지 1/1 CAG 환자번호",
          "reason": "정기 진료",
          "diagnosis": "미확인",
          "notes": ""
        },
        {
          "date": "",
          "hospital": "환자번호 진료과 심장내과",
          "reason": "정기 진료",
          "diagnosis": "미확인",
          "notes": ""
        },
        {
          "date": "",
          "hospital": "MYONGJI HOSPITA炭 환자번호",
          "reason": "정기 진료",
          "diagnosis": "미확인",
          "notes": ""
        },
        {
          "date": "",
          "hospital": "페이지 2/2 EKG 환자번호 진료과 심장내과",
          "reason": "정기 진료",
          "diagnosis": "미확인",
          "notes": ""
        },
        {
          "date": "",
          "hospital": "페이지 1/2 h h EKG 환자번호",
          "reason": "정기 진료",
          "diagnosis": "미확인",
          "notes": ""
        },
        {
          "date": "",
          "hospital": "페이지 2/2 MY ON GAI HOSPIT la h 'V6 환자번호 진료과 심장내과",
          "reason": "정기 진료",
          "diagnosis": "미확인",
          "notes": ""
        },
        {
          "date": "",
          "hospital": "미확인 의료기관",
          "reason": "정기 진료",
          "diagnosis": "미확인",
          "prescription": "일시",
          "notes": ""
        },
        {
          "date": "",
          "hospital": "미확인 의료기관",
          "reason": "정기 진료",
          "diagnosis": "Variant angina 접수일시",
          "notes": ""
        },
        {
          "date": "2025-02-26",
          "hospital": "미확인 의료기관",
          "visitDate": "2025-02-26",
          "reason": "정기 진료",
          "diagnosis": "미확인",
          "notes": "치 단위 BUN 22.7 9 23 mg/dL Creatinine 0.89 0.5 1.1 mg/dL mL/min/1.7 ....eGFR (CKD-EPI) 70.7 > 60.0 3m2 Na 141 2 132 146 mmol/L Electrolyte (3종) K 4.1 ~ 3.5 5.5 mmol/L Cl 108 99 109 mmol/L CK 57 40 235 U/L CK-MB 0.8 <= 5 ng/mL high-sensitivity Troponin I <2.51 < 38.64 pg/mL NT-proBNP 62.00 <125 pg/mL 출력일시"
        },
        {
          "date": "",
          "hospital": "페이지 1/1 일반촬영검사 판독결과지 환자번호",
          "reason": "정기 진료",
          "diagnosis": "미확인",
          "notes": ""
        },
        {
          "date": "",
          "hospital": "미확인 의료기관",
          "reason": "정기 진료",
          "diagnosis": "미확인",
          "prescription": "일자",
          "notes": ""
        },
        {
          "date": "",
          "hospital": "EKG 환자번호",
          "reason": "정기 진료",
          "diagnosis": "미확인",
          "notes": ""
        },
        {
          "date": "",
          "hospital": "M? ONG HOSPITA 나나무 V5 h EKG 환자번호",
          "reason": "정기 진료",
          "diagnosis": "미확인",
          "notes": ""
        },
        {
          "date": "",
          "hospital": "MY ONG II HOSPIT 페이지 2/2 ? V6 환자번호",
          "reason": "정기 진료",
          "diagnosis": "미확인",
          "notes": ""
        },
        {
          "date": "",
          "hospital": "미확인 의료기관",
          "reason": "정기 진료",
          "diagnosis": "미확인",
          "prescription": "알러지 있음 없음 또는 알수없음 Summary angina visit: 간헐적으로 답답하고 조여서 내원. 등도 아플때도 있었다. undelrying dz: HTN (10yr) HL (4yrs) DM (1~2yr) self med: 자디앙듀오정",
          "notes": "LAB,TTE 약물알러지 있음 없음 또는 알수없음 Summary angina visit: 간헐적으로 답답하고 조여서 내원. 등도 아플때도 있었다. undelrying dz: HTN (10yr) HL (4yrs) DM (1~2yr) self med: 자디앙듀오정"
        },
        {
          "date": "",
          "hospital": "미확인 의료기관",
          "reason": "정기 진료",
          "diagnosis": "Chest pain (unspecified) Hypertensive heart disease NOS Type 2 diabetes mellitus, without complications Plan",
          "notes": ""
        },
        {
          "date": "",
          "hospital": "외래 재진기록지 환자번호",
          "reason": "정기 진료",
          "diagnosis": "미확인",
          "notes": ""
        },
        {
          "date": "",
          "hospital": "페이지 2/2 환자번호",
          "reason": "정기 진료",
          "diagnosis": "미확인",
          "notes": ""
        },
        {
          "date": "",
          "hospital": "미확인 의료기관",
          "reason": "정기 진료",
          "diagnosis": "미확인",
          "prescription": "알러지 있음 없음 또는 알수없음 통증평가 ㅇ유 ○평가불가 - 사유 : 현재 병력 angina visit: 간헐적으로 답답하고 조여서 내원. 등도 아플때도 있었다. undelrying dz: HTN (10yr) HL (4yrs) DM (1~2yr) self med: 자디앙듀오정",
          "notes": ""
        },
        {
          "date": "",
          "hospital": "미확인 의료기관",
          "reason": "정기 진료",
          "diagnosis": "주진단명 Yes 부친 VHD 모친 DM HTN stent Smokingnever Drinkingnever Chest pain (unspecified) Hypertensive heart disease NOS 진단명 Type 2 diabetes mellitus, without complications 구분 확진 기타진단명 기타진단명 치료계획",
          "notes": "진단명 기타진단명 치료계획; NSR 65 no cm 진단명 주진단명 Yes 부친 VHD 모친 DM HTN stent Smokingnever Drinkingnever Chest pain (unspecified) Hypertensive heart disease NOS 진단명 Type 2 diabetes mellitus, without complications 구분 확진 기타진단명 기타진단명 치료계획"
        },
        {
          "date": "",
          "hospital": "페이지 1/3 환자번호 진료과 심장내과",
          "reason": "정기 진료",
          "diagnosis": "미확인",
          "notes": ""
        },
        {
          "date": "",
          "hospital": "환자번호",
          "reason": "정기 진료",
          "diagnosis": "미확인",
          "notes": ""
        },
        {
          "date": "",
          "hospital": "페이지 3/3 환자번호",
          "reason": "정기 진료",
          "diagnosis": "미확인",
          "notes": ""
        },
        {
          "date": "",
          "hospital": "미확인 의료기관",
          "reason": "정기 진료",
          "diagnosis": "미확인",
          "prescription": "일시",
          "notes": ""
        },
        {
          "date": "",
          "hospital": "미확인 의료기관",
          "reason": "정기 진료",
          "diagnosis": "Chest pain (unspecified) 접수일시",
          "notes": ""
        },
        {
          "date": "2025-02-12",
          "hospital": "미확인 의료기관",
          "visitDate": "2025-02-12",
          "reason": "정기 진료",
          "diagnosis": "미확인",
          "notes": "치 단위 Calcium 9.0 8.7 10.4 mg/dL I. phosphorus 3.8 2.4 5.1 mg/dL Glucose 91 73 106 mg/dL BUN 19.1 9 23 mg/dL Creatinine 0.73 2 0.5 1.1 mg/dL mL/min/1.7 ...eGFR (CKD-EPI) 89.8 > 60.0 3m2 Uric Acid 3.4 3.0 7.0 mg/dL T.Cholesterol 155 < 239 mg/dL T. Protein 6.9 5.7 8.2 g/dL Albumin 4.5 3.2 4.8 g/dL T.Bilirubin 1.75 H 0.30 1.20 mg/dL ALP 101 46 116 U/L AST (SGOT) 19 < 34 U/L ALT (SGPT) 21 10 49 U/L Y-GT 16 < 38 U/L Triglyceride 139 <150 mg/dL HDL-Cholesterol 50 > 40 mg/dL LDL-Cholesterol 83 <129 mg/dL Amylase 165 H 30 ~ 118 U/L Lipase 29 12 53 U/L Na 141 ~ 132 146 mmol/L Electrolyte (3) K 4.5 3.5 5.5 mmol/L CI 109 99 109 mmol/L CK 157 40 235 U/L CK-MB 0.6 <= 5 ng/mL high-sensitivity Troponin I 3.91 < 38.64 pg/mL NT-proBNP 55.00 <125 pg/mL 출력일시"
        },
        {
          "date": "",
          "hospital": "임상화학검사(일반) 환자번호",
          "reason": "정기 진료",
          "diagnosis": "미확인",
          "notes": ""
        },
        {
          "date": "",
          "hospital": "페이지 2/2 일반촬영검사 판독결과지 환자번호",
          "reason": "정기 진료",
          "diagnosis": "미확인",
          "notes": ""
        },
        {
          "date": "",
          "hospital": "미확인 의료기관",
          "reason": "정기 진료",
          "diagnosis": "미확인",
          "prescription": "일자",
          "notes": ""
        },
        {
          "date": "",
          "hospital": "페이지 1/1 환자번호 진료과 심장내과",
          "reason": "정기 진료",
          "diagnosis": "미확인",
          "notes": ""
        },
        {
          "date": "",
          "hospital": "환자번호",
          "reason": "정기 진료",
          "diagnosis": "미확인",
          "notes": ""
        },
        {
          "date": "",
          "hospital": "MYONGI HOSPITA 환자번호 진료과 심장내과",
          "reason": "정기 진료",
          "diagnosis": "미확인",
          "notes": ""
        },
        {
          "date": "",
          "hospital": "환자번호",
          "reason": "정기 진료",
          "diagnosis": "미확인",
          "notes": ""
        },
        {
          "date": "",
          "hospital": "페이지 2/2 EKG 환자번호",
          "reason": "정기 진료",
          "diagnosis": "미확인",
          "notes": ""
        },
        {
          "date": "",
          "hospital": "MY ONG HOSPIT 페이지 1/2 EKG 환자번호 진료과",
          "reason": "정기 진료",
          "diagnosis": "미확인",
          "notes": ""
        },
        {
          "date": "",
          "hospital": "출력일시",
          "reason": "정기 진료",
          "diagnosis": "미확인",
          "notes": ""
        },
        {
          "date": "",
          "hospital": "미확인 의료기관",
          "reason": "정기 진료",
          "diagnosis": "미확인",
          "prescription": "약품비",
          "notes": ""
        },
        {
          "date": "",
          "hospital": "미확인 의료기관",
          "reason": "정기 진료",
          "diagnosis": "미확인",
          "prescription": "약품비",
          "notes": ""
        },
        {
          "date": "",
          "hospital": "미확인 의료기관",
          "reason": "정기 진료",
          "diagnosis": "서 [일반] 3,900 1 3.900 1.950 1.950 20,000 1 1 20.000 20,000 제증명",
          "notes": ""
        },
        {
          "date": "",
          "hospital": "미확인 의료기관",
          "reason": "정기 진료",
          "diagnosis": "서 [추가 1매당] 1,000 3 1 3,000 3,000 제증명 제증명",
          "notes": ""
        },
        {
          "date": "2025-03-10",
          "hospital": "일반사항 안내 1. 진료비 계산서 영수증의 세부내역서는 환자의 구체적인 처방 내역등이 확인되므로 원칙적으로 환자 본인 외에 발급을 금합니다. 다만, 본 세부내역서 발급에 대해 별도로 환자 본인으로부터 위임을 받은 것이 확인된 자 또는 법정대리인에겐 발급이 가능합니다. 2. 비고란은 세부산정내역을 발부하는 영수증 번호 등 요양기관이 필요한 경우 추가 기재하는 공간으로 활용할 수 있습니다. 3. 동 서식에 명시된 항목은 [국민건강보험 요양급여의 기준에 관한 규칙] 제7조제3항에 따라 필수 기재되어야 합니다. -2- 대표자 이왕준 전체 2 페이지 [별지 제1호 서식] 진료비 세부산정내역 서식 (제2조제1항 관련) 진료비 세부산정내역 환자등록번호",
          "visitDate": "2025-03-10",
          "reason": "정기 진료",
          "diagnosis": "미확인",
          "prescription": "내역등이 확인되므로 원칙적으로 환자 본인 외에 발급을 금합니다. 다만, 본 세부내역서 발급에 대해 별도로 환자 본인으로부터 위임을 받은 것이 확인된 자 또는 법정대리인에겐 발급이 가능합니다. 2. 비고란은 세부산정내역을 발부하는 영수증 번호 등 요양기관이 필요한 경우 추가 기재하는 공간으로 활용할 수 있습니다. 3. 동 서식에 명시된 항목은 [국민건강보험 요양급여의 기준에 관한 규칙] 제7조제3항에 따라 필수 기재되어야 합니다. -2- 대표자 이왕준 전체 2 페이지 [별지 제1호 서식] 진료비 세부산정내역 서식 (제2조제1항 관련) 진료비 세부산정내역 환자등록번호",
          "notes": "란은 세부산정내역을 발부하는 영수증 번호 등 요양기관이 필요한 경우 추가 기재하는 공간으로 활용할 수 있습니다. 3. 동 서식에 명시된 항목은 [국민건강보험 요양급여의 기준에 관한 규칙] 제7조제3항에 따라 필수 기재되어야 합니다. -2- 대표자 이왕준 전체 2 페이지 [별지 제1호 서식] 진료비 세부산정내역 서식 (제2조제1항 관련) 진료비 세부산정내역 환자등록번호"
        },
        {
          "date": "",
          "hospital": "미확인 의료기관",
          "reason": "정기 진료",
          "diagnosis": "료",
          "notes": ""
        },
        {
          "date": "",
          "hospital": "미확인 의료기관",
          "reason": "정기 진료",
          "diagnosis": "료",
          "notes": ""
        },
        {
          "date": "",
          "hospital": "미확인 의료기관",
          "reason": "정기 진료",
          "diagnosis": "료",
          "notes": ""
        },
        {
          "date": "",
          "hospital": "미확인 의료기관",
          "reason": "정기 진료",
          "diagnosis": "료",
          "notes": ""
        },
        {
          "date": "2025-03-10",
          "hospital": "대표자 이왕준 일반사항 안내 1. 진료비 계산서 영수증의 세부내역서는 환자의 구체적인 처방 내역등이 확인되므로 원칙적으로 환자 본인 외에 발급을 금합니다. 다만, 본 세부내역서 발급에 대해 별도로 환자 본인으로부터 위임을 받은 것이 확인된 자 또는 법정대리인에겐 발급이 가능합니다. 2. 비고란은 세부산정내역을 발부하는 영수증 번호 등 요양기관이 필요한 경우 추가 기재하는 공간으로 활용할 수 있습니다. 3. 동 서식에 명시된 항목은 [국민건강보험 요양급여의 기준에 관한 규칙] 제7조제3항에 따라 필수 기재되어야 합니다. -1- 전체 1 페이지 [별지 제1호 서식] 진료비 세부산정내역 서식 (제2조제1항 관련) 환자등록번호 0137 1838 항목 일자 진찰료 진찰료 진찰료 진찰료 투약 약품비 계 끝수처리 조정금액 합계 요양기관 명칭 환자성명 석향숙 진료비 세부산정내역 진료기간 병실 환자구분",
          "visitDate": "2025-03-10",
          "reason": "정기 진료",
          "diagnosis": "미확인",
          "prescription": "내역등이 확인되므로 원칙적으로 환자 본인 외에 발급을 금합니다. 다만, 본 세부내역서 발급에 대해 별도로 환자 본인으로부터 위임을 받은 것이 확인된 자 또는 법정대리인에겐 발급이 가능합니다. 2. 비고란은 세부산정내역을 발부하는 영수증 번호 등 요양기관이 필요한 경우 추가 기재하는 공간으로 활용할 수 있습니다. 3. 동 서식에 명시된 항목은 [국민건강보험 요양급여의 기준에 관한 규칙] 제7조제3항에 따라 필수 기재되어야 합니다. -1- 전체 1 페이지 [별지 제1호 서식] 진료비 세부산정내역 서식 (제2조제1항 관련) 환자등록번호 0137 1838 항목 일자 진찰료 진찰료 진찰료 진찰료 투약 약품비 계 끝수처리 조정금액 합계 요양기관 명칭 환자성명 석향숙 진료비 세부산정내역 진료기간 병실 환자구분",
          "notes": "란은 세부산정내역을 발부하는 영수증 번호 등 요양기관이 필요한 경우 추가 기재하는 공간으로 활용할 수 있습니다. 3. 동 서식에 명시된 항목은 [국민건강보험 요양급여의 기준에 관한 규칙] 제7조제3항에 따라 필수 기재되어야 합니다. -1- 전체 1 페이지 [별지 제1호 서식] 진료비 세부산정내역 서식 (제2조제1항 관련) 환자등록번호 0137 1838 항목 일자 진찰료 진찰료 진찰료 진찰료 투약 약품비 계 끝수처리 조정금액 합계 요양기관 명칭 환자성명 석향숙 진료비 세부산정내역 진료기간 병실 환자구분"
        },
        {
          "date": "2025-03-10",
          "hospital": "일반사항 안내 대표자 이왕준 1. 진료비 계산서 영수증의 세부내역서는 환자의 구체적인 처방 내역등이 확인되므로 원칙적으로 환자 본인 외에 발급을 금합니다. 다만, 본 세부내역서 발급에 대해 별도로 환자 본인으로부터 위임을 받은 것이 확인된 자 또는 법정대리인에겐 발급이 가능합니다. 2. 비고란은 세부산정내역을 발부하는 영수증 번호 등 요양기관이 필요한 경우 추가 기재하는 공간으로 활용할 수 있습니다. 3. 동 서식에 명시된 항목은 [국민건강보험 요양급여의 기준에 관한 규칙] 제7조제3항에 따라 필수 기재되어야 합니다. -1- 전체 1 페이지 [별지 제1호 서식] 진료비 세부산정내역 서식 (제2조제1항 관련) 진료비 세부산정내역 환자등록번호 0137 1838 환자성명 석향숙 진료기간 병실 환자구분",
          "visitDate": "2025-03-10",
          "reason": "정기 진료",
          "diagnosis": "미확인",
          "prescription": "내역등이 확인되므로 원칙적으로 환자 본인 외에 발급을 금합니다. 다만, 본 세부내역서 발급에 대해 별도로 환자 본인으로부터 위임을 받은 것이 확인된 자 또는 법정대리인에겐 발급이 가능합니다. 2. 비고란은 세부산정내역을 발부하는 영수증 번호 등 요양기관이 필요한 경우 추가 기재하는 공간으로 활용할 수 있습니다. 3. 동 서식에 명시된 항목은 [국민건강보험 요양급여의 기준에 관한 규칙] 제7조제3항에 따라 필수 기재되어야 합니다. -1- 전체 1 페이지 [별지 제1호 서식] 진료비 세부산정내역 서식 (제2조제1항 관련) 진료비 세부산정내역 환자등록번호 0137 1838 환자성명 석향숙 진료기간 병실 환자구분",
          "notes": "란은 세부산정내역을 발부하는 영수증 번호 등 요양기관이 필요한 경우 추가 기재하는 공간으로 활용할 수 있습니다. 3. 동 서식에 명시된 항목은 [국민건강보험 요양급여의 기준에 관한 규칙] 제7조제3항에 따라 필수 기재되어야 합니다. -1- 전체 1 페이지 [별지 제1호 서식] 진료비 세부산정내역 서식 (제2조제1항 관련) 진료비 세부산정내역 환자등록번호 0137 1838 환자성명 석향숙 진료기간 병실 환자구분"
        },
        {
          "date": "",
          "hospital": "미확인 의료기관",
          "reason": "정기 진료",
          "diagnosis": "료",
          "notes": ""
        },
        {
          "date": "",
          "hospital": "미확인 의료기관",
          "reason": "정기 진료",
          "diagnosis": "료 영상진단료",
          "notes": ""
        },
        {
          "date": "",
          "hospital": "미확인 의료기관",
          "reason": "정기 진료",
          "diagnosis": "료",
          "notes": ") 영상저장 및 전송시스템 [FULL PACS] 이용 20 흉부2매 3,100 1 1 3.100 9.300 3.100 1,770 1 1 1,770 885 885 10,930 1 1 10.930 5,465 5.465 영상진단료"
        },
        {
          "date": "",
          "hospital": "미확인 의료기관",
          "reason": "정기 진료",
          "diagnosis": "료 계 끝수처리 조정금액 합계",
          "notes": ""
        },
        {
          "date": "2025-03-10",
          "hospital": "대표자 이왕준 일반사항 안내 1. 진료비 계산서 영수증의 세부내역서는 환자의 구체적인 처방 내역등이 확인되므로 원칙적으로 환자 본인 외에 발급을 금합니다. 다만, 본 세부내역서 발급에 대해 별도로 환자 본인으로부터 위임을 받은 것이 확인된 자 또는 법정대리인에겐 발급이 가능합니다. 2. 비고란은 세부산정내역을 발부하는 영수증 번호 등 요양기관이 필요한 경우 추가 기재하는 공간으로 활용할 수 있습니다. 3. 동 서식에 명시된 항목은 [국민건강보험 요양급여의 기준에 관한 규칙] 제7조제3항에 따라 필수 기재되어야 합니다. -2- 전체 2 페이지 ========== 파일: i?￢i??i?? i§?e￡?e?´i?­.pdf ==========",
          "visitDate": "2025-03-10",
          "reason": "정기 진료",
          "diagnosis": "미확인",
          "prescription": "내역등이 확인되므로 원칙적으로 환자 본인 외에 발급을 금합니다. 다만, 본 세부내역서 발급에 대해 별도로 환자 본인으로부터 위임을 받은 것이 확인된 자 또는 법정대리인에겐 발급이 가능합니다. 2. 비고란은 세부산정내역을 발부하는 영수증 번호 등 요양기관이 필요한 경우 추가 기재하는 공간으로 활용할 수 있습니다. 3. 동 서식에 명시된 항목은 [국민건강보험 요양급여의 기준에 관한 규칙] 제7조제3항에 따라 필수 기재되어야 합니다. -2- 전체 2 페이지 ========== 파일: i?￢i??i?? i§?e￡?e?´i?­.pdf ==========",
          "notes": "란은 세부산정내역을 발부하는 영수증 번호 등 요양기관이 필요한 경우 추가 기재하는 공간으로 활용할 수 있습니다. 3. 동 서식에 명시된 항목은 [국민건강보험 요양급여의 기준에 관한 규칙] 제7조제3항에 따라 필수 기재되어야 합니다. -2- 전체 2 페이지 ========== 파일: i?￢i??i?? i§?e￡?e?´i?­.pdf =========="
        },
        {
          "date": "",
          "hospital": "&약국별 기본진료내역 . 정보주체 : 석향숙 . 열람대상기간 :",
          "reason": "정기 진료",
          "diagnosis": "미확인",
          "prescription": "조제정보 병·의원&약국별 기본진료내역 . 정보주체 : 석향숙 . 열람대상기간 :",
          "notes": ""
        },
        {
          "date": "",
          "hospital": "(양방)기 타 및 상세 내과 외래 Al109 불명의 원 1 발성 고혈 압 14,860 10,460 4,400 (양방)기 타 및 상세 2",
          "reason": "정기 진료",
          "diagnosis": "미확인",
          "notes": ""
        },
        {
          "date": "",
          "hospital": "(양방)기 타 및 상세 내과외래 A1109 불명의 원 발성 고혈 압 1 14,860 10,460 4,400 (양방)기 타 및 상세 4",
          "reason": "정기 진료",
          "diagnosis": "미확인",
          "notes": ""
        },
        {
          "date": "",
          "hospital": "(양방)기 타 및 상세 내과 외래 Al109 불명의 원 발성 고혈 압 1 45,230 31,730 13,500 (양방)기 타 및 상세 6",
          "reason": "정기 진료",
          "diagnosis": "미확인",
          "notes": ""
        },
        {
          "date": "",
          "hospital": "(양방)기 타 및 상세 내과외래 Al109 불명의 원 발성 고혈 압 1 6,190 4,390 1,800 (양방)기 타 및 상세 8",
          "reason": "정기 진료",
          "diagnosis": "미확인",
          "notes": ""
        },
        {
          "date": "",
          "hospital": "타 및 상세 내과 외래 Al109 불명의 원 1 발성 고혈 14,610 10,310 4,300 압 (양방)기 타 및 상세 10",
          "reason": "정기 진료",
          "diagnosis": "미확인",
          "notes": ""
        },
        {
          "date": "",
          "hospital": "타 및 상세 내과 외래 Al109 불명의 원 [발성 고혈 압 1 35,890 25,190 10,700 본 자료는 병·의원&약국에서 청구한 요양급여비용 명세서를 기준으로 작성된 자료입니다. . 진료비에는 국민건강보험법 제41조의4에 따른 선별급여 관련 금액이 포함되어 있지 않습니다. . 이에 본 자료를 단순 참고가 아닌 증빙자료로 사용할 수 없으며, 이용에 관한 책임은 이용자에게 있습니다. 1/8",
          "reason": "정기 진료",
          "diagnosis": "미확인",
          "notes": "가 아닌 증빙자료로 사용할 수 없으며, 이용에 관한 책임은 이용자에게 있습니다. 1/8"
        },
        {
          "date": "",
          "hospital": "(양방)기 타 및 상세 내과 외래 Al109 불명의 원 발성 고혈 압 1 16,100 12,400 3,700 (양방)기 타 및 상세 14|",
          "reason": "정기 진료",
          "diagnosis": "미확인",
          "notes": ""
        },
        {
          "date": "",
          "hospital": "치과보 존과 (양방)비 외래 AK0401 가역적 치 수염 1 72,200 50,600 21,600 16",
          "reason": "정기 진료",
          "diagnosis": "미확인",
          "notes": ""
        },
        {
          "date": "",
          "hospital": "치과보 존과 (양방)비 외래 AK0401 가역적 치 수염 12,090 8,490 3,600 17",
          "reason": "정기 진료",
          "diagnosis": "미확인",
          "notes": ""
        },
        {
          "date": "",
          "hospital": "치과보 존과 (양방)비 외래 AK0401 가역적 치 1 수염 21,520 15,120 6,400 18",
          "reason": "정기 진료",
          "diagnosis": "미확인",
          "notes": ""
        },
        {
          "date": "",
          "hospital": "치과보 존과 (양방)비 외래 AK0401 가역적 치 1 수염 32,520 22,820 9,700 19",
          "reason": "정기 진료",
          "diagnosis": "미확인",
          "notes": ""
        },
        {
          "date": "",
          "hospital": "(양방)기 타 및 상세 내과 외래 Al109 불명의 원 발성 고혈 압 1 6,070 4,270 1,800 (양방)만 20",
          "reason": "정기 진료",
          "diagnosis": "미확인",
          "notes": ""
        },
        {
          "date": "",
          "hospital": "치주과 외래 AK0510 단순 병 1 연부 치은 염 101,730 71,230 30,500 21",
          "reason": "정기 진료",
          "diagnosis": "미확인",
          "notes": ""
        },
        {
          "date": "",
          "hospital": "타 및 상세 내과 외래 Al109 불명의 원 발성 고혈 압 1 12,130 8,530 3,600 본 자료는 병·의원&약국에서 청구한 요양급여비용 명세서를 기준으로 작성된 자료입니다. 진료비에는 국민건강보험법 제41조의4에 따른 선별급여 관련 금액이 포함되어 있지 않습니다. ?이에 본 자료를 단순 참고가 아닌 증빙자료로 사용할 수 없으며, 이용에 관한 책임은 이용자에게 있습니다.",
          "reason": "정기 진료",
          "diagnosis": "미확인",
          "notes": "가 아닌 증빙자료로 사용할 수 없으며, 이용에 관한 책임은 이용자에게 있습니다."
        },
        {
          "date": "",
          "hospital": "타 및 상세 내과 외래 Al109 불명의 원 발성 고혈 12,130 8,530 3,600 압 25|",
          "reason": "정기 진료",
          "diagnosis": "미확인",
          "notes": ""
        },
        {
          "date": "",
          "hospital": "타 및 상세 내과 외래 | Al109 불명의 원 발성 고혈 압 6,070 4,270 1,800 27",
          "reason": "정기 진료",
          "diagnosis": "미확인",
          "notes": ""
        },
        {
          "date": "",
          "hospital": "타 및 상세 내과 외래 Al109 불명의 원 [발성 고 압 11,780 8,280 3,500 29",
          "reason": "정기 진료",
          "diagnosis": "미확인",
          "notes": ""
        },
        {
          "date": "",
          "hospital": "타 및 상세 내과 외래 Al109 불명의 원 발성 고혈 1 11,780 8,280 3,500 압 31",
          "reason": "정기 진료",
          "diagnosis": "미확인",
          "notes": ""
        },
        {
          "date": "",
          "hospital": "(양방)기 타 및 상세 내과 외래 Al109 불명의 원 1 [발성 고혈 33,670 23,570 10,100 압 33",
          "reason": "정기 진료",
          "diagnosis": "미확인",
          "notes": ""
        },
        {
          "date": "",
          "hospital": "&약국에서 청구한 요양급여비용 명세서를 기준으로 작성된 자료입니다. ㆍ진료비에는 국민건강보험법 제41조의4에 따른 선별급여 관련 금액이 포함되어 있지 않습니다. ?이에 본 자료를 단순 참고가 아닌 증빙자료로 사용할 수 없으며, 이용에 관한 책임은 이용자에게 있습니다.",
          "reason": "정기 진료",
          "diagnosis": "미확인",
          "notes": "가 아닌 증빙자료로 사용할 수 없으며, 이용에 관한 책임은 이용자에게 있습니다."
        },
        {
          "date": "",
          "hospital": "가정의 학과 골붓돌기 외래 AM654 힘줄윤활 1 11,780 8,280 3,500 [막염 [드퀘 르벵] 44",
          "reason": "정기 진료",
          "diagnosis": "미확인",
          "notes": ""
        },
        {
          "date": "",
          "hospital": "&약국에서 청구한 요양급여비용 명세서를 기준으로 작성된 자료입니다. . 진료비에는 국민건강보험법 제41조의4에 따른 선별급여 관련 금액이 포함되어 있지 않습니다. 이에 본 자료를 단순 참고가 아닌 증빙자료로 사용할 수 없으며, 이용에 관한 책임은 이용자에게 있습니다. 4/8",
          "reason": "정기 진료",
          "diagnosis": "미확인",
          "notes": "가 아닌 증빙자료로 사용할 수 없으며, 이용에 관한 책임은 이용자에게 있습니다. 4/8"
        },
        {
          "date": "",
          "hospital": "가정의 학과 (양방)요 골븟돌기 외래 AM654 힘줄윤활 11,780 8,280 3,500 막염 [드퀘 '르벵] 46",
          "reason": "정기 진료",
          "diagnosis": "미확인",
          "notes": ""
        },
        {
          "date": "",
          "hospital": "외과 외래 AN63 방의 상세 불명의 덩 이 16,480 11,580 4,900 (양방)기 타 및 상세 48",
          "reason": "정기 진료",
          "diagnosis": "미확인",
          "notes": ""
        },
        {
          "date": "",
          "hospital": "가정의 학과 골븟돌기 외래 AM654 힘줄윤활 막염 [드퀘 르벵] 1 11,780 8,280 3,500 (양방)기 50",
          "reason": "정기 진료",
          "diagnosis": "미확인",
          "notes": ""
        },
        {
          "date": "",
          "hospital": "가정의 학과 골붓돌기 외래 AM654 힘줄윤활 1 32,760 22,960 9,800 막염 [드퀘 르벵] 53",
          "reason": "정기 진료",
          "diagnosis": "미확인",
          "notes": ""
        },
        {
          "date": "",
          "hospital": "과 외래 AN951 경 및 여성 의 갱년기 상태 1 11,780 8,280 3,500 (한방)상 세불명의 55",
          "reason": "정기 진료",
          "diagnosis": "미확인",
          "notes": ""
        },
        {
          "date": "",
          "hospital": "침구과 외래 BM7793 골부착부 21,230 14,930 6,300 병증, 아래 본 자료는 병·의원&약국에서 청구한 요양급여비용 명세서를 기준으로 작성된 자료입니다. 진료비에는 국민건강보험법 제41조의4에 따른 선별급여 관련 금액이 포함되어 있지 않습니다. 이에 본 자료를 단순 참고가 아닌 증빙자료로 사용할 수 없으며, 이용에 관한 책임은 이용자에게 있습니다. 5/8",
          "reason": "정기 진료",
          "diagnosis": "미확인",
          "notes": "가 아닌 증빙자료로 사용할 수 없으며, 이용에 관한 책임은 이용자에게 있습니다. 5/8"
        },
        {
          "date": "",
          "hospital": "침구과 외래 BM7793 골부착부 21,320 15,020 6,300 병증, 아래 (양방)폐 57",
          "reason": "정기 진료",
          "diagnosis": "미확인",
          "notes": ""
        },
        {
          "date": "",
          "hospital": "외래 AN951 경 및 여성 의 갱년기 상태 11,540 8,140 3,400 (한방)상 세불명의 58",
          "reason": "정기 진료",
          "diagnosis": "미확인",
          "notes": ""
        },
        {
          "date": "",
          "hospital": "침구과외래 BM7793 골부착부 25,330 17,830 7,500 병증, 아래 팔 (양방)폐 59",
          "reason": "정기 진료",
          "diagnosis": "미확인",
          "notes": ""
        },
        {
          "date": "",
          "hospital": "과 외래 AN951 경 및 여성 ㅣ의 갱년기 상태 38,330 26,930 11,400 (양방)달 리 분류되 60",
          "reason": "정기 진료",
          "diagnosis": "미확인",
          "notes": ""
        },
        {
          "date": "",
          "hospital": "&약국에서 청구한 요양급여비용 명세서를 기준으로 작성된 자료입니다. ㆍ진료비에는 국민건강보험법 제41조의4에 따른 선별급여 관련 금액이 포함되어 있지 않습니다. ?이에 본 자료를 단순 참고가 아닌 증빙자료로 사용할 수 없으며, 이용에 관한 책임은 이용자에게 있습니다.",
          "reason": "정기 진료",
          "diagnosis": "미확인",
          "notes": "가 아닌 증빙자료로 사용할 수 없으며, 이용에 관한 책임은 이용자에게 있습니다."
        },
        {
          "date": "",
          "hospital": "(양방)연 내과 외래 AJ020 쇄알균인 16,140 11,340 4,800 (양방)요 골븟돌기 69|",
          "reason": "정기 진료",
          "diagnosis": "미확인",
          "notes": ""
        },
        {
          "date": "",
          "hospital": "&약국에서 청구한 요양급여비용 명세서를 기준으로 작성된 자료입니다. ㆍ진료비에는 국민건강보험법 제41조의4에 따른 선별급여 관련 금액이 포함되어 있지 않습니다. ?이에 본 자료를 단순 참고가 아닌 증빙자료로 사용할 수 없으며, 이용에 관한 책임은 이용자에게 있습니다.",
          "reason": "정기 진료",
          "diagnosis": "미확인",
          "notes": "가 아닌 증빙자료로 사용할 수 없으며, 이용에 관한 책임은 이용자에게 있습니다."
        },
        {
          "date": "",
          "hospital": "&약국에서 청구한 요양급여비용 명세서를 기준으로 작성된 자료입니다. ㆍ진료비에는 국민건강보험법 제41조의4에 따른 선별급여 관련 금액이 포함되어 있지 않습니다. ?이에 본 자료를 단순 참고가 아닌 증빙자료로 사용할 수 없으며, 이용에 관한 책임은 이용자에게 있습니다.",
          "reason": "정기 진료",
          "diagnosis": "미확인",
          "notes": "가 아닌 증빙자료로 사용할 수 없으며, 이용에 관한 책임은 이용자에게 있습니다."
        }
      ],
      "hospitalizationRecords": [
        {
          "date": "2025-03-26",
          "hospital": "입원료: 2인실 50%, 3인실 40%, 4인실 30%/ 병원급 의료기관(치과병원 제외) 입원료: 2인실 40%, 3인실 30% 2. 전액 본인부담: 「국민건강보험법 시행규칙」 별표 6 또는 「의료급여법 시행규칙」 별표 1의2에 따라 적용되는 항목으로 건강보 험(의료급여)에서 금액을 정하고 있으나 진료비 전액을 환자 본인이 부담합니다. 3. 상한액 초과금: 「국민건강보험법 시행령」 별표 3 제1호에 따른 본인부담상한액의 최고 금액을 초과하는 본인부담금이 발생한 경 [단, 「의료법」 제3조제2항 제3호라목에 따른 요양병원(「장애인복지법」 제58조제1항 제4호에 따른 장애인 의료재활시설로서 「의료법」 제3조의2의 요건을 갖춘 의료기관인 요양병원은 제외)에 입원한 기간이 같은 연도에 120일을 초과하는 경우는 제외]. 공단이 부담하는 초과분 중 사전 정산하는 금액을 말합니다. ※전액 본인부담 및 선별급여(「국민건강보험법」 제41조의4에 따른 요양급여)의 본인부담금 등은 본인부담상한액 산정시 제외 4. \"질병군 포괄수가\"란 「국민건강보험법 시행령」 제21조제3항제2호 및 「국민건강보험 요양급여의 기준에 관한 규칙」 제8조제 3항 따라 보건복지부장관이 고시한 질병군 입원진료에 대하여 해당 입원진료와 관련되는 여러 의료행위를 하나의 행위로 정하여 요양급여비용을 결정한 것을 말합니다. 다만, 해당 질병군의 입원진료와 관련되는 의료행위라도 비급여대상이나 이송처치료 등 포괄수가에서 제외되는 항목은 위 표의 기본항목 및 선택항목란에 합산하여 표기됩니다. 1. 이 계산서·영수증에 대한 세부내용은 요양기관에 요구하여 제공 받을 수 있 습니다. 2. 「국민건강보험법」 제48조 또는 「의 료급여법」 제11조의3에 따라 환자가 전액 부담한 비용과 비급여로 부담한 비용의 타당성 여부를 건강보험심사평 가원(51644-2000. 홈페이지: www.hira.or.kr)에 확인 요청하실 수 있습니다. 3. 계산서·영수증은 「소득세법」에 따른 의료비 공제신청 또는 「조세특례제한 법」에 따른 현금영수증 공제신청(현금 영수증 승인번호가 적힌 경우만 해당합 니다)에 사용할 수 있습니다. 다만, 지 출증빙용으로 발급된 \"현금영수증(지 출증빙)\"은 공제신청에 사용할 수 없 습니다. (현금영수증 문의 126 인터넷 홈페이지: http://현금영수증.kr) 주(註): 진료항목 중 선택항목은 요양기관의 특성에 따라 추가 또는 생략할 수 있으며, 진찰료 등 일부 항목의 경우에는 야간(공휴일) 진료 시 진료비가 가산될 수 있습니다. ========== 파일: eª?i§ e³?i??.pdf ==========",
          "visitDate": "2025-03-26",
          "reason": "응급실 내원",
          "diagnosis": "미확인",
          "admissionPeriod": "undefined ~ undefined",
          "surgeryInfo": null,
          "notes": ""
        },
        {
          "date": "2025-02-19",
          "hospital": "미확인 의료기관",
          "visitDate": "2025-02-19",
          "reason": "응급실 내원",
          "diagnosis": "미확인",
          "admissionPeriod": "undefined ~ undefined",
          "surgeryInfo": null,
          "notes": ""
        },
        {
          "date": "",
          "hospital": "미확인 의료기관",
          "reason": "응급실 내원",
          "diagnosis": "하 약물 치료 계획하에 퇴원했습니다. 향후 6개월 이상 지속적으로 약물 치료 유 지하면서 추적관찰 필요합니다. 치료 내용 및 향후 치료에 대한 소견 입원퇴원 연월일 입원일:",
          "admissionPeriod": "undefined ~ undefined",
          "surgeryInfo": null,
          "notes": "입원퇴원 연월일 입원일:"
        },
        {
          "date": "",
          "hospital": "미확인 의료기관",
          "reason": "응급실 내원",
          "diagnosis": "미확인",
          "admissionPeriod": "undefined ~ undefined",
          "surgeryInfo": null,
          "notes": "퇴원-LAB, EKG,CHEST 약물알러지 있음 없음 또는 알수없음 Summary angina visit: 간헐적으로 답답하고 조여서 내원. 등도 아플때도 있었다. undelrying dz: HTN (10yr) HL (4yrs) DM (1~2yr) self med: 자디앙듀오정"
        },
        {
          "date": "",
          "hospital": "페이지 2/2 단기 입원기록지 환자번호",
          "reason": "응급실 내원",
          "diagnosis": "미확인",
          "admissionPeriod": "undefined ~ undefined",
          "surgeryInfo": null,
          "notes": ""
        },
        {
          "date": "",
          "hospital": "미확인 의료기관",
          "reason": "응급실 내원",
          "diagnosis": "구분 확진 질병코드 진단명 주진단명 1200 Unstable angina 처치명 시행일자 시행과 처치명",
          "admissionPeriod": "undefined ~ undefined",
          "surgeryInfo": null,
          "notes": ""
        },
        {
          "date": "",
          "hospital": "진료 ○가정간호 ㅇ치료종결 외래예약정보 외래예약일",
          "reason": "응급실 내원",
          "diagnosis": "미확인",
          "admissionPeriod": "undefined ~ undefined",
          "surgeryInfo": null,
          "notes": ""
        },
        {
          "date": "",
          "hospital": "전원 호스피스 OYes 퇴원 후 거주장소 자가 사회복지시설 ○기타 출력일시",
          "reason": "응급실 내원",
          "diagnosis": "미확인",
          "admissionPeriod": "undefined ~ undefined",
          "surgeryInfo": null,
          "notes": "출력일시"
        },
        {
          "date": "",
          "hospital": "출력일시",
          "reason": "응급실 내원",
          "diagnosis": "미확인",
          "admissionPeriod": "undefined ~ undefined",
          "surgeryInfo": null,
          "notes": ""
        },
        {
          "date": "",
          "hospital": "페이지 4/4 1일 입원실 간호기록지 (Daycare Center) 환자번호 진료과 심장내과",
          "reason": "응급실 내원",
          "diagnosis": "미확인",
          "admissionPeriod": "undefined ~ undefined",
          "surgeryInfo": null,
          "notes": ""
        },
        {
          "date": "",
          "hospital": "미확인 의료기관",
          "reason": "응급실 내원",
          "diagnosis": "미확인",
          "admissionPeriod": "undefined ~ undefined",
          "surgeryInfo": null,
          "notes": "입원시 교육 입원시 준비물품 1입원시 생활안내문 설명 ?가스 전열기구 사용금지 및 화재방지 ■환자권리장전 및 환자 책임에 대하여 설명 ㅣ금연교육 함 귀중품 관리 및 도난방지 [쓰레기 분리수거 린넨관리 1주차관리 약물알러지 있음 )없음 또는 알수없음 기타알러지 음식 없음 있음 기타 없음 있음 약품 입원직전 복용하던 약 ㅇ없음 있음타원 HTN, HL 현재 가지고 온약 ) 없음 있음 입원일시"
        },
        {
          "date": "",
          "hospital": "MYONGIKOSPITAL 1일 입원실 간호기록지 (Daycare Center) 환자번호 진료과 심장내과",
          "reason": "응급실 내원",
          "diagnosis": "미확인",
          "admissionPeriod": "undefined ~ undefined",
          "surgeryInfo": null,
          "notes": ""
        },
        {
          "date": "",
          "hospital": "MYONGJI KOSITA 1일 입원실 간호기록지 (Daycare Center) 환자번호",
          "reason": "응급실 내원",
          "diagnosis": "미확인",
          "admissionPeriod": "undefined ~ undefined",
          "surgeryInfo": null,
          "notes": ""
        },
        {
          "date": "",
          "hospital": "&약국 매화가정의학과의원 진단과 내과 입원/외래 외래 주상병코드 Al109 주상병명 (양방)기타 및 상세불명의 원발성 고혈압 내원일수 1 이창기",
          "reason": "응급실 내원",
          "diagnosis": "과 내과 입원/외래 외래 주상병코드 Al109 주상병명 (양방)기타 및 상세불명의 원발성 고혈압 내원일수 1 이창기",
          "admissionPeriod": "undefined ~ undefined",
          "surgeryInfo": null,
          "notes": "및 상세불명의 원발성 고혈압 내원일수 1 이창기"
        },
        {
          "date": "",
          "hospital": "&약국 진단과 입원/ 외래 주상병 코드 주상병명 내원 총 진료비 건강보험 등 일수(건강보험 적용분) 혜택받은 금액 내가 낸 의료비 (진료비) 1",
          "reason": "응급실 내원",
          "diagnosis": "과 입원/ 외래 주상병 코드 주상병명 내원 총 진료비 건강보험 등 일수(건강보험 적용분) 혜택받은 금액 내가 낸 의료비 (진료비) 1",
          "admissionPeriod": "undefined ~ undefined",
          "surgeryInfo": null,
          "notes": ""
        },
        {
          "date": "",
          "hospital": "&약국 진단과 입원/ 주상병 외래 내원 총 진료비 주상병명 코드 건강보험 등 일수 (건강보험 적용분) 혜택받은 금액 내가 낸 의료비 (진료비) (양방)기 타 및 상세 12",
          "reason": "응급실 내원",
          "diagnosis": "과 입원/ 주상병 외래 내원 총 진료비 주상병명 코드 건강보험 등 일수 (건강보험 적용분) 혜택받은 금액 내가 낸 의료비 (진료비) (양방)기 타 및 상세 12",
          "admissionPeriod": "undefined ~ undefined",
          "surgeryInfo": null,
          "notes": ""
        },
        {
          "date": "",
          "hospital": "&약국 진단과 입원/ 외래 주상병 코드 내원 총 진료비 주상병명 건강보험 등 일수 (건강보험 적용분) 혜택받은 금액 내가 낸 의료비 (진료비) 23",
          "reason": "응급실 내원",
          "diagnosis": "과 입원/ 외래 주상병 코드 내원 총 진료비 주상병명 건강보험 등 일수 (건강보험 적용분) 혜택받은 금액 내가 낸 의료비 (진료비) 23",
          "admissionPeriod": "undefined ~ undefined",
          "surgeryInfo": null,
          "notes": ""
        },
        {
          "date": "",
          "hospital": "&약국 진단과 입원/ 외래 주상병 코드 내원 총 진료비 주상병명 건강보험 등 일수(건강보험 적용분) 혜택받은 금액 내가 낸 의료비 (진료비) (양방)기 타 및 상세 34",
          "reason": "응급실 내원",
          "diagnosis": "과 입원/ 외래 주상병 코드 내원 총 진료비 주상병명 건강보험 등 일수(건강보험 적용분) 혜택받은 금액 내가 낸 의료비 (진료비) (양방)기 타 및 상세 34",
          "admissionPeriod": "undefined ~ undefined",
          "surgeryInfo": null,
          "notes": ""
        },
        {
          "date": "",
          "hospital": "&약국 진단과 입원/ 외래 주상병 코드 단 주상병명 내원 총 진료비 건강보험 등 일수 (건강보험 적용분) 혜택받은 금액 내가 낸 의료비 (진료비) 45",
          "reason": "응급실 내원",
          "diagnosis": "과 입원/ 외래 주상병 코드 단 주상병명 내원 총 진료비 건강보험 등 일수 (건강보험 적용분) 혜택받은 금액 내가 낸 의료비 (진료비) 45",
          "admissionPeriod": "undefined ~ undefined",
          "surgeryInfo": null,
          "notes": ""
        },
        {
          "date": "",
          "hospital": "&약국 진단과 외래 주상병 코드 내원 총 진료비 주상병명 건강보험 등 일수 (건강보험 적용분) 혜택받은 금액 내가 낸 의료비 (진료비) (한방)상 세불명의 56",
          "reason": "응급실 내원",
          "diagnosis": "과 외래 주상병 코드 내원 총 진료비 주상병명 건강보험 등 일수 (건강보험 적용분) 혜택받은 금액 내가 낸 의료비 (진료비) (한방)상 세불명의 56",
          "admissionPeriod": "undefined ~ undefined",
          "surgeryInfo": null,
          "notes": ""
        },
        {
          "date": "",
          "hospital": "&약국 진단과 입원/ 주상병 외래 코드 내원 총 진료비 주상병명 건강보험 등 일수 (건강보험 적용분) 혜택받은 금액 내가 낸 의료비 (진료비) 67",
          "reason": "응급실 내원",
          "diagnosis": "과 입원/ 주상병 외래 코드 내원 총 진료비 주상병명 건강보험 등 일수 (건강보험 적용분) 혜택받은 금액 내가 낸 의료비 (진료비) 67",
          "admissionPeriod": "undefined ~ undefined",
          "surgeryInfo": null,
          "notes": ""
        },
        {
          "date": "",
          "hospital": "&약국 진단과 입원/ 주상병 외래 코드 임성식 내과의 주상병명 (양방)기 타 및 상세 내원 총 진료비 건강보험 등 일수 (건강보험 적용분) 혜택받은 금액 내가 낸 의료비 (진료비) 78",
          "reason": "응급실 내원",
          "diagnosis": "과 입원/ 주상병 외래 코드 임성식 내과의 주상병명 (양방)기 타 및 상세 내원 총 진료비 건강보험 등 일수 (건강보험 적용분) 혜택받은 금액 내가 낸 의료비 (진료비) 78",
          "admissionPeriod": "undefined ~ undefined",
          "surgeryInfo": null,
          "notes": ""
        }
      ],
      "insuranceClaims": [
        {
          "date": "",
          "company": "미확인 보험사",
          "paymentDate": null,
          "amount": null,
          "notes": ""
        },
        {
          "date": "",
          "company": "미확인 보험사",
          "paymentDate": null,
          "amount": null,
          "notes": "가 아닌 증빙자료로 사용할 수 없으며, 이용에 관한 책임은 이용자에게 있습니다. 1/8"
        },
        {
          "date": "",
          "company": "미확인 보험사",
          "paymentDate": null,
          "amount": null,
          "notes": "가 아닌 증빙자료로 사용할 수 없으며, 이용에 관한 책임은 이용자에게 있습니다."
        },
        {
          "date": "",
          "company": "미확인 보험사",
          "paymentDate": null,
          "amount": null,
          "notes": "가 아닌 증빙자료로 사용할 수 없으며, 이용에 관한 책임은 이용자에게 있습니다."
        },
        {
          "date": "",
          "company": "미확인 보험사",
          "paymentDate": null,
          "amount": null,
          "notes": "가 아닌 증빙자료로 사용할 수 없으며, 이용에 관한 책임은 이용자에게 있습니다. 4/8"
        },
        {
          "date": "",
          "company": "미확인 보험사",
          "paymentDate": null,
          "amount": null,
          "notes": "가 아닌 증빙자료로 사용할 수 없으며, 이용에 관한 책임은 이용자에게 있습니다. 5/8"
        },
        {
          "date": "",
          "company": "미확인 보험사",
          "paymentDate": null,
          "amount": null,
          "notes": "가 아닌 증빙자료로 사용할 수 없으며, 이용에 관한 책임은 이용자에게 있습니다."
        },
        {
          "date": "",
          "company": "미확인 보험사",
          "paymentDate": null,
          "amount": null,
          "notes": "가 아닌 증빙자료로 사용할 수 없으며, 이용에 관한 책임은 이용자에게 있습니다."
        },
        {
          "date": "",
          "company": "미확인 보험사",
          "paymentDate": null,
          "amount": null,
          "notes": "가 아닌 증빙자료로 사용할 수 없으며, 이용에 관한 책임은 이용자에게 있습니다."
        }
      ]
    },
    "progressReport": "NaN\n의료 경과보고서\nMedical Progress Report\n생성일: 2025.08.17\nNaN\n\n■ 환자 정보 (Patient Information)\nNaN\n환자명: 석향숙\n생년월일: 미확인 (만 미확인세)\n등록번호: 641020-\n\n■ 보험 가입 조건 (Insurance Conditions)\nNaN\n1. 제출용 비 고 「의료법」 제17조 및 같은 법 시행규칙 제9조제1항에 따라 위와 같이 진단합니다. 의료기관 명칭: 명지병원 長病明 2025년 02월 26일 전화번호 : 031) 810-5114 주소: 경기도 고양시 덕양구 화수로 14번길 55 팩스번호 : 031) 810-5190 √ 의사 [ 치과의사 한의사 상한의사 면허번호 제 103836 호 성명: 이지현 작성방법 1. 환자의 인적사항은 진찰한 의사, 치과의사 또는 한의사가 주민등록증, 기간 만료 전 여권, 운전면허증, 공무원증, 국립·공립대학 학생증, 군무원증, 건강\n   가입일: 미확인\n   상품명: 미확인 상품\n   담보내용: 미확인 담보\n   상태: 유효\n\n2. 제출용 발급매수 : 37 의무기록 사본 증명서 제공되는 의무기록은 석향숙님의 의료정보로 안전하게 관리하여 주시고,\n   가입일: 미확인\n   상품명: 미확인 상품\n   담보내용: 미확인 담보\n   상태: 유효\n\n3. 제출용 용도 외에는 이용할 수 없으며,\n   가입일: 미확인\n   상품명: 미확인 상품\n   담보내용: 미확인 담보\n   상태: 유효\n\n4. 제출용 목적 달성 시 즉시 파기하여 주시기 바랍니다. 첨부한 사본은 의무기록 원본과 틀림이 없음을 증명합니다. 2025 년 03 월 10 일 의료법인 명지의료재단 명지병원장 長明 三輪知 ※ 담당자 서명이 없는 것은 무효임 담당자 명지병원 MYONGJI HOSPITA 환자번호 01371838 환자이름 석향숙 진료과 심장내과 담당의 이지현 진료일자 2025-02-26 Vital Sign SBP 101 (mmHg) 외래 재진기록지 성별/나이 01/60 주민등록번호 641020-2****** 전자서명자 이지현A DBP 59 (mmHg) 맥박 74 (/min) 특이사항 퇴원-LAB, EKG,CHEST 약물알러지 있음 없음 또는 알수없음 Summary angina visit: 간헐적으로 답답하고 조여서 내원. 등도 아플때도 있었다. undelrying dz: HTN (10yr) HL (4yrs) DM (1~2yr) self med: 자디앙듀오정12.5/1000mg, 아세타졸정,알티스정480mg,아시돌연질캡슐1g,디핀스정80/5 mg, 에제로바정10/5mg,니자리딘캡슐150mg exertioanal angina occupation: 일하다가 휴직 EGD: 2024 GERD + FHX: 부친 VHD 모친 DM HTN stent never alcohol NSR 65 no cm 2025.2.12 TTE: no RWMA EF 66%, E/e' 8 dilaa 38mm Objective 주요 검사결과 2025.2.19 CAG: minimal CAD, diff. ecc. 30% LN of p-mRCA & 35-40% LN of dLCx, ergonovine provocation test positive 2025.2.19 Carotid US : 1.11/1.23 Assessment 진단명 Variant angina Coronary(artery) disease Nause with vomiting Convalescence following other treatment Hyperlipidaemia, unspecified Type 2 diabetes mellitus, without complications Plan 2025-02-26 =>>> Rosulord tab 5mg/T ((주)종근당) 1 # 1x30 2025-02-26 → Isotril ER tab.60mg/T (코오롱제약(주)) 1 # 2x30 출력일시 2025-03-10 17:16 출력자 이지원 원본대조필 페이지 1/2 명지병원 NYONGI MOSPITAL 환자번호 01371838 진료과 심장내과 환자이름 석향숙 담당의 이지현 2025-02-26 CBC with Diff = => 2025-02-26 BUN, Urea Nitrogen 2025-02-26 Creatinine (serum) => 2025-02-26 Electrolyte 3종 = 2025-02-26 ⇒ ALP = 2025-02-26 AST[SGOT] => 2025-02-26 ALT[SGPT] = 2025-02-26 Y-GT = 2025-02-26 ⇒ CK = 2025-02-26 T.Cholesterol 2025-02-26 => Triglyceride 2025-02-26 HDL-Cholesterol 2025-02-26 LDL-Cholesterol 2025-02-26 Uric acid (serum) 2025-02-26 Glucose(Serum) = 2025-02-26 CRP(hs-CRP) 기존약에 상기약제 복용 1개월후 약제 all change 출력일시 2025-03-10 17:16 출력자 이지원 외래 재진기록지 성별/나이 04/60 주민등록번호 641020-2****** 전자서명자 이지현A 작성의 이지현 원본대조필 ?명지병원 페이지 2/2 단기 입원기록지 환자번호 01371838 진료과 심장내과 환자이름 석향숙 성별/나이 여/60 주민등록번호 담당의 이지현 전자서명자 이지현A 입원일자 2025-02-19 입원과 심장내과 입원의사 이지현 퇴원일자 2025-02-19 퇴원과 심장내과 퇴원의사 이지현 최종진단명 구분 확진 질병코드 진단명 주진단명 1200 Unstable angina 처치명 시행일자 시행과 처치명 2025-02-19 CARDIC CATH 2025-02-19 심장내과 관상동맥 조영촬영 Coronary Angiography 관상동맥 조영촬영 Coronary Angiography 입원기록 요약 및 퇴원시 환자상태 주호소 주호소 for CAG Onset 내원당일 과거력 ㅁ없음 ㅁ모름 ODM OHTN OTB Hepatitis Hyperlipidemia □뇌혈관질환 ㅁ심혈관질환 ㅁ수술력 현재 병력 기타알러지 ■기타하기기재 undelrying dz: HTN (10yr) HL (4yrs) DM (1~2yr) diagsnotic CAG 시행 위하여 DCC 내원함. 신체검사 CE Wnl 경과 및 치료과정 undelrying dz: HTN (10yr) HL (4yrs) DM (1~2yr) diagsnotic CAG 시행 위하여 DCC 내원함. 출력일시 2025-03-10 17:16 출력자 이지원 원본대조필 페이지 1/4 641020-2****** 명지병원 MYONGI ROSPITA 환자번호 진료과 심장내과 01371838 환자이름 석향숙 담당의 이지현 단기 입원기록지 성별/나이 여/60 주민등록번호 641020-2****** 전자서명자 이지현A 2025.2.19 CAG: minimal CAD, diff. ecc. 30% LN of p-mRCA & 35-40% LN of dLCx, ergonovine provocation test positive 2025.2.19 Carotid US: 1.11/1.23 Lab 검사결과 [2025-02-19] Calcium: 8.8 [2025-02-19] I. phosphorus: 3.2 [2025-02-19] Glucose: 104 [2025-02-19] BUN: ↑ 29.2 [2025-02-19] Creatinine : 0.73 [2025-02-19] eGFR (CKD-EPI): 89.8 [2025-02-19] Uric Acid : 3.2 [2025-02-19] T. Protein : 6.5 [2025-02-19] Albumin : 4.5 [2025-02-19] T.Bilirubin : 0.98 [2025-02-19] ALP : 90 [2025-02-19] AST (SGOT): 16 [2025-02-19] y-GT: 14 [2025-02-19] ALT (SGPT): 19 [2025-02-19] CRP: 0.07 [2025-02-19] Na: 142 [2025-02-19] K: 4.0 [2025-02-19] Cl: 1 111 [2025-02-19] CO2 : 23 [2025-02-19] CK: 53 [2025-02-19] CK-MB : 0.4 [2025-02-19] high-sensitivity Troponin 1: < 2.51 [2025-02-19] NT-proBNP ↑ 128.00 [2025-02-19] WBC Count: 8.6 [2025-02-19] RBC Count: 4.5 [2025-02-19] Hemoglobin: 13.1 [2025-02-19] Hematocrit : 40.9 [2025-02-19] Platelet Count : 178 [2025-02-19] MCV : 91.7 [2025-02-19] MCH: 29.4 [2025-02-19] MCHC: 32.0 [2025-02-19] RDW : 13.3 출력일시 2025-03-10 17:16 출력자 이지원 원본대조필 명지병원 페이지 2/4 환자번호 진료과 심장내과 01371838 환자이름 석향숙 담당의 이지현 [2025-02-19] PDW : 9.7 [2025-02-19] MPV : 9.1 단기 입원기록지 [2025-02-19] PCT: 10.160 [2025-02-19] Segmented neutrophil%: 74.0 [2025-02-19] Lymphocyte%: 20.0 [2025-02-19] Monocyte%: 4.8 [2025-02-19] Eosinophil%: 1.1 [2025-02-19] Basophil% : 0.1 성별/나이 04/60 주민등록번호 전자서명자 이지현A [2025-02-19] NRBC : 0.0 [2025-02-19] Lymphocyte# : 1.71 [2025-02-19] Monocyte# : 0.41 [2025-02-19] Eosinophil#: 0.09 [2025-02-19] Basophil# : 0.01 [2025-02-19] (ANC) neutrophil(Segmented,Band) : 6.35 [2025-02-19] D-Dimer : 0.31 퇴원약 약품코드 약품명 용법 용량 횟수 일수 JTNTG Nitroglycerin tab.0.6mg/T (명문 제약(주)) 의사 지시대로 복용 1 1 4 Nitrolingual spray 0.4mg*1회당/ JENTGLS 의사지시대로 1 1 1 14.4ml/BT ((주)한국유니팜) JTROSU Rosulord tab 5mg/T ((주)종근당) 1일 1회 아침식후 30분에 복 용하세요 1 1 10 UTIST6 Isotril ER tab.60mg/T (코오롱제 1일 2회 아침, 저녁식후 30분 약(주)) 1 2 10 에 복용하세요 퇴원형태 퇴원지시후 환자상태 및 진료결과 호전 추후치료계획 외래진료 ○추후 재입원 ○타병원진료 ○가정간호 ㅇ치료종결 외래예약정보 외래예약일 2025-02-28 진료과 주치의 심장내과 이지현 퇴원계획 퇴원예정일 2025-02-19 퇴원 후 치료식이 여부 No ○Yes 추후관리계획 사회 복지서비스 연계 필요성 No 외래 ○가정간호 ○타병원 전원 호스피스 OYes 퇴원 후 거주장소 자가 사회복지시설 ○기타 출력일시 2025-03-10 17:16 출력자 이지원 원본대조필 페이지 3/4 641020-2****** 명지병원 환자번호 01371838 환자이름 석향숙 진료과 심장내과 담당의 이지현 담당의사 이지현 단기 입원기록지 성별/나이 01/60 주민등록번호 전자서명자 이지현A 담당교수 이지현 641020-2****** 원본대조필 명지병원 출력일시 2025-03-10 17:16 출력자 이지원 페이지 4/4 환자번호 진료과 심장내과 01371838 환자이름 석향숙 담당의 이지현 2025-02-19 처방일자 의사지시기록 순번 처방일시 의사지시기록지 성별/나이 01/60 주민등록번호 641020-2****** 전자서명자 이지현 D/C 반납 의사 지시 내용 처방량 처방의 구분 구분 2025-02-19 08 Macperan(맥페란) inj.10mg/2ml/A (1A#1 동화약품(주)) :43:22 2 3 1 2025-02-19 08 Aceta inj.1g/100ml/Bag ((주)비보존 1 BAG # 1 :43:22 제약) * 1 2025-02-19 080.9% NS 50ml/BT (제이더블유생명 1BT#1 :43:22 과학(주)) 1 2025-02-19 08 Tridol inj.100mg/2ml/A ((주)유한양 0.5 A # 1 행) 4 :43:22 1 2025-02-19 08 1A#1 5 Lasix inj.20mg/2ml/A ((주)한독) :43:22 6 7 이지현 이지현 * 이지현 * 이지현 이지현 2025-02-19 08 Tridol inj.100mg/2ml/A ((주)유한양 1A#1 :43:22 행) 1 2025-02-19 08 0.9% NS inj.100ml/bag (제이더블유 1 BAG # 1 :43:22 생명과학(주)) 1 * 이지현 이지현 2025-02-19 08 8 Denogan inj.1g// (영진약품(주)) 1V#1 1 이지현 :43:22 2025-02-19 08 0.5 A # 1 * 9 Lasix inj.20mg/2ml/A ((주)한독) 이지현 :43:22 1 10 2025-02-19 080.9% NS inj.100ml/bag (제이더블유 1 BAG # 1 :43:22 생명과학(주) * 1 2025-02-1908 Apidra inj.1000IU/10ml/N ((주)사노 10 IU # 1 피-아벤티스코리아) 이지현 * 11 이지현 :43:23 1 12 2025-02-19 08 Apidra inj.1000IU/10ml/V ((주)사노 6 IU # 1 :43:23 피-아벤티스코리아) * 이지현 1 13 :43:23 2025-02-1908 Apidra inj.1000IU/10ml/N ((주)사노 4 IU#1 피-아벤티스코리아) * 이지현 1 14 2025-02-19 08 Apidra inj.1000IU/10ml/N ((주)사노 2IU#1 :43:23 피-아벤티스코리아) * 이지현 1 15 2025-02-19 080.9% NS 50ml/BT (제이더블유생명 :43:23 과학(주)) 1 BT #1 * 이지현 1 16 :43:23 17 생명과학(주)) 18 2025-02-19 08 Binicapin(소) inj.5mg/5ml/A ((주)비 2MG #1 씨월드제약) 2025-02-19 080.9% NS inj.100ml/bag (제이더블유 80 ML # 1 :43:23 2025-02-1908 Binicapin(대) inj.20mg/20ml/A ((주)1A #1 이지현 이지현 * 1 * 1 출력일시 2025-03-10 17:16 출력자 이지원 원본대조필 페이지 1/4 * 이지현 명지병원 의사지시기록지 환자번호 01371838 진료과 심장내과 환자이름 석향숙 담당의 이지현 성별/나이 04/60 주민등록번호 전자서명자 이지현 :43:23 비씨월드제약) 1 19 :43:23 2025-02-19 08 Peniramine inj.4mg/2ml/A ((주)유한 1A#1 양행) * 이지현 1 * 20 이지현 21 22 :44:39 23 :44:39 2025-02-19 08Apidra inj.1000IU/10ml/V ((주)사노 8IU#1 :43:23 피-아벤티스코리아) 1 2025-02-19 080.9% NS inj.100ml/bag (제이더블유 1BAG #1 :43:23 생명과학(주)) 1 2025-02-19 080.9% NS 1000ml/bag(중외) (제이더 1 BAG #1 블유생명과학(주)) 1 2025-02-19 08 Muteran(대-뮤테란) inj.600mg/6ml/2A #2 A (한화제약(주)) * 이지현 이지현 이지현 1 CAG 전후 2025-02-1908 관상동맥 조영촬영 Coronary Angio 24 1 * 1 * 1 이지현 :44:39 graphy 2025-02-19 08 25 Portable EKG 1 * * 이지현 :44:39 2025-02-19 08 26 CRP(hs-CRP) 1 1 1 이지현 :44:39 2025-02-19 08 27 27 NT-proBNP 1 1 * 1 이지현 :44:39 2025-02-19 08 28 D-Dimer * 1 * 이지현 :44:39 2025-02-19 08 29 High-Sensitivity Troponin I (TNIH) 1 * 1 * 1 이지현 :44:39 2025-02-19 08 30 CK-MB 1 1 * 1 이지현 :44:39 2025-02-19 08 31 CK 1 * 1 * 1 이지현 :44:39 32 32 2025-02-19 08 Y-GT 1 * 1 * 1 이지현 :44:39 2025-02-19 08 33 ALT[SGPT] 1 * 1 * 1 이지현 :44:39 2025-02-19 08 34 AST[SGOT] 1 1 * 1 이지현 :44:39 2025-02-19 08 35 ALP 1 1 * 1 이지현 :44:39 2025-02-19 08 36 T. Bilirubin (serum) 1 * 1 * 1 이지현 :44:39 2025-02-19 08 37 Uric acid (serum) 1 * 1 * 1 이지현 :44:39 출력일시 2025-03-10 17:16 출력자 이지원 원본대조필 페이지 2/4 641020-2****** ?명지병원 의사지시기록지 환자번호 01371838 진료과 심장내과 환자이름 석향숙 담당의 이지현 성별/나이 01/60 주민등록번호 전자서명자 이지현 2025-02-19 08 38 T. Protein (serum) 1 * * 이지현 :44:39 2025-02-19 08 39 Glucose(Serum) 1 1 1 이지현 :44:39 2025-02-19 08 40 40 Albumin (serum) 1 * 1 * 1 이지현 :44:39 2025-02-19 08 41 1.Phos (serum) * 1 * 1 이지현 :44:39 2025-02-19 08 42 Calcium (serum) 1 * 1 * 1 이지현 :44:39 2025-02-19 08 43 Electrolyte 4종 1 1 * * 1 이지현 :44:39 2025-02-19 08 44 Creatinine (serum) * 1 * 1 이지현 :44:39 2025-02-19 08 45 45 BUN, Urea Nitrogen 1 * 1 * 1 이지현 :44:39 2025-02-19 08 46 CBC with Diff 1 * * 1 이지현 :44:39 2025-02-19 10 47 US-Carotid Artery 1 1 1 이지현 :48:54 2025-02-19 11 48 Gluco-Stick Test 1 * 1 * 1 이지현 :08:34 2025-02-19 11 49 49 EKG 심전도 * 1 * 1 이지현 :26:35 2025-02-19 11 50 High-Sensitivity Troponin I (TNIH) * 1 1 1 * 이지현 :26:35 2025-02-19 11 51 BUN, Urea Nitrogen 1 * 1 * 1 이지현 :26:35 2025-02-19 11 42 52 CK * 1 * 1 이지현 :26:35 2025-02-19 11 53 NT-proBNP * * 1 이지현 :26:35 2025-02-19 11 54 CRP(hs-CRP) 1 * 1 * 1 이지현 :26:35 2025-02-19 11 55 Electrolyte 3종 1 1 * 1 이지현 :26:35 2025-02-19 11 56 Creatinine (serum) 1 * 1 * 1 이지현 :26:35 57 2025-02-19 11 Chest PA 1 1 * * 1 이지현 출력일시 2025-03-10 17:16 출력자 이지원 원본대조필 페이지 3/4 641020-2****** 명지병원 MYONGIKOSPITAL 환자번호 진료과 심장내과 01371838 환자이름 석향숙 담당의 이지현 의사지시기록지 성별/나이 여/60 주민등록번호 전자서명자 이지현 :26:35 2025-02-19 11 58 CBC with Diff 1 * 1 * 1 이지현 :26:35 2025-02-19 11 59 CK-MB 1 * 1 * 1 이지현 :26:35 60 :07:59 2025-02-19 14 Nitroglycerin tab.0.6mg/T (명문제 1T#1 약(주)) 2025-02-19 14 Nitrolingual spray 0.4mg*1회당/14.4 1 BT # 1 * 4 이지현 SIGT1 61 이지현 :07:59 ml/BT ((주)한국유니팜) 1 SIGE 2025-02-19 14 1T#1 * 1 62 Rosulord tab 5mg/T ((주)종근당) 이지현 :08:24 0 QDPC 63 :08:24 )) 2025-02-19 15 64 :24:23 1 :44:39 2 2025-02-19 14|sotril ER tab.60mg/T (코오롱제약(주1T#2 *1 Discharge (퇴원합니다) 2025-02-19 08처치지시 입원:1일:V/S TIME:q 8hr, B ST TIME:1 times 2025-02-19 14 처치지시 퇴원(외출)약/기존 지참약 유지하면서 퇴원약 :07:59 2025-02-19 14 처치지시 퇴원(외출)약/자디앙듀오 2 :07:59 1일 후 부터 복용합니다. 이지현 이지현 이지현 이지현 0 BIDPC 1 * * 1 이지현 처치지시 퇴원(외출)약/*NTG: chest 2025-02-19 14 3 :07:59 pain 발생시 1T SL 10분간격 최대 2 회 출력일시 2025-03-10 17:16 출력자 이지원 이지현 641020-2****** 원본대조필 명지병원 페이지 4/4 1일 입원실 간호기록지 (Daycare Center) 환자번호 진료과 심장내과 01371838 환자이름 석향숙 담당의 이지현 성별/나이 01/60 주민등록번호 641020-2****** 전자서명자 이지영 입원일자 2025-02-19 일반정보 입원경로 Ambulatory OWheel chair OCart 입원시 동반자 ㅇ없음 가족 ㅇ기타 입원시 교육 입원시 준비물품 1입원시 생활안내문 설명 ?가스 전열기구 사용금지 및 화재방지 ■환자권리장전 및 환자 책임에 대하여 설명 ㅣ금연교육 함 귀중품 관리 및 도난방지 [쓰레기 분리수거 린넨관리 1주차관리 약물알러지 있음 )없음 또는 알수없음 기타알러지 음식 없음 있음 기타 없음 있음 약품 입원직전 복용하던 약 ㅇ없음 있음타원 HTN, HL 현재 가지고 온약 ) 없음 있음 입원일시 2025-02-19 08:36 신장 164 (cm) 체중 77 (Kg) BMI 28.6(kg/m²) 직업 회사원 입원동기 주증상 For CAG 과거병력 ㅁ없음 ㅣ고혈압 당뇨 간염 ■기타 HL 활력징후 날짜 시간 SBP DBP 체온 맥박 호흡 2025-02-19 09:00 147 82 36.3 52 20 20 11:05 163 87 36.2 59 20 11:40 150 78 36.2 60 20 1. 통증사정도구 NRS OFPRS OFLACC Ⅲ. 통증양상 1. 쑤시는 듯한 2. 날카로운 3. 짓누르는 4. 타는 듯한 5. 욱신욱신 쑤심 6. 쥐어짜는 듯한 7. 바늘로 찌르는 듯한 8. 콕콕 쑤시는 9. 따끔거림 10. 화끈거림 출력일시 2025-03-10 17:16 출력자 이지원 원본대조필 페이지 1/3 명지병원 MYONGIKOSPITAL 1일 입원실 간호기록지 (Daycare Center) 환자번호 진료과 심장내과 01371838 환자이름 석향숙 담당의 이지현 Ⅲ. 비약물 중재 성별/나이 01/60 주민등록번호 641020-2****** 전자서명자 이지영 마사지, 지압, 냉찜질, 온찜질, 심호흡, 이완요법, 심상요법, 전환요법 (영화감상, TV시청, 음악감상, 산책 등) 평가일시 강도 위치 양상 빈도 지속시간 중재(약물 또는 비약물) 간호사 이도윤(D 초기평가 02-19 08:45 0 CC) 이도윤(D 재평가 02-19 11:05 0 CC) 재평가 재평가 재평가 재평가 재평가 날짜 시간 간호기록 간호사 2025-02-19 08:45 외래 통해 걸어서 입원함 CA안슬기에게 알림 금식, 속옷, 장신구 제거 확인함 금일 아침 약 복용 유무 확인함 \"그저께 NTG 복용했어요.\" 이도윤(DC 보호자 같이 내원했는지 확인함 이도윤(DC 09:06 portable EKG 시행함 이도윤(DC 09:20 Full voiding 후 CAG위해 이동침대로 심혈관촬영실감 C) 11:05 CAG 시행후 이동침대로 병실복귀함 식이 가능함을 설명함 Rt.radial CAG site compression set Rt.finger's s ense, motor 양호함 사정 : 금일 CAG 시행함 계획 및 수행 : CAG 부위 관찰함 계획 및 수행 : 출혈즉시 간호사에게 말하도록 교육함 계획 및 수행: 침상안정해야 함을 설명함 이도윤(DC 계획 및 수행 : 검사 및 시술 후 주의사항 안내문을 지급함 출력일시 2025-03-10 17:16 원본대조필 출력자 이지원 페이지 2/3 명지병원 MYONGJI KOSITA 1일 입원실 간호기록지 (Daycare Center) 환자번호 01371838 환자이름 석향숙 진료과 심장내과 담당의 이지현 성별/나이 04/60 주민등록번호 641020-2****** 전자서명자 이지영 11:06 V/S 163/87-59-36.2 \"머리가 조금 아파요\"CA안슬기에게 알 이도윤(DC 림 C) 이도윤(DC 11:35 평가: CAG 부위 출혈없음 C) 이도윤(DC 11:40 V/S 150/78-36.2-60-20 측정됨을 CA안슬기에게 알림 C) 이도윤(DC 13:35 US-Carotid Artery위해 심초음파실 이동함. 이지영(DC) 14:20 병실복귀함 이지영(DC 15:03 CAG site bleeding,hematoma 없이 침상안정 중임 15:25 Rt.radial CAG site compression Dressing 시행함 by CA안 이도윤(DC 슬기 C) 15:38 퇴원 후 압박 Dressing 제거 시간 설명함 퇴원 후 주의사항 설명함 익일 CAG site 소독방법 설명함 이지영(DC 퇴원약 지급하고 외래예약/ 외래검사 설명함 이지영(DC 15:40 보호자와 함께 걸어서 퇴원함 출력일시 2025-03-10 17:16 출력자 이지원 원본대조필 명지병원 페이지 3/3 환자번호 진료과 심장내과 01371838 환자이름 석향숙 담당의 이지현 임상화학검사(일반) 성별/나이 04/60 주민등록번호 641020-2***** 전자서명자 조해원 등록번호 01371838 진료과 심장내과 검사자 N/A 환자명 석향숙 성별/나이F/60 의뢰의사 이지현 병동 DCC/DCC 확인의사 조해원 검체명 Serum, SST 진단명 Unstable angina 처방일시 2025-02-19 08:44 접수일시 2025-02-19 09:06 보고일시 2025-02-19 09:58 검체번호 20250219A00467 0 검사 결과 검사명 결과 H/L 참고치 단위 Calcium 8.8 8.7 10.4 mg/dL 1. phosphorus 3.2 2.4 5.1 mg/dL Glucose 104 73 106 mg/dL BUN 29.2 H 9 23 mg/dL Creatinine 0.73 0.5 1.1 ~ mg/dL mL/min/1.7 ...eGFR (CKD-EPI) 89.8 > 60.0 3m2 Uric Acid 3.2 3.0 7.0 mg/dL T. Protein 6.5 5.7 2 8.2 g/dL Albumin 4.5 ~ 3.2 4.8 g/dL T. Bilirubin 0.98 0.30 ~ 1.20 mg/dL ALP 90 ~ 46 116 U/L AST (SGOT) 16 < 34 U/L ALT (SGPT) 19 10 49 U/L Y-GT 14 < 38 U/L Na 142 ~ 132 146 mmol/L Electrolyte (4종) K 4.0 3.5 5.5 mmol/L Cl 111 H 99 109 mmol/L CO2 23 20 31 mmol/L CK 53 40 ~ 235 U/L CK-MB 0.4 <= 5 ng/mL high-sensitivity Troponin I < 2.51 < 38.64 pg/mL NT-proBNP 128.00 H <125 pg/mL 출력일시 2025-03-10 17:16 원본대조필 명지병원 출력자 이지원 페이지 1/1 CAG 환자번호 01371838 환자이름 석향숙 진료과 심장내과 담당의 이지현 성별/나이 여/60 전자서명자 주민등록번호 641020-2****** CAG MYONGJI HOSPITAL Coronary Angiography & PCI Report Date: 2025.19 Age/Sex: 60 ( ) M (4) F Cath. No : Name: : Hos. ID 1471836 Clinical Diagnosis: No unstable signa ~ Vent Ref. Dr. : Puncture Site Femoral Operator: Rt.( ) Lt. ( ) 01 시현 Radial Rt.Lt. ( ) Others Cardiogenic shock: Y( ) N( CHF : Y( ) Nex 2 Ar shorth Rt dominant coronary artery AGA ZJR 4-x upto drt.co. 30x wf parked 014 Conclusion: Comments: 출력일시 2025-03-10 17:16 출력자 이지원 PILO S LGA2744-35 .diff. ea. upho крашенню 13: Ang Poppins provocanter text & Voca 85 Vasspor ··RCA As well. Variant anjha Mrinal CAD Medical Textment Cardiac Catheterization Laboratory 7697-24 Tel: 031-810-6776, 6786 원본대조필 페이지 1/1 0/2/82 명지병원 환자번호 진료과 심장내과 01371838 환자이름 석향숙 담당의 이지현 CA ECHO검사 Exam Date 2025-02-19 Patient ID: 01371838 Location: DCC Height: cm Comments RT- CA ECHO검사 성별/나이 여/60 주민등록번호 전자서명자 서용성 ECHOCARDIOGRAPHY LABORATORY MYONGJIHOSPITAL Carotid Duplex Ultrasound Report Weight: Echo No.: 25 - 02 Name: 석향숙 Referring Dr.: 0 Sex/Age: F Referral Reason: Subclinical atherosclerosis screening BSA: m2 BP: kig LT 060Y /mmHg 1. Significant thickened IMT (far wall: 1.11mm) in Rt proximal CCA without significant stenotic flow & Significant thickened IMT(far wall: 1.07mm) in Rt distal CCA without significant stenotic flow. Carotid IMT(CCA) Right CCA 1. Significant thickened IMT (far wall: 1.09mm) in Lt distal CCA without significant stenotic flow. 2. Mild homogeneous plaque(far wall:1.23mm) in Lt proximal CCA without significant stenotic flow. Left CCA ICA ECA CCA R ICA ECA CCA MAX IMT Rt far wall prox: 1.11 mm Lt far wall prox: mm Rt far wall dist 1.07 mm Lt far wall dist: 1.09 mm Carotid Plaque Absence Single Multiple Location & Size CR: CCA R: ICA CRt bulb Morphology Echogenecity: Texture: Hyperechoic Homogenous Surface feature: Smooth Calcification: Present Doppler Study mm DL: CCA 1.23 mm mm DL: ICA mm mm CLt bulb mm CEchogenic Heterogenous Dirregular Absent Hypoechoic Acoustic Shadowing Right PSV (cm/sec) Right EDV (cm/sec) Left PSV (cm/sec) Left EDV (cm/sec) CCA proximal 73.8 7.2 88.3 17 CCA distal 64.8 10.2 84.9 109 ICA 46.8 15.1 56.4 174 ICA/CCA ratio 0.63 2.10 0.64 1.02 ECA 76.3 8.06 52.2 3 Vertebral artery 23.1 541 23.4 1.2 Confirmed by: 488 (62830) Sonographer: 김승아 Responsible Dr.: 18(81700) 출력일시 2025-03-10 17:16 원본대조필 출력자 이지원 페이지 1/2 641020-2****** 명지병원 MYONGJI HOSPITA炭 환자번호 01371838 환자이름 석향숙 진료과 심장내과 담당의 이지현 출력일시 2025-03-10 17:16 출력자 이지원 CA ECHO검사 성별/나이 01/60 주민등록번호 641020-2****** 전자서명자 서용성 원본대조필 명지병원 페이지 2/2 EKG 환자번호 진료과 심장내과 01371838 환자이름 석향숙 성별/나이 여/60 주민등록번호 641020-2****** 담당의 이지현 전자서명자 황의석 EKG REST ECG/4* 2.5s+ 1Rhythm S HS Patient ID: 01371838 2025/02/19 09:18:36 60YEARS Vent. Rate 48 bpm PR interval 172 ms QRS duration 104 ms Interpretation Sinus bradycardia Otherwise normal ECG QT/QTC P-R-T axes 430/384 ms -6/38/50 AiTiA-LVSD Score 0.1 (Low risk) P duration Confirmed By: EuiSeock Hwang aVR V1 V4 || aVL V2 V5 2025-03-10 17:16 출력일시 출력자 이지원 원본대조필 명지병원 페이지 1/2 h h EKG 환자번호 01371838 환자이름 석향숙 성별/나이 여/60 진료과 심장내과 담당의 이지현 전자서명자 황의석 = GE MAC5K V008B(1) 25mm/s 10mm/mV 16-150Hz 60Hz 출력일시 2025-03-10 17:16 출력자 이지원 aVF 주민등록번호 641020-2****** V3 Attending MD: 원본대조필 명지병원 페이지 2/2 MY ON GAI HOSPIT la h 'V6 환자번호 진료과 심장내과 01371838 환자이름 석향숙 담당의 이지현 임상화학검사(일반) 성별/나이 여/60 주민등록번호 641020-2****** 전자서명자 조해원 등록번호 01371838 진료과 심장내과 검사자 N/A 처방일시 2025-02-19 15:47 환자명 석향숙 성별/나이 F/60 의뢰의사 이지현 병동 확인의사 조해원 검체명 Serum, SST 진단명 Variant angina 접수일시 2025-02-26 10:56 보고일시 2025-02-26 11:41 검체번호 20250226A00712 0 검사 결과 검사명 결과 H/L 참고치 단위 BUN 22.7 9 23 mg/dL Creatinine 0.89 0.5 1.1 mg/dL mL/min/1.7 ....eGFR (CKD-EPI) 70.7 > 60.0 3m2 Na 141 2 132 146 mmol/L Electrolyte (3종) K 4.1 ~ 3.5 5.5 mmol/L Cl 108 99 109 mmol/L CK 57 40 235 U/L CK-MB 0.8 <= 5 ng/mL high-sensitivity Troponin I <2.51 < 38.64 pg/mL NT-proBNP 62.00 <125 pg/mL 출력일시 2025-03-10 17:16 출력자 이지원 원본대조필 명지병원 페이지 1/1 일반촬영검사 판독결과지 환자번호 01371838 진료과 심장내과 환자이름 석향숙 성별/나이 여/60 주민등록번호 담당의 임정기 전자서명자 임정기 처방일자 2025/02/19 촬영일자 2025/02/26 판독일자 2025/02/26 판독의(1) N/A 판독의(2) 임정기 전사자 N/A 소견 Chest PA(2025-02-19 00:00:00) Within normal limits. 출력일시 2025-03-10 17:16 출력자 이지원 원본대조필 페이지 1/1 641020-2****** 명지병원 EKG 환자번호 01371838 환자이름 석향숙 성별/나이 여/60 주민등록번호 641020-2****** 진료과 심장내과 담당의 이지현 전자서명자 황의석 EKG SHS Patient ID: 01371838 2025/02/26 11:11:57 60YEARS Vent. Rate 63 bpm PR interval 168 ms QRS duration QT/QTC P-R-T axes P duration 94 ms 398/407 ms 4/42/46 2025-03-10 17:16 출력일시 출력자 이지원 aVR aVL 원본대조필 페이지 1/2 REST ECG/4* 2.5s+ 1Rhythm Interpretation Normal sinus rhythm Normal ECG AiTiA-LVSD Score 0.1 (Low risk) Confirmed By: EuiSeock Hwang r 명지병원 M? ONG HOSPITA 나나무 V5 h EKG 환자번호 01371838 환자이름 진료과 심장내과 담당의 석향숙 이지현 성별/나이 여/60 주민등록번호 641020-2****** 전자서명자 황의석 GE MAC5K V008B(1) 25mm/s 10mm/mV 16-150Hz 60Hz 출력일시 2025-03-10 17:16 출력자 이지원 aVF Attending MD: 원본대조필 명지병원 MY ONG II HOSPIT 페이지 2/2 ? V6 환자번호 01371838 진료과 심장내과 담당의 환자이름 석향숙 이지현 진료일자 2025-02-12 Vital Sign 외래 재진기록지 성별/나이 01/60 주민등록번호 641020-2****** 전자서명자 이지현A SBP 124 (mmHg) DBP 70 (mmHg) 맥박 78/min) 특이사항 LAB,TTE 약물알러지 있음 없음 또는 알수없음 Summary angina visit: 간헐적으로 답답하고 조여서 내원. 등도 아플때도 있었다. undelrying dz: HTN (10yr) HL (4yrs) DM (1~2yr) self med: 자디앙듀오정12.5/1000mg, 아세타졸정,알티스정480mg, 아시돌연질캡슐1g, 디핀스정80/5 mg, 에제로바정10/5mg, 니자리딘캡슐150mg exertioanal angina occupation: 일하다가 휴직 EGD: 2024 GERD + FHX: 부친 VHD 모친 DM HTN stent never alcohol NSR 65 no cm Objective 주요 검사결과 HbA1c 6.1 lipid 155/139/50/83 glc 91 CE wnl NT-proBNP 55 2025.2.12 TTE 1. No RWMA. 2. Normal sized cardiac chambers with normal LV systolic function (EF: 66%). 3. Relaxation abnormality of LV filling pressure (E/e': 8). 4. Concentric remodeling. 5. Dilated ascending aorta (38mm). Assessment 진단명 Chest pain (unspecified) Hypertensive heart disease NOS Type 2 diabetes mellitus, without complications Plan 2025-02-12 → Nitroglycerin tab.0.6mg/T (명문제약(주)) 1 # 1x4 출력일시 2025-03-10 17:16 출력자 이지원 원본대조필 페이지 1/2 명지병원 외래 재진기록지 환자번호 01371838 진료과 심장내과 환자이름 석향숙 담당의 이지현 성별/나이 01/60 주민등록번호 전자서명자 이지현A 2025.2.19 DCC adm. for diagsnotic CAG jardiance duo 2일전부터 skip 출력일시 2025-03-10 17:16 출력자 이지원 작성의 이지현 641020-2****** 원본대조필 명지병원 페이지 2/2 환자번호 01371838 진료과 심장내과 환자이름 석향숙 담당의 이지현 진료일자 2025-02-05 외래 초진기록지 성별/나이 여/60 주민등록번호 641020-2****** 전자서명자 이지현A 휴대폰 01031785794 주소 (230-19)인천 강화군 송해면 전망대로 127-42 신장 164 (cm) 체중 79 (Kg) BMI 29.3 (kg/m²) Vital Sign SBP 124 (mmHg) DBP 70 (mmHg) 맥박 78 (/min) 특이사항 신환 가슴통증, 답답 약- 자디앙듀오정12.5/1000mg,아세타졸정,알티스정480mg, 아시돌연질캡슐1ug, 디핀스 정80/5mg,에제로바정10/5mg, 니자리딘캡슐150mg EKG,CHEST 약물알러지 있음 없음 또는 알수없음 통증평가 ㅇ유 ○평가불가 - 사유 : 현재 병력 angina visit: 간헐적으로 답답하고 조여서 내원. 등도 아플때도 있었다. undelrying dz: HTN (10yr) HL (4yrs) DM (1~2yr) self med: 자디앙듀오정12.5/1000mg,아세타졸정,알티스정480mg,아시돌연질캡슐1g,디핀스정80/5 mg,에제로바정10/5mg, 니자리딘캡슐150mg exertioanal angina occupation: 일하다가 휴직 EGD: 2024 GERD + 가족력 ONO 사회력 주요 검사결과 NSR 65 no cm 진단명 주진단명 Yes 부친 VHD 모친 DM HTN stent Smokingnever Drinkingnever Chest pain (unspecified) Hypertensive heart disease NOS 진단명 Type 2 diabetes mellitus, without complications 구분 확진 기타진단명 기타진단명 치료계획 2025-02-05 = = CBC with Diff 출력일시 2025-03-10 17:16 출력자 이지원 원본대조필 명지병원 페이지 1/3 환자번호 진료과 심장내과 01371838 환자이름 석향숙 담당의 이지현 2025-02-05 => PT 2025-02-05 ⇒ aPTT 2025-02-05 Calcium (serum) = 2025-02-05 1.Phos (serum) 2025-02-05 BUN, Urea Nitrogen 2025-02-05 Creatinine (serum) 2025-02-05 Glucose (Serum) 2025-02-05 T. Protein (serum) = 2025-02-05 Albumin (serum) 2025-02-05 2025-02-05 2025-02-05 = Uric acid (serum) T.Cholesterol T. Bilirubin (serum) 2025-02-05 ⇒ ALP 2025-02-05 = AST[SGOT] 2025-02-05 → ALT[SGPT] 2025-02-05 ⇒ CK => 2025-02-05 ⇒ Hb A1c 2025-02-05 Triglyceride = 2025-02-05 = HDL-Cholesterol 외래 초진기록지 2025-02-05 LDL-Cholesterol 2025-02-05 Electrolyte 3 = 2025-02-05 ⇒ Free T4 = 2025-02-05 ⇒ TSH = 2025-02-05 => Routine U/A with Micro 2025-02-05 → CRP(hs-CRP) 2025-02-05 = Y-GT 2025-02-05 = T. Protein (urine) 2025-02-05: ⇒ Creatinine (urine) 2025-02-05: => Microalbumin (Urine) 2025-02-05: ⇒ CK-MB 2025-02-05 => High-Sensitivity Troponin I (TNIH) 2025-02-05 = NT-proBNP 2025-02-05 ⇒ D-Dimer 2025-02-05 Chest PA, Lat (L) 2025-02-05 → EKG 심전도 2025-02-05 => [전문] 경흉부초음파 (TTE) 상기 검사 후 fu 출력일시 2025-03-10 17:16 출력자 이지원 성별/나이 01/60 주민등록번호 전자서명자 이지현A 원본대조필 페이지 2/3 작성의 이지현 641020-2****** 명지병원 환자번호 01371838 환자이름 석향숙 진료과 심장내과 담당의 이지현 출력일시 2025-03-10 17:16 출력자 이지원 외래 초진기록지 성별/나이 여/60 주민등록번호 641020-2****** 전자서명자 이지현A 원본대조필 명지병원 페이지 3/3 환자번호 01371838 진료과 심장내과 환자이름 석향숙 담당의 이지현 임상화학검사(일반) 성별/나이 01/60 주민등록번호 641020-2****** 전자서명자 조해원 등록번호 01371838 진료과 심장내과 검사자 N/A 처방일시 2025-02-05 15:02 환자명 석향숙 성별/나이 F/60 의뢰의사 이지현 병동 확인의사 조해원 검체명 Serum, SST 진단명 Chest pain (unspecified) 접수일시 2025-02-12 11:57 보고일시 2025-02-12 12:46 검체번호 20250212A00883 0 검사 결과 검사명 결과 H/L 참고치 단위 Calcium 9.0 8.7 10.4 mg/dL I. phosphorus 3.8 2.4 5.1 mg/dL Glucose 91 73 106 mg/dL BUN 19.1 9 23 mg/dL Creatinine 0.73 2 0.5 1.1 mg/dL mL/min/1.7 ...eGFR (CKD-EPI) 89.8 > 60.0 3m2 Uric Acid 3.4 3.0 7.0 mg/dL T.Cholesterol 155 < 239 mg/dL T. Protein 6.9 5.7 8.2 g/dL Albumin 4.5 3.2 4.8 g/dL T.Bilirubin 1.75 H 0.30 1.20 mg/dL ALP 101 46 116 U/L AST (SGOT) 19 < 34 U/L ALT (SGPT) 21 10 49 U/L Y-GT 16 < 38 U/L Triglyceride 139 <150 mg/dL HDL-Cholesterol 50 > 40 mg/dL LDL-Cholesterol 83 <129 mg/dL Amylase 165 H 30 ~ 118 U/L Lipase 29 12 53 U/L Na 141 ~ 132 146 mmol/L Electrolyte (3) K 4.5 3.5 5.5 mmol/L CI 109 99 109 mmol/L CK 157 40 235 U/L CK-MB 0.6 <= 5 ng/mL high-sensitivity Troponin I 3.91 < 38.64 pg/mL NT-proBNP 55.00 <125 pg/mL 출력일시 2025-03-10 17:16 원본대조필 출력자 이지원 페이지 1/2 명지병원 임상화학검사(일반) 환자번호 01371838 환자이름 석향숙 진료과 심장내과 담당의 이지현 Free T4 1.24 TSH 1.52 2025-03-10 17:16 출력일시 출력자 이지원 성별/나이 01/60 주민등록번호 전자서명자 조해원 0.89~1.76 ng/dL 0.55~4.78 ulU/mL 641020-2****** 원본대조필 명지병원 페이지 2/2 일반촬영검사 판독결과지 환자번호 01371838 진료과 심장내과 환자이름 석향숙 성별/나이 04/60 주민등록번호 담당의 박지연 전자서명자 박지연 처방일자 2025/02/05 촬영일자 2025/02/05 판독일자 2025/02/05 판독의(1) N/A 판독의(2) 박지연 전사자 N/A 소견 Chest PA, Lat (L) (2025-02-05 00:00:00) No active lung lesion 결 론 No active lung lesion 출력일시 2025-03-10 17:16 출력자 이지원 641020-2****** 원본대조필 명지병원 페이지 1/1 환자번호 진료과 심장내과 01371838 환자이름 석향숙 담당의 이지현 CA ECHO검사 CA ECHO검사 성별/나이 01/60 주민등록번호 전자서명자 서용성 Exam Date 2025-02-12 Patient ID: 01371838 Location: OPD ECHOCARDIOGRAPHY LABORATORY MYONGJI HOSPITAL Transthoracic echocardiography report Height 164.0 cm Weight 77.0 kg Echo No.: 25 2 Name: 석향숙 Referral Reason: Chest pain 1.84 m2 BSA Referring Dr.: 이지현 Sex/Age: F 1 060Y BP 124/70 mmHg HR 78 bpm 1. Comments Echo for chest pain DM, HTN, HL 1. No RWMA 2. Normal sized cardiac chambers with normal LV systolic function (EF: 66%) 3. Relaxation abnormality of LV filling pressure (E/e: 8). 4. Concentric remodeling. 5. Dilated ascending aorta (38mm). Global strain rate -19.4% 2. Regional Wall motion Abnormality: 3. Valves: 4. Regurgitation: 5. Stenosis: 6. Pericardial Effusion: No Image: No MV Native AV Native TV Native MR No Slightly thickened Senile sclerocalcified Normal AR No TR Trivial PR Trivial MS No AS No TS. No PS No No Intracardiac Thrombi: No Mass: No 7. Diastolic function: Relaxation abnormality of LV filling pattern M-mode/2D Measurement RVD1: mm RVD2 mm IVSD (8-11). IVSS: RVD3 mm LVEDD (42-54): 43 mm PWD (8-11) PWs: omom 10 mm Aortic annulus 19.0 mm 13 mm sinus of Valsalva 31.0 mm 10 mm ST Junction 27.0 mm 13 mm Ascending aorta. 38.0 mm LVESD (24-36): 28 mm LVOT (18-22) mm LA (AP/ML/SI) mm LVEF (55-76): LV Mass 142.5 g LA Vol by M-mode. 66 % LV Mass index 76.2 g/m2 by prolate ellipse ml by Biplane % RWT 0.47 by mod simpson 65 ml TV Annulus mm LA Vol index (18-28) NC mm by prolate ellipse Echo Score Doppler Measurement Total M T S C by mod simpson MV Annulus (4C/2C): 35 ml/m2 ml/m2 mm Aortic Mitral Tricuspid LVOT (TVI) 22.0 cm TVI of MR jet cm TR jet 1.54 m/sec AV (TVI) cm E (0.6-1) 0.59 m/sec RVSP 14 mmHg LVOT peak V 1.0 m/sec A (0.3.0.8) 0.67 m/sec RAP 5 mmHg PSPG/MSPG 4.1/2.4 mmHg DT (170-210) 193.51 msec MPAP mmHg AV Peak V PSPG/MSPG AVA by 2D m/sec PHT msec PVR mmHg MDPG mmHg MDPG HR /min RVOT VTL mmHg CM by continuity cm2 MVA by 2D cm2 Pulmonic PHT of AR jet RV function TAPSE msec by PHT: cm2 by continuity cm2 PSPG/MSPG RVOT AT 1 mmHg m/sec TDI S FAC TDI mm cm/sec % S 7.2 cm'sec E 7.2 cm/sec A 10.4 cm/sec EE 8 Contirmed by: 서용성 (81700) Sonographer: 조수현 Responsible Dr.: 4188(81700) 출력일시 2025-03-10 17:16 출력자 이지원 원본대조필 페이지 1/2 641020-2****** 명지병원 환자번호 01371838 환자이름 석향숙 진료과 심장내과 담당의 이지현 CA ECHO검사 성별/나이 01/60 주민등록번호 641020-2****** 전자서명자 서용성 출력일시 2025-03-10 17:16 출력자 이지원 원본대조필 페이지 2/2 명지병원 MYONGI HOSPITA 환자번호 진료과 심장내과 01371838 환자이름 석향숙 담당의 이지현 CA ECHO검사 CA ECHO검사 성별/나이 01/60 주민등록번호 전자서명자 서용성 Exam Date 2025-02-12 Patient ID: 01371838 Location: OPD ECHOCARDIOGRAPHY LABORATORY MYONGJI HOSPITAL Transthoracic echocardiography report Echo No.: 25 2 Name: 석향숙 Referral Reason: Chest pain Referring Dr.: 이지현 Sex/Age: F / 060Y Height 164.0 cm Weight 77.0 kg BSA 1.84 m2 1. Comments Echo for chest pain : DM, HTN, HL 1. No RWMA. 2. Normal sized cardiac chambers with normal LV systolic function (EF: 66%). 3. Relaxation abnormality of LV filling pressure (E/e: 8). 4. Concentric remodeling. 5. Dilated ascending aorta (38mm). * Global strain rate: -19.4% 2. Regional Wall motion Abnormality: 3. Valves: 4. Regurgitation: 5. Stenosis: 6. Pericardial Effusion: 7. Diastolic function: BP 124/70 mmHg HR 78 bpm No Image: No MV AV Native Native Slightly thickened Senile sclerocalcified TV Native Normal MR No AR TR No Trivial PR Trivial MS No AS No TS No PS No No Intracardiac Thrombi: No Mass: No Relaxation abnormality of LV filling pattern M-mode/2D Measurement RVD1 mm IVSD (8-11) 10 mm Aortic annulus. 19.0 mm RVD2 mm IVSS 13 mm sinus of Valsalva 31.0 mm RVD3 mm PWD (8-11) 10 mm ST Junction 27.0 mm LVEDD (42-54) LVESD (24-36). 28 43 mm PWs: 13 mm Ascending aorta 38.0 mm mm LVOT (18-22) mm LA (AP/ML/SI) mm LVEF (55-76) LV Mass 142.5 9 LA Vol by M-mode. 66 % by Biplane % LV Mass index. RWT 76.2 g/m2 0.47 by prolate ellipse by mod simpson mi 65 ml TV Annulus: mm NVC mm Echo Score Doppler Measurement Total M T S C LA Vol index (18-28) by prolate ellipse by mod simpson MV Annulus (4C/2C) 35 ml/m2 ml/m2 mm Aortic Mitral LVOT (TVI) 22.0 cm TVI of MR jet cm Tricuspid TR jet 1.54 1 m/sec AV (TVI) LVOT peak V 1.0 cm m/sec E (06-1) 0.59 m/sec RVSP 14 mmHg A (0.3.0.8) 0.67 m/sec RAP 5 mmHg PSPG/MSPG. 4.1/2.4 mmHg DT (170-210) 193.51 msec MPAP mmHg AV Peak V PSPG/MSPG 1 m/sec mmHg PHT msec PVR MDPG mmHg MDPG mmHg AVA by 2D by continuity PHT of AR jet RV function TAPSE TDI S HR /min RVOT VTI CM cm2 MVA by 20 cm2 Pulmonic msec by PHT cm2 by continuity cm2 PSPGMSPG RVOTAT mmHg m/sec mm cm/sec FAC TDI S 72 cm/sec E 7.2 cm/sec A 10.4 cm/sec EE 8 Confirmed by: (81700) Sonographer: 조수현 Responsible Dr.: 488(81700) 출력일시 2025-03-10 17:16 출력자 이지원 원본대조필 페이지 1/2 641020-2****** 명지병원 환자번호 01371838 환자이름 석향숙 진료과 심장내과 담당의 이지현 출력일시 2025-03-10 17:16 출력자 이지원 CA ECHO검사 성별/나이 여/60 주민등록번호 641020-2****** 전자서명자 서용성 원본대조필 명지병원 페이지 2/2 EKG 환자번호 01371838 환자이름 석향숙 성별/나이 여/60 주민등록번호 641020-2****** 진료과 심장내과 담당의 이지현 전자서명자 황의석 EKG SHS Patient ID: 01371838 2025/02/05 13:46:02 60YEARS = Vent. Rate PR interval 65 bpm 166 ms QRS duration 92 ms QT/QTC P-R-T axes 396/411 ms 1/35/52 P duration 출력일시 2025-03-10 17:16 출력자 이지원 REST ECG/4* 2.5s+ 1Rhythm Interpretation Normal sinus rhythm Nonspecific ST abnormality Abnormal ECG AiTiA-LVSD Score 0.0 (Low risk) Confirmed By: EuiSeock Hwang aVR T 5 T T V4 V5 V2 aVL 원본대조필 명지병원 MY ONG HOSPIT 페이지 1/2 EKG 환자번호 진료과 01371838 환자이름 석향숙 성별/나이 여/60 주민등록번호 641020-2****** 심장내과 담당의 이지현 전자서명자 황의석 = GE MAC5K V008B(1) 25mm/s 10mm/mV 16-150Hz 60Hz aVF V3 Attending MD: 원본대조필 명지병원 출력일시 2025-03-10 17:16 출력자 이지원 페이지 2/2 MY ONG HOSPITA V6 [별지 제1호 서식] 진료비 세부산정내역 서식 (제2조제1항 관련) 진료비 세부산정내역 환자등록번호 01371838 환자성명 진료기간 병실 환자구분 비고 석향숙 2025-02-26 2025-02-26 심장내과 [건강\n   가입일: 미확인\n   상품명: 미확인 상품\n   담보내용: 미확인 담보\n   상태: 유효\n\n■ 보험 가입 이력 (Insurance History)\nNaN\n[보험 가입 3개월 이내]\n미확인 제출용 비 고 「의료법」 제17조 및 같은 법 시행규칙 제9조제1항에 따라 위와 같이 진단합니다. 의료기관 명칭: 명지병원 長病明 2025년 02월 26일 전화번호 : 031) 810-5114 주소: 경기도 고양시 덕양구 화수로 14번길 55 팩스번호 : 031) 810-5190 √ 의사 [ 치과의사 한의사 상한의사 면허번호 제 103836 호 성명: 이지현 작성방법 1. 환자의 인적사항은 진찰한 의사, 치과의사 또는 한의사가 주민등록증, 기간 만료 전 여권, 운전면허증, 공무원증, 국립·공립대학 학생증, 군무원증, 건강 가입 (미확인)\n\n[보험 가입 3개월 이내]\n미확인 제출용 발급매수 : 37 의무기록 사본 증명서 제공되는 의무기록은 석향숙님의 의료정보로 안전하게 관리하여 주시고, 가입 (미확인)\n\n[보험 가입 3개월 이내]\n미확인 제출용 용도 외에는 이용할 수 없으며, 가입 (미확인)\n\n[보험 가입 3개월 이내]\n미확인 제출용 목적 달성 시 즉시 파기하여 주시기 바랍니다. 첨부한 사본은 의무기록 원본과 틀림이 없음을 증명합니다. 2025 년 03 월 10 일 의료법인 명지의료재단 명지병원장 長明 三輪知 ※ 담당자 서명이 없는 것은 무효임 담당자 명지병원 MYONGJI HOSPITA 환자번호 01371838 환자이름 석향숙 진료과 심장내과 담당의 이지현 진료일자 2025-02-26 Vital Sign SBP 101 (mmHg) 외래 재진기록지 성별/나이 01/60 주민등록번호 641020-2****** 전자서명자 이지현A DBP 59 (mmHg) 맥박 74 (/min) 특이사항 퇴원-LAB, EKG,CHEST 약물알러지 있음 없음 또는 알수없음 Summary angina visit: 간헐적으로 답답하고 조여서 내원. 등도 아플때도 있었다. undelrying dz: HTN (10yr) HL (4yrs) DM (1~2yr) self med: 자디앙듀오정12.5/1000mg, 아세타졸정,알티스정480mg,아시돌연질캡슐1g,디핀스정80/5 mg, 에제로바정10/5mg,니자리딘캡슐150mg exertioanal angina occupation: 일하다가 휴직 EGD: 2024 GERD + FHX: 부친 VHD 모친 DM HTN stent never alcohol NSR 65 no cm 2025.2.12 TTE: no RWMA EF 66%, E/e' 8 dilaa 38mm Objective 주요 검사결과 2025.2.19 CAG: minimal CAD, diff. ecc. 30% LN of p-mRCA & 35-40% LN of dLCx, ergonovine provocation test positive 2025.2.19 Carotid US : 1.11/1.23 Assessment 진단명 Variant angina Coronary(artery) disease Nause with vomiting Convalescence following other treatment Hyperlipidaemia, unspecified Type 2 diabetes mellitus, without complications Plan 2025-02-26 =>>> Rosulord tab 5mg/T ((주)종근당) 1 # 1x30 2025-02-26 → Isotril ER tab.60mg/T (코오롱제약(주)) 1 # 2x30 출력일시 2025-03-10 17:16 출력자 이지원 원본대조필 페이지 1/2 명지병원 NYONGI MOSPITAL 환자번호 01371838 진료과 심장내과 환자이름 석향숙 담당의 이지현 2025-02-26 CBC with Diff = => 2025-02-26 BUN, Urea Nitrogen 2025-02-26 Creatinine (serum) => 2025-02-26 Electrolyte 3종 = 2025-02-26 ⇒ ALP = 2025-02-26 AST[SGOT] => 2025-02-26 ALT[SGPT] = 2025-02-26 Y-GT = 2025-02-26 ⇒ CK = 2025-02-26 T.Cholesterol 2025-02-26 => Triglyceride 2025-02-26 HDL-Cholesterol 2025-02-26 LDL-Cholesterol 2025-02-26 Uric acid (serum) 2025-02-26 Glucose(Serum) = 2025-02-26 CRP(hs-CRP) 기존약에 상기약제 복용 1개월후 약제 all change 출력일시 2025-03-10 17:16 출력자 이지원 외래 재진기록지 성별/나이 04/60 주민등록번호 641020-2****** 전자서명자 이지현A 작성의 이지현 원본대조필 ?명지병원 페이지 2/2 단기 입원기록지 환자번호 01371838 진료과 심장내과 환자이름 석향숙 성별/나이 여/60 주민등록번호 담당의 이지현 전자서명자 이지현A 입원일자 2025-02-19 입원과 심장내과 입원의사 이지현 퇴원일자 2025-02-19 퇴원과 심장내과 퇴원의사 이지현 최종진단명 구분 확진 질병코드 진단명 주진단명 1200 Unstable angina 처치명 시행일자 시행과 처치명 2025-02-19 CARDIC CATH 2025-02-19 심장내과 관상동맥 조영촬영 Coronary Angiography 관상동맥 조영촬영 Coronary Angiography 입원기록 요약 및 퇴원시 환자상태 주호소 주호소 for CAG Onset 내원당일 과거력 ㅁ없음 ㅁ모름 ODM OHTN OTB Hepatitis Hyperlipidemia □뇌혈관질환 ㅁ심혈관질환 ㅁ수술력 현재 병력 기타알러지 ■기타하기기재 undelrying dz: HTN (10yr) HL (4yrs) DM (1~2yr) diagsnotic CAG 시행 위하여 DCC 내원함. 신체검사 CE Wnl 경과 및 치료과정 undelrying dz: HTN (10yr) HL (4yrs) DM (1~2yr) diagsnotic CAG 시행 위하여 DCC 내원함. 출력일시 2025-03-10 17:16 출력자 이지원 원본대조필 페이지 1/4 641020-2****** 명지병원 MYONGI ROSPITA 환자번호 진료과 심장내과 01371838 환자이름 석향숙 담당의 이지현 단기 입원기록지 성별/나이 여/60 주민등록번호 641020-2****** 전자서명자 이지현A 2025.2.19 CAG: minimal CAD, diff. ecc. 30% LN of p-mRCA & 35-40% LN of dLCx, ergonovine provocation test positive 2025.2.19 Carotid US: 1.11/1.23 Lab 검사결과 [2025-02-19] Calcium: 8.8 [2025-02-19] I. phosphorus: 3.2 [2025-02-19] Glucose: 104 [2025-02-19] BUN: ↑ 29.2 [2025-02-19] Creatinine : 0.73 [2025-02-19] eGFR (CKD-EPI): 89.8 [2025-02-19] Uric Acid : 3.2 [2025-02-19] T. Protein : 6.5 [2025-02-19] Albumin : 4.5 [2025-02-19] T.Bilirubin : 0.98 [2025-02-19] ALP : 90 [2025-02-19] AST (SGOT): 16 [2025-02-19] y-GT: 14 [2025-02-19] ALT (SGPT): 19 [2025-02-19] CRP: 0.07 [2025-02-19] Na: 142 [2025-02-19] K: 4.0 [2025-02-19] Cl: 1 111 [2025-02-19] CO2 : 23 [2025-02-19] CK: 53 [2025-02-19] CK-MB : 0.4 [2025-02-19] high-sensitivity Troponin 1: < 2.51 [2025-02-19] NT-proBNP ↑ 128.00 [2025-02-19] WBC Count: 8.6 [2025-02-19] RBC Count: 4.5 [2025-02-19] Hemoglobin: 13.1 [2025-02-19] Hematocrit : 40.9 [2025-02-19] Platelet Count : 178 [2025-02-19] MCV : 91.7 [2025-02-19] MCH: 29.4 [2025-02-19] MCHC: 32.0 [2025-02-19] RDW : 13.3 출력일시 2025-03-10 17:16 출력자 이지원 원본대조필 명지병원 페이지 2/4 환자번호 진료과 심장내과 01371838 환자이름 석향숙 담당의 이지현 [2025-02-19] PDW : 9.7 [2025-02-19] MPV : 9.1 단기 입원기록지 [2025-02-19] PCT: 10.160 [2025-02-19] Segmented neutrophil%: 74.0 [2025-02-19] Lymphocyte%: 20.0 [2025-02-19] Monocyte%: 4.8 [2025-02-19] Eosinophil%: 1.1 [2025-02-19] Basophil% : 0.1 성별/나이 04/60 주민등록번호 전자서명자 이지현A [2025-02-19] NRBC : 0.0 [2025-02-19] Lymphocyte# : 1.71 [2025-02-19] Monocyte# : 0.41 [2025-02-19] Eosinophil#: 0.09 [2025-02-19] Basophil# : 0.01 [2025-02-19] (ANC) neutrophil(Segmented,Band) : 6.35 [2025-02-19] D-Dimer : 0.31 퇴원약 약품코드 약품명 용법 용량 횟수 일수 JTNTG Nitroglycerin tab.0.6mg/T (명문 제약(주)) 의사 지시대로 복용 1 1 4 Nitrolingual spray 0.4mg*1회당/ JENTGLS 의사지시대로 1 1 1 14.4ml/BT ((주)한국유니팜) JTROSU Rosulord tab 5mg/T ((주)종근당) 1일 1회 아침식후 30분에 복 용하세요 1 1 10 UTIST6 Isotril ER tab.60mg/T (코오롱제 1일 2회 아침, 저녁식후 30분 약(주)) 1 2 10 에 복용하세요 퇴원형태 퇴원지시후 환자상태 및 진료결과 호전 추후치료계획 외래진료 ○추후 재입원 ○타병원진료 ○가정간호 ㅇ치료종결 외래예약정보 외래예약일 2025-02-28 진료과 주치의 심장내과 이지현 퇴원계획 퇴원예정일 2025-02-19 퇴원 후 치료식이 여부 No ○Yes 추후관리계획 사회 복지서비스 연계 필요성 No 외래 ○가정간호 ○타병원 전원 호스피스 OYes 퇴원 후 거주장소 자가 사회복지시설 ○기타 출력일시 2025-03-10 17:16 출력자 이지원 원본대조필 페이지 3/4 641020-2****** 명지병원 환자번호 01371838 환자이름 석향숙 진료과 심장내과 담당의 이지현 담당의사 이지현 단기 입원기록지 성별/나이 01/60 주민등록번호 전자서명자 이지현A 담당교수 이지현 641020-2****** 원본대조필 명지병원 출력일시 2025-03-10 17:16 출력자 이지원 페이지 4/4 환자번호 진료과 심장내과 01371838 환자이름 석향숙 담당의 이지현 2025-02-19 처방일자 의사지시기록 순번 처방일시 의사지시기록지 성별/나이 01/60 주민등록번호 641020-2****** 전자서명자 이지현 D/C 반납 의사 지시 내용 처방량 처방의 구분 구분 2025-02-19 08 Macperan(맥페란) inj.10mg/2ml/A (1A#1 동화약품(주)) :43:22 2 3 1 2025-02-19 08 Aceta inj.1g/100ml/Bag ((주)비보존 1 BAG # 1 :43:22 제약) * 1 2025-02-19 080.9% NS 50ml/BT (제이더블유생명 1BT#1 :43:22 과학(주)) 1 2025-02-19 08 Tridol inj.100mg/2ml/A ((주)유한양 0.5 A # 1 행) 4 :43:22 1 2025-02-19 08 1A#1 5 Lasix inj.20mg/2ml/A ((주)한독) :43:22 6 7 이지현 이지현 * 이지현 * 이지현 이지현 2025-02-19 08 Tridol inj.100mg/2ml/A ((주)유한양 1A#1 :43:22 행) 1 2025-02-19 08 0.9% NS inj.100ml/bag (제이더블유 1 BAG # 1 :43:22 생명과학(주)) 1 * 이지현 이지현 2025-02-19 08 8 Denogan inj.1g// (영진약품(주)) 1V#1 1 이지현 :43:22 2025-02-19 08 0.5 A # 1 * 9 Lasix inj.20mg/2ml/A ((주)한독) 이지현 :43:22 1 10 2025-02-19 080.9% NS inj.100ml/bag (제이더블유 1 BAG # 1 :43:22 생명과학(주) * 1 2025-02-1908 Apidra inj.1000IU/10ml/N ((주)사노 10 IU # 1 피-아벤티스코리아) 이지현 * 11 이지현 :43:23 1 12 2025-02-19 08 Apidra inj.1000IU/10ml/V ((주)사노 6 IU # 1 :43:23 피-아벤티스코리아) * 이지현 1 13 :43:23 2025-02-1908 Apidra inj.1000IU/10ml/N ((주)사노 4 IU#1 피-아벤티스코리아) * 이지현 1 14 2025-02-19 08 Apidra inj.1000IU/10ml/N ((주)사노 2IU#1 :43:23 피-아벤티스코리아) * 이지현 1 15 2025-02-19 080.9% NS 50ml/BT (제이더블유생명 :43:23 과학(주)) 1 BT #1 * 이지현 1 16 :43:23 17 생명과학(주)) 18 2025-02-19 08 Binicapin(소) inj.5mg/5ml/A ((주)비 2MG #1 씨월드제약) 2025-02-19 080.9% NS inj.100ml/bag (제이더블유 80 ML # 1 :43:23 2025-02-1908 Binicapin(대) inj.20mg/20ml/A ((주)1A #1 이지현 이지현 * 1 * 1 출력일시 2025-03-10 17:16 출력자 이지원 원본대조필 페이지 1/4 * 이지현 명지병원 의사지시기록지 환자번호 01371838 진료과 심장내과 환자이름 석향숙 담당의 이지현 성별/나이 04/60 주민등록번호 전자서명자 이지현 :43:23 비씨월드제약) 1 19 :43:23 2025-02-19 08 Peniramine inj.4mg/2ml/A ((주)유한 1A#1 양행) * 이지현 1 * 20 이지현 21 22 :44:39 23 :44:39 2025-02-19 08Apidra inj.1000IU/10ml/V ((주)사노 8IU#1 :43:23 피-아벤티스코리아) 1 2025-02-19 080.9% NS inj.100ml/bag (제이더블유 1BAG #1 :43:23 생명과학(주)) 1 2025-02-19 080.9% NS 1000ml/bag(중외) (제이더 1 BAG #1 블유생명과학(주)) 1 2025-02-19 08 Muteran(대-뮤테란) inj.600mg/6ml/2A #2 A (한화제약(주)) * 이지현 이지현 이지현 1 CAG 전후 2025-02-1908 관상동맥 조영촬영 Coronary Angio 24 1 * 1 * 1 이지현 :44:39 graphy 2025-02-19 08 25 Portable EKG 1 * * 이지현 :44:39 2025-02-19 08 26 CRP(hs-CRP) 1 1 1 이지현 :44:39 2025-02-19 08 27 27 NT-proBNP 1 1 * 1 이지현 :44:39 2025-02-19 08 28 D-Dimer * 1 * 이지현 :44:39 2025-02-19 08 29 High-Sensitivity Troponin I (TNIH) 1 * 1 * 1 이지현 :44:39 2025-02-19 08 30 CK-MB 1 1 * 1 이지현 :44:39 2025-02-19 08 31 CK 1 * 1 * 1 이지현 :44:39 32 32 2025-02-19 08 Y-GT 1 * 1 * 1 이지현 :44:39 2025-02-19 08 33 ALT[SGPT] 1 * 1 * 1 이지현 :44:39 2025-02-19 08 34 AST[SGOT] 1 1 * 1 이지현 :44:39 2025-02-19 08 35 ALP 1 1 * 1 이지현 :44:39 2025-02-19 08 36 T. Bilirubin (serum) 1 * 1 * 1 이지현 :44:39 2025-02-19 08 37 Uric acid (serum) 1 * 1 * 1 이지현 :44:39 출력일시 2025-03-10 17:16 출력자 이지원 원본대조필 페이지 2/4 641020-2****** ?명지병원 의사지시기록지 환자번호 01371838 진료과 심장내과 환자이름 석향숙 담당의 이지현 성별/나이 01/60 주민등록번호 전자서명자 이지현 2025-02-19 08 38 T. Protein (serum) 1 * * 이지현 :44:39 2025-02-19 08 39 Glucose(Serum) 1 1 1 이지현 :44:39 2025-02-19 08 40 40 Albumin (serum) 1 * 1 * 1 이지현 :44:39 2025-02-19 08 41 1.Phos (serum) * 1 * 1 이지현 :44:39 2025-02-19 08 42 Calcium (serum) 1 * 1 * 1 이지현 :44:39 2025-02-19 08 43 Electrolyte 4종 1 1 * * 1 이지현 :44:39 2025-02-19 08 44 Creatinine (serum) * 1 * 1 이지현 :44:39 2025-02-19 08 45 45 BUN, Urea Nitrogen 1 * 1 * 1 이지현 :44:39 2025-02-19 08 46 CBC with Diff 1 * * 1 이지현 :44:39 2025-02-19 10 47 US-Carotid Artery 1 1 1 이지현 :48:54 2025-02-19 11 48 Gluco-Stick Test 1 * 1 * 1 이지현 :08:34 2025-02-19 11 49 49 EKG 심전도 * 1 * 1 이지현 :26:35 2025-02-19 11 50 High-Sensitivity Troponin I (TNIH) * 1 1 1 * 이지현 :26:35 2025-02-19 11 51 BUN, Urea Nitrogen 1 * 1 * 1 이지현 :26:35 2025-02-19 11 42 52 CK * 1 * 1 이지현 :26:35 2025-02-19 11 53 NT-proBNP * * 1 이지현 :26:35 2025-02-19 11 54 CRP(hs-CRP) 1 * 1 * 1 이지현 :26:35 2025-02-19 11 55 Electrolyte 3종 1 1 * 1 이지현 :26:35 2025-02-19 11 56 Creatinine (serum) 1 * 1 * 1 이지현 :26:35 57 2025-02-19 11 Chest PA 1 1 * * 1 이지현 출력일시 2025-03-10 17:16 출력자 이지원 원본대조필 페이지 3/4 641020-2****** 명지병원 MYONGIKOSPITAL 환자번호 진료과 심장내과 01371838 환자이름 석향숙 담당의 이지현 의사지시기록지 성별/나이 여/60 주민등록번호 전자서명자 이지현 :26:35 2025-02-19 11 58 CBC with Diff 1 * 1 * 1 이지현 :26:35 2025-02-19 11 59 CK-MB 1 * 1 * 1 이지현 :26:35 60 :07:59 2025-02-19 14 Nitroglycerin tab.0.6mg/T (명문제 1T#1 약(주)) 2025-02-19 14 Nitrolingual spray 0.4mg*1회당/14.4 1 BT # 1 * 4 이지현 SIGT1 61 이지현 :07:59 ml/BT ((주)한국유니팜) 1 SIGE 2025-02-19 14 1T#1 * 1 62 Rosulord tab 5mg/T ((주)종근당) 이지현 :08:24 0 QDPC 63 :08:24 )) 2025-02-19 15 64 :24:23 1 :44:39 2 2025-02-19 14|sotril ER tab.60mg/T (코오롱제약(주1T#2 *1 Discharge (퇴원합니다) 2025-02-19 08처치지시 입원:1일:V/S TIME:q 8hr, B ST TIME:1 times 2025-02-19 14 처치지시 퇴원(외출)약/기존 지참약 유지하면서 퇴원약 :07:59 2025-02-19 14 처치지시 퇴원(외출)약/자디앙듀오 2 :07:59 1일 후 부터 복용합니다. 이지현 이지현 이지현 이지현 0 BIDPC 1 * * 1 이지현 처치지시 퇴원(외출)약/*NTG: chest 2025-02-19 14 3 :07:59 pain 발생시 1T SL 10분간격 최대 2 회 출력일시 2025-03-10 17:16 출력자 이지원 이지현 641020-2****** 원본대조필 명지병원 페이지 4/4 1일 입원실 간호기록지 (Daycare Center) 환자번호 진료과 심장내과 01371838 환자이름 석향숙 담당의 이지현 성별/나이 01/60 주민등록번호 641020-2****** 전자서명자 이지영 입원일자 2025-02-19 일반정보 입원경로 Ambulatory OWheel chair OCart 입원시 동반자 ㅇ없음 가족 ㅇ기타 입원시 교육 입원시 준비물품 1입원시 생활안내문 설명 ?가스 전열기구 사용금지 및 화재방지 ■환자권리장전 및 환자 책임에 대하여 설명 ㅣ금연교육 함 귀중품 관리 및 도난방지 [쓰레기 분리수거 린넨관리 1주차관리 약물알러지 있음 )없음 또는 알수없음 기타알러지 음식 없음 있음 기타 없음 있음 약품 입원직전 복용하던 약 ㅇ없음 있음타원 HTN, HL 현재 가지고 온약 ) 없음 있음 입원일시 2025-02-19 08:36 신장 164 (cm) 체중 77 (Kg) BMI 28.6(kg/m²) 직업 회사원 입원동기 주증상 For CAG 과거병력 ㅁ없음 ㅣ고혈압 당뇨 간염 ■기타 HL 활력징후 날짜 시간 SBP DBP 체온 맥박 호흡 2025-02-19 09:00 147 82 36.3 52 20 20 11:05 163 87 36.2 59 20 11:40 150 78 36.2 60 20 1. 통증사정도구 NRS OFPRS OFLACC Ⅲ. 통증양상 1. 쑤시는 듯한 2. 날카로운 3. 짓누르는 4. 타는 듯한 5. 욱신욱신 쑤심 6. 쥐어짜는 듯한 7. 바늘로 찌르는 듯한 8. 콕콕 쑤시는 9. 따끔거림 10. 화끈거림 출력일시 2025-03-10 17:16 출력자 이지원 원본대조필 페이지 1/3 명지병원 MYONGIKOSPITAL 1일 입원실 간호기록지 (Daycare Center) 환자번호 진료과 심장내과 01371838 환자이름 석향숙 담당의 이지현 Ⅲ. 비약물 중재 성별/나이 01/60 주민등록번호 641020-2****** 전자서명자 이지영 마사지, 지압, 냉찜질, 온찜질, 심호흡, 이완요법, 심상요법, 전환요법 (영화감상, TV시청, 음악감상, 산책 등) 평가일시 강도 위치 양상 빈도 지속시간 중재(약물 또는 비약물) 간호사 이도윤(D 초기평가 02-19 08:45 0 CC) 이도윤(D 재평가 02-19 11:05 0 CC) 재평가 재평가 재평가 재평가 재평가 날짜 시간 간호기록 간호사 2025-02-19 08:45 외래 통해 걸어서 입원함 CA안슬기에게 알림 금식, 속옷, 장신구 제거 확인함 금일 아침 약 복용 유무 확인함 \"그저께 NTG 복용했어요.\" 이도윤(DC 보호자 같이 내원했는지 확인함 이도윤(DC 09:06 portable EKG 시행함 이도윤(DC 09:20 Full voiding 후 CAG위해 이동침대로 심혈관촬영실감 C) 11:05 CAG 시행후 이동침대로 병실복귀함 식이 가능함을 설명함 Rt.radial CAG site compression set Rt.finger's s ense, motor 양호함 사정 : 금일 CAG 시행함 계획 및 수행 : CAG 부위 관찰함 계획 및 수행 : 출혈즉시 간호사에게 말하도록 교육함 계획 및 수행: 침상안정해야 함을 설명함 이도윤(DC 계획 및 수행 : 검사 및 시술 후 주의사항 안내문을 지급함 출력일시 2025-03-10 17:16 원본대조필 출력자 이지원 페이지 2/3 명지병원 MYONGJI KOSITA 1일 입원실 간호기록지 (Daycare Center) 환자번호 01371838 환자이름 석향숙 진료과 심장내과 담당의 이지현 성별/나이 04/60 주민등록번호 641020-2****** 전자서명자 이지영 11:06 V/S 163/87-59-36.2 \"머리가 조금 아파요\"CA안슬기에게 알 이도윤(DC 림 C) 이도윤(DC 11:35 평가: CAG 부위 출혈없음 C) 이도윤(DC 11:40 V/S 150/78-36.2-60-20 측정됨을 CA안슬기에게 알림 C) 이도윤(DC 13:35 US-Carotid Artery위해 심초음파실 이동함. 이지영(DC) 14:20 병실복귀함 이지영(DC 15:03 CAG site bleeding,hematoma 없이 침상안정 중임 15:25 Rt.radial CAG site compression Dressing 시행함 by CA안 이도윤(DC 슬기 C) 15:38 퇴원 후 압박 Dressing 제거 시간 설명함 퇴원 후 주의사항 설명함 익일 CAG site 소독방법 설명함 이지영(DC 퇴원약 지급하고 외래예약/ 외래검사 설명함 이지영(DC 15:40 보호자와 함께 걸어서 퇴원함 출력일시 2025-03-10 17:16 출력자 이지원 원본대조필 명지병원 페이지 3/3 환자번호 진료과 심장내과 01371838 환자이름 석향숙 담당의 이지현 임상화학검사(일반) 성별/나이 04/60 주민등록번호 641020-2***** 전자서명자 조해원 등록번호 01371838 진료과 심장내과 검사자 N/A 환자명 석향숙 성별/나이F/60 의뢰의사 이지현 병동 DCC/DCC 확인의사 조해원 검체명 Serum, SST 진단명 Unstable angina 처방일시 2025-02-19 08:44 접수일시 2025-02-19 09:06 보고일시 2025-02-19 09:58 검체번호 20250219A00467 0 검사 결과 검사명 결과 H/L 참고치 단위 Calcium 8.8 8.7 10.4 mg/dL 1. phosphorus 3.2 2.4 5.1 mg/dL Glucose 104 73 106 mg/dL BUN 29.2 H 9 23 mg/dL Creatinine 0.73 0.5 1.1 ~ mg/dL mL/min/1.7 ...eGFR (CKD-EPI) 89.8 > 60.0 3m2 Uric Acid 3.2 3.0 7.0 mg/dL T. Protein 6.5 5.7 2 8.2 g/dL Albumin 4.5 ~ 3.2 4.8 g/dL T. Bilirubin 0.98 0.30 ~ 1.20 mg/dL ALP 90 ~ 46 116 U/L AST (SGOT) 16 < 34 U/L ALT (SGPT) 19 10 49 U/L Y-GT 14 < 38 U/L Na 142 ~ 132 146 mmol/L Electrolyte (4종) K 4.0 3.5 5.5 mmol/L Cl 111 H 99 109 mmol/L CO2 23 20 31 mmol/L CK 53 40 ~ 235 U/L CK-MB 0.4 <= 5 ng/mL high-sensitivity Troponin I < 2.51 < 38.64 pg/mL NT-proBNP 128.00 H <125 pg/mL 출력일시 2025-03-10 17:16 원본대조필 명지병원 출력자 이지원 페이지 1/1 CAG 환자번호 01371838 환자이름 석향숙 진료과 심장내과 담당의 이지현 성별/나이 여/60 전자서명자 주민등록번호 641020-2****** CAG MYONGJI HOSPITAL Coronary Angiography & PCI Report Date: 2025.19 Age/Sex: 60 ( ) M (4) F Cath. No : Name: : Hos. ID 1471836 Clinical Diagnosis: No unstable signa ~ Vent Ref. Dr. : Puncture Site Femoral Operator: Rt.( ) Lt. ( ) 01 시현 Radial Rt.Lt. ( ) Others Cardiogenic shock: Y( ) N( CHF : Y( ) Nex 2 Ar shorth Rt dominant coronary artery AGA ZJR 4-x upto drt.co. 30x wf parked 014 Conclusion: Comments: 출력일시 2025-03-10 17:16 출력자 이지원 PILO S LGA2744-35 .diff. ea. upho крашенню 13: Ang Poppins provocanter text & Voca 85 Vasspor ··RCA As well. Variant anjha Mrinal CAD Medical Textment Cardiac Catheterization Laboratory 7697-24 Tel: 031-810-6776, 6786 원본대조필 페이지 1/1 0/2/82 명지병원 환자번호 진료과 심장내과 01371838 환자이름 석향숙 담당의 이지현 CA ECHO검사 Exam Date 2025-02-19 Patient ID: 01371838 Location: DCC Height: cm Comments RT- CA ECHO검사 성별/나이 여/60 주민등록번호 전자서명자 서용성 ECHOCARDIOGRAPHY LABORATORY MYONGJIHOSPITAL Carotid Duplex Ultrasound Report Weight: Echo No.: 25 - 02 Name: 석향숙 Referring Dr.: 0 Sex/Age: F Referral Reason: Subclinical atherosclerosis screening BSA: m2 BP: kig LT 060Y /mmHg 1. Significant thickened IMT (far wall: 1.11mm) in Rt proximal CCA without significant stenotic flow & Significant thickened IMT(far wall: 1.07mm) in Rt distal CCA without significant stenotic flow. Carotid IMT(CCA) Right CCA 1. Significant thickened IMT (far wall: 1.09mm) in Lt distal CCA without significant stenotic flow. 2. Mild homogeneous plaque(far wall:1.23mm) in Lt proximal CCA without significant stenotic flow. Left CCA ICA ECA CCA R ICA ECA CCA MAX IMT Rt far wall prox: 1.11 mm Lt far wall prox: mm Rt far wall dist 1.07 mm Lt far wall dist: 1.09 mm Carotid Plaque Absence Single Multiple Location & Size CR: CCA R: ICA CRt bulb Morphology Echogenecity: Texture: Hyperechoic Homogenous Surface feature: Smooth Calcification: Present Doppler Study mm DL: CCA 1.23 mm mm DL: ICA mm mm CLt bulb mm CEchogenic Heterogenous Dirregular Absent Hypoechoic Acoustic Shadowing Right PSV (cm/sec) Right EDV (cm/sec) Left PSV (cm/sec) Left EDV (cm/sec) CCA proximal 73.8 7.2 88.3 17 CCA distal 64.8 10.2 84.9 109 ICA 46.8 15.1 56.4 174 ICA/CCA ratio 0.63 2.10 0.64 1.02 ECA 76.3 8.06 52.2 3 Vertebral artery 23.1 541 23.4 1.2 Confirmed by: 488 (62830) Sonographer: 김승아 Responsible Dr.: 18(81700) 출력일시 2025-03-10 17:16 원본대조필 출력자 이지원 페이지 1/2 641020-2****** 명지병원 MYONGJI HOSPITA炭 환자번호 01371838 환자이름 석향숙 진료과 심장내과 담당의 이지현 출력일시 2025-03-10 17:16 출력자 이지원 CA ECHO검사 성별/나이 01/60 주민등록번호 641020-2****** 전자서명자 서용성 원본대조필 명지병원 페이지 2/2 EKG 환자번호 진료과 심장내과 01371838 환자이름 석향숙 성별/나이 여/60 주민등록번호 641020-2****** 담당의 이지현 전자서명자 황의석 EKG REST ECG/4* 2.5s+ 1Rhythm S HS Patient ID: 01371838 2025/02/19 09:18:36 60YEARS Vent. Rate 48 bpm PR interval 172 ms QRS duration 104 ms Interpretation Sinus bradycardia Otherwise normal ECG QT/QTC P-R-T axes 430/384 ms -6/38/50 AiTiA-LVSD Score 0.1 (Low risk) P duration Confirmed By: EuiSeock Hwang aVR V1 V4 || aVL V2 V5 2025-03-10 17:16 출력일시 출력자 이지원 원본대조필 명지병원 페이지 1/2 h h EKG 환자번호 01371838 환자이름 석향숙 성별/나이 여/60 진료과 심장내과 담당의 이지현 전자서명자 황의석 = GE MAC5K V008B(1) 25mm/s 10mm/mV 16-150Hz 60Hz 출력일시 2025-03-10 17:16 출력자 이지원 aVF 주민등록번호 641020-2****** V3 Attending MD: 원본대조필 명지병원 페이지 2/2 MY ON GAI HOSPIT la h 'V6 환자번호 진료과 심장내과 01371838 환자이름 석향숙 담당의 이지현 임상화학검사(일반) 성별/나이 여/60 주민등록번호 641020-2****** 전자서명자 조해원 등록번호 01371838 진료과 심장내과 검사자 N/A 처방일시 2025-02-19 15:47 환자명 석향숙 성별/나이 F/60 의뢰의사 이지현 병동 확인의사 조해원 검체명 Serum, SST 진단명 Variant angina 접수일시 2025-02-26 10:56 보고일시 2025-02-26 11:41 검체번호 20250226A00712 0 검사 결과 검사명 결과 H/L 참고치 단위 BUN 22.7 9 23 mg/dL Creatinine 0.89 0.5 1.1 mg/dL mL/min/1.7 ....eGFR (CKD-EPI) 70.7 > 60.0 3m2 Na 141 2 132 146 mmol/L Electrolyte (3종) K 4.1 ~ 3.5 5.5 mmol/L Cl 108 99 109 mmol/L CK 57 40 235 U/L CK-MB 0.8 <= 5 ng/mL high-sensitivity Troponin I <2.51 < 38.64 pg/mL NT-proBNP 62.00 <125 pg/mL 출력일시 2025-03-10 17:16 출력자 이지원 원본대조필 명지병원 페이지 1/1 일반촬영검사 판독결과지 환자번호 01371838 진료과 심장내과 환자이름 석향숙 성별/나이 여/60 주민등록번호 담당의 임정기 전자서명자 임정기 처방일자 2025/02/19 촬영일자 2025/02/26 판독일자 2025/02/26 판독의(1) N/A 판독의(2) 임정기 전사자 N/A 소견 Chest PA(2025-02-19 00:00:00) Within normal limits. 출력일시 2025-03-10 17:16 출력자 이지원 원본대조필 페이지 1/1 641020-2****** 명지병원 EKG 환자번호 01371838 환자이름 석향숙 성별/나이 여/60 주민등록번호 641020-2****** 진료과 심장내과 담당의 이지현 전자서명자 황의석 EKG SHS Patient ID: 01371838 2025/02/26 11:11:57 60YEARS Vent. Rate 63 bpm PR interval 168 ms QRS duration QT/QTC P-R-T axes P duration 94 ms 398/407 ms 4/42/46 2025-03-10 17:16 출력일시 출력자 이지원 aVR aVL 원본대조필 페이지 1/2 REST ECG/4* 2.5s+ 1Rhythm Interpretation Normal sinus rhythm Normal ECG AiTiA-LVSD Score 0.1 (Low risk) Confirmed By: EuiSeock Hwang r 명지병원 M? ONG HOSPITA 나나무 V5 h EKG 환자번호 01371838 환자이름 진료과 심장내과 담당의 석향숙 이지현 성별/나이 여/60 주민등록번호 641020-2****** 전자서명자 황의석 GE MAC5K V008B(1) 25mm/s 10mm/mV 16-150Hz 60Hz 출력일시 2025-03-10 17:16 출력자 이지원 aVF Attending MD: 원본대조필 명지병원 MY ONG II HOSPIT 페이지 2/2 ? V6 환자번호 01371838 진료과 심장내과 담당의 환자이름 석향숙 이지현 진료일자 2025-02-12 Vital Sign 외래 재진기록지 성별/나이 01/60 주민등록번호 641020-2****** 전자서명자 이지현A SBP 124 (mmHg) DBP 70 (mmHg) 맥박 78/min) 특이사항 LAB,TTE 약물알러지 있음 없음 또는 알수없음 Summary angina visit: 간헐적으로 답답하고 조여서 내원. 등도 아플때도 있었다. undelrying dz: HTN (10yr) HL (4yrs) DM (1~2yr) self med: 자디앙듀오정12.5/1000mg, 아세타졸정,알티스정480mg, 아시돌연질캡슐1g, 디핀스정80/5 mg, 에제로바정10/5mg, 니자리딘캡슐150mg exertioanal angina occupation: 일하다가 휴직 EGD: 2024 GERD + FHX: 부친 VHD 모친 DM HTN stent never alcohol NSR 65 no cm Objective 주요 검사결과 HbA1c 6.1 lipid 155/139/50/83 glc 91 CE wnl NT-proBNP 55 2025.2.12 TTE 1. No RWMA. 2. Normal sized cardiac chambers with normal LV systolic function (EF: 66%). 3. Relaxation abnormality of LV filling pressure (E/e': 8). 4. Concentric remodeling. 5. Dilated ascending aorta (38mm). Assessment 진단명 Chest pain (unspecified) Hypertensive heart disease NOS Type 2 diabetes mellitus, without complications Plan 2025-02-12 → Nitroglycerin tab.0.6mg/T (명문제약(주)) 1 # 1x4 출력일시 2025-03-10 17:16 출력자 이지원 원본대조필 페이지 1/2 명지병원 외래 재진기록지 환자번호 01371838 진료과 심장내과 환자이름 석향숙 담당의 이지현 성별/나이 01/60 주민등록번호 전자서명자 이지현A 2025.2.19 DCC adm. for diagsnotic CAG jardiance duo 2일전부터 skip 출력일시 2025-03-10 17:16 출력자 이지원 작성의 이지현 641020-2****** 원본대조필 명지병원 페이지 2/2 환자번호 01371838 진료과 심장내과 환자이름 석향숙 담당의 이지현 진료일자 2025-02-05 외래 초진기록지 성별/나이 여/60 주민등록번호 641020-2****** 전자서명자 이지현A 휴대폰 01031785794 주소 (230-19)인천 강화군 송해면 전망대로 127-42 신장 164 (cm) 체중 79 (Kg) BMI 29.3 (kg/m²) Vital Sign SBP 124 (mmHg) DBP 70 (mmHg) 맥박 78 (/min) 특이사항 신환 가슴통증, 답답 약- 자디앙듀오정12.5/1000mg,아세타졸정,알티스정480mg, 아시돌연질캡슐1ug, 디핀스 정80/5mg,에제로바정10/5mg, 니자리딘캡슐150mg EKG,CHEST 약물알러지 있음 없음 또는 알수없음 통증평가 ㅇ유 ○평가불가 - 사유 : 현재 병력 angina visit: 간헐적으로 답답하고 조여서 내원. 등도 아플때도 있었다. undelrying dz: HTN (10yr) HL (4yrs) DM (1~2yr) self med: 자디앙듀오정12.5/1000mg,아세타졸정,알티스정480mg,아시돌연질캡슐1g,디핀스정80/5 mg,에제로바정10/5mg, 니자리딘캡슐150mg exertioanal angina occupation: 일하다가 휴직 EGD: 2024 GERD + 가족력 ONO 사회력 주요 검사결과 NSR 65 no cm 진단명 주진단명 Yes 부친 VHD 모친 DM HTN stent Smokingnever Drinkingnever Chest pain (unspecified) Hypertensive heart disease NOS 진단명 Type 2 diabetes mellitus, without complications 구분 확진 기타진단명 기타진단명 치료계획 2025-02-05 = = CBC with Diff 출력일시 2025-03-10 17:16 출력자 이지원 원본대조필 명지병원 페이지 1/3 환자번호 진료과 심장내과 01371838 환자이름 석향숙 담당의 이지현 2025-02-05 => PT 2025-02-05 ⇒ aPTT 2025-02-05 Calcium (serum) = 2025-02-05 1.Phos (serum) 2025-02-05 BUN, Urea Nitrogen 2025-02-05 Creatinine (serum) 2025-02-05 Glucose (Serum) 2025-02-05 T. Protein (serum) = 2025-02-05 Albumin (serum) 2025-02-05 2025-02-05 2025-02-05 = Uric acid (serum) T.Cholesterol T. Bilirubin (serum) 2025-02-05 ⇒ ALP 2025-02-05 = AST[SGOT] 2025-02-05 → ALT[SGPT] 2025-02-05 ⇒ CK => 2025-02-05 ⇒ Hb A1c 2025-02-05 Triglyceride = 2025-02-05 = HDL-Cholesterol 외래 초진기록지 2025-02-05 LDL-Cholesterol 2025-02-05 Electrolyte 3 = 2025-02-05 ⇒ Free T4 = 2025-02-05 ⇒ TSH = 2025-02-05 => Routine U/A with Micro 2025-02-05 → CRP(hs-CRP) 2025-02-05 = Y-GT 2025-02-05 = T. Protein (urine) 2025-02-05: ⇒ Creatinine (urine) 2025-02-05: => Microalbumin (Urine) 2025-02-05: ⇒ CK-MB 2025-02-05 => High-Sensitivity Troponin I (TNIH) 2025-02-05 = NT-proBNP 2025-02-05 ⇒ D-Dimer 2025-02-05 Chest PA, Lat (L) 2025-02-05 → EKG 심전도 2025-02-05 => [전문] 경흉부초음파 (TTE) 상기 검사 후 fu 출력일시 2025-03-10 17:16 출력자 이지원 성별/나이 01/60 주민등록번호 전자서명자 이지현A 원본대조필 페이지 2/3 작성의 이지현 641020-2****** 명지병원 환자번호 01371838 환자이름 석향숙 진료과 심장내과 담당의 이지현 출력일시 2025-03-10 17:16 출력자 이지원 외래 초진기록지 성별/나이 여/60 주민등록번호 641020-2****** 전자서명자 이지현A 원본대조필 명지병원 페이지 3/3 환자번호 01371838 진료과 심장내과 환자이름 석향숙 담당의 이지현 임상화학검사(일반) 성별/나이 01/60 주민등록번호 641020-2****** 전자서명자 조해원 등록번호 01371838 진료과 심장내과 검사자 N/A 처방일시 2025-02-05 15:02 환자명 석향숙 성별/나이 F/60 의뢰의사 이지현 병동 확인의사 조해원 검체명 Serum, SST 진단명 Chest pain (unspecified) 접수일시 2025-02-12 11:57 보고일시 2025-02-12 12:46 검체번호 20250212A00883 0 검사 결과 검사명 결과 H/L 참고치 단위 Calcium 9.0 8.7 10.4 mg/dL I. phosphorus 3.8 2.4 5.1 mg/dL Glucose 91 73 106 mg/dL BUN 19.1 9 23 mg/dL Creatinine 0.73 2 0.5 1.1 mg/dL mL/min/1.7 ...eGFR (CKD-EPI) 89.8 > 60.0 3m2 Uric Acid 3.4 3.0 7.0 mg/dL T.Cholesterol 155 < 239 mg/dL T. Protein 6.9 5.7 8.2 g/dL Albumin 4.5 3.2 4.8 g/dL T.Bilirubin 1.75 H 0.30 1.20 mg/dL ALP 101 46 116 U/L AST (SGOT) 19 < 34 U/L ALT (SGPT) 21 10 49 U/L Y-GT 16 < 38 U/L Triglyceride 139 <150 mg/dL HDL-Cholesterol 50 > 40 mg/dL LDL-Cholesterol 83 <129 mg/dL Amylase 165 H 30 ~ 118 U/L Lipase 29 12 53 U/L Na 141 ~ 132 146 mmol/L Electrolyte (3) K 4.5 3.5 5.5 mmol/L CI 109 99 109 mmol/L CK 157 40 235 U/L CK-MB 0.6 <= 5 ng/mL high-sensitivity Troponin I 3.91 < 38.64 pg/mL NT-proBNP 55.00 <125 pg/mL 출력일시 2025-03-10 17:16 원본대조필 출력자 이지원 페이지 1/2 명지병원 임상화학검사(일반) 환자번호 01371838 환자이름 석향숙 진료과 심장내과 담당의 이지현 Free T4 1.24 TSH 1.52 2025-03-10 17:16 출력일시 출력자 이지원 성별/나이 01/60 주민등록번호 전자서명자 조해원 0.89~1.76 ng/dL 0.55~4.78 ulU/mL 641020-2****** 원본대조필 명지병원 페이지 2/2 일반촬영검사 판독결과지 환자번호 01371838 진료과 심장내과 환자이름 석향숙 성별/나이 04/60 주민등록번호 담당의 박지연 전자서명자 박지연 처방일자 2025/02/05 촬영일자 2025/02/05 판독일자 2025/02/05 판독의(1) N/A 판독의(2) 박지연 전사자 N/A 소견 Chest PA, Lat (L) (2025-02-05 00:00:00) No active lung lesion 결 론 No active lung lesion 출력일시 2025-03-10 17:16 출력자 이지원 641020-2****** 원본대조필 명지병원 페이지 1/1 환자번호 진료과 심장내과 01371838 환자이름 석향숙 담당의 이지현 CA ECHO검사 CA ECHO검사 성별/나이 01/60 주민등록번호 전자서명자 서용성 Exam Date 2025-02-12 Patient ID: 01371838 Location: OPD ECHOCARDIOGRAPHY LABORATORY MYONGJI HOSPITAL Transthoracic echocardiography report Height 164.0 cm Weight 77.0 kg Echo No.: 25 2 Name: 석향숙 Referral Reason: Chest pain 1.84 m2 BSA Referring Dr.: 이지현 Sex/Age: F 1 060Y BP 124/70 mmHg HR 78 bpm 1. Comments Echo for chest pain DM, HTN, HL 1. No RWMA 2. Normal sized cardiac chambers with normal LV systolic function (EF: 66%) 3. Relaxation abnormality of LV filling pressure (E/e: 8). 4. Concentric remodeling. 5. Dilated ascending aorta (38mm). Global strain rate -19.4% 2. Regional Wall motion Abnormality: 3. Valves: 4. Regurgitation: 5. Stenosis: 6. Pericardial Effusion: No Image: No MV Native AV Native TV Native MR No Slightly thickened Senile sclerocalcified Normal AR No TR Trivial PR Trivial MS No AS No TS. No PS No No Intracardiac Thrombi: No Mass: No 7. Diastolic function: Relaxation abnormality of LV filling pattern M-mode/2D Measurement RVD1: mm RVD2 mm IVSD (8-11). IVSS: RVD3 mm LVEDD (42-54): 43 mm PWD (8-11) PWs: omom 10 mm Aortic annulus 19.0 mm 13 mm sinus of Valsalva 31.0 mm 10 mm ST Junction 27.0 mm 13 mm Ascending aorta. 38.0 mm LVESD (24-36): 28 mm LVOT (18-22) mm LA (AP/ML/SI) mm LVEF (55-76): LV Mass 142.5 g LA Vol by M-mode. 66 % LV Mass index 76.2 g/m2 by prolate ellipse ml by Biplane % RWT 0.47 by mod simpson 65 ml TV Annulus mm LA Vol index (18-28) NC mm by prolate ellipse Echo Score Doppler Measurement Total M T S C by mod simpson MV Annulus (4C/2C): 35 ml/m2 ml/m2 mm Aortic Mitral Tricuspid LVOT (TVI) 22.0 cm TVI of MR jet cm TR jet 1.54 m/sec AV (TVI) cm E (0.6-1) 0.59 m/sec RVSP 14 mmHg LVOT peak V 1.0 m/sec A (0.3.0.8) 0.67 m/sec RAP 5 mmHg PSPG/MSPG 4.1/2.4 mmHg DT (170-210) 193.51 msec MPAP mmHg AV Peak V PSPG/MSPG AVA by 2D m/sec PHT msec PVR mmHg MDPG mmHg MDPG HR /min RVOT VTL mmHg CM by continuity cm2 MVA by 2D cm2 Pulmonic PHT of AR jet RV function TAPSE msec by PHT: cm2 by continuity cm2 PSPG/MSPG RVOT AT 1 mmHg m/sec TDI S FAC TDI mm cm/sec % S 7.2 cm'sec E 7.2 cm/sec A 10.4 cm/sec EE 8 Contirmed by: 서용성 (81700) Sonographer: 조수현 Responsible Dr.: 4188(81700) 출력일시 2025-03-10 17:16 출력자 이지원 원본대조필 페이지 1/2 641020-2****** 명지병원 환자번호 01371838 환자이름 석향숙 진료과 심장내과 담당의 이지현 CA ECHO검사 성별/나이 01/60 주민등록번호 641020-2****** 전자서명자 서용성 출력일시 2025-03-10 17:16 출력자 이지원 원본대조필 페이지 2/2 명지병원 MYONGI HOSPITA 환자번호 진료과 심장내과 01371838 환자이름 석향숙 담당의 이지현 CA ECHO검사 CA ECHO검사 성별/나이 01/60 주민등록번호 전자서명자 서용성 Exam Date 2025-02-12 Patient ID: 01371838 Location: OPD ECHOCARDIOGRAPHY LABORATORY MYONGJI HOSPITAL Transthoracic echocardiography report Echo No.: 25 2 Name: 석향숙 Referral Reason: Chest pain Referring Dr.: 이지현 Sex/Age: F / 060Y Height 164.0 cm Weight 77.0 kg BSA 1.84 m2 1. Comments Echo for chest pain : DM, HTN, HL 1. No RWMA. 2. Normal sized cardiac chambers with normal LV systolic function (EF: 66%). 3. Relaxation abnormality of LV filling pressure (E/e: 8). 4. Concentric remodeling. 5. Dilated ascending aorta (38mm). * Global strain rate: -19.4% 2. Regional Wall motion Abnormality: 3. Valves: 4. Regurgitation: 5. Stenosis: 6. Pericardial Effusion: 7. Diastolic function: BP 124/70 mmHg HR 78 bpm No Image: No MV AV Native Native Slightly thickened Senile sclerocalcified TV Native Normal MR No AR TR No Trivial PR Trivial MS No AS No TS No PS No No Intracardiac Thrombi: No Mass: No Relaxation abnormality of LV filling pattern M-mode/2D Measurement RVD1 mm IVSD (8-11) 10 mm Aortic annulus. 19.0 mm RVD2 mm IVSS 13 mm sinus of Valsalva 31.0 mm RVD3 mm PWD (8-11) 10 mm ST Junction 27.0 mm LVEDD (42-54) LVESD (24-36). 28 43 mm PWs: 13 mm Ascending aorta 38.0 mm mm LVOT (18-22) mm LA (AP/ML/SI) mm LVEF (55-76) LV Mass 142.5 9 LA Vol by M-mode. 66 % by Biplane % LV Mass index. RWT 76.2 g/m2 0.47 by prolate ellipse by mod simpson mi 65 ml TV Annulus: mm NVC mm Echo Score Doppler Measurement Total M T S C LA Vol index (18-28) by prolate ellipse by mod simpson MV Annulus (4C/2C) 35 ml/m2 ml/m2 mm Aortic Mitral LVOT (TVI) 22.0 cm TVI of MR jet cm Tricuspid TR jet 1.54 1 m/sec AV (TVI) LVOT peak V 1.0 cm m/sec E (06-1) 0.59 m/sec RVSP 14 mmHg A (0.3.0.8) 0.67 m/sec RAP 5 mmHg PSPG/MSPG. 4.1/2.4 mmHg DT (170-210) 193.51 msec MPAP mmHg AV Peak V PSPG/MSPG 1 m/sec mmHg PHT msec PVR MDPG mmHg MDPG mmHg AVA by 2D by continuity PHT of AR jet RV function TAPSE TDI S HR /min RVOT VTI CM cm2 MVA by 20 cm2 Pulmonic msec by PHT cm2 by continuity cm2 PSPGMSPG RVOTAT mmHg m/sec mm cm/sec FAC TDI S 72 cm/sec E 7.2 cm/sec A 10.4 cm/sec EE 8 Confirmed by: (81700) Sonographer: 조수현 Responsible Dr.: 488(81700) 출력일시 2025-03-10 17:16 출력자 이지원 원본대조필 페이지 1/2 641020-2****** 명지병원 환자번호 01371838 환자이름 석향숙 진료과 심장내과 담당의 이지현 출력일시 2025-03-10 17:16 출력자 이지원 CA ECHO검사 성별/나이 여/60 주민등록번호 641020-2****** 전자서명자 서용성 원본대조필 명지병원 페이지 2/2 EKG 환자번호 01371838 환자이름 석향숙 성별/나이 여/60 주민등록번호 641020-2****** 진료과 심장내과 담당의 이지현 전자서명자 황의석 EKG SHS Patient ID: 01371838 2025/02/05 13:46:02 60YEARS = Vent. Rate PR interval 65 bpm 166 ms QRS duration 92 ms QT/QTC P-R-T axes 396/411 ms 1/35/52 P duration 출력일시 2025-03-10 17:16 출력자 이지원 REST ECG/4* 2.5s+ 1Rhythm Interpretation Normal sinus rhythm Nonspecific ST abnormality Abnormal ECG AiTiA-LVSD Score 0.0 (Low risk) Confirmed By: EuiSeock Hwang aVR T 5 T T V4 V5 V2 aVL 원본대조필 명지병원 MY ONG HOSPIT 페이지 1/2 EKG 환자번호 진료과 01371838 환자이름 석향숙 성별/나이 여/60 주민등록번호 641020-2****** 심장내과 담당의 이지현 전자서명자 황의석 = GE MAC5K V008B(1) 25mm/s 10mm/mV 16-150Hz 60Hz aVF V3 Attending MD: 원본대조필 명지병원 출력일시 2025-03-10 17:16 출력자 이지원 페이지 2/2 MY ONG HOSPITA V6 [별지 제1호 서식] 진료비 세부산정내역 서식 (제2조제1항 관련) 진료비 세부산정내역 환자등록번호 01371838 환자성명 진료기간 병실 환자구분 비고 석향숙 2025-02-26 2025-02-26 심장내과 [건강 가입 (미확인)\n\n■ 진료 기록 (Medical Records)\nNaN\n[미확인] 08.70 진료비 납입 확인서 환자성명 석향숙 주민등록번호 641020-******* 진료비 내역 소득공제 대상액 진료일자 급 여 비급여 (진료기간) 구분 총액 2 환자 부담총액 현금 카 드 현 금 (1+2+3) 영수증 공단부담액 환자부담액 환자부담액 (2+3)\n내원일: 미확인\n내원사유: 정기 진료\n진단명: 미확인\n중증도: 경미\n\n[미확인] 사업자등록번호 8\n내원일: 미확인\n내원사유: 정기 진료\n진단명: 미확인\n중증도: 경미\n\n[미확인] 성 명 김윤호\n내원일: 미확인\n내원사유: 정기 진료\n진단명: 미확인\n중증도: 경미\n\n[2025.03.24] 미확인 의료기관\n내원일: 2025.03.24\n내원사유: 정기 진료\n진단명: 미확인\n중증도: 경미\n\n[미확인] ) 질병군 포괄수가 합계 :층 (동선동1가 골든타워! 상한액 초과금 요양기관 종류 1 ⑤ 4,900 2 11,580 3 140.000 의원 사업자등록번호 8\n내원일: 미확인\n내원사유: 정기 진료\n진단명: 미확인\n중증도: 경미\n\n[미확인] 대표자 김윤호\n내원일: 미확인\n내원사유: 정기 진료\n진단명: 미확인\n중증도: 경미\n\n[2025.02.26] 직인이 없으면 무효임. 등록번호 :\n내원일: 2025.02.26\n내원사유: 경기도 고양시 덕양구 화수로 14번길 55 팩스번호 : 031) 810-5190 √ 의사 [ 치과의사 한의사 상한의사 면허번호 제 103836 호 성명: 이지현 작성방법 1. 환자의 인적사항은 진찰한 의사, 치과의사 또는 한의사가 주민등록증, 기간 만료 전 여권, 운전면허증, 공무원증, 국립·공립대학 학생증, 군무원증, 건강보험증, 외국인등록증 등 국가공인 신분증(환자가 미성년자인 경우에는 주민등록등본·초본, 학생증 등으로 대체 가능합니다)과 대조하여 확인하고 서명 또는 날인합니다. 2. \"병명\"란에는 \"임상적 추정\"과 \"최종진단\" 중 택일하여 [ ]에 √ 표시를 하고, 질병명은 한 한글을 함께 적으며, 질병분류기호도 함께 적습니다. 야 서식은 재발행 서식입니다 3. 본 진단서는 당병원 직인이 없으면 무효임. 등록번호 :\n진단명: \" 중 택일하여 [ ]에 √ 표시를 하고, 질병명은 한 한글을 함께 적으며, 질병분류기호도 함께 적습니다. 야 서식은 재발행 서식입니다 3. 본 진단서는 당병원 직인이 없으면 무효임. 등록번호 :\n중증도: 경미\n\n[미확인] 의무기록사본 총 1부 (표지제외) 빈경환 의료법 시행규칙 [별지 제5호의2서식] <개정\n내원일: 미확인\n내원사유: 정기 진료\n진단명: 미확인\n중증도: 경미\n\n[미확인] 미확인 의료기관\n내원일: 미확인\n내원사유: 인천 강화군 송해면 전망대로 127-42 (전화번호:\n진단명: 단서 환자의 환자의 성명 석향숙 주민등록번호 641020 2336921 환자의 주소 인천 강화군 송해면 전망대로 127-42 (전화번호:\n중증도: 경미\n\n[미확인] 미확인 의료기관\n내원일: 미확인\n내원사유: 정기 진료\n진단명: E785 E119 발병 연월일 (E78)\n중증도: 경미\n\n[미확인] 미확인 의료기관\n내원일: 미확인\n내원사유: 정기 진료\n진단명: 연월일\n중증도: 경미\n\n[2025.02.19] 長病明\n내원일: 2025.02.19\n내원사유: 정기 진료\n진단명: 합니다. 의료기관 명칭: 명지병원 長病明\n중증도: 경미\n\n[2025.02.26] 미확인 의료기관\n내원일: 2025.02.26\n내원사유: 정기 진료\n진단명: 에 의해\n중증도: 경미\n\n[미확인] 장 長明 三輪知 ※ 담당자 서명이 없는 것은 무효임 담당자 명지병원 MYONGJI HOSPITA 환자번호\n내원일: 미확인\n내원사유: 정기 진료\n진단명: 미확인\n중증도: 경미\n\n[미확인] 미확인 의료기관\n내원일: 미확인\n내원사유: 정기 진료\n진단명: Variant angina Coronary(artery) disease Nause with vomiting Convalescence following other treatment Hyperlipidaemia, unspecified Type 2 diabetes mellitus, without complications Plan\n중증도: 경미\n\n[미확인] NYONGI MOSPITAL 환자번호\n내원일: 미확인\n내원사유: 정기 진료\n진단명: 미확인\n중증도: 경미\n\n[미확인] MYONGI ROSPITA 환자번호 진료과 심장내과\n내원일: 미확인\n내원사유: 정기 진료\n진단명: 미확인\n중증도: 경미\n\n[미확인] 페이지 2/4 환자번호 진료과 심장내과\n내원일: 미확인\n내원사유: 정기 진료\n진단명: 미확인\n중증도: 경미\n\n[미확인] 환자번호\n내원일: 미확인\n내원사유: 정기 진료\n진단명: 미확인\n중증도: 경미\n\n[미확인] 미확인 의료기관\n내원일: 미확인\n내원사유: 정기 진료\n진단명: 미확인\n처방: 일자 의사지시기록 순번 처방일시 의사지시기록지 성별/나이 01/60 주민등록번호 641020-2****** 전자서명자 이지현 D/C 반납 의사 지시 내용 처방량 처방의 구분 구분\n중증도: 경미\n\n[미확인] 의사지시기록지 환자번호\n내원일: 미확인\n내원사유: 정기 진료\n진단명: 미확인\n중증도: 경미\n\n[미확인] 의사지시기록지 환자번호\n내원일: 미확인\n내원사유: 정기 진료\n진단명: 미확인\n중증도: 경미\n\n[미확인] MYONGIKOSPITAL 환자번호 진료과 심장내과\n내원일: 미확인\n내원사유: 정기 진료\n진단명: 미확인\n중증도: 경미\n\n[미확인] 미확인 의료기관\n내원일: 미확인\n내원사유: 정기 진료\n진단명: 미확인\n처방: 중재 성별/나이 01/60 주민등록번호 641020-2****** 전자서명자 이지영 마사지, 지압, 냉찜질, 온찜질, 심호흡, 이완요법, 심상요법, 전환요법 (영화감상, TV시청, 음악감상, 산책 등) 평가일시 강도 위치 양상 빈도 지속시간 중재(약물 또는 비약물) 간호사 이도윤(D 초기평가 02-19 08:45 0 CC) 이도윤(D 재평가 02-19 11:05 0 CC) 재평가 재평가 재평가 재평가 재평가 날짜 시간 간호기록 간호사\n중증도: 경미\n\n[미확인] 페이지 3/3 환자번호 진료과 심장내과\n내원일: 미확인\n내원사유: 정기 진료\n진단명: 미확인\n중증도: 경미\n\n[미확인] 미확인 의료기관\n내원일: 미확인\n내원사유: 정기 진료\n진단명: Unstable angina 처방일시\n처방: 일시\n중증도: 경미\n\n[2025.02.19] 미확인 의료기관\n내원일: 2025.02.19\n내원사유: 정기 진료\n진단명: 미확인\n특이사항: 치 단위 Calcium 8.8 8.7 10.4 mg/dL 1. phosphorus 3.2 2.4 5.1 mg/dL Glucose 104 73 106 mg/dL BUN 29.2 H 9 23 mg/dL Creatinine 0.73 0.5 1.1 ~ mg/dL mL/min/1.7 ...eGFR (CKD-EPI) 89.8 > 60.0 3m2 Uric Acid 3.2 3.0 7.0 mg/dL T. Protein 6.5 5.7 2 8.2 g/dL Albumin 4.5 ~ 3.2 4.8 g/dL T. Bilirubin 0.98 0.30 ~ 1.20 mg/dL ALP 90 ~ 46 116 U/L AST (SGOT) 16 < 34 U/L ALT (SGPT) 19 10 49 U/L Y-GT 14 < 38 U/L Na 142 ~ 132 146 mmol/L Electrolyte (4종) K 4.0 3.5 5.5 mmol/L Cl 111 H 99 109 mmol/L CO2 23 20 31 mmol/L CK 53 40 ~ 235 U/L CK-MB 0.4 <= 5 ng/mL high-sensitivity Troponin I < 2.51 < 38.64 pg/mL NT-proBNP 128.00 H <125 pg/mL 출력일시\n중증도: 경미\n\n[미확인] 출력자 이지원 페이지 1/1 CAG 환자번호\n내원일: 미확인\n내원사유: 정기 진료\n진단명: 미확인\n중증도: 경미\n\n[미확인] 환자번호 진료과 심장내과\n내원일: 미확인\n내원사유: 정기 진료\n진단명: 미확인\n중증도: 경미\n\n[미확인] MYONGJI HOSPITA炭 환자번호\n내원일: 미확인\n내원사유: 정기 진료\n진단명: 미확인\n중증도: 경미\n\n[미확인] 페이지 2/2 EKG 환자번호 진료과 심장내과\n내원일: 미확인\n내원사유: 정기 진료\n진단명: 미확인\n중증도: 경미\n\n[미확인] 페이지 1/2 h h EKG 환자번호\n내원일: 미확인\n내원사유: 정기 진료\n진단명: 미확인\n중증도: 경미\n\n[미확인] 페이지 2/2 MY ON GAI HOSPIT la h 'V6 환자번호 진료과 심장내과\n내원일: 미확인\n내원사유: 정기 진료\n진단명: 미확인\n중증도: 경미\n\n[미확인] 미확인 의료기관\n내원일: 미확인\n내원사유: 정기 진료\n진단명: 미확인\n처방: 일시\n중증도: 경미\n\n[미확인] 미확인 의료기관\n내원일: 미확인\n내원사유: 정기 진료\n진단명: Variant angina 접수일시\n중증도: 경미\n\n[2025.02.26] 미확인 의료기관\n내원일: 2025.02.26\n내원사유: 정기 진료\n진단명: 미확인\n특이사항: 치 단위 BUN 22.7 9 23 mg/dL Creatinine 0.89 0.5 1.1 mg/dL mL/min/1.7 ....eGFR (CKD-EPI) 70.7 > 60.0 3m2 Na 141 2 132 146 mmol/L Electrolyte (3종) K 4.1 ~ 3.5 5.5 mmol/L Cl 108 99 109 mmol/L CK 57 40 235 U/L CK-MB 0.8 <= 5 ng/mL high-sensitivity Troponin I <2.51 < 38.64 pg/mL NT-proBNP 62.00 <125 pg/mL 출력일시\n중증도: 경미\n\n[미확인] 페이지 1/1 일반촬영검사 판독결과지 환자번호\n내원일: 미확인\n내원사유: 정기 진료\n진단명: 미확인\n중증도: 경미\n\n[미확인] 미확인 의료기관\n내원일: 미확인\n내원사유: 정기 진료\n진단명: 미확인\n처방: 일자\n중증도: 경미\n\n[미확인] EKG 환자번호\n내원일: 미확인\n내원사유: 정기 진료\n진단명: 미확인\n중증도: 경미\n\n[미확인] M? ONG HOSPITA 나나무 V5 h EKG 환자번호\n내원일: 미확인\n내원사유: 정기 진료\n진단명: 미확인\n중증도: 경미\n\n[미확인] MY ONG II HOSPIT 페이지 2/2 ? V6 환자번호\n내원일: 미확인\n내원사유: 정기 진료\n진단명: 미확인\n중증도: 경미\n\n[미확인] 미확인 의료기관\n내원일: 미확인\n내원사유: 정기 진료\n진단명: 미확인\n처방: 알러지 있음 없음 또는 알수없음 Summary angina visit: 간헐적으로 답답하고 조여서 내원. 등도 아플때도 있었다. undelrying dz: HTN (10yr) HL (4yrs) DM (1~2yr) self med: 자디앙듀오정\n특이사항: LAB,TTE 약물알러지 있음 없음 또는 알수없음 Summary angina visit: 간헐적으로 답답하고 조여서 내원. 등도 아플때도 있었다. undelrying dz: HTN (10yr) HL (4yrs) DM (1~2yr) self med: 자디앙듀오정\n중증도: 경미\n\n[미확인] 미확인 의료기관\n내원일: 미확인\n내원사유: 정기 진료\n진단명: Chest pain (unspecified) Hypertensive heart disease NOS Type 2 diabetes mellitus, without complications Plan\n중증도: 경미\n\n[미확인] 외래 재진기록지 환자번호\n내원일: 미확인\n내원사유: 정기 진료\n진단명: 미확인\n중증도: 경미\n\n[미확인] 페이지 2/2 환자번호\n내원일: 미확인\n내원사유: 정기 진료\n진단명: 미확인\n중증도: 경미\n\n[미확인] 미확인 의료기관\n내원일: 미확인\n내원사유: 정기 진료\n진단명: 미확인\n처방: 알러지 있음 없음 또는 알수없음 통증평가 ㅇ유 ○평가불가 - 사유 : 현재 병력 angina visit: 간헐적으로 답답하고 조여서 내원. 등도 아플때도 있었다. undelrying dz: HTN (10yr) HL (4yrs) DM (1~2yr) self med: 자디앙듀오정\n중증도: 경미\n\n[미확인] 미확인 의료기관\n내원일: 미확인\n내원사유: 정기 진료\n진단명: 주진단명 Yes 부친 VHD 모친 DM HTN stent Smokingnever Drinkingnever Chest pain (unspecified) Hypertensive heart disease NOS 진단명 Type 2 diabetes mellitus, without complications 구분 확진 기타진단명 기타진단명 치료계획\n특이사항: 진단명 기타진단명 치료계획; NSR 65 no cm 진단명 주진단명 Yes 부친 VHD 모친 DM HTN stent Smokingnever Drinkingnever Chest pain (unspecified) Hypertensive heart disease NOS 진단명 Type 2 diabetes mellitus, without complications 구분 확진 기타진단명 기타진단명 치료계획\n중증도: 경미\n\n[미확인] 페이지 1/3 환자번호 진료과 심장내과\n내원일: 미확인\n내원사유: 정기 진료\n진단명: 미확인\n중증도: 경미\n\n[미확인] 환자번호\n내원일: 미확인\n내원사유: 정기 진료\n진단명: 미확인\n중증도: 경미\n\n[미확인] 페이지 3/3 환자번호\n내원일: 미확인\n내원사유: 정기 진료\n진단명: 미확인\n중증도: 경미\n\n[미확인] 미확인 의료기관\n내원일: 미확인\n내원사유: 정기 진료\n진단명: 미확인\n처방: 일시\n중증도: 경미\n\n[미확인] 미확인 의료기관\n내원일: 미확인\n내원사유: 정기 진료\n진단명: Chest pain (unspecified) 접수일시\n중증도: 경미\n\n[2025.02.12] 미확인 의료기관\n내원일: 2025.02.12\n내원사유: 정기 진료\n진단명: 미확인\n특이사항: 치 단위 Calcium 9.0 8.7 10.4 mg/dL I. phosphorus 3.8 2.4 5.1 mg/dL Glucose 91 73 106 mg/dL BUN 19.1 9 23 mg/dL Creatinine 0.73 2 0.5 1.1 mg/dL mL/min/1.7 ...eGFR (CKD-EPI) 89.8 > 60.0 3m2 Uric Acid 3.4 3.0 7.0 mg/dL T.Cholesterol 155 < 239 mg/dL T. Protein 6.9 5.7 8.2 g/dL Albumin 4.5 3.2 4.8 g/dL T.Bilirubin 1.75 H 0.30 1.20 mg/dL ALP 101 46 116 U/L AST (SGOT) 19 < 34 U/L ALT (SGPT) 21 10 49 U/L Y-GT 16 < 38 U/L Triglyceride 139 <150 mg/dL HDL-Cholesterol 50 > 40 mg/dL LDL-Cholesterol 83 <129 mg/dL Amylase 165 H 30 ~ 118 U/L Lipase 29 12 53 U/L Na 141 ~ 132 146 mmol/L Electrolyte (3) K 4.5 3.5 5.5 mmol/L CI 109 99 109 mmol/L CK 157 40 235 U/L CK-MB 0.6 <= 5 ng/mL high-sensitivity Troponin I 3.91 < 38.64 pg/mL NT-proBNP 55.00 <125 pg/mL 출력일시\n중증도: 경미\n\n[미확인] 임상화학검사(일반) 환자번호\n내원일: 미확인\n내원사유: 정기 진료\n진단명: 미확인\n중증도: 경미\n\n[미확인] 페이지 2/2 일반촬영검사 판독결과지 환자번호\n내원일: 미확인\n내원사유: 정기 진료\n진단명: 미확인\n중증도: 경미\n\n[미확인] 미확인 의료기관\n내원일: 미확인\n내원사유: 정기 진료\n진단명: 미확인\n처방: 일자\n중증도: 경미\n\n[미확인] 페이지 1/1 환자번호 진료과 심장내과\n내원일: 미확인\n내원사유: 정기 진료\n진단명: 미확인\n중증도: 경미\n\n[미확인] 환자번호\n내원일: 미확인\n내원사유: 정기 진료\n진단명: 미확인\n중증도: 경미\n\n[미확인] MYONGI HOSPITA 환자번호 진료과 심장내과\n내원일: 미확인\n내원사유: 정기 진료\n진단명: 미확인\n중증도: 경미\n\n[미확인] 환자번호\n내원일: 미확인\n내원사유: 정기 진료\n진단명: 미확인\n중증도: 경미\n\n[미확인] 페이지 2/2 EKG 환자번호\n내원일: 미확인\n내원사유: 정기 진료\n진단명: 미확인\n중증도: 경미\n\n[미확인] MY ONG HOSPIT 페이지 1/2 EKG 환자번호 진료과\n내원일: 미확인\n내원사유: 정기 진료\n진단명: 미확인\n중증도: 경미\n\n[미확인] 출력일시\n내원일: 미확인\n내원사유: 정기 진료\n진단명: 미확인\n중증도: 경미\n\n[미확인] 미확인 의료기관\n내원일: 미확인\n내원사유: 정기 진료\n진단명: 미확인\n처방: 약품비\n중증도: 경미\n\n[미확인] 미확인 의료기관\n내원일: 미확인\n내원사유: 정기 진료\n진단명: 미확인\n처방: 약품비\n중증도: 경미\n\n[미확인] 미확인 의료기관\n내원일: 미확인\n내원사유: 정기 진료\n진단명: 서 [일반] 3,900 1 3.900 1.950 1.950 20,000 1 1 20.000 20,000 제증명\n중증도: 경미\n\n[미확인] 미확인 의료기관\n내원일: 미확인\n내원사유: 정기 진료\n진단명: 서 [추가 1매당] 1,000 3 1 3,000 3,000 제증명 제증명\n중증도: 경미\n\n[2025.03.10] 일반사항 안내 1. 진료비 계산서 영수증의 세부내역서는 환자의 구체적인 처방 내역등이 확인되므로 원칙적으로 환자 본인 외에 발급을 금합니다. 다만, 본 세부내역서 발급에 대해 별도로 환자 본인으로부터 위임을 받은 것이 확인된 자 또는 법정대리인에겐 발급이 가능합니다. 2. 비고란은 세부산정내역을 발부하는 영수증 번호 등 요양기관이 필요한 경우 추가 기재하는 공간으로 활용할 수 있습니다. 3. 동 서식에 명시된 항목은 [국민건강보험 요양급여의 기준에 관한 규칙] 제7조제3항에 따라 필수 기재되어야 합니다. -2- 대표자 이왕준 전체 2 페이지 [별지 제1호 서식] 진료비 세부산정내역 서식 (제2조제1항 관련) 진료비 세부산정내역 환자등록번호\n내원일: 2025.03.10\n내원사유: 정기 진료\n진단명: 미확인\n처방: 내역등이 확인되므로 원칙적으로 환자 본인 외에 발급을 금합니다. 다만, 본 세부내역서 발급에 대해 별도로 환자 본인으로부터 위임을 받은 것이 확인된 자 또는 법정대리인에겐 발급이 가능합니다. 2. 비고란은 세부산정내역을 발부하는 영수증 번호 등 요양기관이 필요한 경우 추가 기재하는 공간으로 활용할 수 있습니다. 3. 동 서식에 명시된 항목은 [국민건강보험 요양급여의 기준에 관한 규칙] 제7조제3항에 따라 필수 기재되어야 합니다. -2- 대표자 이왕준 전체 2 페이지 [별지 제1호 서식] 진료비 세부산정내역 서식 (제2조제1항 관련) 진료비 세부산정내역 환자등록번호\n특이사항: 란은 세부산정내역을 발부하는 영수증 번호 등 요양기관이 필요한 경우 추가 기재하는 공간으로 활용할 수 있습니다. 3. 동 서식에 명시된 항목은 [국민건강보험 요양급여의 기준에 관한 규칙] 제7조제3항에 따라 필수 기재되어야 합니다. -2- 대표자 이왕준 전체 2 페이지 [별지 제1호 서식] 진료비 세부산정내역 서식 (제2조제1항 관련) 진료비 세부산정내역 환자등록번호\n중증도: 경미\n\n[미확인] 미확인 의료기관\n내원일: 미확인\n내원사유: 정기 진료\n진단명: 료\n중증도: 경미\n\n[미확인] 미확인 의료기관\n내원일: 미확인\n내원사유: 정기 진료\n진단명: 료\n중증도: 경미\n\n[미확인] 미확인 의료기관\n내원일: 미확인\n내원사유: 정기 진료\n진단명: 료\n중증도: 경미\n\n[미확인] 미확인 의료기관\n내원일: 미확인\n내원사유: 정기 진료\n진단명: 료\n중증도: 경미\n\n[2025.03.10] 대표자 이왕준 일반사항 안내 1. 진료비 계산서 영수증의 세부내역서는 환자의 구체적인 처방 내역등이 확인되므로 원칙적으로 환자 본인 외에 발급을 금합니다. 다만, 본 세부내역서 발급에 대해 별도로 환자 본인으로부터 위임을 받은 것이 확인된 자 또는 법정대리인에겐 발급이 가능합니다. 2. 비고란은 세부산정내역을 발부하는 영수증 번호 등 요양기관이 필요한 경우 추가 기재하는 공간으로 활용할 수 있습니다. 3. 동 서식에 명시된 항목은 [국민건강보험 요양급여의 기준에 관한 규칙] 제7조제3항에 따라 필수 기재되어야 합니다. -1- 전체 1 페이지 [별지 제1호 서식] 진료비 세부산정내역 서식 (제2조제1항 관련) 환자등록번호 0137 1838 항목 일자 진찰료 진찰료 진찰료 진찰료 투약 약품비 계 끝수처리 조정금액 합계 요양기관 명칭 환자성명 석향숙 진료비 세부산정내역 진료기간 병실 환자구분\n내원일: 2025.03.10\n내원사유: 정기 진료\n진단명: 미확인\n처방: 내역등이 확인되므로 원칙적으로 환자 본인 외에 발급을 금합니다. 다만, 본 세부내역서 발급에 대해 별도로 환자 본인으로부터 위임을 받은 것이 확인된 자 또는 법정대리인에겐 발급이 가능합니다. 2. 비고란은 세부산정내역을 발부하는 영수증 번호 등 요양기관이 필요한 경우 추가 기재하는 공간으로 활용할 수 있습니다. 3. 동 서식에 명시된 항목은 [국민건강보험 요양급여의 기준에 관한 규칙] 제7조제3항에 따라 필수 기재되어야 합니다. -1- 전체 1 페이지 [별지 제1호 서식] 진료비 세부산정내역 서식 (제2조제1항 관련) 환자등록번호 0137 1838 항목 일자 진찰료 진찰료 진찰료 진찰료 투약 약품비 계 끝수처리 조정금액 합계 요양기관 명칭 환자성명 석향숙 진료비 세부산정내역 진료기간 병실 환자구분\n특이사항: 란은 세부산정내역을 발부하는 영수증 번호 등 요양기관이 필요한 경우 추가 기재하는 공간으로 활용할 수 있습니다. 3. 동 서식에 명시된 항목은 [국민건강보험 요양급여의 기준에 관한 규칙] 제7조제3항에 따라 필수 기재되어야 합니다. -1- 전체 1 페이지 [별지 제1호 서식] 진료비 세부산정내역 서식 (제2조제1항 관련) 환자등록번호 0137 1838 항목 일자 진찰료 진찰료 진찰료 진찰료 투약 약품비 계 끝수처리 조정금액 합계 요양기관 명칭 환자성명 석향숙 진료비 세부산정내역 진료기간 병실 환자구분\n중증도: 경미\n\n[2025.03.10] 일반사항 안내 대표자 이왕준 1. 진료비 계산서 영수증의 세부내역서는 환자의 구체적인 처방 내역등이 확인되므로 원칙적으로 환자 본인 외에 발급을 금합니다. 다만, 본 세부내역서 발급에 대해 별도로 환자 본인으로부터 위임을 받은 것이 확인된 자 또는 법정대리인에겐 발급이 가능합니다. 2. 비고란은 세부산정내역을 발부하는 영수증 번호 등 요양기관이 필요한 경우 추가 기재하는 공간으로 활용할 수 있습니다. 3. 동 서식에 명시된 항목은 [국민건강보험 요양급여의 기준에 관한 규칙] 제7조제3항에 따라 필수 기재되어야 합니다. -1- 전체 1 페이지 [별지 제1호 서식] 진료비 세부산정내역 서식 (제2조제1항 관련) 진료비 세부산정내역 환자등록번호 0137 1838 환자성명 석향숙 진료기간 병실 환자구분\n내원일: 2025.03.10\n내원사유: 정기 진료\n진단명: 미확인\n처방: 내역등이 확인되므로 원칙적으로 환자 본인 외에 발급을 금합니다. 다만, 본 세부내역서 발급에 대해 별도로 환자 본인으로부터 위임을 받은 것이 확인된 자 또는 법정대리인에겐 발급이 가능합니다. 2. 비고란은 세부산정내역을 발부하는 영수증 번호 등 요양기관이 필요한 경우 추가 기재하는 공간으로 활용할 수 있습니다. 3. 동 서식에 명시된 항목은 [국민건강보험 요양급여의 기준에 관한 규칙] 제7조제3항에 따라 필수 기재되어야 합니다. -1- 전체 1 페이지 [별지 제1호 서식] 진료비 세부산정내역 서식 (제2조제1항 관련) 진료비 세부산정내역 환자등록번호 0137 1838 환자성명 석향숙 진료기간 병실 환자구분\n특이사항: 란은 세부산정내역을 발부하는 영수증 번호 등 요양기관이 필요한 경우 추가 기재하는 공간으로 활용할 수 있습니다. 3. 동 서식에 명시된 항목은 [국민건강보험 요양급여의 기준에 관한 규칙] 제7조제3항에 따라 필수 기재되어야 합니다. -1- 전체 1 페이지 [별지 제1호 서식] 진료비 세부산정내역 서식 (제2조제1항 관련) 진료비 세부산정내역 환자등록번호 0137 1838 환자성명 석향숙 진료기간 병실 환자구분\n중증도: 경미\n\n[미확인] 미확인 의료기관\n내원일: 미확인\n내원사유: 정기 진료\n진단명: 료\n중증도: 경미\n\n[미확인] 미확인 의료기관\n내원일: 미확인\n내원사유: 정기 진료\n진단명: 료 영상진단료\n중증도: 경미\n\n[미확인] 미확인 의료기관\n내원일: 미확인\n내원사유: 정기 진료\n진단명: 료\n특이사항: ) 영상저장 및 전송시스템 [FULL PACS] 이용 20 흉부2매 3,100 1 1 3.100 9.300 3.100 1,770 1 1 1,770 885 885 10,930 1 1 10.930 5,465 5.465 영상진단료\n중증도: 경미\n\n[미확인] 미확인 의료기관\n내원일: 미확인\n내원사유: 정기 진료\n진단명: 료 계 끝수처리 조정금액 합계\n중증도: 경미\n\n[2025.03.10] 대표자 이왕준 일반사항 안내 1. 진료비 계산서 영수증의 세부내역서는 환자의 구체적인 처방 내역등이 확인되므로 원칙적으로 환자 본인 외에 발급을 금합니다. 다만, 본 세부내역서 발급에 대해 별도로 환자 본인으로부터 위임을 받은 것이 확인된 자 또는 법정대리인에겐 발급이 가능합니다. 2. 비고란은 세부산정내역을 발부하는 영수증 번호 등 요양기관이 필요한 경우 추가 기재하는 공간으로 활용할 수 있습니다. 3. 동 서식에 명시된 항목은 [국민건강보험 요양급여의 기준에 관한 규칙] 제7조제3항에 따라 필수 기재되어야 합니다. -2- 전체 2 페이지 ========== 파일: i?￢i??i?? i§?e￡?e?´i?­.pdf ==========\n내원일: 2025.03.10\n내원사유: 정기 진료\n진단명: 미확인\n처방: 내역등이 확인되므로 원칙적으로 환자 본인 외에 발급을 금합니다. 다만, 본 세부내역서 발급에 대해 별도로 환자 본인으로부터 위임을 받은 것이 확인된 자 또는 법정대리인에겐 발급이 가능합니다. 2. 비고란은 세부산정내역을 발부하는 영수증 번호 등 요양기관이 필요한 경우 추가 기재하는 공간으로 활용할 수 있습니다. 3. 동 서식에 명시된 항목은 [국민건강보험 요양급여의 기준에 관한 규칙] 제7조제3항에 따라 필수 기재되어야 합니다. -2- 전체 2 페이지 ========== 파일: i?￢i??i?? i§?e￡?e?´i?­.pdf ==========\n특이사항: 란은 세부산정내역을 발부하는 영수증 번호 등 요양기관이 필요한 경우 추가 기재하는 공간으로 활용할 수 있습니다. 3. 동 서식에 명시된 항목은 [국민건강보험 요양급여의 기준에 관한 규칙] 제7조제3항에 따라 필수 기재되어야 합니다. -2- 전체 2 페이지 ========== 파일: i?￢i??i?? i§?e￡?e?´i?­.pdf ==========\n중증도: 경미\n\n[미확인] &약국별 기본진료내역 . 정보주체 : 석향숙 . 열람대상기간 :\n내원일: 미확인\n내원사유: 정기 진료\n진단명: 미확인\n처방: 조제정보 병·의원&약국별 기본진료내역 . 정보주체 : 석향숙 . 열람대상기간 :\n중증도: 경미\n\n[미확인] (양방)기 타 및 상세 내과 외래 Al109 불명의 원 1 발성 고혈 압 14,860 10,460 4,400 (양방)기 타 및 상세 2\n내원일: 미확인\n내원사유: 정기 진료\n진단명: 미확인\n중증도: 경미\n\n[미확인] (양방)기 타 및 상세 내과외래 A1109 불명의 원 발성 고혈 압 1 14,860 10,460 4,400 (양방)기 타 및 상세 4\n내원일: 미확인\n내원사유: 정기 진료\n진단명: 미확인\n중증도: 경미\n\n[미확인] (양방)기 타 및 상세 내과 외래 Al109 불명의 원 발성 고혈 압 1 45,230 31,730 13,500 (양방)기 타 및 상세 6\n내원일: 미확인\n내원사유: 정기 진료\n진단명: 미확인\n중증도: 경미\n\n[미확인] (양방)기 타 및 상세 내과외래 Al109 불명의 원 발성 고혈 압 1 6,190 4,390 1,800 (양방)기 타 및 상세 8\n내원일: 미확인\n내원사유: 정기 진료\n진단명: 미확인\n중증도: 경미\n\n[미확인] 타 및 상세 내과 외래 Al109 불명의 원 1 발성 고혈 14,610 10,310 4,300 압 (양방)기 타 및 상세 10\n내원일: 미확인\n내원사유: 정기 진료\n진단명: 미확인\n중증도: 경미\n\n[미확인] 타 및 상세 내과 외래 Al109 불명의 원 [발성 고혈 압 1 35,890 25,190 10,700 본 자료는 병·의원&약국에서 청구한 요양급여비용 명세서를 기준으로 작성된 자료입니다. . 진료비에는 국민건강보험법 제41조의4에 따른 선별급여 관련 금액이 포함되어 있지 않습니다. . 이에 본 자료를 단순 참고가 아닌 증빙자료로 사용할 수 없으며, 이용에 관한 책임은 이용자에게 있습니다. 1/8\n내원일: 미확인\n내원사유: 정기 진료\n진단명: 미확인\n특이사항: 가 아닌 증빙자료로 사용할 수 없으며, 이용에 관한 책임은 이용자에게 있습니다. 1/8\n중증도: 경미\n\n[미확인] (양방)기 타 및 상세 내과 외래 Al109 불명의 원 발성 고혈 압 1 16,100 12,400 3,700 (양방)기 타 및 상세 14|\n내원일: 미확인\n내원사유: 정기 진료\n진단명: 미확인\n중증도: 경미\n\n[미확인] 치과보 존과 (양방)비 외래 AK0401 가역적 치 수염 1 72,200 50,600 21,600 16\n내원일: 미확인\n내원사유: 정기 진료\n진단명: 미확인\n중증도: 경미\n\n[미확인] 치과보 존과 (양방)비 외래 AK0401 가역적 치 수염 12,090 8,490 3,600 17\n내원일: 미확인\n내원사유: 정기 진료\n진단명: 미확인\n중증도: 경미\n\n[미확인] 치과보 존과 (양방)비 외래 AK0401 가역적 치 1 수염 21,520 15,120 6,400 18\n내원일: 미확인\n내원사유: 정기 진료\n진단명: 미확인\n중증도: 경미\n\n[미확인] 치과보 존과 (양방)비 외래 AK0401 가역적 치 1 수염 32,520 22,820 9,700 19\n내원일: 미확인\n내원사유: 정기 진료\n진단명: 미확인\n중증도: 경미\n\n[미확인] (양방)기 타 및 상세 내과 외래 Al109 불명의 원 발성 고혈 압 1 6,070 4,270 1,800 (양방)만 20\n내원일: 미확인\n내원사유: 정기 진료\n진단명: 미확인\n중증도: 경미\n\n[미확인] 치주과 외래 AK0510 단순 병 1 연부 치은 염 101,730 71,230 30,500 21\n내원일: 미확인\n내원사유: 정기 진료\n진단명: 미확인\n중증도: 경미\n\n[미확인] 타 및 상세 내과 외래 Al109 불명의 원 발성 고혈 압 1 12,130 8,530 3,600 본 자료는 병·의원&약국에서 청구한 요양급여비용 명세서를 기준으로 작성된 자료입니다. 진료비에는 국민건강보험법 제41조의4에 따른 선별급여 관련 금액이 포함되어 있지 않습니다. ?이에 본 자료를 단순 참고가 아닌 증빙자료로 사용할 수 없으며, 이용에 관한 책임은 이용자에게 있습니다.\n내원일: 미확인\n내원사유: 정기 진료\n진단명: 미확인\n특이사항: 가 아닌 증빙자료로 사용할 수 없으며, 이용에 관한 책임은 이용자에게 있습니다.\n중증도: 경미\n\n[미확인] 타 및 상세 내과 외래 Al109 불명의 원 발성 고혈 12,130 8,530 3,600 압 25|\n내원일: 미확인\n내원사유: 정기 진료\n진단명: 미확인\n중증도: 경미\n\n[미확인] 타 및 상세 내과 외래 | Al109 불명의 원 발성 고혈 압 6,070 4,270 1,800 27\n내원일: 미확인\n내원사유: 정기 진료\n진단명: 미확인\n중증도: 경미\n\n[미확인] 타 및 상세 내과 외래 Al109 불명의 원 [발성 고 압 11,780 8,280 3,500 29\n내원일: 미확인\n내원사유: 정기 진료\n진단명: 미확인\n중증도: 경미\n\n[미확인] 타 및 상세 내과 외래 Al109 불명의 원 발성 고혈 1 11,780 8,280 3,500 압 31\n내원일: 미확인\n내원사유: 정기 진료\n진단명: 미확인\n중증도: 경미\n\n[미확인] (양방)기 타 및 상세 내과 외래 Al109 불명의 원 1 [발성 고혈 33,670 23,570 10,100 압 33\n내원일: 미확인\n내원사유: 정기 진료\n진단명: 미확인\n중증도: 경미\n\n[미확인] &약국에서 청구한 요양급여비용 명세서를 기준으로 작성된 자료입니다. ㆍ진료비에는 국민건강보험법 제41조의4에 따른 선별급여 관련 금액이 포함되어 있지 않습니다. ?이에 본 자료를 단순 참고가 아닌 증빙자료로 사용할 수 없으며, 이용에 관한 책임은 이용자에게 있습니다.\n내원일: 미확인\n내원사유: 정기 진료\n진단명: 미확인\n특이사항: 가 아닌 증빙자료로 사용할 수 없으며, 이용에 관한 책임은 이용자에게 있습니다.\n중증도: 경미\n\n[미확인] 가정의 학과 골붓돌기 외래 AM654 힘줄윤활 1 11,780 8,280 3,500 [막염 [드퀘 르벵] 44\n내원일: 미확인\n내원사유: 정기 진료\n진단명: 미확인\n중증도: 경미\n\n[미확인] &약국에서 청구한 요양급여비용 명세서를 기준으로 작성된 자료입니다. . 진료비에는 국민건강보험법 제41조의4에 따른 선별급여 관련 금액이 포함되어 있지 않습니다. 이에 본 자료를 단순 참고가 아닌 증빙자료로 사용할 수 없으며, 이용에 관한 책임은 이용자에게 있습니다. 4/8\n내원일: 미확인\n내원사유: 정기 진료\n진단명: 미확인\n특이사항: 가 아닌 증빙자료로 사용할 수 없으며, 이용에 관한 책임은 이용자에게 있습니다. 4/8\n중증도: 경미\n\n[미확인] 가정의 학과 (양방)요 골븟돌기 외래 AM654 힘줄윤활 11,780 8,280 3,500 막염 [드퀘 '르벵] 46\n내원일: 미확인\n내원사유: 정기 진료\n진단명: 미확인\n중증도: 경미\n\n[미확인] 외과 외래 AN63 방의 상세 불명의 덩 이 16,480 11,580 4,900 (양방)기 타 및 상세 48\n내원일: 미확인\n내원사유: 정기 진료\n진단명: 미확인\n중증도: 경미\n\n[미확인] 가정의 학과 골븟돌기 외래 AM654 힘줄윤활 막염 [드퀘 르벵] 1 11,780 8,280 3,500 (양방)기 50\n내원일: 미확인\n내원사유: 정기 진료\n진단명: 미확인\n중증도: 경미\n\n[미확인] 가정의 학과 골붓돌기 외래 AM654 힘줄윤활 1 32,760 22,960 9,800 막염 [드퀘 르벵] 53\n내원일: 미확인\n내원사유: 정기 진료\n진단명: 미확인\n중증도: 경미\n\n[미확인] 과 외래 AN951 경 및 여성 의 갱년기 상태 1 11,780 8,280 3,500 (한방)상 세불명의 55\n내원일: 미확인\n내원사유: 정기 진료\n진단명: 미확인\n중증도: 경미\n\n[미확인] 침구과 외래 BM7793 골부착부 21,230 14,930 6,300 병증, 아래 본 자료는 병·의원&약국에서 청구한 요양급여비용 명세서를 기준으로 작성된 자료입니다. 진료비에는 국민건강보험법 제41조의4에 따른 선별급여 관련 금액이 포함되어 있지 않습니다. 이에 본 자료를 단순 참고가 아닌 증빙자료로 사용할 수 없으며, 이용에 관한 책임은 이용자에게 있습니다. 5/8\n내원일: 미확인\n내원사유: 정기 진료\n진단명: 미확인\n특이사항: 가 아닌 증빙자료로 사용할 수 없으며, 이용에 관한 책임은 이용자에게 있습니다. 5/8\n중증도: 경미\n\n[미확인] 침구과 외래 BM7793 골부착부 21,320 15,020 6,300 병증, 아래 (양방)폐 57\n내원일: 미확인\n내원사유: 정기 진료\n진단명: 미확인\n중증도: 경미\n\n[미확인] 외래 AN951 경 및 여성 의 갱년기 상태 11,540 8,140 3,400 (한방)상 세불명의 58\n내원일: 미확인\n내원사유: 정기 진료\n진단명: 미확인\n중증도: 경미\n\n[미확인] 침구과외래 BM7793 골부착부 25,330 17,830 7,500 병증, 아래 팔 (양방)폐 59\n내원일: 미확인\n내원사유: 정기 진료\n진단명: 미확인\n중증도: 경미\n\n[미확인] 과 외래 AN951 경 및 여성 ㅣ의 갱년기 상태 38,330 26,930 11,400 (양방)달 리 분류되 60\n내원일: 미확인\n내원사유: 정기 진료\n진단명: 미확인\n중증도: 경미\n\n[미확인] &약국에서 청구한 요양급여비용 명세서를 기준으로 작성된 자료입니다. ㆍ진료비에는 국민건강보험법 제41조의4에 따른 선별급여 관련 금액이 포함되어 있지 않습니다. ?이에 본 자료를 단순 참고가 아닌 증빙자료로 사용할 수 없으며, 이용에 관한 책임은 이용자에게 있습니다.\n내원일: 미확인\n내원사유: 정기 진료\n진단명: 미확인\n특이사항: 가 아닌 증빙자료로 사용할 수 없으며, 이용에 관한 책임은 이용자에게 있습니다.\n중증도: 경미\n\n[미확인] (양방)연 내과 외래 AJ020 쇄알균인 16,140 11,340 4,800 (양방)요 골븟돌기 69|\n내원일: 미확인\n내원사유: 정기 진료\n진단명: 미확인\n중증도: 경미\n\n[미확인] &약국에서 청구한 요양급여비용 명세서를 기준으로 작성된 자료입니다. ㆍ진료비에는 국민건강보험법 제41조의4에 따른 선별급여 관련 금액이 포함되어 있지 않습니다. ?이에 본 자료를 단순 참고가 아닌 증빙자료로 사용할 수 없으며, 이용에 관한 책임은 이용자에게 있습니다.\n내원일: 미확인\n내원사유: 정기 진료\n진단명: 미확인\n특이사항: 가 아닌 증빙자료로 사용할 수 없으며, 이용에 관한 책임은 이용자에게 있습니다.\n중증도: 경미\n\n[미확인] &약국에서 청구한 요양급여비용 명세서를 기준으로 작성된 자료입니다. ㆍ진료비에는 국민건강보험법 제41조의4에 따른 선별급여 관련 금액이 포함되어 있지 않습니다. ?이에 본 자료를 단순 참고가 아닌 증빙자료로 사용할 수 없으며, 이용에 관한 책임은 이용자에게 있습니다.\n내원일: 미확인\n내원사유: 정기 진료\n진단명: 미확인\n특이사항: 가 아닌 증빙자료로 사용할 수 없으며, 이용에 관한 책임은 이용자에게 있습니다.\n중증도: 경미\n\n■ 입원 기록 (Hospitalization Records)\nNaN\n[2025.03.26] 입원료: 2인실 50%, 3인실 40%, 4인실 30%/ 병원급 의료기관(치과병원 제외) 입원료: 2인실 40%, 3인실 30% 2. 전액 본인부담: 「국민건강보험법 시행규칙」 별표 6 또는 「의료급여법 시행규칙」 별표 1의2에 따라 적용되는 항목으로 건강보 험(의료급여)에서 금액을 정하고 있으나 진료비 전액을 환자 본인이 부담합니다. 3. 상한액 초과금: 「국민건강보험법 시행령」 별표 3 제1호에 따른 본인부담상한액의 최고 금액을 초과하는 본인부담금이 발생한 경 [단, 「의료법」 제3조제2항 제3호라목에 따른 요양병원(「장애인복지법」 제58조제1항 제4호에 따른 장애인 의료재활시설로서 「의료법」 제3조의2의 요건을 갖춘 의료기관인 요양병원은 제외)에 입원한 기간이 같은 연도에 120일을 초과하는 경우는 제외]. 공단이 부담하는 초과분 중 사전 정산하는 금액을 말합니다. ※전액 본인부담 및 선별급여(「국민건강보험법」 제41조의4에 따른 요양급여)의 본인부담금 등은 본인부담상한액 산정시 제외 4. \"질병군 포괄수가\"란 「국민건강보험법 시행령」 제21조제3항제2호 및 「국민건강보험 요양급여의 기준에 관한 규칙」 제8조제 3항 따라 보건복지부장관이 고시한 질병군 입원진료에 대하여 해당 입원진료와 관련되는 여러 의료행위를 하나의 행위로 정하여 요양급여비용을 결정한 것을 말합니다. 다만, 해당 질병군의 입원진료와 관련되는 의료행위라도 비급여대상이나 이송처치료 등 포괄수가에서 제외되는 항목은 위 표의 기본항목 및 선택항목란에 합산하여 표기됩니다. 1. 이 계산서·영수증에 대한 세부내용은 요양기관에 요구하여 제공 받을 수 있 습니다. 2. 「국민건강보험법」 제48조 또는 「의 료급여법」 제11조의3에 따라 환자가 전액 부담한 비용과 비급여로 부담한 비용의 타당성 여부를 건강보험심사평 가원(51644-2000. 홈페이지: www.hira.or.kr)에 확인 요청하실 수 있습니다. 3. 계산서·영수증은 「소득세법」에 따른 의료비 공제신청 또는 「조세특례제한 법」에 따른 현금영수증 공제신청(현금 영수증 승인번호가 적힌 경우만 해당합 니다)에 사용할 수 있습니다. 다만, 지 출증빙용으로 발급된 \"현금영수증(지 출증빙)\"은 공제신청에 사용할 수 없 습니다. (현금영수증 문의 126 인터넷 홈페이지: http://현금영수증.kr) 주(註): 진료항목 중 선택항목은 요양기관의 특성에 따라 추가 또는 생략할 수 있으며, 진찰료 등 일부 항목의 경우에는 야간(공휴일) 진료 시 진료비가 가산될 수 있습니다. ========== 파일: eª?i§ e³?i??.pdf ==========\n내원일: 2025.03.26\n내원사유: 응급실 내원\n진단명: 미확인\n입원기간: undefined ~ undefined\n\n[2025.02.19] 미확인 의료기관\n내원일: 2025.02.19\n내원사유: 응급실 내원\n진단명: 미확인\n입원기간: undefined ~ undefined\n\n[미확인] 미확인 의료기관\n내원일: 미확인\n내원사유: 응급실 내원\n진단명: 하 약물 치료 계획하에 퇴원했습니다. 향후 6개월 이상 지속적으로 약물 치료 유 지하면서 추적관찰 필요합니다. 치료 내용 및 향후 치료에 대한 소견 입원퇴원 연월일 입원일:\n입원기간: undefined ~ undefined\n특이사항: 입원퇴원 연월일 입원일:\n\n[미확인] 미확인 의료기관\n내원일: 미확인\n내원사유: 응급실 내원\n진단명: 미확인\n입원기간: undefined ~ undefined\n특이사항: 퇴원-LAB, EKG,CHEST 약물알러지 있음 없음 또는 알수없음 Summary angina visit: 간헐적으로 답답하고 조여서 내원. 등도 아플때도 있었다. undelrying dz: HTN (10yr) HL (4yrs) DM (1~2yr) self med: 자디앙듀오정\n\n[미확인] 페이지 2/2 단기 입원기록지 환자번호\n내원일: 미확인\n내원사유: 응급실 내원\n진단명: 미확인\n입원기간: undefined ~ undefined\n\n[미확인] 미확인 의료기관\n내원일: 미확인\n내원사유: 응급실 내원\n진단명: 구분 확진 질병코드 진단명 주진단명 1200 Unstable angina 처치명 시행일자 시행과 처치명\n입원기간: undefined ~ undefined\n\n[미확인] 진료 ○가정간호 ㅇ치료종결 외래예약정보 외래예약일\n내원일: 미확인\n내원사유: 응급실 내원\n진단명: 미확인\n입원기간: undefined ~ undefined\n\n[미확인] 전원 호스피스 OYes 퇴원 후 거주장소 자가 사회복지시설 ○기타 출력일시\n내원일: 미확인\n내원사유: 응급실 내원\n진단명: 미확인\n입원기간: undefined ~ undefined\n특이사항: 출력일시\n\n[미확인] 출력일시\n내원일: 미확인\n내원사유: 응급실 내원\n진단명: 미확인\n입원기간: undefined ~ undefined\n\n[미확인] 페이지 4/4 1일 입원실 간호기록지 (Daycare Center) 환자번호 진료과 심장내과\n내원일: 미확인\n내원사유: 응급실 내원\n진단명: 미확인\n입원기간: undefined ~ undefined\n\n[미확인] 미확인 의료기관\n내원일: 미확인\n내원사유: 응급실 내원\n진단명: 미확인\n입원기간: undefined ~ undefined\n특이사항: 입원시 교육 입원시 준비물품 1입원시 생활안내문 설명 ?가스 전열기구 사용금지 및 화재방지 ■환자권리장전 및 환자 책임에 대하여 설명 ㅣ금연교육 함 귀중품 관리 및 도난방지 [쓰레기 분리수거 린넨관리 1주차관리 약물알러지 있음 )없음 또는 알수없음 기타알러지 음식 없음 있음 기타 없음 있음 약품 입원직전 복용하던 약 ㅇ없음 있음타원 HTN, HL 현재 가지고 온약 ) 없음 있음 입원일시\n\n[미확인] MYONGIKOSPITAL 1일 입원실 간호기록지 (Daycare Center) 환자번호 진료과 심장내과\n내원일: 미확인\n내원사유: 응급실 내원\n진단명: 미확인\n입원기간: undefined ~ undefined\n\n[미확인] MYONGJI KOSITA 1일 입원실 간호기록지 (Daycare Center) 환자번호\n내원일: 미확인\n내원사유: 응급실 내원\n진단명: 미확인\n입원기간: undefined ~ undefined\n\n[미확인] &약국 매화가정의학과의원 진단과 내과 입원/외래 외래 주상병코드 Al109 주상병명 (양방)기타 및 상세불명의 원발성 고혈압 내원일수 1 이창기\n내원일: 미확인\n내원사유: 응급실 내원\n진단명: 과 내과 입원/외래 외래 주상병코드 Al109 주상병명 (양방)기타 및 상세불명의 원발성 고혈압 내원일수 1 이창기\n입원기간: undefined ~ undefined\n특이사항: 및 상세불명의 원발성 고혈압 내원일수 1 이창기\n\n[미확인] &약국 진단과 입원/ 외래 주상병 코드 주상병명 내원 총 진료비 건강보험 등 일수(건강보험 적용분) 혜택받은 금액 내가 낸 의료비 (진료비) 1\n내원일: 미확인\n내원사유: 응급실 내원\n진단명: 과 입원/ 외래 주상병 코드 주상병명 내원 총 진료비 건강보험 등 일수(건강보험 적용분) 혜택받은 금액 내가 낸 의료비 (진료비) 1\n입원기간: undefined ~ undefined\n\n[미확인] &약국 진단과 입원/ 주상병 외래 내원 총 진료비 주상병명 코드 건강보험 등 일수 (건강보험 적용분) 혜택받은 금액 내가 낸 의료비 (진료비) (양방)기 타 및 상세 12\n내원일: 미확인\n내원사유: 응급실 내원\n진단명: 과 입원/ 주상병 외래 내원 총 진료비 주상병명 코드 건강보험 등 일수 (건강보험 적용분) 혜택받은 금액 내가 낸 의료비 (진료비) (양방)기 타 및 상세 12\n입원기간: undefined ~ undefined\n\n[미확인] &약국 진단과 입원/ 외래 주상병 코드 내원 총 진료비 주상병명 건강보험 등 일수 (건강보험 적용분) 혜택받은 금액 내가 낸 의료비 (진료비) 23\n내원일: 미확인\n내원사유: 응급실 내원\n진단명: 과 입원/ 외래 주상병 코드 내원 총 진료비 주상병명 건강보험 등 일수 (건강보험 적용분) 혜택받은 금액 내가 낸 의료비 (진료비) 23\n입원기간: undefined ~ undefined\n\n[미확인] &약국 진단과 입원/ 외래 주상병 코드 내원 총 진료비 주상병명 건강보험 등 일수(건강보험 적용분) 혜택받은 금액 내가 낸 의료비 (진료비) (양방)기 타 및 상세 34\n내원일: 미확인\n내원사유: 응급실 내원\n진단명: 과 입원/ 외래 주상병 코드 내원 총 진료비 주상병명 건강보험 등 일수(건강보험 적용분) 혜택받은 금액 내가 낸 의료비 (진료비) (양방)기 타 및 상세 34\n입원기간: undefined ~ undefined\n\n[미확인] &약국 진단과 입원/ 외래 주상병 코드 단 주상병명 내원 총 진료비 건강보험 등 일수 (건강보험 적용분) 혜택받은 금액 내가 낸 의료비 (진료비) 45\n내원일: 미확인\n내원사유: 응급실 내원\n진단명: 과 입원/ 외래 주상병 코드 단 주상병명 내원 총 진료비 건강보험 등 일수 (건강보험 적용분) 혜택받은 금액 내가 낸 의료비 (진료비) 45\n입원기간: undefined ~ undefined\n\n[미확인] &약국 진단과 외래 주상병 코드 내원 총 진료비 주상병명 건강보험 등 일수 (건강보험 적용분) 혜택받은 금액 내가 낸 의료비 (진료비) (한방)상 세불명의 56\n내원일: 미확인\n내원사유: 응급실 내원\n진단명: 과 외래 주상병 코드 내원 총 진료비 주상병명 건강보험 등 일수 (건강보험 적용분) 혜택받은 금액 내가 낸 의료비 (진료비) (한방)상 세불명의 56\n입원기간: undefined ~ undefined\n\n[미확인] &약국 진단과 입원/ 주상병 외래 코드 내원 총 진료비 주상병명 건강보험 등 일수 (건강보험 적용분) 혜택받은 금액 내가 낸 의료비 (진료비) 67\n내원일: 미확인\n내원사유: 응급실 내원\n진단명: 과 입원/ 주상병 외래 코드 내원 총 진료비 주상병명 건강보험 등 일수 (건강보험 적용분) 혜택받은 금액 내가 낸 의료비 (진료비) 67\n입원기간: undefined ~ undefined\n\n[미확인] &약국 진단과 입원/ 주상병 외래 코드 임성식 내과의 주상병명 (양방)기 타 및 상세 내원 총 진료비 건강보험 등 일수 (건강보험 적용분) 혜택받은 금액 내가 낸 의료비 (진료비) 78\n내원일: 미확인\n내원사유: 응급실 내원\n진단명: 과 입원/ 주상병 외래 코드 임성식 내과의 주상병명 (양방)기 타 및 상세 내원 총 진료비 건강보험 등 일수 (건강보험 적용분) 혜택받은 금액 내가 낸 의료비 (진료비) 78\n입원기간: undefined ~ undefined\n\n■ 보험 청구 이력 (Insurance Claims)\nNaN\n[미확인] 미확인 보험사\n청구일: 미확인\n진단명: 미확인\n지급일: 미확인\n상태: 처리 중\n\n[미확인] 미확인 보험사\n청구일: 미확인\n진단명: 미확인\n지급일: 미확인\n상태: 처리 중\n특이사항: 가 아닌 증빙자료로 사용할 수 없으며, 이용에 관한 책임은 이용자에게 있습니다. 1/8\n\n[미확인] 미확인 보험사\n청구일: 미확인\n진단명: 미확인\n지급일: 미확인\n상태: 처리 중\n특이사항: 가 아닌 증빙자료로 사용할 수 없으며, 이용에 관한 책임은 이용자에게 있습니다.\n\n[미확인] 미확인 보험사\n청구일: 미확인\n진단명: 미확인\n지급일: 미확인\n상태: 처리 중\n특이사항: 가 아닌 증빙자료로 사용할 수 없으며, 이용에 관한 책임은 이용자에게 있습니다.\n\n[미확인] 미확인 보험사\n청구일: 미확인\n진단명: 미확인\n지급일: 미확인\n상태: 처리 중\n특이사항: 가 아닌 증빙자료로 사용할 수 없으며, 이용에 관한 책임은 이용자에게 있습니다. 4/8\n\n[미확인] 미확인 보험사\n청구일: 미확인\n진단명: 미확인\n지급일: 미확인\n상태: 처리 중\n특이사항: 가 아닌 증빙자료로 사용할 수 없으며, 이용에 관한 책임은 이용자에게 있습니다. 5/8\n\n[미확인] 미확인 보험사\n청구일: 미확인\n진단명: 미확인\n지급일: 미확인\n상태: 처리 중\n특이사항: 가 아닌 증빙자료로 사용할 수 없으며, 이용에 관한 책임은 이용자에게 있습니다.\n\n[미확인] 미확인 보험사\n청구일: 미확인\n진단명: 미확인\n지급일: 미확인\n상태: 처리 중\n특이사항: 가 아닌 증빙자료로 사용할 수 없으며, 이용에 관한 책임은 이용자에게 있습니다.\n\n[미확인] 미확인 보험사\n청구일: 미확인\n진단명: 미확인\n지급일: 미확인\n상태: 처리 중\n특이사항: 가 아닌 증빙자료로 사용할 수 없으며, 이용에 관한 책임은 이용자에게 있습니다.\n\n■ 종합 소견 (Summary)\nNaN\n총 진료 기록: 138건\n진료 기간: 미확인 ~ 미확인\n주요 진단명: \" 중 택일하여 [ ]에 √ 표시를 하고, 질병명은 한 한글을 함께 적으며, 질병분류기호도 함께 적습니다. 야 서식은 재발행 서식입니다 3. 본 진단서는 당병원 직인이 없으면 무효임. 등록번호 :, 단서 환자의 환자의 성명 석향숙 주민등록번호 641020 2336921 환자의 주소 인천 강화군 송해면 전망대로 127-42 (전화번호:, E785 E119 발병 연월일, 연월일, 합니다. 의료기관 명칭: 명지병원 長病明\n주요 소견:\n  - 총 22회 입원 이력\n  - 총 9건 보험 청구 이력\n\nNaN\n보고서 생성 완료 - 2025. 8. 17. 오후 10:28:27\nNaN",
    "reportMetadata": {
      "generatedAt": "2025-08-17T13:28:27.887Z",
      "format": "text",
      "totalSections": 10,
      "recordCount": 155
    },
    "statistics": {
      "originalLength": 60630,
      "processedLength": 54807,
      "recordsFound": 141,
      "insuranceCount": 4,
      "timelineEvents": 141
    },
    "processingTime": 1755437307887
  }
}